GO:0032991	protein-containing complex	264	0.058265283601853894	1.615116798201592	1.0257898947539462e-17	8.429316961238949e-16	15.07420761540884	1.9387429010849585e-14	XRCC6, NDN, ERCC6L2, DCTN1, MTMR8, OGT, ZNRF2, CEP290, HTT, HIPK2, CLSTN3, XPO6, CRB1, CNST, RPL3, DCAF7, ERCC8, USP7, HNRNPC, MCM3AP, STAT1, COX11, NR3C1, PSMD11, BCL2, ATG5, APP, FER, MIER1, PLEKHA2, KSR1, PRKCA, GOLT1B, WNK1, UBE2N, PRKAR1A, EIF3M, SPTB, YWHAB, SUGT1, CAMKMT, SMAD1, STK3, ZFYVE9, TANK, EP300, ERCC5, NFE2L1, ALS2, GOPC, TRA2B, STT3B, RAN, RBM39, YWHAQ, KMT2E, MTMR9, SOD1, SCP2, MAPK6, SEM1, SMARCC1, RABEP1, RAB3GAP1, RBM4B, MLLT10, ABL1, CTNNB1, NPM1, DTNA, ALK, IKZF5, PAM16, STK4, AKAP6, MT-CYB, CBX5, PTGES3, CAB39, GIGYF2, ITPR1, RPS7, KHDRBS1, EIF3A, NUP58, GATAD2B, MAGI2, MITF, MAGED1, RBMX, SNX2, DNM1L, ZC4H2, HDAC2, PCP4, TTN, ATG14, CNOT9, GPX4, CALM3, HSP90AB1, FOXO3, ACTN4, AR, PAK1, STRADA, SKIL, RAD23A, CD2AP, SNCA, EXOG, TFCP2, NOS1, PLCB1, COPS2, MAP3K5, HIF1A, HSPD1, RYR2, UBQLN1, TUBB, SSX2IP, TJP1, RAB11A, RAB3GAP2, MDM2, GDI1, ATXN1, RBBP6, PEX14, ATP5IF1, NRXN2, XPO1, SNX1, RFC1, COPS4, MAPKAPK5, KIDINS220, NUMA1, DPYSL5, CALM1, ATP6V0D1, JUND, UBE2D2, SNX4, PARD3B, USP10, ARHGEF7, CDC42, SMAD2, PKN2, RPL10, NDUFA5, RNF111, PFDN5, SMAD4, CXADR, PTPN1, HSP90AA1, KIN, NEDD4, PRKN, KAT2B, FRMPD4, SMARCC2, ATP1A1, ATG12, DNAJC19, RPL11, RGS4, CEP97, PFDN1, SPTBN1, RPL5, MEF2C, UBE2D1, NCOA2, GUCY1B1, DGKI, XRCC5, PTPN11, TRPS1, STXBP1, URI1, SSBP3, ARF1, KPNB1, UVRAG, RFC3, HNRNPU, CUL4B, NAE1, AMFR, DHX9, MFF, MBD2, AHR, PPP1CC, CCP110, SIRT1, CLU, ZNF10, ACTB, SMARCE1, ADGRV1, PPIA, HSP90B1, CALM2, UGGT1, GPSM2, RNF220, STAU2, STRN3, SNU13, MYSM1, CCM2, HSPH1, HSPA5, AKAP10, CHD8, STAU1, AKAP7, KDM1A, OSBPL9, ITCH, GRIA1, DGKH, ATP2B4, MGA, FBXW7, RBBP4, PXK, FBXO7, UFL1, BMP6, RBM17, SH3GLB1, PCM1, CHD4, CDK8, PDSS2, RPL23, EIF3E, UBR5, TSC1, SMAD5, GRB10, RAPGEF2, RIC1, PRKDC, CKAP5, PRDX3, PSEN1, SET, SPATS2L, PRKAR2A, LARGE1, CLTC, SIN3A, NCOA1, KRIT1, WASF1, PEX3, UBE2V1
GO:0012505	endomembrane system	101	0.02229088501434562	1.61088795703671	1.7001484850805903e-07	4.525747375777909e-06	5.344309691735169	0.00032132806368023156	CAMK1G, JAK1, OSBPL8, PARD3, STX1B, RNF34, AIG1, STX17, CLINT1, AGPAT3, RAP2A, RAB18, GOLT1B, RAB6A, CDC42EP3, MTMR7, AGPAT5, TMX4, RAB21, STX8, RAB28, DRD1, JAK2, MAL2, PGRMC2, LMAN1, RABL3, ATP8A1, GABARAP, GRIP1, DOCK9, STX19, PGRMC1, RAB14, ATP11A, DMTN, RAB5C, FNDC3A, RAB1A, VMP1, DNM1L, JMY, CPE, ARL6IP1, KRAS, SEC31A, FAF1, CEPT1, NOS1, RAP2B, LMTK2, ATP2C1, STX16, ATP11B, PICALM, CCDC25, PARD3B, RHEB, FRS2, ITSN1, NBEA, SEC22B, AP4S1, CHPT1, AP2B1, TMEM41B, DNAJC1, LCLAT1, ICA1, VPS39, ATP8A2, VTI1B, STX3, PLD3, ATP6AP1, ARF1, VTI1A, LPGAT1, TOR1AIP2, RAB22A, YIPF6, GOSR2, VPS45, RNASEK, RNF145, ICA1L, RUFY3, FNDC3B, RNF128, TMCC1, MTOR, LRPAP1, TRIM23, YIPF4, RAB6B, RAB5A, MAP1LC3B, ATP8B4, USP32, M6PR, STX7
GO:0010008	endosome membrane	112	0.024718605164422865	1.5959385328101985	8.004476916308052e-08	2.3274555956649566e-06	5.633118595949902	0.0001512846137182222	SCYL2, GGA2, VPS35, VPS26A, VPS4A, UBE2D3, TMEM165, ZNRF2, UBA52, NTRK2, RAB7A, VTA1, PMEPA1, MAP3K7, ABHD17B, SNX10, ATP6V1D, SLC66A2, LAMTOR3, ABCC5, UBC, TM9SF2, NUMB, VPS4B, FIG4, HTR4, LAMP2, SNX3, OSBPL6, ITM2B, TAB2, CLCN3, ACAP2, SCARB2, CHMP5, ARHGAP26, SORT1, ATP6V1A, WDR44, PIKFYVE, COMMD10, BACE1, LAMP5, ARHGAP32, MTMR4, DTNBP1, SNX2, SBF2, VPS35L, OCA2, CCDC93, RNF144A, CLCN4, NSG2, SORL1, MVB12B, RAB11A, SLC9B2, COMMD1, SNX1, RAP1A, TFRC, DENND10, RPS27A, KIF13A, CLEC16A, ANKFY1, VPS13A, ATP6AP2, VPS53, ATP6V1H, MTMR2, TSG101, DNAJC13, NSG1, ATP6V0E2, VPS39, ATP6V0C, SLC30A4, ATP8A2, INSR, PLD3, ATP6AP1, TICAM2, RAB22A, TOM1L1, MFSD8, NDFIP1, VPS45, APPL1, RNASEK, UBB, ATG16L1, SLC9A6, NCDN, VPS26B, VPS37A, ATP6V0A1, RBSN, USP8, RAB10, VPS41, CLCN6, ITCH, SNX25, TBC1D5, NDFIP2, SLC11A2, RAB5A, STEAP2, ITGB1, ATP6V0D1
GO:0005856	cytoskeleton	285	0.06290002207018318	1.5934672257779738	3.887605396113784e-18	3.4988448565024055e-16	15.456075314292944	7.347574198655052e-15	DCTN4, EPB41L5, ABI1, KATNAL1, CCSAP, CRMP1, KLHL3, TCHP, DCTN1, UBR4, RFLNA, TPM1, KAZN, ACTR2, SPAST, PARD3, KIF3A, RUSC1, ACTR10, RDX, NEFL, APPBP2, ENAH, FER, TRIP11, EPB41L1, PDE4DIP, APC, SYNJ2, ABL2, SYN1, MAST2, DNAJC24, SEPTIN7, PREPL, MFHAS1, ADD2, MACF1, GABARAPL1, SPECC1L, CDC42EP3, KIF16B, SPTB, KIF5B, PRKCE, KLHL2, LRRC49, ADD1, CFAP221, DYNC1LI2, TTC28, TBCA, TMSB4X, MPRIP, HOOK1, SNTG2, TUBB4A, CLIP1, MAP7D2, CCDC6, ACTR3, CCT3, ACTN2, WASF3, SYNE1, ACTR3B, PTPN13, ACTR6, PALLD, DNAJC7, BAIAP2, GAPDH, ABLIM1, ARFGEF2, CAMK2B, EML5, COBL, EML6, TUBA1B, BSN, TUBA1A, DIAPH1, SLC30A9, KIF3B, SLAIN2, KIF1A, ARL6IP5, ARHGAP21, EPB41L3, SGCD, SEPTIN2, TPPP, SRCIN1, TTLL3, TMSB10, ROCK1, EVL, SSH2, GABARAP, PCLO, MAPRE3, ABL1, SLAIN1, SGCB, MYCBP2, CAPZA1, CTNNB1, ADD3, ARHGAP26, SYBU, CCSER2, SHROOM2, DMTN, TPGS2, MAP6, SORBS1, CLASP2, BCAS3, IFT88, SNAP25, LRRFIP1, MAP1B, JMY, PPP1R12B, FNBP1L, DYNC1H1, DYNLT3, SVIL, CLASP1, PPP2R2B, SIPA1L1, FRMD3, FMN2, CDC42BPA, RAB3IP, GRIN2B, CD2AP, EML1, KLC1, SNCA, TBCEL, OSBPL10, KIF21A, TTC17, SGCE, NOS1, PPP1R9A, HOOK2, MTUS2, PIK3R4, MAPRE2, TUBB, PTPN4, SEPTIN11, STK38L, ERC2, ROCK2, MARCKS, HOOK3, MARK1, ACTN1, WIPF2, TENM1, TMOD2, RAPH1, CFL1, DPYSL2, CCDC146, FRMD4A, NUMA1, KIF13B, TPM3, EML4, FHOD3, ABI2, MED28, AUTS2, KIF5C, PIAS1, DYNLL1, PKN2, ARL13B, ARPC2, ARPC5, KIF1B, MAP4, TTLL11, SDCBP, CYLD, CTNNA1, LRRK2, PDE4D, ACTG1, CCDC181, DYRK1A, CDC42BPB, SPTBN1, ARPC1A, EPB41L2, MAP7D1, DYNLL2, PAFAH1B1, SPTAN1, ARHGEF18, CTNNA3, MAP2, RAC1, HINT1, ITGB1BP1, SYNPO2, SPIRE1, PKP4, TRIM9, PEAK1, CARMIL1, CLU, MAP9, BASP1, ACTB, IVNS1ABP, RIPOR2, DST, TRAF3IP1, TNIK, ARHGDIA, PINK1, CORO2B, MTSS1, FRMD4B, CEP295, CTNNA2, CDC42SE2, BICDL1, SH3KBP1, LRPPRC, SHTN1, DYNC1I2, MID2, INVS, ANK2, WASL, TUBB2A, NDEL1, RNF128, MAP2K6, MAPK1, PCM1, ANK3, WDR47, FILIP1, ATXN7, JAKMIP1, TLK2, KALRN, TUBB3, DCLK2, DAPK1, LRGUK, SNTG1, KIF5A, AMPH, MARK2, TOGARAM1, FGD4, TLN2, KIF27, STMN1, AMBRA1, AKAP9, MAP1A, MAP7, MAP1LC3B, GPHN, MTCL1, PDXP, DCTN2, SEPTIN3, AKAP12, DNM3, SPATA7, CAMSAP2, KRIT1, WASF1, SEPTIN8, PTK2
GO:0005794	Golgi apparatus	386	0.0851909070845288	1.5849972197949007	6.130766809803039e-24	8.2765351932341025e-22	21.08215143391336	1.1587149270527743e-20	ARL17A, FKTN, VAMP4, HTT, TMED10, APP, B3GALT5, FEZ1, CHST9, B3GAT2, SERINC5, TM9SF2, FUT9, HS6ST2, ITM2B, GALNT2, RNF24, OCIAD1, GOPC, ZDHHC23, BCL9, MAN1A2, FAM177A1, ARHGAP21, GALNT13, CERT1, TMEM130, ATP9B, MAP6, AP1AR, ST8SIA2, CLASP2, BACE1, TRAPPC6B, TMED4, CLASP1, CCAR1, HEATR5B, GNAI3, CHST11, CCDC88A, TBC1D23, SORL1, RAB11A, ATP2C1, STX16, LRBA, GOLGA2, GRB2, CXCL14, SPEF2, SEC22B, AP4S1, SCLY, ACSL3, CALN1, VPS54, ARL1, SEC14L1, ATP8A2, MOB4, FAIM2, VTI1A, MAP2K1, VPS45, CSGALNACT1, FAM20C, NEDD4L, CNTNAP2, CSGALNACT2, BIRC6, RAB10, GNAQ, GLCE, RNF128, MAN2A1, CHIC2, LRPAP1, AKAP9, ARCN1, PSEN1, TRAPPC9, USP32, ZDHHC17, MBTPS1, GGA2, NAPG, SLC35B4, TMEM30A, ZDHHC20, VPS13B, COPA, TCP1, OSBP, CLINT1, MYO6, RAP2A, GDI2, FAM20B, HERC1, EXTL3, RAB21, TVP23C, SYNE1, NAPEPLD, SCOC, PPT1, DENND4C, GOLGB1, LRP6, ARFGEF2, SLC30A7, GCC2, TMBIM4, ATP8A1, RAB14, AP3B1, FNDC3A, GALNT11, KLHL20, RPGR, CUL3, DDHD2, ITM2C, BLZF1, CLVS1, TSNAX, SGCE, ST8SIA3, AP3M2, NSG2, CLN5, FAM3C, SERINC3, GDI1, HOOK3, RUBCN, TENM1, COPB1, PICALM, PIK3C2A, SLC35D1, AIMP1, SH3RF1, RNF115, MMD, MCFD2, TBC1D22A, CHPT1, MON2, PAQR3, GALNT14, GALNT17, ATF6, UBA5, STMN2, ARF1, CCDC91, TMEM87A, EBAG9, HEATR5A, NDFIP1, COPG2, APBA1, WDR11, GOLGA8A, APOE, SLC35A3, MAN1A1, FBXW8, NDST4, SYT4, BAIAP3, TBC1D5, ATP1A3, GRINA, PCSK1N, UNC13B, FGD4, ARMH3, SLC30A1, PTPRN, DLG1, CAMSAP2, SCYL2, SYNRG, SLC10A7, STK24, TNKS, RUSC1, KIFAP3, RHBDD2, TRIP11, GALNT1, SYN1, RAB6A, PHTF1, GOLM1, RABGAP1L, PRKCE, CAMKMT, CUX1, DENND5A, TPST1, AP1S2, AFTPH, RAB3GAP1, GABARAP, SYT1, CLCN3, CHSY3, CCDC186, USP6, HS2ST1, SLC39A9, GIGYF2, ZDHHC21, CEP83, ARHGAP32, UBXN2B, GALNTL6, RAF1, CPE, GOLGA8B, RTN3, B4GALT6, NMNAT2, RNF144A, ERGIC2, ASAP1, CLCN4, APLP1, ATP11B, GOSR1, SNX1, PKD2, TRAPPC12, DOP1A, GKAP1, NDST3, JAKMIP3, PLEKHM3, VPS13A, NEDD4, PRKN, ADAM10, VPS53, DYM, SCAMP5, VTI1B, GOLGA1, TICAM2, USP33, ELMOD1, AGBL4, AP3S1, CLU, SORCS1, OLFM3, USO1, OSBPL9, PLEKHA3, SLC30A5, ARF4, PRKD1, GOLGA4, WWOX, NDFIP2, GNPTAB, RAB6B, TRAPPC8, MOSMO, ATL1, M6PR, SLC35A1, RASGRP1, RETREG1, SYT11, TMEM165, ARF3, SCAMP1, STS, CNST, TTC3, NLGN1, GABARAPL2, PDE4DIP, COG3, RAB18, PITPNB, PREPL, MACF1, TRAPPC11, STMN3, TMEM167A, APBB2, GABARAPL1, CEP57, SLC9A7, SACM1L, ARFGEF1, EI24, ZDHHC11B, TMED7, LMAN1, JAKMIP2, DSE, VAPB, CASD1, SPINT2, COG5, DOP1B, SEC23IP, OPRM1, SORT1, GALNT7, WDR44, MAPK8IP3, MAPKAP1, RAB1A, EXT1, DNM1L, COPB2, B4GAT1, CEPT1, RICTOR, PRNP, B4GALT5, ST6GAL2, HOOK2, AP3S2, LMTK2, TENM2, PDCD10, MGAT5, GLG1, RAB2A, PDXDC1, CLEC16A, MTUS1, FUT8, UST, ATP1A1, ATXN2, LRRK2, ACBD3, MPHOSPH9, KIAA0319L, RAB27B, NSG1, TMF1, FAM91A1, AP1M1, EIPR1, TMED5, CLVS2, SELENOI, GOSR2, PLEKHA8, SPPL3, RELCH, ARFIP1, STRN3, VPS41, SLC2A13, AP1G1, OCRL, ATP9A, SLC35E1, LGI1, ANK3, CCNI, DYNC2H1, MTOR, EXT2, CBL, ZDHHC14, SNX9, GBF1, SLC11A2, YIPF4, LARGE1, MAPK1, DYNC2LI1, ATP8B4, TGOLN2
GO:0016604	nuclear body	107	0.023615096005296845	1.5791445367697852	2.3581269152669262e-07	6.105287492951357e-06	5.214293880668711	0.00044568598698544907	NPAT, RAD18, RAD50, GON4L, PPP2R3C, RNF169, CBX6, PNMA8A, POLR3G, TCF20, CENPC, PSMB7, HIPK2, INO80, RNF34, USP7, CCNL1, SH3BP5, EPC1, CHAMP1, SENP2, TERF1, RALBP1, AGL, SLTM, PPME1, SUZ12, CELF3, XRRA1, NUFIP2, CREBBP, SUGT1, L3MBTL1, PARG, CBX3, EHMT1, PPP1R10, TPP2, MESD, PCNP, XPA, MED14, ABL1, VIRMA, ATRX, ZBTB20, INTS7, TOPBP1, STK4, STAT4, TP53BP1, RAPGEF5, ZFHX3, NUP98, UIMC1, CREBRF, HMBOX1, PARP11, RERE, MTDH, USP15, SCAF11, AHCTF1, SMCHD1, HIF1A, PRDM5, MDM2, ELF2, CNOT7, SUGP2, ATF7IP, HDLBP, PLXDC2, KLHDC2, HIPK3, ARIH1, BMI1, NSMCE2, EIF4E, NCOA2, YY1, THRB, PHC1, AFF4, NAA15, PLAGL1, SETX, KDM5A, DHX9, BCL11A, CBX1, HIVEP1, MSANTD2, ICE1, STAG1, RANBP9, HABP4, DRG1, NUDT21, PPWD1, ICE2, FBXL3, TERF2, SUMO3, NELFA, PSMA1, SETBP1
GO:0005768	endosome	123	0.02714632531450011	1.5487692968904274	1.1594558376281576e-07	3.2226051957606146e-06	5.491792897033464	0.0002191371533117218	VPS35, UBR4, VPS4A, JAK1, VPS26A, VAMP4, SPAST, STS, VOPP1, RPS6KC1, NTRK2, APP, CLINT1, SNX10, FYN, MYO6, TM9SF2, STAMBPL1, VPS36, VPS4B, KIF16B, LAMP2, RAB21, TBC1D12, SCOC, OCIAD1, STX8, GAPVD1, EEA1, RAB11FIP4, CALY, ARFGEF2, ECPAS, ANKRD50, CHMP3, JAK2, RAB3C, ASTN1, RABEP1, STARD3NL, CLCN3, DOP1B, RAB5C, OPRM1, USP6, EHBP1, ATP9B, AGAP2, AP1AR, GIGYF2, BLOC1S6, BACE1, ZNRF1, SNX2, PRKCI, KCNK1, WASHC4, TOM1L2, C9orf72, BSG, PACSIN1, VPS35L, PDCD6, CLVS1, ATP6V1E1, RNF13, NSG2, SORL1, MVB12B, PDCD6IP, COMMD1, SNX1, TMEM106B, DOP1A, OSBPL1A, TFRC, GRB2, SNX4, VPS8, ITSN1, ARPC2, ANKFY1, MYO1D, RAB4A, EPN2, LRRK2, TSG101, NSG1, ATP8A2, STMN2, RUFY2, CLTA, PLD3, SNX27, VTI1A, PIK3C3, UVRAG, TICAM2, TOM1L1, CLVS2, RAB11FIP2, RAB40B, APPL1, HMGB1, VPS26B, BIRC6, RBSN, USP8, RAB10, DGKH, OCRL, ATP9A, SNX25, LRPAP1, SLC11A2, RAB5A, CLTC, PTPRN, STEAP2, TGOLN2, M6PR, STX7, WDFY2
GO:0005829	cytosol	1697	0.37453100860737143	1.5259823250796087	1.4379135537838421e-108	2.7176566166514615e-105	104.565805418433	2.7176566166514615e-105	PSMA6, LONRF1, RPL21, PRKAG2, OSBPL8, HTT, TTC8, MADD, RNF34, STK39, APP, NBN, NPEPPS, NUP93, ABL2, KSR1, MTPN, PRKCA, PARN, SRRM1, DNAJC21, CRCP, PIK3R3, UPP2, GNPDA2, ARID4B, RNF187, TM7SF3, RPAP2, DPYD, EVL, OTUB1, CAB39, AP1AR, CMIP, MTHFD1L, CNOT6L, OXSR1, FMNL2, FMN2, HEATR5B, PPP2R2A, GNAI3, CYTH1, RPS23, CAPRIN1, TBC1D23, MTR, RPS11, LRBA, CAPRIN2, DNAJA1, GRB2, RPS3, TRIP12, MIOS, UBE3D, PEA15, ENO1, ARIH1, VPS54, SRGAP2, EIF2AK2, NAA35, KPNB1, BBIP1, AZIN1, SCLT1, PSMB2, PPIA, RPL19, GAS2, STAU2, EXOC4, CAST, PRKG2, CCT8, FBXL5, WDR45B, PXK, ATXN7, NUP133, UBE3A, POLA1, RPL23, GNA13, NPLOC4, ARCN1, SPATS2L, TAX1BP1, AKAP12, CLTC, PLCG2, XRCC6, UBE2K, NCAM1, RNPS1, UBR4, VPS4A, PSMB7, FNIP2, KIF3A, ASAP2, OSBP2, SLC8A3, OSBP, POGZ, STX17, CLINT1, RAP2A, GDI2, SLC66A2, CTNND1, CASK, RPL24, DDX1, USP40, EIF2S3, TDRP, STRAP, CCDC6, CLIP1, RSPH1, PPP2CB, ECD, FNTA, SCFD1, SMG6, FBXO9, RASA1, CEP70, SCP2, TPPP, AK9, ABL1, AASDHPPT, RPL37A, WDFY3, FNDC3A, PPP1CB, MAGED1, ARL6IP1, PPP2R2B, PPFIBP1, IQGAP1, WWP1, OSBPL10, TSNAX, CAMK2A, ETNK1, HIF1A, HECW1, UBQLN1, LARP4, ACTN1, RBX1, SH3RF1, PPP2R2D, OSBPL1A, PDCD4, CDC42, ISCU, HSPA8, PPP3CC, ARL14EP, ARHGEF9, DGKE, SDCBP, TSG101, N4BP1, WIPF3, ATF6, TUT4, ARF1, EXOC6, ATP6V1G1, AGK, AGO1, SPIRE1, APBA1, CHN1, EIF2AK3, AAGAB, AKAP5, GAD2, PAK2, PTK2B, UROS, FRK, TIAM2, ATM, MAT2A, NAP1L2, GRB10, SH3PXD2A, ATG10, PRKAR2A, OAZ2, GPHN, GMDS, ACTR2, NUP42, DENND1B, SH3GL2, DCTN1, ENOX2, UCK2, RPL6, CHM, RAB7A, PSME4, FYN, NAMPT, CCND2, ARMC1, HOMER1, UCHL3, AFDN, FBXW2, VPS4B, SND1, TMSB4X, CUX1, USP2, OSBPL6, PSMD1, RPTOR, TPP2, AP1S2, EPB41L3, SOD1, CSNK2A1, RAB3GAP1, GABARAP, LTN1, PGM3, RPS28, NCBP2, BBS2, RPL13, CEP83, SGK1, UBXN2B, ALDH7A1, TCF25, PGAM1, KRAS, PRKCI, UBE2F, CDC42BPA, UBE2E3, DPP8, RAP2B, PDCD6IP, NUDT3, DOK5, CIP2A, EEF1AKMT2, VAPA, DIS3, SPRED1, PSMA7, KPNA3, KAT2B, VPS53, EIF5B, CYLD, ATG12, KPNA5, PDE4D, NRGN, ITSN2, RPE, FTH1, PRKCB, PSMD12, SYNGAP1, PABPC1, PPP2R5E, BACH2, GSTM3, LSM14A, NPL, PPA1, TRUB1, HSPA5, PLEKHA3, RNF19A, KAT7, PCM1, UFL1, RPS8, HERC3, PTS, ARL6, DNAJC6, HNRNPD, NSUN6, INPP4A, STAM2, CRMP1, RAD23B, SPAST, HNRNPC, STAT1, SPIN3, USP46, MIPOL1, NAA30, COG3, FBXL13, KBTBD7, RAB18, PREPL, TRAPPC11, UBE2N, PRKAR1A, PHACTR1, HIPK1, GABARAPL1, CDC42EP3, SUGT1, FTL, FBXL20, RIMS1, CAMK2B, EI24, SELENOW, CTNNB1, LARP1B, G2E3, NHLRC2, WDR44, MAPKAP1, PRKRA, FBXW4, ST13, RAB1A, PCCA, EIF3A, ANAPC16, SH3BGRL, COPB2, RPL36, KPNA4, METAP2, TTN, BRAF, PUM2, LNX1, KLC1, PRNP, EIF2AK4, UBA6, PHLPP2, SRI, HUWE1, RLIM, NGLY1, ATXN1, SS18L1, ADK, DNAJB6, RERG, TENT4B, MAPKAPK5, AMD1, CARHSP1, NDRG4, RPS27A, PCBP2, BLVRA, SPIN1, STAG2, BAG5, ACTG1, MEF2C, RFK, BTRC, DNAJC5, SDCCAG8, LPP, PIK3C3, AMFR, EPM2A, PLEKHA8, SRP54, PDE8A, FBXW11, ARHGDIA, IPO7, RPLP1, RBSN, VPS41, DENND6A, PDE1C, MAP2K6, UBE2R2, TNRC6A, SH3GLB1, DZIP1, CHD9, NME7, CBL, TSC1, DYNC1LI1, TKT, RIC1, MAPK1, PEBP1, RPS2, TCHP, OGT, USP24, PRMT3, EEF1A1, XPO4, MTRR, WBP2, ERI3, DHX36, GTF2E2, SPTB, LSAMP, PPFIA1, RAPGEF1, MCTS1, PRKCG, PTPRR, APIP, FIP1L1, PRMT2, N4BP2, DNAJC7, CDK19, BABAM2, RPL34, TNKS2, PPIL4, CACNB4, CHMP5, PTGES3, AGAP2, TRAPPC6B, PDE7B, MAP1B, RACK1, PCBP1, PAIP1, EXOSC3, AKAP11, TUBGCP2, PDCD6, KMT2A, IRS2, USP37, PKM, RRAGD, NOS1AP, RAPGEF6, AHCTF1, CCDC88A, TIAL1, TUBB, STX16, VSNL1, CFAP298, ULK1, KPNA1, CNOT7, NUMA1, ARL13B, SMG1, BBS1, HSP90AA1, KIN, EPN2, ATP6V1H, SPTBN1, MKNK1, PIP4K2A, ATP6V1C1, NAA15, VTI1A, UGP2, HPCA, ANKRD28, RAC1, MAP2K1, APPL1, ULK2, GHR, MAPK9, IPO9, ECHDC1, DLG4, SMG7, MCF2L2, NBAS, WAPL, DEPDC5, AGPS, FILIP1, MAPK14, RPL27A, GNAI1, VAMP2, SRP14, TBC1D15, FAU, EXOSC6, SRSF1, AKAP9, MAPK4, AGBL3, DCTN4, JADE1, QKI, ARL2BP, DGKB, NDN, MYO5A, CEP290, RASAL2, HPS4, XPO6, UBA52, COPA, DYNC1I1, MAP3K7, FGF13, MYO6, GSTO2, ADD2, HERC1, MARK3, KIF16B, SAR1A, STK3, PPIP5K2, TANK, RAB21, GAPVD1, DENND4C, SLAIN2, TUBA1A, RAP1B, CAMK2D, CDK14, RAB14, OLA1, NT5C3A, SORBS1, HSPA13, OAZ1, ERRFI1, AP2M1, DDHD2, IPO8, RAB3IP, HECTD2, EML1, RAD23A, LYPLA1, RPS20, FAM47E, HSPA4L, URGCP, PDE10A, LARP4B, NSL1, HCFC2, RBBP6, COPB1, MDH1, CPNE3, DPYSL2, RNF115, CALM1, KLHDC1, EML4, SIRT5, CUL2, USP10, YWHAZ, RPL10, NBEA, NUDT11, SOCS2, EFR3A, OTUD3, MON2, ACOX1, SULT4A1, RAB9B, RPL5, GUCY1B1, BAIAP2L2, PGM2L1, FBXL4, YWHAE, LANCL2, DHX9, NT5C2, RAB40B, UPF3B, DNAJC3, FAM120A, CPEB1, PIK3CA, ATG13, WDR11, EIF4ENIF1, HSP90B1, ZNF540, SHOC2, PRRC2C, GPSM2, DICER1, LMO7, CEP295, HERC4, DYNC1I2, STAU1, WASL, FBXO7, DRG1, PJA2, TBC1D5, TTC1, PREP, PSMA1, SYNCRIP, NAA25, STMN1, EIF4G3, ARMH3, NCOA1, PHKB, POLR3B, KLHL3, BBS5, VPS35, IQSEC1, UBE2D3, TPM1, KAZN, TIPRL, UBR2, STK24, RUSC1, VTA1, PUDP, RPL35A, ENAH, ZMYM2, NGEF, PPM1B, TAOK1, TRPC4AP, AFAP1, LPIN2, NF1, ZFYVE9, PPP1R12A, PRKACB, UCHL5, YWHAG, ALS2, AHI1, GAPDH, NUDCD1, AFTPH, SEC24A, AHCYL1, DENND1A, S100PBP, RPS19, RAD21, RPS21, FARSB, OFD1, STK4, YWHAH, GLRX3, MT3, LARP1, DOCK3, SEC31A, MINDY4, HNRNPDL, FGFR1OP2, KCNA1, ASAP1, LRCH3, RAP1GAP, DNAAF4, KLHL7, LRRC7, PEX14, GOSR1, SNX1, COPS4, TRAPPC12, CPNE1, CNBP, CAPZA2, MYRIP, REPS1, EXOC1, MTM1, ARPC5, SPART, VPS13A, MBNL1, EXOC5, REPS2, SH3GL3, CEP97, PRKCH, CNOT6, PTPN5, C2CD3, SNX27, PRKAA2, EIF4B, INPP4B, TICAM2, USP33, RPL37, ATP6V1G2, RMND5A, MAT2B, RIOK3, CARNMT1, RC3H1, PPIP5K1, NUDT4, NBR1, OSBPL9, KLHL13, GOLGA4, LRGUK, WWOX, APLF, CKAP5, BACH1, UBE2G2, TOP2B, GLS, SEPTIN7, SESN1, SEC24B, DBT, CSNK1E, ABI1, PIP5K1A, TTBK2, RPL32, POLR3G, FCHO2, IP6K1, SYNJ1, SENP2, PGK1, SNX10, PPIG, SEC61G, SLC44A1, RALBP1, UPF2, STMN3, NUFIP2, SRGAP3, CEP57, CCT3, SNX3, ETF1, TAB2, RIMKLB, ARFGEF1, RPS6KA6, GRK4, SEC23IP, KHDRBS1, MITF, SNX2, NUP98, SFPQ, PHLPP1, RB1, SNCA, JPT1, RICTOR, COPS2, PER3, UBE2Z, CRYZL1, RPS16, DIAPH2, PLEKHA5, PPP2R1A, PKN2, RAB2A, ITSN1, RPL35, CLEC16A, AP2B1, PWWP3A, ERBB4, LRRK2, EIF4E3, ALMS1, RGS2, DGKI, TMF1, MSRA, ARHGEF12, GSK3B, WDR48, URI1, LONP2, PLK2, USP47, HDGFL3, ITGB1BP1, NEMF, BEX3, HSPA4, SH3KBP1, AP1G1, GRIA1, FBXO38, SNX9, GBF1, SMAD5, NCBP1, SRPK1, DYNC2LI1, EIF3F, EIF4A1, EIF2AK1, PTK2, RNF216, PDE4B, IPO5, ARMCX3, RB1CC1, PSMG2, CALCOCO1, GLUL, ARHGAP44, NR3C2, OSGEP, ATG5, RPL26, APC, DDX6, RNF213, DYNC1LI2, SOCS5, ACTR3, COP1, EEA1, CABIN1, TIAM1, TTLL3, CRLF3, RPL8, STARD3NL, PPP6R2, PPP4R4, GPCPD1, EIF4G2, PIKFYVE, LTV1, FXR1, DYNC1H1, RABGAP1, FOXO3, HSP90AB1, RPS6, TXLNG, STRN, STRADA, EIF1AX, USP15, PLCB1, ATG7, SORL1, STK38L, DDX3X, MAP3K1, PAN3, RAP1A, PEG10, FPGT, ALKBH8, SSB, MKLN1, FRS2, ATXN10, PTPN1, ILRUN, SCLY, GBE1, SERP1, CCT6A, ARHGAP18, ARL1, ANP32B, SEC14L1, UBE2D1, FTO, FKBP1A, CRY2, HNRNPU, MAP2, AGO3, TACC1, AHR, WASHC1, NUP88, TTC7B, CARMIL1, PSMD14, CDKN2D, BIRC6, RANBP2, RAB10, STAG1, AKAP7, MGLL, CYFIP2, MZT1, SH3D19, CRPPA, AAK1, ARHGEF11, CEP192, DCP1B, ZRANB1, PTPN2, SRP72, NR3C1, SYNGR1, BCL2, RPSA, NRP1, EPB41L1, GMPS, SRSF10, SEC23A, WNK1, VPS36, KIF5B, TBC1D2B, SCOC, GCC2, SGIP1, WBP11, MESD, FAM13A, ZNF146, RMDN2, PPP2R5B, ANAPC5, DOCK9, MOB1B, VRK1, RPL17, DMTN, CIT, ATP6V1A, TP53BP2, BLOC1S6, EIF2S1, DTNBP1, KLHL20, FNBP1L, NCKAP1, TASP1, UBE2G1, CUL3, MCCC1, PACSIN1, FBXO22, PAK1, PSMC6, CDC16, ZC3H7A, SMURF2, SMS, RAP1GDS1, PFKP, FAM13B, MYH10, BBS9, COMMD1, AP5M1, WIPF2, CHKA, AIMP1, DDHD1, ABI2, LNPEP, ANAPC4, RHEB, KCNAB1, ARPC2, GPRASP1, RRP1B, ELP1, DDX3Y, RPL28, UBE2E1, SEMA5B, EIF4E, EVI5, COPS8, STMN2, CLTA, MRE11, SPTAN1, TMEM87A, HEATR5A, PPFIA2, COPG2, NLK, ACTB, NEK1, AKR1B1, YTHDF3, G3BP2, SMURF1, MAPK10, FBXW8, HABP4, RALGAPA2, PIK3R2, FBXL3, DPH6, AMPH, TLN2, MAP7, STEAP2, WASF1, SIRT1, UBE2V1, PAPSS1, AKAP13, IREB2, DNAJA2, CENPC, CFLAR, CEP41, USP45, DOCK4, RRAGB, VAV3, NEFL, GFPT1, BRD7, AMOTL1, POLR1D, MTMR12, SKAP2, MAPK8, AGL, CADPS, RAB6A, TRIM24, IPO11, MTMR7, EIF3M, YWHAB, PRKCE, CAMKMT, TXNRD1, SMAD1, PALLD, USP12, PPP2R2C, COX4I1, USP11, CHMP3, DIAPH1, KIF3B, SRP19, KCMF1, MAPK6, TRIM37, SBDS, KCTD7, CNOT10, AHCYL2, CEP63, NPM1, ARHGAP26, PPP4R3A, FBXO21, STAT4, TRAPPC13, GIGYF2, PDE7A, NKTR, RAF1, PCP4, FAF1, C9orf72, SENP6, ECI2, CNOT4, TTLL5, PEX1, MTMR6, RPL18, TNPO3, SHANK2, PTPN4, RAB3GAP2, MDM2, RNF217, CSNK1A1, TSC22D1, XPO1, USP9Y, PAFAH1B2, DOP1A, PPP2CA, SKP1, TPM3, RPS29, PNPT1, WNK2, HIPK3, ANKFY1, NEDD4, PRKN, ANAPC1, NEDD8, MTMR2, XRCC5, EPB41L2, STXBP1, AGTPBP1, CRYM, PAK6, PSMF1, FLCN, ARHGAP5, PIK3CG, ANAPC10, NBEAL1, CLU, AGBL4, USP48, UBB, ZFYVE16, CUL5, USP9X, DST, ATG16L1, NSMAF, CKB, USP8, AKAP10, AK5, RPS14, PRKD1, EGLN1, RAB6B, PRKDC, TRAPPC8, TPT1, MAP1A, RBMS3, DOCK10, PUM1, THRA, SRM, NPHP3, ARHGAP35, FBXO10, RNF169, ME1, XPNPEP1, MAP2K4, RPL3, USP7, ALDH3A2, PACRG, ARMC8, GABARAPL2, ATP6V1D, RGL1, POLR3A, RGS5, STAMBPL1, STRADB, PDS5A, LYPLAL1, RPL14, LATS1, KLHL2, AMPD2, PCYT1A, EP300, UPF3A, RNF146, RBM8A, CNTRL, SNRPD1, ZC3H15, SAR1B, ASCC3, YWHAQ, RCHY1, DGUOK, CDO1, PIK3R1, RPL4, ITGB3BP, CMPK1, COG5, ASNS, CAPZA1, ADD3, DOP1B, PSMA3, SORT1, TBK1, KBTBD6, RPL7, MTMR4, EIF4A2, DDX5, DNAJC9, SBF2, ATP6V1E1, HOOK2, MAP4K5, WWC2, CAND1, TJP1, UBE2H, MVB12B, RAPH1, RPL30, ARHGEF26, RGS7, SERGEF, SPAG9, RNF111, CRTC3, USP14, CLOCK, CTNNA1, FBXO11, ANKS1A, DYNLL2, PDE8B, MTAP, RPL9, TOM1L1, HELZ, CSDE1, IVNS1ABP, TRAPPC2, RIPOR2, RPL23A, ASB3, CTNNA2, RUFY3, YARS2, XIAP, OCRL, ATP9A, HEATR3, MTOR, NPHP1, NSF, ABCD3, PHLDA1, RPIA, RAPGEF2, OTUD7A, SET, GOT1, CRBN, SHC3, DDN, VPS26A, PPP3R1, PDLIM5, DCAF8, PPP6R3, DCAF7, NAF1, PSMD11, DENND5B, GNAS, SERINC5, QDPR, RPS15, SGK3, UBC, PPM1A, ACTN2, TNRC6B, MTMR9, ATP6V1B2, ARHGEF4, ARHGAP21, GDAP1, ROCK1, EIF3J, BCAT1, DLG3, CERT1, ANKIB1, CLASP2, IFT88, SNAP25, EPS15, OTUD4, CLASP1, GPX4, STXBP5, RPS25, FMR1, TRIO, PANK2, ARHGEF5, HACL1, HLCS, NOS1, ENO2, TPK1, RAB11A, CCDC39, HDAC4, ACACA, KIDINS220, KIF2A, RPL13A, STAM, EIF3H, UBE2D2, TFG, PPID, SPG11, EEF1G, PELI1, CDC42BPB, DLG2, NCOR1, RPLP2, FHIT, HSD17B4, UBQLN2, RPL15, NEDD4L, EXOC2, VPS13C, TNIK, RPS6KA2, NCDN, RPS24, PTPN12, UCHL1, FKBP3, RNF128, PPP2R5C, WNK3, AGFG1, KIF5A, HMGCLL1, GCLM, PRDX3, TRAPPC9, PPP1R12B, PHAX, EPB41L5, PPP2R3C, SRP9, ZNRF2, CDK5R1, INO80, PARD3, CENPP, STX1B, ACTR10, MCM3AP, TCP1, NTRK2, PPP3CB, DCP2, FER, SERBP1, RPS6KA3, CDC27, GUCY1A1, PAK3, ZNF106, ADD1, TUBB4A, PAK5, TDRD3, PPT1, GOLGB1, ATAD1, ARFGEF2, PTEN, DIXDC1, FANCL, FNTB, RASGRF1, C2CD5, PPP1R13B, SEM1, MIB1, GRIP1, RASA2, MCCC2, TXNDC11, IKZF5, ACBD6, GPI, LRRFIP1, RBKS, ATIC, ELMO1, PANK3, DOCK1, AR, CEP78, UBR1, NFKB1, BRCC3, NAA50, AGO4, EEF2, CLN5, PIK3R4, RO60, HK1, GDI1, PICALM, CFL1, PIK3C2A, NUP214, NEK4, SMAD2, DYNLL1, DAB1, TTLL11, PDS5B, UBE2Q2, POLR3F, ICA1, EFCAB13, FEM1B, UBA5, PTPN11, CCDC91, KLHL42, RPL7A, LECT2, BCL11A, LIMS1, RIC8B, PIK3CB, EEF1E1, PINK1, RPS6KB1, MYL12B, RABGEF1, ITCH, ANK2, BBS7, KALRN, BAIAP3, PDSS2, EIF3E, DOCK11, UNC13B, FGD4, NLN, RAB5A, DLG1, NECAP1, ILF3, IQCB1, NFAT5, DGKD, EIF4E2, CNOT1, INPP1, ANKRD11, TNKS, SPATA13, BTBD3, RPL38, KIFAP3, CC2D2A, FOCAD, SYNJ2, SMC1A, GOLT1B, GPS2, ZCCHC7, HERC2, PARG, DENND5A, PLEKHA1, RPGRIP1L, MRTFA, PDE3A, RAN, CBLB, ARL8B, RABEP1, SYNC, DENND4A, RPS4X, DDX17, WDR26, RPL31, PDE5A, MAP3K2, PIGN, SEC31B, ARHGAP32, ZNRF1, ATG14, PSMB1, HBS1L, HMBOX1, NMNAT2, PPP3CA, DAAM1, CNOT2, MTMR1, ARHGEF3, HSPD1, MAP3K5, FHL1, ADAR, RPS18, ROCK2, EIF4H, PI4KA, MOCS2, PRKAR2B, EIF5, GRK3, CUL1, BEX4, PFDN5, SMAD4, ELP3, VCPIP1, OBSCN, CCDC50, SRPK2, TASOR2, CSNK1G1, TRAK2, ARPC1A, SOS2, CRYL1, VTI1B, GOLGA1, PAFAH1B1, ARHGEF18, RPS4Y1, HINT1, CCP110, PSIP1, HIVEP1, LDHB, MTHFD1, SLK, TUBGCP3, PCMT1, USO1, RANBP9, NDEL1, ARF4, ACIN1, CRADD, AMBRA1, CEP162, MAP1LC3B, PDXP, DNAJC2, KATNAL1, MOAP1, RASGRP1, MTMR8, EXOSC10, JAK1, TNPO1, GNB5, PTRH2, MIF, KSR2, CAB39L, ABCE1, EIF2S2, PIP4K2B, MECP2, CSE1L, ARHGAP20, CREBBP, SOS1, GALK2, TXNL1, TUBGCP5, IDE, BAIAP2, AGO2, TTLL7, SHB, BAG4, PSMD2, JAK2, STRIP2, GPBP1, PDE1B, PTMA, SIAH1, TNRC6C, USP13, GSTA4, EHBP1, RPS7, XRN1, DNM1L, NUP205, GIPC2, PDCD11, CNOT9, G3BP1, YBX1, DDX25, NRDC, FNIP1, MTMR3, SMC3, GUCY1A2, PDCD10, EFNB2, GSPT1, RCOR3, DPYSL5, PMM2, ARHGEF7, MYO9A, MSI2, USP34, RAPGEF4, RPS17, TUT7, RPS27, FMN1, RPL11, DCUN1D1, SMAP2, FARP2, STARD13, AP1M1, USP25, NAE1, ENDOD1, PPP1CC, SNCAIP, WSB1, OGA, VPS26B, ARFIP1, PPP1R1B, HSPH1, TUBGCP4, PDPK1, NAA16, DLC1, FBXW7, ANK3, TMCC1, GNB1, PAXBP1, MTHFS, DCTN2, CACYBP, ELP2
