GO_ID	Name	Gene Count	Gene Ratio	Fold Enrichment	p-value	FDR	-log10 FDR	FWER	Associated Genes
GO:0051963	regulation of synapse assembly	17	0.006369426751592357	3.8583739228175347	2.0303309059144253e-07	7.335040450997645e-05	4.134597486783667	0.0024538579328881745	OPCML, CRTAC1, CTNNB1, NEGR1, CHD4, SEMA4D, SRGAP2, RAP2A, SRGAP2C, SETD5, OGT, SRGAP3, CLSTN3, SRGAP2B, NLGN4X, LSAMP, MEF2C
GO:0007612	learning	27	0.010116148370176097	3.205418335879183	9.435766268168036e-09	6.3355928398377155e-06	5.198212740682067	0.00011404067111707889	GABRB3, PAK5, SYT11, CNTNAP2, NLGN4Y, PLCB1, BCHE, NRXN1, NLGN4X, ELAVL4, ATAD1, GRM5, SLC24A2, SYNJ1, PRKN, APP, PPP3CB, FYN, SHANK2, FGF13, NRXN3, NTRK2, SLC12A5, ATP8A1, GRIN2A, ATXN1, SLC8A3
GO:0042752	regulation of circadian rhythm	28	0.01049082053203447	3.177484407026205	6.372177566030623e-09	4.530243415473301e-06	5.343878462190978	7.701413806304611e-05	PSPC1, CSNK1E, USP9X, CLOCK, MAPK10, FBXW7, TARDBP, MAGED1, GSK3B, KDM2A, MAPK8, HNRNPD, PRKAA2, UBE3A, PPARGC1A, PRKDC, ADCY1, BTRC, RORA, ROCK2, OPN3, SFPQ, ATG7, USP7, PROX1, MAPK9, SKP1, NR1D2
GO:0050808	synapse organization	29	0.010865492693892843	3.024130912478608	1.3208160547920316e-08	8.401780441166577e-06	5.075628671814417	0.00015963382838216495	SLC6A1, SYN1, SNCB, NLGN4X, GPHN, TSC1, SYN3, GRM5, NPTN, APP, CTNNB1, SYN2, LARGE1, NRCAM, CNTN4, GET1, CAPS2, SHANK2, PPFIA2, CNTN6, PAK3, TNR, CAPRIN1, CD2AP, MAPT, APBB2, CTNND2, SLC8A3, NBEA
GO:0048812	neuron projection morphogenesis	27	0.010116148370176097	2.8541396141389983	1.7016458690257988e-07	6.63422321711155e-05	4.178209920165206	0.0020566091973045803	PPP1R12B, GABRB3, NYAP2, KIRREL3, PACSIN1, CNTNAP2, NRXN1, EPB41L3, MAP4K4, PLXNA4, SLIT1, NEGR1, TRIO, NCKAP1, VPS54, TAOK3, PPP1R12A, DICER1, GAS7, NLGN1, SRGAP2, CNTNAP1, TNIK, GPM6A, ATP9A, SGK1, KDM1A
GO:0050804	modulation of chemical synaptic transmission	44	0.016485575121768452	2.853251304268429	2.5469926453779193e-11	3.4203281235597257e-08	7.46593222861761	3.078295311203753e-07	PRKAR1B, NXPH1, GRIK1, PTPRD, CPLX2, GRIA4, SYN1, NLGN4X, ARHGAP44, BSN, EPHA7, DLGAP1, BTBD9, SYN3, GRM5, DLGAP2, GRID1, PXK, AKAP7, NRG3, PLPPR4, NPTN, PRKN, STAU1, PPP3CA, UBE3A, ADCY1, GRIA1, FYN, PAFAH1B1, MAPK9, JAK2, GRIK2, DGKE, CDKL5, NLGN1, CACNA1B, TNR, PCDH8, GRIN2A, LRRC4C, RTN4, LRP8, GRIA2
GO:0007416	synapse assembly	28	0.01049082053203447	2.770114611253615	2.098928379014185e-07	7.335040450997645e-05	4.134597486783667	0.002536764838876544	MAP1B, KIRREL3, DNM3, NLGN4Y, NRXN1, NLGN4X, GPHN, ERBB4, CLSTN3, PLXNA4, DNER, SLC25A46, NRG3, NRCAM, RYK, GRIA1, SHANK2, PTEN, ADD2, CDH2, FARP1, DSCAM, NLGN1, CAPRIN1, PLXNA2, GPM6A, MAPT, ADGRL3
GO:0070936	protein K48-linked ubiquitination	34	0.012738853503184714	2.704839451047344	2.1706942570560753e-08	1.3117505395389863e-05	4.882148748498973	0.0002623501079077973	CDC27, UBE2H, HACE1, MYCBP2, TTC3, SKP1, ASB3, ANAPC10, RFFL, CDC16, UBE2D3, ITCH, KLHL3, CUL3, RNF216, HUWE1, ZNRF2, UBR5, KBTBD6, PRKN, FBXO38, UBE3A, UBE2K, UBE2E3, BTRC, UBE2D2, UBR4, ANAPC5, ANAPC1, UBE3C, ANAPC4, NEDD4L, UBE2E2, UBE2E1
GO:0017148	negative regulation of translation	32	0.011989509179467965	2.5722492818783564	2.1241636255578155e-07	7.335040450997645e-05	4.134597486783667	0.0025672641578491757	CIRBP, DAPK1, QKI, ILF3, DDX6, RBM4, PURA, CPEB3, CELF4, CPEB1, XRN1, NCL, FXR1, SYNCRIP, SERBP1, EIF2AK2, LSM14A, GAPDH, SAMD4A, LARP1, EPHA4, PUS7, CSNK2A1, PURB, PAIP2, CAPRIN1, CNOT9, IREB2, PRKCA, HELZ, ZNF540, GIGYF2
GO:0048511	rhythmic process	48	0.01798426376920195	2.5370129903457763	3.7211888127281655e-10	2.998285866042174e-07	6.523126962506398	4.497428799063261e-06	PSPC1, NRIP1, PER3, NCOA2, MYCBP2, OGT, NCOR1, CREBBP, CSNK1E, HNRNPU, USP9X, CLOCK, LGR4, MAPK10, FBXW7, TARDBP, HUWE1, MAGED1, GSK3B, KDM2A, MAPK8, HNRNPD, SIRT1, KMT2A, PRKAA2, GPR176, AHR, UBE3A, PPARGC1A, ENOX1, HLF, PRKDC, ADCY1, BTRC, EP300, RORA, CREB1, ROCK2, CSNK2A1, SFPQ, NLGN1, ATG7, USP7, DNM1L, PROX1, MAPK9, FBXW11, NR1D2
GO:0031175	neuron projection development	52	0.019482952416635443	2.5237162765598966	8.696636776603547e-11	9.555232007457317e-08	7.019758763518942	1.0510755208203047e-06	MAP1B, WASF1, CYFIP2, CDC27, CNTN1, CHL1, CNTNAP2, BICDL1, NRXN1, PPP1R9A, FRYL, MAP2, PTPRG, PTPRM, VPS13B, GSK3B, GPRIN3, EXT1, HERC1, DOCK7, ROCK1, APP, RAB6A, TBC1D24, CAMSAP1, LONRF2, HDGFL3, CNTN4, CAMSAP2, RYK, TMEM108, BLOC1S6, RAPGEF2, HMGB1, UBE4B, LGI1, MYH10, VAPA, NLGN1, CD2AP, RAPGEF6, TBC1D23, CNTNAP1, ARFGEF1, MAP4, SH3GL2, GPM6A, MAPT, ATXN10, ERCC6, FRY, NEDD4L
GO:0000209	protein polyubiquitination	50	0.018733608092918696	2.5218130214493693	2.0509822231487296e-10	1.906782396075042e-07	6.719698866249275	2.4788171148975546e-06	NFE2L1, SHPRH, UBE2V1, UBE2H, FBXL17, UBE2W, RMND5A, LNPEP, HLTF, TNKS, DZIP3, UBE2D3, ITCH, TRIM2, TAF1, KLHL3, CUL3, HUWE1, UBR5, WSB2, SPOP, UBE2V2, PRKN, CTNNB1, NPEPPS, KLHL42, RC3H1, UBE3A, UBE2K, TRIP12, BTRC, HECTD2, UBE2D2, TNKS2, TPP2, UBE4B, UBE2N, SMURF1, BIRC2, UBE3D, UBE3C, BCL2, CBL, PIK3R1, PELI2, RNF111, RNF180, FBXW11, SKP1, UBE2E1
GO:0006897	endocytosis	72	0.026976395653802922	2.4584329419722346	1.176048555801305e-13	2.0305318350592245e-10	9.692390197170168	1.4213722845414572e-09	EPS15, RAB7A, FCHO2, KCNQ3, ZFYVE9, USP33, PACSIN1, AAK1, FCHSD2, HEATR5B, SNX10, EHBP1, CSNK1E, AMPH, MYO5A, CSNK1G3, SH3GL3, CLCN5, FNBP1, DNM3, RABGEF1, LMBRD1, GAPVD1, RABEP1, C9orf72, RAB5B, CSNK1G1, RUBCN, OCIAD1, SH3KBP1, EPN2, PIK3CB, DNER, SORT1, MYO6, ATP9A, SYNJ1, APP, SGIP1, LRP1B, RAB5A, DENND1B, EEA1, PICALM, AP2B1, REPS2, LRP8, ANK2, RABGAP1L, ITSN1, CDC42, DENND1A, ATP9B, SCAMP1, FNBP1L, GHR, PIK3C3, MIB1, MAGI2, DPYSL2, ABL1, SH3GL2, LRP6, DNM1L, HEATR5A, DNM1, ESYT2, SH3GLB1, REPS1, ITSN2, RNASEK, AP2A2
GO:0001764	neuron migration	41	0.015361558636193332	2.396868649023014	5.367777325385831e-08	2.7031231981088818e-05	4.568134160353961	0.0006487495675461315	MAP1B, NEO1, AUTS2, KIRREL3, CHL1, USP9X, NDN, MEF2C, SDCCAG8, FZD3, ASTN1, NAV1, KIAA0319, BBS4, DCX, KIAA0319L, DNER, ABI2, CEP85L, CTNNB1, BBS1, PCM1, LARGE1, NRCAM, FYN, PAFAH1B1, FGF13, ASTN2, RAPGEF2, HSP90AA1, MARK1, NTRK2, MYH10, CDKL5, SEPTIN4, SPOCK1, GPM6A, APBB2, ADGRL3, NTRK3, TOP2B
GO:0006887	exocytosis	40	0.014986886474334956	2.374383952503098	9.766060220104396e-08	4.59520281008271e-05	4.337695316191675	0.0011803260382018173	KCNQ3, CPLX2, STXBP5, RIMS1, STXBP5L, VAMP2, ARHGAP44, EXOC5, RAB10, EXOC6, RAB3C, STXBP3, STXBP1, ARFGEF2, MICAL3, SYTL5, LIN7A, RAPGEF4, SNAP25, DNAJC5, KCNB1, RAB27B, ITSN1, EXOC4, SYTL2, SRCIN1, EXOC2, MYH10, PRSS12, MIA3, CADPS, NSF, SCAMP1, RIMS2, ARFGEF1, RAB8B, EXOC6B, EXOC1, RAB3B, SCAMP5
GO:0007411	axon guidance	58	0.021730985387785687	2.3311009117022605	3.2434627200961953e-10	2.80003503107733e-07	6.552836535190492	3.920049043508262e-06	CRPPA, NEO1, NFASC, KIF5C, CYFIP2, EFNA5, MYCBP2, CNTN1, ROBO1, CHL1, UNC5D, FLRT2, EPHA6, NRXN1, EFNB2, KALRN, TUBB3, EPHA7, SEMA5B, SEMA4D, SMAD4, PTK2, PLXNA4, PTPRJ, SEMA5A, PGRMC1, ENAH, NPTN, SLIT1, KIF5A, NRCAM, CNTN4, TRIO, RYK, FYN, ROBO2, EPHA4, ETV1, ARHGAP35, ABLIM1, PTPRO, LGI1, NRXN3, CNTN6, MYH10, DSCAM, TNR, DSCAML1, NTN4, EVL, USP33, PALLD, APBB2, ULK2, SOS1, UNC5C, EXT1, FEZ1
GO:0000226	microtubule cytoskeleton organization	43	0.01611090295991008	2.257279982056517	1.6951161852397787e-07	6.63422321711155e-05	4.178209920165206	0.0020487174214807967	MAP1B, FER, MID1, KIF2A, RNF19A, TTBK2, SIK3, TUBB3, MAP2, CLASP2, ULK4, DYNC1LI1, DST, TAOK1, GABARAP, CDK5RAP2, CDC14B, EML4, BBS4, ATXN7, CLASP1, DOCK7, GAPDH, CAMSAP1, BBS1, RANBP10, CAMSAP2, TTLL7, PAFAH1B1, TTLL11, TBCD, NAV3, SON, TOGARAM1, MARK1, DCLK2, MARK3, TBCEL, MAP7, MAP4, MAPT, SPATA7, PARD3
GO:0007417	central nervous system development	45	0.016860247283626825	2.240346148732762	1.0265755581782493e-07	4.595256368941601e-05	4.33769025435169	0.0012407192196142321	GRIK1, APLP2, SH3GL3, CNTNAP2, SPTBN1, NDN, ZEB2, RNF103, HAPLN1, JARID2, SOX6, ZBTB16, BTD, DCX, ARNT2, VPS13B, MBP, DNER, IL1RAPL2, SHC3, APP, PRKN, RPS6KA6, GABRA4, ADAM22, NRCAM, HTT, MSI2, ADAM23, ROBO2, NCKAP1, MARCKSL1, PTEN, CNTN6, DCLK2, DSCAM, DSCAML1, DCLK1, CNTNAP1, ALDH5A1, CHD7, WWP1, PROX1, SH3GL2, HPCAL4
GO:0006511	ubiquitin-dependent protein catabolic process	74	0.02772573997751967	2.230622424128887	1.2737890182981114e-11	1.9243767593938717e-08	7.715709896691498	1.5395014075150974e-07	ARIH1, CNOT4, FBXL2, RNF19A, KLHL8, UBE2H, HACE1, TTC3, RNF144A, RNF150, HECW2, RFFL, COP1, RNF144B, UBQLN1, RNF11, FBXW4, UBE2D3, ATE1, PSMA6, ITCH, RNF217, PSMA1, TAF1, KLHL3, CUL3, HUWE1, UBR1, FBXO10, PSMD14, NDFIP1, TRPC4AP, UBA6, PRKN, ANKIB1, PSMD11, UBR2, UBE3A, UBE2K, RBBP6, RC3H1, RLIM, FBXO11, TRIP12, UCHL1, HERC6, RNF13, BTRC, UBE2D2, FBXO8, FAF1, UBR4, UBR3, HECW1, UBE4B, RNF130, UBE2N, SMURF1, HECTD1, MIB1, UBE3C, CBL, UBE2Z, WWP1, HERC3, SMURF2, USP33, RNF111, HERC4, ARRB1, FBXW11, NEDD4L, SKP1, UBE2E1
GO:0007010	cytoskeleton organization	50	0.018733608092918696	2.1084010507199644	1.8426682188528385e-07	6.959527529079815e-05	4.157420242929438	0.0022270488093055407	PCLO, PDZD8, ZMYM4, PAK5, PACSIN1, RICTOR, CAPZB, ZRANB1, SH3D19, DST, NAA25, RANBP9, MAPKAP1, CTNNA2, ANK3, FMNL2, SH3KBP1, CAP2, DMD, MAST2, SEPTIN2, ADD1, MAP3K20, ABI2, SEPTIN6, MICAL3, SORBS1, ABLIM3, CAMSAP1, PRPF40A, BRWD3, DIAPH1, RANBP10, LARGE1, CCDC6, SEPTIN7, ABLIM1, CDC42BPA, MARK1, SEPTIN3, MAST4, BRWD1, ZMYM6, MICAL2, CNTNAP1, DPYSL2, TNIK, PALLD, SORBS2, PHIP
GO:0006468	protein phosphorylation	66	0.024728362682652678	2.095906822271253	3.310873615021351e-09	2.500951156946753e-06	5.601894789867114	4.001521851114805e-05	RAF1, HIPK3, FER, DAPK1, ILF3, PKN2, SNRK, CDK17, DYRK1A, AAK1, CAMK4, PRKACB, NLK, CSNK1E, STK39, MAML1, MAP3K9, KALRN, TBCK, SIK3, MAPK10, MAP4K3, NEK10, HIPK2, BIRC6, MAP4K4, JAK1, MAP3K13, MAST2, GSK3B, STRADA, MAPK8, MAP3K20, EIF2AK2, TNNI3K, PXK, PPP3CB, YWHAZ, PRKDC, PAK2, CSNK1A1, PPP4R1, MAPK1, MERTK, RYK, SIK2, CREB1, TAOK3, ROCK2, CDC42BPA, WNK1, MARK1, BRAF, MARK3, NUAK1, CAMK2D, DCLK1, TLK2, TNIK, PRKCA, SRPK2, TLK1, NEK1, MAPK9, COPS2, SGK1
GO:0007399	nervous system development	169	0.06331959535406519	2.0377037279880104	1.618166110992617e-20	6.519051872485591e-17	16.1858155632389	1.955715561745677e-16	RAPGEF5, EFNA5, CPLX2, DYRK1A, SRGAP2C, FGF2, CHL1, SRGAP3, NRXN1, KALRN, CNTNAP4, SEMA5B, SEMA4D, NAV2, DCX, BRINP2, ERBB4, MTR, DNER, CHN1, LSAMP, MDGA2, SLIT1, GLRB, PCDH10, CIT, BMPR1A, LGI1, NRG2, DSCAM, DSCAML1, SRGAP2, TENM1, ADGRG6, EVL, TNIK, DIP2A, ATXN10, DCTN1, SRGAP2B, MAP1B, GABRB3, TMOD2, RBFOX3, APBA1, MBD5, EP400, FGF12, SMARCC1, EFNB2, PURA, SDC2, TMEM14B, FZD3, BTBD3, KIAA0319, ARHGEF7, INA, TRPC5, NOVA2, HDAC4, ABI2, IL1RAPL2, PCSK2, DOCK7, CTNNB1, PRKD1, CNTN4, EP300, PTEN, MEF2A, EPHA4, NAV3, ITM2B, RAPGEF2, NEXMIF, PLXNA2, TBC1D23, RBFOX2, LRP6, MYT1L, CNTNAP1, DLG3, DPYSL2, GPM6A, ULK2, NTRK3, RUFY3, SMARCE1, GRIK1, PTPRD, KIF2A, FBXL17, MBNL1, ROBO1, CNTNAP2, ADNP2, FGF14, EPHA7, IGF1, PHACTR4, NAV1, TSC1, SMARCA2, ARID1A, GSK3B, NAP1L1, SPAST, VPS13B, NRG3, GPM6B, DPF3, NUMB, ROBO2, ZMYND8, TRAPPC6B, DLG1, TCF12, CDC42, NLGN1, TNR, DCLK1, ALK, MAGI2, SCN3B, USP33, ERCC6, RTN4, RAP1A, FEZ1, VPS13A, CNTNAP5, DIP2B, ACVR1B, TCF4, CRMP1, CABLES1, BICDL1, APBA2, PPP1R9A, ZEB2, MEF2C, ST8SIA4, RBM45, PLXNA4, SEMA5A, NPTN, LHX6, MERTK, TTLL7, KIDINS220, PAFAH1B1, NOVA1, FGF13, DLG2, SCN2A, NRXN3, NTRK2, CRIM1, ARID1B, CAMK1D, GAS7, ZSWIM6, CAPRIN1, WDPCP, SPOCK1, ELAVL3, RBFOX1, PHF10
GO:0015031	protein transport	175	0.06556762832521544	2.0368489788629525	3.8031960385478686e-21	2.298271366094477e-17	16.63859869373326	4.596542732188954e-17	EPS15, BBS9, PGAP1, RAB7A, PEX14, KCNQ3, NUP153, DENND2A, SCFD1, IPO7, STX12, STXBP5, CCDC93, TMED7, RAB2A, SNX2, VAMP2, DOP1A, COG3, BCAP29, MON2, SNX3, RAB21, EXOC6, RAB3C, STXBP1, RPH3A, SEC23A, LRP1B, COPG2, LIN7A, BBS1, AP2B1, FRMPD1, SNAP91, RAB3IP, GOLPH3, ATG7, IER3IP1, TBC1D5, KIF3A, SCAMP5, MTX2, AP4E1, GOPC, AHCTF1, APBA1, UBAP1, EHBP1, HOOK3, XPO1, TMED5, GABARAP, RAB5B, SEC63, EXOC5, BBS4, BBS7, LYST, MYO6, GBF1, ARFGEF2, SNX25, RAB5A, RAB2B, DENND1B, TRAM1, BLZF1, CCDC91, ATG10, STX18, VPS41, EXOC2, MIA3, SCFD2, SNX27, CADPS, BBS5, EXOC1, TSG101, VPS45, STXBP5L, MYO5A, ERC1, AFTPH, XPO4, ATG4C, STAM2, VTA1, RAB6A, GPM6B, NUP42, TNPO1, SENP2, XPO7, VPS35L, ASTN2, VPS54, SNX14, XPO6, RABGAP1L, TIMM23B, COPB1, VPS8, SNX4, DENND4C, DENND1A, NSF, ARFGEF1, ARF3, SNX13, EXOC6B, TNKS, HEATR5B, RAB3B, AP2A2, DNAJC15, KPNA3, RAB11FIP2, NBAS, APPBP2, SEC24B, FCHSD2, SNX10, RABGEF1, SEC22B, APBA2, NUP54, IPO9, KPNA5, C2CD5, STAM, RABEP1, COG6, RAB10, SEC31B, STX16, AP3S2, STXBP3, AGAP1, SPIRE1, ZMAT3, FMN2, COG5, VPS50, SEC31A, NAPB, VTI1B, CASK, SNX7, GCC2, DOP1B, AP5M1, ANK2, IPO8, DENND10, ITSN1, AP3S1, DNAJC13, EXOC4, KPNA4, SEC62, RBSN, VTI1A, RANBP17, TMEM9, CD2AP, SCAMP1, NUP93, PIK3R1, RAB8B, KPNA1, ARL8B, ARRB1, SAR1B
GO:0007268	chemical synaptic transmission	61	0.02285500187336081	1.9695465212708754	1.6084807794627866e-07	6.63422321711155e-05	4.178209920165206	0.0019440098700587239	GABRB3, PRKAR1B, SPG11, KCNQ3, GRIK1, APBA1, SYT1, SLC6A1, GABBR2, AMPH, FGF12, SYN1, KCND3, NRXN1, AKAP9, APBA2, SNCB, BSN, DLGAP1, CACNB4, CACNB2, GABARAP, SYN3, GRM5, GAD2, MBP, GAD1, CDH8, APP, CTNNB1, GABRB2, DTNA, GLRB, SYN2, GPR176, SNAP25, LARGE1, AP2B1, MAPK1, GRIA1, RPS6KA2, PAFAH1B1, HOMER1, DLG1, DLG2, GRIN2B, GRIK2, EXOC4, GABRG2, CACNA1B, PCDH8, KCNIP1, SLC12A5, LRP6, DLG3, SLITRK5, GRIN2A, KCND2, GLS, LRP8, KIF5A
GO:0006886	intracellular protein transport	70	0.026227051330086175	1.9430660042966004	2.584286224457802e-08	1.4197128776725907e-05	4.847799478328761	0.00031233683308796995	IPO7, SPG11, AP4E1, DNAJC15, SCFD1, VPS45, APBA1, APPBP2, SEC24B, MYRIP, STX12, TMED7, SNX10, RIMS1, RFFL, SNX2, ARFIP1, PDCD6, IPO9, XPO1, TMED5, COG3, FAM91A1, BCAP29, STX7, RAB21, RAB5B, STX16, CHM, EXOC6, AP3S2, STXBP3, ARL5A, STXBP1, MYO6, RAB6A, SYTL5, RPH3A, NAPB, SEC23A, COPG2, EXOC6B, RAB5A, VTI1B, LARGE1, TNPO1, AP2B1, XPO7, IPO8, XPO6, RAB3GAP2, COPB1, AP3S1, SYTL2, STX18, VPS41, VTI1A, SCFD2, RANBP17, CLTC, SNX27, NSF, HERC2, RIMS2, TLK1, ARF3, SNX13, ARL4C, AP2A2, SAR1B
GO:0016567	protein ubiquitination	133	0.04983139752716373	1.936466912206536	1.785820291284459e-14	3.597237340077329e-11	10.444030907167459	2.1583424040463973e-10	SHPRH, RFFL, RNF144B, RNF38, ZBTB16, BIRC6, G2E3, SIRT1, KBTBD6, UBE3A, UBE2K, UBE2D2, PCNP, ANAPC5, KLHL12, HECTD1, USP7, UBE2Z, WWP1, HERC3, ANAPC4, SKP1, CNOT4, RNF19A, HACE1, UBE2W, MYCBP2, HECW2, USP9X, UBE2D3, CAND1, FANCL, KLHL13, KLHL2, UBR5, SPOP, UBE2V2, HERC1, DCAF6, ANKIB1, UBE2E3, BTRC, TRIM9, UBR4, KLHL7, ZFP91, UBE3C, SMURF2, RNF180, DCAF17, UBE2H, FBXL17, RNF144A, ASB3, ANAPC10, RNF103, ITCH, UHRF2, DCAF8, RNF217, TRIM2, DCAF7, KLHL3, PDZRN3, UBR1, KLHL24, TRPC4AP, UBA6, TRIM33, PRKN, FBXO38, PJA2, UBR2, TRIP12, RBBP6, RLIM, HECTD2, UBR3, HECW1, ANAPC1, UBE4B, RNF138, RNF130, FBXL5, UBE3D, KLHDC1, CBL, FEM1B, RNF111, UBE2E1, ARIH1, FBXL2, CDC27, KLHL8, APPBP2, PCMTD1, TTC3, COP1, WDSUB1, CDC16, HLTF, DZIP3, TRIM37, DCAF5, FBXW7, SH3RF3, DCAF10, CUL3, RNF157, RNF216, HUWE1, ZNRF2, FBXO10, WSB2, KLHL42, RC3H1, FBXO11, HERC6, RNF13, TRIM13, UBE2N, HECTD4, SMURF1, MIB1, HERC2, MED17, RNF10, HERC4, ARRB1, FBXW11, NEDD4L, UBE2E2, PELI2
GO:0006338	chromatin remodeling	79	0.02959910078681154	1.870009447255124	2.4910836888426506e-08	1.4197128776725907e-05	4.847799478328761	0.00030107237463352276	NSD3, DYRK1A, USP16, BICRAL, KAT14, NIPBL, USP22, RSF1, SETD7, SMARCAD1, PWWP2A, BAZ2B, MIER1, PRKAA2, WAC, USP49, CHD6, HCFC2, SF3B1, PSIP1, SKP1, SETBP1, JADE1, ARID2, SMARCC1, RBBP4, KDM2A, HDAC4, MYSM1, PHF8, EP300, JMJD1C, HMGB1, KDM5D, CHD7, SMARCE1, INO80D, RERE, KMT5B, NCOA3, RYBP, CHD2, CLOCK, UTY, JARID2, KDM2B, KDM4C, TAF1, SMARCA2, KDM4A, ARID1A, DPF3, DEK, SETD5, JAK2, HNRNPC, PRDM2, KMT2C, BRPF3, RSBN1, ASH1L, CHD4, ERCC6, CREBBP, HLTF, HUWE1, JADE3, PRMT3, PRKDC, ATRX, TP53BP1, SFPQ, MLLT10, ARID1B, GATAD2B, PRKCA, CFDP1, PHF10, KDM1A
GO:0006325	chromatin organization	106	0.03971524915698764	1.8675234512267522	1.2827947207419017e-10	1.2919880829072186e-07	6.888741492185752	1.5503856994886623e-06	NSD3, PYGO1, NCOR1, FGF2, USP16, MORF4L2, AEBP2, USP22, RSF1, SETD7, CABIN1, SMARCAD1, SIRT1, KMT2A, PRKAA2, WAC, ASXL1, USP49, SPIN1, CHD6, PTMA, IER3IP1, TLK2, CTCF, MLLT3, KMT2E, TBL1XR1, CTR9, OGT, EP400, ARID2, SMARCC1, RBBP4, ARID4A, TET2, KDM2A, NUCKS1, HDAC4, MYSM1, PHF8, SETD2, SFMBT1, PWWP3A, TAF3, JMJD1C, HMGB1, KDM5D, ASH2L, CHD7, ZCWPW2, PHIP, ZNF518A, SMARCE1, KMT5B, CHD2, KANSL1, UTY, NR3C1, UBN2, JARID2, KDM2B, KDM4C, KAT6A, TAF1, FAM47E, KAT6B, ARID1A, DPF3, SMYD3, DEK, SETD5, JAK2, ZMYND8, PHF14, KMT2C, APBB1, ZMYND11, MORF4L1, BRPF3, RSBN1, ASH1L, CHD4, EPC1, CHD9, PHF21A, BABAM2, HDAC5, ARID4B, KAT7, SMCHD1, HNRNPU, SAFB, HLTF, SUZ12, ZNF618, L3MBTL4, HDAC9, EPC2, ATRX, L3MBTL1, TP53BP1, HDAC8, ARID1B, TLK1, KDM4A, KDM1A
GO:0043161	proteasome-mediated ubiquitin-dependent protein catabolic process	80	0.029973772948669913	1.8373209156273975	4.27820360804746e-08	2.2481029916026782e-05	4.648183796457007	0.000517063688068616	WDR26, RFFL, SH3BGRL, SIRT1, KBTBD6, PSMD14, UBE3A, CSNK1A1, FAF1, PCNP, KLHL12, WWP1, SKP1, TBL1XR1, PSMD12, UBE2W, MYCBP2, RMND5A, UBE2D3, KLHL13, KLHL2, UBR5, SPOP, CTNNB1, ARMC8, BTRC, TRIM9, UBR4, KLHL7, BIRC2, MKLN1, SMURF2, UBE2H, FBXL17, CLOCK, PSMA6, ITCH, TRIM2, PSMA1, KLHL3, ZYG11B, UBR1, GSK3B, KLHL24, NDFIP1, PRKN, PSMD11, PJA2, UBR2, TRIP12, RANBP10, UBE4B, PPP2R5C, UBE3D, FEM1B, KLHL5, KLHL23, UBXN2B, KLHL8, APPBP2, COP1, RANBP9, FBXW7, CUL3, RNF216, HUWE1, ZNRF2, RNF145, KLHL42, FBXO11, UCHL1, KLHL32, TRIM13, UBE2N, SMURF1, HERC2, PCBP2, ARRB1, FBXW11, NEDD4L
GO:0016192	vesicle-mediated transport	80	0.029973772948669913	1.7945925222407138	1.5018157514133908e-07	6.482480418422228e-05	4.188258786426566	0.001815094517158224	SCFD1, SYT1, STX12, RAB2A, KALRN, VAMP2, SYT13, UVRAG, BCAP29, STXBP1, SYT17, SEC23A, CYTH3, COPG2, PICALM, AP2B1, FBXO8, RTN3, IQSEC1, KLHL12, BORCS7, KIF5A, AP4E1, GAPVD1, TVP23C, MAPK8IP3, RAB2B, OSBPL1A, BLZF1, STX18, VPS41, MIA3, SCFD2, TBC1D23, LRP6, KIF16B, ERGIC2, TRAPPC8, VPS45, MYO5A, STX7, CHM, VPS13B, RAB6A, COPB1, SPAG9, NSF, KIF1B, ARFGEF1, ARF3, NCALD, AP2A2, RAB11FIP2, SEC24B, SYT11, ARFGEF3, RABGEF1, SEC22B, SPTBN1, RABEP1, RAB10, CUL3, SEC31B, STX16, ARL5A, AP3S2, STXBP3, FMN2, SPIRE1, SEC31A, NAPB, VTI1B, GOLGA4, AP5M1, AP3S1, SYTL2, VTI1A, CLTC, CYTH1, SAR1B
GO:0006974	DNA damage response	122	0.04571000374672162	1.5983756148853625	9.885427193624894e-08	4.59520281008271e-05	4.337695316191675	0.0011947527306215046	SHPRH, MTREX, JMY, USP16, CDC5L, MORF4L2, UVRAG, NIPBL, CRADD, INTS7, IMMP2L, SETD7, STXBP4, SMARCAD1, SIRT1, PSMD14, RAD50, WAC, MAPK1, TAOK3, REV1, NCOA6, NUAK1, USP1, USP7, TLK2, CDC14B, PIAS1, PARP1, UBE2W, MCM9, SHLD2, RBBP4, UBE2D3, FANCL, CBX5, CEP63, XRCC5, SLF2, UBR5, NUCKS1, FOXP1, SETD2, PWWP3A, SPIDR, RAD51D, HMGB1, WRNIP1, WNK1, DELE1, RIF1, BCL2, ASH2L, ZBTB38, SGK1, ASCC3, NSMCE2, INO80D, REV3L, METTL14, CHD2, CLOCK, ERCC6L2, PSMA6, MSH2, PSMA1, HIPK2, TAF1, UBA6, TRIP12, RBBP6, APBB1, RNF138, SMG1, MORF4L1, WRN, CBL, NFAT5, MAPT, MSH3, RNF111, CDK6, ERCC6, BABAM2, XIAP, KAT7, SMCHD1, USP47, DCUN1D5, PSME4, HLTF, USP10, FBXW7, TAOK1, ZBTB4, HUWE1, SMC5, FMN2, ZMAT3, GTF2H1, MAPK14, EPC2, ATF2, PRKDC, ATRX, TP53BP1, MACROD2, PARG, NBN, PPP4R3B, CSNK2A1, POGZ, UBE2N, SFPQ, MCTS1, BCLAF1, ERCC5, HERC2, ABL1, TLK1, UBE2E2, PMS2
GO:0007186	G protein-coupled receptor signaling pathway	55	0.020606968902210566	0.42399713437555325	2.0904677139539277e-15	5.053078558169434e-12	11.296443949908555	2.526539279084717e-11	PDE4A, RGS12, CALM3, APLP2, ADRA1A, CALM2, GABBR2, GABBR1, PDE3B, TACR1, PLCB1, CALM1, GPR83, ECE2, GNB5, LGR4, GNAI3, GNA13, RIC8B, FZD3, ARHGEF11, PLCB4, GPR19, RGS17, GNAQ, GPR63, RGS7, CNR1, RGS7BP, GRM5, PIK3CB, PDE3A, FRS2, SORT1, PLPPR4, APP, TAPT1, ADGRB3, RAPGEF4, GNAI1, ADGRL2, GNAO1, GNG4, RAPGEF2, OPN3, GNB1, GRK3, ARHGEF12, ADGRG6, LANCL1, ADGRL3, GNB4, GPR176, TAFA5, GNAS
GO:0006955	immune response	15	0.005620082427875608	0.2769167887189618	4.8734034836258337e-11	5.8899954503101826e-08	7.2298850406808	5.889995450310183e-07	TENM1, SEMA4D, ITGB8, IGF1R, TCF12, PIK3R1, BMPR1A, IL1RAP, CERT1, STXBP3, MBP, LYST, DPP8, HMGB1, PIK3R3
GO:0007608	sensory perception of smell	6	0.0022480329711502436	0.1064379013191044	7.863558795163143e-19	2.3759742899585436e-15	14.624158263097218	9.503897159834175e-15	PDE4A, BBS1, BBS4, UBR3, GNAS, RIC8B
GO:0050911	detection of chemical stimulus involved in sensory perception of smell	0	0.0	0.0	2.169360801032779e-25	2.6218894641282167e-21	20.58138562162041	2.6218894641282167e-21	
