	DrugBank_ID	DrugBank_Name	Indication	Targets	Proximity	FDR
0	DB00313	valproic-acid	"**Indicated** for:[Label] 

1) Use as monotherapy or adjunctive therapy in the management of complex partial seizures and simple or complex absence seizures. 

2) Adjunctive therapy in the management of multiple seizure types that include absence seizures. 

3) Prophylaxis of migraine headaches.

4) Acute management of mania associated with bipolar disorder.


**Off-label** uses include:
 
1) Maintenance therapy for bipolar disorder.[A177919]

2) Treatment for acute bipolar depression.[A177928,A177931,A177934]

3) Emergency treatment of status epilepticus.[A177955]"	OGDH, HDAC2, PPARD, ALDH5A1, PPARG, SCN1A, HDAC9, ACADSB, PPARA	-0.6340473602475019	1.802753098299324e-18
1	DB02424	geldanamycin		HSP90AB1, HSP90B1, HSP90AA1	-2.897405595421956	2.350284665883487e-16
2	DB00197	troglitazone	For the treatment of Type II diabetes mellitus. It is used alone or in combination with a sulfonylurea, metformin, or insulin as an adjunct to diet and exercise.	ACSL4, ESRRA, PPARD, SERPINE1, SLC29A1, ESRRG, PPARG, GSTP1, PPARA	-0.0379267972487888	2.580443708492089e-15
3	DB03496	alvocidib	Investigated for use/treatment in esophageal cancer, leukemia (lymphoid), lung cancer, liver cancer, and lymphoma (unspecified).	PYGM, EGFR, CDK5, CDK7, CDK2, CDK6, CDK9, PYGB, CDK4, CDK8, CDK1	-0.8477376300452232	5.0448283065745315e-12
4	DB06595	midostaurin	Investigated for use/treatment in adult patients with high-risk acute myeloid leukemia (AML) who are FLT3 mutation-positive, agressive systemic mastocytosis (ASM), systemic mastocytosis with associated hematological neoplasm (SM-AHN), or mast cell leukemia (MCL). 	KDR, PDGFRA, KIT, FLT3, PRKCA, PDGFRB	-1.0261302071206364	1.3576042286259176e-11
5	DB00679	thioridazine	For the treatment of schizophrenia and generalized anxiety disorder.	ADRA1A, HTR2A, KCNH2, DRD2, DRD1, ADRA1B	-0.1646320834602972	3.477389444932702e-11
6	DB00824	enprofylline	Used in the management of symptoms of asthma. Also used in the treatment of peripheral vascular diseases and in the management of cerebrovascular insufficiency, sickle cell disease, and diabetic neuropathy.	PDE4A, ADORA3, ADORA2B, ADORA2A, ADORA1, PDE4B	-0.1223016086807903	2.578445455205911e-10
7	DB06448	lonafarnib	Lonafarnib is a farnesyltransferase inhibitor indicated in patients aged 12 months and older with a body surface area of at least 0.39 m<sup>2</sup> to reduce the risk of mortality associated with Hutchinson-Gilford progeria syndrome (HGPS). It is also indicated in this same population for the treatment of processing-deficient progeroid laminopathies that either involve a heterozygous _LMNA_ mutation resulting in the accumulation of a progerin-like protein or homozygous/compound heterozygous mutations in _ZMPSTE24_.[L23414]	FNTA, FNTB	-1.3907295512834923	6.520213091403223e-10
8	DB00273	topiramate	"Topiramate is indicated  for the following conditions: 1)Monotherapy for partial onset or primary generalized tonic-clonic seizures for patients 2 years of age and above 2)Adjunctive therapy for partial onset seizures or primary generalized tonic-clonic seizures for both adult and pediatric patients above 2 years old 3)Adjunctive therapy for seizures associated with Lennox-Gastaut syndrome in patients above 2 years of age 4)Prophylaxis of migraine in children 12 years of age and older and adults.[L10544]

Topiramate is also used off-label as an adjunct therapy for weight management[L10550] and for mood disorders.[A188312]"	GRIK1, CA1, CACNA1E, SCN1A, CA3, CA4, CACNA1C, CA2, GABRA1	-0.718297675645672	1.6095910028892334e-09
9	DB00694	daunorubicin	"For remission induction in acute nonlymphocytic leukemia (myelogenous, monocytic, erythroid) of adults and for remission induction in acute lymphocytic leukemia of children and adults.

Daunorubicin is indicated in combination with [cytarabine] for the treatment of newly-diagnosed therapy-related acute myeloid leukemia (t-AML) or AML with myelodysplasia-related changes (AML-MRC) in adults and pediatric patients 1 year and older.[L32843]"	TOP2B, TOP2A	-1.566116809344411	4.1086809302133424e-09
10	DB00499	flutamide	For the management of locally confined Stage B2-C and Stage D2 metastatic carcinoma of the prostate	NR1I2, AHR, AR	-0.8843330442841292	4.1086809302133424e-09
11	DB07232	veliparib		PARP2, PARP1	-2.0104757731556644	2.3780298438968725e-08
12	DB07374	anisomycin		RPL10L, RPL15, RSL24D1, RPL19, SNU13, RPL23A, RPL8, RPL11, RPL23, RPL37, RPL3, RPL13A, RPL26L1	0.0528909815489178	2.3780298438968725e-08
13	DB12442	alvespimycin	Investigated for use as an antineoplastic agent for solid tumors, advanced solid tumours or acute myeloid leukaemia. 	HSP90AA1	-4.556119388446258	5.450276117592741e-08
14	DB08059	wortmannin		PIK3R1, PIK3CA, PLK1, PIK3CG	-1.7346567360576823	5.450276117592741e-08
15	DB00898	palmitoylethanolamide	For therapeutic neurolysis of nerves or ganglia for the relief of intractable chronic pain in such conditions as inoperable cancer and trigeminal neuralgia (tic douloureux), in patients for whom neurosurgical procedures are contraindicated.	GABRB3, CHRNA6, SLC29A2, CACNA1S, CHRNA5, GRIA4, KCNJ6, CACNA1D, SLC29A1, GABRA6, CACNG1, L1CAM, GABRQ, CACNB1, GABRE, CHRNA7, GABRB1, GABRP, GLRA2, CHRNA9, GABRG1, HTR3C, HTR3A, GRIA2, GABRA3, GABRB2, GABRA4, KCNJ5, HTR3D, GRIA1, KCNJ3, HTR3E, GRIN3A, HTR3B, GABRG3, GABRD, CHRNA3, GABRA5, CHRNA4, CHRNB3, GRIA3, CHRNB2, GLRA1, CACNG2, CHRNA10, KCNJ9, CHRNA2, CACNA1C, GABRA2, VCAM1, CHRNB4, GABRA1	-0.3002299603449723	5.450276117592741e-08
16	DB00820	tadalafil	Tadalafil is indicated for the treatment of erectile dysfunction (ED) and either alone or in combination with [finasteride] for the treatment of benign prostatic hypertrophy (BPH).[L39095,L39439] It is also indicated for the treatment of pulmonary arterial hypertension (PAH) both alone and in combination with [macitentan] or other endothelin-1 antagonists.[L39100,L39105]	PDE5A, PDE11A, PDE6G	-0.0982188884505879	5.450276117592741e-08
17	DB00939	meclofenamic-acid	For the relief of mild to moderate pain, for the treatment of primary dysmenorrhea and for the treatment of idiopathic heavy menstrual blood loss. Also for relief of the signs and symptoms of acute and chronic rheumatoid arthritis and osteoarthritis.	KCNQ3, PTGS2, PTGS1, ALOX5, KCNQ2	-0.1064289188797688	1.2293441885683867e-07
18	DB08881	vemurafenib	"Vemurafenib is approved since 2011 for the treatment of metastatic melanoma with a mutation on BRAF in the valine located in the exon 15 at codon 600, this mutation is denominated as V600E.[A31270] The V600E mutation, a substitution of glutamic acid for valine, accounts for 54% of the cases of cutaneous melanoma.[A31271] 
Vemurafenib approval was extended in 2017, for its use as a treatment of adult patients with Erdheim-Chester Disease whose cancer cells present BRAF V600 mutation.[L1013] Erdheim-Chester disease is an extremely rare histiocyte cell disorder that affects large bones, large vessels, central nervous system, as well as, skin and lungs. It is reported an association of Erdheim-Chester disease and V600E mutation.[A31272]"	BRAF	-3.51515641300938	2.807262734561885e-07
19	DB09063	ceritinib	Ceritinib is a kinase inhibitor indicated for the treatment of patients with anaplastic lymphoma kinase (ALK)-positive metastatic non-small cell lung cancer (NSCLC) who have progressed on or are intolerant to crizotinib. This indication is approved under accelerated approval based on tumor response rate and duration of response. An improvement in survival or disease-related symptoms has not been established. Continued approval for this indication may be contingent upon verification and description of clinical benefit in confirmatory trials.	ALK	-3.1390977778058256	2.807262734561885e-07
20	DB08877	ruxolitinib	"Ruxolitinib is indicated for the treatment of inte1mediate or high-risk myelofibrosis (MF), including prima1y MF, post-polycythemia vera MF and post-essential thrombocythemia MF in adults.[L31938] It is also indicated to treat disease-related splenomegaly or symptoms in adult patients with these conditions.[L32073]

Ruxolitinib is indicated for the treatment of polycythemia vera (PV) in adults who have had an inadequate response to or are intolerant of hydroxyurea.[L31938]

Ruxolitinib is indicated for the treatment of steroid-refracto1y acute graft-versus-host disease (GVHD) in adult and pediatric patients 12 years and older.[L31938]

Ruxolitinib is indicated for topical non-continuous and short-term treatment of mild to moderate atopic dermatitis in immunocompetent patients who are 12 years and older and whose disease is not adequately controlled with topical prescription therapies or when the topical prescription therapies are not advisable.[L39125]"	JAK3, JAK2, JAK1, TYK2	-1.6224430826606089	2.807262734561885e-07
21	DB01954	rolipram		PDE4D, PDE4B	-1.2979652215143431	2.807262734561885e-07
22	DB01791	piclamilast		PDE4C, PDE4D, PDE4A, PDE4B	-1.1611440945944846	2.807262734561885e-07
23	DB12010	fostamatinib	Fostamatinib is indicated for use in the treatment of chronic immune thrombocytopenia (ITP) in patients who have had insufficient response to previous therapy [FDA Label].	MYLK2, TIE1, PDGFRA, RPS6KA3, DYRK1A, MYO3A, LYN, SLC18A2, EPHA6, CAMK1, HCK, MATK, SIK2, LIMK1, PAK4, BMX, STK24, PAK1, STK3, MTOR, ADORA3, COQ8A, PIP4K2C, FLT3, MAP4K4, ERBB4, JAK1, OXSR1, NUAK2, FLT4, FGR, LTK, TNK1, SGK3, RPS6KA6, STK38L, YES1, FES, LRRK2, BMP2K, CSNK1A1, STK36, CIT, MARK4, CLK2, TTK, TAOK3, MAP3K10, PRKCQ, ROS1, MARK2, LATS1, NUAK1, RIPK1, CAMK2D, MKNK2, CDK16, TYK2, TLK2, TNIK, PRKACA, STK33, EPHB2, ACVR1, CAMK1G, TSSK1B, IKBKE, CAMKK2, ITK, TESK1, RAF1, HIPK3, FER, MAP2K2, ULK3, EPHA1, PAK5, GSK3A, CDK17, PIK3C2G, AAK1, CAMK2G, MAP3K15, PRKACB, CHEK2, PRKCE, IKBKB, MYLK3, MELK, SIK3, NEK9, EPHA3, PDPK1, RIOK1, ABL2, BTK, MINK1, KIT, BMPR1B, PIK3C2B, CDC42BPG, MYLK, PTK6, EPHB6, TEC, DAPK2, CDKL2, DDR2, FLT1, INSRR, LCK, ULK1, PRKD1, JAK3, AURKA, CAMK2A, WEE1, GAK, INSR, MAP3K12, PAK2, IRAK1, EPHA4, CSNK2A2, PTK2B, PDGFRB, MARK1, MAPK7, BMPR2, PIK3CD, CLK3, PKN1, RPS6KA1, PAK3, SRMS, STK16, ANKK1, PRKCD, FRK, FAAH, COQ8B, ALOX5, ULK2, DAPK3, MAPK13, MAPK9, MKNK1, DAPK1, NTRK3, STK17A, MAP4K1, STK26, PIK3CG, PDE5A, PKN2, SNRK, RET, MYLK4, RIOK2, MAST1, MAP3K4, FGFR1, EPHA7, SIK1, STK10, MAP4K3, CSK, HIPK2, SBK1, PTK2, CTSL, PIP4K2B, MAP3K6, CSN3, MST1R, GSK3B, EIF2AK2, LIMK2, MAP3K1, MAP4K2, EPHB4, PAK6, PLK2, CLK4, PRKAA1, AXL, DCLK3, FYN, JAK2, NEK5, TAOK2, ROCK2, STK32A, PRKG2, PRKCG, NEK3, AURKB, TEK, DCLK1, CILK1, PHKG1, ALK, BLK, CLK1, MAP3K19, MAPK15, NEK1, UGT1A1, NEK4, SYK, CAMKK1, DYRK1B, ERBB2, MET, ACVR1B, ERN1, SLC29A1, STK39, NIM1K, ZAP70, MAP3K9, PRP4K, AURKC, STK38, EIF2AK4, KDR, MAPK10, MAPKAPK5, PIM3, CDK15, NTRK1, TAOK1, CAMK2B, STK35, CSF1R, TGFBR1, DDR1, FGFR2, CHEK1, NEK11, MAP3K13, FGFR3, MAP3K3, MAP3K20, TNNI3K, TBK1, CLASP1, MAP2K5, MAPK14, MUSK, PLK4, RIPK2, CASK, EGFR, MAP2K6, STK17B, TXK, CDKL1, EIF2AK1, EPHA8, IRAK4, MAP4K5, TYRO3, EPHB1, MERTK, NEK2, PIM1, PKMYT1, IRAK3, PLK1, RIPK4, SBK3, CSNK2A1, SRC, PI4KB, NTRK2, TGFBR2, TNK2, BRAF, CAMK1D, DCLK2, MAP2K3, MARK3, EPHA2, EPHA5, RIOK3, SLK, CTSS, MAP3K2, ABL1, PLK3, PRKCI, TLK1, MAPK4, CDK4, MAP3K11, CDK1	-0.5843087791040351	2.807262734561885e-07
24	DB02546	vorinostat	For the treatment of cutaneous manifestations in patients with cutaneous T-cell lymphoma who have progressive, persistent or recurrent disease on or following two systemic therapies.	HDAC2, HDAC1, HDAC3, HDAC6, HDAC8	-0.3902673917517685	2.807262734561885e-07
25	DB06075	linsitinib	Investigated for use/treatment in cancer/tumors (unspecified) and solid tumors.	INSR, IGF1R	-1.676784981678605	6.118253553423818e-07
26	DB00170	menadione	The primary known function of vitamin K is to assist in the normal clotting of blood, but it may also play a role in normal bone calcification.	GGCX, F2, PROC, PROS1, NQO1, VKORC1L1, NQO2, VKORC1, F9, BGLAP	0.0242311847413743	6.118253553423818e-07
27	DB02918	zardaverine		PDE4D	-2.924639513844814	1.280029537089483e-06
28	DB00829	diazepam	"In general, diazepam is useful in the symptomatic management of mild to moderate degrees of anxiety in conditions dominated by tension, excitation, agitation, fear, or aggressiveness such as may occur in psychoneurosis, anxiety reactions due to stress conditions, and anxiety states with somatic expression.[F3160]

Moreover, in acute alcoholic withdrawal, diazepam may be useful in the symptomatic relief of acute agitation, tremor, and impending acute delirium tremens.[F3160]

Furthermore, diazepam is a useful adjunct for the relief of skeletal muscle spasm due to reflex spasm to local pathologies, such as inflammation of the muscle and joints or secondary to trauma; spasticity caused by upper motor neuron disorders, such as cerebral palsy and paraplegia; athetosis and the rare ""stiff man syndrome"".[F3160]

Particular label information from the United Kingdom also lists particular age-specific indications, including for adults: (1) The short-term relief (2-4 weeks) only, of anxiety which is severe, disabling, or subjecting the individual to unacceptable distress, occurring alone or in association with insomnia or short-term psychosomatic, organic or psychotic illness, (2) cerebral palsy, (3) muscle spasm, (4) as an adjunct to certain types of epilepsy (eg. myoclonus), (5) symptomatic treatment of acute alcohol withdrawal, (6) as oral premedication for the nervous dental patient, and (7) for premedication before surgery.[L5188]

In the same UK label information, diazepam is indicated in children for: (1) control of tension and irritability in cerebral spasticity in selected cases, (2) as an adjunct to the control of muscle spasm in tetanus, and for (3) oral premedication.[L5188]

A diazepam nasal spray is indicated in patients 6 years and older to treat intermittent, stereotypic episodes of frequent seizure activity that are different than the patient's usual seizure pattern.[L11247]"	GABRA1	-2.109887855165669	1.280029537089483e-06
29	DB03758	radicicol		HSP90AB1, PDK3, HSP90B1, DLAT	-0.8696698140468384	1.280029537089483e-06
30	DB00421	spironolactone	"Spironolactone is indicated for the treatment of New York Heart Association Class III-IV heart failure, management of edema in cirrhotic adults not responsive to fluid and sodium restrictions, primary hyperaldosteronism short-term preoperatively, primary hyperaldosteronism long-term in patients with aldosterone producing adrenal adenomas that are not candidates for surgery or patients with bilarteral micro/macronodular adrenal hyperplasia, as an add-on therapy in hypertension, and in nephrotic syndrome when treatment of the disease as well as fluid and sodium restriction with other diuretics is inadequate.[Label]

Spironolactone has antiandrogenic activity which leads to many of its off label uses. Spironolactone is used off label in the treatment of hirsutism, female pattern hair loss, and adult acne vulgaris.[A178135]

Spironolactone is also frequently used for its antiandrogenic effects in transgender female patients due to its low cost and reducing male-pattern hair growth.[A178138]"	SHBG, CYP11B2, NR3C2, NR1I2, SRD5A1, AR, CACNG1, PGR, NR3C1, CYP17A1	-0.3360565765893979	1.280029537089483e-06
31	DB00843	donepezil	Donepezil is indicated for the management of mild to moderate Alzheimer’s Disease at doses of 5 mg or 10 mg.[L7916] It is also indicated for the management of moderate to severe Alzheimer’s Disease in a higher dose of 10 mg or 23 mg administered once daily.[L7916] Off-label uses include the management of vascular dementia, Parkinson's Disease-associated dementia, and Lewy body dementia, among others.[A182333,T668] When combined with memantine, the extended-release form of donepezil is indicated to treat the symptoms of moderate to severe dementia.[L7937]	TNFAIP6, IL1B, NFKB2, NOS1, HTR2A, BCHE, ACHE, GRIN1	-0.0705880779459008	1.280029537089483e-06
32	DB01065	melatonin	Used orally for jet lag, insomnia, shift-work disorder, circadian rhythm disorders in the blind (evidence for efficacy), and benzodiazepine and nicotine withdrawal. Evidence indicates that melatonin is likely effective for treating circadian rhythm sleep disorders in blind children and adults. It has received FDA orphan drug status as an oral medication for this use. A number of studies have shown that melatonin may be effective for treating sleep-wake cycle disturbances in children and adolescents with mental retardation, autism, and other central nervous system disorders. It appears to decrease the time to fall asleep in children with developmental disabilities, such as cerebral palsy, autism, and mental retardation. It may also improve secondary insomnia associated with various sleep-wake cycle disturbances. Other possible uses for which there is some evidence for include: benzodiazepine withdrawal, cluster headache, delayed sleep phase syndrome (DSPS), primary insomnia, jet lag, nicotine withdrawal, preoperative anxiety and sedation, prostate cancer, solid tumors (when combined with IL-2 therapy in certain cancers), sunburn prevention (topical use), tardive dyskinesia, thrombocytopenia associated with cancer, chemotherapy and other disorders. 	ESR1, RORB, ASMT, EPX, CALR, MTNR1A, NQO2, MPO, CALM1, MTNR1B	-0.0647702511423779	1.280029537089483e-06
33	DB01259	lapatinib	Indicated in combination with capecitabine for the treatment of patients with advanced or metastatic breast cancer whose tumors overexpress the human epidermal receptor type 2 (HER2) protein and who have received prior therapy including an anthracycline, a taxane, and trastuzuma.	ERBB2, EGFR	-2.248411702354106	2.736643866273119e-06
34	DB00590	doxazosin	Doxazosin is indicated to treat the symptoms of benign prostatic hypertrophy, which may include urinary frequency, urgency, and nocturia, among other symptoms. In addition, doxazosin is indicated alone or in combination with various antihypertensive agents for the management of hypertension.[L7282] Off-label uses of doxazosin include the treatment of pediatric hypertension[A180634] and the treatment of ureteric calculi.[A180637]	ADRA1D, KCNH2, ADRA1A, ADRA1B	-0.4113026605985096	2.736643866273119e-06
