	DrugBank_ID	DrugBank_Name	Indication	Targets	Proximity	Normalized_Enrichment_Score	FDR
86	DB08896	Regorafenib	Regorafenib is indicated for the treatment of patients with metastatic colorectal cancer (CRC) who have been previously treated with fluoropyrimidine-, oxaliplatin- and irinotecan-based chemotherapy, an anti-VEGF therapy, and, if KRAS wild type, an anti-EGFR therapy. Regorafenib is also indicated for the treatment of patients with locally advanced, unresectable or metastatic gastrointestinal stromal tumour (GIST) who have been previously treated with imatinib mesylate and sunitinib malate. Regorafenib is also indicated for the treatment of patients with hepatocellular carcinoma (HCC) previously treated with sorafenib.[L16835]	FLT4, ABL1, RAF1, FGFR2, TEK, KDR, DDR2, FGFR1, EPHA2, FLT1, NTRK1, BRAF, MAPK11, KIT, PDGFRB, FRK, RET, PDGFRA	-0.8141630137468769	2.2423000669963558	<0.0001
87	DB08604	Triclosan	Triclosan is used in a variety of common household products, including soaps, mouthwashes, dish detergents, toothpastes, deodorants, and hand sanitizers.  It is also used in health care settings in surgical scrubs and personnel hand washes.	NR1I2, NR1I3, PPARG, TPO, AR	-0.8017377107776695	1.6623296536047116	<0.0001
88	DB02266	Flufenamic acid		AKR1C3, PTGS2, PTGS1, PPARG, AR, PPARA	-0.7577229610340842	-1.45672810937851	<0.0001
89	DB00396	Progesterone	"**Gelatinized capsules**

The gelatinized capsules are indicated for use in the prevention of endometrial hyperplasia in non-hysterectomized postmenopausal women who are receiving conjugated estrogens tablets. They are also indicated for use in secondary amenorrhea [FDA label]. 

**Vaginal gel**

Progesterone gel (8%) is indicated as progesterone supplementation or replacement as part of an Assisted Reproductive Technology (“ART”) treatment for infertile women with progesterone deficiency.  The lower concentration progesterone gel (4%) is used in the treatment of secondary amenorrhea, with the use of the 8% concentration if there is no therapeutic response to the 4% gel [F3898].

**Vaginal insert**

This form is indicated to support embryo implantation and early pregnancy by supplementation of corpus luteal function as part of an Assisted Reproductive Technology (ART) treatment program for infertile women [F3901].

**Injection (intramuscular)**

This drug is indicated in amenorrhea and abnormal uterine bleeding due to hormonal imbalance in the absence of organic pathology, such as submucous fibroids or uterine cancer [F3907]. 

**Tablets, contraceptive**

The tablet form of progesterone in contraceptive formulations is indicated for the prevention of pregnancy [F3904]. "	ORM1, ESR1, OPRK1, CYP17A1, NR3C1, ESR2, NR3C2, PGR, SHBG, AR	-0.7378978528869566	1.5637285719119278	<0.0001
90	DB07995	H-89		HASPIN, PKIA, PRKACA	-0.7367878343036042	1.6446438253035052	<0.0001
91	DB09237	Levamlodipine	Levamlodipine is indicated alone or in combination to treat hypertension in adults and children.[L10833]	CACNA1D, NOS2, NOS3, CACNA1C	-0.7149251659527306	-1.4070203793138474	<0.0001
92	DB03010	Patupilone	Investigated for use/treatment in ovarian cancer, lung cancer, brain cancer, breast cancer, and gastric cancer.	TUBA4A, TUBB, TUBA1C, TUBA3C, TUBB4B, TUBB4A, TUBA8, TUBA1B, TUBA1A, TUBB3, TUBB1	-0.714416833147713	1.4278270120564358	<0.0001
93	DB00887	Bumetanide	For the treatment of edema associated with congestive heart failure, hepatic and renal disease including the nephrotic syndrome.	SLC12A5, SLC12A4, SLC12A1, SLC12A2, CFTR	-0.7022004431486439	-1.4291710864165617	<0.0001
94	DB01076	Atorvastatin	"Atorvastatin is indicated for the treatment of several types of dyslipidemias, including primary hyperlipidemia and mixed dyslipidemia in adults, hypertriglyceridemia, primary dysbetalipoproteinemia, homozygous familial hypercholesterolemia, and heterozygous familial hypercholesterolemia in adolescent patients with failed dietary modifications.[A177397]

Dyslipidemia describes an elevation of plasma cholesterol, triglycerides or both as well as to the presence of low levels of high-density lipoprotein. This condition represents an increased risk for the development of atherosclerosis.[L6025] 

Atorvastatin is indicated, in combination with dietary modifications, to prevent cardiovascular events in patients with cardiac risk factors and/or abnormal lipid profiles.[A177397]

Atorvastatin can be used as a preventive agent for myocardial infarction, stroke, revascularization, and angina, in patients without coronary heart disease but with multiple risk factors and in patients with type 2 diabetes without coronary heart disease but multiple risk factors.[A177397]

Atorvastatin may be used as a preventive agent for non-fatal myocardial infarction, fatal and non-fatal stroke, revascularization procedures, hospitalization for congestive heart failure and angina in patients with coronary heart disease.[A177397]

Prescribing of statin medications is considered standard practice following any cardiovascular events and for people with a moderate to high risk of development of CVD. Statin-indicated conditions include diabetes mellitus, clinical atherosclerosis (including myocardial infarction, acute coronary syndromes, stable angina, documented coronary artery disease, stroke, trans ischemic attack (TIA), documented carotid disease, peripheral artery disease, and claudication), abdominal aortic aneurysm, chronic kidney disease, and severely elevated LDL-C levels.[A181087, A181406]"	HDAC2, AHR, DPP4, NR1I3, HMGCR	-0.6757215710169089	1.8262276730698772	<0.0001
95	DB12695	Phenethyl Isothiocyanate		PSMC3, FBXO41, YWHAQ, TPM4, TUBA1A, ATP5F1B, ATP5MG, DIABLO, HSPB1, TPM1, TXN, ACTB, SMARCE1, S100A10, RANBP1, TUBA4A, TPM3, HSPA4, YWHAZ, PSMA3, HSPH1, NUDC, UCHL1, YWHAH, SF3A3, TUBB2A, ATP5ME, USP14, ACTA2, SUCLG2, PAPPA, HSPE1, TUBB3, TUBB1, YWHAB, TPD52L2, TUBA3C, TUBB4B, VIM, HNRNPK, MT-ND1, HNRNPF, VCP, CYB5B, YWHAE	-0.6757183366692112	1.587471599246114	<0.0001
96	DB00564	Carbamazepine	Carbamazepine is indicated for the treatment of epilepsy and pain associated with true trigeminal neuralgia.[L1335] In particular, carbamazepine has shown efficacy in treating mixed seizures, partial seizures with complex symptoms, and generalized tonic-clonic seizures.[A180301,L1335] Carbamazepine is also indicated for the treatment of manic episodes and mixed manic-depressive episodes caused by bipolar I disorder.[L1335] Some off-label, unapproved uses of carbamazepine include the treatment of alcohol withdrawal syndrome and restless leg syndrome.[A180415,A180421]	NR1I2, CHRNA4, SCN1A	-0.6726725377827184	-1.8523547629476511	<0.0001
97	DB04599	Aniracetam		GRIA2, HTR2A, GRIA3, DRD2	-0.6655574116980224	-1.619620379722036	<0.0001
98	DB02546	Vorinostat	For the treatment of cutaneous manifestations in patients with cutaneous T-cell lymphoma who have progressive, persistent or recurrent disease on or following two systemic therapies.	HDAC2, HDAC8, HDAC6, HDAC3, HDAC1	-0.6653256829919625	-2.611358900677478	<0.0001
99	DB06616	Bosutinib	Treatment of chronic, accelerated, or blast phase Philadelphia chromosome-positive (Ph+) chronic myelogenous leukemia (CML) with resistance or intolerance to prior therapy in adult patients. 	BCR, LYN, ABL1, MAP2K1, CAMK2G, HCK, SRC, MAP2K2, CDK2, MAP3K2	-0.6592860233824942	-2.6293012630551558	<0.0001
100	DB00280	Disopyramide	For the treatment of documented ventricular arrhythmias, such as sustained ventricular tachycardia, ventricular pre-excitation and cardiac dysrhythmias. It is a Class Ia antiarrhythmic drug.	CHRM1, ORM2, CHRM2, KCND2, KCND3, CHRM3, KCNH2, SCN5A	-0.6034871990397963	1.505083675484527	<0.0001
101	DB00421	Spironolactone	"Spironolactone is indicated for the treatment of New York Heart Association Class III-IV heart failure, management of edema in cirrhotic adults not responsive to fluid and sodium restrictions, primary hyperaldosteronism short-term preoperatively, primary hyperaldosteronism long-term in patients with aldosterone producing adrenal adenomas that are not candidates for surgery or patients with bilarteral micro/macronodular adrenal hyperplasia, as an add-on therapy in hypertension, and in nephrotic syndrome when treatment of the disease as well as fluid and sodium restriction with other diuretics is inadequate.[Label]

Spironolactone has antiandrogenic activity which leads to many of its off label uses. Spironolactone is used off label in the treatment of hirsutism, female pattern hair loss, and adult acne vulgaris.[A178135]

Spironolactone is also frequently used for its antiandrogenic effects in transgender female patients due to its low cost and reducing male-pattern hair growth.[A178138]"	SRD5A1, CACNG1, CYP17A1, NR1I2, NR3C1, NR3C2, PGR, SHBG, AR, CYP11B2	-0.5944973972355814	-1.770990983371225	<0.0001
102	DB05266	Ibudilast	For the treatment of multiple sclerosis, asthma, and cerebrovascular disease.	PDE4C, PDE4B, PDE4A, PDE3A, PDE4D	-0.5850765240123196	-1.5706534571114912	<0.0001
103	DB06195	Seliciclib	Investigated for use/treatment in breast cancer, lung cancer, lymphoma (unspecified), multiple myeloma, leukemia (lymphoid), and cancer/tumors (unspecified).	CSNK1E, CDK9, MAPK1, CDK1, CDK7, MAPK3, CDK2	-0.579325480457419	-1.9530275641262342	<0.0001
104	DB01205	Flumazenil	For the complete or partial reversal of the sedative effects of benzodiazepines in cases where general anesthesia has been induced and/or maintained with benzodiazepines, and where sedation has been produced with benzodiazepines for diagnostic and therapeutic procedures. Also for the management of benzodiazepine overdose as an adjunct for appropriate supportive and symptomatic measures.	GABRA1, GABRG2, GABRA5	-0.5700324328201015	-1.4150702887730349	<0.0001
105	DB00630	Alendronic acid	Alendronic acid is indicated for the treatment and prevention of osteoporosis in men and postmenopausal women, treatment of glucocorticoid-induced osteoporosis, and Paget's disease of bone[FDA Label][A959,A176750]. However, alendronic acid is not indicated for use in pediatric populations or patients with a creatinine clearance <35mL/min[FDA Label].	PTPN4, FDPS, PTPRE, ATP6V1A, PTPRS	-0.5691267172573998	-1.688493610962546	<0.0001
106	DB13956	Estradiol valerate	"Estradiol valerate is commercially available as an intramuscular injection as the product Delestrogen and is indicated for the treatment of moderate to severe vasomotor symptoms and vulvovaginal atrophy due to menopause, for the treatment of hypoestrogenism due to hypogonadism, castration or primary ovarian failure, and for the treatment of advanced androgen-dependent carcinoma of the prostate (for palliation only). 

Estradiol valerate is also available in combination with [DB09123] as the commercially available product Natazia used for the prevention of pregnancy and for the treatment of heavy menstrual bleeding."	BECN1, MT-ATP6, GPER1, NCOA2, ESR1, NR1I2, ESR2, HSD17B2, ESRRG, CHRNA4	-0.560310479471915	1.6159600321421559	<0.0001
107	DB12742	Amuvatinib	Amuvatinib is a selective multi-targeted tyrosine kinase inhibitor that suppresses c-MET, c-RET and the mutant forms of c-KIT, PDGFR and FLT3. Amuvatinib also suppresses Rad51 protein, a critical component of double-stranded DNA repair in cancer cells.	FLT3, KIT, RAD51, MET, RET, PDGFRA	-0.5199667726690411	-2.4126502870699436	<0.0001
108	DB06080	Linifanib	Investigated for use/treatment in leukemia (myeloid), myelodysplastic syndrome, and solid tumors.	FLT4, FLT3, CSF1R, KDR, FLT1, KIT	-0.5199667726690411	1.3241580526902208	<0.0001
109	DB03374	3,5-Diiodotyrosine		PRSS1, IYD, PKIA, PRKACA	-0.5077526092425236	-1.8795290594713854	<0.0001
110	DB00159	Icosapent	EPA can be used for lowering elevated triglycerides in those who are hyperglyceridemic. In addition, EPA may play a therapeutic role in patients with cystic fibrosis by reducing disease severity and may play a similar role in type 2 diabetics in slowing the progression of diabetic nephropathy.	PPARD, PPARA, PTGS2, ACSL4, FFAR1, FABP7, TRPV1, PTGS1, PPARG, FADS1, SLC8A1	-0.48706114135457	1.799933158917126	<0.0001
111	DB01645	Genistein	Currently Genistein is being studied in clinical trials as a treatment for prostate cancer.  	ESRRA, AKT1, NCOA2, GPER1, ESR2, ESR1, NR1I2, PTK2B, ESRRB, CYP1B1, TOP2A, NCOA1, SHBG	-0.48450038295729	-1.9173651756923158	<0.0001
112	DB01248	Docetaxel	For the treatment of patients with locally advanced or metastatic breast cancer after failure of prior chemotherapy. Also used as a single agent in the treatment of patients with locally advanced or metastatic non-small cell lung cancer after failure of prior platinum-based chemotherapy. It is also used in combination with prednisone, in the treatment of patients with androgen independent (hormone refractory) metastatic prostate cancer. Furthermore, docetaxel has uses in the treatment of gastric adenocarinoma and head and neck cancer. 	MAP2, MAP4, NR1I2, BCL2, MAPT, TUBB1	-0.459233711064372	1.4415128060481335	<0.0001
113	DB00508	Triflupromazine	Used mainly in the management of psychoses. Also used to control nausea and vomiting.	CHRM1, DRD1, CHRM2, HTR2B, DRD2	-0.44691914604369354	1.482434204651135	<0.0001
114	DB01103	Quinacrine	For the treatment of giardiasis and cutaneous leishmaniasis and the management of malignant effusions.	PLCL1, PLA2G4A, PLA2G6	-0.44430457678765445	1.5724229261024059	<0.0001
115	DB00836	Loperamide	For the control and symptomatic relief of acute nonspecific diarrhea and of chronic diarrhea associated with inflammatory bowel disease or gastroenteritis. Also used for reducing the volume of discharge from ileostomies.	OPRD1, CALM1, OPRK1, OPRM1, NR1I3, POMC, CACNA1A	-0.44292028639202113	1.8994305673670866	<0.0001
116	DB00622	Nicardipine	Used for the management of patients with chronic stable angina and for the treatment of hypertension.	CHRM1, PDE1A, CALM1, CACNA1C, CACNA1D, CHRM2, CHRM4, CACNB2, CACNA2D1, ADRA1A, PDE1B, CHRM5, ADRA1B, CHRM3, ADRA1D	-0.4257426022799341	2.3560836955594797	<0.0001
117	DB00608	Chloroquine	"Chloroquine is indicated to treat infections of _P. vivax_, _P. malariae_, _P. ovale_, and susceptible strains of _P. falciparum_.[L12051] It is also used to treat extraintestinal amebiasis.[L12051]

Chloroquine is also used off label for the treatment of rheumatic diseases,[A191655] as well as treatment and prophylaxis of Zika virus.[A191649,A191652] Chloroquine is currently undergoing clinical trials for the treatment of COVID-19.[A191631]"	ACE2, TLR9, GSTA2, GSTM1, HMGB1, TNF	-0.42437350807189794	-1.570378999162031	<0.0001
118	DB01254	Dasatinib	For the treatment of adults with chronic, accelerated, or myeloid or lymphoid blast phase chronic myeloid leukemia with resistance or intolerance to prior therapy. Also indicated for the treatment of adults with Philadelphia chromosome-positive acute lymphoblastic leukemia with resistance or intolerance to prior therapy.	STAT5B, PPAT, SRC, YES1, LCK, ABL1, EPHA5, CSK, HSPA8, KIT, FYN, NR4A3, ABL2, LYN, EPHA2, BTK, MAPK14, FRK, EPHB4, BCR, FGR, MAP3K20, PDGFRB	-0.4124247920135403	-2.08689999103745	<0.0001
119	DB00412	Rosiglitazone	Rosiglitazone is indicated as an adjunct to diet and exercise to improve glycemic control in adults with type 2 diabetes mellitus. 	PPARD, RXRB, RXRG, ACSL4, PPARG, PPARA, RXRA	-0.4072969504132006	2.068350938044809	<0.0001
120	DB08901	Ponatinib	Ponatinib is indicated for the treatment of adult patients with chronic phase, accelerated phase, or blast phase chronic myeloid leukemia (CML) that is resistant or intolerant to prior tyrosine kinase inhibitor therapy or Philadelphia chromosome positive acute lymphoblastic leukemia (Ph+ALL) that is resistant or intolerant to prior tyrosine kinase inhibitor therapy.	FGFR3, BCR, KIT, ABL1, FLT3, LYN, TEK, FGFR2, KDR, FGFR1, FGFR4, SRC, LCK, RET, PDGFRA	-0.3812101938994475	-2.5627258401509625	<0.0001
121	DB01268	Sunitinib	For the treatment of advanced renal cell carcinoma as well as the treatment of gastrointestinal stromal tumor after disease progression on or intolerance to imatinib mesylate.	FLT4, FLT3, CSF1R, KDR, FLT1, KIT, PDGFRB, PDGFRA	-0.34513681301660143	-2.2822402185823196	<0.0001
122	DB00940	Methantheline	For the treatment of peptic ulcer disease, irritable bowel syndrome, pancreatitis, gastritis, biliary dyskinesia, pylorosplasm, and reflex neurogenic bladder in children.	CHRM1, CHRM2, CHRM5, HRH2, CHRM3, CHRM4	-0.34254044404629164	1.6515225945509253	<0.0001
123	DB00835	Brompheniramine	For the treatment of the symptoms of the common cold and allergic rhinitis, such as runny nose, itchy eyes, watery eyes, and sneezing.	CHRM1, CHRM2, CHRM5, CHRM3, CHRM4, HRH1	-0.34254044404629164	1.2890744680398323	<0.0001
124	DB01069	Promethazine	Promethazine tablets and suppositories are indicated to treat rhinitis, allergic conjunctivitis, allergic reactions to blood or plasma, dermographism, anaphylactic reactions, sedation, nausea, vomiting, pain, motion sickness, and allergic skin reactions.[A189907,L4000] Promethazine cough syrup with phenylephrine and codeine is indicated to relieve cough and upper respiratory symptoms, and nasal congestion associated with allergy or the common cold.[L11326]	CHRM1, CALM1, CHRM2, DRD2, ADRA1A, CHRM5, CHRM3, HRH2, CHRM4, HRH1, SCN1A	-0.3376867405222245	-1.5841060166352892	<0.0001
125	DB01118	Amiodarone	"The FDA approved indications for amiodarone are recurrent ventricular fibrillation (VF)
and recurrent hemodynamically unstable ventricular tachycardia (VT). The FDA emphasizes that this drug should only be given in these conditions when they are clinically documented and have not responded to normal therapeutic doses of other antiarrhythmic agents, or when other drugs are not tolerated by the patient.[L3561]

Off-label indications include atrial fibrillation and supraventricular tachycardia.[A189666,A189720,A189723,L11286]"	CACNA1I, CACNA1C, KCNH2, ADRB1, PPARGC1B, PPARG, PPARA	-0.3316630665698242	-2.323494249593631	<0.0001
126	DB01054	Nitrendipine	For the treatment of mild to moderate hypertension	CACNA2D2, CACNA1S, CACNA1H, CACNA1C, CACNA1D, CACNA2D1, CACNB2	-0.3316630665698242	-1.4980535577285548	<0.0001
127	DB00482	Celecoxib	"Celecoxib is indicated for symptomatic treatment of adult osteoarthritis (OA) and adult rheumatoid arthritis (RA).[L7646] Celecoxib is not a substitute for aspirin for cardiovascular event prophylaxis.[L7646] 

It may be also be used to treat acute pain from various sources, juvenile rheumatoid arthritis in children over 2, ankylosing spondylitis, and primary dysmenorrhea.[L7646]

Celecoxib, in combination with [tramadol], is indicated for the management of acute pain in adults severe enough to require an opioid analgesic and in whom alternative treatments are inadequate.[L38949]"	PDPK1, PTGS2, CA3, CA2, CDH11	-0.30790666443422254	-1.9715728236802519	<0.0001
128	DB02659	Cholic Acid	Oral cholic acid is indicated for: treatment of bile acid synthesis disorders due to single enzyme defects; and as adjunctive treatment of peroxisomal disorders including Zellweger spectrum disorders in patients who exhibit manifestations of liver disease, steatorrhea or complications from decreased fat soluble vitamin absorption. 	COX4I1, COX8A, COX7C, NR1H4, COX7A1, PLA2G1B, COX7B, MT-CO2, FECH, CES1, MT-CO1, ADH1C, MT-CO3, FABP6, COX6C, GPBAR1, COX6B1, ESRRG, COX5A, COX5B, COX6A2	-0.3051728656156405	1.6049633772391443	<0.0001
129	DB00619	Imatinib	For the treatment of Philadelphia chromosome positive chronic myeloid leukemia (Ph+ CML), Ph+ acute lymphoblastic leukaemia, myelodysplastic/myeloproliferative diseases, aggressive systemic mastocytosis, hypereosinophilic syndrome and/or chronic eosinophilic leukemia (CEL), dermatofibrosarcoma protuberans, and malignant gastrointestinal stromal tumors (GIST).	BCR, KIT, ABL1, CSF1R, DDR1, NTRK1, RET, PDGFRB, PDGFRA	-0.2868601597991215	2.1766658839265007	<0.0001
130	DB00783	Estradiol	"Estradiol is indicated in various preparations for the treatment of moderate to severe vasomotor symptoms and vulvar and vaginal atrophy due to menopause, for the treatment of hypoestrogenism due to hypogonadism, castration, or primary ovarian failure, and for the prevention of postmenopausal osteoporosis. It is also used for the treatment of breast cancer (only for palliation therapy) in certain men or women with metastatic disease, and for the treatment of androgen-dependent prostate cancer (only for palliation therapy).[L11485,L11494,L11497] It is also used in combination with other hormones as a component of oral contraceptive pills for preventing pregnancy (most commonly as [DB00977], a synthetic form of estradiol).

**A note on duration of treatment**

Recommendations for treatment of menopausal symptoms changed drastically following the release of results and early termination of the Women's Health Initiative (WHI) studies in 2002 as concerns were raised regarding estrogen use.[A31626] Specifically, the combined estrogen–progestin group was discontinued after about 5 years of follow up due to a statistically significant increase in invasive breast cancer and in cardiovascular events.[A31627] 

Following extensive critique of the WHI results, Hormone Replacement Therapy (HRT) is now recommended to be used only for a short period (for 3-5 years postmenopause) in low doses, and in women without a history of breast cancer or increased risk of cardiovascular or thromboembolic disease.[A31628] Estrogen for postmenopausal symptoms should always be given with a progestin component due to estrogen's stimulatory effects on the endometrium; in women with an intact uterus, unopposed estrogen has been shown to promote the growth of the endometrium which can lead to endometrial hyperplasia and possibly cancer over the long-term. 

"	BECN1, MT-ATP6, GPER1, ESR1, NR1I2, ESR2, CHRNA4	-0.2679842283338617	-1.7872246839872505	<0.0001
131	DB02010	Staurosporine		CHRM1, PIK3CG, SYK, PDPK1, PIM1, CSK, ITK, GSK3B, PRKCQ, MAPKAPK2, LCK, CDK2, ZAP70	-0.24301703919817833	-1.8314527961292388	<0.0001
132	DB06589	Pazopanib	Treatment of advanced renal cell cancer and advanced soft tissue sarcoma (in patients previously treated with chemotherapy) 	FGFR3, SH2B3, FLT4, KDR, ITK, FGF1, FLT1, KIT, PDGFRB, PDGFRA	-0.24023883722513759	2.4307123427778974	<0.0001
133	DB02709	Resveratrol	Being investigated for the treatment of Herpes labialis infections (cold sores).	CLEC14A, AHR, ITGB3, MTNR1B, CSNK2A1, PPARG, AKT1, ALOX15, ITGA5, ALOX5, APP, PTGS1, MTNR1A, KHSRP, ESR1, PI4K2B, NR1I3, YARS1, PTGS2, NQO2, SLC2A1, SNCA, NR1I2, CBR1, SIRT1, PPARA	-0.22938984607501758	2.5190902004861777	<0.0001
134	DB01088	Iloprost	Used for the treatment of pulmonary arterial hypertension.	PLAT, PTGDR2, PDE4C, PDE4B, PDE4A, PDE4D, PTGER1, PTGIR	-0.20879014299782106	2.1121888928793635	<0.0001
135	DB11800	Tivozanib	Tivozanib is approved in the USA for the treatment of relapsed or refractory renal cell carcinoma in adult patients who have undergone two or more systemic therapies.[L32524] In the UK and other countries,  is indicated as first line therapy of adults with advanced renal cell carcinoma (RCC) and VEGFR and mTOR pathway inhibitor-naïve patients after disease progression following one previous treatment with cytokine therapy for advanced disease.[L17180] 	PTK6, FLT4, FLT3, MET, TEK, KDR, FGFR1, FLT1, KIT, PDGFRB, PDGFRA	-0.2020941187555144	-2.5459004855699616	<0.0001
136	DB01115	Nifedipine	Nifedipine capsules are indicated to treat vasospastic angina and chronic stable angina.[L11383] Extended release tablets are indicated to treat vasospastic angina, chronic stable angina, and hypertension.[L11389,L1245]	CACNA1G, CACNA1S, CALM1, CACNA1C, CACNA1D, NR1I2, KCND3, CACNB2	-0.17816076522389696	-1.6950110366899784	<0.0001
137	DB04447	1,4-Dithiothreitol		PPIB, TPI1, MSRA, GSTZ1, AXIN1, LGALS1, CAMK2A, TRPM7, ALDH1A1, HMGCR	-0.1286594160537805	2.287903206765605	<0.0001
138	DB00747	Scopolamine	Scopolamine is indicated in adult patients for the prevention of nausea and vomiting associated with motion sickness and for the prevention of postoperative nausea and vomiting (PONV) associated with anesthesia or opiate analgesia.[L31578]	SI, CHRM1, CHRM2, CHRNB2, CHRNA4, CHRM5, CHRM3, CHRM4	-0.12244178176742979	1.7691728654934025	<0.0001
139	DB04216	Quercetin		UGT3A1, PIK3CG, RUVBL2, AHR, ATP5F1B, CYP1B1, UBA1, ACTB, CSNK2A1, ESR2, CEBPB, HIBCH, SF3B3, SHBG, HSP90AA1, ESR1, HSPA2, ATP5F1C, ATP5F1A, PIM1, NQO2, NR1I2, STK17B, HCK, EIF3F, CSNK2B, CBR1	-0.11640325427730755	1.6144494703598955	<0.0001
140	DB00132	alpha-Linolenic acid	For nutritional supplementation and for treating dietary shortage or imbalance.	PPARD, ELOVL2, SLC8A1, NR1H4, FADS2, ELOVL5, TRPV1, FADS1, PPARG, PPARA, RXRA	-0.11373840367480378	-1.3673277738568905	<0.0001
141	DB01239	Chlorprothixene	For treatment of psychotic disorders (e.g. schizophrenia) and of acute mania occuring as part of bipolar disorders.	DRD1, DRD3, CHRM1, CHRM2, DRD2, HTR1A, HTR2A, CHRM5, CHRM3, CHRM4, HRH1	-0.10531612132492375	-1.3196495474818877	<0.0001
142	DB00313	Valproic acid	"**Indicated** for:[Label] 

1) Use as monotherapy or adjunctive therapy in the management of complex partial seizures and simple or complex absence seizures. 

2) Adjunctive therapy in the management of multiple seizure types that include absence seizures. 

3) Prophylaxis of migraine headaches.

4) Acute management of mania associated with bipolar disorder.


**Off-label** uses include:
 
1) Maintenance therapy for bipolar disorder.[A177919]

2) Treatment for acute bipolar depression.[A177928,A177931,A177934]

3) Emergency treatment of status epilepticus.[A177955]"	HDAC9, ALDH5A1, PPARA, PPARD, HDAC2, ACADSB, PPARG, OGDH, SCN1A	-0.10465546863376092	-1.6351217691583788	<0.0001
