	DrugBank_ID	DrugBank_Name	Indication	Targets	Proximity	Normalized_Enrichment_Score	FDR
143	DB00162	Vitamin A	For the treatment of vitamin A deficiency.	DHRS4, RDH8, RDH12, RDH13, RDH11, LRAT, DHRS3, ALDH1A3, RDH14, RDH5, ALDH1A2, PTGDS, RETSAT, ALDH1A1, APOD	-0.08905054761008964	1.8512940403994274	<0.0001
144	DB01131	Proguanil	For the causal prevention and suppression of malaria caused by susceptible strains of <i>P. falciparum</i> and other species of Plasmodium found in some geographical areas of the world.	DHFR	-3.987996358510278	1.3010556076182003	0.0005124246558132676
145	DB01428	Oxybenzone	Used as an ingredient in sunscreen and other cosmetics.	AR, ESR1, ESR2, PGR	-1.2262609745214854	-1.2869136711657954	0.000649819918112601
146	DB00717	Norethisterone	"Norethisterone is indicated as an oral contraceptive when given as monotherapy[L9527] or in combination with an estrogen component, such as [ethinylestradiol] or [estradiol].[L10313,L10307] In combination with an estrogen component, oral norethisterone is also indicated as a hormone replacement therapy in the treatment of postmenopausal osteoporosis and moderate-to-severe vasomotor symptoms arising from menopause.[L10304] When applied via transdermal patch, the combination of norethisterone and estradiol is indicated for the treatment of hypoestrogenism, vulvovaginal atrophy, and moderate-severe vasomotor symptoms.[L10301]

Norethisterone, taken in combination with intramuscular [leuprolide], is also indicated for the symptomatic treatment of endometriosis-related pain.[L10310]"	AR, NR3C1, PGR	-1.6947989880088863	1.3152295691318447	0.0007683199717695467
147	DB07996	5-(2-methylpiperazine-1-sulfonyl)isoquinoline		PKIA, PRKACA	-1.1948582844257651	1.3126705769616749	0.0009156587229676931
148	DB02918	Zardaverine		PDE4D	-3.6427948838244686	1.300808969661182	0.0013649179469682434
149	DB06780	Desoxycorticosterone acetate		NR3C2	-3.3706999604872125	-1.282459578075484	0.002281165627450688
150	DB11064	Homosalate	As ingredient in many sunscreen for protection against sunburn, skin aging and skin cancer. 	AR, ESR1, PGR	-1.6947989880088863	1.2629815579815544	0.004637706641924975
151	DB00704	Naltrexone	Used as an adjunct to a medically supervised behaviour modification program in the maintenance of opiate cessation in individuals who were formerly physically dependent on opiates and who have successfully undergone detoxification. Also used for the management of alcohol dependence in conjunction with a behavioural modification program.	OPRK1, OPRD1, SIGMAR1, OPRM1	-0.9096253006415752	1.2168530273156766	0.007515885633308563
152	DB01231	Diphenidol	For use in the prevention and symptomatic treatment of peripheral (labyrinthine) vertigo and associated nausea and vomiting that occur in such conditions as Meniere's disease and surgery of the middle and inner ear. Also for the control of nausea and vomiting associated with postoperative states, malignant neoplasms, labyrinthine disturbances, antineoplastic agent therapy, radiation sickness, and infectious diseases.	CHRM1, CHRM2, CHRM3	-0.8644339540333009	1.2459715221431913	0.007719058446458954
153	DB00332	Ipratropium	"Inhaled ipratropium is indicated in combination with inhaled beta-agonist systemic corticosteroids for the management of severe exacerbations of asthma flares requiring treatment.[A176939]

Asthma exacerbations are characterized by a progressive increase in one or more of asthma symptoms accompanied by a decrease in expiratory flow.[L5900]

As a single agent, ipratropium was indicated for the symptomatic relief of rhinorrhea associated with the common cold or seasonal allergic rhinitis for patients 5 years or older. It does not alleviate nasal congestion nor sneezing.[FDA label]

Rhinorrhea refers to recurrent or chronic watery nasal discharge. This condition is debilitating and its pathogenesis and etiology is complex and not very well understood presenting very substantial cost burden.[L5903]

Additionally, ipratropium is indicated as a bronchodilator for maintenance treatment of bronchospasm associated with chronic obstructive pulmonary disease including chronic bronchitis and emphysema.[FDA label]

The chronic obstructive pulmonary disease includes a large number of conditions characterized by breathlessness. As this includes several conditions, the etiology, symptoms, and treatments are diverse.[L5906]

Ipratropium has also been studied to be used for the treatment of sialorrhea.[A176942]

Sialorrhea is a common symptom that accompanies different neurologic conditions and it is characterized by drooling or excessive salivation.[A176963]"	CHRM1, CHRM2, CHRM3	-0.8644339540333009	1.1970641639758164	0.007835842009959256
154	DB05424	Canertinib	Investigated for use/treatment in breast cancer and lung cancer.	EGFR	-5.8760305630450125	1.2370937602114622	0.011114164602483313
155	DB00794	Primidone	Primidone is commonly indicated for the management of grand mal, psychomotor, and focal epileptic seizures.[L4645,L11112] In addition, it has also been studied and utilized as an effective management of essential tremor.[A39414,A39415,L4645]	GRIA2, GRIK2, CHRNA7, GABRA1, CHRNA4, GABRA2, GABRA6, GABRA4, GABRA3, GABRA5	-0.8028173322164315	1.2160865254681876	0.021971885155391363
156	DB00700	Eplerenone	For improvement of survival of stable patients with left ventricular systolic dysfunction (ejection fraction <40%) and clinical evidence of congestive heart failure after an acute myocardial infarction.	NR3C2	-3.3706999604872125	-1.1810208996906058	0.022450551232166018
157	DB01119	Diazoxide	Used parentally to treat hypertensive emergencies. Also used to treat hypoglycemia secondary to insulinoma.	KCNJ11, ATP1A1, KCNMA1, CA2, CA1	-0.3083801883498997	1.2087649186801055	0.02269642306532305
158	DB01023	Felodipine	For the treatment of mild to moderate essential hypertension. 	CACNA2D2, CACNA1S, CACNA1H, PDE1A, CALM1, CACNA1C, CACNA1D, TNNC2, CACNA2D1, CACNB2, NR3C2, PDE1B, TNNC1	-0.5510413178912554	1.1298285879078023	0.025076851336239877
159	DB00436	Bendroflumethiazide	For the treatment of high blood pressure and management of edema related to heart failure.	CA4, SLC12A3, KCNMA1, CA2, CA1	-0.3083801883498997	-1.1588520953313914	0.026200188550247985
160	DB01229	Paclitaxel	Used in the treatment of Kaposi's sarcoma and cancer of the lung, ovarian, and breast. Abraxane® is specfically indicated for the treatment of metastatic breast cancer and locally advanced or metastatic non-small cell lung cancer.	MAP2, MAP4, NR1I2, BCL2, MAPT, TUBB1	-0.459233711064372	-1.1664657425076126	0.030824209321525693
161	DB02052	Indirubin-3'-monoxime		AHR, GSK3B, CDK5R1, CDK1, CDK5, CDK2	-1.4483443593249128	-1.1238498928438632	0.0320480305803438
162	DB07423	Andarine		AR	-5.443103095908095	1.1108479474889952	0.04832424419365688
163	DB00281	Lidocaine	Lidocaine is an anesthetic of the amide group indicated for production of local or regional anesthesia by infiltration techniques such as percutaneous injection and intravenous regional anesthesia by peripheral nerve block techniques such as brachial plexus and intercostal and by central neural techniques such as lumbar and caudal epidural blocks [F4349, L5930].	SCN10A, ORM2, ORM1, SCN9A, EGFR, SCN5A, SCN4A	-0.6857017382001008	-1.1293163039279903	0.07942298225529479
164	DB01183	Naloxone	"Naloxone nasal sprays are indicated for the emergency treatment of an opioid overdose or suspected opioid overdose.[L33694] Intramuscular, intravenous, and subcutaneous injections are indicated for complete or partial reversal of opioid depression, diagnosis of known or suspected opioid overdose, and as an adjunct therapy in the treatment of septic shock.[L33739]

Sublingual tablets and films are formulated with [buprenorphine] for the treatment of opioid dependence.[L33714,L33719] Naloxone is also formulated with [pentazocine] as an oral tablet for severe pain.[L33744]

Naloxone has been used off-label for the treatment of neuraxial opioid-induced pruritus.[A234604]"	OPRD1, OPRK1, ESR1, TLR4, CES1, OPRM1, CREB1	-0.44292028639202113	-1.1353975007840589	0.08324566413177431
165	DB08162	Fasudil		ROCK1, ROCK2, PKIA, PRKACA	-2.652090186095962	1.0965442603636484	0.08425293287843483
166	DB08916	Afatinib	"Afatinib is a kinase inhibitor indicated as monotherapy [L2937] for the first-line [FDA Label] treatment of (a) Epidermal Growth Factor Receptor (EGFR) TKI (tyrosine kinase inhibitor)-naive adult patients with locally advanced or metastatic non-small cell lung cancer (NSCLC) whose tumours have non-resistant EGFR mutations as detected by an FDA-approved test [FDA Label], and (b) adult patients with locally advanced or metastatic NSCLC of squamous histology progressing on or after platinum-based chemotherapy [FDA Label, L2937].

Recently, as of January 2018, the US FDA approved a supplemental New Drug Application for Boehringer Ingelheim's Gilotrif (afatinib) for the first line treatment of patients with metastatic non-small cell lung cancer (NSCLC) whose tumors have non-resistant epidermal growth factor receptor (EGFR) mutations as detected by an FDA-approved test [L2939]. The new label includes data on three additional EGFR mutations: L861Q, G719X and S768I [L2939]."	EGFR, ERBB2, ERBB4	-3.352632744498327	1.084035364249269	0.08436876603020804
167	DB07594	CCT-018159		HSP90AA1, HSP90AB1	-2.636441970236284	1.13550672849288	0.09525823254540426
168	DB07997	N-[2-(METHYLAMINO)ETHYL]-5-ISOQUINOLINESULFONAMIDE		PKIA, PRKACA	-1.1948582844257651	1.0632383162592673	0.10300325430032543
169	DB13954	Estradiol cypionate	Depo-Estradiol intramuscular depot injection is indicated for the treatment of moderate to severe vasomotor symptoms and hypoestrogenism due to hypogonadism.	BECN1, MT-ATP6, GPER1, NCOA2, ESR1, NR1I2, ESR2, HSD17B2, ESRRG, CHRNA4	-0.560310479471915	1.1056381155561483	0.13263454342100714
170	DB00342	Terfenadine	For the treatment of allergic rhinitis, hay fever, and allergic skin disorders.	CHRM1, CHRM2, CHRM5, CHRM3, KCNH2, CHRM4, HRH1	-0.2679842283338617	1.0931238633139377	0.13658958146789885
171	DB00615	Rifabutin	For the prevention of disseminated <i>Mycobacterium avium</i> complex (MAC) disease in patients with advanced HIV infection.	HSP90AA1, HSP90B1	-2.382614113520467	1.1051939177781211	0.18106035034830908
172	DB00243	Ranolazine	"Ranolazine is indicated for the treatment of chronic angina. It can be used alone or in conjunction with nitrates, beta-blockers, angiotensin receptor blockers, anti-platelet drugs, calcium channel blockers, lipid-lowering drugs, and ACE inhibitors.[L3580]

Ranolazine has also been used off-label for the treatment of certain arrhythmias, including ventricular tachycardia, however, this use is not strongly  supported by scientific evidence.[A174940] Ranolazine has also been studied for the treatment of acute coronary syndrome, microvascular coronary dysfunction, arrhythmia, and glycemic control, which are not yet approved indications.[A174898,L3580]"	CACNA1C, KCNJ12, ADRA1A, ADRB1, SCN1A	-1.0472848818081026	1.064251336294952	0.23811362921855134
