GO_ID	Name	Gene Count	Gene Ratio	Fold Enrichment	p-value	FDR	-log10 FDR	FWER	Associated Genes
GO:0050811	GABA receptor binding	14	0.0031481897908702495	3.60222871848687	5.882748776769733e-07	5.971615832759233e-05	4.223908139171949	0.0028066594413968396	PLCL2, GABRA5, JAKMIP1, GABARAP, GABARAPL1, LHFPL4, PPP2CA, AKAP5, ERBB4, TRAK2, CLPTM1, GABRB1, ARFGEF2, GABARAPL2
GO:0048156	tau protein binding	26	0.005846638183044749	2.736758182227038	7.454086384519348e-08	9.878735039039391e-06	5.005298662774349	0.0003556344614054181	ACTB, DYRK1A, CREBBP, TTBK2, MAP2, CLU, PPP2CB, TAOK1, HSP90AB1, PPP2R2A, GSK3B, ROCK1, PRKAA1, PICALM, FYN, EP300, HSP90AA1, ROCK2, MARK1, MARK3, MARK2, SNCA, PPP2CA, SMAD2, MAP1A, DCTN1
GO:0019888	protein phosphatase regulator activity	26	0.005846638183044749	2.6759413337331033	1.402508591537672e-07	1.715735510314419e-05	4.765549660114438	0.0006691368490226233	PPP2R2C, PPP4R2, PPP1R16B, PPP2R1B, PPP2R3A, PPP1R10, PPP4R3A, PPP1R7, WBP11, ARPP19, PPP6R2, PPP1R1B, PPP2R2A, EIF2AK2, PPP6R3, SHOC2, PPP2R5E, ENSA, PPP2R1A, PPP4R3B, PPP2R2B, ANKLE2, PPP4R4, PPP2R5C, SET, ANKRD28
GO:0048487	beta-tubulin binding	24	0.005396896784348999	2.5849880504756273	1.0127466865913258e-06	9.663628883454431e-05	4.0148597568026885	0.004831814441727215	GABARAPL1, PACRG, SYT11, GABARAPL2, IFT74, TBCA, TAOK1, GABARAP, EML4, SPAST, CDK5R1, APPL1, ADNP, HTT, BCAS3, NDEL1, TTLL7, LRPPRC, TBCD, FGF13, SMC3, VAPB, SNCA, ARL8B
GO:0019003	GDP binding	32	0.007195862379131999	2.3524758977873437	5.250976631846575e-07	5.446175980552176e-05	4.263908329549868	0.002505240951054001	RAB7A, ARL2, RHEB, RAN, RERG, RAB2A, RHOT1, GNAI3, RALA, DYNC1LI1, RAB12, RAB21, RAB10, RAP2A, SRP54, GNAI1, RAB5A, RAB27A, TRIM23, RAB27B, ARL3, RAB18, RRAGD, RAB14, RAP2B, RAB28, RAB9B, KRAS, DNM1, ARL8B, RAB8B, RAB22A
GO:0030165	PDZ domain binding	40	0.008994827973915	2.2320177945873896	1.0942989304388306e-07	1.3739211045062267e-05	4.862038205312387	0.0005220900197123661	CLCN3, SHISA6, CADM1, SHISA9, LIN7C, ERC1, GRM7, BAIAP2, SDC2, ATP2B4, LNX2, FZD3, LNX1, CFTR, ADRB1, ACVR2A, PLEKHA1, PRKN, CCDC88C, CRIPT, CACNG3, DOCK4, DLG4, CIT, GRIA1, KIDINS220, PTEN, CXADR, RAPGEF2, GRIK2, EXOC4, CRIM1, NLGN1, NSF, ATP2B2, PLEKHA2, GRID2, SSTR2, ADAM17, ACOX1
GO:0003725	double-stranded RNA binding	36	0.0080953451765235	2.1938385428378684	7.334858526509143e-07	7.290543756244817e-05	4.137240079153917	0.003499461002997512	ADARB1, ILF3, AGO4, MBNL1, TUBA1B, RC3H2, STRBP, PRKRA, DHX9, EIF4A1, HNRNPU, ZFR2, ZFR, HSP90AB1, HSPD1, ADAR, MTDH, EIF2AK2, LSM14A, STAU1, RC3H1, DHX30, DHX36, AGO3, SUPV3L1, PRKRIP1, LRRFIP1, HMGB1, DICER1, DHX15, AGO1, APTX, CLTC, DDX1, STAU2, ACTN1
GO:0003730	mRNA 3'-UTR binding	44	0.0098943107713065	2.0584164105639258	4.256979131586599e-07	4.7232668457673645e-05	4.325757517821443	0.0020310047436799664	CIRBP, RNPS1, QKI, LARP4, CPEB2, ANGEL2, UTP23, SECISBP2L, HNRNPA2B1, CELF1, HNRNPU, RBM4, PARN, CARHSP1, CPEB3, PUM1, PABPC1, CPEB1, TAF15, ZC3H14, TARDBP, SECISBP2, HNRNPA3, FXR1, FUS, SERBP1, DDX5, RPL5, CELF2, RC3H1, AUH, DHX36, LRPPRC, NOVA1, LARP1, HNRNPC, CPEB4, PUM2, RBMS3, FUBP1, FUBP3, ELAVL3, FMR1, LARP4B
GO:0003712	transcription coregulator activity	63	0.014166854058916123	2.0262536541488645	2.511279048519976e-09	4.279040121603145e-07	6.368653641417642	1.1981312340488804e-05	SND1, KAT7, AFF4, NRIP1, NCOA2, LDB2, NFKB1, CREBBP, DHX9, RYBP, THRAP3, YAF2, MED6, EWSR1, TRRAP, ATF7IP, CAMTA1, TAF15, AEBP2, PIR, KAT6A, KDM3B, MTDH, KAT6B, FUS, KDM2A, PPARGC1B, PHF8, MED14, SUPT20H, NPAT, MED21, TP53BP1, ATF7IP2, PIAS2, EP300, MED13L, TCERG1, JMJD1C, TDG, BCLAF3, NSD1, CNOT2, MED4, MED12L, LMO4, MED15, AKIRIN1, NFKBIZ, HCFC2, DDX1, BTAF1, BCLAF1, DPF2, BRD4, MED17, MED13, BCL11A, CALCOCO1, KDM3A, BTG1, PHF10, PIAS1
GO:0106310	protein serine kinase activity	157	0.03530469979761637	2.0254473454922195	3.0940917630194192e-21	1.845238975170706e-18	17.73394738079106	1.476191180136565e-17	CDC42BPB, RPS6KA3, NLK, DYRK1A, MYO3A, CAMK4, CDK12, TTBK2, KALRN, MAP3K5, STK24, PAK1, MTOR, CDK7, PINK1, OXSR1, SGK3, PRKAA2, RPS6KA6, WNK2, LRRK2, STK38L, CSNK1A1, MAPK1, CIT, TAOK3, MAK, MAP2K4, RPS6KB1, MARK2, LATS1, CAMK2D, PRKCB, TLK2, TNIK, TRPM7, STK33, PRKG1, CAMK1G, RAF1, HIPK3, PAK5, CDK17, AAK1, PRKACB, PRKCE, CSNK1G3, PDPK1, SIK3, ULK4, STK4, MAP3K21, MINK1, TTN, HUNK, PIK3CB, CDKL2, ULK1, RPS6KA5, CDK19, PAK2, CAMK2A, EIF2AK3, WNK1, MARK1, CDKL5, PAK3, DSTYK, MAPK6, OBSCN, ULK2, MAPK9, DAPK1, SGK1, PKN2, SNRK, AATK, MAP3K4, MAP4K3, CSNK1G1, TAF1, GSK3B, MAPK8, EIF2AK2, MAP3K1, AKT3, ROCK1, PRKAA1, CLK4, DCLK3, PIK3CA, KSR2, ROCK2, CDC42BPA, PRKCG, ATR, SMG1, DCLK1, MAP3K7, UHMK1, CLK1, CDK13, CDK6, NEK1, MAP2K1, NEK4, HIPK4, PRKCH, CAMKK1, RPS6KC1, CDK14, STK39, VRK1, MAP3K9, NIM1K, CDK8, EIF2AK4, MAPK10, MAPKAPK5, TAOK1, NEK10, CAMK2B, MOK, NEK11, MAP3K13, TNNI3K, TBK1, MAP2K5, MAPK14, CASK, PRKDC, MAST3, PLK2, TRIO, CDKL1, MAP4K5, RPS6KA2, SIK2, CSNK2A1, PASK, DCLK2, MARK3, RIOK3, BRAF, CAMK1D, ATM, SLK, PGK1, LRRK1, SRPK2, PRKCA, TLK1, PRKCI, MAP3K2, HIPK1, PIKFYVE, LMTK2
GO:0004842	ubiquitin-protein transferase activity	110	0.024735776928266246	2.0216589746609985	4.024489496353839e-15	1.3714885276502976e-12	11.86280782086952	1.9200839387104166e-11	SHPRH, RNF115, AMFR, BIRC6, G2E3, PRPF19, UBE3A, UBE2K, TRIM23, UBE2D2, UBE4A, RCHY1, UBE2G2, HECTD1, WWP1, HERC3, CNOT4, RNF19A, HACE1, UBE2W, RNF141, HECW2, RMND5A, UBE2D3, ZNRF1, FANCL, KLHL13, KLHL20, RNF14, UBR5, HERC1, ANKIB1, TRIM71, FBXO9, UBE2E3, PELI1, UBE2G1, FBXW2, ZFP91, UBE3C, SMURF2, FBXO21, CBLB, RBX1, UBE2H, RNF144A, OBI1, RNF169, FBXL3, RNF103, ITCH, UHRF2, LNX1, RNF217, TRIM2, UBE2R2, UBR1, CUL2, RNF213, TRIM33, PRKN, PJA2, TRIP12, RBBP6, RLIM, HECTD2, FBXO22, UBR3, UBE4B, RNF130, RSPRY1, FBXL5, CBL, MALT1, RNF146, ARIH1, AREL1, XIAP, TTC3, COP1, WDSUB1, DZIP3, LNX2, TRIM37, CHFR, RNF2, CUL3, MDM2, HUWE1, FBXO10, TRIM24, LTN1, KLHL42, RC3H1, FBXO25, UBE2B, FBXO11, RNF13, CUL5, UBE2N, HECTD4, SMURF1, TRIM13, MIB1, HERC2, LMO7, FBXO3, HERC4, NEDD4L, UBE2E2
GO:0019904	protein domain specific binding	92	0.0206881043400045	1.928018990890193	1.6983490958023196e-11	3.52296675481429e-09	8.453091455106815	8.102823536072867e-08	CBX3, DIXDC1, NEFL, GRB2, YWHAE, RDX, BASP1, ACTN2, MAP3K5, YWHAG, STXBP1, ACSL3, THRA, RUNX2, RAB27A, GRIA1, FAF1, MLF1, DICER1, RAP2B, VAPA, IRS2, TOP1, PIANP, KCNN2, ETS2, SKP1, PIAS1, CNTLN, ZFYVE9, CALM3, MPP7, XPO1, HNRNPK, ENAH, KCNAB1, MBD2, YWHAZ, TRIM9, PRKAR2B, STMN3, SSX2IP, SRSF7, KHDRBS1, STX18, AJAP1, M6PR, ARF1, GPSM2, RAN, ARFIP1, YWHAQ, ITPR1, PPP3R1, RAB6A, PRKAR1A, TUBB, IQGAP1, ZMYND8, RAB27B, CEP68, OSBP, SNCA, EPB41L5, AP2A2, TFDP2, NFE2L1, DDX6, NCOA2, HSPA5, LIN7C, XPA, RABEP1, RFC1, RBMX, KPNB1, ARL1, MDM2, YWHAB, IST1, TRA2B, PRKDC, ICA1L, CNOT1, CNOT9, SCAMP1, HPCAL4, MYO1D, ICA1, YWHAH, NUMA1, TRPS1
GO:0042393	histone binding	72	0.016190690353047	1.9275344422621734	3.811170001661932e-09	5.86551357352551e-07	6.231693955861612	1.8183092077929078e-05	IPO7, MCM3AP, SUPT6H, CHD8, TBL1XR1, RBBP5, NPM1, APLF, SCMH1, CHD2, VRK1, SMARCC1, RBBP4, KDM5B, IPO9, YEATS2, UHRF2, RBBP7, KDM5A, UIMC1, SBNO1, RSF1, BRD7, SMARCA2, ATAD2B, L3MBTL4, NAP1L1, PWWP2A, SMARCA5, MYSM1, ZZEF1, ATAD2, SFMBT1, HDAC2, ATRX, L3MBTL1, BCAS3, BAZ1B, TP53BP1, PHF6, JAK2, USP49, NAP1L3, NBN, PHF14, NAP1L4, DNAJC9, APBB1, GLYR1, CHD6, TSPYL1, MLLT10, PTMA, RESF1, PRKCB, CHD4, SNCA, NAP1L2, SET, CHD1, INO80, TSPYL4, BRD4, TSPYL2, PHC1, PHC2, MBTD1, DNAJC2, MLLT3, PTMS, TNKS, PHC3
GO:0003729	mRNA binding	112	0.025185518326961996	1.914099392849112	1.7599434581893643e-13	4.664827910567476e-11	10.331164373111369	8.396690239021457e-10	CIRBP, NUP98, THOC2, HDLBP, ZC3H12B, EIF4A1, HNRNPR, DDX19A, KHDRBS2, ATXN2, STRAP, UPF3A, PTBP2, CSDE1, DDX3Y, HSP90AA1, RPL13A, SRRM2, RBFOX1, LUC7L2, SF3B1, STAU2, FMR1, YTHDF3, N4BP1, LSM8, ADARB1, PPP1R21, TPR, CELF5, PPHLN1, HNRNPK, CNBP, FXR1, NOVA2, PCBP3, MBD2, NCBP1, MECP2, RBM20, SRSF7, KHDRBS1, EIF4G3, RBFOX2, DDX25, XPO5, QKI, LUC7L3, SUPT5H, RC3H2, SCAF8, DHX9, SRSF10, PKM, ZNF638, PABPC1, CELF4, DDX17, RBM25, TSN, YTHDC1, CDC40, MRPL1, EIF3A, EIF2A, RBM14, NUDT21, DHFR, PEG10, LRPPRC, SF1, ZC3H12C, RBM4B, PURB, G3BP1, TRA2A, PTBP3, COPA, RPS2, DCP1A, DDX39B, DDX6, RBM5, CELF1, RBM4, G3BP2, LUC7L, CPSF6, PUM3, RBMX, SRSF1, CSTF3, RPS3, SPEN, HNRNPD, DDX5, LSM14A, STAU1, AQR, TRA2B, RC3H1, EIF4G2, NOVA1, SRSF5, HNRNPLL, FYTTD1, CAPRIN1, DDX3X, SLIRP, PCBP2, GPATCH8, DDX50
GO:0045296	cadherin binding	127	0.02855857881718012	1.9035355641379992	8.026424258134148e-15	2.5529380090372013e-12	11.592959730695137	3.8294070135558024e-11	ASAP1, NEO1, CD46, RPL15, SND1, AFDN, YWHAE, RPL7A, APC, HDLBP, SNX2, RDX, STK24, PTPRM, USO1, CTNNA1, SEPTIN2, CDK5R1, PICALM, EEF2, LARP1, SEPTIN7, LRRFIP1, SHTN1, EIF4H, PDXDC1, CDH4, CDH9, CDH2, MARK2, VAPA, MACF1, PI4KA, ABI1, CAST, ACVR1, CTNNAL1, DHX29, RPL14, MPP7, CDH10, PTPRB, GAPVD1, PPME1, HNRNPK, USP8, ADD1, PTPRJ, CTNNB1, YWHAZ, PAK2, CDHR3, OLA1, ARGLU1, PTPRO, SNX9, BMPR2, CCT8, CTNND1, VAPB, FNBP1L, CLINT1, CALD1, ESYT2, SH3GLB1, CDH11, PKN2, ERC1, EIF3E, RPL34, RAN, PTPN11, MRTFB, PKM, RACK1, HSP90AB1, CTNNA2, ANK3, PKP4, SPTAN1, SERBP1, EIF2A, PTPN1, CDH12, IQGAP1, ENO1, VCL, NUMB, RPL6, DLG1, RAB1A, ZC3H15, MRE11, HSPA8, DOCK9, CKAP5, UBAP2, TJP1, CDH18, MB21D2, CBL, PCMT1, CAPZA1, RTN4, RPS2, GIGYF2, MPRIP, DDX6, HSPA5, BZW2, SPTBN1, PKP2, BSG, FMNL2, YWHAB, IST1, CDH8, EIF4G2, SNX1, SLK, DDX3X, CD2AP, EIF5, KIF5B, CTNND2, KTN1, CTNNA3
GO:0004674	protein serine/threonine kinase activity	172	0.0386777602878345	1.8966836925910462	2.0955525184692287e-19	1.11087567395741e-16	15.954334543341378	9.99788106561669e-16	CDC42BPB, RPS6KA3, NLK, DYRK1A, MYO3A, CAMK4, CDK12, TTBK2, ACVR1C, KALRN, MAP3K5, STK24, PAK1, MTOR, CDK7, GRK4, ACVR2A, PINK1, OXSR1, SGK3, PRKAA2, RPS6KA6, WNK2, LRRK2, STK38L, CSNK1A1, MAPK1, CIT, BMPR1A, TAOK3, MAK, RPS6KB1, MAP2K4, MARK2, LATS1, TOP1, CAMK2D, PRKCB, TLK2, TNIK, TRPM7, STK33, ACVR1, PRKG1, CAMK1G, RAF1, HIPK3, PAK5, CDK17, AAK1, PRKACB, PRKCE, CSNK1G3, PDPK1, SIK3, ULK4, STK4, MAP3K21, MINK1, TTN, HUNK, PIK3CB, CDKL2, ULK1, RPS6KA5, CDK19, PAK2, CAMK2A, EIF2AK3, WNK1, MARK1, BMPR2, CDKL5, PAK3, DSTYK, BRD4, MAPK6, OBSCN, ULK2, MAPK9, DAPK1, SGK1, PDK3, GRK5, PKN2, SNRK, AATK, MAP3K4, PKM, CPNE3, MAP4K3, MAPKAP1, CSNK1G1, TAF1, GSK3B, MAPK8, EIF2AK2, MAP3K1, AKT3, ROCK1, PRKAA1, CLK4, DCLK3, PIK3CA, KSR2, ROCK2, CDC42BPA, GRK3, PRKCG, ATR, SMG1, DCLK1, MAP3K7, UHMK1, CLK1, CDK13, CDK6, NEK1, MAP2K1, NEK4, HIPK4, PRKCH, CAMKK1, RPS6KC1, RICTOR, CDK14, STK39, VRK1, MAP3K9, NIM1K, CDK8, EIF2AK4, MAPK10, MAPKAPK5, TAOK1, NEK10, CAMK2B, MOK, NEK11, MAP3K13, TNNI3K, TBK1, MAP2K5, MAPK14, CASK, PRKDC, MAST3, PLK2, TRIO, CDKL1, MAP4K5, RPS6KA2, SIK2, CSNK2A1, PASK, DCLK2, MARK3, RIOK3, BRAF, CAMK1D, ATM, SLK, PGK1, LRRK1, SRPK2, PRKCA, TLK1, PRKCI, MAP3K2, HIPK1, PIKFYVE, LMTK2
GO:0031267	small GTPase binding	119	0.026759613222397123	1.8939553055961895	7.754768207811557e-14	2.1763528893805257e-11	10.66227068365913	3.6997999119468936e-10	RAB7A, IPO7, ALS2, CYFIP2, AFDN, IPO11, TRIP11, RIMS1, XPOT, DOCK3, ARHGAP44, KIF3B, PAK1, GDI1, RAP1GAP, RUSC2, RPH3A, LRRK2, RAPGEF4, EVI5, PICALM, GRIA1, DEPDC5, WDR44, VPS39, SRGAP2, DOCK11, KIF3A, RAF1, UNC13B, HACE1, MYCBP2, MYRIP, EHBP1, RANBP2, SGSM1, GIT2, GAPVD1, XPO1, RAB11FIP4, DMXL2, GDI2, IPO5, EXOC5, STRN3, ABI2, DOCK7, ULK1, DENND1B, DENND5B, PAK2, DOCK4, DIAPH1, CSE1L, OCRL, EXOC2, DIAPH2, RABGAP1, FARP1, CDKL5, PAK3, HPS4, CCDC186, XPO5, PEX5L, PKN2, TBC1D30, MYO5A, ERC1, ATP6AP1, CDC42SE2, XPO4, MAPKAP1, RIC1, TNPO2, SOD1, CHM, ROCK1, IQGAP1, BICD1, DENND5A, TNPO1, XPO7, NCKAP1, XPO6, RAB3GAP2, RABGAP1L, ROCK2, GGA2, ANKFY1, RAPGEF6, RIMS2, SORL1, USP33, RAP1A, MAP2K1, WASF1, PRKCH, RAB11FIP2, DAAM1, RABGEF1, BICDL1, IPO9, RANBP9, CYFIP1, C9orf72, KPNB1, FMNL2, SYTL5, AP1G1, GOLGA4, GCC2, IPO8, TNPO3, BRAF, RBSN, RAB3GAP1, DNM1L, AKAP13
GO:0008017	microtubule binding	111	0.024960647627614123	1.8762390457603666	1.273757027444244e-12	3.038547388968244e-10	9.5173339860381	6.0770947779364875e-09	KRIT1, KIF5C, KIF3C, APC, DNM3, JMY, KIF3B, EML1, KATNBL1, DCX, KIF21A, APC2, MAP9, CAMSAP1, TRAF3IP1, LRRK2, KIF27, HDGFL3, CEP350, JAKMIP3, CEP295, ARL3, TOGARAM2, TERF1, RMDN2, VAPA, EML5, MACF1, CCSER2, MAP1A, DCTN1, KIF5A, FMR1, KIF3A, MAP1B, CCP110, HOOK3, MAP2, GABARAPL2, DST, DYNC1I1, GABARAP, PRNP, EML4, CCDC88A, LUZP1, MAPRE2, CCSAP, JAKMIP2, OPA1, CLIP1, TUBA1A, NAV3, GAS2, TUBGCP5, VPS41, VAPB, MAPRE3, KIF16B, MTUS2, MAP6, KIF6, KIF2A, CLASP2, HOOK1, MAP7D2, RGS14, CLIP3, SPAST, ZNF207, CCDC66, CRIPT, KATNAL1, NDEL1, RAB11A, CAMSAP2, LRPPRC, KIF13B, CKAP5, NEFM, SNCA, KIF1B, DNM1, MAP4, MAPT, MACO1, MTUS1, MID2, JAKMIP1, STRBP, CEP57, RPS3, SPIRE1, KIF1A, CLASP1, GAPDH, EML6, REEP1, SGIP1, CCDC88C, CEP57L1, PAFAH1B1, FGF13, TOGARAM1, FNTA, DCLK2, DNM1L, KIF5B, DCDC1, KIF20B, NUMA1
GO:0044325	transmembrane transporter binding	60	0.013492241960872498	1.8650081572223487	2.1974164345914473e-07	2.557042392545316e-05	4.592262071857947	0.0010483873809435794	PKD2, GOPC, CALM3, SLC8A1, CALM2, YWHAE, FGF12, CNTNAP2, STK39, CALM1, PKP2, AKAP9, YWHAQ, ACTN2, ATP1A1, USP10, PPP2CB, MTOR, ANK3, PRNP, GRINA, OXSR1, PACS1, ACTN1, TRPC1, KCNAB1, RYR2, CTNNB1, NEGR1, LRRK2, VDAC1, YWHAZ, CRBN, TCAF1, SCN4B, DIAPH1, HTT, FYN, ANK2, HOMER1, FGF13, KCNB1, DLG1, HSP90AA1, PDE4D, PDE4B, AKAP6, AP2M1, CAMK2D, KCNIP1, ATP2A2, RIMS2, PGK1, SCN3B, ASPH, FHL1, FKBP1A, YWHAH, NEDD4L, FMR1
GO:0005516	calmodulin binding	82	0.01843939734652575	1.8525747695075332	2.0630423421005077e-09	3.6454722274672307e-07	6.438246206029288	9.842775014161522e-06	KCNQ3, SYT1, SLC8A1, MYO3A, CAMK4, PLCB1, EWSR1, BASP1, VAMP2, WFS1, PDE1C, SNTB2, CAMSAP1, PPP3CA, CAMK2D, KCNN2, PDE1B, ATP2B2, UNC13C, SLC8A3, CAMK1G, UNC13B, PHKB, MAP2, ATP2B4, GAP43, AKAP5, TTN, ADD1, STRN3, MYO6, RYR2, EEA1, CAMK2A, KCNH1, UBR4, MYH10, MARCKS, CALD1, ATP2B1, OBSCN, STRN, DAPK1, MAP6, CFAP221, AKAP12, NRGN, PCYT1A, MYO5A, PPP3CC, PCP4, SPTAN1, ARPP21, PPP3R1, CEP97, SLC24A4, PPP3CB, IQGAP1, CAMSAP2, TJP1, INVS, CAMKK1, FBXL2, SPTBN1, TPRG1L, MAPKAPK5, CAMK2B, CAMKV, IQCB1, ADD3, ATP2B3, CASK, ADCY1, ADORA2A, KCNN3, ADD2, RIT2, SCN2A, MYO5C, UNC13A, CAMK1D, MYO1D
GO:0031625	ubiquitin protein ligase binding	114	0.025635259725657746	1.8143773515795427	7.193975389436247e-12	1.6344026944285873e-09	8.78664093040981	3.432245658300033e-08	GABARAPL1, SHPRH, NLK, YWHAE, PACRG, APC, POLR2A, ATP6V0C, RALA, WFS1, CLU, CUL4B, PINK1, JAK1, CACUL1, DNAJA1, UBE2K, PIAS2, FAF1, ERLIN1, MFN2, HSP90AA1, GRIK2, SUMO1, TRAF5, AMBRA1, TANK, NPLOC4, UBXN7, PIAS1, HSPA9, DBT, TMBIM6, UBE2W, TUBA1B, TPI1, GABARAPL2, FANCL, GABARAP, ATXN3, HSPD1, XRCC5, SLF2, ABCB1, SPOP, ABI2, SMC6, CTNNB1, YWHAZ, ACTG1, UBE2G1, JKAMP, PRKAR2B, BAG4, SNX9, TOLLIP, RAD18, DLG3, GPI, RBX1, PSMA3, NEDD8, FOXO1, RB1, HSP90AB1, CKB, CUL2, SH3KBP1, DIO2, GSK3B, PRKN, SMAD1, RPL5, PSMD1, NDUFS2, PRKAR1A, TUBB, VCL, LRPPRC, USP13, HSPA8, APBB1, MAP3K7, SMAD2, CAMLG, RTN4, RNF34, ARIH1, FHIT, HSPA5, SYT11, HLTF, NAE1, TRIM37, FBXW7, CUL3, MDM2, UBE2J1, UBE2B, UCHL1, CUL1, SNCAIP, GLMN, CUL5, UBE2N, USP2, WASHC1, HERC2, SLF1, DNM1L, PCBP2, SPART, KDM4A, USP25
GO:0016887	ATP hydrolysis activity	150	0.033730604902181244	1.790503965374549	1.7282249731782037e-14	5.153350841895756e-12	11.287910289614887	8.24536134703321e-11	KIF5C, ACTB, KIF3C, MTREX, PEX1, MYO3A, EIF4A1, ABCB8, ATF7IP, DHX35, KIF3B, ATP13A3, ATP1A1, CLU, DDX19A, SHOC1, ATP8A2, RSF1, NAV2, KIF21A, SMARCAD1, PSMC6, SMARCA5, VPS4B, ABCC5, RAD50, SPG7, DDX3Y, KIF27, SUPV3L1, HSP90AA1, VWA8, CHD6, MLH3, FBH1, ATP9B, ATP2B2, ATP10D, KIF5A, HSPA9, ATP11B, KIF3A, ATP2C1, DHX29, MCM9, ABCD3, BRIP1, ABCE1, DHX8, ATP2B4, ATAD1, ATP11A, HSPD1, ACIN1, XRCC5, ABCB1, YTHDC2, SMC6, OLA1, NAV3, WRNIP1, ABCA5, DHX15, SMC3, HSP90B1, CCT8, ATP6V1A, DDX1, CHD1, ATP8A1, DDX24, BTAF1, ATP2A2, MLH1, ATP5F1A, ATP2B1, HSPA13, KIF16B, DDX25, ATP9A, ASCC3, DDX42, YME1L1, KIF6, KIF2A, DHX9, CHD2, MYO5A, MYO18A, EIF4A2, ATP11C, DDX17, HSP90AB1, MSH2, CFTR, SMARCA2, RNF213, SPAST, AFG1L, LONP2, ATP6V1H, ATAD2, DHX36, KATNAL1, MDN1, ATP1A3, KIF13B, HSPA8, G3BP1, CHD4, NSF, KIF1B, WRN, CHD9, ABCB7, TDRD9, DDX39B, CHD8, DDX6, SMCHD1, NVL, HSPA5, DDX10, SMARCA1, PMS1, RHOT1, XRCC6, RFC1, CLPX, ATAD2B, SMC5, DDX5, IDE, KIF1A, ATP2B3, AQR, ABCA10, ATP8B4, DDX18, DHX30, ATRX, AFG3L2, FANCM, DDX3X, INO80, ATP7B, KIF5B, KIF20B, PMS2, DDX50
GO:0004672	protein kinase activity	193	0.04340004497413987	1.7356647112376404	9.503104959444585e-17	3.77827614679251e-14	13.422706303522341	4.533931376151012e-13	NME7, CDC42BPB, RPS6KA3, NLK, DYRK1A, MYO3A, CAMK4, CDK12, EPHA6, TTBK2, KALRN, ACVR1C, MAP3K5, STRADB, STK24, PAK1, EPHA10, MTOR, CDK7, GRK4, ACVR2A, ERBB4, JAK1, PINK1, OXSR1, CDK5R1, SGK3, PRKAA2, RPS6KA6, WNK2, LRRK2, STK38L, CSNK1A1, MAPK1, RYK, CIT, BMPR1A, TAOK3, MAK, RPS6KB1, MAP2K4, MARK2, LATS1, CAMK2D, PRKCB, PIK3C3, TLK2, TNIK, TRPM7, STK33, ACVR1, PRKG1, CAMK1G, RAF1, HIPK3, FER, PAK5, CDK17, AAK1, PRKACB, PRKCE, CSNK1G3, PDPK1, SIK3, ABL2, ULK4, STK4, MAP3K21, MINK1, PAN3, TTN, EPHB6, HUNK, STRADA, CDKL2, PRAG1, ULK1, RPS6KA5, CDK19, PAK2, CAMK2A, IGF1R, EIF2AK3, STYK1, SCYL2, EPHA4, PTK2B, WNK1, MARK1, BMPR2, CDKL5, PAK3, DSTYK, MAPK6, OBSCN, ULK2, MAPK9, NTRK3, DAPK1, SGK1, PDK3, GRK5, PEAK1, PKN2, SNRK, AATK, MAP3K4, TBCK, EPHA7, MAP4K3, CSNK1G1, TAF1, PTK2, GSK3B, MAPK8, EIF2AK2, MAP3K1, AKT3, ROCK1, PRKAA1, CLK4, MMD, DCLK3, KSR2, FYN, JAK2, ROCK2, CDC42BPA, GRK3, PRKCG, ATR, SMG1, DCLK1, MAP3K7, UHMK1, CLK1, CDK13, CDK6, NEK1, MAP2K1, NEK4, HIPK4, PRKCH, CAMKK1, RPS6KC1, CDK14, STK39, VRK1, MAP3K9, NIM1K, CDK8, EIF2AK4, MAPK10, MAPKAPK5, TAOK1, NEK10, CAMK2B, CAMKV, MOK, NEK11, MAP3K13, TNNI3K, TBK1, MAP2K5, MAPK14, TRIM24, CASK, PRKDC, MAST3, PLK2, TRIO, CDKL1, MAP4K5, RPS6KA2, SIK2, PDK2, CSNK2A1, PASK, NTRK2, DCLK2, MARK3, BRAF, CAMK1D, ATM, SLK, MAP3K2, LRRK1, SRPK2, PRKCA, TLK1, PRKCI, HIPK1, LMTK2
GO:0005096	GTPase activator activity	101	0.022711940634135373	1.7197615047818091	4.392010908211791e-09	6.548213763462016e-07	6.183877151682719	2.0954284043078452e-05	ASAP1, ALS2, RAP1GAP2, SRGAP2C, ARHGAP20, STXBP5, SRGAP3, AGFG1, PLCB1, ARHGAP21, DOCK3, ARHGAP44, OPHN1, RGS8, THY1, RGS17, SMAP2, STARD13, GDI1, CHN1, RAP1GAP, SEC23A, ARHGAP10, LRRK2, EVI5, ELMOD1, ACAP2, ARHGAP5, DEPDC5, MYO9A, TBC1D19, FAM13A, SRGAP2, WDR41, TBC1D5, ARHGDIA, RGS12, SGSM1, GIT2, RASA1, GAPVD1, NF1, ARHGEF11, GDI2, GNAQ, RGS7, TIAM2, DOCK7, AGAP2, FAM13B, DOCK4, RALGAPA1, ELMOD2, RAPGEF2, OCRL, ARHGAP26, RABGAP1, RGS20, SOS1, TBC1D12, TBC1D30, STXBP5L, HACD3, TBCK, ASAP2, RASAL2, RGS14, CHM, ADGRB3, TBC1D9, RASA2, SIPA1L3, IQGAP1, TBC1D15, TBC1D4, RAB3GAP2, RABGAP1L, TBC1D1, VAV3, ARHGEF12, TBC1D22A, ARFGEF1, FLCN, RALGAPB, ARHGAP6, SYNGAP1, ARHGAP32, RABEP1, ARHGAP12, C9orf72, RGS6, AGAP1, SMAP1, ARAP2, TBCD, ARHGAP35, RAB3GAP1, EIF5, SIPA1L1, PIK3R1, DNM1L
GO:0003713	transcription coactivator activity	111	0.024960647627614123	1.7193628713656872	6.822070717451633e-10	1.3019239757184697e-07	6.885414375130294	3.254809939296174e-06	SSBP2, NUP98, DYRK1A, TRIP11, MAML2, JMY, ACTN2, MED23, BRD7, KDM5A, USP22, SUB1, MTDH, PPARGC1B, ASXL1, UBE3A, JUND, MAK, NCOA6, MTA3, PRKCB, HCFC2, AATF, MED13, PSIP1, LPIN2, KMT2E, JADE1, ZFPM2, SMARCC1, SUPT3H, MAGED1, RNF14, FUS, NUCKS1, MYSM1, MED14, DCAF6, CTNNB1, MED27, EP300, ARGLU1, HMGB1, SETD3, TMF1, BRD4, BRD8, SSBP3, ARID5B, SMARCE1, QKI, RERE, TADA2A, TACC1, DHX9, YAF2, ARL2BP, MRTFB, PKM, SLC30A9, MED6, DDX17, KDM4C, KAT6A, SMARCA2, CRTC3, KAT6B, ARID1A, NCOA7, TDRD3, SERTAD2, CEBPZ, RBM14, MED21, TCERG1, KMT2C, MRTFA, APBB1, TSC22D1, MED4, NCOA1, PRMT2, CALCOCO1, RRP1B, MID2, ACTN1, WBP2, NRIP1, NPM1, NCOA2, CREBBP, THRAP3, CNOT6, TRIM37, MMS19, TRIM24, LMO3, NPAT, WWOX, TP53BP1, TCF20, MED13L, LPIN1, TRIM13, SS18, ARID1B, MED12L, CNOT9, MED17, CCAR1, KDM1A
GO:0016301	kinase activity	233	0.052394872948054866	1.696737112009651	1.5926976878214636e-18	7.598760668596203e-16	15.119257233861267	7.598760668596203e-15	NME7, CDC42BPB, RPS6KA3, NLK, DYRK1A, MYO3A, CAMK4, GK, CDK12, EPHA6, DGKG, TTBK2, KALRN, ACVR1C, MAP3K5, ADK, EPHA10, AK5, STK24, PAK1, MTOR, CHKA, CDK7, GRK4, SGMS1, ACVR2A, ERBB4, JAK1, PINK1, OXSR1, CDK5R1, SGK3, PRKAA2, RPS6KA6, WNK2, LRRK2, DGKH, STK38L, CSNK1A1, UCK2, RYK, CIT, MAPK1, BMPR1A, TAOK3, MAK, DGKE, RPS6KB1, MAP2K4, MARK2, LATS1, CAMK2D, PRKCB, PIK3C3, PI4KA, TLK2, TNIK, TRPM7, IP6K2, STK33, ACVR1, PRKG1, CAMK1G, RBKS, RAF1, HIPK3, FER, PAK5, CDK17, AAK1, PRKACB, PRKCE, CSNK1G3, PDPK1, SIK3, DGKK, PPIP5K1, ABL2, ULK4, STK4, MAP3K21, MINK1, DGKB, AGK, TTN, HUNK, AK4, PIK3CB, CDKL2, ULK1, RPS6KA5, ETNK1, CDK19, PAK2, CAMK2A, IGF1R, EIF2AK3, BAZ1B, STYK1, LRGUK, IPMK, PANK2, DGUOK, EPHA4, PTK2B, WNK1, MARK1, BMPR2, CDKL5, PANK3, PAK3, DSTYK, MAPK6, HK1, GK5, OBSCN, CERT1, ULK2, MAPK9, NTRK3, DAPK1, SGK1, PDK3, GRK5, PKN2, PIK3C2A, SNRK, AATK, MAP3K4, PKM, EPHA7, TPK1, MAP4K3, GALK2, CSNK1G1, CKB, DGKA, PTK2, PIP4K2B, TAF1, PPIP5K2, GUK1, GSK3B, MAPK8, EIF2AK2, MAP3K1, AKT3, ROCK1, PRKAA1, CLK4, PIP4K2A, DCLK3, PIK3CA, KSR2, FYN, JAK2, ROCK2, CDC42BPA, GRK3, PRKCG, ATR, SMG1, DCLK1, MAP3K7, UHMK1, CLK1, CDK13, CDK6, DGKD, NEK1, MAP2K1, NEK4, HIPK4, PRKCH, CAMKK1, RPS6KC1, PIP5K1A, CDK14, STK39, VRK1, DGKI, MAP3K9, TRRAP, NIM1K, CDK8, EIF2AK4, MAPK10, MAPKAPK5, TAOK1, NEK10, CAMK2B, MOK, FAM20B, NEK11, MAP3K13, TNNI3K, TBK1, MAP2K5, MAPK14, CASK, RFK, PRKDC, MAST3, PLK2, TRIO, CDKL1, MAP4K5, RPS6KA2, SIK2, PDK2, CSNK2A1, PASK, IP6K1, NTRK2, DCLK2, MARK3, RIOK3, BRAF, CAMK1D, ATM, CCNH, SLK, PGK1, LRRK1, SRPK2, PRKCA, TLK1, PAPSS1, PRKCI, HIPK1, MAP3K2, PIKFYVE, LMTK2
GO:0003676	nucleic acid binding	216	0.04857207105914099	1.681328362242131	1.065028549673598e-16	3.908654777302105e-14	13.40797268590788	5.081251210492736e-13	MCM3AP, CIRBP, LARP4, AGO4, SND1, MTREX, AARSD1, HDLBP, MYEF2, HNRNPH1, GPATCH11, EIF4A1, EIF4B, EWSR1, HNRNPR, POLR2A, ZFR2, CPEB1, DDX19A, PNPT1, TAF15, ZDBF2, XRN1, KHDRBS2, SYNCRIP, AKAP1, PPARGC1B, RBM17, SYNJ1, UPF3A, PTBP2, CSDE1, RBM33, RBM39, DDX3Y, ANKRD17, NUP35, EIF4H, RBMS3, DICER1, FUBP1, ZNF385D, RBFOX1, TCEA1, RCAN1, ZMAT1, FMR1, R3HDM2, POLN, ALKBH8, CNOT4, CPEB2, PSPC1, RALYL, SRSF11, DHX29, CNOT7, KRR1, BRIP1, PPARG, PARN, CARHSP1, DHX8, CELF5, ZNF385B, ZFR, TARDBP, HNRNPK, CNBP, NCL, ACIN1, RPS18, FXR1, FUS, NOVA2, YTHDC2, PCBP3, AGGF1, ZMAT2, CELF2, ZNF318, MECP2, AGO3, RBM20, ZRANB3, NFX1, ERI3, SRSF7, TSEN2, KHDRBS1, HNRNPH3, MTERF4, DHX15, DDX1, RBFOX2, DDX24, DDX25, DNAJC21, RCAN2, ASCC3, DDX42, PPIL4, SUPT6H, RNPS1, QKI, SLTM, SCAF8, REV3L, DHX9, RYBP, SRSF10, MTERF1, ZNF638, PABPC1, CPEB3, CELF4, RBM12B, RNPC3, EIF4A2, ENOX2, FOXO1, RBM25, TSN, DDX17, ZMAT4, HNRNPA3, ARPP21, RBM26, WBP4, R3HDM1, SCAPER, SUGP2, RBM14, ZCCHC2, DHX36, RBBP6, PEG10, SF1, HNRNPC, TNRC6B, TDG, RAVER2, RBM4B, SREK1IP1, SON, G3BP1, RBM27, WRN, UHMK1, TRA2A, PTBP3, ZCCHC7, XRN2, TTC14, TDRD9, DDX39B, LARP4B, ZCCHC17, ZFHX3, PIWIL4, ANKHD1, DDX6, NPM1, U2SURP, RBM5, HNRNPA2B1, SREK1, DDX10, EXOG, CELF1, TUT7, TUT4, RBM48, G3BP2, RBM4, KDM5B, HLTF, CPSF6, ZNF407, RBMX, SRSF1, SPEN, HNRNPD, DDX5, ZMAT3, TBK1, TRA2B, DDX18, DHX30, ENOX1, SCAF4, NOVA1, SRSF5, HNRNPLL, TRMT11, CPEB4, POGZ, SFPQ, AGO1, NARS2, TNRC6A, FUBP3, LEMD3, DDX3X, HNRNPDL, GPATCH2, FANCM, ZFHX4, SLIRP, TNRC6C, ELAVL3, PCBP2, GPATCH8, POLA1, RBM6, DDX50
GO:0005085	guanyl-nucleotide exchange factor activity	87	0.019563750843265122	1.678895884866202	2.0394013826011192e-07	2.432495999097485e-05	4.613947865374642	0.000972998399638994	ALS2, RAPGEF5, RASGEF1A, KALRN, DOCK3, DIS3, ELMO2, MON2, RGL1, PSD, DENND6A, RAPGEF4, RASGEF1B, RPGR, DENND11, PSD3, SH3BP5, RAB3IP, IQSEC1, WDR41, MCF2L2, DOCK11, MYCBP2, RAP1GDS1, GRIPAP1, RIC8B, GAPVD1, ARHGEF11, ARHGEF7, CCDC88A, TIAM2, TRAPPC10, GBF1, HERC1, ARFGEF2, DOCK7, DENND1B, DENND5B, RAPGEFL1, DOCK4, MCF2, RAPGEF2, NUCB2, FARP1, HPS4, OBSCN, SOS1, ARHGEF17, RASGRP1, IQSEC2, RIC1, RALGPS1, ARHGEF9, ARHGEF26, IQSEC3, SPATA13, DENND5A, RAB3GAP2, DOCK9, DENND4C, VAV3, DENND1A, TIAM1, RAPGEF6, ARHGEF12, SOS2, ARFGEF1, RALGDS, RAP1A, RALGPS2, ELMO1, SLC38A9, ARFGEF3, RABGEF1, C9orf72, MADD, CCDC88C, TRIO, DENND4A, ITSN1, RAB3GAP1, SBF2, SERGEF, HERC2, AKAP13, CYTH1, ITSN2
