GO:0003723	RNA binding	550	0.12367888464133124	1.6638081698712333	8.963575493360843e-41	1.0691304669706145e-37	36.9709692942037	4.276521867882458e-37	API5, RNMT, CIRBP, GRB2, MTREX, RPL7A, MYEF2, ADK, DDX19A, DIS3, PAPOLG, DROSHA, SECISBP2, YWHAG, ATXN2, PPARGC1B, FAM120A, CSDE1, RPS19, EIF4E, ANKRD17, EEF2, EIF4H, NAP1L4, RBMS3, MARK2, CAPRIN2, RPL13, SMG6, RPSA, ZC3H13, KHDC1, TFB1M, YTHDF3, UCHL5, PPP1R21, PRRC2C, RPL14, DHX8, CELF5, XPO1, ZFR, TBCA, AIMP1, HNRNPK, ACIN1, SIN3A, FUS, ADD1, SETX, YTHDC2, RPL17, PCBP3, HBP1, NCBP1, ERI3, SRSF7, RPL18, MTERF4, GSPT1, GTF2E2, UTP20, VIRMA, CMSS1, TARBP1, DNAJC21, MRPS9, PPIL4, SUPT6H, RNPS1, SUPT5H, RPL7L1, ARF1, RPL37, MYO5A, CHD2, RAN, PRPF8, NUDT5, PURG, MYO18A, PABPC1, PKM, PUM1, RPS27A, SLTM, RACK1, NAF1, ENOX2, WBP11, PRRC2B, ADAR, NAP1L1, TDRD3, R3HDM1, SRP14, RPL5, AUH, RBBP6, TCERG1, NDUFV3, SON, HSPA8, G3BP1, UHMK1, PTBP3, MAP4, ZCCHC7, EEF1A1, XRN2, YY1, JAKMIP1, HNRNPA2B1, STRBP, SREK1, THRAP3, HNRNPU, SPTBN1, TENT4B, TUT4, RBM4, G3BP2, TUT7, DZIP3, ZC3H7A, ZC3H14, KPNB1, HNRNPD, LSM14A, DDX18, DHX30, SCAF4, SRSF5, SUCLG1, HNRNPLL, TRMT11, FYTTD1, HEATR1, CAPRIN1, EIF5, YARS2, ELAVL3, RPS28, RBFOX1, ZRANB2, ACO1, NOL4, KDM1A, LARP4, AGO4, NUP98, ZC3H6, YWHAE, THOC2, RIMS1, EIF1B, HNRNPH1, DHX35, PNPT1, TAF15, LRP1, PDIA3, SUB1, KHDRBS2, DIS3L2, SYNCRIP, SYNJ1, STRAP, PTBP2, RBM33, PHF6, SUPV3L1, TRNT1, RPL13A, SRRM2, CDH2, PPIA, MACF1, HNRNPUL2, AATF, FKBP3, WDR43, N4BP1, ALKBH8, ILF3, PSPC1, RALYL, PRKRA, GFM1, CNOT7, MRPL3, PURA, PPHLN1, PTCD3, IPO5, CNBP, SEC23IP, TMSB4X, BMS1, NUCKS1, EIF5B, URB1, CELF2, AGO3, DIAPH1, ESF1, NOP58, RPP38, HMGB1, HNRNPH3, EIF4G3, DHX15, HSP90B1, XPO5, MRPS27, ZNF106, SMARCE1, METAP2, SECISBP2L, FARSB, RPL34, NCOA5, MTERF1, ZNF638, CPNE3, EIF4A2, DYNC1LI1, PSMA6, CDC40, MRPL1, EYA1, MRPL42, HDAC2, NUDT21, IMMT, ENO1, PEG10, LRPPRC, RPL6, HNRNPC, RPL3, SARNP, ZC3H15, RBM4B, RAVER2, PURB, PAIP1, RPL21, RBM27, TRA2A, FNDC3B, THUMPD1, PUS10, ASCC1, DCP2, TDRD9, ZCCHC17, U2SURP, RBM5, SYNE1, CELF1, ANXA7, LARP1B, CPSF6, RPL37A, RPS4Y1, FAU, ZMAT3, SNRPN, STAU1, FIP1L1, PRKDC, ENOX1, NMD3, TRUB1, CNOT1, CLTC, AHCYL1, MCTS1, FAM98B, DDX3X, SLIRP, DMGDH, FASTKD2, GLRX3, RARS2, RPL15, HDLBP, RTF1, AGFG1, NSUN3, METTL16, EWSR1, PAPOLA, POLR2A, RDX, EIF4B, HNRNPR, MTDH, CTNNA1, PDCD4, SRP19, AKAP1, UPF3A, RBM39, DDX3Y, PPIG, EIF1AX, LARP1, DAP3, HSP90AA1, SUMO1, FUBP1, SCAF11, MPHOSPH6, SF3B1, RPS15, RNASET2, EXOSC3, CAST, FMR1, RADX, R3HDM2, GPBP1, RPL4, ADARB1, POLR2B, SRSF11, RPL35A, RPL9, TPR, CLNS1A, PARN, RPS14, CARHSP1, TARDBP, RBBP7, NCL, RPS18, UBR5, THOC1, FASTKD1, SSBP1, TRIM71, MECP2, RBM20, EIF4E3, ARGLU1, PUM2, KHDRBS1, SUPT16H, DDX24, PUS7L, SORBS2, DDX42, RPS8, QKI, LUC7L3, PKN2, UTP23, RC3H2, RPS20, CPEB3, RBM12B, RO60, CELF4, DDX17, RBM25, TASOR, YTHDC1, THUMPD2, EIF3A, EIF2AK2, SERBP1, PTPN1, ZNF207, CEBPZ, ZC3H8, RBM14, TNPO1, EIF1, TNRC6B, ROCK2, KMT2C, UBAP2, SMG1, RPS2, DNAJC2, KCTD12, DDX39B, MRPS28, PIWIL4, ANKHD1, DDX6, NVL, PEBP1, RPS27, C1D, HLTF, USP10, PUM3, SUZ12, ZNF326, RPL10, DDX5, TRA2B, EIF4G2, UTP25, UPF2, UBE2N, AGO1, RPL26, FUBP3, HNRNPDL, BCLAF1, TNRC6C, SELENOH, GPATCH8, RSRC2, KTN1, RBM6, NUFIP2, SRFBP1, SND1, GOLGB1, PPP1R10, NOL10, ELP3, XPOT, EIF4A1, CPEB1, USO1, UBC, XRN1, UBAP2L, SNTB2, SPATS2, STXBP1, RBM17, RPGR, OTUD4, DICER1, LUC7L2, TOP1, IREB2, STAU2, PSIP1, HELZ, HSPA9, LSM8, CNOT4, CPEB2, SRP72, NAA15, DHX29, RANBP2, KRR1, CANX, CWC22, SNU13, HSPD1, SEC63, GDI2, PAN3, FXR1, XRCC5, CCDC59, NOVA2, TSNAX, THOC7, YWHAZ, NFX1, BAG4, DDX1, RBFOX2, ATP5F1A, DDX25, WDR33, RPS16, ASCC3, RPL32, EIF3H, MBNL1, SCAF8, FAM133B, EXOSC6, DHX9, SRSF10, EIF3E, C1orf52, NR3C1, RNPC3, TSN, HSP90AB1, SRP54, HNRNPA3, HABP4, RBM26, DIDO1, WBP4, SUGP2, PRPF40A, DHX36, NUP42, DHFR, SF1, MRPS30, FAM120C, NAT10, DYNC1H1, DNM1, CDK13, MAPT, RRP1B, RTN4, LARP4B, GIGYF2, DTD1, NPM1, KHDC4, MBNL2, ALKBH5, DDX10, CNOT6, RBM48, CCDC47, EIF2AK4, XRCC6, RBMX, SRSF1, HUWE1, CSTF3, RPS3, SPEN, NGRN, RPL28, FNDC3A, AQR, RC3H1, TCF20, NOVA1, CPEB4, YLPM1, SFPQ, TNRC6A, MRPS5, SRPK2, PCBP2, CCAR1, DDX50
GO:0005524	ATP binding	518	0.11648302226219924	1.6387188022624697	3.117589550580415e-36	2.9748039491638323e-33	32.52654165064195	1.487401974581916e-32	KIF5C, KIF3C, MTREX, PEX1, CDK12, TTBK2, DGKG, NAIP, NDUFA13, ADCY5, MAP3K5, LARS2, ADK, KIF3B, DDX19A, EPHA10, MTOR, CDK7, PAPOLG, NAV2, KIF21A, ERBB4, OXSR1, DNAJA1, PSMC6, SGK3, STK38L, WNK2, ACSL3, MAPK1, CIT, MYO9A, TAOK3, VWA8, CHD6, MARK2, PIK3C3, STK33, ACVR1, PCCA, CTPS2, CAMK1G, MCM9, CSNK1G3, TTLL5, SIK3, PDPK1, DGKK, DHX8, UBE2D3, STK4, ULK4, EPHB6, SETX, YTHDC2, MTHFS, PRAG1, EIF2AK3, ACTG1, STYK1, SCYL2, IPMK, PANK2, MARK1, CDKL5, PNPLA8, BTAF1, MLH1, SGK1, NMNAT3, CHD2, MYO5A, MYO18A, PKM, ATP11C, MSH2, SMARCA2, ATP6V1B2, CKB, PPIP5K2, SPAST, ACTR2, ATAD2, PIP4K2A, JAK2, HSPA8, G3BP1, UHMK1, WRN, CLK1, MSH3, DGKD, MAP2K1, NEK4, PRKCH, THRAP3, HNRNPU, SYN1, TENT4B, IARS2, KIF1A, MAP2K5, ATP2B3, VDAC1, RFK, ABCA10, DHX30, ADCY1, DDX18, PLK2, MAGI3, ATRX, RPS6KA2, SIK2, AFG3L2, CSNK2A1, CAPRIN1, FANCM, INO80, YARS2, PAPSS1, TLK1, UBA5, SHPRH, NLK, DYRK1A, LANCL2, DHX35, ATP13A3, ACVR2A, HLCS, PINK1, ABCC5, LRRK2, DGKH, RUNX2, KIF27, RYK, SUPV3L1, TRNT1, DGKE, PRKCB, UBE2G2, PRKG1, HSPA12A, DNAJA4, UBE2W, ATP2C1, PRKACB, EP400, PRKCE, ABCE1, DNAH9, ABL2, MAP3K21, ATP11A, AGK, STRADA, BMS1, ULK1, ETNK1, RPS6KA5, LRGUK, RAD51D, NAV3, PTK2B, WNK1, DHX15, HSP90B1, PAK3, ATP6V1A, PANK3, ATP8A1, MAPK6, OBSCN, NUBPL, NMNAT2, DAPK1, CLCN3, MCCC1, KIF6, PEAK1, UBE2H, FARSB, EIF4A2, TPK1, DYNC1LI1, CFTR, TAF1, UBE2R2, PIP4K2B, GUK1, AFG1L, LONP2, NT5C2, KATNAL1, FYN, TDG, DCLK1, MAP3K7, N4BP2, NSF, CHD9, TOP2B, TDRD9, RPS6KC1, MTHFD1, RICTOR, PMS1, MAP3K9, MAPKAPK5, NEK10, RFC1, FAM20B, CLPX, CDC123, ATAD2B, NEK11, ACTR3B, IDE, TNNI3K, UBE2J1, ATP8B4, PRKDC, PDK2, P2RY1, PASK, NTRK2, CAMK1D, DDX3X, PGK1, PRKCA, DYNC1LI2, PIKFYVE, MYO1D, KIF20B, LMTK2, RARS2, CDC42BPB, RPS6KA3, AARSD1, GK, ACVR1C, PAPOLA, ATP1A1, STK24, CHKA, DNAH6, PRKAG1, RAD50, PRKAA2, SPG7, RPS6KA6, SYN2, DDX3Y, UBE2K, CNNM2, BMPR1A, UBE2D2, HSP90AA1, MAK, MAP2K4, MLH3, CAMK2D, PI4KA, TLK2, TRPM7, TTLL3, ATP10D, KIF5A, DNAH7, KIF3A, ATP11B, RBKS, ORC5, RAF1, FER, SUCLA2, PAK5, ABCD3, PPIP5K1, ORC4, MINK1, UBA3, TTN, RNGTT, MSH4, MYO6, RIMKLA, UBE2E3, CDK19, PAK2, OLA1, ZRANB3, DGUOK, ITM2B, WRNIP1, BMPR2, SMC3, TTL, ACSL6, DDX24, DSTYK, ATP2B1, HK1, KIF16B, ATP9A, DDX42, PDK3, YME1L1, GRK5, KIF2A, PKN2, PIK3C2A, SNRK, AATK, ERCC6L2, TBCK, EPHA7, DDX17, HSPA4, GALK2, DGKA, DYNC2H1, GSK3B, MAPK8, EIF2AK2, MAP3K1, UBA6, ROCK1, PRKAA1, CLK4, KSR2, ATP1A3, ROCK2, CDC42BPA, PRKCG, SMG1, CACNA1B, CHD4, KIF1B, ITM2C, ABCB7, CDK6, NEK1, DDX39B, DDX6, NVL, PEBP1, HLTF, CDK8, GPHN, TAOK1, CAMK2B, MOK, SMC5, DDX5, TBK1, UBE2B, MAST3, MAP4K5, UBA2, TTLL7, RUNX1, IP6K1, PRKAG2, MYO5C, RIOK3, BRAF, UBE2N, ATM, NARS2, GMPS, ATP7B, KIF5B, HIPK1, UBE2E2, PMS2, NME7, ACTR3, ACTB, MYO3A, CAMK4, GCLC, ADCY9, RAD51B, EIF4A1, EPHA6, ABCB8, KALRN, STRADB, PAK1, AK5, GRK4, ATP8A2, JAK1, SMARCAD1, SMARCA5, VPS4B, CSNK1A1, UCK2, DNAJA2, RPS6KB1, DICER1, LATS1, FBH1, TOP1, ATP9B, ATP2B2, UBE2Z, TNIK, IP6K2, HELZ, HSPA9, ACSL4, HIPK3, CDK17, AAK1, DHX29, MCCC2, BRIP1, ATP2B4, ATAD1, DGKB, HSPD1, PAN3, HUNK, AK4, XRCC5, PIK3CB, ABCB1, CDKL2, AGAP2, SMC6, HACL1, CAMK2A, IGF1R, BAZ1B, UBE2G1, EPHA4, ABCA5, CCT8, MYH10, DPH6, DDX1, CHD1, ATP2A2, ATP5F1A, HSPA13, GK5, DDX25, ULK2, MAPK9, NTRK3, RIMKLB, ASCC3, ACACA, DNHD1, DHX9, MAP3K4, TENT2, ITPR1, MAP4K3, HSP90AB1, CSNK1G1, KIAA0232, PTK2, RNF213, HSPH1, AKT3, MTHFD1L, DCLK3, DHX36, PIK3CA, MDN1, KIF13B, MAGI1, CLCN4, UBE4B, GRK3, ATR, NAT10, DYNC1H1, CDK13, HIPK4, CAMKK1, CHD8, SMCHD1, PIP5K1A, HSPA5, CDK14, DDX10, SMARCA1, STK39, VRK1, DGKI, NIM1K, EIF2AK4, MAPK10, XRCC6, CAMKV, MAP3K13, CHORDC1, MAPK14, CASK, AQR, CDKL1, TRIO, DCLK2, MARK3, HSPA4L, SLK, MAP3K2, LRRK1, ACSL1, SRPK2, PRKCI, DDX50
GO:0019899	enzyme binding	134	0.030132673712615247	1.5672034034975344	1.5004603751775735e-08	2.1054989558741775e-06	5.67664496961213	7.158696449972203e-05	CBX3, YWHAE, PLCB1, MDM4, USP22, HLCS, N4BP2L2, LAMB1, PPP3CA, EIF4E, HACD2, PHF6, JUND, GSTM3, CREB1, PDE4D, XRCC4, NCOA6, TSPYL1, SUMO1, CDH2, LUC7L2, GOLPH3, WDR70, SOD2, ANKMY2, PCCA, EGLN1, BTG1, KMT2E, PIAS1, HSPA9, RAF1, TMBIM6, PRKRA, MCM9, PRKCE, PPARG, ABL2, FNIP1, RASA1, HSPD1, TTN, ACIN1, TMSB4X, SORT1, PDE4DIP, METTL6, RYR2, CTNNB1, EIF2AK3, PTEN, PEX7, VAPB, ACSL6, ATP2A2, MLH1, BRD4, TRAK2, SCARB2, RAC1, ACAT1, TBC1D12, SUPT5H, DYM, HACD3, CNTNAP2, FNTB, RACK1, RB1, KDM4C, CFTR, ZNHIT6, SOD1, MAPK8, LONP2, POR, PTPN1, PRKN, HDAC2, PPP3CB, FYN, PAWR, NDUFAF7, TNKS2, HSPA8, ATF6, UBE4B, MLEC, TSPAN5, SNCA, DHCR24, RAD9A, MAPT, MSH3, RPS2, MID2, PRKCH, ZFHX3, FLCN, CTNNBL1, LDB2, HSPA5, SYNE1, PEBP1, PMS1, THRB, VOPP1, TRIM37, RANBP9, ESR2, SUDS3, DYNLL1, KPNB1, MMS19, MDM2, ENO2, RPS3, MAP3K13, YWHAB, IQCB1, MAPK14, APP, WWOX, PRKDC, ADORA2A, ANK2, FNTA, PRMT8, PRKCA, HDHD2, PCBP2, YWHAH, KDM1A
GO:0000166	nucleotide binding	612	0.13762086800089948	1.5633973509909131	4.148594620911533e-36	3.2988241560614875e-33	32.481640833920416	1.9792944936368922e-32	RAB7A, KIF5C, KIF3C, MTREX, APLF, PEX1, CDK12, TTBK2, RERG, NAIP, DGKG, ADCY5, RAB2A, MAP3K5, LARS2, ADK, KIF3B, DDX19A, EPHA10, MTOR, RAB21, TUBB4A, CDK7, PAPOLG, NAV2, KIF21A, ERBB4, GUCY1A2, RAB3C, OXSR1, SEPTIN2, PSMC6, SGK3, STK38L, HBS1L, ACSL3, GNAL, RAPGEF4, WNK2, MAPK1, CIT, EEF2, SEPTIN7, MYO9A, TAOK3, MFN1, ARL3, CHD6, VWA8, ATL1, MARK2, PIK3C3, STK33, ACVR1, PCCA, CTPS2, CAMK1G, TUBA1B, MCM9, CSNK1G3, TTLL5, NT5C3A, SIK3, PDPK1, DGKK, DHX8, UBE2D3, STK4, ULK4, GNAQ, EPHB6, GUF1, SETX, YTHDC2, MTHFS, EIF2AK3, ACTG1, STYK1, PRKAR2B, IPMK, PANK2, MARK1, PDE10A, CDKL5, GSPT1, BTAF1, MLH1, SGK1, NMNAT3, RAC1, ARF1, CHD2, MYO5A, GPSM2, RAN, MYO18A, PKM, ATP11C, MSH2, ATP6V1B2, CKB, PPIP5K2, TUBE1, SPAST, ACTR2, MPPED2, RAB6A, ATAD2, PIP4K2A, PRKAR1A, TUBB, JAK2, HSPA8, G3BP1, UHMK1, WRN, CLK1, ARF3, MSH3, DGKD, EEF1A1, RAP1A, MAP2K1, NEK4, DPYD, PRKCH, ATL2, THRAP3, HNRNPU, TENT4B, IARS2, KIF1A, MAP2K5, ATP2B3, VDAC1, RFK, ABCA10, DHX30, ADCY1, DDX18, PLK2, MAGI3, ATRX, RPS6KA2, SIK2, SUCLG1, AFG3L2, CSNK2A1, RRAGD, CAPRIN1, FANCM, EIF5, INO80, YARS2, MRAS, PAPSS1, TLK1, RAB22A, UBA5, SHPRH, NLK, DYRK1A, GUCY1B1, DNM3, DHX35, ATP13A3, ACVR2A, HLCS, PINK1, RAB40B, ABCC5, LRRK2, DGKH, HPRT1, KIF27, RYK, TRIM23, SUPV3L1, MFN2, TRNT1, DGKE, RAP2B, PRKCB, UBE2G2, PRKG1, HSPA12A, UBE2W, ATP2C1, PRKACB, EP400, PRKCE, RAB6B, GFM1, ABCE1, DNAH9, ABL2, MAP3K21, FPGT, ATP11A, AGK, RAP2A, STRADA, BMS1, EIF5B, ULK1, ETNK1, RPS6KA5, RAB5A, OPA1, LRGUK, RAD51D, PTK2B, WNK1, RAB14, GFOD1, DHX15, HSP90B1, PAK3, ATP6V1A, PANK3, ATP8A1, MAPK6, OBSCN, VDAC3, NUBPL, NMNAT2, DAPK1, CLCN3, MCCC1, KIF6, UBE2H, RABL6, REV3L, FARSB, EIF4A2, TPK1, DYNC1LI1, RAB12, CFTR, TAF1, UBE2R2, PIP4K2B, GUK1, AFG1L, LONP2, ARL13B, NT5C2, C1GALT1, KATNAL1, FYN, RAB1A, CDC42, RAB28, DCLK1, MAP3K7, N4BP2, NSF, CHD9, KRAS, TOP2B, TDRD9, RPS6KC1, FHIT, MTHFD1, RICTOR, RHEB, DIRAS3, MAP3K9, RHOT1, MAPKAPK5, NEK10, RFC1, ARL1, FAM20B, CLPX, CDC123, ATAD2B, ARL5A, NEK11, AGAP1, ACTR3B, IDE, TNNI3K, UBE2J1, ATP8B4, PRKDC, PDK2, P2RY1, GNL1, PASK, NTRK2, CAMK1D, DDX3X, PGK1, PRKCA, ARL15, DYNC1LI2, RAB8B, PIKFYVE, MYO1D, KIF20B, LMTK2, SAR1B, RARS2, GUCY1A1, CDC42BPB, RPS6KA3, AARSD1, GK, ACVR1C, PAPOLA, ATP1A1, GFM2, STK24, CHKA, DNAH6, PRKAG1, NNT, RAD50, PRKAA2, SPG7, URGCP, RPS6KA6, GNAI1, DDX3Y, UBE2K, RAB27A, BMPR1A, UBE2D2, DAP3, HSP90AA1, MAK, SEPTIN3, MAP2K4, CAMK2D, PI4KA, TLK2, TRPM7, TTLL3, ATP10D, KIF5A, DNAH7, KIF3A, ATP11B, RBKS, ORC5, RAF1, FER, SUCLA2, PAK5, ARL2, ABCD3, PPIP5K1, ORC4, MINK1, UBA3, TTN, RNGTT, CRCP, MSH4, MYO6, RIMKLA, UBE2E3, CDK19, PAK2, OLA1, ZRANB3, TUBA1A, DGUOK, GNA12, WRNIP1, BMPR2, SMC3, TTL, ACSL6, DDX24, DSTYK, RRAS2, ATP2B1, HK1, KIF16B, ATP9A, DDX42, PDK3, YME1L1, GRK5, KIF2A, PDE5A, PKN2, PIK3C2A, SNRK, AATK, ERCC6L2, EPHA7, DDX17, HSPA4, GALK2, DGKA, DYNC2H1, GSK3B, MAPK8, EIF2AK2, MAP3K1, UBA6, ROCK1, PRKAA1, CLK4, KSR2, ATP1A3, ROCK2, CDC42BPA, PRKCG, SMG1, CACNA1B, HINT1, CHD4, KIF1B, ABCB7, CDK6, NEK1, DDX39B, DDX6, NVL, PEBP1, HHAT, ARL6, HLTF, CDK8, GPHN, CHFR, TAOK1, CAMK2B, MOK, SMC5, DDX5, AKAP7, TBK1, TYW1, RHOQ, UBE2B, MAST3, MAP4K5, UBA2, TTLL7, RIT2, IP6K1, PRKAG2, MYO5C, RIOK3, BRAF, UBE2N, ATM, NARS2, GMPS, ATP7B, KIF5B, DNM1L, HIPK1, UBE2E2, PMS2, PRKAR1B, ACTR3, ACTB, MYO3A, CAMK4, GCLC, ADCY9, RAD51B, EIF4A1, EPHA6, ABCB8, KALRN, RALA, STRADB, PAK1, AK5, GRK4, ATP8A2, JAK1, SMARCAD1, VPS4B, CSNK1A1, UCK2, RAB18, NIN, RPS6KB1, DICER1, LATS1, FBH1, ATP9B, ATP2B2, UBE2Z, TNIK, IP6K2, HELZ, GNAS, HSPA9, ACSL4, HIPK3, CDK17, AAK1, DHX29, MCCC2, BRIP1, ATP2B4, ATAD1, DGKB, HSPD1, PAN3, HUNK, AK4, XRCC5, PIK3CB, ABCB1, CDKL2, AGAP2, SMC6, CAMK2A, IGF1R, BAZ1B, UBE2G1, EPHA4, RRAGB, ABCA5, CCT8, MYH10, RASD2, DPH6, DDX1, RAB9B, CHD1, ATP2A2, ATP5F1A, HSPA13, GK5, DDX25, ULK2, MAPK9, NTRK3, RIMKLB, ASCC3, ACACA, SEPTIN11, DHX9, MAP3K4, HCN1, TENT2, GNAI3, ITPR1, MAP4K3, HSP90AB1, CSNK1G1, KIAA0232, SPAG1, PTK2, SRP54, RNF213, HSPH1, AKT3, MTHFD1L, KDSR, DCLK3, DHX36, PIK3CA, MDN1, RAB11A, KIF13B, MAGI1, RAB27B, CLCN4, GRK3, ATR, NAT10, DYNC1H1, DNM1, CDK13, HIPK4, CAMKK1, CHD8, PIP5K1A, HSPA5, CDK14, DDX10, STK39, VRK1, DGKI, NIM1K, EIF2AK4, MAPK10, XRCC6, RAB10, MAP3K13, MAPK14, CASK, AQR, CDKL1, TRIO, ARHGAP35, TUBB2A, DCLK2, MARK3, HSPA4L, SLK, MAP3K2, LRRK1, ACSL1, SRPK2, PRKCI, ARL8B, CRY2, POLA1, DDX50
GO:0003682	chromatin binding	160	0.03597931189566	1.5342234116004416	3.1899480008456705e-09	5.073080637344898e-07	6.294728234454605	1.5219241912034693e-05	CBX3, MCM3AP, TTC21B, NIPBL, KDM5A, ZNF431, SMARCAD1, PWWP2A, KMT2A, SMARCA5, PRKAA2, WAC, ASXL1, TLE4, RUNX2, BCAS3, ANKRD17, NAP1L4, CHD6, NCOA6, TSPYL1, MLH3, MTA3, TOP1, PRKCB, NAP1L2, CCNT2, PHC1, MBTD1, PSIP1, NELFA, MLLT3, FMR1, HMGN1, POLR2B, MBD5, SCMH1, EP400, MCM9, TPR, SMARCC1, PPARG, IFT74, CBX5, CBX6, SIN3A, FUS, NUCKS1, SSBP1, PHF8, SP3, SFMBT1, CTNNB1, STAG2, MBD2, ADNP, MECP2, EP300, MEF2A, NAP1L3, TTC5, APTX, SMC3, DDX1, CHD1, SET, GABPA, STAG1, MLH1, TSPYL2, BRD4, POLR3A, KDM3A, ZNF445, AUTS2, SMARCE1, RERE, TADA2A, KMT5B, NFKB1, CHD2, ASXL2, RAN, SLC30A9, URI1, OBI1, NCOA5, TAF2, FOXO1, JARID2, MSH2, TASOR, KAT6A, MSL1, SMARCA2, SMAD4, KAT6B, NAP1L1, TDRD3, ATAD2, PRKAA1, HDAC2, NUDT21, PHF10, SARNP, APBB1, NCOA1, MORF4L1, ASH1L, CHD4, TSPYL4, SMAD2, NFAT5, MTF2, PHF21A, CALCOCO1, DNAJC2, TOP2B, PHC3, RAD21, CHD8, NFE2L1, YY1, KAT7, NPM1, NCOA2, CREBBP, SMARCA1, WDR82, PBRM1, HNRNPU, THRB, TRIM37, RBMX, SUZ12, RNF2, HMGN3, ATAD2B, RBPJ, L3MBTL4, HNRNPD, TRIM24, APP, BEND6, ATF2, DHX30, ATRX, L3MBTL1, CDYL, RIT2, ELK1, NSD1, GLYR1, SFPQ, MLLT10, FANCM, PHC2, ZEB1, POLA1, KDM1A
GO:0019901	protein kinase binding	153	0.03440521700022487	1.501292053679304	3.344930459773716e-08	4.559618063880114e-06	5.341071534461941	0.000159586632235804	PPP1R12B, ATP1B1, RPS6KA3, ACTB, GRB2, CALM2, RB1CC1, APC, IFNAR2, CDK12, CALM1, MAP3K5, SLC12A2, CACNB4, STX1B, BCL2L14, PAK1, DCX, CACUL1, OXSR1, STXBP1, PRKAG1, CDK5R1, CDC25B, ACSL3, RPS19, KIZ, DLG4, CIT, GRIA1, DNAJC3, EEF2, FAF1, SNAP91, STX17, CDH2, LATS1, IRS2, CCNT2, DCTN1, NBEA, CNTLN, FRMD5, CALM3, PARN, CCNYL1, ATP2B4, PPME1, ITGB1BP1, PGAM1, ARHGEF7, TTN, CAMK2N1, STRN3, PTPRJ, AGAP2, RYR2, CTNNB1, YWHAZ, MAPRE2, IBTK, PAK2, ACTG1, MEF2A, PRKAR2B, SV2A, SLC12A6, WNK1, PPP1R12A, EXOC2, SPRED1, CADPS, MAPK6, DLG3, SOS1, RAC1, PTPN2, PLCG2, PTPN5, ERCC6L2, CYLD, PTPN11, NR3C1, CCND2, HSP90AB1, MAPKAP1, LRRC7, MT-ND2, CNKSR2, PTK2, RGS14, GSK3B, MAP3K1, PTPN1, PRKN, SMAD1, RBBP6, IQGAP1, BICD1, JAK2, PRKRIP1, DLG1, KIF13B, CEP68, CDC42, MAP3K7, NSF, GHR, PTPRR, DNM1, CBL, CDK13, GSKIP, RAD9A, MAPT, EEF1A1, LIMS1, MAP2K1, AP2A2, SPG11, RAB11FIP2, FOXO3, NPM1, RICTOR, RHEB, PEBP1, STK39, SYN1, VRK1, UTRN, RPS3, MAP3K13, AKAP7, RHOQ, VDAC1, ELP2, ATF2, LRBA, TOM1L1, ANK2, ADD2, DLG2, CCNY, PDCD10, PRKAG2, CLTC, SLC12A5, USP37, PPP1CB, MAP3K2, CRY2, UNC5C, POLA1
GO:0061630	ubiquitin protein ligase activity	122	0.027434225320440746	1.4987673864716118	9.84951368761278e-07	9.590210164000116e-05	4.01817187540854	0.0046992029803600574	SHPRH, JADE2, RNF38, RNF11, RNF115, AMFR, G2E3, PRPF19, UBE3A, RPGR, TRIM23, UBE2D2, UBE4A, SH3RF1, RCHY1, HECTD1, TRAF5, WWP1, HERC3, RNF128, CNOT4, RNF19A, HACE1, MYCBP2, RNF150, HECW2, RMND5A, UBE2D3, ZNRF1, FANCL, SH3RF2, RNF14, UBR5, HERC1, ANKIB1, TRIM71, RNF170, BTRC, TRIM9, PELI1, NFX1, UBR4, LONRF1, KCMF1, ZFP91, RAD18, UBE3C, SMURF2, BSPRY, RNF180, CBLB, RBX1, RNF114, RC3H2, RNF144A, NHLRC3, OBI1, RNF169, RNF103, ITCH, UHRF2, LNX1, RNF217, TRIM2, UBR1, RNF213, MAP3K1, NT5C2, TRIM33, PRKN, PJA2, UBR2, TRIP12, RBBP6, MED21, RNF175, RLIM, HECTD2, UBR3, UBE4B, CDC42, RNF130, UBE3D, CBL, RNF111, RNF146, MID2, RNF34, ARIH1, AREL1, XIAP, MSL2, TTC3, RABGEF1, COP1, HLTF, WSB1, DZIP3, TRIM37, CHFR, RNF2, CUL3, MDM2, RNF216, HUWE1, RNF145, RNF149, TRIM24, LTN1, LONRF2, RC3H1, RNF13, TRIM44, TRIM13, HECTD4, SMURF1, MIB1, HERC2, MED17, RNF10, HERC4, NEDD4L
GO:0016740	transferase activity	577	0.12975039352372386	1.4290583449276026	1.0432073237488909e-22	7.110203059437083e-20	19.14811799612906	4.977142141605958e-19	RNMT, ST3GAL5, NMT2, NSD3, B3GALNT2, CDK12, TTBK2, DGKG, MAP3K5, B3GNT2, ADK, B4GALNT3, MBOAT7, EPHA10, MTOR, CDK7, PAPOLG, CHPT1, G2E3, MTR, ERBB4, HGSNAT, OXSR1, SGK3, ABAT, STK38L, WNK2, PRPF19, MAPK1, CIT, PIAS2, EXTL3, TAOK3, MGMT, REV1, MARK2, HECTD1, PIK3C3, STK33, ACVR1, CAMK1G, TFB1M, CHST11, AGPAT5, DPM1, CSNK1G3, RMND5A, NT5C3A, SIK3, PDPK1, POLR3B, DGKK, UBE2D3, STK4, ZNRF1, ULK4, GALNTL6, HERC1, METTL6, GCNT4, RNF170, TRIM9, EIF2AK3, STYK1, IPMK, PANK2, MARK1, GALNT11, CDKL5, TARBP1, UST, MGAT5, SGK1, NMNAT3, RNF144A, NUDT5, OBI1, PKM, TMEM260, LNX1, RNF217, SAMD8, CKB, TPST1, ESCO1, PPIP5K2, PRKN, PIP4K2A, B3GNT5, ST8SIA1, RBBP6, RLIM, PLA2G4C, JAK2, TRMT9B, TNKS2, PRDM2, ZDHHC21, UHMK1, CLK1, LANCL1, DGKD, RNF146, MAP2K1, NEK4, CRPPA, PRKCH, XIAP, STT3B, ELOVL6, TENT4B, TUT7, TUT4, DZIP3, TMTC3, CHSY3, RNF149, MAP2K5, LTN1, MTFMT, RFK, PLK2, ALG13, RPS6KA2, SIK2, RNF13, ST6GALNAC5, TRMT11, CSNK2A1, SMURF1, HS2ST1, PAPSS1, TLK1, NUS1, SHPRH, NLK, DYRK1A, PNPT1, BIRC6, PARP11, ACVR2A, PINK1, HS6ST3, PIGN, DPY19L2, LRRK2, DGKH, UBE3A, HPRT1, MGAT4A, RYK, CHSY1, TRIM23, SH3RF1, RCHY1, TRNT1, DGKE, KYAT1, PRKCB, UBE2G2, WWP1, SIRT5, RNF128, PRKG1, METTL8, CEPT1, POLN, ZNF451, ALKBH8, TMTC1, UBE2W, PRKACB, PRKCE, ABL2, B4GALT6, MAP3K21, MTAP, FPGT, COX10, AGK, DTWD1, SELENOI, SETD2, EEF1AKMT2, ULK1, ETNK1, RPS6KA5, PELI1, LRGUK, ATG10, UBR4, PTK2B, SUGCT, WNK1, PAK3, PANK3, RAD18, MAPK6, POLR3A, SPTLC1, OBSCN, EXT1, DAPK1, NMNAT2, ACAT1, RBX1, ST3GAL3, UBE2H, REV3L, CLOCK, TPK1, TAF1, UBE2R2, PIP4K2B, GUK1, AGPS, CROT, NT5C2, MGST1, C1GALT1, PJA2, UBR2, GNPTAB, FYN, AGL, CERS5, NCOA1, MB21D2, DCLK1, MAP3K7, PCMT1, MID2, SETDB2, RNF34, RPS6KC1, B4GAT1, GFPT1, KAT7, MSL2, FHIT, TTC3, CREBBP, COP1, CERS6, MAP3K9, MAPKAPK5, NEK10, METTL25, FAM20B, RNF216, NEK11, FTCDNL1, TNNI3K, UBE2J1, METTL15, PRMT3, PRKDC, PDK2, NSD1, PASK, NTRK2, TRIM13, HECTD4, CAMK1D, FKTN, UGGT2, PGK1, PRKCA, PIKFYVE, METTL24, CSGALNACT2, LMTK2, AGPAT4, CDC42BPB, RPS6KA3, JADE2, TRMT61B, GK, NSUN3, METTL16, ACVR1C, PAPOLA, POLR2A, STK24, DTWD2, CHKA, POLK, KMT2A, PRKAA2, EXT2, RPS6KA6, B3GALT5, UBE2K, LARGE1, SPTLC2, ZDHHC14, BMPR1A, UBE2D2, UBE4A, ALG5, MAK, MAP2K4, HS3ST4, CAMK2D, PI4KA, TLK2, PGGT1B, TRPM7, PIAS1, ST6GALNAC3, CMAS, RBKS, RAF1, FER, POLR2B, PAK5, RNF19A, DBT, OGT, GOT1, HECW2, PPIP5K1, FUT8, XXYLT1, MINK1, TTN, RNGTT, UBR5, ALG9, TRIM71, UBE2E3, CDK19, PAK2, ELOVL4, DGUOK, SETD3, BMPR2, ZFP91, DSTYK, HK1, PDK3, LCLAT1, GRK5, PKN2, PIK3C2A, SNRK, LPGAT1, GSTO2, RNF212, RC3H2, AATK, UGGT1, KMT5B, RNF169, CDKAL1, EPHA7, UHRF2, TRIM2, KAT6A, GALK2, DGKA, THUMPD2, UBR1, CLYBL, GSK3B, MAPK8, EIF2AK2, MAP3K1, LPCAT4, GCNT1, ROCK1, TRIM33, PRKAA1, CLK4, TRIP12, SMYD3, KSR2, HECTD2, NDUFAF7, SULT4A1, ROCK2, CDC42BPA, KMT2C, GALNT17, PRKCG, SMG1, UBE3D, ASH1L, CBL, RNF111, CDK6, NEK1, TNKS, AASDHPPT, AREL1, B4GALT5, HHAT, HLTF, PGM2L1, CDK8, GPHN, CHFR, TAOK1, CAMK2B, MOK, FTO, ZDHHC20, RNF2, ZDHHC23, TBK1, GAPDH, UBE2B, MAST3, MAP4K5, UBA2, ELOVL7, NDST3, CARNMT1, IP6K1, RIOK3, BRAF, UBE2N, ATM, HERC2, HIPK1, UBE2E2, MCM3AP, NME7, BCAT1, CRLS1, ELP3, MYO3A, CAMK4, ZDHHC17, EPHA6, RNF38, KALRN, RNF115, PAK1, AK5, AMFR, GRK4, SGMS1, JAK1, CSNK1A1, UCK2, GSTM3, GSTA4, OXCT1, RPS6KB1, KIAA1586, LATS1, UBE2Z, TNIK, HERC3, IP6K2, TAMM41, HIPK3, CNOT4, HACE1, CDK17, MYCBP2, AAK1, NAA50, RANBP2, ATE1, FANCL, DGKB, SH3RF2, HUNK, AK4, RNF14, PIK3CB, CAMKMT, CDKL2, ATPSCKMT, PIGK, ANKIB1, MGAT4C, NAT8L, CAMK2A, IGF1R, ST8SIA3, BAZ1B, EP300, UBE2G1, EPHA4, NFX1, GALNT13, KCMF1, CASD1, GLT1D1, UBE3C, SMURF2, GK5, ULK2, RNF180, MAPK9, NTRK3, CBLB, NDUFAF5, NSMCE2, RNF114, PCYT1A, MAP3K4, TENT2, FNTB, RNF103, MAP4K3, ITCH, CSNK1G1, PTK2, KAT6B, HS6ST2, RNF213, AKT3, DCLK3, PIK3CA, SETD5, UBR3, UGCG, UBE4B, GRK3, PTDSS1, RNF130, ATR, NAT10, PRMT2, CDK13, SCP2, ECE2, HIPK4, CAMKK1, ARIH1, CDS2, PIP5K1A, CDK14, CISD1, STK39, VRK1, MBOAT2, DGKI, NIM1K, EIF2AK4, MAPK10, TRIM37, VCPKMT, UPP2, MDM2, HUWE1, MAP3K13, RNF145, MAPK14, TRIM24, LCMT1, CASK, RC3H1, CDKL1, GALNT7, TRIO, B3GALNT1, FNTA, B3GLCT, PRMT8, DCLK2, MARK3, SLK, SOAT1, MIB1, MAP3K2, RNF10, SRPK2, PRKCI, LRRK1, HERC4, NEDD4L, POLA1
