GO_ID	Name	Gene Count	Gene Ratio	Fold Enrichment	p-value	FDR	-log10 FDR	FWER	Associated Genes
GO:0030136	clathrin-coated vesicle	31	0.011654135338345865	3.1582706766917292	1.2108718718872496e-09	8.476103103210748e-08	7.0718037691765385	2.2885478378669018e-06	PIK3C2A, AAK1, LMBRD1, VAMP2, AFTPH, ASTN1, DNAJC6, RNF216, EPN2, MYO6, SORT1, ADAM10, SGIP1, BTBD8, DENND1B, AP1G1, PICALM, CLTA, SCYL2, ASTN2, SNAP91, SNX9, VPS41, GAS7, CLTC, VTI1A, DENND1A, SCAMP1, CLINT1, HEATR5B, FCHO2
GO:0098839	postsynaptic density membrane	45	0.016917293233082706	2.92797118847539	5.490243034855673e-12	5.188279667938611e-10	9.284976621838359	1.0376559335877221e-08	NEO1, GRIK1, GRIA4, SHISA6, NLGN4Y, NLGN4X, GSG1L, SLC16A7, CLSTN1, ELFN2, LRRTM2, ERBB4, RGS7BP, NETO2, GRM5, GRID1, NECTIN3, PLPPR4, ADGRB3, NETO1, ADAM22, NRCAM, NSG2, ASIC2, RYK, CSMD2, DLG1, DLG2, TMEM108, GRIN2B, DCC, PTPRO, GRIK2, GRIA3, GRIK4, NTM, IQSEC1, SORCS3, LRRTM3, ATP2B2, SLITRK5, LRRC4C, IGSF21, GRID2, GRIA2
GO:1904115	axon cytoplasm	24	0.009022556390977444	2.9035714285714285	5.700222442349585e-07	2.7624154912924914e-05	4.5587109991807635	0.0010773420416040715	KIF5C, AGTPBP1, DST, ZC3H14, HIF1A, RAB21, KIF21A, AP3S2, AGBL4, SPAST, NETO1, AP3B1, UCHL1, OPA1, PAFAH1B1, DLG2, TMEM108, RAB27B, DYNC1H1, KIF1B, KIF5B, ARL8B, FBXW11, KIF3A
GO:0043197	dendritic spine	55	0.020676691729323307	2.8774131274131274	5.850402121088354e-14	8.505584622197683e-12	11.070295830262047	1.1057260008856989e-10	MAP1B, GABRB3, APBA1, GRIA4, SEPTIN11, SYT11, GABBR1, DNM3, KCND3, DGKI, OPHN1, GPHN, ARHGAP32, DOCK10, ITGB1, FXR1, GRM5, GRID1, ABI2, ANKS1B, APP, NEGR1, PPP3CA, MT3, CRIPT, ASIC2, HOMER1, CFL1, PRKAR2B, ZMYND8, PTEN, CPEB4, PTPRO, PPFIA2, ITSN1, PDE4B, NTRK2, GRIA3, MYH10, FARP1, NLGN1, SRGAP2, SIPA1L1, KCNN2, ATP1A2, SLC1A1, DIP2A, GPM6A, TANC2, CTTNBP2, KCND2, STRN, GRID2, SLC8A3, GRIA2
GO:0098685	Schaffer collateral - CA1 synapse	37	0.013909774436090226	2.864857142857143	8.47887491527252e-10	6.410029435946026e-08	7.193139976122435	1.6025073589865064e-06	CALM3, PTPRD, ACTB, APBA1, GABBR1, GSG1L, FBXL20, SLC16A7, ITGB1, RAP2A, LRRTM2, GRM5, PPP3R1, ATG5, NTNG1, ROCK1, PLPPR4, CTNNB1, CASK, PPP3CA, SYN2, NETO1, EEA1, RAB11A, FYN, ACTG1, PAFAH1B1, DCC, ADCY8, SNX27, TNR, SLC1A1, LRRC4C, PTN, GRIA2, GABRB1, CDH11
GO:0014069	postsynaptic density	93	0.03496240601503759	2.7802537231108655	2.0344969922112075e-21	5.49314187897026e-19	18.260179183709727	3.845199315279182e-18	SYT1, DTNB, SLC8A1, DNM3, KALRN, ATP1A1, CLSTN1, DROSHA, NETO2, RPS19, SYN2, PDLIM5, TMEM108, RTN3, GRIK2, ADCY8, IQSEC1, CAMK2D, SRGAP2, ABI1, DISC1, EGLN1, SLC8A3, MAP1B, GOPC, PLEKHA5, PRNP, DNAJC6, USP8, RPS18, ADD1, ANKS1B, RTN1, NETO1, PAK2, PTEN, GRIN2B, BMPR2, PAK3, STRN, SOS1, IGSF9B, GPSM2, EIF3E, CPEB3, DLGAP1, LRRC7, TSC1, CNKSR2, PKP4, CTNNA2, MPDZ, SH3KBP1, ARHGEF9, PRKN, PJA2, NEGR1, CRIPT, FYN, HOMER1, DLG1, ABLIM1, PPFIA2, PDE4B, NLGN1, MAGI2, PRICKLE1, RTN4, GRIA2, SHISA6, SYT11, SPTBN1, DGKI, PPP1R9A, GPHN, OPCML, PRICKLE2, ARHGAP32, HNRNPD, ADAM10, NPTN, ADD3, DLG2, CPEB4, NTRK2, EPS8, SORCS3, SPOCK1, MIB1, SIPA1L1, KPNA1, CTNND2, PSD3
GO:0098982	GABA-ergic synapse	39	0.014661654135338346	2.7204633204633204	1.7176777199155593e-09	1.1194520312553128e-07	6.950994511292146	3.246410890640407e-06	GABRB3, CLCN3, KIF5C, NXPH1, SLC4A10, SLC6A1, IGSF9B, CDH10, CACNA2D1, PCDH17, GABBR1, PLCB1, ERC2, KCND3, NRXN1, NLGN4X, GPHN, CSPG5, LRRTM2, ERBB4, SH3KBP1, LAMP5, ARHGEF9, FUS, GRID1, GAD1, GLRB, GNAO1, CACNA2D3, SLITRK2, PTPRO, NLGN1, NSF, PIK3C3, ATP2B2, MKLN1, KCND2, DISC1, GABRB1
GO:0098978	glutamatergic synapse	191	0.07180451127819548	2.6361599185128592	3.841318210384188e-39	2.4200304725420383e-36	35.61617916543546	7.260091417626115e-36	NEO1, ACTB, SYT1, GUCY1B1, KIFAP3, GABBR1, ZDHHC17, PLCB1, NRXN1, BCAN, OPHN1, FBXL20, THY1, CACNB4, CLSTN1, CSPG5, DOCK10, DROSHA, LRRTM2, ERBB4, NETO2, STXBP1, SACM1L, SYT17, PLPPR4, ARHGAP22, ELMOD1, LRRK2, UBE3A, SYN2, EFR3A, PPP3CA, AP2B1, RYK, DSTN, CNNM2, CFL1, PPP2R1A, TMEM108, GRIK2, RPS6KB1, ADCY8, GRIK4, SRGAP2, ERBIN, PIK3C3, ATP2B2, TNIK, STAU2, CTTNBP2, PRUNE2, LRRC4C, DISC1, EGLN1, PIAS1, MAP1B, NXPH1, APBA1, DOCK1, CNTN1, FXYD6, OGT, CDH10, FLRT2, NOS1AP, ATP2B4, NF1, FZD3, PLEKHA5, ATAD1, CNIH3, PCDH9, RGS7, USP14, USP8, PPP2R2A, FXR1, FUS, ATG5, NTNG1, ANKS1B, APPL1, CTNNB1, YWHAZ, NETO1, EEA1, PAK2, NRCAM, DOCK4, NSG2, GNAO1, ADAM23, SNAP25, CSMD2, PRKAR2B, PUM2, PTPRO, MARK1, MYH10, FARP1, PDE10A, CDKL5, SNX27, CADPS, PAK3, ATP8A1, LRRTM3, ATP2B1, GPM6A, SLC1A2, SOS1, NTRK3, CBLB, RAC1, CDH11, CLCN3, GRIK1, BRINP1, PTPRD, PCDH17, AKAP9, GSG1L, CLASP2, PPP3CC, DLGAP1, SLC16A7, ITGB1, BTBD9, CNKSR2, SH3KBP1, GRM5, GSK3B, PPP3R1, NRG3, PRKN, PJA2, PPP3CB, CRIPT, PRKAR1A, RAB11A, FYN, HOMER1, JAK2, DLG1, PPFIA2, NLGN1, TNR, SPARCL1, KCND2, ADGRL3, PRICKLE1, IL1RAP, RTN4, RAP1A, VWC2, ELMO1, DAAM1, SHISA6, NCDN, ERC2, SPTBN1, IL1RAPL1, DGKI, NLGN4X, PCDH7, APOE, ARHGAP32, RABEP1, CUL3, RGS7BP, HNRNPD, GRID1, MAPK14, AGO2, DAB1, ADAM10, NAPB, TRIO, CALY, PAFAH1B1, EPHB1, SLITRK2, ITSN1, EPS8, BRAF, NEDD4, SORCS3, MIB1, WASL, GRID2, KPNA1
GO:0030027	lamellipodium	60	0.022556390977443608	2.432311144353029	2.135021429255647e-11	1.9215192863300822e-09	8.716355252154774	4.035190501293173e-08	WASF1, PKD2, FER, ACTR3, ACTB, PKN2, APC, SNX2, RDX, RAPH1, PABPC1, PAK1, PHACTR4, PTPRM, ITGB1, CTNNA2, TSC1, ARHGEF7, CTNNA1, CCDC88A, KLHL2, ARHGAP31, TIAM2, DPYSL3, SPATA13, ABI2, ENAH, ROCK1, PLCE1, CTNNB1, SNX1, PIK3CA, PLEKHH2, MTSS2, NCKAP1, CFL1, ARHGEF6, SHTN1, SH3RF1, PTPN13, ABLIM1, PTPRO, CDC42BPA, ITSN1, RAB3IP, CDH2, MYH10, ANKRD28, CAPRIN1, SRGAP2, ABI1, EVL, PALLD, WASL, APBB2, UNC5C, SORBS2, CTNNA3, RAC1, RUFY3
GO:0000151	ubiquitin ligase complex	37	0.013909774436090226	2.4278450363196127	2.1363450309315895e-07	1.0912681374218119e-05	4.962068525035058	0.0004037692108460704	ARIH1, RNF19A, UBE2V1, MYCBP2, DCUN1D1, RNF144A, WDR26, FBXL7, FBXL3, FBXW4, CAND1, RANBP9, WWP2, FBXL4, UBR1, SUGT1, PRKN, ANKIB1, ARMC8, UBR2, FBXO9, FBXO11, UBE4A, UBR3, UBE4B, FBXO7, UBE2N, NEDD4, FBXL5, UBE3D, LMO7, MKLN1, FBXO21, SMURF2, FBXW11, SKP1, UBE2E1
GO:0030424	axon	126	0.04736842105263158	2.350843373493976	4.0153957869468564e-21	9.486372546661947e-19	18.022899823835264	7.589098037329559e-18	ACTB, SYT1, DYRK1A, SLC6A1, SLC8A1, GRM7, OPHN1, ATP1A1, ATP6AP2, PAK1, SEMA6A, KIF21A, SLC38A2, STXBP1, GAD1, MAP9, PRKAA2, BTBD8, LRRK2, CFL1, CREB1, SHTN1, SACS, TMEM108, ATL1, GRIK2, NIN, ADCY8, DSCAM, DSCAML1, STAU2, DISC1, SLC8A3, SEPTIN8, MAP1B, MYCBP2, CNTN1, INPP5F, NF1, DST, FZD3, FXR1, GAD2, SETX, ATG5, DOCK7, RAB5A, ADNP, ADAM22, SNAP25, NRCAM, IGF1R, ACTG1, SCN8A, SLC12A6, DCC, PTPRO, BMPR2, MYH10, WDFY3, SLC1A1, GPM6A, SLC1A2, NTRK3, NMNAT2, RUFY3, CADM2, SEPTIN11, ALCAM, SCN1A, ROBO1, PUM1, FEZ2, CTNNA2, ANK3, GSK3B, MAPK8, SPAST, KLHL24, PRKN, GFRA1, DHX36, HOMER1, COBL, PPFIA2, KIF1B, MAP4, PENK, PALLD, CD200, ADGRL3, MACO1, NFASC, DIP2B, SPG11, SLC4A10, NCDN, SYT11, AGTPBP1, IL1RAPL1, DGKI, PRICKLE2, ELAVL4, RGS7BP, AGBL4, ADAM10, APP, NPTN, MT3, HTT, UCHL1, PAFAH1B1, EPHB1, NCAM2, SLC38A1, DLG2, CPEB4, SCN2A, NTRK2, SCN9A, SMURF1, SBF2, TANC2, ARL8B, UNC5C, UNC80
GO:0030426	growth cone	41	0.015413533834586466	2.3004140786749483	2.5909279471353806e-07	1.2886457421278604e-05	4.889866456878281	0.000489685382008587	MAP1B, NEO1, AUTS2, CALM3, MYO5A, USP9X, ERC2, BASP1, THY1, ELAVL4, KLC1, KIF21A, TIAM2, EXOC6, DPYSL3, SETX, DOCK7, APP, PTBP2, LRRK2, SNAP25, PAFAH1B1, CFL1, CXADR, MYO9A, SHTN1, CPEB4, PTPRO, SLC2A13, EPS8, MYH10, DSCAM, LRIG2, ABI1, PALLD, COPA, GPM6A, APBB2, UNC5C, LMTK2, RUFY3
GO:0005938	cell cortex	56	0.021052631578947368	2.294179894179894	1.1260985108232602e-09	8.185869944061391e-08	7.08693515964496	2.1283261854559617e-06	FER, TRAK1, KANK1, INSC, GRB2, GPSM2, PARD3B, STK39, GRM7, FRYL, RIC8B, CLASP2, DST, ITCH, EPB41L2, ARHGAP32, C2CD5, TSC1, ARHGEF7, PARD3, PTK2, KIF21A, PPFIBP1, SPTAN1, FMN2, SEPTIN2, SPIRE1, ACTR2, GAD1, MYO6, CLASP1, NDFIP1, CTNNB1, ADD3, GNAI1, PRKD1, SNAP25, ENO1, PAFAH1B1, ASTN2, CLIP4, COBL, DCTN4, EPS8, MYH10, NEDD4, ITPR2, WDPCP, DYNC1H1, MARCKS, FNBP1L, MKLN1, CTTNBP2, AKAP13, FRY, RAC1
GO:0043025	neuronal cell body	103	0.0387218045112782	2.233933573429372	8.688044673095143e-16	1.4927640392863473e-13	12.82600883563376	1.642040443214982e-12	KIF5C, GRIA4, SLC6A1, SLC8A1, GABBR1, AGFG1, NRXN1, XRN1, BRINP2, PDE1C, SLC38A2, MBP, DNER, PGRMC1, PRKAA2, PTBP2, LRRK2, MT-ND1, PICALM, PPP2R1A, CFL1, BMPR1A, HSP90AA1, NAP1L4, GRIK2, DSCAM, KCNN2, STAU2, ATXN10, SLC8A3, MAP1B, S100B, INPP5F, KCND3, MAP2, CACNA1E, ASCL1, FZD3, ARHGEF7, STRN3, RTN1, IL6ST, RAB5A, CACNA1A, ADNP, PRKAR2B, RAPGEF2, PUM2, GNA12, SEZ6L, BMPR2, MYH10, LRP6, SLC1A1, GPM6A, STRN, SOS1, SORBS2, RUFY3, BRINP1, ALCAM, SCN1A, AKAP9, HSP90AB1, CNKSR2, SERPINI1, GRM5, PRKN, NEGR1, GFRA1, CRIPT, KLHL1, COBL, GHR, SORL1, PENK, CD200, KCND2, RTN4, GRIA2, ATP1A2, VPS13A, SLC25A27, SLC4A10, NCDN, APOE, PPP1R1B, SLC1A3, ASIC2, BRINP3, UCHL1, KCNQ1, PAFAH1B1, APOD, SLC38A1, NAPEPLD, ITSN1, SMURF1, VTI1A, UNC5C, FBXW11, LMTK2, SLC22A3
GO:0005802	trans-Golgi network	57	0.02142857142857143	2.206714285714286	3.957906470753837e-09	2.4934810765749176e-07	6.603193923363115	7.480443229724752e-06	TRAPPC9, PIK3C2A, ATP2C1, SLC9A7, SYT11, GOLGA4, VAMP2, PCSK5, CLASP2, DOP1A, PREPL, YIPF4, RAB21, WDR11, RAB31, BIRC6, PCSK1N, RAB10, SLC11A2, STX16, ARL5A, ATXN2, AP4S1, STX8, ATP9A, RAB6A, SYT17, LRRK2, AP1G1, OSBPL9, PRKD1, LAMP2, SNAP25, GCC2, RAB11A, CCDC91, FUT9, DENND5A, VPS54, WLS, SNX9, RAB14, CLTC, PLPP3, ATP9B, RELCH, ATP8A1, SCAMP1, GOLPH3, GSAP, ARFGEF1, SORL1, ECPAS, RBFOX1, RAC1, NBEA, NMNAT2
GO:0098794	postsynapse	66	0.02481203007518797	2.1932556713672593	3.4741078425528094e-10	2.7358599260103375e-08	7.56290614193659	6.56606382242481e-07	MAP1B, WASF1, SLC4A10, ELMO1, DOCK1, DTNB, SLC8A1, KIFAP3, NCDN, SRGAP3, SPTBN1, DGKI, CBLB, CPEB3, GPHN, MEF2C, THY1, OPHN1, LNX1, ATAD1, FRRS1L, DOCK10, PRNP, ARHGEF7, CUL3, RGS7BP, FXR1, GSK3B, STRN3, PPP3R1, STXBP1, ATG5, AGO2, SYT17, PRKN, APP, KCTD8, LRRK2, ADGRB3, DOCK4, TRIO, DSTN, NCKAP1, PRKAR2B, JAK2, SNX14, HOMER1, PDLIM5, CPEB4, PUM2, MARK1, BRAF, RAB3GAP1, SNX27, NLGN1, KIF1B, PIK3C3, ERBIN, MKLN1, STAU2, ATXN1, STRN, RTN4, SLC8A3, GRIA2, RAC1
GO:0045202	synapse	213	0.08007518796992481	2.1786374787695792	6.39750797765587e-30	2.015215012961599e-27	26.695678610088102	1.2091290077769594e-26	CYFIP2, KCNQ3, CNP, SNTG1, RPS6KA3, ACTB, CADM1, DTNB, SLC8A1, STXBP5, RPL7A, RIMS1, SRGAP3, DNM3, NRXN1, VAMP2, BCAN, OPHN1, FBXL20, CACNB4, CLU, UNC5C, ELFN2, RGS17, RAB21, LRRTM2, YWHAG, NETO2, DMD, SYNPR, SEPTIN2, MBP, GPRIN3, GAD1, PGRMC1, PCDH15, LRRK2, SGCZ, GLRB, SYN2, ELMOD1, AP2B1, MAPK1, CNNM2, PPP2R1A, EIF1AX, MYO9A, RTN3, GRIK2, RPL13A, RPS6KB1, ADCY8, GRIK4, DSCAM, CDH2, RPL13, DSCAML1, ATP2B2, PPP2CA, APBB2, SLC8A3, SEPTIN8, MAP1B, GABRB3, TMOD2, GOPC, ADARB1, PAK5, CPEB2, CNTN1, OGT, MYRIP, CDH10, FGF12, FLRT2, CACNA1E, TLN2, CNIH3, LAMA4, DNAJC6, USP14, PPP2R2A, TIAM2, RPS18, DPYSL3, GAD2, ATG5, ENAH, CTNNB1, CACNA1A, NETO1, SNAP25, NRCAM, IGSF11, TRIM9, ACTG1, TUBA1A, SLC12A6, RAPGEF2, FARP1, PDE10A, CADPS, ATP8A1, GNG2, LRRTM3, LRP6, MKLN1, SLC1A1, ATP2B1, SLC38A6, SLC1A2, SORBS2, EXT1, NMNAT2, RAC1, CDH11, SNAP23, CADM2, QKI, BRINP1, PLP1, SEPTIN11, RPL37, ERC1, NLGN4Y, RPL34, YWHAQ, PTPRZ1, PURG, NR3C1, CPEB3, GSG1L, DLGAP1, PTPRN2, ITGB1, MPDZ, SH3KBP1, MAPK8, PPP3R1, NDFIP1, NRG3, PRKN, SAMD4A, PJA2, CRIPT, PRKAR1A, HOMER1, SNX14, VPS54, DLG1, RPL21, NLGN1, TIAM1, RIMS2, MAGI2, KCND2, MACO1, IL1RAP, RTN4, PHACTR1, FCHO2, WASF1, SPG11, CNTNAP5, LRRTM4, GPC6, VWC2, SLC4A10, DAAM1, SYT11, ERC2, UTRN, PPP1R9A, NLGN4X, VCAN, DGKI, ETV5, PPA2, FRRS1L, RPL37A, HNRNPD, GRID1, DAB1, APP, PDE7B, RPL28, DTNA, CASK, SLC1A3, HTT, ASIC2, RPS6KA2, KIDINS220, RIT2, HNRNPLL, DLG2, CPEB4, ITSN1, EXOC4, GNB1, NRXN3, EPS8, SGCE, CAPRIN1, KCNIP1, SCAMP1, FAM171B, SIPA1L1, GRID2, RPS28, SPART, GLS, ARL8B
GO:0045211	postsynaptic membrane	65	0.02443609022556391	2.1507936507936507	1.4402928488319497e-09	9.721976729615661e-08	7.012245422781288	2.722153484292385e-06	GABRB3, LRRTM4, GRIK1, SYT1, GRIA4, SHISA6, IGSF9B, FXYD6, SYNE1, CNTN1, GABBR1, SUSD4, NTRK3, FLRT2, IL1RAPL1, KCND3, GRM7, PTCH1, UTRN, PCDH17, GPHN, CLSTN1, CSPG5, ATAD1, DGKB, CNIH3, LRRC7, ANK3, CNKSR2, RGS7, LRRTM2, ERBB4, DMD, GRM5, GRID1, NECTIN3, CTNNB1, KCTD8, GLRB, PICALM, NRCAM, GNAO1, ANK2, SLITRK2, NAPEPLD, GRIN2B, SSPN, KCTD16, GRIK2, GRIA3, GRIK4, NLGN1, SRGAP2, LRRTM3, KCNMA1, LRRC4C, KCND2, GRID2, IGSF21, STRN, ADGRL3, SLC8A3, GRIA2, GABRB1, RAC1
GO:0030425	dendrite	130	0.04887218045112782	2.114645858343337	1.9407076735257398e-17	3.6679375029636485e-15	14.43557807277008	3.667937502963648e-14	KIF5C, GRIA4, DTNB, DYRK1A, SLC8A1, GABBR1, CHL1, GRM7, OPHN1, THY1, PAK1, MTOR, XRN1, BRINP2, KIF21A, LAMP5, SLC38A2, DNER, PRKAA2, LRRK2, GLRB, MT-ND1, PPP2R1A, BMPR1A, SACS, TMEM108, NAP1L4, NIN, GRIK2, ADCY8, DSCAM, STAU2, BPTF, ATXN10, SLC8A3, MAP1B, GOPC, INPP5F, KCND3, MAP2, NF1, FZD3, CNIH3, PRNP, RGS7, FXR1, STRN3, RTN1, IL6ST, RAB5A, ADNP, TRIM9, NSG2, GNAO1, OPA1, PRKAR2B, GRIN2B, MARK1, BMPR2, FARP1, SLC1A1, STRN, SORBS2, RAC1, RUFY3, BRINP1, ALCAM, NLGN4Y, URI1, CPEB3, ANK3, MPDZ, GRM5, GSK3B, NDFIP1, SAMD4A, NEGR1, CRIPT, DHX36, FYN, HOMER1, SNX14, KLHL1, COBL, NLGN1, KIF1B, MAGI2, PENK, KCND2, GRIA2, SPG11, DIP2B, TRAK1, SLC4A10, NCDN, SYT11, RABGEF1, HNRNPU, IL1RAPL1, DGKI, PPP1R9A, NLGN4X, GPHN, APOE, PRICKLE2, ELAVL4, AGO2, ADAM10, APP, RPL28, ADCY2, NPTN, HTT, TTLL7, BRINP3, EPHB1, APOD, SLITRK2, CPEB4, NTRK2, SFPQ, MARK3, SGCE, CAPRIN1, KCNIP1, NRDC, KPNA1, CTNND2, UNC5C, GABRB1
GO:0005912	adherens junction	53	0.01992481203007519	2.1044688644688643	7.851195443179162e-08	4.496593753820793e-06	5.347116347131529	0.00014838759387608615	FRMD5, SNAP23, FER, ACTB, VEZT, DDX6, AFDN, APC, CDH10, PARD3B, STXBP6, RDX, PTPRM, PTPRK, LRRC7, CTNNA2, RAB10, PKP4, CTNNA1, ADD1, FRS2, LIMD1, ABI2, KLHL24, NECTIN3, ADAM10, CTNNB1, CTNND2, EIF4G2, CDH12, AHI1, CXADR, DLG1, DLG2, MAGI1, FRMD4A, PDLIM5, CRB1, CDH20, TJP1, BMPR2, CTNND1, CDH2, CDH4, EPB41L5, PLPP3, AJAP1, CDH13, CYTH1, PARD3, FRMD4B, CTNNA3, CDH11
GO:0043005	neuron projection	95	0.03571428571428571	2.0956450956450956	8.4306857235369e-13	9.958747510927963e-11	10.001795278373171	1.593399601748474e-09	CYFIP2, KIF5C, SYT1, CADM1, CHL1, VAMP2, CLSTN1, RAB21, RGS17, DCX, PLPPR1, SYNPR, PGRMC1, LRRK2, PPP2R1A, RTN3, RPS6KB1, CDH2, CAMK2D, TENM1, ABI1, STAU2, CPEB2, FLRT2, MAP2, ARHGEF7, RGS7, TIAM2, FXR1, DOCK7, RTN1, SNAP25, NRCAM, PTEN, CXADR, CNTN3, RAPGEF2, GRIN2B, HMGB1, PTPRO, GNA12, UFL1, MYH10, FARP1, CDH13, SLC1A1, GPM6A, SNAP23, IGSF9B, MYO5A, CPEB3, AHCYL2, ANK3, MPDZ, SH3KBP1, GRM5, NDFIP1, PRKN, SAMD4A, HOMER1, DLG1, KIF1B, BBS2, MAGI2, MAP4, CD200, MACO1, RTN4, RAP1A, VPS13A, NCDN, SYT11, PPP1R9A, ANKS1A, RGS7BP, APP, SLC1A3, ASIC2, ANK2, KCNQ1, RIT2, NCAM2, PAFAH1B1, NAPEPLD, DLG2, CPEB4, ITSN1, EPS8, BRAF, SCN9A, SIPA1L1, NCAM1, KIF5B, UNC5C, FBXW11
GO:0031901	early endosome membrane	55	0.020676691729323307	2.04739010989011	1.873258877589477e-07	9.834609107344753e-06	5.0072428971474805	0.00035404592786441116	CLCN3, ZFYVE9, APPL2, FIG4, RABGEF1, INPP5F, ZFYVE16, SNX2, ATP13A3, ITCH, MAPKAP1, MON2, RABEP1, RAB31, CFTR, RAB21, SLC11A2, LAMP5, STAM2, VPS13B, ATP9A, GPNMB, APPL1, APP, EGFR, RAB5A, SNX1, EEA1, SNX7, NSG2, EPHB1, NAPEPLD, OSBPL6, PLD3, WLS, DNAJC13, TMEM163, NTRK2, VPS41, RAB14, SNX27, WASHC4, SLC9A9, LRP6, SLC1A1, SORL1, LDLRAD4, KIF16B, ARL8B, TMEM30A, PIKFYVE, SNX13, ATP13A4, RAC1, ATP11B
GO:0005925	focal adhesion	100	0.03759398496240601	1.9024219024219025	1.1123015475831192e-10	9.140217064922153e-09	8.039043490373551	2.102249924932095e-07	ACTR3, CD46, ACTB, YWHAE, RPL7A, RDX, ATP6V0C, THY1, PAK1, LRP1, RAB21, MAP4K4, CTNNA1, ARHGAP31, JAK1, PPFIBP1, YWHAG, LIMD1, ARHGAP22, RPS19, MAPK1, MTSS2, CFL1, PTPRA, ITGAV, RPL13A, CDH2, PPIA, CD81, EVL, FLRT2, DST, TLN2, ITGB8, ARHGEF7, HNRNPK, MPZL1, RPS18, ADD1, ENAH, DOCK7, CTNNB1, YWHAZ, MAPRE2, ACTG1, RPL18, GNA12, PPP1R12A, DCTN4, ARHGAP26, HSP90B1, MARCKS, ITGA8, CDH13, SCARB2, SORBS2, RAC1, SNAP23, PEAK1, ALCAM, HACD3, YWHAQ, PABPC1, CPNE3, CLASP2, TNS3, ITGB1, PTK2, SH3KBP1, ACTR2, RPL5, DLC1, NCKAP1, SSH2, RPL3, HSPA8, EPB41L5, TEK, PALLD, RPS2, WASF1, NFASC, RPLP1, EPB41L2, CD59, RPL37A, RAB10, STX16, FERMT1, YWHAB, CLASP1, ADAM10, CASK, EGFR, FOCAD, PTPN12, CLTC, LMO7, LPP, PDCD6IP
GO:0098793	presynapse	58	0.02180451127819549	1.8790197250448297	1.4234961064110173e-06	6.561969856382493e-05	4.182965768957105	0.0026904076411168225	SNAP23, SLC4A10, ACTB, DAAM1, SLC6A1, PPFIBP2, AAK1, STXBP5, SYT11, GABBR1, ERC1, DNM3, ERC2, DGKI, NRXN1, CANX, OPHN1, FBXL20, PPP3CC, THY1, CACNB4, NF1, CACNB2, RGS7, KIF21A, RGS7BP, YWHAG, FXR1, STXBP3, GSK3B, AP3S2, STXBP1, GAD1, SYNJ1, PRKN, SGIP1, APP, BTBD8, EFR3A, DSTN, PDLIM5, NAPEPLD, ITSN1, CDH2, NLGN1, CADPS, KIF1B, SCRN1, SLC1A1, TNIK, GPM6A, PRUNE2, RAB8B, DISC1, ITSN2, SEPTIN8, FCHO2, SLC22A3
GO:0048471	perinuclear region of cytoplasm	160	0.06015037593984962	1.7547551598543099	4.995818374345333e-13	6.29473115167512e-11	10.201022813902	9.44209672751268e-10	GALNT2, CYFIP2, ANKRD13C, APC, EIF4A1, DNM3, MEIS2, VAMP2, CLU, PTPRM, USO1, MTDH, SLC11A2, GALNT1, EXOC6, RAB3C, ATXN2, STXBP1, GAD1, SYNJ1, SEC23A, ARHGAP10, ACSL3, PICALM, FAF1, HSP90AA1, SH3RF1, NELL1, SHTN1, RAB3IP, DICER1, VAPA, ATP9B, TENM1, SERINC5, NDFIP2, TLK2, CCNT2, CYB5R4, STK33, CMYA5, BPTF, DISC1, ATXN10, SLC8A3, GNAS, MAP1B, APBA1, MYRIP, S100B, PRKCE, NOS1AP, MTPN, SLC30A7, FXR1, UBR5, YTHDC2, TPD52, MYO6, SORT1, CTNNB1, CRBN, PRKD1, CDK19, PAK2, LAMP2, SNAP25, TGFA, PRKAR2B, PTGDS, RAPGEF2, PUM2, KLHL7, RAB14, HSP90B1, ABCA1, CLINT1, CERT1, ATP9A, SORBS2, EXOC1, ATP6V0A1, PKN2, PLCG2, MAP3K4, LNPEP, CYLD, ATP2C2, UBQLN1, EIF4A2, AFTPH, HSP90AB1, ITGB1, MAPKAP1, TSC1, PKP4, PTK2, SPAST, NDFIP1, TRPC4AP, PRKN, RASA2, PIK3CA, FYN, LRPPRC, VPS54, DLG1, TNKS2, COBL, SPAG9, AKAP6, FBXL5, ITM2C, MAGI2, ARFGEF1, USP33, RAP1A, HEATR5B, DDX6, DAAM1, GALNT3, PTCH1, RBM4, TRIM37, TAOK1, RAB10, ZDHHC20, STX16, FMN2, SPIRE1, YWHAB, STX8, GAPDH, DAB1, VPS50, SEC31A, APP, EGFR, MYO16, CTIF, AP1G1, SLC1A3, MT3, HTT, TNFSF13B, PAFAH1B1, APOD, UPF2, CPEB4, NTRK2, NEDD4, VTI1A, SLK, SBF2, PIK3R1, DNM1L, KIF5B, PRKCA, RAB8B, LMTK2
GO:0005813	centrosome	133	0.05	1.7454237288135594	5.914063404655036e-11	5.080718106726372e-09	8.294074900364139	1.1177579834798017e-07	BBS9, NME7, CALM2, KIFAP3, APC, SLMAP, CALM1, KIF13A, FBXL7, CDC14A, PAK1, UVRAG, CEP70, CEP126, BIRC6, POC1B, ALMS1, GNAI1, EVI5, IFT80, KIZ, CSNK1A1, CEP350, MAPK1, FAM110B, PDE4D, NIN, RAB3IP, DISC1, SKP1, KMT2E, CNTLN, KIF3A, CALM3, RNF19A, PRKACB, HOOK3, RTTN, TTLL5, USP9X, PPP4R3A, PCGF5, ARHGEF7, CCDC88A, PDE4DIP, CEP85L, CTNNB1, KAT2B, PCM1, DZIP1, PRKAR2B, PIBF1, RGCC, PPP1R12A, DCTN4, RABGAP1, CDKL5, MARCKS, RAD18, ECPAS, DYNC1I2, RMDN1, ORC2, FRY, TTC8, PPP4R2, CCDC146, OFD1, KIF2A, CEP83, TACC1, DHX9, ERC1, ERCC6L2, CYLD, AKAP9, NR3C1, AKAP11, CLASP2, SDCCAG8, CSPP1, CEP192, CEP290, PTK2, GSK3B, SPAST, CEP97, C10orf90, PJA2, CCDC66, PRKAR1A, AHI1, ANKRD26, RAB11A, CAMSAP2, ROCK2, CKAP5, PDE4B, TTC19, KIAA1217, CHD4, DYNC1H1, INTS6L, WRN, MAGI2, USP33, MTUS1, NEK1, CCDC92, TNKS, CDC27, CEP170, TUBGCP3, TTC28, SLAIN2, HNRNPU, ITSN2, CUL3, CLASP1, TAPT1, PAFAH1B1, FIGN, PPP4R3B, NEK7, EXOC4, TACC2, ARHGEF10, ATM, MIB1, CCDC14, PDCD6IP, FBXW11, SCLT1
GO:0016607	nuclear speck	90	0.03383458646616541	1.7334754797441365	1.1188852429001622e-07	6.219685614945019e-06	5.2062315669402475	0.00021146931090813064	MTREX, DYRK1A, THOC2, MAML2, PLCB1, BASP1, CACNB4, HIF3A, KAZN, RSRC1, PRKAA2, WAC, RBM39, BMP2K, CSNK1A1, RSBN1L, PIAS2, LUC7L2, SF3B1, TENM1, ZC3H13, PIAS1, KMT2E, PSPC1, SFMBT2, SRSF11, PPP4R3A, CWC22, SPOP, NSL1, SMC6, DENND1B, HBP1, PAK2, DZIP1, ARGLU1, DHX15, RAD18, SMURF2, ASCC3, SGK1, MRTFB, ZNF638, NR3C1, DDX17, RBM25, NSRP1, HIF1A, KAT6A, YTHDC1, CDC40, SCAPER, PRKN, HP1BP3, TRIP12, DHX36, PRPF40A, TCERG1, SARNP, SON, IFI16, TCF12, MORF4L1, RBM27, WRN, CDK13, DDX39B, SRSF6, NRIP1, SREK1, HNRNPU, PSME4, COP1, RBM4, MEF2C, CPSF6, ZC3H14, FBXL4, FTO, SMC5, DDX5, MAPK14, SRSF5, PPP4R3B, YLPM1, SFPQ, GATAD2B, GPATCH2, BCLAF1, SRPK2
GO:0005856	cytoskeleton	182	0.06842105263157895	1.7333333333333336	2.8368523696248475e-14	4.4680424821591345e-12	11.349882706263774	5.361650978590962e-11	PPP1R12B, ACTR3, KIF5C, MID1, SNTG1, ACTB, DYRK1A, TRIP11, APC, DNM3, ARHGAP21, RDX, RAPH1, DGKG, BASP1, KALRN, CLU, CTNNA1, DCX, KIF21A, KAZN, DMD, SEPTIN2, MAP9, LRRK2, SGCZ, BCAS3, MAPK1, CCDC6, CFL1, SEPTIN7, LRRFIP1, SHTN1, PDE4D, RAB3IP, TRIB2, WIPF1, EML5, TENM1, MACF1, CCSER2, TLK2, EVL, TNIK, ABI1, RFLNA, STK33, SPATA7, DISC1, PARD3, SEPTIN8, PIAS1, KIF3A, MAP1B, FRMD5, TMOD2, FER, MYCBP2, HOOK3, PRKCE, MAP2, ABL2, DST, TLN2, TBCA, KLC1, EML4, KLHL2, TMSB4X, ADD1, ABI2, PDE4DIP, ENAH, CTNNB1, PCM1, MAPRE2, SNAP25, TRIM9, PTPN4, ACTG1, MARCKSL1, TUBA1A, ARL6IP5, GRIN2B, MARK1, DCTN4, ARHGAP26, FARP1, MARCKS, FNBP1L, DPYSL2, CALD1, DYNC1I2, KIF16B, FRMD4B, RAC1, AUTS2, CCDC146, PEAK1, PKN2, KANK1, SEPTIN11, AMPH, KIF26B, CYLD, SLC30A9, AKAP9, CLASP2, PREPL, CDC42SE2, NAV1, CTNNA2, ANK3, KLHL3, PTK2, PKP4, SPTAN1, SH3KBP1, MAST2, SGCD, SPAST, ACTR2, ROCK1, CAMSAP2, LRPPRC, SSH2, KLHL1, PTPN13, COBL, ROCK2, CDC42BPA, ABLIM1, SPECC1L, INVS, EPB41L5, TEK, DYNC1H1, KIF1B, KLHL5, MAP4, PALLD, CAPZA1, LRRC49, WASF1, APPBP2, ARHGAP6, SYNE1, TTC28, SLAIN2, ERC2, SPTBN1, UTRN, PPP1R9A, TTC17, GPHN, EPB41L2, MTSS1, FERMT1, FMN2, SPIRE1, ATXN7, CLASP1, GAPDH, EML6, ADD3, MAP2K6, FHOD3, PLEKHH2, ANK2, PAFAH1B1, TOGARAM1, FRMD4A, PPP2R2B, DCLK2, EPB41L4A, SGCE, SLAIN1, STIM1, SIPA1L1, KIF5B, WASL, CTNNA3
GO:0000139	Golgi membrane	158	0.059398496240601506	1.7303697716710447	1.9337641082792604e-12	2.1498906850869424e-10	9.667583621977641	3.654814164647802e-09	ASAP1, GALNT2, ST3GAL5, SCFD1, GOLGB1, TRIP11, SLC35A1, TMED7, CSGALNACT1, RFFL, ZDHHC17, RAB2A, ARHGAP21, KIF13A, ATP6V0C, ST3GAL6, DOP1A, CLSTN1, ATP6AP2, CSPG5, MTOR, RAB21, CHPT1, USO1, SGMS1, GALNT1, SACM1L, DSEL, SEC23A, EXT2, LRRK2, SGCZ, GOSR1, LARGE1, MGAT4A, FUT9, TRIM23, RTN3, ACER3, ATL1, VAPA, GOLPH3, GOLIM4, NDFIP2, GLCE, TMEM165, GOPC, CHST11, USP32, HACE1, ATP2C1, TMED10, FIG4, GALNT10, B4GALT6, FUT8, SLC30A7, TVP23C, GLG1, KIAA0319L, GAD2, RTN1, NOTCH2, GALNT13, ITM2B, WLS, LMAN1, ABCA5, STX18, RAB14, GALNT11, CASD1, RNF24, ATP6V1A, PLPP3, ABCG1, LDLRAD4, UST, PLD3, SH3GLB1, SCARB2, MGAT5, EXT1, NMNAT2, ST6GAL2, CLCN3, ST3GAL3, VPS45, ERC1, ARFIP1, ATP2C2, MAPKAP1, RIC1, SGCD, HS6ST2, VPS13B, ATP6V1H, DSE, C1GALT1, RAB6A, NDFIP1, ROCK1, PRKN, PLCE1, PJA2, ST8SIA1, DENND5A, GNPTAB, RAB11A, TNKS2, RAB1A, ATF6, ZDHHC21, ARFGEF1, SORL1, COPA, PIKFYVE, B3GAT2, TNKS, MAN1A2, B4GAT1, GCNT2, SLC9A7, GALNT3, COP1, SEC22B, PCSK5, ARHGAP32, COG6, CD59, RAB10, ZDHHC20, HUWE1, STX16, COG5, ADAM10, FNDC3A, EGFR, AP1G1, GOLGA4, GALNT7, SLC35A3, XYLT1, SLC10A7, TMEM167A, PITPNB, NAPEPLD, PDGFC, SSPN, TMEM87A, VTI1A, SGCE, FKTN, HS2ST1, TMBIM4, NCAM1, CYTH1, ICA1
GO:0005794	Golgi apparatus	246	0.0924812030075188	1.7206349206349207	1.340169166347452e-18	2.814355249329649e-16	15.550621083487705	2.5329197243966845e-15	ASAP1, GALNT2, PDGFRA, GOLGB1, SYT1, GRB2, TRIP11, FAM3C, SLC35A1, TMED7, KIFAP3, CSGALNACT1, ZDHHC17, RAB2A, ARHGAP21, TM9SF2, ATP1A1, DOP1A, CLU, RNF115, CSPG5, MTOR, MON2, BIRC6, CHPT1, RAB31, USO1, RAB21, SLC11A2, GALNT1, SNX1, HS6ST3, ATXN2, SACM1L, EXT2, LRRK2, ACSL3, ELMOD1, PICALM, GOSR1, ZDHHC14, CCNI, MAPK1, LARGE1, FUT9, SH3RF1, RTN3, ATL1, SCRG1, RAB18, PDXDC1, GOLPH3, ATP9B, RELCH, GOLIM4, SPPL3, NDFIP2, TENM1, MACF1, SERINC5, MOSMO, APBB2, GLCE, CPQ, TBC1D5, TMEM165, CEPT1, ATP11B, SORCS1, RAF1, GOLM1, GOPC, CHST11, USP32, TRAPPC9, APBA1, ATP2C1, TMED10, HOOK3, PRKCE, GALNT10, PLOD2, B4GALT6, CHIC2, FUT8, YIPF4, SLC30A7, TVP23C, WDR11, GNAQ, PRNP, RAP2A, GLG1, CCDC88A, KIAA0319L, CAMKMT, STRN3, MYO6, NAPG, SORT1, HERC1, PDE4DIP, CPE, OSBPL9, PRKD1, NSG2, CCDC91, JAKMIP2, SCYL2, PTGDS, GALNT13, ITM2B, WLS, SNX9, LMAN1, RAB14, GALNT11, VPS41, CASD1, RNF24, ABCA1, PLPP3, ATP8A1, ABCG1, LRP6, HEATR5A, GSAP, CLINT1, UST, CERT1, ATP9A, TMEM30A, MGAT5, EXT1, NMNAT2, TRAPPC8, ST6GAL2, CLCN3, CEP83, VPS45, PIK3C2A, DYM, RNF144A, ARFIP1, ATP2C2, AKAP9, CLASP2, PREPL, AFTPH, MAPKAP1, ANK3, DYNC2H1, VPS13B, HS6ST2, AP4S1, DSE, RAB6A, NDFIP1, PRKN, TBC1D14, GFRA1, DENND5A, GNPTAB, RAB11A, CAMSAP2, HFM1, VPS54, DLG1, RAB1A, RABGAP1L, RAB27B, SLC2A13, ATF6, ZDHHC21, DENND4C, NLGN1, ITM2C, ARFGEF1, SORL1, USP33, COPA, MTUS1, MALRD1, B3GAT2, TNKS, VPS13A, HEATR5B, GIGYF2, MAN1A2, PKD2, CST3, B4GAT1, TTC3, SLC9A7, SYNE1, RICTOR, SYT11, GALNT3, SEC22B, PTCH1, PCSK5, APOE, ARHGAP32, PCSK1N, RAB10, CUL3, ZDHHC20, STX16, OCIAD1, RHOBTB3, AP3S2, AGBL4, PACS1, COG5, CLASP1, ADAM10, APP, FNDC3A, EGFR, LRBA, WWOX, AP1G1, GOLGA4, HTT, GALNT7, AP3B1, XYLT1, SLC10A7, TMEM167A, SLC35A3, GCC2, USP6NL, PITPNB, NAPEPLD, TMEM87A, NEDD4, VTI1A, RAB3GAP1, SGCE, FKTN, HS2ST1, SCAMP1, TMBIM4, DNM1L, BCL9, LMTK2
