GO:0032991	protein-containing complex	163	0.06127819548872181	1.6986348779080946	4.387109496419539e-12	4.3640194464383835e-10	9.360113322826578	8.291636948232929e-09	PDGFRA, MT-CYB, SEM1, ACTB, UBE2V1, CALM2, GUCY1B1, PLCB1, CALM1, SNX2, MAP3K5, ATP1A1, MGA, MFF, CLU, CUL4B, PAK1, UVRAG, DMD, MBP, STXBP1, MIER1, DGKH, RBM39, LARGE1, SPATS2L, HSP90AA1, FBXO7, PPIA, STAU2, TANK, MITF, ATXN1, KMT2E, FER, GOPC, ZFYVE9, CALM3, TFCP2, OGT, PARD3B, SMARCC1, RBBP4, ATP2B4, XPO1, NUP58, CBX5, ARHGEF7, MAGED1, XRCC5, STRADA, STRN3, UBR5, CAMKMT, ATG5, MYSM1, KHDRBS3, SUGT1, CTNNB1, KAT2B, OSBPL9, PCM1, EP300, CXADR, RAPGEF2, WNK1, UFL1, HSP90B1, BLM, PPM1E, SSBP3, SH3GLB1, PTN, SMARCE1, PKN2, NCOA3, SASH1, DHX9, GPSM2, EIF3E, ERCC6L2, YWHAQ, URI1, NR3C1, UBQLN1, ITCH, AKAP10, HIF1A, HSP90AB1, CFTR, RIC1, TSC1, HIPK2, CEP290, SMAD4, PCP4, EYA1, CEP97, PXK, HSPH1, PRKN, SMAD1, RPL5, PRKAR1A, RAB11A, SMAD5, CAB39, HNRNPC, CRB1, RPL3, RAB3GAP2, CKAP5, TJP1, NCOA1, AKAP6, CHD4, ALK, MAGI2, SMAD2, SCP2, PLEKHA2, RNF111, ATP1A2, GIGYF2, WASF1, STT3B, FOXO3, INSC, NCOA2, HNRNPU, SPTBN1, UTRN, DGKI, PDSS2, CDK8, MEF2C, USP10, FBXW7, RABEP1, RFC1, RBMX, YWHAB, AKAP7, APP, DTNA, TRA2B, EGFR, SNX1, PRKDC, HTT, KIDINS220, MLLT10, UBE2N, NEDD4, CLTC, RAB3GAP1, GATAD2B, UGGT2, DNM1L, PRKCA, COPS2, KDM1A, TRPS1
GO:0031410	cytoplasmic vesicle	191	0.07180451127819548	1.6287287602265574	3.852922784970591e-12	4.04556892421912e-10	9.393020395368193	7.282024063594417e-09	RAB7A, CD46, SYT1, FAM3C, STXBP5, TMED7, RFFL, ZDHHC17, AGFG1, RAB2A, ARHGAP21, SNX2, VAMP2, ATP6V0C, MFF, CLU, ATP6AP2, UVRAG, MTOR, ASTN1, RAB21, RAB31, SLC11A2, LAMP5, ATP6V1C1, STXBP4, SYNPR, PHLDA1, SCG3, GPNMB, SEC23A, SGK3, BTBD8, LRRK2, PICALM, AP2B1, STX17, TMEM163, ADCY8, GPRC5B, ITPR2, IQSEC1, WIPF1, SRGAP2, UQCC1, PIK3C3, TRPM7, HERC3, TBC1D5, SEPTIN8, GNAS, GABRB3, VEZT, TMED10, MYRIP, PAM, DUSP16, FTH1, CHIC2, DST, SLC30A7, KLC1, WDR11, DMXL2, DNAJC6, USP14, CCDC88A, KIAA0319L, GAD2, MYO6, SORT1, APPL1, CPE, RAB5A, SLC18B1, DENND1B, EEA1, LAMP2, NSG2, TRIM9, TAX1BP1, TGFA, SCN8A, SCYL2, WLS, SNX9, RAB14, VPS41, SPRED1, ATP6V1A, SLC35F1, CADPS, RAB9B, FNBP1L, ATP8A1, LRP6, CLINT1, ATP2B1, ECPAS, CHIC1, KIF16B, TMEM30A, SH3GLB1, NMNAT2, RAC1, ATP6V0A1, SNAP23, CLCN3, VPS45, PIK3C2A, APPL2, RNF144A, LMBRD1, MYO5A, AMPH, LNPEP, ATP2C2, SLC30A9, PIP4P2, UBQLN1, PTPRN2, AFTPH, ITCH, ITGB1, ATP6V1B2, CEP290, SH3KBP1, SERPINI1, EPN2, VPS13B, SPAST, ATP6V1H, DSE, RAB6A, TBC1D14, RAB11A, ASTN2, SSH2, RABGAP1L, SPAG9, DENND4C, CXXC4, DENND1A, SLC9A9, KIF1B, SORL1, PENK, COPA, MALRD1, VPS13A, HEATR5B, SPG11, PKD2, TRAK1, SEC24B, SYT11, ARFGEF3, DGKI, C2CD5, RABEP1, RAB10, RNF216, AP3S2, FMN2, SPIRE1, ADAM10, SEC31A, APP, FNDC3A, AP1G1, SLC1A3, SNX7, HTT, CALY, AP3B1, CLTA, KCNQ1, USP6NL, MCTP1, DENND4A, ITSN1, VTI1A, CLTC, ATM, MIB1, DNM1L, WASL, RAB8B, COMMD1, PIKFYVE, ICA1
GO:0005654	nucleoplasm	703	0.2642857142857143	1.5082373431500613	4.544012182657253e-35	2.1470457563055518e-32	31.66815870009134	8.588183025222208e-32	NSD3, GRB2, MTREX, MAML2, NDUFA13, ADK, NFIA, ARPP19, MGA, MTOR, SAMHD1, NIPBL, DROSHA, NAV2, SECISBP2, ERBB4, KAZN, SENP7, NECAB1, BACH2, MIER1, ELF1, RPS19, HDGFL3, ANKRD17, MAPK1, PIAS2, RUNX1T1, ANAPC5, CHD6, REV1, RAB3IP, NCOA6, NAP1L4, NRG2, MTA3, BRWD1, HECTD1, ZC3H13, ANKRD28, TIAL1, TFCP2, POT1, VEZT, SHLD2, ARID2, USP48, MINDY3, ARID4A, UBE2D3, XPO1, CAND1, TET2, HNRNPK, XRRA1, SUPT3H, FUS, ADD1, SETX, KDM2A, ZNF655, KHDRBS3, YTHDC2, MED14, TET1, DCAF6, CTNNB1, BTRC, VEZF1, GTF2F2, NEXMIF, CDKL5, BTAF1, STAG1, BLM, CHD7, POU2F1, SGK1, RAC1, PPP4R2, PHACTR3, RERE, AFF4, GTF2A1, PDS5B, CHD2, PUM1, PKM, UTY, SLTM, UBN2, JARID2, KDM4C, SMARCA2, CUL2, SPAST, TDRD3, RPL5, PIP4K2A, DPF3, SMAD5, JAK2, TCERG1, PRDM2, IFI16, HSPA8, PTPN13, TCF12, BBX, WRN, ZNF559, SMAD2, PHF21A, MSH3, XRN2, ZFHX3, XIAP, TCF4, APPBP2, HNRNPA2B1, SREK1, HNRNPU, PSME4, TRRAP, RBM4, BACH1, EPB41L2, PPM1A, RBPJ, HNRNPD, MAP2K6, WWOX, PPARGC1A, ATF2, ATRX, FBXO11, RPS6KA2, SRSF5, NAPEPLD, CCNY, CSNK2A1, POGZ, SMURF1, NR3C2, LCOR, CCNH, GATAD2B, RPRD2, CDC73, ZNF609, TLK1, NR2C2, RPS28, RBFOX1, KPNA1, FBXW11, ZRANB2, NR1D2, NOL4, KDM1A, NUP98, SHPRH, UBE2V1, ZC3H6, NLK, DYRK1A, THOC2, WDR26, APC, RFFL, HNRNPH1, CUL4B, CDC14A, TAF15, KDM5A, RSF1, SUB1, ESRRG, SYNCRIP, ANKRD10, WAC, BTBD8, EYA2, PPP3CA, CEP350, USP3, PHF6, XRCC4, USP11, TM7SF3, PTMA, IQSEC1, PRKCB, WDR70, MITF, CDC14B, MLLT3, USP43, SETBP1, ZNF451, PSPC1, RALYL, UBE2W, GTF2I, PRKACB, DUSP16, SMARCC1, RBBP4, PCGF5, PPHLN1, TSEN15, SOX5, PPP2R2A, ARNT2, LIN52, STRADA, SLF2, TEAD1, NUCKS1, ABI2, SETD2, MNAT1, STAG2, SP3, CELF2, RPS6KA5, ARMC8, IBTK, MED27, PTPN4, PELI1, USP15, MEF2A, DZIP1, GCFC2, RGCC, HMGB1, HNRNPH3, KLHL7, APTX, DHX15, RAD18, MKLN1, RPS24, ETS1, ECPAS, CERT1, HMBOX1, ARID5B, SMARCE1, FBXL17, RCOR3, REV3L, FARSB, CSNK1E, CLOCK, URI1, ZNF638, CPNE3, FOXO1, RPAP2, NSRP1, DCAF8, TCF7L2, SMAD4, CDC40, EYA1, PSMD1, AGL, LRPPRC, ZMYND8, HNRNPC, SARNP, ATF6, NCOA1, ZMYND11, PPP2R5C, RBM27, TIAM1, EPC1, CHD9, NR6A1, ZHX1, ZHX3, TRA2A, MTF2, INTS6, CWF19L2, TOP2B, PHC3, TFDP2, WAPL, RAD21, ZNF148, ARID4B, U2SURP, NRIP1, USP47, RBM5, PDS5A, SYNE1, COMMD10, CREBBP, CELF1, AGTPBP1, COP1, PBRM1, MEIS1, ZEB2, ETV5, CPSF6, ZNF521, RFC1, ATAD2B, TASOR2, ZMAT3, SNRPN, CBFA2T2, SH3BGRL2, CHD1L, FIP1L1, PRKDC, NMD3, TP53BP1, MACROD2, TAB2, NBN, NSD1, KPNA4, NEDD4, ARID1B, ZMYM6, USP37, CGGBP1, MXI1, PRKCA, COMMD1, ZEB1, PPP1R12B, SEM1, RPS6KA3, PYGO1, SP4, NCOR1, ZFC3H1, CALM1, RPRD1A, SH3D19, PAPOLA, HNRNPR, CENPP, BICRAL, CREB3L2, MORF4L2, MSRA, YEATS2, AEBP2, HIF3A, DOCK10, POLK, KATNBL1, PLPPR1, KMT2A, PSMD14, RAD50, PRKAA2, ASXL1, RBM39, FAF1, SPIN1, CENPC, HSP90AA1, FBXO7, FUBP1, SCAF11, CAMK2D, SF3B1, TLK2, JAZF1, FOXG1, SKP1, PIAS1, KMT2E, R3HDM2, TBL1XR1, ADARB1, HMGN1, PAK5, AHCTF1, SRSF11, OGT, S100B, BTBD10, TPR, RNASEH2B, ZFPM2, ORC4, RBBP7, ZHX2, RPS18, RNGTT, STRN3, UBR5, MYO6, NPAS3, KAT2B, UBE2E3, CDK19, PAK2, ZBTB20, NOTCH2, PTEN, ARGLU1, RORA, DMTF1, KLF7, SETD3, CREBRF, ZFP91, RIF1, PHYHIP, EMSY, SOX4, ORC2, USP24, QKI, INO80D, KIF2A, PKN2, NCOA3, PIK3C2A, KMT5B, RYBP, KANSL1, ERCC6L2, RNF169, UBQLN1, DDX17, RB1, RBM25, UHRF2, HIF1A, TASOR, HIPK2, MAPKAP1, KAT6A, YTHDC1, SOX8, ARID1A, GSK3B, MAPK8, PPP3R1, SCAPER, ZNF207, UBA6, TRIM33, PPP3CB, TRIP12, SMYD3, TNPO1, SENP2, SNAPC3, TNRC6B, KMT2C, KCTD1, SMG1, ASH1L, CHD4, USP12, NFAT5, RNF111, NEK1, RPS2, UBE2E1, DDX39B, CDC27, FOXO3, SRSF6, NCOA2, ANKRD12, PPWD1, HLTF, ZNF131, THRB, CDK8, KPNA5, USP10, DCAF5, RANBP9, PUM3, FBXW7, SUZ12, DCAF10, FTO, CUL3, SMC5, DDX5, PPP6R3, AGO2, TRA2B, GCC2, IPO8, RIT2, PARG, NAALADL2, UBE2N, ATM, TERF2IP, HNRNPDL, HERC2, BCLAF1, TNRC6C, SERGEF, CWC27, BCL9, NME7, RAPGEF5, PTTG1IP, SSBP2, ACTB, AFDN, PPP1R10, CAMK4, RAD51B, RNF38, ATF7IP, FOXN2, PAK1, CREM, ICE2, MDM4, BRD7, UIMC1, USP22, UBC, INTS7, SMARCAD1, PWWP2A, SMARCA5, LIMD1, INTS8, TLE4, ARHGAP22, KDM6A, AFF3, CREB1, HIVEP2, RPS6KB1, CCNC, LUC7L2, TOP1, WASHC4, CCNT2, TNIK, STAU2, MED13, PSIP1, BPTF, ATXN1, HIPK3, SFMBT2, MYCBP2, MBD5, SCMH1, PPP4R3A, CWC22, EYA3, ATF7, TPT1, ATE1, NF1, ELP4, FANCL, CBX5, NUP214, TIAM2, XRCC5, CAMKMT, FOXP1, LYST, SPOP, MYSM1, TRERF1, PIK3CB, ANKS1B, SFMBT1, SMC6, PWWP3A, YWHAZ, RAD23B, TCF7L1, SPIDR, MARCKSL1, EP300, JMJD1C, PPP1R12A, SPRED1, KDM5D, DDX1, EGLN3, CHD1, RBFOX2, EFCAB13, PHF20L1, SESN1, NFIB, SMURF2, ZBTB38, NRF1, WDR33, ASCC3, NSMCE2, ZNF438, MYT1, MBNL1, SCAF8, FAM133B, PRIM2, DHX9, ANAPC10, EIF3E, YAF2, ASXL2, NR3C1, RNPC3, TAF2, SENP6, ITCH, XPO4, HSP90AB1, PSMA1, ITGB3BP, ZNF462, HNRNPA3, KAT6B, RBM26, SPATA13, HSPH1, AKT3, LRMDA, SMAD1, GSTCD, CMIP, WDR27, PRPF40A, DHX36, NUP42, FAN1, PRRX1, SF1, SETD5, MRTFA, ATR, MORF4L1, TOX3, PRMT2, ARFGEF1, CDK13, BABAM2, ARIH1, KPNA3, SMCHD1, MBNL2, CDK14, STK39, MEF2C, MAPK10, SOX6, NKTR, RBMX, RBL2, HUWE1, CSTF3, SPEN, JADE3, ATXN7, MAPK14, TRIM24, CASK, MYO16, PBX1, AQR, ELP2, HTT, CUL1, UCHL1, NOVA1, MED13L, PPP4R3B, PTPN12, NEK7, TACC2, HDAC8, SFPQ, MLLT10, SS18, LMO4, TNRC6A, MAP3K2, SRPK2, COPS2, POLA1, TRPS1
GO:0005829	cytosol	975	0.36654135338345867	1.4934294192454431	1.2842913163389481e-50	1.2136552939403059e-47	46.915904645383726	2.427310587880612e-47	RAB7A, GRB2, KIFAP3, STXBP5, RPL7A, ARL6IP1, ZFYVE16, SNX2, TTBK2, RAPH1, DGKG, RAB2A, RPE, MAP3K5, ADK, SH3BGRL, MTOR, RAB21, CRADD, G2E3, SMAP2, STARD13, MTR, PDE1C, ERBB4, ARHGAP31, KAZN, GUCY1A2, IDH1, YWHAG, DCX, RBMS1, BACH2, SGK3, FAM120A, HBS1L, ST13, RPS19, RAPGEF4, RPL35, EFR3A, GOSR1, HDGFL3, TFG, CIT, DDHD1, MAPK1, CFL1, AMD1, SEPTIN7, MYO9A, PRTFDC1, ANAPC5, RBMS3, RAB3IP, RPL13, FAM13A, GOLPH3, PIK3C3, PPP2CA, PCCA, ANKRD28, TIAL1, DOCK11, YTHDF3, MAP1B, ZFYVE9, TRAPPC9, APBA1, PRRC2C, SERP1, MYRIP, PHKB, ECHDC1, TTLL5, PYGL, USP48, FTH1, NOS1AP, MAP2, FNIP1, UBE2D3, XPO1, CAND1, PLEKHA5, KLC1, BTBD3, USP8, MAGED1, ADD1, SORT1, HERC1, ENAH, SUGT1, CTNNB1, OSBPL1A, OSBPL9, BTRC, DENND5B, PCM1, TAX1BP1, CCDC91, ACTG1, PRKAR2B, HTRA1, ARHGAP15, ERI3, DCC, RPL18, UFL1, EXOC2, PDE10A, SNX27, CLINT1, STAG1, FBXO21, SOS1, NGLY1, EXOC1, STRN, SGK1, RAC1, RUFY3, OFD1, PEX5L, TACC1, PDS5B, ASB3, RPL37, MYO5A, GPSM2, NAA35, PUM1, PKM, PABPC1, ENOX2, PREPL, LNX1, ATP6V1B2, TSC1, CKB, PPIP5K2, CUL2, ARHGEF9, STAM2, SPAST, TDRD3, ACTR2, ARHGEF4, TRPC4AP, RAB6A, PRKN, GAB2, ACBD6, PIP4K2A, RPL5, PRKAR1A, ASB5, SMAD5, JAK2, TNKS2, TPP2, HSPA8, COX4I1, IFI16, PLAAT1, PRKG2, TSC22D1, DENND4C, PDZD2, NAA16, ARHGEF12, SMAD2, MIPOL1, ZCCHC7, RNF146, RAP1A, VPS13A, FCHO2, ME1, CRPPA, HEATR5B, XIAP, TUBGCP3, PPFIBP2, RABGEF1, HNRNPU, PSME4, SPTBN1, TUT4, G3BP2, BACH1, C2CD5, EPB41L2, PPM1A, FBXL4, PPP1R1B, HNRNPD, YWHAB, LSM14A, SGIP1, ADD3, GPCPD1, PPP2R5E, LTN1, SNX1, AP1G1, WWOX, PPARGC1A, LRBA, FBXO11, MAP2K6, RPS6KA2, PAFAH1B1, CSNK2A1, ITSN1, POGZ, ARHGEF10, SMURF1, NR3C2, CAPRIN1, SBF2, LMO7, RALGAPA2, PAPSS1, LPP, RPS28, SPART, CYTH1, FBXW11, ITSN2, KPNA1, PDCD6IP, PELI2, AGO4, SCFD1, NUP98, UBE2V1, NLK, OSBPL3, GUCY1B1, WDR26, APC, SERPINE2, RIMS1, YWHAE, RFFL, SRGAP3, PDE8B, NAA25, GDAP1, LRP1, BIRC6, HLCS, PPFIBP1, PIGN, SYNCRIP, PHLDA1, DMD, SYNJ1, USP9Y, EYA2, LRRK2, PPP3CA, UBE3A, ARHGAP10, AP2B1, MSI2, CCDC6, ARHGAP5, SPATS2L, LRRC1, SH3RF1, PDE4D, RPL13A, XRCC4, USP11, TM7SF3, RMDN2, PTMA, IQSEC1, PRKCB, PPIA, UBE2G2, WWP1, MITF, ATXN10, DISC1, MCF2L2, SLC8A3, PARD3, TBC1D5, NBEA, MDH1, ZFAND6, PRKACB, PRKCE, DUSP16, USP9X, RAP1GDS1, SMG7, ABL2, TASP1, DST, MTAP, KLHL13, PRNP, RAP2A, RGS7, KLHL2, PPP2R2A, TMSB4X, STRADA, CC2D2A, GAD2, DPYSL3, ABI2, NSL1, STAG2, ETNK1, SLC44A1, ARMC8, EEA1, FAM13B, PRKD1, AGO3, PTPN4, RAB5A, CRBN, PELI1, USP15, DZIP1, ATG10, RGCC, WNK1, SRI, RAB14, EIF4G3, KLHL7, HSP90B1, RABGAP1, PAK3, ATP6V1A, CADPS, WDFY3, CTNND1, PANK3, MKLN1, OSBPL8, CALD1, RPS24, CERT1, SH3GLB1, HMBOX1, NMNAT2, MCCC1, CEP83, UBE2H, RCOR3, PLCG2, FARSB, CSNK1E, CLOCK, RPL34, PMP2, ARFIP1, URI1, CYLD, CPNE3, SDCCAG8, CLASP2, TPK1, FOXO1, RPAP2, EIF4A2, DCAF8, SMAD4, CFTR, LRRC7, RASAL2, CEP192, PCP4, AGPS, EPN2, CEP97, ATP6V1H, PXK, LONP2, SHOC2, NT5C2, C10orf90, PSMD1, PJA2, TBC1D14, UBR2, NHLRC2, RASA2, ENO1, PEG10, FYN, AGL, VPS54, HNRNPC, RPL3, RAB1A, HECW1, PPFIA2, ATF6, CKAP5, NCOA1, VAV3, RPL21, PPP2R5C, NSMAF, DENND1A, MAP3K7, RAPGEF6, CHD9, NSF, TIAM1, PCMT1, SORL1, USP33, COPA, FGFR1OP2, MTMR7, CAPZA1, GLUL, TOP2B, WAPL, RAD21, TRAPPC13, ARID4B, DAAM1, FHIT, USP47, SEC24B, RICTOR, PDS5A, CREBBP, SLAIN2, AGTPBP1, COP1, WSB1, RPL37A, ANKS1A, RNF216, STXBP3, FMN2, TASOR2, PACS1, CLASP1, APP, PRMT3, HSD17B4, FIP1L1, FOCAD, PRKDC, ANK2, KIDINS220, TAB2, NBN, DENND4A, TMEM87A, GNB1, CNOT1, NTRK2, PPP2R2B, KPNA4, NEDD4, CLTC, AHCYL1, USP37, FNIP2, PRKCA, NCAM1, WASL, REPS1, COMMD1, PIKFYVE, ICA1, USP25, PPP1R12B, ASAP1, CYFIP2, CRYZL1, SEM1, RPS6KA3, ARHGEF28, ARHGAP20, NCOR1, AGFG1, ARHGAP21, CALM1, SH3D19, CENPP, FBXL7, DOCK3, MSRA, CEP70, HIF3A, DOCK10, CHKA, CTNNA1, CHN1, KMT2A, ALMS1, PSMD14, HNMT, ARHGEF3, PRKAA2, URGCP, GNAI1, EVI5, UBE2K, PDE8A, EIF1AX, FAF1, SPIN1, STX17, FAM110B, CENPC, HSP90AA1, MAP2K4, FBXO7, CAMK2D, SRGAP2, ATG7, ABI1, CAB39L, TANK, OTUD7A, SKP1, KIF3A, GPBP1, RAF1, FER, PAK5, RNF19A, AHCTF1, OGT, S100B, ABCD3, NBEAL1, ARHGEF11, TLN2, EXOC5, DNAJC6, EML4, ZMYM2, PAXBP1, RPS18, MTMR1, MYO6, AFAP1L2, APPL1, KCNAB1, KAT2B, FBXO9, UBE2E3, CDK19, PAK2, OLA1, PTEN, ARHGEF6, TUBA1A, RAPGEF2, PUM2, GNA12, ARHGAP26, DIAPH2, DOK6, FNBP1L, DPYSL2, KIF16B, DYNC1I2, ATP9A, TTC8, USP24, QKI, KIF2A, PDE5A, PKN2, NCOA3, BEX3, PIK3C2A, DCUN1D1, SASH1, AMPH, ZFP36L1, YWHAQ, RNF169, AKAP11, AASS, UBQLN1, LNPEP, RO60, AHCYL2, PPP3CC, DDX17, RB1, AFTPH, PIP5K1B, AKAP10, HIF1A, MAPKAP1, RIC1, GALK2, ANK3, CTNNA2, CEP290, KLHL3, UBR1, SPTAN1, SH3KBP1, GSK3B, MAPK8, PPP3R1, MAP3K1, FRS2, UBA6, ROCK1, RAPGEF1, SAMD4A, FBXO38, PPP3CB, TRIP12, SENP2, TNPO1, KSR2, HECTD2, OGA, HOMER1, DLG1, TNRC6B, TBC1D15, RAB3GAP2, ROCK2, CDC42BPA, SPAG9, TJP1, VPS13C, USP40, SMG1, UBE3D, SOS2, USP12, KLHL5, NFAT5, RNF111, PRICKLE1, NEK1, RPS2, TNKS, PHACTR1, PHLPP1, AASDHPPT, UBE2E1, TRAK1, CDC27, ELMO1, FOXO3, DDX6, NCDN, PEBP1, GPHN, PPM1B, FBXW4, KPNA5, USP10, RANBP9, FBXW7, TAOK1, FTO, CUL3, STX16, FMNL2, USP34, SPIRE1, DDX5, CRLF3, AKAP7, PPP6R3, GAPDH, AGO2, PDE7B, NPEPPS, KLHL42, EIF4G2, CTIF, MT3, GOLGA4, MAP4K5, GCC2, CLTA, TTLL7, IPO8, EPHB1, PARG, USP6NL, UPF2, PDGFC, CUL5, BRAF, UBE2N, RAB3GAP1, ATM, HNRNPDL, HERC2, SERGEF, TNRC6C, DNM1L, KIF5B, FKBP1A, AKAP13, GLS, SCLT1, BBS9, NME7, ACTR3, MID1, SND1, GOLGB1, ACTB, AFDN, RB1CC1, GCLC, EIF4A1, PLCB1, KALRN, VAMP2, PGM3, FBXL20, DOP1A, NPHP3, CACNB4, RNF115, LRCH3, PAK1, CLU, BCL2L14, AK5, MON2, TXNIP, BRD7, USO1, RAB31, UBC, XRN1, JAK1, EXOC6, ATP6V1C1, LDHB, PUDP, MBP, STXBP1, LIMD1, LSAMP, SEC23A, ARHGAP22, MIF, PICALM, CSNK1A1, CCDC50, PPP2R1A, PDE7A, PDLIM5, LRRFIP1, GSTA4, RAB18, RPS6KB1, DICER1, VAPA, FKBP5, WIPF1, IREB2, SERINC5, EVL, TNIK, STAU2, HERC3, PSIP1, ATXN1, EGLN1, HELZ, GNAS, HIPK3, CNOT4, DOCK1, UBAP1, AAK1, NAA15, EHBP1, PPP4R3A, MTPN, RASA1, RIC8B, TPT1, NF1, ATAD1, DGKB, WDR11, FANCL, ARHGEF7, NUP214, CCDC88A, USP14, PAN3, TIAM2, FXR1, XRCC5, CAMKMT, PIK3CB, ATG5, PWWP3A, ANKIB1, YWHAZ, DENND1B, SNAP25, DOCK4, RAD23B, EP300, MARCKSL1, CRYL1, PPP1R12A, SNX9, DCTN4, VPS41, SPRED1, MYH10, CAPZA2, DPH6, FARP1, DDX1, EGLN3, RAB9B, EFCAB13, SESN1, HEATR5A, SMURF2, HSPA13, CBLB, RIMKLB, ASCC3, ACACA, TRAPPC8, EIF3H, ADRA1A, MBNL1, DHX9, ANAPC10, EIF3E, AKAP9, NR3C1, RIN2, FBXL3, LYPLAL1, SENP6, TNS3, ITCH, XPO4, HSP90AB1, WWP2, PSMA1, ITGB3BP, CSNK1G1, PTK2, CHM, ARHGEF26, SPATA13, HSPH1, PLCE1, SMAD1, CMIP, DLC1, MT2A, DHX36, DENND5A, RAB11A, NUP42, NEMF, NCKAP1, PIK3CA, AHI1, CSDE1, CAB39, OSBPL6, DOCK9, MRTFA, CNOT2, PDE4B, FBXL5, EPB41L5, TOX3, DYNC1H1, GHR, PRMT2, BBS2, ARFGEF1, SCP2, PALLD, NCALD, GAB1, DOK5, LARP4B, SPG11, WASF1, RPLP1, ARIH1, BABAM2, GIGYF2, KPNA3, NBAS, ARHGAP6, CDK14, STK39, DGKI, UTRN, PDSS2, MEF2C, MAPK10, TRIM37, UPP2, ARHGAP32, NKTR, RABEP1, PLCB4, MTMR3, KCNIP4, RAB10, HUWE1, FERMT1, RHOBTB3, AGBL4, ATXN7, COG5, MAPK14, TRIM24, CNOT6L, SEC31A, RPL28, FNDC3A, CASK, DAB1, RC3H1, SRGAP1, ELP2, HTT, TRIO, CUL1, UCHL1, DDAH1, ARHGAP35, DLG2, PTPN12, EXOC4, TACC2, SFPQ, MARK3, VTI1A, TNRC6A, SLK, REPS2, NRDC, MIB1, MAP3K2, SAT1, SRPK2, PIK3R1, ARL8B, HERC4, COPS2, POLA1, TMCC1, TTC7B
GO:0005737	cytoplasm	1188	0.44661654135338347	1.4230374823196608	1.2556380460892742e-53	2.373155907108728e-50	49.62467372938787	2.3731559071087283e-50	KIF5C, CNP, SNTG1, GRB2, DTNB, STXBP5, RPL7A, ARL6IP1, ZFYVE16, SNX2, TTBK2, RAB2A, NAIP, NDUFA13, MAP3K5, ADK, SH3BGRL, ARPP19, KLHDC10, MFF, MTOR, CHPT1, CRADD, SMAP2, G2E3, DROSHA, MTR, KIF21A, STARD13, KAZN, GUCY1A2, STXBP4, ATXN2, SEPTIN2, IDH1, YWHAG, SENP7, GAD1, NECAB1, BACH2, MIER1, MAP9, SGK3, FAM120A, HBS1L, ST13, RPS19, GNAL, BMP2K, RAPGEF4, RPL35, HDGFL3, TFG, CIT, DDHD1, ANKRD17, MAPK1, CFL1, STOX2, SEPTIN7, SPAG16, MYO9A, TAOK3, MFN1, VWA8, NAP1L4, RBMS3, RAB3IP, SCRG1, ATL1, PCMTD2, RPL13, MTA3, ITPR2, BRWD1, TENM1, WDR41, PIK3C3, NDFIP2, SUCO, PPP2CA, STK33, CMYA5, TIAL1, YTHDF3, MAP1B, ZFYVE9, TRAPPC9, APBA1, MYRIP, RNF150, HOOK3, TTLL5, CSNK1G3, PYGL, USP48, FTH1, SIK3, MAP2, FNIP1, PLOD2, XPO1, CAND1, ZFR, TBCA, AOPEP, PLEKHA5, KLC1, GNAQ, HNRNPK, USP8, XRRA1, MAGED1, FUS, ADD1, SETX, ZNF655, YTHDC2, CALCRL, HERC1, ENAH, SUGT1, DCAF6, CTNNB1, OSBPL1A, PCM1, BTRC, TRIM9, TAX1BP1, GNAO1, ACTG1, PRKAR2B, CXADR, PIBF1, ARHGAP15, ARL6IP5, RB1, RPL18, UFL1, MARK1, NEXMIF, LRIG2, CLINT1, BLM, RMDN1, SOS1, NGLY1, EXOC1, STRN, FRY, SGK1, RAC1, RUFY3, PPP4R2, ATP1B2, PEX5L, GTF2A1, APPL2, TACC1, RNF144A, ASB3, RPL37, MYO5A, ERC1, GPSM2, NAA35, PUM1, PKM, PABPC1, FEZ2, PKIA, LNX1, ITGB1, BTBD9, ATP6V1B2, TSC1, RBM33, RALGPS1, CUL2, ARHGEF9, STAM2, NAP1L1, SPAST, RGN, AP4S1, TDRD3, ACTR2, NDFIP1, ARHGEF4, EIF2A, PRKN, GAB2, ACBD6, PIP4K2A, RPL5, MAF, PRKAR1A, SMAD5, AVL9, JAK2, TNKS2, TPP2, HSPA8, IFI16, TCF12, PTPN13, ABLIM1, TSC22D1, PDZD2, AKAP6, NAA16, ARHGEF12, WRN, SCRN1, MAGI2, SMAD2, LANCL1, MTUS1, RNF146, RAP1A, ATP1A2, FCHO2, ME1, SCN3A, PKD2, ZFHX3, XIAP, NEBL, TUBGCP3, APPBP2, HNRNPA2B1, STRBP, ARFGEF3, RABGEF1, HNRNPU, SPTBN1, TUT4, RBM4, G3BP2, BACH1, PPA2, DZIP3, ELAVL4, ZC3H14, PID1, FBXL4, PPP1R1B, RBPJ, HNRNPD, YWHAB, LSM14A, ADAM10, LMO3, ASAH1, SGIP1, ADD3, GPCPD1, FHOD3, TNFSF13B, AP1G1, SNX1, WWOX, PPARGC1A, MAGI3, FBXO11, ALG13, PLEKHH2, ATF2, RPS6KA2, SIK2, ARAP2, PAFAH1B1, RNF13, PITPNB, NAPEPLD, TRMT11, FRMD4A, ITSN1, POGZ, ARHGEF10, SMURF1, NR3C2, CAPRIN1, SBF2, KCNIP1, LMO7, BCAS1, HDHD2, PAPSS1, RALGAPA2, LPP, RPS28, SPART, CYTH1, FBXW11, ITSN2, RBFOX1, KPNA1, NR1D2, PDCD6IP, AGO4, GATM, SCFD1, UBE2V1, NLK, DYRK1A, GUCY1B1, WDR26, APC, YWHAE, THOC2, RFFL, DNM3, BASP1, TM9SF2, FRMD6, OPHN1, CUL4B, CDC14A, NAA25, GDAP1, LRP1, TAF15, RGS17, ACVR2A, SLC11A2, HLCS, RSRC1, SYNCRIP, PHLDA1, SYNJ1, USP9Y, EYA2, LRRK2, DGKH, UBE3A, KIZ, PPP3CA, ARHGAP10, BCAS3, MSI2, RYK, USP3, DSTN, CCDC6, TRIM23, ARHGAP5, SPATS2L, LRRC1, SACS, PDE4D, RPL13A, XRCC4, USP11, TRIB2, CDH2, RMDN2, IQSEC1, PRKCB, PPIA, MACF1, EMC2, CYB5R4, WWP1, APBB2, MITF, ATXN10, DISC1, CDC14B, PARD3, MCF2L2, SEPTIN8, NBEA, CEPT1, TBC1D5, MDH1, USP32, PSPC1, TMBIM6, LRRC8B, ATP2C1, ZFAND6, GTF2I, PRKACB, UBE2W, PRKCE, DUSP16, USP9X, SMARCC1, SMG7, GRAMD2B, WDR7, TASP1, PPHLN1, MTAP, DST, FZD3, DENR, PRNP, RGS7, KLHL2, ARNT2, TMSB4X, STRADA, CC2D2A, GAD2, NUCKS1, DPYSL3, ABI2, SETD2, CELF2, ETNK1, CACNA1A, RPS6KA5, EEA1, ARMC8, IBTK, AGO3, PRKD1, PTPN4, OPA1, TBC1D32, USP15, DZIP1, PELI1, ATG10, RGCC, HMGB1, WNK1, SRI, KLHL7, EIF4G3, MAST4, RABGAP1, CTNND1, PAK3, ATP6V1A, APTX, WDFY3, PANK3, MKLN1, PPM1E, RPS24, ETS1, ECPAS, CERT1, SH3GLB1, HMBOX1, FRMD4B, NMNAT2, CDH11, KANK1, FBXL17, PLCG2, FARSB, CSNK1E, SESN3, CLOCK, RPL34, PMP2, CYLD, URI1, ZNF638, CPNE3, RUFY2, SDCCAG8, CLASP2, RPAP2, FOXO1, DCAF8, SMAD4, CFTR, LRRC7, CEP192, PKP4, PCP4, EPN2, ATG4C, EYA1, AFG1L, PXK, LONP2, SHOC2, KLHL24, NT5C2, C10orf90, PJA2, RASA2, UBR2, ENO1, PEG10, FYN, AGL, LRPPRC, ZMYND8, VPS54, SSH2, RPL3, KLHL1, HECW1, RABGAP1L, RAVER2, PPFIA2, CKAP5, SPECC1L, INVS, CXXC4, VAV3, RPL21, RAB28, NSMAF, MAP3K7, NSF, EPC1, CHD9, RAPGEF6, TIAM1, PCMT1, RBM27, MTF2, USP33, FNDC3B, COPA, FGFR1OP2, MTMR7, GLUL, WAPL, MRPL33, RPS6KC1, TRAPPC13, ARID4B, DAAM1, FHIT, USP47, TTC3, SYNE1, CREBBP, COMMD10, SYT11, CELF1, AGTPBP1, COP1, IL1RAPL1, ERC2, PPP1R9A, WSB1, CPSF6, MTSS1, RPL37A, ANKS1A, RNF216, ARL5A, AGAP1, FMN2, FARS2, SNRPN, TNNI3K, APP, PRMT3, NMD3, TP53BP1, TAB2, FIGN, PLCL1, GLMN, TRIM44, GLUD1, GNB1, PPP2R2B, KPNA4, TRIM13, NEDD4, GAS7, AHCYL1, FKTN, ZFAND5, FNIP2, SPOCK1, ADARB2, PRKCA, WASL, REPS1, COMMD1, ICA1, WDFY2, LMTK2, USP25, PPP1R12B, ASAP1, CYFIP2, PDGFRA, RARS2, RPS6KA3, ANGEL2, SYT1, ARHGEF28, FILIP1L, GABBR1, AGFG1, CALM1, HNRNPR, SH3D19, PAPOLA, DOCK3, ATP6AP2, PPP2R5E, DTWD2, MSRA, UVRAG, HIF3A, DOCK10, CHKA, PTPRM, MTDH, MAP4K4, CTNNA1, PRXL2A, SLC38A2, ALMS1, HNMT, ARHGEF3, PRKAA2, URGCP, GNAI1, IFT80, UBE2K, DENND11, CCNI, PPP4R1, NDUFAF6, EIF1AX, FAF1, UBE4A, STX17, FAM110B, SHTN1, NELL1, HSP90AA1, MAP2K4, FBXO7, KLHL28, FUBP1, CAMK2D, SRGAP2, ATG7, ABI1, SOD2, CAB39L, PRUNE2, TANK, PCYT1B, OTUD7A, TAFA5, SKP1, KMT2E, KIF3A, GPBP1, RAF1, FER, ADARB1, CALM3, HMGN1, RNF19A, AHCTF1, PAK5, MOB3B, OGT, S100B, HECW2, BTBD10, TPR, ZFPM2, MAP2K6, ARHGEF11, TLN2, ORC4, ZNF717, RBBP7, EXOC5, DNAJC6, EML4, DCX, RPS18, STRN3, MTMR1, UBR5, TPD52, MYO6, AFAP1L2, APPL1, KCNAB1, KAT2B, FBXO9, UBE2E3, CDK19, MAPRE2, PHYHIPL, PAK2, ZBTB20, NOTCH2, OLA1, PTEN, ARHGEF6, TUBA1A, RAPGEF2, GRIN2B, EEFSEC, PUM2, GNA12, FGGY, SETD3, ARHGAP26, CREBRF, FNBP1L, DDX24, CDH13, PHYHIP, DPYSL2, KIF16B, DYNC1I2, SOX4, TTC8, ATP6V0A1, QKI, KIF2A, PKN2, NCOA3, BEX3, PIK3C2A, LPGAT1, DCUN1D1, SASH1, RYBP, STXBP5L, AMPH, KIF26B, ROBO1, ERCC6L2, ZFP36L1, YWHAQ, AASS, AKAP11, TBCK, CPEB3, UBQLN1, FGF14, RO60, AHCYL2, DDX17, SLC16A7, RBM25, PPP3CC, AFTPH, TRIM2, AKAP10, HIF1A, HIPK2, GALK2, MAPKAP1, CTNNA2, CEP290, KLHL3, SOX8, PTPRE, UBR1, MPDZ, ARPP21, GSK3B, SH3KBP1, MAPK8, RAB5A, FRS2, DYNC2H1, UBA6, ROCK1, RAPGEF1, SAMD4A, FBXO38, PTAR1, PPP3CB, SMYD3, TNPO1, SENP2, EIF1, CAMSAP2, KSR2, OGA, HOMER1, DLG1, TBC1D15, RAB3GAP2, COBL, CDC42BPA, ROCK2, SPAG9, SLC2A13, UBAP2, TJP1, VPS13C, USP40, SMG1, UBE3D, CHD4, KIF1B, KLHL5, USP12, ASPH, NFAT5, RNF111, KLHL23, NEK1, RPS2, TMEM131L, TNKS, PHACTR1, PHLPP1, DDX39B, DIP2B, CST3, TRAK1, RALGPS2, CDC27, ELMO1, FOXO3, ANKHD1, INSC, NCOA2, DDX6, PPP1R14C, FCHSD2, PEBP1, SEC22B, HLTF, GPHN, APOE, KPNA5, PRICKLE2, USP10, DCAF5, FBXW7, RANBP9, TAOK1, ARHGAP12, CRBN, FTO, CUL3, STX16, FMNL2, SMC5, DDX5, PPP6R3, CRLF3, AKAP7, SLC23A2, GAPDH, AGO2, ADCY2, NPEPPS, KLHL42, MT3, GOLGA4, MAP4K5, GCC2, IPO8, EPHB1, KCNQ1, PARG, RIT2, UPF2, CUL5, BRAF, UBE2N, RAB3GAP1, ATM, TERF2IP, HNRNPDL, HERC2, BCLAF1, SERGEF, DNM1L, KIF5B, FKBP1A, AKAP13, CTNND2, BCL9, NDUFA10, BBS9, NME7, PTTG1IP, MID1, ACTR3, SND1, SSBP2, ACTB, AFDN, CALM2, CAMK4, RB1CC1, EIF4A1, BRINP3, STXBP6, KIF13A, GLCCI1, PLCB1, KALRN, SLMAP, LONRF2, FBXL20, LRCH3, CLU, RNF115, PAK1, BCL2L14, CREM, AK5, PLAAT1, ARHGAP42, TXNIP, BRD7, USO1, RAB31, BRINP2, USP22, UBC, XRN1, INTS7, EXOC6, JAK1, LDHB, STXBP1, LIMD1, ARHGAP22, GLRB, MIF, ACAP2, CSNK1A1, CCDC50, PPP2R1A, PDE7A, MTSS2, LRRFIP1, GSTA4, NIN, RPS6KB1, DICER1, TAFA2, FKBP5, TOP1, IREB2, ATP2B2, ERBIN, EVL, TNIK, STAU2, HERC3, BPTF, ATXN1, CPQ, EGLN1, AQP4, HELZ, GNAS, CNTLN, ACSL4, HIPK3, GOPC, CNOT4, CPEB2, DOCK1, HACE1, CDK17, UBAP1, MYCBP2, NAA15, EHBP1, FGF12, INPP5F, PPP4R3A, EYA3, ATF7, MTPN, TMEM196, CAMTA1, ATE1, NF1, TPT1, RASA1, RIC8B, SLC30A7, ELP4, FANCL, DGKB, WDR11, ARHGEF7, PAN3, CCDC88A, USP14, TIAM2, FXR1, XRCC5, CAMKMT, PIK3CB, LYST, SPOP, MYSM1, ATG5, PDE4DIP, ANKS1B, CPE, ANKIB1, LRCH1, YWHAZ, SNAP25, DOCK4, RAD23B, EP300, MARCKSL1, CRYL1, RALGAPA1, PPP1R12A, SNX9, DCTN4, SPRED1, MYH10, PLCL2, DDX1, EGLN3, CHD1, RBFOX2, MARCKS, SESN1, SLC1A1, SMURF2, HSPA13, NTRK3, CBLB, RIMKLB, TRAPPC8, SNAP23, BRINP1, EIF3H, ADRA1A, MBNL1, HEPACAM, SCAF8, DYM, DHX9, ANAPC10, MAP3K4, EIF3E, TENT2, NR3C1, AKAP9, RIN2, FBXL3, LYPLAL1, SENP6, CHCHD3, MAP4K3, PHACTR4, XPO4, HSP90AB1, WWP2, PSMA1, ITGB3BP, CSNK1G1, CNKSR2, ITCH, PTK2, GRM5, SPATA13, HSPH1, AKT3, SMAD1, GSTCD, CMIP, CRIPT, DLC1, MT2A, DHX36, PIK3CA, RAB11A, XPO7, CSDE1, CAB39, PHF14, MAGI1, UBR3, LRRC8D, MRTFA, UBE4B, CNOT2, PDE4B, RNF130, KIAA1217, EPB41L5, DYNC1H1, PRMT2, BBS2, ARFGEF1, SCP2, PLEKHA2, GAB1, CCDC92, MALRD1, RCBTB1, GIGYF2, WASF1, SPG11, ARIH1, RPLP1, BABAM2, DTD1, KPNA3, NBAS, MBNL2, PCMTD1, ARHGAP6, CDK14, DDX10, STK39, TTC17, DGKI, UTRN, MEF2C, MAPK10, TRIM37, UPP2, SOX6, NKTR, RABEP1, ARHGAP32, MTMR3, KCNIP4, HUWE1, RGS7BP, FERMT1, MAP3K13, RHOBTB3, OLIG2, AGBL4, ATXN7, BLCAP, SMAP1, MAPK14, TRIM24, SEC31A, CNOT6L, RPL28, FNDC3A, CASK, MYO16, PBX1, RC3H1, DAB1, DTNA, HTT, TRIO, EGFR, ELP2, CUL1, UCHL1, ZYG11B, APOD, NOVA1, PPP4R3B, ARHGAP35, ICA1L, PTPN12, CPEB4, NEK7, EXOC4, TACC2, HDAC8, SFPQ, MARK3, DCLK2, VTI1A, ACAD11, SLK, REPS2, MIB1, MAP3K2, PIK3R1, SRPK2, ARL8B, HERC4, COPS2
GO:0000785	chromatin	209	0.07857142857142857	1.4084048240706204	1.7346085375343863e-07	9.366886102685686e-06	5.028404760572316	0.000327841013593999	NSD3, ACTB, ZC3H6, PPP1R10, SP4, NCOR1, PLCB1, MEIS2, BASP1, FOXN2, BICRAL, CREB3L2, NFIA, MGA, PBX3, AEBP2, CREM, HIF3A, NIPBL, KDM5A, BRD7, RSF1, HLCS, ESRRG, SMARCAD1, SMARCA5, BACH2, BAZ2B, INTS8, ELF1, RFX3, ANKRD17, USP3, KLF12, PIAS2, PPP2R1A, SPIN1, CREB1, ZFY, NAP1L4, CHD6, FOXJ3, SF3B1, PPP2CA, FOXG1, MITF, BPTF, TSHZ1, SKP1, KMT2E, PIAS1, FER, RFX7, TFCP2, HMGN1, CALM3, AHCTF1, ZNF827, SHLD2, ARID2, ZFPM2, SMARCC1, RBBP4, PCGF5, ATF7, ASCL1, PPHLN1, FANCL, HNRNPK, SOX5, ZHX2, ARNT2, MAGED1, SLF2, UBR5, NUCKS1, TEAD1, FOXP1, SP3, STAG2, NPAS3, KAT2B, ADNP, HBP1, TCF7L1, EP300, FOXN3, MEF2A, ETV1, JMJD1C, RORA, KLF7, SETD3, APTX, KDM5D, CHD1, RIF1, MYT1L, STAG1, NFIB, POU2F1, CHD7, ETS1, CSRNP3, SOX4, ORC2, HMBOX1, AUTS2, PPP4R2, SMARCE1, MYT1, NCOA3, PDS5B, RYBP, CHD2, EIF3E, CLOCK, YAF2, NR3C1, FOXO1, RB1, JARID2, HIF1A, KDM4C, TCF7L2, KAT6A, SMARCA2, SMAD4, SOX8, KAT6B, ARID1A, NAP1L1, POU6F2, TRIM33, SMAD1, MAF, DPF3, UBR2, PRRX1, SMAD5, SETD5, JAK2, ZMYND8, HNRNPC, PHF14, BBX, TCF12, ATF6, NCOA1, CHD4, ZHX1, NR6A1, ZHX3, NFAT5, SMAD2, CREB5, INTS6, CREBZF, PHC3, TFDP2, WAPL, RAD21, ZFHX3, FOXO3, NRIP1, TCF4, NCOA2, PDS5A, CREBBP, PBRM1, HLTF, MEIS1, BACH1, ZEB2, ETV5, MEF2C, THRB, SOX6, RBL2, OLIG2, RBPJ, HNRNPD, TASOR2, TRIM24, PBX1, ATF2, PPARGC1A, PRKDC, PPP4R3B, NSD1, CSNK2A1, POGZ, SFPQ, SS18, NEDD4, ARID1B, NR3C2, GATAD2B, HNRNPDL, MXI1, ZFHX4, OLIG1, SRPK2, NR2C2, ZEB1, POLA1, NR1D2, KDM1A, TRPS1
