	DrugBank_ID	DrugBank_Name	Indication	Targets	Proximity	FDR
0	DB04690	camptothecin	Investigated for the treatment of cancer.	TOP1	-3.856582545990357	4.916603015101278e-36
1	DB01030	topotecan	For the treatment of advanced ovarian cancer in patients with disease that has recurred or progressed following therapy with platinum-based regimens. Also used as a second-line therapy for treatment-sensitive small cell lung cancer, as well as in combination with cisplatin for the treatment of stage IV-B, recurrent, or persistent cervical cancer not amenable to curative treatment with surgery and/or radiation therapy.	TOP1, TOP1MT	-1.7552064585777978	9.829072432815327e-30
2	DB02424	geldanamycin		HSP90AB1, HSP90B1, HSP90AA1	-4.326428076522169	1.2416409847453015e-20
3	DB08059	wortmannin		PIK3R1, PIK3CA, PLK1, PIK3CG	-1.7139690482272507	2.1555999382916846e-17
4	DB12442	alvespimycin	Investigated for use as an antineoplastic agent for solid tumors, advanced solid tumours or acute myeloid leukaemia. 	HSP90AA1	-4.531018897898992	2.1764032587898367e-15
5	DB05814	IPI-145	Investigated for use/treatment in erectile dysfunction and parkinson's disease.	FKBP1A	-3.3707587430220407	1.8357196405745192e-14
6	DB09241	methylene-blue	"Indicated for the treatment of pediatric and adult patients with acquired methemoglobinemia. 

Other clinical applications of methylene blue include improvement of hypotension associated with various clinical states, an antiseptic in urinary tract infections, treatment of hypoxia and hyperdynamic circulation in cirrhosis of liver and severe hepatopulmonary syndrome, and treatment of ifofosamide induced neurotoxicity."	GUCY1A2, NOS1	-0.839121339016201	1.8357196405745192e-14
7	DB04216	quercetin		PIK3CG, NR1I2, ACTB, UGT3A1, UBA1, HCK, ESR1, SF3B3, ESR2, NQO2, CYP1B1, RUVBL2, AHR, STK17B, CEBPB, PIM1, CSNK2B, HSP90AA1, CSNK2A1, HIBCH, EIF3F, SHBG, CBR1, HSPA2, ATP5F1C, ATP5F1A, ATP5F1B	-0.6184634628314802	1.8357196405745192e-14
8	DB00273	topiramate	"Topiramate is indicated  for the following conditions: 1)Monotherapy for partial onset or primary generalized tonic-clonic seizures for patients 2 years of age and above 2)Adjunctive therapy for partial onset seizures or primary generalized tonic-clonic seizures for both adult and pediatric patients above 2 years old 3)Adjunctive therapy for seizures associated with Lennox-Gastaut syndrome in patients above 2 years of age 4)Prophylaxis of migraine in children 12 years of age and older and adults.[L10544]

Topiramate is also used off-label as an adjunct therapy for weight management[L10550] and for mood disorders.[A188312]"	GRIK1, CA1, CACNA1E, SCN1A, CA3, CA4, CACNA1C, CA2, GABRA1	-0.2993823910004752	1.8357196405745192e-14
9	DB01041	thalidomide	For the acute treatment of the cutaneous manifestations of moderate to severe erythema nodosum leprosum (ENL). Also for use as maintenance therapy for prevention and suppression of the cutaneous manifestations of ENL recurrence.	CRBN, PTGS2, FGFR2, NFKB1, TNF, ORM1	-0.294483175046987	5.545763858008852e-14
10	DB00436	bendroflumethiazide	For the treatment of high blood pressure and management of edema related to heart failure.	SLC12A3, KCNMA1, CA4, CA1, CA2	-0.1902006544036242	5.545763858008852e-14
11	DB01234	dexamethasone	Dexamethasone and [ciprofloxacin] otic suspension is indicated for bacterial infections with inflammation in acute otitis media and acute otitis externa.[L10698] Intramuscular and intravenous injections are indicated for a number of endocrine, rheumatic, collagen, dermatologic, allergic, ophthalmic, gastrointestinal, respiratory, hematologic, neoplastic, edematous, and other conditions.[L10701] Oral tablets are indicated for the treatment of multiple myeloma.[L10710] An intravitreal implant is indicated for some forms of macular edema and non-infectious posterior uveitis affecting the posterior of the eye.[L10719] Various ophthalmic formulations are indicated for inflammatory conditions of the eye.[L10704,L10707,L10713,L10716,L10722,L10725]	ANXA1, NR1I2, NOS2, NR0B1, NR3C1	-0.6216166324299551	4.3945199169947813e-13
12	DB01115	nifedipine	Nifedipine capsules are indicated to treat vasospastic angina and chronic stable angina.[L11383] Extended release tablets are indicated to treat vasospastic angina, chronic stable angina, and hypertension.[L11389,L1245]	CACNA1S, NR1I2, CACNB2, CACNA1D, CACNA1G, CALM1, KCND3, CACNA1C	-1.1433468946118406	1.2300531409734806e-12
13	DB01065	melatonin	Used orally for jet lag, insomnia, shift-work disorder, circadian rhythm disorders in the blind (evidence for efficacy), and benzodiazepine and nicotine withdrawal. Evidence indicates that melatonin is likely effective for treating circadian rhythm sleep disorders in blind children and adults. It has received FDA orphan drug status as an oral medication for this use. A number of studies have shown that melatonin may be effective for treating sleep-wake cycle disturbances in children and adolescents with mental retardation, autism, and other central nervous system disorders. It appears to decrease the time to fall asleep in children with developmental disabilities, such as cerebral palsy, autism, and mental retardation. It may also improve secondary insomnia associated with various sleep-wake cycle disturbances. Other possible uses for which there is some evidence for include: benzodiazepine withdrawal, cluster headache, delayed sleep phase syndrome (DSPS), primary insomnia, jet lag, nicotine withdrawal, preoperative anxiety and sedation, prostate cancer, solid tumors (when combined with IL-2 therapy in certain cancers), sunburn prevention (topical use), tardive dyskinesia, thrombocytopenia associated with cancer, chemotherapy and other disorders. 	ESR1, RORB, ASMT, EPX, CALR, MTNR1A, NQO2, MPO, CALM1, MTNR1B	-0.0466942865652031	1.2300531409734806e-12
14	DB00783	estradiol	"Estradiol is indicated in various preparations for the treatment of moderate to severe vasomotor symptoms and vulvar and vaginal atrophy due to menopause, for the treatment of hypoestrogenism due to hypogonadism, castration, or primary ovarian failure, and for the prevention of postmenopausal osteoporosis. It is also used for the treatment of breast cancer (only for palliation therapy) in certain men or women with metastatic disease, and for the treatment of androgen-dependent prostate cancer (only for palliation therapy).[L11485,L11494,L11497] It is also used in combination with other hormones as a component of oral contraceptive pills for preventing pregnancy (most commonly as [DB00977], a synthetic form of estradiol).

**A note on duration of treatment**

Recommendations for treatment of menopausal symptoms changed drastically following the release of results and early termination of the Women's Health Initiative (WHI) studies in 2002 as concerns were raised regarding estrogen use.[A31626] Specifically, the combined estrogen–progestin group was discontinued after about 5 years of follow up due to a statistically significant increase in invasive breast cancer and in cardiovascular events.[A31627] 

Following extensive critique of the WHI results, Hormone Replacement Therapy (HRT) is now recommended to be used only for a short period (for 3-5 years postmenopause) in low doses, and in women without a history of breast cancer or increased risk of cardiovascular or thromboembolic disease.[A31628] Estrogen for postmenopausal symptoms should always be given with a progestin component due to estrogen's stimulatory effects on the endometrium; in women with an intact uterus, unopposed estrogen has been shown to promote the growth of the endometrium which can lead to endometrial hyperplasia and possibly cancer over the long-term. 

"	ESR1, GPER1, ESR2, NR1I2, BECN1, MT-ATP6, CHRNA4	-0.0340008920128761	1.2300531409734806e-12
15	DB04338	SB-225002		MAPK1, MAPK14	-4.065471421685875	3.3139732639034397e-12
16	DB06075	linsitinib	Investigated for use/treatment in cancer/tumors (unspecified) and solid tumors.	INSR, IGF1R	-1.656187805992552	3.3139732639034397e-12
17	DB07374	anisomycin		RPL10L, RPL15, RSL24D1, RPL19, SNU13, RPL23A, RPL8, RPL11, RPL23, RPL37, RPL3, RPL13A, RPL26L1	-0.6096898594642477	3.3139732639034397e-12
18	DB03496	alvocidib	Investigated for use/treatment in esophageal cancer, leukemia (lymphoid), lung cancer, liver cancer, and lymphoma (unspecified).	PYGM, EGFR, CDK5, CDK7, CDK2, CDK6, CDK9, PYGB, CDK4, CDK8, CDK1	-0.4768385751903852	3.3139732639034397e-12
19	DB08877	ruxolitinib	"Ruxolitinib is indicated for the treatment of inte1mediate or high-risk myelofibrosis (MF), including prima1y MF, post-polycythemia vera MF and post-essential thrombocythemia MF in adults.[L31938] It is also indicated to treat disease-related splenomegaly or symptoms in adult patients with these conditions.[L32073]

Ruxolitinib is indicated for the treatment of polycythemia vera (PV) in adults who have had an inadequate response to or are intolerant of hydroxyurea.[L31938]

Ruxolitinib is indicated for the treatment of steroid-refracto1y acute graft-versus-host disease (GVHD) in adult and pediatric patients 12 years and older.[L31938]

Ruxolitinib is indicated for topical non-continuous and short-term treatment of mild to moderate atopic dermatitis in immunocompetent patients who are 12 years and older and whose disease is not adequately controlled with topical prescription therapies or when the topical prescription therapies are not advisable.[L39125]"	JAK3, JAK2, JAK1, TYK2	-1.6019308983812013	8.71259474233974e-12
20	DB11278	DL-TBOA	Used as an antitussive and decongestant [L2834].	ADRA2A, ADRA1A, ADRB1	-0.6389694963028655	8.71259474233974e-12
21	DB00780	phenelzine	"Phenelzine is indicated for the treatment of nonendogenous, neurotic or atypical depression for patients that do not tolerate other forms of therapy.[L1356] 

Atypical depression has a high prevalence rate, starts in early life, tends to last longer, is more likely to occur in people with bipolar disorder, has a high comorbidity with anxiety disorder and carries more risk of suicidal behavior. It is important to specify the atypical feature to predict the clinical course of depression and hence generate the best treatment and service. The featuring symptoms of the atypical feature include mood reactivity, two or more of this symptoms: 1) increased appetite, 2) increased sleep, 3) leaden paralysis and 4) interpersonal rejection sensitivity and should not have melancholic or catatonic features of depression.[A31917]

Neurotic depression is a depression of an emotionally unstable person. It is a secondary condition to major personality disorder, neuroses and drug use disorders. Likewise, a primary depression with a family history of depression spectrum disease would fit in this category.[A31922]

A nonendogenous depression is characterized by a disturbance in mood and general outlook. The physical symptoms tend to be less severe and it often occurs in response to stressful life events that keep occurring over a large period of time generating a continuous stress in the daily living.[A31924]"	ABAT, MAOB, GPT, MAOA, AOC3, GPT2, GAD2	-0.5236514509462078	8.71259474233974e-12
22	DB00197	troglitazone	For the treatment of Type II diabetes mellitus. It is used alone or in combination with a sulfonylurea, metformin, or insulin as an adjunct to diet and exercise.	ACSL4, ESRRA, PPARD, SERPINE1, SLC29A1, ESRRG, PPARG, GSTP1, PPARA	-0.4076661575440242	8.71259474233974e-12
23	DB00458	imipramine	"For the relief of symptoms of depression and as temporary adjunctive therapy in reducing enuresis in children aged 6 years and older [FDA Label]. 

May also be used off-label to manage panic disorders with or without agoraphobia, as a second line agent for ADHD in children and adolescents, to manage bulimia nervosa, for short-term management of acute depressive episodes in bipolar disorder and schizophrenia, for the treatment of acute stress disorder and posttraumatic stress disorder, and for symptomatic treatment of postherpetic neuralgia and painful diabetic neuropathy [L1349,L1348,A31900,L1351,L1352,L1353,A31904]. "	HTR1A, ORM2, ADRA1A, DRD2, KCND3, ADRA1B, HRH1, HTR6, SLC6A2, SLC6A3, DRD1, SLC6A4, CHRM4, ADRA1D, KCNH1, CHRM3, KCNH2, HTR7, CHRM5, HTR2C, CHRM2, HTR2A, KCND2, CHRM1	-0.0087398967545029	8.71259474233974e-12
24	DB00588	fluticasone-propionate	Fluticasone propionate is indicated as an inhaler for the treatment and management of asthma by prophylaxis[FDA Label]as well as inflammatory and pruritic dermatoses[F4355]. Fluticasone propionate nasal spray is indicated for managing allergic and nonallergic rhinitis[L8309,F4358].	PGR, NR3C1, NR3C2, PLA2G4A	-1.6178181667413132	2.2819908060496888e-11
25	DB01782	pyrazolanthrone		TTK, MAPK8IP1, MAPK8, MAPK10	-1.4548769313819303	2.2819908060496888e-11
26	DB02546	vorinostat	For the treatment of cutaneous manifestations in patients with cutaneous T-cell lymphoma who have progressive, persistent or recurrent disease on or following two systemic therapies.	HDAC2, HDAC1, HDAC3, HDAC6, HDAC8	-0.3716823455940926	2.2819908060496888e-11
27	DB00679	thioridazine	For the treatment of schizophrenia and generalized anxiety disorder.	ADRA1A, HTR2A, KCNH2, DRD2, DRD1, ADRA1B	-0.1463999337340518	2.2819908060496888e-11
28	DB08881	vemurafenib	"Vemurafenib is approved since 2011 for the treatment of metastatic melanoma with a mutation on BRAF in the valine located in the exon 15 at codon 600, this mutation is denominated as V600E.[A31270] The V600E mutation, a substitution of glutamic acid for valine, accounts for 54% of the cases of cutaneous melanoma.[A31271] 
Vemurafenib approval was extended in 2017, for its use as a treatment of adult patients with Erdheim-Chester Disease whose cancer cells present BRAF V600 mutation.[L1013] Erdheim-Chester disease is an extremely rare histiocyte cell disorder that affects large bones, large vessels, central nervous system, as well as, skin and lungs. It is reported an association of Erdheim-Chester disease and V600E mutation.[A31272]"	BRAF	-3.4916840015161617	5.984891472717582e-11
29	DB00518	parbendazole	For the treatment of parenchymal neurocysticercosis due to active lesions caused by larval forms of the pork tapeworm, <i>Taenia solium</i> and for the treatment of cystic hydatid disease of the liver, lung, and peritoneum, caused by the larval form of the dog tapeworm, <i>Echinococcus granulosus</i>.	TUBB4B, TUBA1A	-1.9955041565119291	5.984891472717582e-11
30	DB00480	lenalidomide	"Lenalidomide is indicated for the treatment of adult patients with multiple myeloma (MM) in combination with dexamethasone. It is also indicated as maintenance therapy in multiple myeloma following autologous hematopoietic stem cell transplantation (auto-HSCT).

It is indicated for the treatment of adult patients with transfusion-dependent anemia due to low- or intermediate-1-risk myelodysplastic syndromes (MDS) associated with a deletion 5q cytogenetic abnormality with or without additional cytogenetic abnormalities.

Lenalidomide is indicated for the treatment of adult patients with mantle cell lymphoma (MCL) whose disease has relapsed or progressed after two prior therapies, one of which included bortezomib.

In combination with a rituximab product, lenalidomide is indicated for the treatment of adult patients with previously treated follicular lymphoma (FL) or previously treated marginal zone lymphoma (MZL).[L16028]"	CDH5, PTGS2, CRBN, TNFSF11	-0.6148095769878614	5.984891472717582e-11
31	DB01590	everolimus	"Everolimus is indicated for the treatment of postmenopausal women with advanced hormone receptor-positive, HER2-negative breast cancer (advanced HR+ BC) in combination with exemestane, after failure of treatment with letrozole or anastrozole.
Indicated for the treatment of adult patients with progressive neuroendocrine tumors of pancreatic origin (PNET) with unresectable, locally advanced or metastatic disease.
Indicated for the treatment of adult patients with advanced renal cell carcinoma (RCC) after failure of treatment with sunitinib or sorafenib.
Indicated for the treatment of adult patients with renal angiomyolipoma and tuberous sclerosis complex (TSC), not requiring immediate surgery.
Indicated in pediatric and adult patients with tuberous sclerosis complex (TSC) for the treatment of subependymal giant cell astrocytoma (SEGA) that requires therapeutic intervention but cannot be curatively resected."	MTOR	-3.843040969530591	1.5399857155406428e-10
32	DB01092	ouabain	For the treatment of atrial fibrillation and flutter and heart failure	ATP1A2, ATP1A3, ATP1A1	-1.9950610565872509	1.5399857155406428e-10
33	DB00694	daunorubicin	"For remission induction in acute nonlymphocytic leukemia (myelogenous, monocytic, erythroid) of adults and for remission induction in acute lymphocytic leukemia of children and adults.

Daunorubicin is indicated in combination with [cytarabine] for the treatment of newly-diagnosed therapy-related acute myeloid leukemia (t-AML) or AML with myelodysplasia-related changes (AML-MRC) in adults and pediatric patients 1 year and older.[L32843]"	TOP2B, TOP2A	-1.545692720057758	1.5399857155406428e-10
