	DrugBank_ID	DrugBank_Name	Indication	Targets	Proximity	Normalized_Enrichment_Score	FDR
140	DB00608	Chloroquine	"Chloroquine is indicated to treat infections of _P. vivax_, _P. malariae_, _P. ovale_, and susceptible strains of _P. falciparum_.[L12051] It is also used to treat extraintestinal amebiasis.[L12051]

Chloroquine is also used off label for the treatment of rheumatic diseases,[A191655] as well as treatment and prophylaxis of Zika virus.[A191649,A191652] Chloroquine is currently undergoing clinical trials for the treatment of COVID-19.[A191631]"	ACE2, TLR9, GSTA2, GSTM1, HMGB1, TNF	-0.40052694730417393	-1.6867339696525239	<0.0001
141	DB00280	Disopyramide	For the treatment of documented ventricular arrhythmias, such as sustained ventricular tachycardia, ventricular pre-excitation and cardiac dysrhythmias. It is a Class Ia antiarrhythmic drug.	CHRM1, ORM2, CHRM2, KCND2, KCND3, CHRM3, KCNH2, SCN5A	-0.37946470199356036	1.5630784591095817	<0.0001
142	DB13956	Estradiol valerate	"Estradiol valerate is commercially available as an intramuscular injection as the product Delestrogen and is indicated for the treatment of moderate to severe vasomotor symptoms and vulvovaginal atrophy due to menopause, for the treatment of hypoestrogenism due to hypogonadism, castration or primary ovarian failure, and for the treatment of advanced androgen-dependent carcinoma of the prostate (for palliation only). 

Estradiol valerate is also available in combination with [DB09123] as the commercially available product Natazia used for the prevention of pregnancy and for the treatment of heavy menstrual bleeding."	BECN1, MT-ATP6, GPER1, NCOA2, ESR1, NR1I2, ESR2, HSD17B2, ESRRG, CHRNA4	-0.37607736573311834	1.612822941013466	<0.0001
143	DB08896	Regorafenib	Regorafenib is indicated for the treatment of patients with metastatic colorectal cancer (CRC) who have been previously treated with fluoropyrimidine-, oxaliplatin- and irinotecan-based chemotherapy, an anti-VEGF therapy, and, if KRAS wild type, an anti-EGFR therapy. Regorafenib is also indicated for the treatment of patients with locally advanced, unresectable or metastatic gastrointestinal stromal tumour (GIST) who have been previously treated with imatinib mesylate and sunitinib malate. Regorafenib is also indicated for the treatment of patients with hepatocellular carcinoma (HCC) previously treated with sorafenib.[L16835]	FLT4, ABL1, RAF1, FGFR2, TEK, KDR, DDR2, FGFR1, EPHA2, FLT1, NTRK1, BRAF, MAPK11, KIT, PDGFRB, FRK, RET, PDGFRA	-0.3724172639444409	2.240606139621849	<0.0001
144	DB12695	Phenethyl Isothiocyanate		PSMC3, FBXO41, YWHAQ, TPM4, TUBA1A, ATP5F1B, ATP5MG, DIABLO, HSPB1, TPM1, TXN, ACTB, SMARCE1, S100A10, RANBP1, TUBA4A, TPM3, HSPA4, YWHAZ, PSMA3, HSPH1, NUDC, UCHL1, YWHAH, SF3A3, TUBB2A, ATP5ME, USP14, ACTA2, SUCLG2, PAPPA, HSPE1, TUBB3, TUBB1, YWHAB, TPD52L2, TUBA3C, TUBB4B, VIM, HNRNPK, MT-ND1, HNRNPF, VCP, CYB5B, YWHAE	-0.3496224118377781	1.6977911394209269	<0.0001
145	DB02010	Staurosporine		CHRM1, PIK3CG, SYK, PDPK1, PIM1, CSK, ITK, GSK3B, PRKCQ, MAPKAPK2, LCK, CDK2, ZAP70	-0.3384702557479012	-1.4055188940000243	<0.0001
146	DB06195	Seliciclib	Investigated for use/treatment in breast cancer, lung cancer, lymphoma (unspecified), multiple myeloma, leukemia (lymphoid), and cancer/tumors (unspecified).	CSNK1E, CDK9, MAPK1, CDK1, CDK7, MAPK3, CDK2	-0.32851638425334023	-2.119065006094811	<0.0001
147	DB01233	Metoclopramide	"Metoclopramide in the oral tablet form is used for symptomatic treatment of both acute and recurrent diabetic gastroparesis, in addition to the treatment of gastroesophageal reflux disease (GERD) in patients who have failed to respond to traditional therapy.[L8414] A nasal spray formulation is also indicated to treat adults with acute, recurrent diabetic gastroparesis.[L14381]

In the intravenous injection form, it is indicated for the above conditions as well as for the prevention of vomiting that may follow emetogenic chemotherapy or nausea and vomiting after surgery. Intravenous metoclopramide facilitates intubation of the small bowel and stimulates gastric emptying and barium flow in patients who require radiological examination of the stomach or small intestine.  In some cases, the delay of gastrointestinal emptying interferes with the radiographic visualization of the gastrointestinal tract, and metoclopramide is used to facilitate emptying in these cases, allowing for adequate diagnostic visualization.[L8417]

Some off-label uses of metoclopramide include the management of radiation-induced nausea and vomiting, gastric bezoars, intractable hiccups, and migraine pain.[A184961,A184964,A184967,A40105]"	CHRM1, HTR3A, DRD2, HTR4	-0.320154284212081	1.5583220452245323	<0.0001
148	DB00604	Cisapride	For the symptomatic treatment of adult patients with nocturnal heartburn due to gastroesophageal reflux disease.	HTR2A, KCNH2, HTR3A, HTR4	-0.320154284212081	1.4237061447586015	<0.0001
149	DB00313	Valproic acid	"**Indicated** for:[Label] 

1) Use as monotherapy or adjunctive therapy in the management of complex partial seizures and simple or complex absence seizures. 

2) Adjunctive therapy in the management of multiple seizure types that include absence seizures. 

3) Prophylaxis of migraine headaches.

4) Acute management of mania associated with bipolar disorder.


**Off-label** uses include:
 
1) Maintenance therapy for bipolar disorder.[A177919]

2) Treatment for acute bipolar depression.[A177928,A177931,A177934]

3) Emergency treatment of status epilepticus.[A177955]"	HDAC9, ALDH5A1, PPARA, PPARD, HDAC2, ACADSB, PPARG, OGDH, SCN1A	-0.3179939232402033	-1.7081659131349543	<0.0001
150	DB02587	Colforsin		ADCY5, ADCY2, CFTR, GNAS	-0.2996469750323056	-1.8832181763418094	<0.0001
151	DB01069	Promethazine	Promethazine tablets and suppositories are indicated to treat rhinitis, allergic conjunctivitis, allergic reactions to blood or plasma, dermographism, anaphylactic reactions, sedation, nausea, vomiting, pain, motion sickness, and allergic skin reactions.[A189907,L4000] Promethazine cough syrup with phenylephrine and codeine is indicated to relieve cough and upper respiratory symptoms, and nasal congestion associated with allergy or the common cold.[L11326]	CHRM1, CALM1, CHRM2, DRD2, ADRA1A, CHRM5, CHRM3, HRH2, CHRM4, HRH1, SCN1A	-0.2934937723121912	-1.758176948477117	<0.0001
152	DB00420	Promazine	Used as an adjunct for short term treatment of moderate and severe psychomotor agitation. Also used to treat agitation or restlessness in the elderly.	CHRM1, DRD2, HTR2A, ADRA1A, HTR2C, HRH1	-0.2904272632472396	1.3610248429898006	<0.0001
153	DB01242	Clomipramine	"May be used to treat obsessive-compulsive disorder and disorders with an obsessive-compulsive component (e.g. depression, schizophrenia, Tourette’s disorder).
Unlabeled indications include: depression, panic disorder, chronic pain (e.g. central pain, idiopathic pain disorder, tension headache, diabetic peripheral neuropathy, neuropathic pain), cataplexy and associated narcolepsy (limited evidence), autistic disorder (limited evidence), trichotillomania (limited evidence), onchophagia (limited evidence), stuttering (limited evidence), premature ejaculation, and premenstrual syndrome. "	GSTP1, HTR2B, HTR2A, SLC6A4, SLC6A2, HTR2C	-0.2904272632472396	1.1963017801988918	<0.0001
154	DB11672	Curcumin	No approved therapeutic indications. 	GSTP1, ABCC5, VDR, PPARG, CBR1	-0.27175601686223616	1.2808966938006678	<0.0001
155	DB03374	3,5-Diiodotyrosine		PRSS1, IYD, PKIA, PRKACA	-0.2671948240349997	-1.8735262743740009	<0.0001
156	DB00925	Phenoxybenzamine	For the treatment of phaeochromocytoma (malignant), benign prostatic hypertrophy and malignant essential hypertension.	ADRA2C, CALM1, ADRA1A, ADRA1B, ADRA2A, ADRB2, ADRA1D, ADRA2B	-0.25036889857508876	-1.3451007176268626	<0.0001
157	DB00159	Icosapent	EPA can be used for lowering elevated triglycerides in those who are hyperglyceridemic. In addition, EPA may play a therapeutic role in patients with cystic fibrosis by reducing disease severity and may play a similar role in type 2 diabetics in slowing the progression of diabetic nephropathy.	PPARD, PPARA, PTGS2, ACSL4, FFAR1, FABP7, TRPV1, PTGS1, PPARG, FADS1, SLC8A1	-0.24946697446630803	1.6719136220621202	<0.0001
158	DB00247	Methysergide	For the treatment of vascular headache	HTR7, HTR2B, HTR1A, HTR2A, HTR1E, HTR1F, HTR2C, HTR1B	-0.24478816377948917	1.418214628900615	<0.0001
159	DB04447	1,4-Dithiothreitol		PPIB, TPI1, MSRA, GSTZ1, AXIN1, LGALS1, CAMK2A, TRPM7, ALDH1A1, HMGCR	-0.23851192449551542	2.1207141350634084	<0.0001
160	DB02709	Resveratrol	Being investigated for the treatment of Herpes labialis infections (cold sores).	CLEC14A, AHR, ITGB3, MTNR1B, CSNK2A1, PPARG, AKT1, ALOX15, ITGA5, ALOX5, APP, PTGS1, MTNR1A, KHSRP, ESR1, PI4K2B, NR1I3, YARS1, PTGS2, NQO2, SLC2A1, SNCA, NR1I2, CBR1, SIRT1, PPARA	-0.23740769962701294	2.5506371595457735	<0.0001
161	DB01103	Quinacrine	For the treatment of giardiasis and cutaneous leishmaniasis and the management of malignant effusions.	PLCL1, PLA2G4A, PLA2G6	-0.21283439002034799	1.3721449475860128	<0.0001
162	DB00191	Phentermine	"Phentermine is indicated, alone or in combination with topiramate, as a short-term adjunct, not pass a few weeks, in a regimen of weight reduction based on exercise, behavioral modifications and caloric restriction in the management of exogenous obesity for patients with an initial body mass index (BMI) greater than 30 kg/m2 or greater than 27 kg/m2 in presence of other risk factors such as controller hypertension, diabetes or hyperlipidemia.[FDA label]

Exogenous obesity is considered when the overweight is caused by consuming more food than the person activity level warrants. This condition commonly causes an increase in fat storage. It is an epidemic condition in the United States where over two-thirds of adults are overweight or obese and one in three Americans is obese. In the world, the incidence of obesity has nearly doubled.[A174391]"	SLC6A4, MAOB, SLC6A3, MAOA, SLC6A2, NPY	-0.1930205261570176	-1.6175409865985224	<0.0001
163	DB00412	Rosiglitazone	Rosiglitazone is indicated as an adjunct to diet and exercise to improve glycemic control in adults with type 2 diabetes mellitus. 	PPARD, RXRB, RXRG, ACSL4, PPARG, PPARA, RXRA	-0.18112732908038348	1.9613738723435326	<0.0001
164	DB00619	Imatinib	For the treatment of Philadelphia chromosome positive chronic myeloid leukemia (Ph+ CML), Ph+ acute lymphoblastic leukaemia, myelodysplastic/myeloproliferative diseases, aggressive systemic mastocytosis, hypereosinophilic syndrome and/or chronic eosinophilic leukemia (CEL), dermatofibrosarcoma protuberans, and malignant gastrointestinal stromal tumors (GIST).	BCR, KIT, ABL1, CSF1R, DDR1, NTRK1, RET, PDGFRB, PDGFRA	-0.1643576323782328	2.0930124932801997	<0.0001
165	DB00875	Flupentixol	"Flupentixol is indicated for maintenance therapy of chronic schizophrenic patients whose main manifestations do not include excitement, agitation or hyperactivity.[L31808]

It is indicated for the management of depression in adult patients who may, or may not, also be showing signs of anxiety.[L31928]

Flupentixol in combination with [melitracen] is indicated to manage symptoms of anxiety, depression, and asthenia in adults.[L31923]"	DRD1, DRD3, CHRM1, DRD2, HTR2A, ADRA1A, HTR2C, DRD4	-0.13744609987683906	-1.2527949319094522	<0.0001
166	DB00459	Acitretin	For the treatment of severe psoriasis in adults.	RXRB, RARB, RARG, RXRA, RXRG, RBP1, RARA	-0.11951796667253468	-1.965129840923757	<0.0001
167	DB01118	Amiodarone	"The FDA approved indications for amiodarone are recurrent ventricular fibrillation (VF)
and recurrent hemodynamically unstable ventricular tachycardia (VT). The FDA emphasizes that this drug should only be given in these conditions when they are clinically documented and have not responded to normal therapeutic doses of other antiarrhythmic agents, or when other drugs are not tolerated by the patient.[L3561]

Off-label indications include atrial fibrillation and supraventricular tachycardia.[A189666,A189720,A189723,L11286]"	CACNA1I, CACNA1C, KCNH2, ADRB1, PPARGC1B, PPARG, PPARA	-0.116326411024111	-2.0701735472884346	<0.0001
168	DB00909	Zonisamide	For use as adjunctive treatment of partial seizures in adults with epilepsy.	CA4, CACNA1G, SCN2B, CA14, CA6, CA8, CA7, SCN11A, SCN1B, SCN4A, CA12, CACNA1H, CACNA1I, SCN2A, CA10, CA3, SCN3A, CA13, CA11, MAOA, CA1, SCN1A, CA5B, MAOB, CA9, SCN3B, SCN4B, SCN9A, CA2, SCN5A, CA5A	-0.11374977040578059	1.9143941498014205	<0.0001
169	DB00321	Amitriptyline	"This drug in indicated for the following conditions [FDA label]:

Major depressive disorder in adults

Management of neuropathic pain in adults

Prophylactic treatment of chronic tension-type headache (CTTH) in adults

Prophylactic treatment of migraine in adults

Treatment of nocturnal enuresis in children aged 6 years and above when organic pathology, including spina bifida and related disorders, have been excluded and no response has been achieved to all other non-drug and drug treatments, including antispasmodics and vasopressin-related products. This product should only be prescribed by a healthcare professional with expertise in the management of persistent enuresis [FDA label]

Off-label uses: irritable bowel syndrome, sleep disorders, diabetic neuropathy, agitation, fibromyalgia, and insomnia "	HTR1A, SLC6A2, HTR1D, OPRK1, NTRK2, HTR2A, OPRM1, HRH2, ADRA2A, HTR2C, HTR7, CHRM1, OPRD1, KCNQ2, ADRA1A, NTRK1, HRH4, HTR6, ADRA1B, KCNH2, HTR1B, KCNA1, SLC6A4, ADRA1D, HRH1, SIGMAR1, KCNQ3	-0.10422177618286516	1.0659339302103612	<0.0001
170	DB03010	Patupilone	Investigated for use/treatment in ovarian cancer, lung cancer, brain cancer, breast cancer, and gastric cancer.	TUBA4A, TUBB, TUBA1C, TUBA3C, TUBB4B, TUBB4A, TUBA8, TUBA1B, TUBA1A, TUBB3, TUBB1	-0.08050934734841597	1.3663547804029277	<0.0001
171	DB00210	Adapalene	Adapalene is indicated for the topical treatment of acne vulgaris in patients aged 12 and over.[L12873]	RXRB, TLR2, JUN, RARB, RARG, GOT1, RXRG, RARA, RXRA	-0.02151455402655753	1.8284170982529084	<0.0001
172	DB01016	Glyburide	Glyburide is indicated alone or as part of combination product with metformin, as an adjunct to diet and exercise, to improve glycemic control in adults with type 2 diabetes mellitus.[L8120,L8123]	ABCB11, ABCC8, ABCC9, CPT1A, ABCA1, TRPM4, CFTR, KCNJ11	-0.0025116214135851105	-1.4877277952811692	<0.0001
173	DB01149	Nefazodone	For the treatment of depression.	ADRA2A, HTR1A, HTR2A, ADRA1A, KCNH2, SLC6A4, SLC6A2, ADRA1B, HTR2C, SLC6A3	0.015773273814125955	1.3980548982244416	<0.0001
174	DB01259	Lapatinib	Indicated in combination with capecitabine for the treatment of patients with advanced or metastatic breast cancer whose tumors overexpress the human epidermal receptor type 2 (HER2) protein and who have received prior therapy including an anthracycline, a taxane, and trastuzuma.	EGFR, ERBB2	-2.27254114382911	-1.280485688312005	0.000520512506391376
175	DB00862	Vardenafil	Used for the treatment of erectile dysfunction	PDE6H, PDE6G, PDE5A	-0.5162209500964319	1.2331553137372242	0.000628347861707926
176	DB00261	Anagrelide	Anagrelide is indicated for the treatment of thrombocythemia, secondary to malignant neoplasms, to reduce platelet count and the associated risk of thrombosis. It is also beneficial in the amelioration of thrombocythemia symptoms including thrombo-hemorrhagic events.[L14153]	PDE3A	-2.976990705215955	1.2430280991011435	0.001923036059582244
177	DB12191	Obatoclax		BCL2	-3.5920285948531783	1.2251668084127236	0.002612057866599504
178	DB06780	Desoxycorticosterone acetate		NR3C2	-2.7200850800954965	-1.2209901748462895	0.002733882339486906
179	DB00477	Chlorpromazine	For the treatment of schizophrenia; to control nausea and vomiting; for relief of restlessness and apprehension before surgery; for acute intermittent porphyria; as an adjunct in the treatment of tetanus; to control the manifestations of the manic type of manic-depressive illness; for relief of intractable hiccups; for the treatment of severe behavioral problems in children (1 to 12 years of age) marked by combativeness and/or explosive hyperexcitable behavior (out of proportion to immediate provocations), and in the short-term treatment of hyperactive children who show excessive motor activity with accompanying conduct disorders consisting of some or all of the following symptoms: impulsivity, difficulty sustaining attention, aggressivity, mood lability, and poor frustration tolerance.	DRD1, DRD2, HTR1A, DRD5, ORM1, SMPD1, CALM1, HTR2A, ADRA2A, HTR2C, HTR7, CHRM1, DRD3, ADRA1A, HTR6, HRH4, ADRA1B, KCNH2, DRD4, CHRM3, HRH1	-0.04193934665506493	1.1909323411681594	0.0028797444187052923
180	DB14544	Hydrocortisone valerate	For the relief of the inflammatory and pruritic manifestations of corticosteroid-responsive dermatoses. Also used to treat endocrine (hormonal) disorders (adrenal insufficiency, Addisons disease). It is also used to treat many immune and allergic disorders, such as arthritis, lupus, severe psoriasis, severe asthma, ulcerative colitis, and Crohn's disease.	NR3C1, ANXA1, HSD3B1, HSD11B2	-0.8980842865071551	-1.2300520632695724	0.003550874533641185
181	DB00635	Prednisone	Prednisone is indicated as an anti-inflammatory or immunosuppressive drug for allergic, dermatologic, gastrointestinal, hematologic, ophthalmologic, nervous system, renal, respiratory, rheumatologic, infectious, endocrine, or neoplastic conditions as well as in organ transplant.[L10502]	NR3C1	-4.556829316731708	-1.2107372582400784	0.004526236061818647
182	DB00243	Ranolazine	"Ranolazine is indicated for the treatment of chronic angina. It can be used alone or in conjunction with nitrates, beta-blockers, angiotensin receptor blockers, anti-platelet drugs, calcium channel blockers, lipid-lowering drugs, and ACE inhibitors.[L3580]

Ranolazine has also been used off-label for the treatment of certain arrhythmias, including ventricular tachycardia, however, this use is not strongly  supported by scientific evidence.[A174940] Ranolazine has also been studied for the treatment of acute coronary syndrome, microvascular coronary dysfunction, arrhythmia, and glycemic control, which are not yet approved indications.[A174898,L3580]"	CACNA1C, KCNJ12, ADRA1A, ADRB1, SCN1A	-0.7294504270347966	-1.212054375420493	0.004664328994511947
183	DB00975	Dipyridamole	For as an adjunct to coumarin anticoagulants in the prevention of postoperative thromboembolic complications of cardiac valve replacement and also used in prevention of angina.	ADA, PDE10A, ORM1, PDE4A, RCAN1, PDE5A	-0.9092284780207427	-1.2255364279176977	0.00470505818536633
184	DB01119	Diazoxide	Used parentally to treat hypertensive emergencies. Also used to treat hypoglycemia secondary to insulinoma.	KCNJ11, ATP1A1, KCNMA1, CA2, CA1	-0.21923966757949362	1.2103299517634933	0.005628681565022926
185	DB00436	Bendroflumethiazide	For the treatment of high blood pressure and management of edema related to heart failure.	CA4, SLC12A3, KCNMA1, CA2, CA1	-0.21923966757949362	-1.171286476004487	0.006256744619859555
186	DB08916	Afatinib	"Afatinib is a kinase inhibitor indicated as monotherapy [L2937] for the first-line [FDA Label] treatment of (a) Epidermal Growth Factor Receptor (EGFR) TKI (tyrosine kinase inhibitor)-naive adult patients with locally advanced or metastatic non-small cell lung cancer (NSCLC) whose tumours have non-resistant EGFR mutations as detected by an FDA-approved test [FDA Label], and (b) adult patients with locally advanced or metastatic NSCLC of squamous histology progressing on or after platinum-based chemotherapy [FDA Label, L2937].

Recently, as of January 2018, the US FDA approved a supplemental New Drug Application for Boehringer Ingelheim's Gilotrif (afatinib) for the first line treatment of patients with metastatic non-small cell lung cancer (NSCLC) whose tumors have non-resistant epidermal growth factor receptor (EGFR) mutations as detected by an FDA-approved test [L2939]. The new label includes data on three additional EGFR mutations: L861Q, G719X and S768I [L2939]."	EGFR, ERBB2, ERBB4	-2.70460561344236	1.1698419637085675	0.006956998574007475
187	DB13954	Estradiol cypionate	Depo-Estradiol intramuscular depot injection is indicated for the treatment of moderate to severe vasomotor symptoms and hypoestrogenism due to hypogonadism.	BECN1, MT-ATP6, GPER1, NCOA2, ESR1, NR1I2, ESR2, HSD17B2, ESRRG, CHRNA4	-0.37607736573311834	-1.1896363618834491	0.008852417324001372
188	DB00562	Benzthiazide	For the treatment of high blood pressure and management of edema.	CA4, CA9, SLC12A3, CA2, CA1, CA12	-0.08760349869188919	-1.143389779231273	0.02037228888480915
189	DB00700	Eplerenone	For improvement of survival of stable patients with left ventricular systolic dysfunction (ejection fraction <40%) and clinical evidence of congestive heart failure after an acute myocardial infarction.	NR3C2	-2.7200850800954965	-1.1487718977987729	0.024527847538874742
190	DB00615	Rifabutin	For the prevention of disseminated <i>Mycobacterium avium</i> complex (MAC) disease in patients with advanced HIV infection.	HSP90AA1, HSP90B1	-1.8735217840145173	1.1378280549846553	0.051760330179783064
191	DB01388	Mibefradil	For the treatment of angina and high blood pressure.	CACNA1G, CACNA1S, CACNA1H, CACNA1I, CACNB3, CACNA1C, CACNB4, CACNA1D, CACNB2, CACNA1F, CACNB1	-0.5781090778848021	1.148979452089737	0.052859696971705436
192	DB01626	Pargyline	For the treatment of moderate to severe hypertension.	MAOA, MAOB	-1.222056358939778	-1.1307222078465777	0.07291185678083963
193	DB00939	Meclofenamic acid	For the relief of mild to moderate pain, for the treatment of primary dysmenorrhea and for the treatment of idiopathic heavy menstrual blood loss. Also for relief of the signs and symptoms of acute and chronic rheumatoid arthritis and osteoarthritis.	PTGS2, KCNQ2, ALOX5, PTGS1, KCNQ3	-0.11649710527293357	1.111134522784226	0.07567964653329262
194	DB00568	Cinnarizine	For the treatment of vertigo/meniere's disease, nausea and vomiting, motion sickness and also useful for vestibular symptoms of other origins.	DRD1, CACNA1G, CACNA1S, CACNA1H, CACNA1I, CACNA1F, CACNA1C, CHRM1, CACNA1D, DRD2, HRH1	-0.16419778262762896	-1.1083441498861943	0.11627779249845385
195	DB07997	N-[2-(METHYLAMINO)ETHYL]-5-ISOQUINOLINESULFONAMIDE		PKIA, PRKACA	-0.8558870383043621	-1.1125629152902534	0.12065721518481053
196	DB02052	Indirubin-3'-monoxime		AHR, GSK3B, CDK5R1, CDK1, CDK5, CDK2	-0.4625639311429656	-1.0412393497385757	0.22399911995434765
197	DB00794	Primidone	Primidone is commonly indicated for the management of grand mal, psychomotor, and focal epileptic seizures.[L4645,L11112] In addition, it has also been studied and utilized as an effective management of essential tremor.[A39414,A39415,L4645]	GRIA2, GRIK2, CHRNA7, GABRA1, CHRNA4, GABRA2, GABRA6, GABRA4, GABRA3, GABRA5	-0.7103475674014877	1.0745983641174486	0.23390660773770916
198	DB01195	Flecainide	In New Zealand and America, flecainide is indicated to prevent supraventricular arrhythmias and ventricular arrhythmias.[L8878] In the United States, it is also indicated to prevent paroxysmal atrial fibrillation and flutter.[A186886,L5056]	RYR2, SCN5A, SCN4A, KCNH2	-0.4097119600183014	-1.0666330190275097	0.24704836446358064
