	DrugBank_ID	DrugBank_Name	Indication	Targets	Proximity	Normalized_Enrichment_Score	FDR
72	DB00380	Dexrazoxane	For reducing the incidence and severity of cardiomyopathy associated with doxorubicin administration in women with metastatic breast cancer who have received a cumulative doxorubicin hydrochloride dose of 300 mg/m^2 and would benefit from continued doxorubicin therapy. Also approved for the treatment of extravasation from intravenous anthracyclines.	TOP2A, TOP2B	-1.5857672593888283	1.8088478033221633	<0.0001
73	DB00773	Etoposide	For use in combination with other chemotherapeutic agents in the treatment of refractory testicular tumors and as first line treatment in patients with small cell lung cancer. Also used to treat other malignancies such as lymphoma, non-lymphocytic leukemia, and glioblastoma multiforme.	TOP2A, TOP2B	-1.5857672593888283	-1.7132467245807075	<0.0001
74	DB01115	Nifedipine	Nifedipine capsules are indicated to treat vasospastic angina and chronic stable angina.[L11383] Extended release tablets are indicated to treat vasospastic angina, chronic stable angina, and hypertension.[L11389,L1245]	CACNA1G, CACNA1S, CALM1, CACNA1C, CACNA1D, NR1I2, KCND3, CACNB2	-1.563241624581022	-1.5384078233569345	<0.0001
75	DB08597	Dorsomorphin		FKBP1A, ACVR1	-1.5520971905166896	1.6082078912273954	<0.0001
76	DB01782	Pyrazolanthrone		MAPK8, MAPK8IP1, MAPK10, TTK	-1.4942121082064754	2.210600021306618	<0.0001
77	DB01229	Paclitaxel	Used in the treatment of Kaposi's sarcoma and cancer of the lung, ovarian, and breast. Abraxane® is specfically indicated for the treatment of metastatic breast cancer and locally advanced or metastatic non-small cell lung cancer.	MAP2, MAP4, NR1I2, BCL2, MAPT, TUBB1	-1.4905078996370011	-1.3726556675104036	<0.0001
78	DB01248	Docetaxel	For the treatment of patients with locally advanced or metastatic breast cancer after failure of prior chemotherapy. Also used as a single agent in the treatment of patients with locally advanced or metastatic non-small cell lung cancer after failure of prior platinum-based chemotherapy. It is also used in combination with prednisone, in the treatment of patients with androgen independent (hormone refractory) metastatic prostate cancer. Furthermore, docetaxel has uses in the treatment of gastric adenocarinoma and head and neck cancer. 	MAP2, MAP4, NR1I2, BCL2, MAPT, TUBB1	-1.4905078996370011	1.3479437752630734	<0.0001
79	DB04297	Trichostatin A		HDAC7, HDAC8	-1.4877432441223657	-2.477440806402488	<0.0001
80	DB11781	Tosedostat		NPEPPS, LTA4H	-1.4830893160222838	1.551330474941126	<0.0001
81	DB07859	4-(4-CHLOROPHENYL)-4-[4-(1H-PYRAZOL-4-YL)PHENYL]PIPERIDINE		AKT2, GSK3B, PKIA, PRKACA	-1.443286806100992	2.2991195152460158	<0.0001
82	DB08073	(2S)-1-(1H-INDOL-3-YL)-3-{[5-(3-METHYL-1H-INDAZOL-5-YL)PYRIDIN-3-YL]OXY}PROPAN-2-AMINE		PRKACA, AKT2, PKIA, GSK3B	-1.443286806100992	-1.4726119772064774	<0.0001
83	DB00201	Caffeine	Caffeine is indicated for the short term treatment of apnea of prematurity in infants and off label for the prevention and treatment of bronchopulmonary dysplasia caused by premature birth.[T716,L9851] In addition, it is indicated in combination with sodium benzoate to treat respiratory depression resulting from an overdose with CNS depressant drugs.[L9899] Caffeine has a broad range of over the counter uses, and is found in energy supplements, athletic enhancement products, pain relief products, as well as cosmetic products.[T716,L9854,L9872]	ITPR1, ADORA2B, PDE1A, ADORA1, PRKDC, PDE4B, ADORA2A, ADORA3, RYR1, PIK3CB, PDE1B, ATM, PIK3CA, PIK3CD	-1.4259578059442655	1.4905472939047006	<0.0001
84	DB00836	Loperamide	For the control and symptomatic relief of acute nonspecific diarrhea and of chronic diarrhea associated with inflammatory bowel disease or gastroenteritis. Also used for reducing the volume of discharge from ileostomies.	OPRD1, CALM1, OPRK1, OPRM1, NR1I3, POMC, CACNA1A	-1.3638629295412366	2.060743446043415	<0.0001
85	DB00717	Norethisterone	"Norethisterone is indicated as an oral contraceptive when given as monotherapy[L9527] or in combination with an estrogen component, such as [ethinylestradiol] or [estradiol].[L10313,L10307] In combination with an estrogen component, oral norethisterone is also indicated as a hormone replacement therapy in the treatment of postmenopausal osteoporosis and moderate-to-severe vasomotor symptoms arising from menopause.[L10304] When applied via transdermal patch, the combination of norethisterone and estradiol is indicated for the treatment of hypoestrogenism, vulvovaginal atrophy, and moderate-severe vasomotor symptoms.[L10301]

Norethisterone, taken in combination with intramuscular [leuprolide], is also indicated for the symptomatic treatment of endometriosis-related pain.[L10310]"	AR, NR3C1, PGR	-1.3046115120876611	1.3281917278271576	<0.0001
86	DB01054	Nitrendipine	For the treatment of mild to moderate hypertension	CACNA2D2, CACNA1S, CACNA1H, CACNA1C, CACNA1D, CACNA2D1, CACNB2	-1.2253753794390803	-1.5894442428183837	<0.0001
87	DB01132	Pioglitazone	Pioglitazone is indicated as an adjunct to diet and exercise to improve glycemic control in adults with type 2 diabetes mellitus.[L11416] It is also available in combination with [metformin],[L11419] [glimepiride],[L11422] or [alogliptin][L11425] for the same indication.	PPARG, MAOB	-1.222056358939778	1.7459911957665375	<0.0001
88	DB02509	Farnesol		NR1H4, MAOB	-1.222056358939778	1.5086974312322192	<0.0001
89	DB01247	Isocarboxazid	Isocarboxazid is indicated for the treatment of the enduring and debilitating symptoms of depression that have not responded to other antidepressant drugs.[L1372] Depression is a common but serious mood disorder. The patient will present changes in its feelings, thoughts, and ability to handle everyday activities. For a mood disorder to be considered as depression, the symptoms should be present for at least two weeks.[L1375]	MAOA, MAOB	-1.222056358939778	-1.1673202536396088	<0.0001
90	DB01023	Felodipine	For the treatment of mild to moderate essential hypertension. 	CACNA2D2, CACNA1S, CACNA1H, PDE1A, CALM1, CACNA1C, CACNA1D, TNNC2, CACNA2D1, CACNB2, NR3C2, PDE1B, TNNC1	-1.2206270335566913	1.4445570035003303	<0.0001
91	DB00343	Diltiazem	"**Oral**

Indicated for the management of hypertension, to lower blood pressure, alone or in combination with other antihypertensive agents.[L10556]

Indicated for use to improve exercise tolerance in patients with chronic stable angina.[L10556]

Indicated for the management of variant angina (Prinzmetal's angina).[L6298]

**Intravenous**

Indicated for the short-term management of atrial fibrillation or atrial flutter for temporary control of rapid ventricular rate.[L6292]

Indicated for the rapid conversion of paroxysmal supraventricular tachycardias (PSVT) to sinus rhythm. This includes AV nodal reentrant tachycardias and reciprocating tachycardias associated with an extranodal accessory pathway such as the WPW syndrome or short PR syndrome.[L6292]

**Off-label**

Indicated for off-label uses in anal fissures (as topical formulation), migraine prophylaxis, cramps in lower leg related to rest, pulmonary hypertension,[L6289] idiopathic dilated cardiomyopathy, and proteinuria associated with diabetic nephropathy.[L6298]"	CACNG1, CACNA1C	-1.2108859141702948	1.2980754849101914	<0.0001
92	DB04513	N-(6-Aminohexyl)-5-Chloro-1-Naphthalenesulfonamide		TNNI3, TNNC1, CALM1	-1.2034793799241743	1.6826360128260134	<0.0001
93	DB02424	Geldanamycin		HSP90AA1, HSP90AB1, HSP90B1	-1.141848725931557	-2.1919388944597036	<0.0001
94	DB04599	Aniracetam		GRIA2, HTR2A, GRIA3, DRD2	-1.078318724210139	-1.5570205835430955	<0.0001
95	DB01041	Thalidomide	For the acute treatment of the cutaneous manifestations of moderate to severe erythema nodosum leprosum (ENL). Also for use as maintenance therapy for prevention and suppression of the cutaneous manifestations of ENL recurrence.	CRBN, ORM1, PTGS2, FGFR2, TNF, NFKB1	-1.070914552897029	1.6508182278441446	<0.0001
96	DB00818	Propofol	Used for induction and/or maintenance of anaesthesia and for management of refractory status epilepticus. 	GABRB2, SCN2A, GABRB3, GABRA1, SCN4A	-1.0685377881704465	1.3960234932110294	<0.0001
97	DB09237	Levamlodipine	Levamlodipine is indicated alone or in combination to treat hypertension in adults and children.[L10833]	CACNA1D, NOS2, NOS3, CACNA1C	-1.014164335136114	-1.1555508406607455	<0.0001
98	DB01092	Ouabain	For the treatment of atrial fibrillation and flutter and heart failure	ATP1A2, ATP1A1, ATP1A3	-1.0063874670949866	1.7972105272158723	<0.0001
99	DB12340	Navitoclax		BAD, BCL2, BCL2L2	-0.9830112714614844	1.4020595486136318	<0.0001
100	DB00393	Nimodipine	For use as an adjunct to improve neurologic outcome following subarachnoid hemorrhage (SAH) from ruptured intracranial berry aneurysms by reducing the incidence and severity of ischemic deficits.	CACNA1S, CACNB3, CACNA1C, CACNB4, CACNA1D, AHR, CACNB2, NR3C2, CACNA1F, CACNB1	-0.9722279717297049	2.029218625761396	<0.0001
101	DB01205	Flumazenil	For the complete or partial reversal of the sedative effects of benzodiazepines in cases where general anesthesia has been induced and/or maintained with benzodiazepines, and where sedation has been produced with benzodiazepines for diagnostic and therapeutic procedures. Also for the management of benzodiazepine overdose as an adjunct for appropriate supportive and symptomatic measures.	GABRA1, GABRG2, GABRA5	-0.9550538589929741	-1.534830160046314	<0.0001
102	DB00756	Hexachlorophene	For use as a surgical scrub and a bacteriostatic skin cleanser. It may also be used to control an outbreak of gram-positive infection where other infection control procedures have been unsuccessful.	ESR1, GLUD1, SDHD	-0.9454869120185507	2.437772464559568	<0.0001
103	DB07080	TO-901317		RXRB, NCOA2, NR1I2, NCOA1, NR1H3, NR1H2	-0.9108384356468322	-1.5411155454655627	<0.0001
104	DB00834	Mifepristone	For the medical termination of intrauterine pregnancy through 49 days' pregnancy. Also indicated to control hyperglycemia secondary to hypercortisolism in adult patients with endogenous Cushing's syndrome who have type 2 diabetes mellitus or glucose intolerance and are not candidates for surgery or have had unsuccessful surgery.	KLK3, NR3C1, NR1I2, PGR	-0.8980842865071551	1.717384081599747	<0.0001
105	DB08175	(2E,4E)-11-METHOXY-3,7,11-TRIMETHYLDODECA-2,4-DIENOIC ACID		RXRB, NR1H3, NCOA2	-0.8966237412887688	-1.9353383201155636	<0.0001
106	DB07863	2-chloro-5-nitro-N-phenylbenzamide		PPARG, NCOA2, RXRA	-0.8966237412887688	1.7292245235928585	<0.0001
107	DB00675	Tamoxifen	Tamoxifen is indicated to treat estrogen receptor positive metastatic breast cancer in adults, as an adjuvant in the treatment of early stage estrogen receptor positive breast cancer in adults, to reduce the risk of invasive breast cancer after surgery and radiation in adult women with ductal carcinoma in situ.[L7802]	MAPK8, ESR1, ESR2, PRKCA, NR1I2, ESRRG, SHBG, KCNH2, EBP, AR	-0.8635321875770374	2.0135773457463966	<0.0001
108	DB03496	Alvocidib	Investigated for use/treatment in esophageal cancer, leukemia (lymphoid), lung cancer, liver cancer, and lymphoma (unspecified).	CDK6, PYGM, CDK9, CDK4, PYGB, EGFR, CDK8, CDK1, CDK7, CDK5, CDK2	-0.8626722098391694	-1.4204071974295172	<0.0001
109	DB07996	5-(2-methylpiperazine-1-sulfonyl)isoquinoline		PKIA, PRKACA	-0.8558870383043621	1.3847016279838622	<0.0001
110	DB06616	Bosutinib	Treatment of chronic, accelerated, or blast phase Philadelphia chromosome-positive (Ph+) chronic myelogenous leukemia (CML) with resistance or intolerance to prior therapy in adult patients. 	BCR, LYN, ABL1, MAP2K1, CAMK2G, HCK, SRC, MAP2K2, CDK2, MAP3K2	-0.8342937786754141	-2.743975232743238	<0.0001
111	DB01100	Pimozide	Used for the suppression of motor and phonic tics in patients with Tourette's Disorder who have failed to respond satisfactorily to standard treatment.	CALM1, DRD3, DRD2, KCNH2	-0.8222351873845399	1.4096130365039834	<0.0001
112	DB02116	Olomoucine		CDK1, CDK5, CDK2, MAPK1	-0.8160267151191172	-1.6732993853880453	<0.0001
113	DB00622	Nicardipine	Used for the management of patients with chronic stable angina and for the treatment of hypertension.	CHRM1, PDE1A, CALM1, CACNA1C, CACNA1D, CHRM2, CHRM4, CACNB2, CACNA2D1, ADRA1A, PDE1B, CHRM5, ADRA1B, CHRM3, ADRA1D	-0.812238279029227	2.458137915575275	<0.0001
114	DB01262	Decitabine	Decitabine is indicated for the treatment of patients with myelodysplastic syndromes (MDS) including all French-American-British subtypes (refractory anemia, refractory anemia with ringed sideroblasts, refractory anemia with excess blasts, refractory anemia with excess blasts in transformation, and chronic myelomonocytic leukemia), as well as for MDS scored as belonging to the intermediate-1, intermediate-2, or high-risk group in the International Prognostic Scoring System.[L14962]	DNMT3B, DNMT3A, DNMT1	-0.8091932870588651	2.2645099522532557	<0.0001
115	DB08080	Latrunculin B		SPIRE2, MRTFA, ACTA1	-0.7805743852159338	2.076558782955889	<0.0001
116	DB03758	Radicicol		DLAT, HSP90AB1, HSP90B1, PDK3	-0.7760121968900774	-1.1503091735798763	<0.0001
117	DB05470	VX-702	Investigated for use/treatment in coronary artery disease, inflammatory disorders (unspecified), and rheumatoid arthritis.	IL1B, MAPK14, TNF, IL6	-0.7647573716775568	1.3597022690022007	<0.0001
118	DB00482	Celecoxib	"Celecoxib is indicated for symptomatic treatment of adult osteoarthritis (OA) and adult rheumatoid arthritis (RA).[L7646] Celecoxib is not a substitute for aspirin for cardiovascular event prophylaxis.[L7646] 

It may be also be used to treat acute pain from various sources, juvenile rheumatoid arthritis in children over 2, ankylosing spondylitis, and primary dysmenorrhea.[L7646]

Celecoxib, in combination with [tramadol], is indicated for the management of acute pain in adults severe enough to require an opioid analgesic and in whom alternative treatments are inadequate.[L38949]"	PDPK1, PTGS2, CA3, CA2, CDH11	-0.7481535572484187	-1.8754086827144478	<0.0001
119	DB06486	Enzastaurin	Investigated for use/treatment in brain cancer, lymphoma (non-hodgkin's), and lung cancer.	AURKA, AURKB, AKT1, CDK15, CHEK2, PRKCB, PIK3R1, CHEK1	-0.7454079100332522	1.2828047753153016	<0.0001
120	DB05294	Vandetanib	Vandetanib is currently approved as an alternative to local therapies for both unresectable and disseminated disease. Because Vandetanib can prolong the Q-T interval, it is contraindicated for use in patients with serious cardiac complications such as congenital long QT syndrome and uncompensated heart failure. 	PTK6, VEGFA, TEK, EGFR, RET	-0.7161180233910264	-2.549789687212881	<0.0001
121	DB01234	Dexamethasone	Dexamethasone and [ciprofloxacin] otic suspension is indicated for bacterial infections with inflammation in acute otitis media and acute otitis externa.[L10698] Intramuscular and intravenous injections are indicated for a number of endocrine, rheumatic, collagen, dermatologic, allergic, ophthalmic, gastrointestinal, respiratory, hematologic, neoplastic, edematous, and other conditions.[L10701] Oral tablets are indicated for the treatment of multiple myeloma.[L10710] An intravitreal implant is indicated for some forms of macular edema and non-infectious posterior uveitis affecting the posterior of the eye.[L10719] Various ophthalmic formulations are indicated for inflammatory conditions of the eye.[L10704,L10707,L10713,L10716,L10722,L10725]	NOS2, NR0B1, NR3C1, NR1I2, ANXA1	-0.6541679511588517	1.5514445430779022	<0.0001
122	DB14649	Dexamethasone acetate		NOS2, NR0B1, NR3C1, NR1I2, ANXA1	-0.6541679511588517	-1.4306810706222222	<0.0001
123	DB00480	Lenalidomide	"Lenalidomide is indicated for the treatment of adult patients with multiple myeloma (MM) in combination with dexamethasone. It is also indicated as maintenance therapy in multiple myeloma following autologous hematopoietic stem cell transplantation (auto-HSCT).

It is indicated for the treatment of adult patients with transfusion-dependent anemia due to low- or intermediate-1-risk myelodysplastic syndromes (MDS) associated with a deletion 5q cytogenetic abnormality with or without additional cytogenetic abnormalities.

Lenalidomide is indicated for the treatment of adult patients with mantle cell lymphoma (MCL) whose disease has relapsed or progressed after two prior therapies, one of which included bortezomib.

In combination with a rituximab product, lenalidomide is indicated for the treatment of adult patients with previously treated follicular lymphoma (FL) or previously treated marginal zone lymphoma (MZL).[L16028]"	CRBN, TNFSF11, CDH5, PTGS2	-0.6473054771420024	-1.5874930115003474	<0.0001
124	DB07557	3,20-Pregnanedione		NCOA1, NR1I3, AKR1D1, RXRA	-0.613415499945081	1.532066042264363	<0.0001
125	DB00704	Naltrexone	Used as an adjunct to a medically supervised behaviour modification program in the maintenance of opiate cessation in individuals who were formerly physically dependent on opiates and who have successfully undergone detoxification. Also used for the management of alcohol dependence in conjunction with a behavioural modification program.	OPRK1, OPRD1, SIGMAR1, OPRM1	-0.6115076904525321	1.3917115291390183	<0.0001
126	DB08846	Ellagic acid	Ellagic acid is being investigated for use in follicular lymphoma, brain injury in intrauterine growth restricted babies, obese adolescents, and solar lentigines.	CA4, CA9, SYK, CA12, PRKCA, SQLE, CA14, CA5B, CA6, PRKACA, PRKCB, CA3, CA7, CA2, CSNK2A1, CA1, CA5A	-0.5941344248817861	1.854974466957168	<0.0001
127	DB04841	Flunarizine	Used in the prophylaxis of migraine, occlusive peripheral vascular disease, vertigo of central and peripheral origin, and as an adjuvant in the therapy of epilepsy.	CACNA1G, CACNA1H, CACNA1I, CALM1, HRH1	-0.5934886718607596	-1.1730057784164534	<0.0001
128	DB00642	Pemetrexed	Used in combination with cisplatin for the treatment of malignant pleural mesothelioma in adults whose disease is unresectable or who otherwise are not candidates for potentially curative surgery. Also used as a monotherapy for the treatment of locally advanced or metastatic non-small cell lung cancer (NSCLC) after prior chemotherapy	GART, DHFR, TYMS, ATIC	-0.5711186399199337	-1.9419434487191638	<0.0001
129	DB00203	Sildenafil	"Sildenafil is a phosphodiesterase-5 (PDE5) inhibitor that is predominantly employed for two primary indications:

(1) the treatment of erectile dysfunction [A175582, L5611, F3853, F3856, F3886]; and

(2) treatment of pulmonary hypertension, where:
a) the US FDA specifically indicates sildenafil for the treatment of pulmonary arterial hypertension (PAH) (WHO Group I) in adults to improve exercise ability and delay clinical worsening [F3850]. The delay in clinical worsening was demonstrated when sildenafil was added to background epoprostenol therapy [F3850]. Studies establishing effectiveness were short-term (12 to 16 weeks), and included predominately patients with New York Heart Association (NYHA) Functional Class II-III symptoms and idiopathic etiology (71%) or associated with connective tissue disease (CTD) (25%) [F3850];

b) the Canadian product monograph specifically indicates sildenafil for the treatment of primary pulmonary arterial hypertension (PPH) or pulmonary hypertension secondary to connective tissue disease (CTD) in adult patients with WHO functional class II or III who have not responded to conventional therapy [F3859]. In addition, improvement in exercise ability and delay in clinical worsening was demonstrated in adult patients who were already stabilized on background epoprostenol therapy [F3859]; and

c) the EMA product information specifically indicates sildenafil for the treatment of adult patients with pulmonary arterial hypertension classified as WHO functional class II and III, to improve exercise capacity [F3883]. Efficacy has been shown in primary pulmonary hypertension and pulmonary hypertension associated with connective tissue disease [F3883]. The EMA label also indicates sildenafil for the treatment of pediatric patients aged 1 year to 17 years old with pulmonary arterial hypertension [F3883]. Efficacy in terms of improvement of exercise capacity or pulmonary hemodynamics has been shown in primary pulmonary hypertension and pulmonary hypertension associated with congenital heart disease [F3883]."	PDE6H, PDE6G, PDE5A	-0.5162209500964319	1.506828056823705	<0.0001
130	DB01645	Genistein	Currently Genistein is being studied in clinical trials as a treatment for prostate cancer.  	ESRRA, AKT1, NCOA2, GPER1, ESR2, ESR1, NR1I2, PTK2B, ESRRB, CYP1B1, TOP2A, NCOA1, SHBG	-0.5148952141415537	-1.923087943719345	<0.0001
131	DB01088	Iloprost	Used for the treatment of pulmonary arterial hypertension.	PLAT, PTGDR2, PDE4C, PDE4B, PDE4A, PDE4D, PTGER1, PTGIR	-0.4919532742386822	2.1738388875179564	<0.0001
132	DB00396	Progesterone	"**Gelatinized capsules**

The gelatinized capsules are indicated for use in the prevention of endometrial hyperplasia in non-hysterectomized postmenopausal women who are receiving conjugated estrogens tablets. They are also indicated for use in secondary amenorrhea [FDA label]. 

**Vaginal gel**

Progesterone gel (8%) is indicated as progesterone supplementation or replacement as part of an Assisted Reproductive Technology (“ART”) treatment for infertile women with progesterone deficiency.  The lower concentration progesterone gel (4%) is used in the treatment of secondary amenorrhea, with the use of the 8% concentration if there is no therapeutic response to the 4% gel [F3898].

**Vaginal insert**

This form is indicated to support embryo implantation and early pregnancy by supplementation of corpus luteal function as part of an Assisted Reproductive Technology (ART) treatment program for infertile women [F3901].

**Injection (intramuscular)**

This drug is indicated in amenorrhea and abnormal uterine bleeding due to hormonal imbalance in the absence of organic pathology, such as submucous fibroids or uterine cancer [F3907]. 

**Tablets, contraceptive**

The tablet form of progesterone in contraceptive formulations is indicated for the prevention of pregnancy [F3904]. "	ORM1, ESR1, OPRK1, CYP17A1, NR3C1, ESR2, NR3C2, PGR, SHBG, AR	-0.4704935274952305	1.8094516416538964	<0.0001
133	DB07995	H-89		HASPIN, PKIA, PRKACA	-0.46342556212478714	1.7659968725728652	<0.0001
134	DB00831	Trifluoperazine	For the treatment of anxiety disorders, depressive symptoms secondary to anxiety and agitation.	CALM1, S100A4, DRD2, ADRA1A, TNNC1, CALY	-0.4409909948449059	1.525575495061962	<0.0001
135	DB00887	Bumetanide	For the treatment of edema associated with congestive heart failure, hepatic and renal disease including the nephrotic syndrome.	SLC12A5, SLC12A4, SLC12A1, SLC12A2, CFTR	-0.4337920885264443	-1.2783088012373922	<0.0001
136	DB00421	Spironolactone	"Spironolactone is indicated for the treatment of New York Heart Association Class III-IV heart failure, management of edema in cirrhotic adults not responsive to fluid and sodium restrictions, primary hyperaldosteronism short-term preoperatively, primary hyperaldosteronism long-term in patients with aldosterone producing adrenal adenomas that are not candidates for surgery or patients with bilarteral micro/macronodular adrenal hyperplasia, as an add-on therapy in hypertension, and in nephrotic syndrome when treatment of the disease as well as fluid and sodium restriction with other diuretics is inadequate.[Label]

Spironolactone has antiandrogenic activity which leads to many of its off label uses. Spironolactone is used off label in the treatment of hirsutism, female pattern hair loss, and adult acne vulgaris.[A178135]

Spironolactone is also frequently used for its antiandrogenic effects in transgender female patients due to its low cost and reducing male-pattern hair growth.[A178138]"	SRD5A1, CACNG1, CYP17A1, NR1I2, NR3C1, NR3C2, PGR, SHBG, AR, CYP11B2	-0.40906285182650587	-1.5939040046496908	<0.0001
137	DB00564	Carbamazepine	Carbamazepine is indicated for the treatment of epilepsy and pain associated with true trigeminal neuralgia.[L1335] In particular, carbamazepine has shown efficacy in treating mixed seizures, partial seizures with complex symptoms, and generalized tonic-clonic seizures.[A180301,L1335] Carbamazepine is also indicated for the treatment of manic episodes and mixed manic-depressive episodes caused by bipolar I disorder.[L1335] Some off-label, unapproved uses of carbamazepine include the treatment of alcohol withdrawal syndrome and restless leg syndrome.[A180415,A180421]	NR1I2, CHRNA4, SCN1A	-0.40849343561113094	-1.7196354459903118	<0.0001
138	DB01254	Dasatinib	For the treatment of adults with chronic, accelerated, or myeloid or lymphoid blast phase chronic myeloid leukemia with resistance or intolerance to prior therapy. Also indicated for the treatment of adults with Philadelphia chromosome-positive acute lymphoblastic leukemia with resistance or intolerance to prior therapy.	STAT5B, PPAT, SRC, YES1, LCK, ABL1, EPHA5, CSK, HSPA8, KIT, FYN, NR4A3, ABL2, LYN, EPHA2, BTK, MAPK14, FRK, EPHB4, BCR, FGR, MAP3K20, PDGFRB	-0.4082499550268298	-1.9266420865627554	<0.0001
139	DB02546	Vorinostat	For the treatment of cutaneous manifestations in patients with cutaneous T-cell lymphoma who have progressive, persistent or recurrent disease on or following two systemic therapies.	HDAC2, HDAC8, HDAC6, HDAC3, HDAC1	-0.4021988635083288	-2.6444862475720337	<0.0001
