HP:0001288	Gait disturbance	199	0.05494202098288239	1.6939908146159368	4.425486443304776e-15	5.836535774650799e-13	12.233844848153801	4.5524979042276225e-11	ALS2, CYFIP2, PGAP1, NEFL, RPS6KA3, DYRK1A, THOC2, ARL6IP1, TTBK2, CPLANE1, XPR1, ACTN2, ADCY5, PDE8B, ATP6AP2, MED23, GDAP1, MTOR, TUBB4A, KDM5A, ATP8A2, MTR, YWHAG, DMD, SYNJ1, HEXB, TMEM106B, PPP3CA, GLRB, MT-ND1, TFG, DDHD1, BMPR1A, ERLIN1, SACS, MYO9A, ATL1, EIF4H, XRCC4, PI4KA, FHL1, FOXG1, ATXN1, ELP1, PSAP, HACE1, GLB1, GTF2I, FIG4, FGF12, DDHD2, USP9X, MT-ATP6, KCND3, ABCD3, RANBP2, ATAD1, AOPEP, WDR11, PRNP, FUS, STRADA, CC2D2A, LUZP1, LYST, SETX, GBF1, HERC1, TCTN1, CELF2, CACNA1A, SLC20A2, SNAP25, MECP2, CDK19, KIAA0586, ZBTB20, OPA1, MT-CO2, SCN8A, PIBF1, PANK2, ELOVL4, SEMA3A, DCC, GABRA5, APTX, CDKL5, ATP6V1A, AMPD2, MT-CO3, HPCA, SLC9A6, HK1, SPTLC1, SLC1A2, MICU1, NUBPL, PHIP, PDK3, RERE, NECAP1, IQSEC2, DYM, SCN1A, MTRR, HCN1, RPS20, SLC30A9, UBAC2, ITPR1, FGF14, TPK1, CSPP1, JARID2, MSH2, RIC1, ADAR, CNKSR2, TAF1, SPTAN1, SGCD, AP4S1, EIF2AK2, ARL13B, PRKN, GABRB2, FBXO38, PIK3CA, CEP120, GNPTAB, AHI1, ATP1A3, KCNB1, NPHP1, UBE4B, GABRG2, TRAPPC11, SNCA, CACNA1B, HINT1, DYNC1H1, GOSR2, MT-CO1, KRAS, SLC2A3, DNM1, MAPT, RPGRIP1L, LRP12, CRPPA, SCN3A, VPS37A, KPNA3, GFPT1, SMCHD1, DDX6, SLC9A7, SYNE1, BSCL2, CACNA2D1, PMS1, SYT14, CDK8, ISCU, WDR48, SYNGAP1, GPHN, FTL, CFAP43, AP1S2, FRRS1L, MT-ND5, SGCB, SPEN, DAB1, APP, NPAT, CASK, WWOX, LNPK, MT-ND4, HTT, GDAP2, LPIN1, TOGARAM1, PPP2R2B, NTRK2, TMEM67, CLTC, ATM, SBF2, FKTN, DNM1L, ANO5, GRID2, SPART, GABRA2, STAT4
HP:0000337	Broad forehead	84	0.02319160684704583	1.6938096972402692	5.129849099305931e-07	2.377061156962167e-05	4.623959644611943	0.005277075768456011	CDC42BPB, DYRK1A, THOC2, PAK1, PIGN, UBAP2L, KMT2A, WAC, RUNX2, EIF4H, CDH2, MARK2, AMMECR1, PPP2CA, ADAMTS3, NALCN, DNMT3A, SETBP1, PRKACB, NAA15, GTF2I, MBD5, GLIS1, ZFPM2, CAMTA1, NF1, FUT8, PEX3, ANKH, ADNP, KCNH1, ZBTB20, PTEN, DZIP1, TTC5, CTNND1, CDKL5, RBFOX2, SOS1, CDH11, IQSEC2, ROBO1, KANSL1, CNTNAP2, PTPN11, TBCK, TMEM260, WBP11, TLL1, JARID2, FBN1, TSC1, TAF1, KAT6B, SHOC2, ANKRD11, PIK3CA, RLIM, TCF12, PKD1L1, PTDSS1, CHD4, KRAS, SMAD2, MAP2K1, YY1, CHD8, FLCN, SPTBN1, SUZ12, RPL10, MADD, CASK, FBXO11, TAB2, MCTP2, MED13L, NSD1, POGZ, HECTD4, BRAF, GATAD2B, ABL1, UNC80
HP:0001249	Intellectual disability	577	0.15930425179458862	1.6921249974014168	1.0005978904313239e-43	2.058630099773406e-40	39.686421681579645	1.0293150498867028e-39	C2CD3, KCNQ3, GRIA4, PEX1, ARL6IP1, MEIS2, ADCY5, WFS1, MBOAT7, MTOR, NIPBL, CRADD, TUBB4A, MTR, SECISBP2, KIF21A, YWHAG, HGSNAT, IFT122, GDI1, TMEM106B, RPS19, MAPK1, CIT, GRIA1, EXTL3, CEP295, MYO9A, EIF4H, CHD6, MARK2, RPL13, AMMECR1, FRAS1, ADAMTS3, FRMPD4, ACVR1, PCCA, MAP1B, GABRB3, DNMT3A, CHST11, ARHGDIA, FRMD5, SIL1, TRAPPC9, PPP1R21, ARID2, GNAQ, HNRNPK, HERC1, AGGF1, CTNNB1, CEP85L, BTRC, NRCAM, KCNH1, GNAO1, ACTG1, PIBF1, PANK2, DCC, OCRL, NEXMIF, CDKL5, ALDH5A1, STAG1, GRIP1, SOS1, NGLY1, RAC1, SLC16A2, AUTS2, RERE, NECAP1, AFF4, CHD2, EDEM3, MYO5A, PUM1, ZBTB7A, USP45, JARID2, TSC1, SMARCA2, ATP6V1B2, SEMA3E, SPAST, PRKAR1A, TUBB, CEP120, RLIM, CRYM, NPHP1, SON, ANAPC1, TCF12, GABRG2, TUSC3, SMAD2, DHCR24, PHF21A, MAP2K1, DPYD, CRPPA, SCN3A, YY1, STT3B, CACNA1D, HNRNPA2B1, HNRNPU, SPTBN1, SYT14, TRRAP, ZC3H14, TMTC3, COG6, RBPJ, KIF1A, FAR1, MTFMT, WWOX, DHX30, AP1G1, ATRX, SLC35A3, FBXO11, PAFAH1B1, SUCLG1, WDR19, FRMD4A, CSNK2A1, POGZ, PRORP, HS2ST1, LEMD3, FANCM, CDC73, PDCD6IP, FBXW11, GLB1, KIAA0586, PDZD8, MANBA, DYRK1A, THOC2, WDR26, SLC35A1, HNRNPH1, P4HA1, OPHN1, CUL4B, LRP1, KDM5A, DIS3L2, PIGN, RSRC1, TMEM38B, RUSC2, SYNJ1, WAC, PPP3CA, HPRT1, UBE3A, RUNX2, DLG4, CHSY1, DEPDC5, SACS, PDE4D, GRIK2, XRCC4, CDH2, SLC4A4, FRA10AC1, FHL1, LPIN2, SPATA7, SETBP1, ALKBH8, ANO10, PSMD12, PRKACB, GTF2I, FIG4, DDHD2, USP9X, PURA, MTAP, BTD, COX10, ARNT2, STRADA, CC2D2A, ARFGEF2, DOCK7, SETD2, STAG2, TCTN1, IL6ST, CELF2, CACNA1A, MED27, DIAPH1, OPA1, SCN8A, LIFR, GABRA5, KLHL7, APTX, PAK3, ATP6V1A, AMPD2, WDFY3, BBS5, CERT1, EXT1, CDH11, CLCN3, MCCC1, ST3GAL3, CEP83, IQSEC2, PMM2, GPR88, EIF4A2, SDCCAG8, SMAD4, TAF1, FILIP1, AGPS, EYA1, ARL13B, SHOC2, NT5C2, DPP6, RASA2, INTU, ANKRD11, GNPTAB, VPS35L, KCNB1, SPECC1L, CDC42, ARSB, MAP3K7, TIAM1, KRAS, SORL1, BMPER, GRIA2, MID2, RAD21, ZNF148, B4GAT1, SYNE1, CREBBP, CEP57, FAM20B, FMN2, SNRPN, MADD, APP, BCL11B, BRWD3, SAMD12, TAB2, KIDINS220, NBN, NSD1, SCN2A, GNB1, CNOT1, NTRK2, ZC4H2, HECTD4, ARID1B, CLTC, WDPCP, DDX3X, FKTN, PGK1, ANO5, FASTKD2, GABRA2, STS, KCTD7, CYFIP2, CDC42BPB, RPS6KA3, SYT1, LMBR1, GABBR1, DPYSL5, ATP6V0C, ATP6AP2, MED23, COG3, YEATS2, LAMB1, ALMS1, KMT2A, NNT, RAD50, EXT2, TRAF3IP1, GNAI1, BBS1, IFT80, CNNM2, BMPR1A, PLCH1, PI4KA, TLK2, FOXG1, IDS, NALCN, RFX7, TBL1XR1, SUCLA2, ADARB1, OGT, HECW2, PARN, FUT8, ORC4, QDPR, DNAJC6, MAPK8IP3, ZMYM2, PDP1, ALG9, ANKH, ADNP, MAPRE2, MECP2, PAK2, CDK19, ZBTB20, PTEN, TUBA1A, RORA, FOXP2, GRIN2B, SEMA3A, TENM3, SUPT16H, SMC3, BRD4, DLG3, ATP2B1, HK1, SLC1A2, SCARB2, TTC8, ATP6V0A1, YME1L1, KMT5B, SCN1A, ROBO1, MTRR, KANSL1, PTPN11, RB1, KAT6A, RIC1, FBN1, ANK3, RELN, CEP290, UBR1, DYNC2H1, SPTAN1, MPDZ, ARID1A, EIF2AK2, SCAPER, ZNF292, GABRB2, TRIP12, ATP1A3, SNX14, TNRC6B, RAB3GAP2, KMT2C, TRAPPC11, CACNA1B, STARD7, ASH1L, CHD4, SOS2, ASPH, GP1BB, RPGRIP1L, NEK1, EXOC6B, PHACTR1, DIP2B, PRRT2, DGCR2, DDX6, NCDN, SNX10, RARB, CACNA2D1, HHAT, PGM2L1, ARL6, CDK8, GPHN, SYNGAP1, FBXW4, FBXW7, TAOK1, CAMK2B, KCNA4, SUZ12, RPL10, PDHX, AGO2, GABRA3, MAST3, IPO8, KCNN3, SUMF1, TOGARAM1, GRIA3, SCN9A, BRAF, MED12L, DYNC2LI1, ZSWIM6, AGO1, RAB3GAP1, TMEM67, STIM1, PPP1CB, KCNQ5, HERC2, ERCC5, CWC27, CTNND2, SCLT1, BBS9, EFHC1, PGAP1, ACTB, GCLC, TTC21B, CPLANE1, GRM7, VAMP2, RALA, CACNB4, WDR37, TSPAN7, KDM3B, ATP8A2, GPX4, UBAP2L, STXBP1, GLRB, KDM6A, PPP2R1A, HIVEP2, WASHC4, TNIK, YY1AP1, EPG5, BPTF, TMEM165, GABRA1, ACSL4, HACE1, KCNT1, NAA15, MBD5, RANBP2, FGF12, MCCC2, PPARG, FRYL, CAMTA1, NF1, FANCL, ATAD1, WDR11, DMXL2, RUBCN, BBS7, LUZP1, FOXP1, SPOP, LYST, MYSM1, CPE, SLC17A5, SNAP25, CAMK2A, IGF1R, EP300, JMJD1C, SLC12A6, TTC5, CDON, VPS41, SPRED1, AP2M1, CHD1, ATP5F1A, ATP2A2, SLC1A1, PHIP, GPI, NSMCE2, DYM, PCYT1A, LMBRD1, HCN1, CNTNAP2, ASXL2, FBXL3, ITPR1, RNPC3, TAF2, CSPP1, CNKSR2, KAT6B, VPS13B, RNF213, OSTM1, DSE, AKT3, CRIPT, PIK3CA, AHI1, WDR35, NEMF, SETD5, SDHC, VPS53, PTDSS1, UBE4B, ATR, DYNC1H1, GHR, BBS2, CDK13, DNM1, IFT81, GPC6, CHD8, SMCHD1, NBAS, VRK1, MAPK10, TRIM37, FRRS1L, RBMX, HUWE1, SPEN, IQCB1, COG5, CASK, ALDH3A2, ELP2, TRIO, UCHL1, B3GLCT, HDAC8, SLC12A5, ABL1, PIK3R1, TANC2, GRID2, NEDD4L, TRPS1
HP:0000369	Low-set ears	252	0.06957482054113749	1.691809921918852	7.915175399611393e-19	1.9386526032333905e-16	15.712500007329627	8.142340933580241e-15	C2CD3, PCLO, RPL15, CDC42BPB, PDZD8, ACTB, DYRK1A, YWHAE, PEX1, HNRNPH1, MEIS2, CPLANE1, ATP6V1E1, DPYSL5, P4HA1, SLC12A2, RALA, ATP6AP2, WDR37, COG3, NIPBL, KDM5A, DIS3L2, PIGN, IFT122, TMEM38B, STXBP1, KMT2A, GAD1, RUSC2, ASXL1, RPS19, MAPK1, CHSY1, KDM6A, BMPR1A, DEPDC5, MYO9A, ACER3, SRRM2, CDH2, MARK2, PLCH1, IREB2, WASHC4, FRA10AC1, FRAS1, MACF1, FHL1, ADAMTS3, EPG5, TMEM165, NALCN, SETBP1, PSMD12, PPP1R21, GLB1, OGT, RPL9, MBD5, FIG4, ARID2, USP9X, FRYL, PURA, CAMTA1, NF1, TASP1, DST, FANCL, PEX3, ORC4, MAPK8IP3, ZMYM2, CC2D2A, SPOP, MYSM1, HERC1, ALG9, STAG2, ANKH, TCTN1, IL6ST, CTNNB1, ADNP, SNAP25, MECP2, MAPRE2, IGF1R, KCNH1, MED27, EP300, PTEN, SCYL2, PIBF1, JMJD1C, RALGAPA1, FOXP2, LIFR, TTC5, RPL18, PPP1R12A, TENM3, EXOC2, SPRED1, SUPT16H, SMC3, MIA3, SPART, ATP6V1A, STAG1, BRD4, ATP2B1, GRIP1, SOS1, NGLY1, RAC1, CDH11, AUTS2, CLCN3, RERE, DHX9, LMBRD1, EDEM3, ASXL2, RPS20, PTPN11, PUM1, TBCK, TMEM260, WBP11, CSPP1, RB1, JARID2, ITCH, SMAD4, KAT6A, FBN1, ATP6V1B2, ADAR, RELN, ZNF462, SMARCA2, TAF1, KAT6B, EYA1, HS6ST2, SHOC2, ARL13B, ZNF292, RPL5, INTU, BRCC3, TRIP12, TUBB, CEP120, WDR35, GNPTAB, AHI1, LRPPRC, SETD5, VPS35L, SON, RAB3GAP2, KCTD1, CDC42, SPECC1L, NUP88, ATR, CNOT2, CHD4, MAP3K7, ASH1L, KRAS, DNM1, SMAD2, CDK13, DHCR24, ASPH, GP1BB, BMPER, RPGRIP1L, IFT81, MAP2K1, PHACTR1, MRPS28, CRPPA, RAD21, YY1, GPC6, B4GAT1, ZNF148, SLC4A10, DDX6, NBAS, CREBBP, CACNA2D1, RPS27, TRRAP, CCDC47, CEP57, TAOK1, FBXL4, HUWE1, RPL10, SPEN, SMC5, MADD, COG5, GABRA3, HSD17B4, PBX1, DHX30, AP1G1, PRKDC, ATRX, ALG13, UBA2, AP3B1, FBXO11, TCF20, PAFAH1B1, MCTP2, MED13L, IPO8, TOGARAM1, NSD1, CSNK2A1, B3GLCT, FRMD4A, ZC4H2, CNOT1, POGZ, BRAF, TMEM67, ZSWIM6, DYNC2LI1, RAB3GAP1, GREB1L, HS2ST1, DDX3X, FKTN, ARID1B, PPP1CB, ERCC5, ABL1, PIK3R1, KIF5B, RPS28, CWC27, UNC80, KIAA0586
HP:0003596	Middle age onset	77	0.021258972943125346	1.6905397943498441	1.4476123047383509e-06	6.17908206591013e-05	4.209076036775186	0.014891587778843415	NEFL, APC, PDE8B, ATP6AP2, CTNNA1, HGSNAT, SPTLC2, MAK, CDH2, PDYN, ATP2B2, FHL1, TRPM7, ATXN10, KIF5A, MAP1B, ANO10, POT1, PSAP, TTLL5, USP48, KCND3, SCN2B, NF1, PRNP, GBF1, HMGCR, UBQLN2, ELOVL4, DGUOK, ITM2B, AAGAB, BMPR2, KLHL7, NPTX1, VAPB, SLC9A6, PDK3, FAT2, CYLD, MFSD8, ITPR1, NAF1, MSH2, FBN1, RELN, PRKN, TENM4, CADM3, JAK2, VPS13C, TTC19, SNCA, BMP6, KIF1B, BBS2, SMAD2, SCN3B, MAPT, MSH3, LRP12, NEK1, VPS13A, PKD2, VRK1, RIPOR2, EIF2AK4, FTL, CYP7B1, DAB1, APP, CASK, AFG3L2, TPM1, FKTN, DNM1L, ANO5
HP:0001643	Patent ductus arteriosus	120	0.03313086692435119	1.6890181563711315	1.8560472981567967e-09	1.281420037324763e-07	6.892308489309712	1.9093158556138967e-05	C2CD3, CDC42BPB, ACTB, DYRK1A, PEX1, LARS2, NPHP3, WDR37, NIPBL, PIGN, STXBP1, KMT2A, WAC, EXT2, KDM6A, CEP295, BMPR1A, EIF4H, AMMECR1, FRA10AC1, YY1AP1, PRKG1, MAP1B, ACSL4, DNMT3A, PSMD12, GTF2I, ARID2, USP9X, DNAH9, SIK3, FRYL, FUT8, FANCL, ZMYM2, LUZP1, ARFGEF2, STAG2, AGGF1, PAK2, KCNH1, EP300, PTEN, JMJD1C, SMC3, SUPT16H, SOS1, RAC1, RERE, AFF4, ARF1, LMBRD1, KANSL1, ASXL2, PTPN11, EIF4A2, ZBTB7A, SMAD4, KAT6A, FBN1, SMARCA2, KAT6B, SEMA3E, ARID1A, TRIM33, RPL5, RASA2, CADM3, PIK3CA, WDR35, CEP120, SETD5, SNX14, SON, UBE4B, CDC42, SPECC1L, CHD4, MAP3K7, KRAS, SOS2, SMAD2, DHCR24, ASPH, GP1BB, MAP2K1, ZNF148, CREBBP, TRRAP, CCDC47, MAPKAPK5, TMTC3, FBXL4, COG6, FTO, SPEN, SMC5, SNRPN, AGO2, DTNA, FOCAD, TRIO, CHRM3, IPO8, KCNN3, MCTP2, SUCLG1, NSD1, B3GLCT, POGZ, BRAF, ARID1B, DYNC2LI1, FANCM, WDPCP, DDX3X, PPP1CB, ABL1, NEDD4L, GLB1
HP:0002808	Kyphosis	92	0.025400331308669245	1.6875652375269412	1.5442721263926719e-07	7.787219296177165e-06	5.108617594948308	0.0015885927364201414	RPS6KA3, ACTB, DYRK1A, MEIS2, DPYSL5, CUL4B, ALMS1, RUNX2, EXTL3, EIF4H, RAB18, DICER1, MARK2, PI4KA, TLK2, FHL1, FOXG1, NELFA, IDS, KMT2E, SIL1, PSAP, HACE1, GTF2I, FIG4, TPI1, NF1, MAPK8IP3, LUZP1, ALG9, HERC1, MECP2, ZBTB20, PTEN, TTC5, DCC, OCRL, CDKL5, MBTPS1, ASCC3, AUTS2, RERE, PMM2, DYM, KANSL1, ASXL2, ITPR1, SMAD4, FBN1, ATP6V1B2, TAF1, FILIP1, VPS13B, ACBD6, PRKAR1A, ANKRD11, PIK3CA, GNPTAB, SETD5, VPS35L, SON, RAB3GAP2, COPB1, KMT2C, SDHC, TCF12, UBE4B, PTDSS1, NUP88, CHD8, VPS37A, SYNE1, SPTBN1, ZNF407, SPEN, SMC5, MADD, ALDH3A2, ATRX, HTT, TRIO, IPO8, KCNN3, NSD1, ZC4H2, GRIA3, ARID1B, RAB3GAP1, HS2ST1, HERC2, ABL1, GLB1
HP:0001761	Pes cavus	99	0.027332965212589728	1.680447019458203	6.165307270250651e-08	3.3380271520562335e-06	5.476510135020392	0.0006342251588906844	RAB7A, ALS2, NEFL, WDR26, SEL1L, ATP1A1, CUL4B, PNPT1, GDAP1, PIGN, RUSC2, SYNJ1, HEXB, DDHD1, SACS, MYO9A, ATL1, XRCC4, ATG7, PI4KA, FHL1, YY1AP1, PRKG1, IDS, KIF5A, MAP1B, SETBP1, ANO10, DDHD2, USP9X, NF1, WDR11, HSPD1, DMXL2, DNAJC6, SETX, GBF1, SLC25A46, SNAP25, MECP2, NRCAM, KCNH1, ZBTB20, OPA1, SEMA3A, DCC, VPS41, APTX, GTF2E2, HK1, SPTLC1, ASCC3, PDK3, IQSEC2, KANSL1, CNTNAP2, SLC33A1, FGF14, DCAF8, TRIM2, SMAD4, FBN1, ATP6V1B2, SPTAN1, EIF2AK2, SPAST, FBXO38, ATP1A3, MRE11, TRAPPC11, HINT1, DYNC1H1, MAP3K7, GOSR2, KIF1B, SMAD2, VPS13A, ARIH1, KPNA3, SYNE1, BSCL2, VRK1, SUZ12, CYP7B1, SPEN, HSD17B4, UCHL1, IPO8, VPS13D, KCNN3, NSD1, B3GLCT, HDAC8, SBF2, ERCC5, DNM1L, REPS1, SPART, GLB1
HP:0000023	Inguinal hernia	97	0.026780784097183877	1.6765259248194502	1.0601218626397985e-07	5.425608756704282e-06	5.2655515266324	0.0010905473600975608	RPS6KA3, DYRK1A, YWHAE, MEIS2, ATP6V1E1, DPYSL5, POLR2A, NPHP3, CUL4B, NIPBL, KDM3B, DIS3L2, IFT122, MAPK1, KDM6A, PPP2R1A, DEPDC5, EIF4H, XRCC4, DICER1, PPP2CA, PRKG1, IDS, NALCN, SETBP1, GTF2I, TASP1, ATAD1, CC2D2A, ADNP, MAPRE2, JMJD1C, ELOVL4, GRIN2B, OCRL, ATP6V1A, BRD4, MBTPS1, AUTS2, FARSB, SMAD4, RIC1, FBN1, SMARCA2, ARID1A, SHOC2, DSE, TRIM33, TUBB, GNPTAB, WDR35, LRPPRC, VPS35L, TNRC6B, RAB3GAP2, CLCN4, KMT2C, PTDSS1, CDC42, ARSB, SMAD2, ASPH, BMPER, GP1BB, RPGRIP1L, DGCR2, SMCHD1, DDX6, CREBBP, TRRAP, KDM5B, GPHN, AP1S2, FBXL4, SUZ12, RPL10, SEC31A, MTFMT, FOCAD, PAFAH1B1, IPO8, RNF13, WDR19, NSD1, CSNK2A1, B3GLCT, POGZ, BRAF, TMEM67, ARID1B, ABL1, PIK3R1, CWC27, CTNND2, FBXW11, ZEB1, GLB1
HP:0004209	Clinodactyly of the 5th finger	140	0.03865267807840972	1.672459154838081	1.5095698911361096e-10	1.1854156847417679e-08	7.926129330723005	1.552894547011716e-06	DYRK1A, YWHAE, WDR26, GABBR1, HNRNPH1, HNRNPR, CUL4B, NIPBL, KDM5A, PIGN, IFT122, KMT2A, EXT2, UBE3A, RUNX2, MAPK1, CHSY1, KDM6A, PPP2R1A, EIF4H, RAB18, CHD6, XRCC4, AMMECR1, ATG7, FRA10AC1, ACVR1, BPTF, MAP1B, TRAPPC9, OGT, PRKACB, NAA15, GTF2I, MBD5, TPR, GLIS1, ZFPM2, SIK3, NF1, FANCL, ORC4, WDR11, MAPK8IP3, HNRNPK, ZMYM2, LUZP1, SPOP, STAG2, CTNNB1, ADNP, MAPRE2, MECP2, EP300, DZIP1, SPRED1, NEXMIF, CTNND1, MIA3, SMC3, RBFOX2, STAG1, BRD4, ATP2B1, BBS5, GRB10, SOS1, PHIP, CDH11, AUTS2, CLCN3, RERE, IQSEC2, DYM, REV3L, PTPN11, TMEM260, RB1, TLL1, SMAD4, FBN1, ATP6V1B2, TSC1, SMARCA2, ZNF462, TAF1, UBR1, KAT6B, SEMA3E, VPS13B, ZNF292, RASA2, ANKRD11, WDR35, PKD1L1, UBE4B, SPECC1L, KCTD1, CNOT2, ATR, CHD4, KRAS, SOS2, PHF21A, NEK1, RAD21, CHD8, SLC9A7, CREBBP, TRRAP, CCDC47, CEP57, RPL10, SPEN, SNRPN, AGO2, AP1G1, ATRX, UBA2, TRIO, TCF20, TAB2, PAFAH1B1, MED13L, MCTP2, WDR19, NSD1, CSNK2A1, B3GLCT, ZC4H2, HDAC8, BRAF, ARID1B, CAPRIN1, FANCM, LEMD3, ABL1, NEDD4L, KDM1A, TRPS1
HP:0000252	Microcephaly	487	0.13445610160132523	1.6692331938402016	7.543707096244999e-35	8.622457211008033e-32	31.06436895214401	7.76021148990723e-31	ALS2, C2CD3, KIF5C, GRIA4, PEX1, MEIS2, MBOAT7, NIPBL, TUBB4A, MTR, YWHAG, TMX2, HGSNAT, IFT122, RPS19, MAPK1, ANKRD17, CIT, EXTL3, EIF4H, CHD6, MARK2, RPL13, AMMECR1, FRAS1, PPP2CA, ACVR1, MAP1B, DNMT3A, CHST11, SIL1, TRAPPC9, PPP1R21, ARID2, MT-ATP6, FTH1, PEX3, HNRNPK, NDUFV2, FUS, AGGF1, CTNNB1, BTRC, NRCAM, KCNH1, GNAO1, ACTG1, SCYL2, DCC, RPL18, NEXMIF, CDKL5, GTF2E2, STAG1, GRIP1, SOS1, NGLY1, RAC1, SLC16A2, AUTS2, RERE, NECAP1, AFF4, CHD2, PUM1, TMEM260, WBP11, JARID2, SMARCA2, ADAR, ATP6V1B2, SEMA3E, AP4S1, RPL5, AUH, PRKAR1A, TUBB, CEP120, RLIM, DLD, COPB1, TCF12, GABRG2, TUSC3, SMAD2, DHCR24, MAP2K1, DPYD, CRPPA, SCN3A, VPS37A, STT3B, HNRNPU, SPTBN1, TRRAP, TMTC3, COG6, FBXL4, RBPJ, KIF1A, ADD3, FAR1, MTFMT, WWOX, DHX30, ATRX, SLC35A3, ALG13, FBXO11, RNF13, SUCLG1, WDR19, FRMD4A, CSNK2A1, POGZ, HS2ST1, LEMD3, FANCM, CDC73, RPS28, SPART, PDCD6IP, GLB1, KIAA0586, MANBA, DYRK1A, THOC2, WDR26, SLC35A1, HNRNPH1, CUL4B, KDM5A, RSRC1, TMEM38B, SYNJ1, PPP3CA, MT-ND1, RUNX2, BCAS3, CHSY1, PDE4D, GRIK2, SRRM2, XRCC4, TMEM163, IQSEC1, MACF1, KCNMA1, NELFA, LPIN2, NBEA, NDUFS1, PRKACB, GTF2I, FIG4, GFM1, PURA, TASP1, MTAP, ATP11A, CC2D2A, ARFGEF2, SELENOI, SETD2, STAG2, TCTN1, IL6ST, CELF2, CACNA1A, UQCRC2, DIAPH1, MED27, TBC1D32, SCN8A, LIFR, GABRA5, NUP133, PAK3, ATP6V1A, ADAMTSL1, WDFY3, SPTLC1, EXT1, NUBPL, CDH11, CLCN3, IQSEC2, PMM2, FARSB, EIF4A2, TPK1, SMAD4, TAF1, FILIP1, AGPS, SHOC2, DPP6, INTU, ANKRD11, GNPTAB, LRPPRC, VPS35L, KCNB1, HNRNPC, SPECC1L, CDC42, ARSB, MAP3K7, KRAS, BMPER, NFASC, RAD21, FLCN, ZNF148, B4GAT1, SYNE1, CREBBP, AGTPBP1, LMBRD2, CEP57, MAPKAPK5, FAM20B, SNRPN, MT-ATP8, PRKDC, TAB2, NBN, NSD1, SCN2A, GNB1, CNOT1, NTRK2, ZC4H2, ARID1B, CLTC, FKTN, ISCA1, DDX3X, ANO5, GABRA2, KCTD7, RARS2, CYFIP2, RPL15, CDC42BPB, RPS6KA3, LMBR1, NSUN3, SEL1L, POLR2A, MED23, COG3, CHKA, CHN1, ALMS1, KMT2A, RAD50, EXT2, TRAF3IP1, ASXL1, IFT80, CNNM2, PLCH1, RNASET2, PI4KA, TLK2, NDUFAF2, FOXG1, IDS, KIF5A, NALCN, RFX7, TBL1XR1, SUCLA2, ADARB1, OGT, RPL9, PARN, FUT8, ORC4, QDPR, MAPK8IP3, ZMYM2, ALG9, ANKH, NDUFS4, ADNP, MAPRE2, MECP2, CDK19, TUBA1A, DGUOK, ELOVL4, SV2A, GRIN2B, SEMA3A, SUPT16H, SMC3, SLC9A6, BRD4, DSTYK, DYNC1I2, SLC1A2, YME1L1, KIF2A, SCN1A, MTRR, KANSL1, RPS20, ERCC6L2, PTPN11, SLC30A9, TBCK, RB1, KAT6A, FBN1, ANK3, RELN, CEP290, UBR1, DYNC2H1, SPTAN1, MPDZ, ARID1A, EIF2AK2, ZNF292, DNAAF4, GABRB2, TRIP12, ATP1A3, TNRC6B, RAB3GAP2, KMT2C, TRAPPC11, CACNA1B, ASH1L, SOS2, ASPH, GP1BB, CDK6, RPGRIP1L, NEK1, EXOC6B, PHACTR1, MRPS28, DGCR2, DDX6, SNX10, CACNA2D1, HHAT, RPS27, MIPEP, SYNGAP1, FBXW4, ZBTB11, FBXW7, CAMK2B, AP1S2, KCNA4, CUL3, RPL10, PDHX, SMC5, NAPB, IPO8, VPS13D, SUMF1, ANKLE2, BRAF, TMEM67, ZSWIM6, RAB3GAP1, DYNC2LI1, NARS2, ATM, STIM1, PPP1CB, ERCC5, DNM1L, CTNND2, PRKAR1B, PGAP1, ACTB, TTC21B, CPLANE1, GRM7, RALA, AMFR, GPX4, STXBP1, INTS8, KDM6A, PPP2R1A, HIVEP2, RAB18, WASHC4, EPG5, BPTF, TMEM165, ACSL4, PSAP, HACE1, KCNT1, MBD5, FGF12, FRYL, NF1, FANCL, WDR11, DMXL2, NUP214, TRAPPC10, LUZP1, MYSM1, SLC17A5, CAMK2A, IGF1R, EP300, SPIDR, JMJD1C, TSEN2, SLC12A6, TTC5, CDON, SPRED1, AP2M1, ATP5F1A, MICU1, ASCC3, NSMCE2, DYM, PCYT1A, DHX9, HCN1, CNTNAP2, MT-ND3, FBXL3, ITPR1, RNPC3, TAF2, CSPP1, MT-ND2, CNKSR2, KAT6B, VPS13B, OSTM1, DSE, CRIPT, PIK3CA, DENND5A, WDR35, CLCN4, VPS53, PTDSS1, UBE4B, ATR, DYNC1H1, GHR, DNM1, CDK13, IFT81, GPC6, SLC4A10, CHD8, NBAS, VRK1, ACADSB, CCDC47, LRRC8C, TRIM37, RBMX, HUWE1, SPEN, COG5, CASK, ALDH3A2, TRIO, AP3B1, MCTP2, B3GLCT, HDAC8, SLC12A5, ABL1, PIK3R1, TANC2, UNC80, TRPS1
HP:0001629	Ventricular septal defect	151	0.04168967421314191	1.664032035065641	4.996099075561207e-11	4.144747676636946e-09	8.382501903227034	5.139487119029813e-07	C2CD3, MT-CYB, RPL15, DYRK1A, PEX1, WDR26, GRM7, SEL1L, MEIS2, HNRNPR, P4HA1, DPYSL5, LARS2, SLC12A2, WDR37, MED23, NIPBL, KDM5A, KDM3B, WAC, EXT2, ASXL1, RPS19, MAPK1, KDM6A, EIF4H, PLCH1, FRA10AC1, MACF1, PI4KA, YY1AP1, DNMT3A, RFX7, ALKBH8, PSMD12, RPL9, PRKACB, GTF2I, FIG4, TPR, ARID2, FRYL, NF1, TASP1, DST, PEX3, DMXL2, HNRNPK, ZMYM2, SLF2, ALG9, STAG2, CAMK2A, IGF1R, GNAO1, EP300, JMJD1C, RPL18, EXOC2, SMC3, CDKL5, ATP6V1A, GTF2E2, STAG1, BRD4, SOS1, MICU1, RAC1, RERE, AFF4, KANSL1, RPS20, PTPN11, CCND2, TBCK, ZBTB7A, TMEM260, SMAD4, KAT6A, FBN1, CEP290, ZNF462, FILIP1, UBR1, KAT6B, ARID1A, VPS13B, SHOC2, AKT3, RPL5, ANKRD11, PIK3CA, SETD5, VPS35L, SON, PKD1L1, SPECC1L, CHD4, MAP3K7, TIAM1, KRAS, SOS2, SMAD2, CDK13, ASPH, GP1BB, NEK1, IFT81, MAP2K1, RAD21, GPC6, DGCR2, CACNA1D, CREBBP, RARB, SPTBN1, RPS27, NAE1, TRRAP, JAM3, CDK8, CCDC47, CEP57, TAOK1, COG6, RBMX, FTO, RPL10, SPEN, DTNA, MTFMT, FOCAD, CASK, ATRX, TRIO, CHRM3, TAB2, IPO8, MED13L, NSD1, B3GLCT, SCN2A, HDAC8, BRAF, ARID1B, DYNC2LI1, PPP1CB, ABL1, RPS28, CWC27, NEDD4L
HP:0003593	Infantile onset	411	0.11347321921590281	1.6622293193248465	6.93823336736721e-29	4.460850415631656e-26	25.350582339581727	7.1373606650106495e-25	ALS2, NEFL, GRIA4, PEX1, ADCY5, ADK, MFF, MBOAT7, SLC25A12, MTOR, NIPBL, TUBB4A, ARPC5, MTR, YWHAG, TMX2, GAD1, USP53, TMEM106B, RPS19, DDHD1, GRIA1, EXTL3, TSPYL1, IDH3A, AMMECR1, PPP2CA, RPSA, FRMPD4, DOCK11, GABRB3, FRMD5, SIL1, TRAPPC9, CNTN1, PHKB, ARID2, FTH1, FNIP1, STK4, TET2, NDUFV2, CTNNB1, KCNH1, GNAO1, PANK2, DCC, EXOC2, NEXMIF, MIA3, CDKL5, LRIG2, ALDH5A1, STAG1, MBTPS1, NGLY1, RFXAP, RAC1, AUTS2, RERE, CHD2, EDEM3, MYO5A, PUM1, TSC1, ADAR, ATP6V1B2, ARHGEF9, AUH, RLIM, DLD, JAK2, SON, TPP2, COPB1, GABRG2, HYDIN, MAGI2, PTPRQ, DPYD, SCN3A, VPS37A, HNRNPA2B1, TMEM63C, SLC9A7, HNRNPU, NDUFB8, PPA2, TMTC3, CD59, FBXL4, ATCAY, KIF1A, ADD3, FAR1, MTFMT, WWOX, DHX30, ALG13, SUCLG1, CSNK2A1, AFG3L2, RRAGD, POGZ, CAPRIN1, GATAD2B, GLB1, PCLO, PDZD8, MANBA, DYRK1A, WDR26, SLC35A1, OPHN1, ATP13A3, PNPT1, GDAP1, LRP1, SLC11A2, RSRC1, TMEM38B, RUSC2, SYNJ1, WAC, PPP3CA, HPRT1, BCAS3, DLG4, DEPDC5, SACS, GRIK2, SRRM2, TMEM163, DGKE, MACF1, FHL1, KCNMA1, SPATA7, NBEA, NDUFS1, SETBP1, FIG4, PURA, DST, BTD, COX10, SLF2, ARFGEF2, DOCK7, IL6ST, CELF2, CRBN, CACNA1A, ADAM22, DIAPH1, OPA1, SCN8A, WNK1, KLHL7, APTX, ATP6V1A, AMPD2, SLC25A36, CLCN3, MCCC1, ST3GAL3, IQSEC2, PMM2, PLCG2, FARSB, EIF4A2, TPK1, CFTR, NT5C2, GNPTAB, LRPPRC, KCNB1, TRAPPC6B, HNRNPC, ZMYND11, ARSB, SLC6A17, RPL21, TIAM1, MID2, GFPT1, MTHFD1, CREBBP, AGTPBP1, LMBRD2, ZNF407, NEK10, FMN2, BCL11B, FOCAD, PRKDC, BRWD3, KIDINS220, SCN2A, GNB1, NTRK2, HECTD4, CLTC, MCTS1, ISCA1, DDX3X, FKTN, REPS1, FASTKD2, STS, KCTD7, GUCY1A1, RPS6KA3, SYT1, GABBR1, NSUN3, SEL1L, CALM1, RDX, DOCK3, ATP6V0C, ATP1A1, ATP6AP2, MED23, COG3, CHKA, BCKDHB, EXT2, HEXB, CNNM2, ATG7, RNASET2, PI4KA, TLK2, FOXG1, CAST, OTUD7A, IDS, KIF5A, KMT2E, RFX7, TBL1XR1, SUCLA2, TPR, ABCD3, PARN, QDPR, MAPK8IP3, ZMYM2, ALG9, ANKH, NDUFS4, ADNP, MECP2, PTEN, DGUOK, SV2A, GRIN2B, SUPT16H, SMC3, BRD4, ATP2B1, DYNC1I2, SLC1A2, ATP9A, ATP6V0A1, YME1L1, VPS45, KMT5B, SCN1A, MTRR, SLC33A1, SLC30A9, TBCK, TRIM2, CTNNA2, SH3KBP1, SPTAN1, EIF2AK2, DNAAF4, ATP1A3, SNX14, CCDC39, HIBCH, TNR, CACNA1B, ASH1L, GOSR2, RPGRIP1L, DIP2B, PRRT2, NCDN, SNX10, CACNA2D1, PGM2L1, MIPEP, GPHN, SYNGAP1, CAMK2B, AP1S2, CUL3, AGO2, NAPB, MAST3, VPS13D, FGF13, TOGARAM1, GRIA3, AGO1, BRAF, ZSWIM6, NARS2, SCN9A, TMEM67, ANAPC7, HERC2, KCNQ5, ERCC5, HEXA, GLS, NDUFA10, PRKAR1B, PGAP1, SLC26A3, ACTB, CRLS1, CPLANE1, VAMP2, NPHP3, PAK1, AMFR, STXBP1, KDM6A, HIVEP2, ACER3, WASHC4, IREB2, TNIK, EPG5, GABRA1, MTX2, PSAP, KCNT1, MBD5, RANBP2, FGF12, MCCC2, CAMTA1, NF1, FANCL, RUBCN, FOXP1, LYST, ATG5, PIGK, HMGCR, CAMK2A, EP300, SLC12A6, VPS41, CHD1, ATP5F1A, UBE3C, SLC25A26, SOBP, CBLB, PHIP, PCYT1A, DHX9, LMBRD1, HCN1, CNTNAP2, ATP6AP1, FBXL3, ITPR1, RNPC3, TAF2, ZNF462, KAT6B, SGCD, OSTM1, IFNAR1, CADM3, NEMF, SETD5, CLCN4, VPS53, ATR, DYNC1H1, DNM1, ARFGEF1, CHD8, KPNA3, NBAS, RETREG1, ACADSB, KDM5B, TRIM37, FRRS1L, HUWE1, CASK, ELP2, HTT, TRIO, TCF20, MED13L, SLC12A5, PIK3R1, GRID2, NEDD4L, GABRB1
HP:0001252	Hypotonia	526	0.14522363335173938	1.6589162243551991	5.464069389105446e-37	9.368146967621286e-34	33.02834630466432	5.620888180572772e-33	C2CD3, NEFL, PEX1, ADCY5, ADK, MFF, SLC25A12, MTOR, NIPBL, TUBB4A, MTR, KIF21A, YWHAG, HGSNAT, IFT122, ATXN2, ABAT, TMEM106B, MAPK1, EXTL3, MYO9A, EIF4H, MARK2, RPL13, AMMECR1, PPP2CA, ACVR1, DOCK11, FRMD5, DNMT3A, CHST11, SIL1, TRAPPC9, PPP1R21, CNTN1, PHKB, MT-ATP6, TPI1, PEX3, HNRNPK, NDUFV2, GUF1, HERC1, SLC25A46, CTNNB1, BTRC, NRCAM, KCNH1, PIBF1, DCC, OCRL, NEXMIF, CDKL5, PNPLA8, ALDH5A1, STAG1, SOS1, NGLY1, RFXAP, RAC1, RERE, CHD2, EDEM3, MYO5A, PUM1, NDN, ZBTB7A, PREPL, USP45, JARID2, MSH2, SMARCA2, ATP6V1B2, SEMA3E, AP4S1, ACBD6, PRKAR1A, TUBB, CEP120, DLD, NPHP1, SON, MRE11, TCF12, GABRG2, SMAD2, DHCR24, MAP2K1, VPS13A, DPYD, CRPPA, SCN3A, YY1, STT3B, SLC9A7, HNRNPU, SPTBN1, TRRAP, PPA2, CD59, FBXL4, ATCAY, RBPJ, KIF1A, FAR1, MTFMT, DHX30, LNPK, AP1G1, ATRX, ALG13, FBXO11, PAFAH1B1, SUCLG1, WDR19, CSNK2A1, AFG3L2, POGZ, SGCE, HS2ST1, LEMD3, CDC73, ACADM, KDM1A, GLB1, KIAA0586, MANBA, EPB41L1, THOC2, YWHAE, WDR26, HNRNPH1, ATP6V1E1, OPHN1, CUL4B, KDM5A, HLCS, DIS3L2, PIGN, RSRC1, DMD, TMEM38B, RUSC2, SYNJ1, PPP3CA, HPRT1, MT-ND1, UBE3A, RUNX2, BCAS3, CHSY1, PDE4D, GRIK2, SRRM2, XRCC4, TMEM163, FRA10AC1, MACF1, OCA2, FHL1, KCNMA1, NELFA, LPIN2, SPATA7, NBEA, NDUFS1, SETBP1, PSMD12, PRKACB, GTF2I, FIG4, USP9X, PURA, DST, MTAP, BTD, COX10, STRADA, CC2D2A, SLF2, ARFGEF2, DOCK7, SETD2, TCTN1, IL6ST, CELF2, CACNA1A, MED27, DIAPH1, SCN8A, LIFR, WNK1, NUP133, APTX, PAK3, ATP6V1A, EXT1, NUBPL, CLCN3, MCCC1, ST3GAL3, IQSEC2, PMM2, REV3L, FARSB, EIF4A2, TPK1, SMAD4, CDC40, FILIP1, AGPS, ARL13B, SHOC2, RASA2, INTU, ANKRD11, GNPTAB, LRPPRC, VPS35L, KCNB1, TRAPPC6B, HNRNPC, SPECC1L, CDC42, ZMYND11, ARSB, MAP3K7, KRAS, BMPER, NFASC, RAD21, B4GAT1, GFPT1, SYNE1, CREBBP, PMS1, AGTPBP1, SLC25A3, NAE1, CEP57, ZNF407, FAM20B, SNRPN, MADD, BCL11B, HSD17B4, MT-ATP8, FOCAD, BRWD3, TAB2, NSD1, SCN2A, GNB1, ZC4H2, NTRK2, HECTD4, ARID1B, CLTC, FKTN, DDX3X, ANO5, REPS1, FASTKD2, GABRA2, RARS2, CDC42BPB, RPS6KA3, LMBR1, GABBR1, NSUN3, SEL1L, NRXN1, DPYSL5, DOCK3, LAMB1, ALMS1, KMT2A, EXT2, TRAF3IP1, GNAI1, ASXL1, IFT80, HEXB, BMPR1A, UBE4A, TMEM67, NDUFAF2, FOXG1, OTUD7A, IDS, KIF5A, NALCN, ELP1, RFX7, TBL1XR1, SUCLA2, HECW2, TPR, FUT8, ORC4, QDPR, MAPK8IP3, ZMYM2, PDP1, ALG9, ANKH, NDUFS4, ADNP, MAPRE2, MECP2, ZBTB20, PTEN, TUBA1A, DGUOK, SV2A, GRIN2B, SEMA3A, SMC3, SLC9A6, BRD4, DLG3, ATP2B1, ATP9A, YME1L1, SCN1A, MTRR, KANSL1, SLC33A1, RPS20, PTPN11, TBCK, RB1, TRIM2, KAT6A, CTNNA2, ANK3, FBN1, RELN, CEP290, UBR1, DYNC2H1, SPTAN1, MPDZ, ARID1A, EIF2AK2, ZNF292, TRIP12, ATP1A3, SNX14, TNRC6B, RAB3GAP2, KMT2C, HIBCH, TRAPPC11, CACNA1B, ASH1L, CHD4, GOSR2, SOS2, ASPH, GP1BB, RPGRIP1L, NEK1, EXOC6B, PHACTR1, PRRT2, DGCR2, DDX6, SNX10, CACNA2D1, HHAT, PGM2L1, MIPEP, ISCU, PPM1B, SYNGAP1, FBXW4, ZBTB11, FBXW7, TAOK1, AP1S2, CAMK2B, RNF2, RPL10, AGO2, NAPB, NPAT, IPO8, FGF13, SUMF1, TOGARAM1, SCN9A, AGO1, BRAF, ZSWIM6, DYNC2LI1, NARS2, RAB3GAP1, ATM, ANAPC7, STIM1, PPP1CB, KCNQ5, ERCC5, DNM1L, HEXA, CTNND2, GLS, NDUFA10, PGAP1, ACTB, CRLS1, TTC21B, CPLANE1, RALA, ATP8A2, GPX4, UBAP2L, STXBP1, KDM6A, PPP2R1A, HIVEP2, OXCT1, RAB18, WASHC4, MED13, EPG5, ATXN1, TMEM165, TAMM41, ACSL4, PSAP, HACE1, KCNT1, MBD5, FGF12, MCCC2, FRYL, NF1, WDR11, HSPD1, NUP214, CCDC88A, CAMKMT, TRAPPC10, LUZP1, FOXP1, SLC17A5, SNAP25, CAMK2A, IGF1R, EP300, JMJD1C, TSEN2, RALGAPA1, SLC12A6, TTC5, VPS41, SPRED1, AP2M1, CHD1, ATP5F1A, UBE3C, MICU1, PHIP, NSMCE2, ACACA, DYM, PCYT1A, LMBRD1, HCN1, CNTNAP2, ASXL2, MT-ND3, ATP6AP1, ITPR1, RNPC3, CSPP1, ITCH, MT-ND2, ZNF462, KAT6B, VPS13B, OSTM1, DSE, CRIPT, DHFR, PIK3CA, AHI1, WDR35, SETD5, CLCN4, PTDSS1, UBE4B, ATR, DYNC1H1, GHR, DNM1, CDK13, IFT81, GPC6, SLC4A10, CHD8, NBAS, RETREG1, VRK1, ACADSB, CCDC47, TRIM37, FRRS1L, SPEN, IQCB1, COG5, CASK, ALDH3A2, TRIO, TCF20, MED13L, HDAC8, SLC12A5, ABL1, PIK3R1, GRID2, NEDD4L, GABRB1, TRPS1
