GO_ID	Name	Gene Count	Gene Ratio	Fold Enrichment	p-value	FDR	-log10 FDR	FWER	Associated Genes
HP:0007768	Central retinal vessel vascular tortuosity	10	0.0027609055770292656	4.73863427204123	1.3059959386732952e-06	5.644865639131171e-05	4.248346390829956	0.013434780221132188	MT-CYB, MT-CO3, MT-ND1, MT-ND4, MT-ND2, MT-ND5, MT-ND4L, NEK1, MT-ATP6, SELENOI
HP:0100033	Tics	12	0.0033130866924351186	4.2647708448371064	7.749988361721534e-07	3.4512610509536545e-05	4.462022189737539	0.007972413027702942	POGZ, ACBD6, ZSWIM6, CHD8, GATAD2B, KMT5B, MAPK1, ZBTB20, ARID2, SPTBN1, FRYL, VPS13A
HP:0200125	Mitochondrial respiratory chain defects	13	0.003589177250138045	3.890668139149641	1.4160885941664896e-06	6.0951060117952635e-05	4.215018736323318	0.01456730336819068	PREPL, PNPT1, MT-CYB, MT-CO3, MT-ND1, MT-ND4, MT-CO1, MT-ND2, MT-ND5, MT-ND4L, CAMKMT, MT-ATP6, PPM1B
HP:0040082	Happy demeanor	14	0.003865267807840972	3.790907417632984	8.855339005243759e-07	3.8929432626898525e-05	4.409721925816972	0.009109487234694255	PRKAR1B, ZSWIM6, TASP1, ASXL1, ADNP, UBE3A, SLC9A6, DYRK1A, WDR26, OCA2, HNRNPC, SNRPN, GRIK2, HDAC8
HP:0002883	Hyperventilation	21	0.005797901711761457	3.5121642251599696	1.1637536862590017e-08	7.168583335656498e-07	6.1445666616678025	0.0001197153417054635	GABRB3, SYT1, KCNT1, CNTNAP2, MT-ATP6, MT-ND3, CPLANE1, NRXN1, BTD, CAMK2B, MT-ND2, MT-ND5, HLCS, ARL13B, MT-ND1, MT-ND4, DEPDC5, GABRG2, CDKL5, TLK2, GABRA1
HP:0011182	Interictal epileptiform activity	30	0.008282716731087797	3.4814455876221277	1.153750636968812e-11	1.0320550263041885e-09	8.986297146717353	1.1868632802498168e-07	MAP1B, KCNQ3, PRRT2, ADARB1, NECAP1, KCNT1, SCN1A, KANSL1, CHD2, CNTNAP2, GRM7, SYNGAP1, FRRS1L, RELN, STRADA, CAMK2A, GRIA1, SCN8A, DEPDC5, SLC12A6, SCN2A, GABRG2, GRIA3, SCN9A, NEXMIF, AP2M1, SLC9A6, GOSR2, NBEA, GABRA1
HP:0007270	Atypical absence seizure	22	0.006073992269464384	3.4749984661635684	6.9072258410049116e-09	4.4409145141510954e-07	6.352527586742962	7.105463222641753e-05	GABRB3, SCN1A, CHD2, HNRNPU, EIF4A2, MAPK10, CACNB4, FRRS1L, CEP85L, PPP3CA, CACNA1A, UBE3A, PAFAH1B1, KCNB1, SCN2A, GABRG2, SCN9A, AP2M1, DNM1, KCNMA1, OTUD7A, GABRA1
HP:0002236	Frontal upsweep of hair	16	0.004417448923246825	3.3696954823404304	1.4731703592849805e-06	6.210862084411719e-05	4.206848114393793	0.015154503485964595	CAMTA1, YY1, HERC2, MED27, CAMK2A, TRIO, FBXO11, OGT, BRD4, CREBBP, EP300, FRMPD4, UBR1, UBAP2L, MED13L, FOXP1
HP:0020221	Clonic seizure	16	0.004417448923246825	3.3696954823404304	1.4731703592849805e-06	6.210862084411719e-05	4.206848114393793	0.015154503485964595	NAPB, SCN3A, SCN2A, TPK1, KIF5C, ATP6V1A, PSAP, DENND5A, DNM1, SCN8A, HCN1, SPTBN1, KIF5A, GRIK2, GRIA2, ATP6V0A1
HP:0032792	Tonic seizure	49	0.013528437327443401	3.3570083758557145	3.0303496107061035e-17	5.881737065157299e-15	14.230494393923411	3.117320644533369e-13	CLCN3, TBL1XR1, ST3GAL3, PSAP, SCN1A, CHD2, FGF12, CNTNAP2, HNRNPU, ATP6V0C, COG3, SLC25A12, DMXL2, CUL3, ARHGEF9, RUSC2, DOCK7, SYNJ1, NAPB, GABRA3, CEP85L, PPP3CA, CACNA1A, ADNP, LNPK, MECP2, MAST3, DENND5A, ALG13, SCN8A, ATP1A3, TSEN2, SV2A, SCN2A, VPS53, GABRA5, GNB1, GABRG2, GRIK2, NEXMIF, ATP6V1A, CACNA1B, NSF, KCNQ5, ARFGEF1, DNM1, GRIA2, PHACTR1, ATP6V0A1
HP:0002487	Hyperkinetic movements	25	0.006902263942573164	3.230887003664475	5.413585322016059e-09	3.5246552030113417e-07	6.45288336115587	5.56895522075792e-05	YME1L1, PRRT2, SUCLA2, SYT1, PSAP, IQSEC2, THOC2, SCN1A, MTRR, CACNA1E, CAMK2B, FRRS1L, FBXL4, GAD1, GNAO1, SUCLG1, SCN2A, AFG3L2, RRAGD, TRAPPC11, CACNA1B, SLC9A6, ALDH5A1, NGLY1, VPS13A
HP:0100023	Recurrent hand flapping	17	0.004693539480949751	3.222271304988036	1.6431679081067262e-06	6.871247264509712e-05	4.162964422921767	0.016903268270693893	SYNGAP1, NEXMIF, PRKAR1B, PDZD8, CHD8, SLC4A10, UBE3A, CDK19, KMT5B, TRAPPC9, HERC2, OCA2, MBD5, HECW2, TRAPPC6B, CSNK2A1, GRIK2
HP:0010844	EEG with multifocal slow activity	30	0.008282716731087797	3.2186949772355518	1.8250938343455997e-10	1.4223288086297868e-08	7.846999993433053	1.8774740273913184e-06	SCN3A, CYFIP2, NECAP1, SCN1A, CACNA2D1, FGF12, HCN1, SYNGAP1, CNKSR2, YWHAG, SYNJ1, CELF2, GABRB2, PPP3CA, CACNA1A, WWOX, CDK19, SCN8A, ATP1A3, KCNB1, GABRA5, GABRG2, NTRK2, CLTC, ATP6V1A, CACNA1B, DNM1, FOXG1, SLC1A2, GABRA2
HP:0011443	Abnormality of coordination	31	0.008558807288790724	3.205039907635159	1.0533403576635746e-10	8.465400202566556e-09	8.072352505758484	1.0835712259285192e-06	SCN3A, CYFIP2, NECAP1, PMM2, SCN1A, CACNA2D1, FGF12, HCN1, SYNGAP1, CNKSR2, YWHAG, SYNJ1, CELF2, GABRB2, PPP3CA, CACNA1A, WWOX, CDK19, SCN8A, ATP1A3, KCNB1, GABRA5, GABRG2, NTRK2, CLTC, ATP6V1A, CACNA1B, DNM1, FOXG1, SLC1A2, GABRA2
HP:0008770	Obsessive-compulsive trait	19	0.005245720596355604	3.1776723941923537	5.359051698125329e-07	2.472132951507411e-05	4.606928176563251	0.005512856481861526	PRRT2, SCN1A, HCN1, NDN, SYNGAP1, YWHAG, SNRPN, TRIO, FGF13, PANK2, SCN2A, GABRG2, SCN9A, ASH1L, GATAD2B, TIAM1, OCA2, ASCC3, GABRA1
HP:0012447	Abnormal myelination	38	0.010491441192711209	3.1316191710881167	2.2085369384181766e-12	2.2273744593635081e-10	9.652206764571511	2.271921948550778e-08	SCN3A, CYFIP2, C2CD3, PGAP1, NECAP1, SCN1A, CACNA2D1, FGF12, HCN1, SYNGAP1, ZFR, CNKSR2, YWHAG, LAMB1, OSTM1, SYNJ1, CELF2, GABRB2, PPP3CA, CACNA1A, WWOX, CDK19, TFG, SCN8A, ATP1A3, KCNB1, RAB3GAP2, GABRA5, GABRG2, NTRK2, CLTC, ATP6V1A, CACNA1B, DNM1, FOXG1, SLC1A2, NGLY1, GABRA2
HP:0011167	Focal tonic seizure	20	0.005521811154058531	3.073708716999717	5.556209240960454e-07	2.54029886496712e-05	4.595115185832594	0.005715672446176019	KCNQ3, PRRT2, KCNT1, GRM7, PURA, MTOR, DMXL2, AKT3, CASK, CACNA1A, WWOX, PIK3CA, GNAO1, SCN8A, CLCN4, SCN2A, GRIA3, CDKL5, SLC1A2, NGLY1
HP:0010819	Atonic seizure	51	0.014080618442849255	3.020879348426284	2.853920861990498e-15	3.967335663148142e-13	12.401501053751712	2.9358283907296254e-11	GABRB3, PRRT2, ST3GAL3, RPS6KA3, IQSEC2, DYRK1A, SCN1A, CHD2, HCN1, CNTNAP2, HNRNPU, GRM7, ATP6V0C, MAPK10, SYNGAP1, ATP6AP2, MTOR, CAMK2B, FRRS1L, CTNNA2, DMXL2, SPTAN1, STXBP1, RUSC2, DOCK7, AKT3, ACBD6, CEP85L, CASK, CACNA1A, MAST3, PIK3CA, ALG13, GNAO1, PAFAH1B1, FGF13, KCNB1, SCN2A, CSNK2A1, GRIK2, GNB1, GABRG2, SCN9A, NEXMIF, CDKL5, AP2M1, GOSR2, DNM1, ARFGEF1, NGLY1, GABRA1
HP:0011097	Epileptic spasm	39	0.010767531750414136	2.9968659990747235	7.204539193677471e-12	6.799366484895426e-10	9.167531549783634	7.411309468536015e-08	SETBP1, TBL1XR1, ST3GAL3, KCNT1, NCDN, SCN1A, CHD2, PURA, EIF4A2, SYNGAP1, MFF, MTOR, TSC1, SMARCA2, STXBP1, GAD1, AKT3, SYNJ1, GABRA3, CELF2, CASK, PPP3CA, WWOX, PIK3CA, SCN8A, ATP1A3, GRIN2B, COX4I1, SCN2A, GRIK2, NEXMIF, CACNA1B, AP2M1, NSF, SLC12A5, DNM1, SLC1A2, PHACTR1, ATP6V0A1
HP:0009928	Thick nasal alae	20	0.005521811154058531	2.992821645499724	9.790006028955261e-07	4.267364068638253e-05	4.36984030388178	0.010070979201986277	RAD21, RPS6KA3, PIK3C2A, SCN1A, KANSL1, CHD2, ARID2, SYNGAP1, NF1, SMARCA2, ARID1A, ANKRD17, KCNH1, ABCA5, NEXMIF, ARID1B, ZSWIM6, AP2M1, EXT1, TRPS1
HP:0012547	Abnormal involuntary eye movements	35	0.00966316951960243	2.970487155607935	1.1804233423925282e-10	9.413189862939487e-09	8.026263181554684	1.2143014923191936e-06	SCN3A, CYFIP2, NECAP1, SCN1A, CACNA2D1, FGF12, HCN1, TBCK, SYNGAP1, CNKSR2, KIF21A, YWHAG, SYNJ1, CELF2, GABRB2, PPP3CA, CACNA1A, WWOX, CDK19, HTT, SCN8A, ATP1A3, TUBA1A, KCNB1, SCN2A, GABRA5, GABRG2, NTRK2, CLTC, ATP6V1A, CACNA1B, DNM1, FOXG1, SLC1A2, GABRA2
HP:0002384	Focal impaired awareness seizure	65	0.017945886250690227	2.956907785753727	1.963445435257772e-18	4.390861563586239e-16	15.357450255247777	2.0197963192496698e-14	SCN3A, KCNQ3, PRRT2, RERE, KCNT1, CACNA1D, SCN1A, FIG4, HCN1, CNTNAP2, OPHN1, ATP6V0C, ITPR1, MTOR, CAMK2B, FRRS1L, FBXL4, ATP6V1B2, TSC1, RELN, SPTAN1, ARHGEF9, FMN2, STRADA, STXBP1, DOCK7, GABRA3, CEP85L, GNAI1, CACNA1A, CRIPT, MAST3, HTT, GNAO1, KDM6A, SCN8A, VPS35L, ATP1A3, FGF13, PAFAH1B1, DEPDC5, KCNB1, GRIN2B, NSD1, CLCN4, SCN2A, GRIK2, GNB1, CNOT1, GABRG2, POGZ, SCN9A, AGO1, SUPT16H, CDH2, PNPLA8, AP2M1, SLC12A5, MACF1, KCNQ5, DNM1, GABRA1, DNM1L, ATXN10, ATP6V0A1
HP:0200134	Epileptic encephalopathy	67	0.01849806736609608	2.9533813602489523	6.397496566745065e-19	1.6051474922464997e-16	15.794485055392585	6.5811047182106484e-15	GABRB3, CYFIP2, SCN3A, MDH1, ST3GAL3, NECAP1, KCNT1, CRLS1, SCN1A, CHD2, FGF12, HNRNPU, HCN1, GRM7, NRXN1, HNRNPR, CACNA1E, SYNGAP1, SLC25A12, CHKA, FRRS1L, DMXL2, SPTAN1, GUF1, ARHGEF9, STXBP1, ALG9, DOCK7, SYNJ1, NAPB, ABAT, CELF2, GABRB2, PPP3CA, CACNA1A, WWOX, ADAM22, MAST3, CASK, DENND5A, GNAO1, SCN8A, RNF13, PAFAH1B1, KCNB1, GRIN2B, CLCN4, SCN2A, GABRG2, NTRK2, NEXMIF, CDKL5, ATP6V1A, CACNA1B, AP2M1, NSF, SLC9A6, KCNQ5, DNM1, STAG1, DNM1L, SLC1A2, GLS, GABRB1, KMT2E, PHACTR1, GABRA1
HP:0002263	Exaggerated cupid's bow	21	0.005797901711761457	2.912526430620463	9.478010769839507e-07	4.148948799546341e-05	4.382061924585753	0.0097500296789339	DNMT3A, CLCN3, CHD8, HNRNPU, TBCK, RALA, JARID2, SMARCA2, HNRNPK, ZNF462, KMT2A, CACNA1A, TRIP12, MED27, NRCAM, ATP1A3, B3GLCT, SCN2A, EXOC2, POGZ, SUPT16H
HP:0002539	Cortical dysplasia	23	0.006350082827167311	2.9063623535186207	3.033614683073728e-07	1.4514788020827647e-05	4.838189302378438	0.003120679424477944	KIF5C, YY1, VPS37A, B4GAT1, KIF2A, PRRT2, SCN1A, FIG4, HCN1, FRYL, SLC12A2, CUL4B, MTOR, TSC1, HSD17B4, TUBB, FGF13, SCN2A, GABRG2, SCN9A, DDX3X, NEDD4L, ATP6V0A1
HP:0010841	Multifocal epileptiform discharges	28	0.007730535615681944	2.8948747552833693	1.7780261024624206e-08	1.0759149715312306e-06	5.9682220491658375	0.0001829055451603092	KCNT1, SCN1A, CHD2, FGF12, SPTBN1, TBCK, ADK, SPTAN1, STXBP1, DOCK7, PPP3CA, MECP2, GNAO1, LRPPRC, SCN8A, ATP1A3, MED13L, DEPDC5, SCN2A, GNB1, GABRG2, SCN9A, CDKL5, SLC12A5, ARFGEF1, KCNMA1, DPYD, GABRA1
HP:0012760	Reduced social responsiveness	34	0.009387078961899503	2.8019750478156835	1.6334311297232453e-09	1.1508976733878783e-07	6.938963287889338	1.6803106031463023e-05	CHD8, IQSEC2, CREBBP, SCN1A, MBD5, CHD2, CNTNAP2, SPTBN1, OPHN1, SYNGAP1, NF1, DNAJC6, SNRPN, HERC1, SYNJ1, PRKN, LRRK2, ADNP, MECP2, EP300, UCHL1, GRIK2, VPS13C, POGZ, NEXMIF, TTC19, ZMYND11, NLGN1, SNCA, AP2M1, CLTC, CDKL5, GTF2E2, FOXG1
HP:0002373	Febrile seizure (within the age range of 3 months to 6 years)	60	0.016565433462175594	2.796571045794824	1.191748782467302e-15	1.776741989165382e-13	12.750375633993942	1.2259519725241136e-11	GABRB3, SETBP1, RFX7, EFHC1, DNMT3A, PRRT2, CHD8, GLS, KCNQ3, KMT5B, DYRK1A, WDR26, MBD5, SCN1A, CHD2, HCN1, ASXL2, SPTBN1, GRM7, HNRNPR, KCTD7, ATP6V0C, CACNB4, MBOAT7, SLC25A12, AMFR, WDR11, DMXL2, CNKSR2, RPL10, SPTAN1, RSRC1, AP4S1, HS6ST2, APP, GABRA3, CEP85L, CASK, SLC44A1, AUH, CAMK2A, GNAO1, SCN8A, FGF13, SCN2A, GNB1, GABRG2, POGZ, SCN9A, AGO1, CDKL5, ATP6V1A, SLC12A5, HERC2, SLC13A3, ACADM, OTUD7A, GRIA2, DPYD, GABRA1
HP:0002073	Progressive cerebellar ataxia	30	0.008282716731087797	2.75146506118523	2.519196751593951e-08	1.4724418740708506e-06	5.831961840356507	0.0002591497698364697	ZFHX3, ANO10, KCND3, TTBK2, WFS1, PNPT1, TARDBP, ATXN3, PRNP, FUS, ATXN2, ATXN7, CACNA1A, AUH, SLC44A1, HTT, EEF2, VPS13D, ELOVL4, SACS, CLCN4, PRKCG, PPP2R2B, VPS41, PDYN, ATM, ATXN1, ATXN10, GLS, KCTD7
HP:0000752	Hyperactivity	103	0.028437327443401435	2.7497427043394174	4.1197929393361843e-25	2.0181099984262536e-22	21.695055165944698	4.238030996695133e-21	MANBA, DYRK1A, GRM7, OPHN1, ATP1A1, CUL4B, MTOR, CHKA, GLRA2, HGSNAT, STXBP1, KMT2A, RUSC2, UBE3A, GRIA1, PPP2R1A, HIVEP2, PDE4D, OCA2, FRMPD4, GABRB3, SETBP1, TRAPPC9, MBD5, ARID2, CAMTA1, DMXL2, STAG2, CACNA1A, ADNP, MECP2, GNAO1, EP300, PANK2, FOXP2, SPRED1, NEXMIF, PAK3, CDKL5, AP2M1, UBE3C, ALDH5A1, ATP9A, MICU1, RAC1, ATP6V0A1, AUTS2, CLCN3, YME1L1, DYM, SCN1A, CHD2, KANSL1, CNTNAP2, SMAD4, ANK3, CNKSR2, TSC1, ARID1A, SHOC2, DPP6, TRIP12, DENND5A, CLCN4, ATR, ASH1L, KRAS, BBS2, DNM1, MID2, DPYD, VPS13A, FLCN, SLC4A10, CREBBP, BSCL2, SLC25A13, SPTBN1, IL1RAPL1, THRB, MAPK10, SYNGAP1, CUL3, HUWE1, SNRPN, CASK, AP1G1, LNPK, ATRX, FBXO11, HTT, TCF20, MED13L, NBN, SCN2A, POGZ, AGO1, ARID1B, ZSWIM6, GATAD2B, DDX3X, HERC2, PDCD6IP
HP:0011153	Focal motor seizure	26	0.00717835450027609	2.7378775794015993	2.4155504652247833e-07	1.172111680932422e-05	4.931031005978412	0.0024848767635767344	KCNQ3, PRRT2, KCNT1, SCN1A, GRM7, BTD, MTOR, FRRS1L, DMXL2, YWHAG, STXBP1, AKT3, FAR1, CASK, CACNA1A, PPP3CA, PIK3CA, SLC35A3, GNAO1, SCN8A, PAFAH1B1, ATP1A3, SCN2A, CDKL5, ATXN10, DPYD
HP:0007334	Bilateral tonic-clonic seizure with focal onset	26	0.00717835450027609	2.7378775794015993	2.4155504652247833e-07	1.172111680932422e-05	4.931031005978412	0.0024848767635767344	KCNQ3, PRRT2, PSAP, KCNT1, SCN1A, FIG4, CNTNAP2, TBCK, ATP6V0C, RELN, STXBP1, CEP85L, MTFMT, WWOX, ADAM22, MAST3, KDM6A, SCN8A, DEPDC5, KCNB1, SCN2A, GABRG2, SLC12A5, PPP2CA, KCNMA1, KCTD7
HP:0045025	Narrow palpebral fissure	35	0.00966316951960243	2.7263375263798855	2.401027378507635e-09	1.6357197776627841e-07	6.786291095187043	2.469936864270804e-05	DNMT3A, RFX7, TBL1XR1, GPC6, CDC42BPB, DGCR2, DDX6, DHX9, EDEM3, ARID2, MAPKAPK5, SMAD4, RBMX, SMARCA2, MAPK8IP3, RPL10, ZMYM2, UBAP2L, SPEN, SPOP, KMT2A, GABRA3, ADNP, TRIP12, PIK3CA, FBXO11, WDR35, B3GLCT, PDE4D, KCTD1, TENM3, SLC6A17, GATAD2B, FRA10AC1, MED13
HP:0000729	Autistic behavior	210	0.05797901711761458	2.7077910125949884	1.0035276402525565e-48	3.441096278426016e-45	44.46330317608462	1.0323288835278049e-44	PRKAR1B, PDZD8, CDC42BPB, SYT1, DYRK1A, THOC2, WDR26, GABBR1, GRM7, MEIS2, VAMP2, DPYSL5, OPHN1, ATP1A1, POLR2A, SLC12A2, WFS1, RALA, MBOAT7, MTOR, CHKA, NIPBL, KDM5A, KDM3B, UBAP2L, RSRC1, STXBP1, ALMS1, WAC, EXT2, HEXB, GNAI1, UBE3A, ANKRD17, DLG4, KDM6A, GRIA1, DEPDC5, UBE4A, HIVEP2, PDE4D, GRIK2, SRRM2, CDH2, MARK2, ATG7, FRA10AC1, PPP2CA, TLK2, MED13, OCA2, FRMPD4, SPATA7, NBEA, GABRA1, MAP1B, ACSL4, GABRB3, RFX7, TBL1XR1, SETBP1, PSMD12, NAA15, MBD5, HECW2, ARID2, USP9X, ZFPM2, CAMTA1, NF1, DMXL2, GNAQ, MAPK8IP3, ZMYM2, CC2D2A, FOXP1, SLF2, SETD2, STAG2, CTNNB1, CELF2, CEP85L, CACNA1A, ADNP, MECP2, GNAO1, EP300, SCN8A, PTEN, RORA, FOXP2, TTC5, NEXMIF, SUPT16H, CDKL5, AP2M1, CHD1, UBE3C, STAG1, ATP2B1, ATP9A, RAC1, CDH11, ATP6V0A1, MAX, CLCN3, AUTS2, RERE, IQSEC2, KMT5B, PCYT1A, SCN1A, CHD2, KANSL1, CNTNAP2, HCN1, NDN, ZBTB7A, USP45, JARID2, KAT6A, CTNNA2, ATP6V1B2, ANK3, CEP290, ZNF462, TSC1, SMARCA2, SPTAN1, ARID1A, TAF1, VPS13B, ZNF292, ACBD6, TRIP12, RLIM, SETD5, ATP1A3, SNX14, TNRC6B, SON, CLCN4, KMT2C, TCF12, SPECC1L, GABRG2, NLGN1, ASH1L, TIAM1, RIMS2, DNM1, PHF21A, RPGRIP1L, GRIA2, DPYD, PHACTR1, YY1, PRRT2, CREBBP, SYN1, SPTBN1, NLGN4X, TRRAP, CDK8, MAPK10, SYNGAP1, CAMK2B, AP1S2, TAOK1, TMTC3, FRRS1L, CUL3, SPEN, SNRPN, MADD, IQCB1, COG5, AGO2, BCL11B, CASK, DHX30, AP1G1, UBA2, SLC35A3, FBXO11, TRIO, TCF20, MCTP2, FGF13, MED13L, TOGARAM1, NSD1, SCN2A, NTRK2, GRIA3, SCN9A, AGO1, ZSWIM6, MED12L, POGZ, CAPRIN1, GATAD2B, DDX3X, SBF2, PRORP, ARID1B, HERC2, TANC2, FBXW11, GABRA2
HP:0100660	Dyskinesia	87	0.024019878520154612	2.7033520109349967	8.384366825136673e-21	2.7822574687155146e-18	17.55560268309002	8.624998153018096e-17	CYFIP2, PGAP1, SYT1, GRM7, XPR1, ADCY5, VPS35, PNPT1, CHKA, YWHAG, STXBP1, SYNJ1, LRRK2, PPP3CA, MT-ND1, BCAS3, BMPR1A, IREB2, ATG7, FOXG1, ATXN10, GABRB3, SIL1, HECW2, FGF12, MT-ATP6, PURA, DMXL2, DNAJC6, CELF2, NDUFS4, CACNA1A, SLC20A2, CDK19, GNAO1, SCN8A, GRIN2B, GABRA5, CDKL5, ATP6V1A, SLC1A2, SLC16A2, NECAP1, SCN1A, HCN1, RPS20, SLC30A9, MT-ND3, ITPR1, MSH2, MT-ND2, CNKSR2, PRKN, GABRB2, PIK3CA, LRPPRC, ATP1A3, KCNB1, GABRG2, VPS13C, SNCA, CACNA1B, KRAS, DNM1, GIGYF2, SCN3A, PRRT2, CACNA2D1, PMS1, SYNGAP1, FTL, CAMK2B, STX16, MT-ND5, NPAT, CASK, WWOX, MT-ND4, UCHL1, SCN2A, NTRK2, CLTC, ATM, DDX3X, FASTKD2, GABRA2, UNC80
HP:0000448	Prominent nose	53	0.014632799558255107	2.6670543336444443	6.141167023675166e-13	6.580644288806919e-11	10.181731583988556	6.3174185172546425e-09	PSMD12, PMM2, ACTB, CREBBP, LMBR1, MBD5, USP9X, PGM2L1, PUM1, OPHN1, FBXL3, ITPR1, CUL4B, COG3, AP1S2, PEX3, FILIP1, KAT6B, SMC5, AP4S1, SLF2, SNRPN, SPOP, RUSC2, COG5, STAG2, BCL11B, INTU, CDK19, FBXO11, CEP120, RLIM, EP300, EXTL3, SETD5, ACTG1, DENND5A, NBN, HNRNPC, FOXP2, TTC5, ACER3, PDE4D, MARK2, ATR, ASH1L, STIM1, ASPH, FHL1, DYNC1I2, BPTF, SPART, UNC80
HP:0010818	Generalized tonic seizure	30	0.008282716731087797	2.6654817780231914	6.268925669046408e-08	3.3763580291874557e-06	5.471551506994222	0.0006448843835748041	GABRB3, KCNQ3, PRRT2, NECAP1, KCNT1, SCN1A, CHD2, GRM7, MAPK10, CACNB4, DMXL2, RPL10, ARHGEF9, STXBP1, DOCK7, VPS50, CASK, CACNA1A, GNAO1, SCN8A, PAFAH1B1, TUBA1A, SCN2A, GNB1, GABRG2, SCN9A, CDKL5, DNM1, SLC1A2, GABRA1
HP:0002121	Generalized non-motor (absence) seizure	64	0.0176697956929873	2.65640227804939	3.216678164006703e-15	4.35394319383381e-13	12.361117241524932	3.308996827313695e-11	NBEA, GABRB3, EFHC1, RFX7, KCNQ3, PRRT2, PGAP1, WDR26, SCN1A, CHD2, CACNA2D1, HCN1, GRM7, ATP6V0C, EIF4A2, SYNGAP1, CACNB4, DMXL2, SMARCA2, YWHAG, SPTAN1, GDI1, DOCK7, GABRA3, CEP85L, FAR1, GNAI1, CASK, WWOX, DHFR, MECP2, MAST3, SLC35A3, CAMK2A, GNAO1, SCN8A, SETD5, ATP1A3, FGF13, TUBA1A, SON, NSD1, CLCN4, SCN2A, GNB1, GABRG2, NTRK2, SCN9A, NEXMIF, PAK3, CDKL5, AP2M1, GATAD2B, SLC12A5, CAPRIN1, GOSR2, ALDH5A1, PPP2CA, CDK13, KCNMA1, NGLY1, NEDD4L, NUBPL, GABRA1
HP:0001338	Partial agenesis of the corpus callosum	28	0.007730535615681944	2.6536351923430885	1.928179603364365e-07	9.536145951831358e-06	5.020627110625031	0.0019835183579809223	CRPPA, CLCN3, C2CD3, MDH1, ROBO1, TBCK, KDM5B, TMEM260, CDC40, PDHX, OSTM1, ACBD6, TUBB, LRPPRC, KIDINS220, TUBA1A, FRMD4A, NSD1, TCF12, HECTD4, SUPT16H, PLCH1, TNR, ARID1B, DDX3X, GTF2E2, FRA10AC1, DHCR24
HP:0025336	Delayed ability to sit	40	0.011043622308117063	2.6448191285811515	5.590594664914202e-10	4.167423718693652e-08	7.380132340834957	5.7510447317972395e-06	WASF1, PGAP1, SLC9A7, WDR26, MBD5, VRK1, FTH1, SIK3, POLR2A, ADCY5, OPHN1, DPYSL5, ITPR1, NGLY1, KAT6A, RBL2, CUL3, ALMS1, CTNNB1, CELF2, CASK, GNAI1, MECP2, TRIO, EXTL3, PAFAH1B1, VPS35L, SNX14, HIVEP2, SON, TTC5, RAB3GAP2, GRIN2B, GRIK2, NEXMIF, MACF1, CDK13, FOXG1, HK1, OTUD7A
HP:0001182	Tapered finger	69	0.019050248481501934	2.6332813270135156	4.748382696956612e-16	8.14110213393211e-14	13.089316796795817	4.884661280359266e-12	WASF1, ACSL4, MAP1B, PRKAR1B, SLC4A10, CDC42BPB, TRAPPC9, RPS6KA3, DDX6, DYRK1A, RETREG1, FIG4, USP9X, PUM1, TBCK, DPYSL5, DOCK3, SLC25A12, SMARCA2, CCDC88A, HUWE1, RPL10, PIGN, SPEN, ZMYM2, VPS13B, SMARCAD1, KMT2A, SPOP, RUSC2, DSE, SLC25A46, KIF1A, ACBD6, ASXL1, GNAI1, ADNP, RUNX2, MAPRE2, DHX30, ATRX, FBXO11, TRIO, MAPK1, TCF20, SETD5, RNF13, HIVEP2, SLC12A6, COPB1, KMT2C, WNK1, GNB1, CNOT1, CDC42, HDAC8, HECTD4, SCN9A, SUPT16H, CDKL5, AMMECR1, CHD4, ADAMTSL1, PHF21A, EXOC6B, UNC80, KMT2E, PHIP, KDM1A
HP:0001273	Abnormal corpus callosum morphology	49	0.013528437327443401	2.6286008980757005	8.825155989546084e-12	8.034015899509785e-10	9.095067313124321	9.078437966446057e-08	SCN3A, CYFIP2, NECAP1, KCNT1, CREBBP, SCN1A, CACNA2D1, FGF12, HCN1, SYNGAP1, PNPT1, CSPP1, MTOR, CNKSR2, YWHAG, ARID1A, PDHX, KMT2A, SYNJ1, ABAT, CELF2, GABRB2, PPP3CA, CACNA1A, WWOX, CDK19, EP300, SCN8A, PAFAH1B1, ATP1A3, TUBA1A, KCNB1, SCN2A, GABRA5, CDON, GABRG2, NTRK2, CLTC, ATP6V1A, CACNA1B, DDX3X, SLC12A5, DNM1, FOXG1, RPGRIP1L, SLC1A2, GABRA2, KMT2E, KIAA0586
HP:0000219	Thin upper lip vermilion	151	0.04168967421314191	2.6258120186356906	2.392330623471671e-33	2.23726410215028e-30	29.65028274574853	2.460990512365308e-29	PRKAR1B, CDC42BPB, SYT1, ACTB, DYRK1A, WDR26, SEL1L, MEIS2, OPHN1, RALA, MTOR, NIPBL, KDM3B, PIGN, UBAP2L, KMT2A, GAD1, SEC23A, WAC, GNAI1, ANKRD17, CIT, KDM6A, MAPK1, CEP295, HIVEP2, PDE4D, SRRM2, CDH2, AMMECR1, WASHC4, TLK2, MED13, OCA2, KCNMA1, FOXG1, BPTF, NALCN, SETBP1, RFX7, TBL1XR1, ADARB1, TRAPPC9, PSMD12, OGT, MBD5, FIG4, TPR, ARID2, USP9X, PURA, TASP1, MAPK8IP3, TRAPPC10, PIGK, ALG9, STAG2, CTNNB1, ADNP, MAPRE2, IGF1R, EP300, ACTG1, TTC5, OCRL, EXOC2, NEXMIF, SMC3, PAK3, AP2M1, HK1, ATP9A, EXT1, ASCC3, CDH11, CLCN3, AFF4, PMM2, SCN1A, DHX9, LMBRD1, CHD2, CNTNAP2, EDEM3, ASXL2, NDN, SMAD4, KAT6A, FBN1, ATP6V1B2, SMARCA2, TAF1, KAT6B, ARID1A, DSE, ZNF292, ACBD6, TRIP12, ANKRD11, AGL, SETD5, VPS35L, HNRNPC, TNRC6B, CNOT2, CDC42, SPECC1L, CDK13, CDK6, RAD21, SLC9A7, CREBBP, SPTBN1, PGM2L1, TRRAP, SYNGAP1, ZNF407, HUWE1, RPL10, SPEN, SNRPN, AGO2, BCL11B, FAR1, PBX1, PRKDC, ATRX, FBXO11, AP3B1, TRIO, TCF20, MCTP2, WDR19, B3GLCT, CSNK2A1, HDAC8, ANKLE2, AGO1, POGZ, MED12L, CLTC, ARID1B, CAPRIN1, HS2ST1, GATAD2B, HERC2, PPP1CB, PDCD6IP, UNC80, KDM1A, TRPS1
HP:0000455	Broad nasal tip	75	0.020706791827719492	2.600470027339699	6.092041025718559e-17	1.1259382630346649e-14	13.94848542188115	6.266882603156682e-13	PRKAR1B, SETBP1, RFX7, TBL1XR1, YY1, CDC42BPB, RPS6KA3, ACTB, DYRK1A, WDR26, APC, RARB, CDH11, TPR, ARID2, ASXL2, CPLANE1, ATP6V1E1, PURA, KAT6A, NIPBL, KDM5A, KDM3B, ATP6V1B2, TAF1, COG6, HUWE1, HNRNPK, ZMYM2, ARID1A, FOXP1, SNRPN, KMT2A, DOCK7, SETD2, CTNNB1, WAC, EXT2, CASK, ADNP, PRKAR1A, IGF1R, FBXO11, ZBTB20, KDM6A, TBC1D32, MCTP2, EXTL3, KCNH1, KCNN3, AGL, SMC3, RAB3GAP2, NSD1, XRCC4, HDAC8, POGZ, SUPT16H, ARID1B, ZSWIM6, RAB3GAP1, ATP6V1A, CAPRIN1, HS2ST1, GATAD2B, PHIP, WASHC4, MAP3K7, PPP2CA, TLK2, PHF21A, BPTF, NEK1, DPYD, GLB1
HP:0025269	Panic attack	25	0.006902263942573164	2.5847096029315795	1.5914076202751619e-06	6.681963342763506e-05	4.175095911229944	0.01637081018977059	DNMT3A, CREBBP, USP48, NR3C1, NF1, DNAJC6, SYNJ1, PRKN, CTNNB1, LRRK2, PRKAR1A, MECP2, ATRX, EP300, UCHL1, SDHC, SPECC1L, VPS13C, BRAF, CDKL5, SNCA, SGCE, KIF1B, SPART, MAX
HP:0100716	Self-injurious behavior	69	0.019050248481501934	2.581308669243512	1.6923543393630735e-15	2.4870355841468483e-13	12.60431800086273	1.7409249089027938e-11	WASF1, SETBP1, KIF5C, RFX7, CLCN3, CDC42BPB, CHD8, RERE, SYT1, IQSEC2, RPS6KA3, CREBBP, MBD5, HECW2, GRM7, VAMP2, NDN, TAOK1, AP1S2, NIPBL, DMXL2, TSC1, CHKA, RBL2, RPL10, UBAP2L, SPEN, FOXP1, LUZP1, SPOP, SNRPN, CTNNB1, ACBD6, WAC, CRBN, ELP2, HPRT1, CASK, AP1G1, ATRX, TRIO, NRCAM, ZBTB20, GRIA1, EP300, RLIM, GNAO1, CLCN4, SCN2A, KMT2C, OCRL, UBE4B, GRIA3, POGZ, CDH2, CDKL5, WASHC4, VPS13A, ALDH5A1, PPP2CA, HERC2, DNM1, OCA2, GLS, FBXW11, GRIA2, KMT2E, DPYD, ATP6V0A1
HP:0000574	Thick eyebrow	71	0.019602429596907785	2.5715391081395715	8.469704070891037e-16	1.281291849665531e-13	12.892351936404472	8.712784577725609e-12	AUTS2, RAD21, CLCN3, DNMT3A, TBL1XR1, AFF4, PSMD12, RPS6KA3, NBAS, DYM, PPP1R21, CREBBP, MBD5, HECW2, ARID2, SPTBN1, TBCK, TASP1, JARID2, SMAD4, NIPBL, FBXL4, ATP6V1B2, MAPK8IP3, TAF1, SMARCA2, SPEN, ARID1A, VPS13B, KMT2A, TRPS1, RUSC2, DOCK7, WAC, ANKRD11, NRCAM, BCAS3, IGF1R, TRIO, KCNH1, EP300, DENND5A, KCNN3, DEPDC5, RALGAPA1, SUMF1, FRMD4A, ACER3, KMT2C, CNOT2, SPECC1L, ABCA5, HDAC8, CDON, ARID1B, ZSWIM6, SLC6A17, SMC3, LEMD3, MAP3K7, SLC9A6, CHD1, CDK13, BRD4, FHL1, BPTF, PDCD6IP, EXT1, ASCC3, PHIP, CDH11
HP:0002572	Episodic vomiting	28	0.007730535615681944	2.568034057106215	4.506435497328633e-07	2.097633572896817e-05	4.678270374658974	0.0046357701961019645	KRIT1, MT-CYB, CDC42BPB, MT-ATP6, SEL1L, MT-ND3, CDK8, CCM2, MT-ND2, HNRNPK, MT-ND5, ADNP, MT-ND1, MT-ND4, UQCRC2, PIK3CA, MT-CO2, FGF13, PDCD10, NSD1, APTX, MARK2, NEXMIF, POGZ, MT-CO3, MT-CO1, CDK13, NDUFS1
HP:0000194	Open mouth	55	0.015184980673660961	2.5635234586452555	1.699154154703699e-12	1.7479198789436954e-10	9.757478478412208	1.747919878943695e-08	SETBP1, PDZD8, CHD8, RPS6KA3, DGCR2, IQSEC2, OGT, REV3L, MBD5, KANSL1, IL1RAPL1, TBCK, PURA, DST, MTOR, AP1S2, TUBB4A, ATP6V1B2, HNRNPK, CCDC88A, DIS3L2, PIGN, VPS13B, STRADA, FOXP1, DPYD, AGO2, DHX30, ADAM22, PRKAR1A, ATRX, BCAS3, KCNH1, TCF20, DENND5A, EXTL3, PPP2R1A, AHI1, MED13L, PDE4D, OCRL, GRIA3, BRAF, NEXMIF, ZSWIM6, ANKLE2, CLTC, POGZ, ASH1L, MED12L, SLC9A6, PAK3, NGLY1, UNC80, RAC1
HP:0002078	Truncal ataxia	36	0.009939260077305357	2.558862506902264	1.2024777738354334e-08	7.363029083003038e-07	6.132943484113439	0.00012369888859445103	ANO10, KCND3, TTBK2, SYT14, ITPR1, FGF14, CACNB4, TPK1, COX10, ATXN3, PRNP, ATP8A2, CYP7B1, ATCAY, EIF2AK2, ATG5, COG5, DAB1, CACNA1A, MECP2, CEP120, OPA1, LRPPRC, EEF2, ATP1A3, VPS13D, HIBCH, APTX, VPS41, TRAPPC11, AP2M1, SLC9A6, GRID2, FASTKD2, ATXN1, KCTD7
HP:0012469	Infantile spasms	70	0.01932633903920486	2.551572300329893	2.2145113299610124e-15	3.1206408289464293e-13	12.505756213706634	2.2780678051308936e-11	GABRB3, SUCLA2, PRRT2, CNTNAP2, SPTBN1, SEL1L, MT-ND3, GRM7, MT-ATP6, ATP6V0C, EIF4A2, NGLY1, BTD, ATAD1, CTNNA2, FBXL4, MT-ND2, CDC40, CUL3, MT-ND5, DMXL2, SPTAN1, TSC1, GUF1, GNAQ, STRADA, STXBP1, RUSC2, DOCK7, ACBD6, CEP85L, CASK, MT-ND1, CDK19, MT-ND4, MECP2, ALG13, MAPK1, GNAO1, RNF13, PAFAH1B1, DEPDC5, TUBA1A, TSEN2, RALGAPA1, KCNB1, GRIN2B, CLCN4, SCN2A, VPS53, GNB1, GABRG2, NTRK2, HIBCH, NEXMIF, CDH2, CDKL5, ATP6V1A, CAPRIN1, MACF1, PI4KA, KCNQ5, ARFGEF1, ERCC5, ATP2B1, DNM1, HK1, OTUD7A, NEDD4L, PHACTR1
HP:0000319	Smooth philtrum	87	0.024019878520154612	2.5500691649541465	9.500820542522573e-19	2.221248657293857e-16	15.653402821710017	9.77349409209297e-15	CDC42BPB, SYT1, DYRK1A, MEIS2, ATP6V1E1, WDR37, MTOR, NIPBL, KDM5A, DIS3L2, PIGN, GAD1, SEC23A, ANKRD17, MAPK1, KDM6A, CEP295, ACER3, SRRM2, CDH2, ATG7, FRA10AC1, MED13, FOXG1, NALCN, TBL1XR1, TRAPPC9, TPR, USP9X, TASP1, ORC4, SPOP, ALG9, STAG2, CTNNB1, ADNP, IGF1R, EP300, EXOC2, SMC3, ATP6V1A, CERT1, ATP9A, RERE, DYM, DHX9, CNTNAP2, JARID2, FBN1, SMARCA2, ZNF292, TRIP12, ANKRD11, PIK3CA, WDR35, SETD5, HNRNPC, SON, CDC42, ASH1L, BBS2, CDK13, RAD21, CHD8, FLCN, ZNF148, DDX6, CREBBP, HNRNPU, SPTBN1, PGM2L1, TRRAP, KDM5B, FBXL4, RPL10, CASK, FAR1, DHX30, FBXO11, AP3B1, WDR19, SUMF1, ZC4H2, PPP1CB, ABL1, UNC80, TRPS1
