HP:0002509	Limb hypertonia	52	0.01435670900055218	2.27454445057979	1.7197968204920113e-09	1.195374992729819e-07	6.92249583385707	1.769154989240132e-05	SCN3A, CYFIP2, CDC42BPB, NECAP1, DYRK1A, SCN1A, CACNA2D1, FGF12, ASXL2, HCN1, GRM7, SLC30A9, ADCY5, GPHN, WDR48, SYNGAP1, CNKSR2, DNAJC6, YWHAG, OSTM1, SYNJ1, CELF2, GABRB2, PPP3CA, CACNA1A, WWOX, CDK19, NDUFA9, SCN8A, KIDINS220, ATP1A3, FGF13, KCNB1, TSEN2, ELOVL4, FRMD4A, GRIK2, GABRA5, GNB1, GABRG2, NTRK2, CLTC, ATP6V1A, CACNA1B, PI4KA, DNM1, FOXG1, HK1, SLC1A2, PCCA, GABRA2, SLC16A2
HP:0100704	Cerebral visual impairment	69	0.019050248481501934	2.2679706226879413	5.441089140470557e-12	5.280423017737794e-10	9.277331284490744	5.597248398802062e-08	SCN3A, PGAP1, ARHGDIA, MT-CYB, ADARB1, RERE, PSMD12, CACNA1D, SCN1A, CACNA2D1, FGF12, HECW2, FTH1, GRM7, CCDC47, TBCK, VAMP2, PUM1, EIF4A2, ITPR1, CACNA1E, FBXW7, KAT6A, CHKA, MAPK8IP3, MT-ND5, CC2D2A, SNRPN, KIF1A, SELENOI, DOCK7, COG5, STAG2, CEP85L, GABRB2, PPP3CA, KIF5A, MT-ND1, ADNP, DIAPH1, MT-CO2, RNF13, PPP2R1A, TSEN2, RALGAPA1, SON, SV2A, CLCN4, RAB18, RAB3GAP2, GRIK2, GNB1, CDON, POGZ, BRAF, NEDD4L, PLCH1, NARS2, MT-CO3, CACNA1B, AMPD2, RAB3GAP1, CDKL5, MACF1, MT-CO1, HK1, CERT1, GABRA2, GABRB1
HP:0001266	Choreoathetosis	53	0.014632799558255107	2.265993531592648	1.3287118548695651e-09	9.558362832897355e-08	7.0196164877999125	1.3668458851043216e-05	PRRT2, SYT1, SCN1A, MT-ATP6, GRM7, SLC30A9, XPR1, ADCY5, PNPT1, FTL, MED23, QDPR, AP1S2, TUBB4A, FBXL4, DMXL2, ADAR, HSPD1, FRRS1L, CHKA, PIGN, GUF1, SETX, EIF2AK2, STXBP1, ABAT, TMEM106B, CASK, ELP2, HPRT1, SLC20A2, MECP2, CACNA1A, NDUFA9, GNAO1, SCN8A, ATP1A3, PANK2, TSEN2, SUCLG1, MRE11, SCN2A, GRIK2, GABRG2, TNR, ATM, CACNA1B, CDKL5, IREB2, ATG7, NGLY1, MICU1, SLC16A2
HP:0002230	Generalized hirsutism	35	0.00966316951960243	2.2616209025651326	8.057448727531923e-07	3.57271444224659e-05	4.447001694436402	0.00828869750601209	BBS9, RAD21, SUCLA2, RERE, MBD5, BSCL2, PPARG, ARL6, SDCCAG8, SLC25A12, NIPBL, CEP290, SPEN, BBS7, LUZP1, KMT2A, SCAPER, BBS1, MAPRE2, TUBB, MAPK1, NPHP1, RAB3GAP2, RAB18, UBE4B, ABCA5, HDAC8, SMC3, RAB3GAP1, WDPCP, BBS2, BRD4, BBS5, TTC8, SCLT1
HP:0000817	Reduced eye contact	46	0.012700165654334622	2.254936308764447	2.1152049359218774e-08	1.2505237457372617e-06	5.902908057196374	0.00021759113175828353	FLCN, ST3GAL3, SYT1, KCNT1, MBD5, GFM1, CNTNAP2, AGTPBP1, SPTBN1, SEL1L, MT-ND3, ADCY5, OPHN1, GPHN, SLC25A12, CAMK2B, COX10, MT-ND2, NDUFV2, SPEN, GUF1, ARFGEF2, DOCK7, NDUFS4, NUBPL, ADNP, WWOX, ADAM22, MT-ND1, MECP2, NHLRC2, ALG13, NALCN, GRIN2B, TMEM163, NTRK2, GRIA3, NEXMIF, CDKL5, IREB2, NDUFAF2, FRMPD4, FOXG1, GLS, GABRA2, NDUFS1
HP:0002540	Inability to walk	107	0.029541689674213143	2.2534838538151627	8.094295545540654e-18	1.6653203655395343e-15	14.778502206840953	8.32660182769767e-14	ALS2, NEFL, SYT1, GRIA4, ARL6IP1, HNRNPH1, VAMP2, MTM1, ATP6AP2, MBOAT7, MFF, GDAP1, CHKA, ATP8A2, DMD, STXBP1, INTS8, SYNJ1, ASXL1, SPTLC2, BCAS3, TFG, EXTL3, PPP2R1A, UBE4A, ATL1, RAB18, GRIK2, PLCH1, OTUD7A, SUCLA2, POT1, PPP1R21, HACE1, KCNT1, FGF12, PURA, CACNA1E, DNAJC6, MAPK8IP3, HNRNPK, FUS, STRADA, LYST, SELENOI, DOCK7, STAG2, SLC17A5, CELF2, MECP2, CAMK2A, GNAO1, PANK2, SLC12A6, CDON, VPS41, CDKL5, ATP6V1A, DYNC1I2, SPTLC1, SLC1A2, NGLY1, SLC16A2, ST3GAL3, DYM, SCN1A, SLC33A1, TBCK, ITPR1, TRIM2, CTNNA2, EIF2AK2, GABRB2, GNPTAB, LRPPRC, SNX14, COPB1, SLC6A17, TRAPPC11, TNR, CACNA1B, SLC2A3, DNM1, GRIA2, DPYD, SCN3A, SYNE1, AGTPBP1, CAMK2B, RPL10, KIF1A, SEC31A, FAR1, DHX30, LNPK, HTT, SCN2A, GNB1, ZC4H2, NTRK2, CLTC, ATM, SBF2, SLC12A5, DNM1L, GABRA2, UNC80
HP:0001258	Spastic paraplegia	42	0.011595803423522915	2.253086484064886	9.919528316609083e-08	5.127748130299379e-06	5.290073315062474	0.0010204218779295763	ALS2, VPS37A, CACNA1D, BSCL2, ARL6IP1, DDHD2, SLC33A1, MT-ATP6, WDR48, AMFR, PEX3, HSPD1, CYP7B1, SPTAN1, PDHX, LAMB1, AP4S1, SETX, SPAST, LYST, KIF1A, STXBP1, NT5C2, INTS8, MT-ATP8, MECP2, ATRX, TFG, DDHD1, OPA1, UCHL1, KIDINS220, ATL1, AMPD2, ATP5F1A, PI4KA, DSTYK, DNM1L, SPART, KIF5A, ASCC3, SLC16A2
HP:0002380	Fasciculations	40	0.011043622308117063	2.252024208494842	2.1742434495005707e-07	1.0650686840482082e-05	4.972622384580828	0.002236644236501237	RAB7A, ANO10, NEFL, PSAP, HACE1, HNRNPA2B1, SYNE1, FIG4, VRK1, CPLANE1, GPHN, TAF15, ATAD1, CEP126, TARDBP, ATXN3, DMD, FUS, ATXN2, FBXO38, GLRB, HEXB, TMEM106B, TFG, UCHL1, UBQLN2, EEF2, VPS13D, SCYL2, ERLIN1, ELOVL4, UNC13A, VPS41, VAPB, HINT1, MAPT, LRP12, NEK1, ATXN1, DCTN1
HP:0000490	Deeply set eye	118	0.03257868580894534	2.2441157622777195	2.643912203762221e-19	6.973826882077427e-17	16.156528837730285	2.7197924840101964e-15	RARS2, PGAP1, EPB41L1, ACTB, DYRK1A, WDR26, SLC35A1, MEIS2, DPYSL5, OPHN1, PAK1, DIS3L2, UBAP2L, CHN1, ALMS1, WAC, UBE3A, ANKRD17, MAPK1, EXTL3, SRRM2, XRCC4, CDH2, MARK2, YY1AP1, PRKG1, BPTF, KMT2E, NALCN, SETBP1, ALKBH8, TBL1XR1, PSMD12, HACE1, HECW2, TPR, FRYL, CAMTA1, NF1, MAPK8IP3, ARNT2, BBS7, LUZP1, SPOP, IGF1R, ZBTB20, EP300, RALGAPA1, LIFR, OCRL, PAK3, CDKL5, SLC9A6, STAG1, PHIP, RERE, IQSEC2, FARSB, EDEM3, TBCK, JARID2, SMAD4, KAT6A, FBN1, TAF1, HS6ST2, ACBD6, BRCC3, PIK3CA, AGL, HNRNPC, SON, RAB3GAP2, UBE4B, ASH1L, BBS2, SMAD2, DPYD, WASF1, CRPPA, ARIH1, SLC9A7, CREBBP, HHAT, SPTBN1, TRRAP, MIPEP, SYNGAP1, LRRC8C, CEP57, CAMK2B, AP1S2, RNF2, HUWE1, SPEN, SNRPN, AGO2, PRKDC, FBXO11, TCF20, KIDINS220, IPO8, TOGARAM1, ZC4H2, HDAC8, GRIA3, TMEM67, MED12L, RAB3GAP1, CAPRIN1, GATAD2B, LEMD3, STIM1, ABL1, PIK3R1, DNM1L, PDCD6IP, NEDD4L
HP:0002353	EEG abnormality	110	0.030369961347321922	2.2339275853908656	6.812828827764961e-18	1.4302769418615952e-15	14.844579862760602	7.008357015121815e-14	SYT1, YWHAE, PEX1, GRM7, VAMP2, DRD3, LARS2, MFF, MED23, COG3, CUL4B, YEATS2, YWHAG, RUSC2, ABAT, SYN2, UBE3A, MT-ND1, ANKRD17, KDM6A, MARK2, PLCH1, IREB2, OCA2, KCNMA1, FOXG1, EPG5, GABRB3, PSAP, HECW2, FGF12, PURA, CACNA1E, PEX3, DMXL2, PRNP, FOXP1, LUZP1, CEP85L, CACNA1A, SLC44A1, NDUFA9, CAMK2A, MECP2, KCNH1, MT-CO2, EP300, GNAO1, SLC12A6, GRIN2B, OCRL, ABCA5, NUP133, CDKL5, MT-CO3, SLC9A6, ALDH5A1, SLC1A2, NGLY1, RERE, IQSEC2, SCN1A, CHD2, KANSL1, CNTNAP2, MFSD8, CTNNA2, ATP6V1B2, GABRB2, ANKRD11, DENND5A, ATP1A3, UBE4B, TRAPPC11, KRAS, MT-CO1, DNM1, MAP2K1, DPYD, CRPPA, PRRT2, FLCN, CREBBP, HNRNPU, SPTBN1, NLGN4X, CCDC47, MAPK10, SYNGAP1, LRRC8C, AP1S2, MT-ND5, RBPJ, SPEN, SNRPN, MADD, CASK, WWOX, MT-ND4, SAMD12, PAFAH1B1, MED13L, SCN2A, AFG3L2, GNB1, POGZ, BRAF, FKTN, ERCC5, CTNND2
HP:0002465	Poor speech	77	0.021258972943125346	2.2339275853908656	8.966678005589066e-13	9.317193600353003e-11	10.03071488028745	9.224021664349473e-09	SYT1, DYRK1A, SLC35A1, ATP6V1E1, OPHN1, ATP1A1, ADK, PAK1, TUBB4A, EXT2, TMEM106B, UBE3A, CHSY1, PPP2R1A, PLCH1, RNASET2, OCA2, NDUFS1, NALCN, FGF12, HNRNPK, TRAPPC10, LUZP1, ALG9, DOCK7, STAG2, CTNNB1, SNAP25, DIAPH1, FOXP2, CDON, SMC3, PAK3, ATP6V1A, SOBP, NGLY1, NUBPL, RAC1, YME1L1, RERE, IQSEC2, DYM, GPR88, KANSL1, CNTNAP2, TBCK, FBXL3, ITPR1, TAF2, KAT6A, ATP6V1B2, TSC1, SMARCA2, HS6ST2, AP4S1, RLIM, GNPTAB, LRPPRC, UBE4B, CDC42, SLC6A17, TRAPPC11, MAPT, MID2, ZNF148, TRRAP, SYNGAP1, AP1S2, SPEN, FMN2, SNRPN, TRIO, MED13L, FRMD4A, HDAC8, GATAD2B, UNC80
HP:0000348	High forehead	123	0.03395913859745997	2.2274599316983617	1.1324413056993693e-19	3.148492895062003e-17	16.50189728239649	1.1649423711729412e-15	CYFIP2, CDC42BPB, EPB41L1, SYT1, ACTB, THOC2, YWHAE, APC, PEX1, HNRNPH1, POLR2A, MTM1, NPHP3, WDR37, CUL4B, MTOR, DIS3L2, YWHAG, IFT122, KMT2A, SYNJ1, EXT2, PPP3CA, MAPK1, KDM6A, HIVEP2, EIF4H, XRCC4, MARK2, FRA10AC1, FRMPD4, FOXG1, NELFA, MTX2, SETBP1, TBL1XR1, MDH1, PPP1R21, GTF2I, FIG4, FGF12, ARID2, PURA, FUT8, PEX3, STRADA, SETD2, CELF2, CACNA1A, CDK19, KCNH1, SCN8A, GABRA5, SUPT16H, CTNND1, CDKL5, ATP6V1A, SLC1A2, SOS1, ASCC3, PHIP, CDH11, NECAP1, KMT5B, SCN1A, KANSL1, HCN1, PTPN11, ATP6AP1, CCND2, FBN1, ATP6V1B2, CNKSR2, AKT3, GABRB2, RASA2, CRIPT, ANKRD11, PIK3CA, GNPTAB, WDR35, SETD5, ATP1A3, KCNB1, GABRG2, CACNA1B, KRAS, GHR, SOS2, DNM1, MAP2K1, SCN3A, CACNA2D1, HNRNPU, SPTBN1, SYNGAP1, CEP57, TAOK1, AP1S2, HUWE1, MADD, HSD17B4, FOCAD, WWOX, DHX30, UBA2, TRIO, FBXO11, TCF20, PAFAH1B1, NSD1, SCN2A, ZC4H2, NTRK2, AGO1, BRAF, MED12L, CLTC, STIM1, PPP1CB, PDCD6IP, GABRA2, UNC80
HP:0001773	Short foot	57	0.015737161789066815	2.2200177000521926	9.491709653110344e-10	6.974372657253293e-08	7.156494850957054	9.764121720154611e-06	RAD21, KIF5C, TBL1XR1, RERE, DYRK1A, WDR26, MBD5, LMBR1, USP9X, TTC21B, ARL6, TRRAP, CCDC47, HNRNPR, NDN, CUL4B, SMAD4, NIPBL, FBN1, FBXL4, RNF2, MAPK8IP3, HUWE1, DYNC2H1, PIGN, SPEN, ZMYM2, SNRPN, LUZP1, BBS1, IFT80, MECP2, HTT, IGF1R, FBXO11, CHSY1, WDR35, CEP120, WDR19, SON, B3GLCT, CHD6, UBE4B, HDAC8, SMC3, DYNC2LI1, CDKL5, DYNC1H1, MAP3K7, HERC2, BRD4, OCA2, CERT1, SPART, NGLY1, ASCC3, TRPS1
HP:0002059	Cerebral atrophy	148	0.040861402540033134	2.197340591943923	8.51344827531783e-23	3.127780086006947e-20	19.504763789752584	8.757784240819452e-19	RARS2, CYFIP2, PCLO, PGAP1, CRLS1, GRM7, ADK, WFS1, ATP6AP2, MTR, YWHAG, TMX2, PIGN, STXBP1, GAD1, SYNJ1, ABAT, HEXB, PPP3CA, BCAS3, ACER3, ATG7, TRPM7, KCNMA1, FOXG1, PCCA, NALCN, SETBP1, SUCLA2, HACE1, KCNT1, HECW2, FGF12, TPI1, PTCD3, ATAD1, ATP11A, NUP214, MAPK8IP3, ALG9, SLC17A5, CELF2, CACNA1A, ADNP, ADAM22, MECP2, NDUFA9, CDK19, MED27, GNAO1, SCN8A, TSEN2, RALGAPA1, DGUOK, TTC5, GABRA5, ATP6V1A, SLC9A6, STAG1, DYNC1I2, SLC1A2, NGLY1, NECAP1, SCN1A, FARSB, MTRR, HCN1, CNTNAP2, SLC33A1, PUM1, TBCK, MFSD8, ITPR1, TAF2, CNKSR2, SPTAN1, SERPINI1, EIF2AK2, OSTM1, DSE, NT5C2, PRKN, GABRB2, AUH, DHFR, ATP1A3, KCNB1, CLCN4, COX4I1, VPS53, GABRG2, TTC19, TRAPPC11, CACNA1B, KRAS, SLC2A3, DNM1, MAPT, GRIA2, DPYD, SCN3A, BSCL2, CACNA2D1, NDUFB8, CCDC47, KCTD7, SYNGAP1, FRRS1L, C9orf72, FBXL4, COG6, RBL2, HUWE1, PDHX, ATXN7, KIF1A, COG5, FAR1, WWOX, DHX30, ATRX, ALG13, HTT, UCHL1, KIDINS220, FGF13, SUCLG1, SUMF1, NSD1, B3GLCT, SCN2A, AFG3L2, ZC4H2, PPP2R2B, POGZ, BRAF, NTRK2, CLTC, RAB3GAP1, CAPRIN1, SLC12A5, DDX3X, DNM1L, FASTKD2, REPS1, GABRA2, UNC80, GLB1
HP:0002162	Low posterior hairline	44	0.012147984538928768	2.194735873366464	9.343411491858114e-08	4.855595739322499e-06	5.313757478335166	0.0009611567401674442	RAD21, PGAP1, ACTB, PIK3C2A, CREBBP, APC, MBD5, EDEM3, PPARG, PTPN11, WBP11, NF1, NIPBL, SMARCA2, HUWE1, CHN1, KMT2A, ALG9, SHOC2, MADD, RASA2, INTU, ANKRD11, MAPK1, KDM6A, ACTG1, EP300, RAB3GAP2, HDAC8, SPRED1, BRAF, CDH2, SMC3, RAB3GAP1, KRAS, SOS2, PPP1CB, CDK13, BRD4, NELFA, RPS28, SOS1, MAP2K1, ASCC3
HP:0002342	Moderate intellectual disability	47	0.012976256212037547	2.1906473192059455	5.359562294643404e-08	2.93264985771259e-06	5.532739786300319	0.000551338173249967	DNMT3A, YY1, CHD8, THOC2, KANSL1, CNTNAP2, ARID2, USP9X, NDN, OPHN1, PPM1B, ITPR1, SYNGAP1, CUL4B, PREPL, AP1S2, DMXL2, ANK3, RBMX, TAF1, HNRNPK, ARID1A, CAMKMT, CC2D2A, FOXP1, SNRPN, COG5, STAG2, EXT2, CASK, HPRT1, ANKRD11, MECP2, SLC35A3, MED13L, NSD1, CLCN4, GRIA3, AGO1, TMEM67, ARID1B, OCA2, RPGRIP1L, CWC27, KIF5A, SLC16A2, CDH11
HP:0000322	Short philtrum	99	0.027332965212589728	2.1904659592159454	2.032503182905734e-15	2.944839470781871e-13	12.530938374511443	2.0908360242551288e-11	CDC42BPB, EPB41L1, GRIA4, WDR26, APC, SLC35A1, MEIS2, DPYSL5, OPHN1, RALA, CUL4B, TSPAN7, EXT2, PPP3CA, RUNX2, BCAS3, ANKRD17, HIVEP2, RAB18, PDE4D, CDH2, MARK2, IREB2, PPP2CA, ADAMTS3, NELFA, BPTF, MTX2, SETBP1, TRAPPC9, PSMD12, PRKACB, FIG4, ARID2, FRYL, MAPK8IP3, DOCK7, STAG2, KCNH1, JMJD1C, TTC5, CDON, NEXMIF, ADAMTSL1, IFT57, PHIP, CDH11, AUTS2, CLCN3, IQSEC2, EDEM3, CNTNAP2, EIF4A2, JARID2, ITCH, SMAD4, KAT6A, SMARCA2, ARID1A, VPS13B, AP4S1, ZNF292, ACBD6, TRIP12, DENND5A, SETD5, SON, RAB3GAP2, CDC42, ASH1L, MAP3K7, CDK13, PHF21A, GP1BB, MID2, CREBBP, SPTBN1, TRRAP, TAOK1, AP1S2, RNF2, HUWE1, SPEN, MADD, BCL11B, FBXO11, TRIO, KIDINS220, MCTP2, GNB1, GRIA3, HECTD4, POGZ, MED12L, RAB3GAP1, ARID1B, GATAD2B, STIM1, UNC80
HP:0001268	Mental deterioration	68	0.018774157923799006	2.184590715246126	4.963367799041654e-11	4.144747676636946e-09	8.382501903227034	5.10581645487415e-07	GABRB3, CYFIP2, SCN3A, NECAP1, ACTB, PSAP, BSCL2, SCN1A, CHD2, FGF12, CNTNAP2, CACNA2D1, TMEM106B, FTH1, XPR1, HCN1, MFSD8, MAPK10, SYNGAP1, VPS35, PRNP, CNKSR2, YWHAG, ATXN7, GABRB2, APP, SYNJ1, GABRA2, CELF2, HEXB, LRRK2, SLC20A2, WWOX, CDK19, PRKAR1A, HTT, CACNA1A, PPP3CA, SLC44A1, SCN8A, GDAP2, ATP1A3, PANK2, NBN, KCNB1, SCN2A, GABRA5, GABRG2, NTRK2, APTX, BRAF, PRKCG, VPS13C, CLTC, ATP6V1A, CACNA1B, SNCA, SLC9A6, GOSR2, SLC2A3, DNM1, MAPT, FOXG1, SLC1A2, SCARB2, MAP2K1, VPS13A, GIGYF2
HP:0000294	Low anterior hairline	56	0.015461071231363888	2.1810700211039085	2.365268360859533e-09	1.6221010418774676e-07	6.789922096756751	2.4331515628162016e-05	RAD21, CLCN3, RPL15, PGAP1, CDC42BPB, PIK3C2A, RPL9, CREBBP, CNTNAP2, ARID2, RPS20, RPS27, PPARG, NIPBL, ATP6V1B2, SMARCA2, RBL2, FILIP1, UBAP2L, SPEN, VPS13B, ARID1A, SPOP, DOCK7, STAG2, RPL5, ASXL1, RPS19, MAPRE2, ANKRD11, TRIO, KCNH1, CIT, EP300, LRPPRC, SETD5, KCNN3, MED13L, NBN, RALGAPA1, SLC12A6, RAB3GAP2, TTC5, RAB18, RPL18, TCF12, XRCC4, FRMD4A, HDAC8, SMC3, ARID1B, CAPRIN1, ASH1L, MAP3K7, BRD4, RPS28
HP:0002067	Bradykinesia	46	0.012700165654334622	2.1797717651389656	8.461123281280572e-08	4.486576040955323e-06	5.348084967189176	0.0008703957519453324	PRKAR1B, PRRT2, SCN1A, HCN1, XPR1, PDE8B, VPS35, ATP6AP2, FTL, ATXN3, PRNP, TAF1, DNAJC6, ATCAY, ATXN2, EIF2AK2, SYNJ1, PRKN, LRRK2, SLC20A2, TENM4, MECP2, HTT, UCHL1, ATP1A3, FGF13, PANK2, SNCAIP, ATL1, SCN2A, GABRG2, PPP2R2B, VPS13C, SCN9A, TTC19, CLTC, SNCA, SLC9A6, SLC2A3, MAPT, ATXN1, GIGYF2, ATXN10, DCTN1, VPS13A, GABRA1
HP:0002123	Generalized myoclonic seizure	54	0.014908890115958034	2.1777553250232033	4.957646687112806e-09	3.2483637879190723e-07	6.488335339579044	5.099931147032944e-05	GABRB3, EFHC1, PRRT2, TRAPPC9, PSAP, HACE1, DYRK1A, SCN1A, CHD2, HCN1, MT-ATP6, GRM7, MT-ND3, KCTD7, MFSD8, OPHN1, GPHN, MAPK10, SYNGAP1, MBOAT7, BTD, DMXL2, MT-ND2, MT-ND5, STXBP1, ACBD6, CASK, CACNA1A, MT-ND1, LNPK, MT-ND4, MECP2, GNAO1, SAMD12, SETD5, FGF13, PAFAH1B1, TSEN2, ELOVL4, NSD1, SCN2A, AFG3L2, GABRG2, SCN9A, NEXMIF, CDKL5, AP2M1, SLC12A5, ALDH5A1, DNM1, GABRA1, DNM1L, NGLY1, GLB1
HP:0000154	Wide mouth	86	0.023743787962451683	2.173453586109577	1.6924106391890803e-13	1.9131679390481393e-11	10.718246905664984	1.740982824533807e-09	PGAP1, CDC42BPB, RPS6KA3, ACTB, WDR26, NRXN1, DPYSL5, SLC12A2, CUL4B, MTOR, KDM3B, PIGN, SEC23A, WAC, UBE3A, MAPK1, EIF4H, MED13, OCA2, KCNMA1, NALCN, SETBP1, GTF2I, MBD5, HECW2, ARID2, TASP1, STRADA, ALG9, ADNP, CDK19, CAMK2A, KCNH1, ACTG1, RALGAPA1, FOXP2, NEXMIF, AP2M1, STAG1, SOS1, AUTS2, PMM2, DYM, SCN1A, CHD2, CNTNAP2, KAT6A, ATP6V1B2, SMARCA2, ARID1A, AP4S1, TRIP12, ANKRD11, PIK3CA, GNPTAB, PTDSS1, CDC42, ZMYND11, MAP3K7, MAP2K1, DPYD, FLCN, ZNF148, TRRAP, CCDC47, MIPEP, SYNGAP1, AP1S2, RNF2, HUWE1, SPEN, SNRPN, ATRX, FBXO11, TRIO, KCNN3, MED13L, B3GLCT, POGZ, HECTD4, TMEM67, ZSWIM6, ARID1B, HS2ST1, GATAD2B, GLB1
HP:0011344	Severe global developmental delay	88	0.024295969077857537	2.1662328100759907	1.0318807970175423e-13	1.2342974138278438e-11	10.908580180966203	1.0614957758919458e-09	RPS6KA3, SYT1, DYRK1A, PEX1, WDR26, GRM7, SEL1L, MEIS2, DPYSL5, ADK, CHKA, MTR, PIGN, LAMB1, STXBP1, ABAT, MT-ND1, EXTL3, DEPDC5, RNASET2, TBL1XR1, SUCLA2, PPP1R21, FIG4, MT-ATP6, PURA, FUT8, PEX3, ARNT2, STRADA, SLC25A46, ADNP, MECP2, KCNH1, TSEN2, FOXP2, RALGAPA1, EXOC2, NEXMIF, CDKL5, SLC9A6, DYNC1I2, SLC16A2, ST3GAL3, DYM, MTRR, SLC33A1, SLC30A9, MT-ND3, TBCK, EIF4A2, CTNNA2, MT-ND2, ADAR, RELN, GNPTAB, DENND5A, VPS35L, SNX14, RAB3GAP2, VPS53, GABRG2, DNM1, PHACTR1, DPYD, YY1, CCDC47, KDM5B, GPHN, MAPKAPK5, FBXL4, RNF2, FTO, MT-ND5, RBL2, MADD, VPS50, CASK, MT-ND4, FGF13, SCN2A, NTRK2, BRAF, PRORP, ERCC5, CTNND2, GABRA2, UNC80
HP:0001300	Parkinsonism	49	0.013528437327443401	2.159935621674607	3.5619849903121496e-08	1.9806561943427613e-06	5.703190903491251	0.0003664213959534108	ALS2, PRKAR1B, SCN1A, XPR1, VPS35, ATP6AP2, FTL, AOPEP, TARDBP, ATXN3, C9orf72, PRNP, DNAJC6, FUS, ATXN2, EIF2AK2, LYST, APP, PRKN, SYNJ1, ACBD6, TMEM106B, SCARB2, LRRK2, SLC20A2, MECP2, ATP1A3, DNAJC5, PANK2, SNCAIP, JMJD1C, SCN2A, AFG3L2, GABRG2, PPP2R2B, SCN9A, TNR, SNCA, SLC9A6, SORL1, TRPM7, GP1BB, MAPT, SPTLC1, GIGYF2, DCTN1, KIF5A, VPS13A, GABRA1
HP:0012444	Brain atrophy	71	0.019602429596907785	2.1589927271546134	4.647606431976066e-11	3.918846505388343e-09	8.406841746771539	4.780992736573779e-07	RARS2, CYFIP2, SCN3A, YME1L1, NECAP1, KCNT1, HNRNPA2B1, SCN1A, MTRR, FGF12, CACNA2D1, USP9X, TMEM106B, HCN1, TBCK, PURA, SYNGAP1, RBMX, CNKSR2, FTO, ADAR, MT-ND5, YWHAG, NDUFV2, DNAJC6, OSTM1, LYST, RUSC2, COG5, SYNJ1, ACBD6, CELF2, GABRB2, PPP3CA, CACNA1A, WWOX, CDK19, MT-ND4, MT-ND1, DIAPH1, PRKDC, MT-CO2, NHLRC2, TBC1D32, SCN8A, ATP1A3, KCNB1, ELOVL4, GABRA5, NUP133, NTRK2, ZC4H2, GABRG2, CLTC, ATP6V1A, CACNA1B, RAB3GAP1, MT-CO3, MT-CO1, KCNQ5, DNM1, STAG1, MAPT, FOXG1, GRID2, SLC1A2, LRP12, RFXAP, GABRA2, NDUFS1, SLC16A2
HP:0001007	Hirsutism	53	0.014632799558255107	2.1526938550130157	1.0339464671895214e-08	6.525280557042089e-07	6.185400810923654	0.00010636207307978606	MAP1B, SETBP1, WDR26, CREBBP, BSCL2, ARID2, PPARG, USP48, ARL6, NR3C1, TBCK, HNRNPR, PUM1, EIF4A2, TASP1, FUT8, NIPBL, ATP6V1B2, TAF1, RPL10, SPEN, ARID1A, HGSNAT, ALMS1, SETD2, WAC, BCL11B, ASXL1, BBS1, ADNP, PRKAR1A, ATRX, FBXO11, TRIO, KCNH1, KDM6A, LRPPRC, IPO8, EP300, HIVEP2, FRMD4A, TTC5, COPB1, CNOT2, ABCA5, HDAC8, BRAF, ARSB, ARID1B, SMC3, MAP3K7, KDM1A, GLB1
HP:0002188	Delayed CNS myelination	77	0.021258972943125346	2.146322582042204	6.6207135925707375e-12	6.306229696923628e-10	9.200230214639546	6.810728072677518e-08	PGAP1, POLR2A, ATP6AP2, COG3, NIPBL, STXBP1, TMEM106B, PPP3CA, PPP2R1A, GRIK2, TMEM163, PPP2CA, FRMPD4, FOXG1, KIF5A, FRMD5, RFX7, ADARB1, KCNT1, TPR, PURA, FANCL, ARNT2, FOXP1, ALG9, CTNNB1, CDK19, NRCAM, GNAO1, PIBF1, ELOVL4, NUP133, ALDH5A1, SLC1A2, ATP9A, NGLY1, SLC16A2, CLCN3, YME1L1, RERE, ARF1, TAF2, CDC40, EIF2AK2, ATP1A3, HNRNPC, GABRG2, TNR, ASH1L, PHACTR1, YY1, ZNF148, DDX6, NCDN, NAE1, TRRAP, FBXL4, CUL3, MADD, FAR1, FOCAD, WWOX, DHX30, ALG13, KIDINS220, RNF13, ZC4H2, POGZ, ARID1B, CLTC, RAB3GAP1, HS2ST1, SLC12A5, DNM1L, GLS, NEDD4L, KDM1A
HP:0200055	Small hand	43	0.011871893981225842	2.1448555126081357	3.396247165134113e-07	1.6100089671767104e-05	4.793171705095778	0.003493719458773462	RAD21, KIF5C, AFF4, WDR26, CACNA2D1, USP9X, PUM1, NDN, EIF4A2, CUL4B, NIPBL, FBN1, RNF2, MAPK8IP3, HUWE1, PIGN, SNRPN, KMT2A, CTNNB1, ACBD6, MTFMT, ADNP, MECP2, HTT, IGF1R, FBXO11, ALG13, KDM6A, MCTP2, SON, CHD6, SPECC1L, HDAC8, SMC3, SLC6A17, CDKL5, WRN, HERC2, BRD4, OCA2, BPTF, CTNND2, NGLY1
HP:0002307	Drooling	61	0.01684152401987852	2.141160671070481	1.1335181602351425e-09	8.211620643900642e-08	7.085571122144375	1.1660501314338911e-05	ALS2, SLC9A7, MBD5, SCN1A, FIG4, SPTBN1, NRXN1, ITPR1, SYNGAP1, CAMTA1, ATP6AP2, TASP1, ZBTB11, TAF15, SLC25A12, TARDBP, SMARCA2, RSRC1, SPEN, FUS, AP4S1, STRADA, FOXP1, ATXN2, SNRPN, HERC1, UBE3A, LNPK, MECP2, MED27, ATRX, EXTL3, SETD5, UBQLN2, ATP1A3, FOXP2, HIVEP2, MRE11, SCN2A, GRIK2, ZC4H2, UNC13A, ANKLE2, SCN9A, NEXMIF, VAPB, PAK3, GABRG2, SLC9A6, PI4KA, OCA2, DNM1L, FOXG1, NEK1, SPART, CERT1, DCTN1, NALCN, VPS13A, SLC16A2, GABRA1
HP:0012450	Chronic constipation	44	0.012147984538928768	2.1384605945621957	2.560143372208837e-07	1.2364410737048028e-05	4.907826576411176	0.0026336194869912306	WASF1, KMT5B, PPP1R21, CREBBP, FGF12, USP9X, SLC12A2, VPS35, CAMTA1, CAMK2B, TAOK1, SPOP, MADD, ZNF292, FAR1, LRRK2, ADNP, MECP2, PAK2, TRIO, GRIA1, OPA1, IPO8, PPP2R1A, EP300, RORA, HIVEP2, POGZ, MARK2, ARSB, SUPT16H, SNCA, HS2ST1, ASH1L, GATAD2B, HERC2, PPP1CB, MED13, ABL1, SLC25A36, TANC2, SPART, NGLY1, GIGYF2
HP:0002061	Lower limb spasticity	50	0.013804527885146328	2.137729746785517	3.503567049137331e-08	1.9587605562215066e-06	5.7080186500019	0.0003604119423447573	ALS2, RARS2, PGAP1, PRRT2, KPNA3, ACTB, PSAP, HACE1, SYNE1, TMEM63C, BSCL2, CNTNAP2, SLC33A1, MT-ATP6, WDR48, TPK1, ZFR, CAMK2B, HSPD1, CYP7B1, FUS, SPAST, KIF1A, ALG9, SELENOI, NT5C2, ACBD6, WWOX, MECP2, TFG, DDHD1, UCHL1, UBE4A, ERLIN1, SACS, RAB3GAP2, CLCN4, RAB18, ATL1, MRE11, VPS41, NEXMIF, CLTC, GATAD2B, PI4KA, SPTLC1, REPS1, SPART, ATXN10, KIF5A
HP:0000276	Long face	109	0.030093870789618993	2.129942827432965	6.283960319794816e-16	1.01004843452702e-13	12.995657800134712	6.464309980972927e-12	CDC42BPB, DYRK1A, APC, HNRNPH1, MEIS2, CPLANE1, DOCK3, OPHN1, MTM1, COG3, PAK1, TSPAN7, UBAP2L, RUSC2, ASXL1, BCAS3, MAPK1, EXTL3, MYO9A, XRCC4, ATG7, FRA10AC1, TLK2, YY1AP1, PRKG1, SETBP1, ALKBH8, PRKACB, FRYL, PURA, CAMTA1, NF1, MAPK8IP3, HNRNPK, STRADA, CC2D2A, SLF2, PIGK, HERC1, SETD2, ANKH, TCTN1, ADNP, SNAP25, MAPRE2, NRCAM, PIBF1, JMJD1C, SLC12A6, TTC5, PPP1R12A, OCRL, SLC9A6, SLC16A2, CLCN3, PMM2, KANSL1, ASXL2, CSPP1, SMAD4, KAT6A, RIC1, FBN1, TAF1, CEP290, FILIP1, EYA1, ARL13B, ACBD6, ANKRD11, CEP120, AHI1, NPHP1, CLCN4, KRAS, SMAD2, ASPH, GP1BB, RPGRIP1L, MAP2K1, MID2, ARIH1, SLC4A10, GFPT1, NBAS, SLC9A7, SYNE1, SYNGAP1, CEP57, AP1S2, HUWE1, RPL10, SPEN, SMC5, PBX1, DHX30, BRWD3, FBXO11, TCF20, IPO8, TOGARAM1, NSD1, B3GLCT, BRAF, TMEM67, CAPRIN1, DDX3X, NEDD4L, KIAA0586
HP:0000494	Downslanted palpebral fissures	201	0.05549420209828824	2.11267760890267	5.2672971814557535e-28	3.1873344768020786e-25	24.496572359555014	5.418468610563534e-24	BBS9, CYFIP2, CDC42BPB, RPS6KA3, ACTB, DYRK1A, YWHAE, APC, HNRNPH1, SEL1L, ATP6V1E1, DPYSL5, DOCK3, CUL4B, MTOR, KDM5A, YWHAG, KMT2A, GAD1, SYNJ1, WAC, ABAT, PPP3CA, BBS1, UBE3A, RPS19, MAPK1, KDM6A, CEP295, PPP2R1A, BMPR1A, CDH2, MARK2, AMMECR1, FHL1, YY1AP1, KCNMA1, NELFA, FOXG1, PRKG1, BPTF, OTUD7A, KMT2E, NALCN, ACSL4, SETBP1, PSMD12, FGF12, ARID2, USP9X, FRYL, PURA, CAMTA1, NF1, TASP1, PEX3, DMXL2, HNRNPK, ZMYM2, BBS7, SLF2, FOXP1, SPOP, HERC1, SETD2, IL6ST, CELF2, CACNA1A, ADNP, CDK19, MAPRE2, CAMK2A, KCNH1, ZBTB20, EP300, ACTG1, SCN8A, PTEN, JMJD1C, GABRA5, ABCA5, SPRED1, NEXMIF, SUPT16H, SPART, ATP6V1A, AMPD2, CHD1, BRD4, BBS5, SLC1A2, SOS1, TTC8, CDH11, AUTS2, CLCN3, RERE, NECAP1, AFF4, SCN1A, EDEM3, CNTNAP2, HCN1, PTPN11, SDCCAG8, JARID2, SMAD4, FBN1, ATP6V1B2, CNKSR2, CEP290, ZNF462, SMARCA2, FILIP1, KAT6B, MPDZ, TAF1, VPS13B, HS6ST2, SHOC2, DSE, SCAPER, GABRB2, RASA2, ANKRD11, PIK3CA, RLIM, SETD5, VPS35L, ATP1A3, KCNB1, HNRNPC, NPHP1, SON, RAB3GAP2, CLCN4, TNRC6B, CDC42, SPECC1L, GABRG2, ATR, CACNA1B, DYNC1H1, MAP3K7, KRAS, SOS2, BBS2, SMAD2, DHCR24, ASPH, DNM1, GP1BB, MAP2K1, DPYD, SCN3A, ARIH1, YY1, CHD8, ZNF148, FLCN, SLC9A7, CREBBP, CACNA2D1, PGM2L1, ARL6, KDM5B, SYNGAP1, CEP57, FBXL4, SUZ12, HUWE1, SPEN, CASK, WWOX, DHX30, FBXO11, TRIO, PAFAH1B1, IPO8, KCNN3, NSD1, NTRK2, POGZ, HECTD4, AGO1, ZSWIM6, DYNC2LI1, CLTC, MED12L, WDPCP, BRAF, ARID1B, PPP1CB, ABL1, RPS28, CTNND2, CWC27, GABRA2, UNC80, KDM1A, SCLT1
HP:0001257	Spasticity	248	0.06847045831032579	2.104802327402194	4.244262996071629e-34	4.3660733440588845e-31	30.35990897301247	4.366073344058884e-30	ALS2, RARS2, CYFIP2, PCLO, BBS9, PGAP1, NEFL, GRIA4, THOC2, PEX1, ARL6IP1, GRM7, SEL1L, ATP6V1E1, OPHN1, SLC12A2, ATP6AP2, MED23, COG3, TAF15, MFF, SLC25A12, EML1, TUBB4A, ARPC5, MTR, YWHAG, PIGN, ATXN2, STXBP1, GAD1, RUSC2, SYNJ1, RAD50, HEXB, LRRK2, BBS1, HPRT1, PPP3CA, GLRB, MT-ND1, BCAS3, TFG, CIT, ERLIN1, TMEM67, SACS, RAB18, EIF4H, PLCH1, IREB2, WASHC4, RNASET2, MACF1, PI4KA, FRMPD4, FOXG1, ATXN1, DCTN1, FRMD5, SETBP1, SUCLA2, ADARB1, SIL1, PSAP, HACE1, KCNT1, GLB1, GTF2I, FIG4, FGF12, MCCC2, GFM1, MT-ATP6, FTH1, RANBP2, TPI1, ATAD1, PEX3, ATXN3, TARDBP, PRNP, DNAJC6, MAPK8IP3, DMXL2, NUP214, NDUFV2, ARNT2, BBS7, GUF1, FUS, FOXP1, SLC25A46, STAG2, CTNNB1, SLC17A5, NDUFS4, CELF2, CACNA1A, CEP85L, ADAM22, MECP2, CAMK2A, CDK19, MED27, GNAO1, OPA1, SCN8A, UBQLN2, SCYL2, PANK2, ELOVL4, TSEN2, SLC12A6, GRIN2B, ITM2B, RALGAPA1, TUBA1A, GABRA5, CDON, VAPB, CDKL5, PNPLA8, AMPD2, ATP6V1A, GTF2E2, BBS5, DYNC1I2, SLC1A2, NUBPL, SLC16A2, TTC8, AUTS2, CLCN3, MCCC1, NECAP1, ARF1, SCN1A, HCN1, CNTNAP2, MYO5A, MT-ND3, EIF4A2, SDCCAG8, TAF2, TPK1, ITPR1, MT-ND2, ADAR, ANK3, CEP290, CNKSR2, TAF1, SPTAN1, AP4S1, EIF2AK2, SPAST, SCAPER, PRKN, ACBD6, GABRB2, AUH, RLIM, DENND5A, DLD, LRPPRC, ATP1A3, SNX14, KCNB1, NPHP1, SON, RAB3GAP2, COPB1, VPS53, GABRG2, VPS13C, TNR, SNCA, CACNA1B, KRAS, BBS2, DNM1, DHCR24, NEK1, GRIA2, SCN3A, B4GAT1, CACNA1D, SYNE1, RETREG1, BSCL2, CACNA2D1, AGTPBP1, VRK1, SPTBN1, ARL6, LMBRD2, JAM3, GPHN, SYNGAP1, LRRC8C, FTL, ZBTB11, AP1S2, FRRS1L, RBMX, SUZ12, MT-ND5, ATXN7, KIF1A, ADD3, BCL11B, FAR1, ALDH3A2, CASK, WWOX, AP1G1, MT-ND4, ATRX, HTT, TCF20, UCHL1, RNF13, GDAP2, VPS13D, SUMF1, NSD1, SCN2A, AFG3L2, ZC4H2, UNC13A, CNOT1, GRIA3, ANKLE2, NTRK2, CLTC, ATM, RAB3GAP1, WDPCP, ISCA1, DDX3X, NARS2, ERCC5, DNM1L, SPART, GABRA2, UNC80, SCLT1
