HP:0002120	Cerebral cortical atrophy	106	0.029265599116510214	1.9381166540310109	1.7824502380293634e-12	1.8154520394661447e-10	9.741015219772477	1.833606559860806e-08	ALS2, RARS2, PGAP1, RPS6KA3, ACTB, GRIA4, DYRK1A, YWHAE, PEX1, SEL1L, VPS35, WFS1, NIPBL, ATP8A2, PIGN, ATXN2, SYNJ1, HEXB, LRRK2, UBE3A, MT-ND1, KDM6A, RAB18, EIF4H, FRMPD4, EPG5, SETBP1, TRAPPC9, KCNT1, GTF2I, MT-ATP6, PARN, CACNA1E, CAMTA1, PRNP, GNAQ, GUF1, LUZP1, HERC1, SLC25A46, CACNA1A, MECP2, MT-CO2, ACTG1, PANK2, ELOVL4, DGUOK, GABRA5, NUP133, NEXMIF, SMC3, MT-CO3, AMPD2, GTF2E2, SLC9A6, ATP5F1A, BRD4, RERE, MTRR, MYO5A, ITPR1, CNKSR2, SPTAN1, AP4S1, GNPTAB, SNX14, TRAPPC6B, RAB3GAP2, CLCN4, UBE4B, CDC42, VPS13C, PTDSS1, TTC19, SNCA, KRAS, MT-CO1, SORL1, MAP2K1, PHACTR1, VPS13A, GIGYF2, RAD21, AGTPBP1, VRK1, TRRAP, AP1S2, MT-ND5, SPEN, SNRPN, APP, CASK, MT-ATP8, MT-ND4, ATRX, PAFAH1B1, GDAP2, B3GLCT, PPP2R2B, POGZ, BRAF, HDAC8, ZSWIM6, RAB3GAP1, ERCC5, CWC27
HP:0001642	Pulmonic stenosis	48	0.013252346769740474	1.9357825111317362	2.118208883719724e-06	8.786296285009999e-05	4.056194155865218	0.0217900147868248	ADAMTS19, RAD21, PGAP1, PSMD12, GTF2I, CREBBP, KANSL1, FRYL, NRXN1, TBCK, PTPN11, DPYSL5, ITPR1, ADK, NPHP3, NF1, SMAD4, KAT6A, NIPBL, FBN1, CUL3, SMC5, SHOC2, AGO2, WAC, KCNH1, KDM6A, EP300, SETD5, VPS35L, HIVEP2, B3GLCT, EIF4H, CDC42, SPRED1, BRAF, SMC3, FKTN, DDX3X, MAP3K7, KRAS, SOS2, PPP1CB, SMAD2, BPTF, SOS1, FBXW11, MAP2K1
HP:0000256	Macrocephaly	140	0.03865267807840972	1.932258635201278	6.547961821666147e-16	1.0205891402951462e-13	12.991149057143298	6.735888325947965e-12	CDC42BPB, PEX1, DPYSL5, OPHN1, SLC12A2, MTM1, ADK, CUL4B, MTOR, EML1, DIS3L2, PIGN, LAMB1, GAD1, SEC23A, EXT2, HEXB, BBS1, UBE3A, IFT80, RUNX2, ANKRD17, BMPR1A, DEPDC5, SRRM2, DICER1, CDH2, MARK2, PLCH1, PPP2CA, IDS, KMT2E, NALCN, DNMT3A, RFX7, ALKBH8, FIG4, HECW2, CACNA1E, CAMTA1, NF1, PEX3, GNAQ, STRADA, CC2D2A, FOXP1, HERC1, SETD2, STAG2, AGGF1, CTNNB1, IL6ST, ANKH, MECP2, CAMK2A, KCNH1, ZBTB20, PTEN, PIBF1, TUBA1A, FOXP2, PPP1R12A, CDON, SPRED1, CHD1, SOS1, RAC1, MAX, CLCN3, YME1L1, RERE, KMT5B, KANSL1, CNTNAP2, ASXL2, PTPN11, CCND2, TBCK, EIF4A2, ZBTB7A, JARID2, SMAD4, CTNNA2, ANK3, FBN1, MPDZ, DYNC2H1, SHOC2, AKT3, PIK3CA, WDR35, VPS35L, TNRC6B, SON, CLCN4, SDHC, PTDSS1, ARSB, CHD4, ASH1L, KRAS, DHCR24, PHF21A, RPGRIP1L, MAP2K1, DPYD, CRPPA, CHD8, B4GAT1, SNX10, SYN1, SPTBN1, ARL6, TRIM37, FBXW7, TAOK1, AP1S2, SUZ12, HUWE1, HSD17B4, FAR1, BRWD3, ALG13, FBXO11, TRIO, TCF20, SUMF1, NSD1, B3GLCT, GNB1, GRIA3, HECTD4, BRAF, ZSWIM6, TMEM67, FKTN, PPP1CB, ACADM, CWC27, KDM1A
HP:0007340	Lower limb muscle weakness	57	0.015737161789066815	1.9293010964739294	3.501407909530391e-07	1.6447024276410563e-05	4.783912666543043	0.0036018983165339133	CRPPA, PDK3, NEFL, KPNA3, SYNE1, RETREG1, BSCL2, FIG4, DDHD2, SLC33A1, MT-ATP6, RASA1, ITPR1, NF1, TAF15, GDAP1, TARDBP, HSPD1, PRNP, CYP7B1, ADAR, SPTAN1, FUS, ATXN2, SPAST, KIF1A, GABRA3, DCTN1, FBXO38, PIK3CA, TFG, DDHD1, EXTL3, UBQLN2, VPS13D, SCYL2, DGUOK, LPIN1, SLC12A6, ATL1, AFG3L2, GNB1, UNC13A, VAPB, PRORP, MT-CO3, SBF2, MT-CO1, PI4KA, DSTYK, FHL1, SPTLC1, LRP12, SPART, NEK1, RFXAP, KIF5A
HP:0002376	Developmental regression	143	0.0394809497515185	1.922339577026655	5.331325769015174e-16	8.99071281735395e-14	13.046205874410147	5.48433481858591e-12	CYFIP2, CRLS1, PEX1, GRM7, NRXN1, ATP6V0C, WFS1, MFF, AMFR, TUBB4A, YWHAG, UBAP2L, STXBP1, SYNJ1, HEXB, PPP3CA, MT-ND1, BMPR1A, EIF4H, ACER3, PPP2CA, FOXG1, NDUFS1, NALCN, NBEA, GABRA1, GABRB3, DNMT3A, PSAP, HACE1, KCNT1, GLB1, GTF2I, RANBP2, FGF12, MT-ATP6, CACNA1E, PTCD3, PEX3, ATP11A, COX10, DMXL2, NUP214, NDUFV2, GUF1, CTNNB1, CELF2, NDUFS4, CACNA1A, ADNP, CDK19, MECP2, MED27, ZBTB20, GNAO1, SCN8A, SV2A, GRIN2B, GABRA5, CDKL5, ATP6V1A, SLC9A6, SLC1A2, NGLY1, ASCC3, NECAP1, IQSEC2, SCN1A, CHD2, HCN1, RPS20, SLC30A9, MT-ND3, TBCK, UBAC2, ITPR1, TPK1, MSH2, MT-ND2, ADAR, CNKSR2, SPTAN1, ARHGEF9, GABRB2, PIK3CA, LRPPRC, ATP1A3, KCNB1, SON, COX4I1, GABRG2, HIBCH, TRAPPC11, CACNA1B, KRAS, DNM1, PHACTR1, WASF1, SCN3A, CHD8, PRRT2, SLC4A10, BSCL2, CACNA2D1, PMS1, AGTPBP1, HNRNPU, SPTBN1, KCTD7, MAPK10, SYNGAP1, FBXW7, CAMK2B, FRRS1L, MT-ND5, NPAT, FAR1, CASK, WWOX, LNPK, MT-ND4, HTT, FBXO11, PAFAH1B1, IPO8, FGF13, SUMF1, SCN2A, GNB1, NTRK2, SCN9A, CLTC, ATM, NARS2, ISCA1, SLC12A5, ERCC5, DNM1L, TANC2, FASTKD2, GABRA2, GABRB1, STAT4
HP:0001328	Specific learning disability	93	0.02567642186637217	1.916056466521019	8.361429917450741e-11	6.826510282604427e-09	8.165801251270343	8.601402956081578e-07	BBS9, EFHC1, ACTB, MTOR, TUBB4A, DIS3L2, DMD, GDI1, ALMS1, BBS1, MT-ND1, CHSY1, EXTL3, PLCH1, PI4KA, OCA2, YY1AP1, GABRA1, GABRB3, SIL1, NF1, ORC4, PRNP, BBS7, LYST, STAG2, CTNNB1, MT-CO2, ACTG1, JMJD1C, FOXP2, SUGCT, DCC, CDON, SPRED1, APTX, MT-CO3, BBS5, GRB10, SOS1, MICU1, TTC8, AUTS2, PIK3C2A, FARSB, MYO5A, PTPN11, NDN, SDCCAG8, ITPR1, SMAD4, TSC1, CNKSR2, CEP290, SMARCA2, KAT6B, SCAPER, RASA2, GNPTAB, NPHP1, PTDSS1, GABRG2, HINT1, KRAS, MT-CO1, SOS2, BBS2, GP1BB, DPYD, CRPPA, PRRT2, B4GAT1, DGCR2, SYN1, ARL6, THRB, FBXW7, MT-ND5, SNRPN, MT-ND4, TRIO, MED13L, NSD1, HDAC8, GRIA3, BRAF, LEMD3, SBF2, FKTN, WDPCP, HERC2, SPART, SCLT1
HP:0010864	Severe intellectual disability	76	0.020982882385422418	1.9122276354431864	5.602296081921579e-09	3.624579861303603e-07	6.440742326883915	5.763081979472729e-05	ACSL4, DNMT3A, RAD21, YY1, CHD8, TRAPPC9, IQSEC2, DYM, CACNA1D, THOC2, MBD5, KANSL1, CNTNAP2, ARID2, HNRNPU, MT-ATP6, PURA, ADCY5, OPHN1, SYNGAP1, CUL4B, MTOR, KAT6A, NIPBL, RBMX, SMARCA2, HNRNPK, RPL10, ARID1A, PDHX, TRAPPC10, AP4S1, FOXP1, SNRPN, STXBP1, HERC1, COG5, AKT3, CEP85L, CTNND2, ASXL1, EXT2, UBE3A, MECP2, PIK3CA, SLC35A3, KCNH1, CIT, PAFAH1B1, SNX14, SON, RAB3GAP2, NSD1, RAB18, CLCN4, FRMD4A, HDAC8, GRIA3, ANKLE2, POGZ, SLC6A17, RAB3GAP1, ARID1B, AMMECR1, FKTN, GATAD2B, SMC3, MACF1, STAG1, BRD4, OCA2, FOXG1, NELFA, CDK6, PDCD6IP, ATP9A
HP:0001290	Generalized hypotonia	232	0.06405300938707896	1.9091690033810107	5.849852152079873e-25	2.735337685838439e-22	21.56298905103316	6.017742908844566e-21	RARS2, CYFIP2, C2CD3, MANBA, ACTB, DYRK1A, PEX1, APC, SLC35A1, CPLANE1, NRXN1, POLR2A, ACTN2, OPHN1, SLC12A2, MTM1, CUL4B, MBOAT7, PAK1, PNPT1, MTOR, KDM3B, HLCS, GPX4, PIGN, YWHAG, ATXN2, TRPS1, SYNJ1, WAC, PPP3CA, UBE3A, MAPK1, KDM6A, EXTL3, BMPR1A, GRIK2, PLCH1, IQSEC1, AMMECR1, TLK2, KCNMA1, FOXG1, ATXN1, BPTF, ATXN10, KMT2E, NDUFS1, MTX2, GABRB3, ELP1, ADARB1, PSAP, HACE1, KCNT1, GLB1, HECW2, FGF12, ARID2, USP9X, MCCC2, TPI1, TASP1, DST, PEX3, COX10, PRNP, NUP214, NDUFV2, STRADA, FOXP1, PDP1, PIGK, ARFGEF2, SLC25A46, SETD2, STAG2, SLC17A5, CELF2, CACNA1A, ADAM22, CDK19, MAPRE2, KCNH1, GNAO1, EP300, SCN8A, PTEN, TUBA1A, RORA, LIFR, GRIN2B, WNK1, GABRA5, CDON, SUPT16H, SPART, CDKL5, ATP6V1A, AP2M1, GTF2E2, CHD1, SLC9A6, ALDH5A1, SLC25A26, SLC13A3, DYNC1I2, SLC1A2, NTRK2, AUTS2, MCCC1, NECAP1, IQSEC2, SCN1A, FARSB, LMBRD1, KANSL1, CNTNAP2, MYO5A, HCN1, TBCK, ITPR1, CSPP1, ITCH, KAT6A, FBN1, ATP6V1B2, ANK3, CEP290, ZNF462, CNKSR2, TAF1, UBR1, SPTAN1, KAT6B, OSTM1, SHOC2, ARL13B, GABRB2, DHFR, PIK3CA, RLIM, GNPTAB, DLD, NEMF, LRPPRC, ATP1A3, KCNB1, NPHP1, MRE11, CLCN4, KMT2C, COX4I1, CNOT2, CDC42, PRKCG, GABRG2, PTDSS1, TRAPPC11, CACNA1B, DNM1, SMAD2, ASPH, BMPER, PHF21A, RPGRIP1L, IFT81, WASF1, MRPS28, SCN3A, CRPPA, CHD8, FLCN, STT3B, GFPT1, SLC9A7, SYNE1, RETREG1, CACNA2D1, HNRNPU, NDUFB8, CDK8, GPHN, SYNGAP1, AP1S2, CD59, COG6, SUZ12, ATCAY, HUWE1, RPL10, FMN2, SNRPN, KIF1A, BCL11B, PBX1, WWOX, SLC35A3, ALG13, IPO8, RNF13, MED13L, KCNN3, TOGARAM1, GNB1, ZC4H2, CNOT1, HDAC8, SCN9A, BRAF, MED12L, CLTC, NARS2, POGZ, FKTN, DDX3X, MAMLD1, TMEM67, HERC2, PPP1CB, ABL1, DNM1L, TANC2, GRID2, HEXA, ACADM, FASTKD2, FBXW11, GABRA2, UNC80, KDM1A, KIAA0586
HP:0001385	Hip dysplasia	58	0.01601325234676974	1.9064100886362403	3.4438584464034557e-07	1.625090451291392e-05	4.789122461513725	0.0035426971838152348	RAD21, SETBP1, RERE, SIL1, GLB1, THOC2, WDR26, CREBBP, MBD5, KANSL1, USP9X, HNRNPR, CCDC47, ATP6V1E1, DPYSL5, NDN, NIPBL, FBN1, KDM3B, TAF1, SMARCA2, COG6, HNRNPK, SPEN, SNRPN, NRCAM, LUZP1, SLC35A3, ANKRD11, UBA2, PIK3CA, GNPTAB, ZBTB20, KDM6A, EXTL3, IPO8, RNF13, ATP1A3, PPP2R1A, EP300, WDR19, HIVEP2, UBE4B, HDAC8, MARK2, ARSB, ATR, TRAPPC11, ATP6V1A, SMC3, HERC2, BRD4, OCA2, ACVR1, NGLY1, EXT1, PHIP, TRPS1
HP:0002020	Gastroesophageal reflux	183	0.05052457205963556	1.8989125659493684	1.465275416526632e-19	3.966654792055122e-17	16.40157559343284	1.5073288209809464e-15	RARS2, CYFIP2, KCNQ3, SYT1, DYRK1A, WDR26, GCLC, HNRNPH1, MEIS2, NRXN1, DPYSL5, POLR2A, SLC12A2, PAK1, NIPBL, YWHAG, PIGN, KMT2A, ALMS1, SYNJ1, SEC23A, WAC, EXT2, ASXL1, PPP3CA, GLRB, SPTLC2, MAPK1, KDM6A, GRIA1, HIVEP2, MYO9A, ATL1, EIF4H, TSPYL1, MARK2, NEDD4L, PLCH1, PI4KA, FOXG1, NALCN, MAP1B, ELP1, SUCLA2, PSAP, GTF2I, MBD5, FGF12, ARID2, USP9X, MT-ATP6, PARN, CAMTA1, DST, ATAD1, ORC4, ATP11A, SEC63, NUP214, MAPK8IP3, HNRNPK, ARNT2, KIAA0319L, LUZP1, SPOP, ALG9, ARFGEF2, STAG2, CELF2, CACNA1A, ADNP, SNAP25, MECP2, NRCAM, CDK19, KCNH1, EP300, SCN8A, JMJD1C, TSEN2, FOXP2, SV2A, WNK1, GABRA5, OCRL, DCTN4, CDON, NEXMIF, SUPT16H, SMC3, CDKL5, ATP6V1A, SLC9A6, STAG1, BRD4, SPTLC1, GRB10, ATP9A, SLC1A2, PHIP, ATP6V0A1, RERE, NECAP1, AFF4, IQSEC2, ARF1, SCN1A, FARSB, DHX9, EDEM3, HCN1, ITPR1, ZBTB7A, CSPP1, ITCH, KAT6A, CFTR, FBN1, ATP6V1B2, ADAR, CNKSR2, SMARCA2, TAF1, SPTAN1, KAT6B, SEMA3E, DNAAF4, GABRB2, LRPPRC, VPS35L, ATP1A3, KCNB1, SON, CLCN4, KMT2C, UBE4B, GABRG2, CACNA1B, MAP3K7, DNM1, SMAD2, CDK13, ASPH, GP1BB, SCN3A, RAD21, FLCN, RETREG1, CREBBP, CACNA2D1, CCDC47, GPHN, SYNGAP1, FBXW7, CAMK2B, TMTC3, FBXL4, RPL10, SPEN, SMC5, KIF1A, AGO2, SEC31A, WWOX, ATRX, FBXO11, AP3B1, IPO8, SUCLG1, NSD1, HDAC8, POGZ, HECTD4, SCN9A, ZSWIM6, CLTC, MED12L, AGO1, BRAF, NTRK2, ABL1, GABRA2, KIAA0586
HP:0001272	Cerebellar atrophy	141	0.038928768636112644	1.8954537088164918	2.9254847815748455e-15	4.012594926408058e-13	12.396574680312291	3.009446194806044e-11	RARS2, CYFIP2, PCLO, GRM7, TTBK2, ATP6AP2, MFF, PNPT1, TUBB4A, ATP8A2, TMX2, PIGN, ATXN2, GAD1, ABAT, HEXB, BCAS3, EEF2, SACS, GRIK2, PLCH1, PDYN, PI4KA, KCNMA1, ATXN1, ATXN10, NDUFS1, NALCN, ANO10, SIL1, FGF12, MT-ATP6, KCND3, FTH1, ATXN3, DMXL2, PRNP, NUP214, MAPK8IP3, CCDC88A, RUBCN, SETX, LYST, PIGK, HERC1, ALG9, SLC25A46, NDUFS4, CACNA1A, SLC44A1, NDUFA9, MED27, GNAO1, OPA1, SCN8A, ELOVL4, TSEN2, VPS41, APTX, NPTX1, CDKL5, ATP6V1A, SLC9A6, ATP5F1A, ALDH5A1, HK1, SLC13A3, PLD3, NGLY1, SCARB2, ATP6V0A1, PMM2, SCN1A, DHX9, SLC33A1, FAT2, TBCK, MFSD8, ITPR1, FGF14, TAF1, RELN, SPTAN1, AP4S1, ACBD6, ATP1A3, SNX14, TRAPPC6B, MRE11, COX4I1, VPS53, CDC42, PRKCG, TTC19, TRAPPC11, GRIA2, CRPPA, NFASC, ZFHX3, PRRT2, STT3B, SYNE1, AGTPBP1, SYT14, CAMK2B, FRRS1L, FBXL4, COG6, RBL2, ATCAY, ATXN7, KIF1A, COG5, VPS50, DAB1, HSD17B4, CASK, MT-ATP8, FAR1, WWOX, DHX30, LNPK, HTT, UCHL1, RNF13, GDAP2, VPS13D, SUMF1, SCN2A, AFG3L2, PPP2R2B, POGZ, NARS2, CAPRIN1, FKTN, DNM1L, GRID2, REPS1, SPART, GLS, KCTD7
HP:0002360	Sleep disturbance	76	0.020982882385422418	1.8954537088164918	7.285681635392422e-09	4.655143290887071e-07	6.33206694637248	7.494780698328185e-05	RAD21, CHD8, SYT1, IQSEC2, DYRK1A, SUPT16H, MBD5, BSCL2, FIG4, SLC25A13, GRM7, NDN, GPHN, SYNGAP1, VPS35, NF1, WFS1, TAF15, ATAD1, TARDBP, ATXN3, ANK3, DMXL2, NIPBL, PRNP, TSC1, GNAQ, ARNT2, FUS, ATXN2, SNRPN, ALMS1, KMT2A, ATP9A, STAG2, CTNNB1, WAC, ASXL1, GLRB, LRRK2, ADNP, CASK, MECP2, TRIO, GNAO1, SMC3, UBQLN2, TNPO3, TSEN2, SUCLG1, SCN2A, HIBCH, GRIA3, BRAF, UNC13A, AGO1, HDAC8, SNCA, POGZ, ASH1L, GATAD2B, SLC9A6, CDKL5, VPS13A, VAPB, BRD4, OCA2, EPG5, NELFA, NEK1, SPART, ATXN10, DCTN1, PHIP, SLC16A2, GIGYF2
HP:0001513	Obesity	101	0.02788514632799558	1.8954537088164918	2.6874390946998504e-11	2.3038071639314467e-09	8.637553875572333	2.764568596717736e-07	PRKAR1B, BBS9, RPS6KA3, LARS2, ATP6AP2, CUL4B, SECISBP2, ALMS1, WAC, TRAF3IP1, GNAI1, BBS1, UBE3A, KDM6A, EIF4H, PDE4D, SRRM2, OCA2, FHL1, DNMT3A, SETBP1, TRAPPC9, HACE1, GTF2I, PPARG, WDR11, MAPK8IP3, ARNT2, BBS7, FXR1, FOXP1, LUZP1, SETD2, CTNNB1, CPE, ADNP, MECP2, EP300, MEF2A, PTEN, JMJD1C, SEMA3A, DCC, SUPT16H, MIA3, UBE3C, BBS5, PHIP, TTC8, RERE, AFF4, IQSEC2, CNTNAP2, NDN, SDCCAG8, SMAD4, TAF1, CEP290, SH3KBP1, VPS13B, ARL13B, SCAPER, ACBD6, TRIP12, PIK3CA, NPHP1, COPB1, UBE4B, BBS2, PHF21A, GP1BB, EXOC6B, POU3F4, DPYD, CHD8, DDX6, SYNE1, CREBBP, SPTBN1, PGM2L1, ARL6, RBMX, STX16, SPEN, SNRPN, GABRA3, MTFMT, ATRX, FBXO11, TCF20, KIDINS220, TOGARAM1, NTRK2, POGZ, HECTD4, BRAF, TMEM67, PRORP, WDPCP, HERC2, SCLT1
HP:0000316	Hypertelorism	291	0.08034235229155164	1.8889624289917781	3.202199579137115e-30	2.1960684713722333e-27	26.658354123112865	3.29410270705835e-26	BBS9, RPL15, PDZD8, CDC42BPB, EPB41L1, RPS6KA3, ACTB, THOC2, YWHAE, APC, PEX1, LMBR1, WDR26, SEL1L, CPLANE1, ATP6V1E1, DPYSL5, P4HA1, POLR2A, ADK, WDR37, COG3, SLC25A12, MTOR, KDM5A, KIF21A, PIGN, UBAP2L, RSRC1, KMT2A, GAD1, RUSC2, INTS8, SEC23A, WAC, EXT2, ASXL1, PPP3CA, BBS1, RPS19, THRA, RUNX2, PRORP, BCAS3, MAPK1, CHSY1, KDM6A, EXTL3, CIT, PPP2R1A, DEPDC5, BMPR1A, HIVEP2, PDE4D, DICER1, CDH2, MARK2, FRA10AC1, FRAS1, MACF1, PPP2CA, TLK2, MED13, ADAMTS3, KCNMA1, EPG5, NELFA, PRKG1, BPTF, NALCN, DNMT3A, SETBP1, TBL1XR1, TRAPPC9, PSMD12, PPP1R21, HACE1, GLB1, CNTN1, OGT, PRKACB, RPL9, MBD5, FIG4, SIK3, FRYL, CAMTA1, NF1, TASP1, FANCL, PEX3, WDR11, MAPK8IP3, ZMYM2, BBS7, STRADA, CC2D2A, FOXP1, SPOP, ALG9, HERC1, SETD2, ANKH, TCTN1, IL6ST, ADNP, CDK19, MAPRE2, NRCAM, KIAA0586, KCNH1, ZBTB20, MED27, ACTG1, TBC1D32, PTEN, EP300, SCYL2, TUBA1A, JMJD1C, FOXP2, SLC12A6, RPL18, PPP1R12A, NUP133, EXOC2, TENM3, SUPT16H, SPRED1, CTNND1, SPART, ATP6V1A, GTF2E2, BRD4, GRIP1, BBS5, SOS1, NGLY1, MICU1, ASCC3, PHIP, TTC8, CDH11, AUTS2, CLCN3, RERE, AFF4, IQSEC2, PMM2, GLDN, SCN1A, DHX9, EDEM3, CNTNAP2, ASXL2, RPS20, PTPN11, PUM1, TBCK, CCND2, SDCCAG8, CSPP1, RB1, JARID2, ITCH, SMAD4, FBN1, ATP6V1B2, SMARCA2, RELN, ZNF462, CEP290, FILIP1, KAT6B, SEMA3E, TAF1, AP4S1, SHOC2, DSE, SCAPER, AKT3, ZNF292, TRIM33, RPL5, RASA2, INTU, BRCC3, PRKAR1A, ANKRD11, TRIP12, RLIM, WDR35, PIK3CA, TUBB, LRPPRC, CEP120, VPS35L, GNPTAB, ARID1B, HNRNPC, NPHP1, TCF12, PTDSS1, CDC42, SPECC1L, NUP88, ZMYND11, CHD4, MAP3K7, ASH1L, KRAS, SOS2, BBS2, SMAD2, CDK13, ASPH, BMPER, GP1BB, RPGRIP1L, NEK1, MAP2K1, DPYD, PHACTR1, NFASC, RAD21, CHD8, FLCN, SMCHD1, DDX6, NBAS, NCDN, CREBBP, HNRNPU, SPTBN1, RPS27, IL1RAPL1, TRRAP, CCDC47, ARL6, TRIM37, TAOK1, FBXL4, SUZ12, RNF2, RBL2, HUWE1, SPEN, PDHX, SNRPN, HSD17B4, BCL11B, FAR1, CASK, AP1G1, ATRX, ALG13, FBXO11, TRIO, PAFAH1B1, IPO8, MED13L, KCNN3, MCTP2, TOGARAM1, NSD1, CSNK2A1, B3GLCT, HDAC8, POGZ, HECTD4, BRAF, ZSWIM6, MED12L, TMEM67, CAPRIN1, HS2ST1, GATAD2B, WDPCP, GREB1L, DDX3X, PPP1CB, FANCM, LEMD3, ABL1, PIK3R1, ANAPC7, RPS28, CTNND2, NEDD4L, KDM1A, SCLT1
HP:0001265	Hyporeflexia	127	0.03506350082827167	1.8855557782221497	9.822106639402626e-14	1.1887060117592332e-11	10.924925540888346	1.0104001099953482e-09	RAB7A, CYFIP2, NEFL, PEX1, SLC35A1, DOCK3, ATP1A1, ATP6AP2, PNPT1, GDAP1, YWHAG, PIGN, UBAP2L, DMD, ATXN2, SYNJ1, PPP3CA, MT-ND1, EXTL3, MYO9A, TSPYL1, NDUFAF2, FHL1, FOXG1, ATXN1, ATXN10, ELP1, SUCLA2, SIL1, PSAP, PPP1R21, FIG4, FGF12, MT-ATP6, KCND3, PARN, TPI1, TARDBP, DNAJC6, RUBCN, FUS, SETX, LYST, GBF1, SLC25A46, CELF2, NDUFS4, HMGCR, CACNA1A, SNAP25, NDUFA9, CDK19, SCN8A, ELOVL4, DGUOK, WNK1, GABRA5, APTX, VAPB, ATP6V1A, GTF2E2, ALDH5A1, HK1, SPTLC1, SLC1A2, NGLY1, NECAP1, IQSEC2, PMM2, SCN1A, HCN1, CNTNAP2, MT-ND3, PUM1, TBCK, DCAF8, FBN1, ATP6V1B2, MT-ND2, CNKSR2, GABRB2, GNPTAB, ATP1A3, SNX14, KCNB1, MRE11, GABRG2, TRAPPC11, CACNA1B, DYNC1H1, KIF1B, DNM1, VPS13A, CRPPA, NFASC, SCN3A, ZFHX3, B4GAT1, SYNE1, RETREG1, CACNA2D1, AGTPBP1, VRK1, CCDC47, SYNGAP1, TAOK1, STX16, MT-ND5, SNRPN, KIF1A, GABRA3, HSD17B4, WWOX, DHX30, MT-ND4, LPIN1, NTRK2, GRIA3, SCN9A, ZSWIM6, CLTC, NARS2, HNRNPDL, SBF2, FKTN, GABRA2, KIAA0586
HP:0002194	Delayed gross motor development	62	0.017117614577581448	1.885317592726564	3.143739196533855e-07	1.4972057923492485e-05	4.824718501367628	0.0032339645114743765	CLCN3, SUCLA2, SYNE1, TMEM63C, PHKB, FIG4, CNTNAP2, TRRAP, ADCY5, ATP1A1, ITPR1, FNIP1, EIF4A2, ASCC3, KCNA4, CHKA, CTNNA2, TMTC3, TAF1, CDC40, RUBCN, KIF21A, RBPJ, DMD, FOXP1, KMT2A, SELENOI, DSE, LNPK, MECP2, CAMK2A, BCAS3, CIT, GRIA1, EP300, KIDINS220, PPP2R1A, PTEN, SNX14, TUBA1A, HNRNPC, NPHP1, TAMM41, TNRC6B, TRAPPC6B, KMT2C, POGZ, SUPT16H, CDH2, SMC3, PAK3, CDKL5, AMPD2, SLC9A6, PI4KA, MED13, FRMPD4, CWC27, MBTPS1, GLS, NEDD4L, NUBPL
HP:0000431	Wide nasal bridge	171	0.04721148536720044	1.8844336291140702	5.199256064451139e-18	1.1142655653126846e-15	14.953011290486396	5.348474713500887e-14	RPL15, ACTB, PEX1, GABBR1, HNRNPR, DPYSL5, OPHN1, RALA, DIS3L2, PIGN, UBAP2L, IFT122, RSRC1, CHN1, KMT2A, GAD1, SEC23A, WAC, ASXL1, RPS19, RUNX2, BCAS3, MAPK1, KDM6A, HIVEP2, RAB18, EIF4H, PDE4D, XRCC4, MARK2, FRAS1, MED13, ADAMTS3, KCNMA1, FRMPD4, NELFA, BPTF, NALCN, RFX7, TRAPPC9, PSMD12, PPP1R21, RPL9, GTF2I, TPR, USP9X, PURA, TASP1, FUT8, FANCL, PEX3, HNRNPK, ZMYM2, STRADA, LUZP1, SETD2, STAG2, ANKH, CTNNB1, ADNP, MAPRE2, MECP2, IGF1R, KCNH1, ZBTB20, EP300, ACTG1, JMJD1C, SLC12A6, RPL18, EXOC2, NEXMIF, SUPT16H, ATP6V1A, AP2M1, ADAMTSL1, GRIP1, IFT57, EXT1, CDH11, AUTS2, RERE, IQSEC2, PIK3C2A, KMT5B, SCN1A, DHX9, CHD2, EDEM3, KANSL1, RPS20, PTPN11, PUM1, TBCK, FBXL3, EIF4A2, RB1, JARID2, FBN1, ATP6V1B2, SMARCA2, RELN, FILIP1, KAT6B, AP4S1, TRIM33, RPL5, PRKAR1A, RLIM, WDR35, AHI1, LRPPRC, SETD5, VPS35L, SNX14, SON, RAB3GAP2, UBE4B, CDC42, SPECC1L, NUP88, MAP3K7, KRAS, CDK13, GP1BB, NEK1, NFASC, RAD21, CHD8, GPC6, SLC4A10, CREBBP, RARB, SPTBN1, RPS27, TRRAP, SYNGAP1, TRIM37, FBXL4, RBL2, RPL10, SPEN, COG5, AGO2, CASK, PBX1, PRKDC, ATRX, FBXO11, AP3B1, TRIO, KCNN3, MED13L, WDR19, TOGARAM1, CSNK2A1, HECTD4, AGO1, ZSWIM6, RAB3GAP1, BRAF, ARID1B, HS2ST1, GATAD2B, DDX3X, ERCC5, PIK3R1, RPS28, CTNND2, KDM1A, TRPS1
HP:0000540	Hypermetropia	80	0.022087244616234125	1.8797888021320581	4.422409137589363e-09	2.916238640921909e-07	6.535176939820837	4.5493322798381774e-05	SYT1, DYRK1A, WDR26, HNRNPR, UBAP2L, RAD50, WAC, HIVEP2, PDE4D, SRRM2, MARK2, SPATA7, SETBP1, MBD5, USP9X, TASP1, HNRNPK, ZMYM2, CTNNB1, ADNP, EP300, RORA, PPP1R12A, ATP6V1A, SOBP, PHIP, CLCN3, YME1L1, IQSEC2, PCYT1A, ROBO1, KANSL1, ATP6AP1, ITPR1, USP45, SMAD4, FBN1, CEP290, SHOC2, ACBD6, WDR35, SON, KMT2C, ATF6, ASH1L, NEK1, YY1, FLCN, ZNF148, DDX6, NBAS, SYNE1, CREBBP, PGM2L1, LMBRD2, CCDC47, TAOK1, HUWE1, RPL10, SNRPN, MADD, IQCB1, BCL11B, PBX1, FBXO11, KIDINS220, MED13L, WDR19, NSD1, ZC4H2, HDAC8, POGZ, MARK3, BRAF, MED12L, CAPRIN1, GATAD2B, FKTN, HERC2, PIK3R1
HP:0001347	Hyperreflexia	203	0.05604638321369409	1.876961477510965	7.239037881015476e-21	2.4822660894002065e-18	17.605151665639816	7.446798268200621e-17	ALS2, RARS2, CYFIP2, PCLO, PGAP1, PEX1, GCLC, GRM7, XPR1, TTBK2, ADCY5, SLC12A2, ATP6AP2, MBOAT7, MFF, TAF15, CHKA, ATP8A2, TMX2, PIGN, ATXN2, GAD1, RUSC2, SYNJ1, ABAT, HEXB, LRRK2, TMEM106B, UBE3A, HPRT1, GLRB, MT-ND1, BCAS3, TFG, CIT, DDHD1, EXTL3, ERLIN1, SACS, ATL1, EIF4H, PDYN, IREB2, PI4KA, FRMPD4, ATXN1, ATXN10, DCTN1, NDUFS1, NALCN, ACSL4, RFX7, ANO10, PSAP, GLB1, KCNT1, GTF2I, FIG4, GFM1, DDHD2, MCCC2, MT-ATP6, KCND3, FTH1, CACNA1E, ZFR, ATAD1, FANCL, HSPD1, ATXN3, PRNP, GNAQ, DNAJC6, CCDC88A, PEX3, TARDBP, DMXL2, NUP214, TRAPPC10, FUS, CC2D2A, SETX, ALG9, SELENOI, SLC25A46, NDUFS4, CACNA1A, SLC20A2, MECP2, GNAO1, OPA1, EP300, UBQLN2, PANK2, ELOVL4, DGUOK, DCC, VAPB, CDKL5, ATP6V1A, AMPD2, SLC9A6, DSTYK, DYNC1I2, SPTLC1, NUBPL, SLC16A2, AUTS2, MCCC1, PMM2, DYM, DHX9, SLC33A1, MT-ND3, UBAC2, ITPR1, TAF2, CTNNA2, MT-ND2, ADAR, SPTAN1, EYA1, AP4S1, SPAST, OSTM1, NT5C2, PRKN, AUH, RLIM, DENND5A, ATP1A3, TRAPPC6B, PRKCG, VPS13C, HIBCH, TTC19, TRAPPC11, TNR, SNCA, KRAS, SLC2A3, DNM1, MAPT, CDK6, RPGRIP1L, NEK1, POU3F4, DPYD, NFASC, VPS37A, SLC4A10, KPNA3, TMEM63C, SYNE1, BSCL2, CREBBP, AGTPBP1, VRK1, CCDC47, JAM3, GPHN, FTL, AP1S2, FBXL4, CYP7B1, RNF2, MT-ND5, HUWE1, SNRPN, ATXN7, KIF1A, SEC31A, CASK, ELP2, WWOX, MT-ND4, ATRX, HTT, TRIO, UCHL1, KIDINS220, GDAP2, VPS13D, NSD1, SCN2A, AFG3L2, GNB1, ZC4H2, UNC13A, GRIA3, HECTD4, PPP2R2B, ANKLE2, RAB3GAP1, NARS2, NTRK2, FANCM, ISCA1, TMEM67, GRID2, PDCD6IP, SPART, STAT4
HP:0000750	Delayed speech and language development	446	0.12313638873550524	1.8758262295831847	8.5674933796381e-46	2.2033451099084283e-42	41.65691747398384	8.813380439633713e-42	PEX1, MEIS2, ADCY5, ADK, NIPBL, CRADD, TUBB4A, YWHAG, GLRA2, HGSNAT, IFT122, TMEM106B, MAPK1, ANKRD17, CIT, EXTL3, CEP295, GRIA1, MYO9A, NME5, MARK2, RPL13, AMMECR1, PPP2CA, FRMPD4, ACVR1, MAP1B, DNMT3A, CHST11, TRAPPC9, PPP1R21, PHKB, ARID2, MT-ATP6, FTH1, SIK3, GNAQ, SLC25A46, BTRC, DCC, NEXMIF, CDKL5, ALDH5A1, STAG1, SOS1, SLC16A2, AUTS2, RERE, NECAP1, ARF1, CHD2, ZBTB7A, SMARCA2, ADAR, ACBD6, AUH, PRKAR1A, TUBB, CEP120, RLIM, NPHP1, MRE11, COPB1, TCF12, GABRG2, HYDIN, SMAD2, DHCR24, PHF21A, MAP2K1, DPYD, SCN3A, YY1, VPS37A, SLC9A7, TMEM63C, BSCL2, HNRNPU, SPTBN1, TRRAP, TMTC3, COG6, RBPJ, KIF1A, ADD3, FAR1, MTFMT, WWOX, LNPK, DHX30, AP1G1, ALG13, FBXO11, WDR19, CSNK2A1, POGZ, CAPRIN1, HS2ST1, LEMD3, CDC73, ACADM, SPART, FBXW11, KDM1A, KIAA0586, GLB1, MANBA, DYRK1A, THOC2, WDR26, ATP6V1E1, SLC12A2, CUL4B, RSRC1, DMD, TMEM38B, RUSC2, SYNJ1, WAC, PPP3CA, UBE3A, RUNX2, CHSY1, PDE4D, GRIK2, SRRM2, XRCC4, TMEM163, FRA10AC1, KCNMA1, LPIN2, NBEA, SETBP1, PSMD12, PRKACB, FIG4, USP9X, DNAH9, PURA, MTAP, PRNP, CC2D2A, SELENOI, SETD2, STAG2, IL6ST, CELF2, CACNA1A, SLC44A1, MED27, SCN8A, LIFR, GABRA5, PAK3, ATP6V1A, BBS5, GRB10, EXT1, CLCN3, CFAP221, IQSEC2, PMM2, SPEF2, EIF4A2, SDCCAG8, TPK1, SMAD4, TAF1, FILIP1, AGPS, SHOC2, NT5C2, INTU, ANKRD11, GNPTAB, LRPPRC, VPS35L, KCNB1, HNRNPC, SPECC1L, CDC42, ZMYND11, ARSB, MAP3K7, TIAM1, KRAS, BMPER, GRIA2, RAD21, CREBBP, LMBRD2, ZNF407, NEK10, FAM20B, FMN2, SNRPN, MADD, BCL11B, FOCAD, BRWD3, TAB2, KIDINS220, NBN, NSD1, SCN2A, GNB1, CNOT1, NTRK2, ZC4H2, ARID1B, CLTC, FKTN, WDPCP, PGK1, ANO5, REPS1, GABRA2, CYFIP2, RPS6KA3, LMBR1, GABBR1, SEL1L, ATP6V0C, ATP6AP2, MED23, COG3, ALMS1, KMT2A, EXT2, TRAF3IP1, GNAI1, BBS1, IFT80, CNNM2, UBE4A, ATG7, RNASET2, PI4KA, TLK2, FOXG1, OTUD7A, IDS, KMT2E, NALCN, RFX7, TBL1XR1, ORC4, ATXN3, ZMYM2, ALG9, ANKH, ADNP, MAPRE2, MECP2, CDK19, ZBTB20, PTEN, RORA, FOXP2, SEMA3A, GAS2, TENM3, SUPT16H, SMC3, BRD4, DLG3, HK1, DYNC1I2, SLC1A2, ATP9A, TTC8, ATP6V0A1, KMT5B, SCN1A, KANSL1, PTPN11, SLC30A9, TBCK, MFSD8, CFAP298, RIC1, FBN1, ANK3, CEP290, DYNC2H1, SPTAN1, ARID1A, SCAPER, ZNF292, DNAAF4, GABRB2, TRIP12, ATP1A3, SNX14, DLG1, TNRC6B, CCDC39, RAB3GAP2, KMT2C, TNR, CACNA1B, ASH1L, SOS2, RPGRIP1L, NEK1, EXOC6B, DDX6, NCDN, SNX10, CACNA2D1, PGM2L1, ARL6, NLGN4X, THRB, SYNGAP1, FBXW4, ZBTB11, FBXW7, TAOK1, AP1S2, CAMK2B, KCNA4, CUL3, RPL10, SGCB, AGO2, UBA2, SUMF1, GRIA3, AGO1, BRAF, MED12L, DYNC2LI1, ZSWIM6, ATM, TMEM67, STIM1, PPP1CB, KCNQ5, HERC2, CWC27, GLS, SCLT1, PRKAR1B, BBS9, PGAP1, ACTB, TTC21B, CPLANE1, RALA, PAK1, AMFR, TSPAN7, KDM3B, GPX4, UBAP2L, STXBP1, SEC23A, KDM6A, HIVEP2, WASHC4, MED13, TNIK, BPTF, TMEM165, ACSL4, HACE1, NAA15, MBD5, FGF12, FRYL, CAMTA1, NF1, RUBCN, BBS7, TRAPPC10, LUZP1, FOXP1, SPOP, SLC17A5, CAMK2A, IGF1R, EP300, TTC5, SPRED1, AP2M1, SOBP, MICU1, ASCC3, NSMCE2, DYM, PCYT1A, HCN1, CNTNAP2, ASXL2, FBXL3, ITPR1, RNPC3, TAF2, CNKSR2, ZNF462, KAT6B, VPS13B, HS6ST2, OSTM1, DSE, CRIPT, WDR35, NEMF, SETD5, CNOT2, PTDSS1, UBE4B, ATR, DYNC1H1, GHR, RIMS2, CDK13, BBS2, DNM1, IFT81, WASF1, GPC6, CHD8, KPNA3, NBAS, KDM5B, LRRC8C, TRIM37, RBMX, HUWE1, SPEN, COG5, PBX1, ELP2, TRIO, TCF20, MCTP2, MED13L, HDAC8, PIK3R1, DNAL1, TANC2, GRID2, NEDD4L, TRPS1
HP:0000278	Retrognathia	110	0.030369961347321922	1.872753664399528	7.376721620391712e-12	6.89857593717905e-10	9.161240550777933	7.588433530896954e-08	BBS9, ACTB, DYRK1A, HNRNPH1, MTM1, DIS3L2, RSRC1, ABAT, ASXL1, PPP3CA, BBS1, RPS19, KDM6A, CEP295, ATG7, FRA10AC1, FHL1, ADAMTS3, YY1AP1, FRMPD4, PRKG1, SETBP1, PSMD12, MBD5, ARID2, FRYL, FUT8, ORC4, WDR11, HNRNPK, CCDC88A, ARNT2, BBS7, FOXP1, ALG9, SETD2, CTNNB1, IGF1R, EP300, ACTG1, SMC3, MIA3, ATP6V1A, GTF2E2, DSTYK, BBS5, TTC8, AUTS2, PMM2, PIK3C2A, GLDN, DHX9, EDEM3, ASXL2, SDCCAG8, WBP11, PREPL, JARID2, SMAD4, FBN1, CEP290, KAT6B, EYA1, SCAPER, RPL5, INTU, BRCC3, WDR35, NPHP1, NUP88, BBS2, SMAD2, DHCR24, ASPH, DPYD, CRPPA, ARIH1, CHD8, SLC4A10, DGCR2, CREBBP, RARB, ARL6, MAPKAPK5, COG6, SUZ12, FTO, SPEN, SNRPN, MADD, COG5, GABRA3, HSD17B4, CASK, UBA2, FBXO11, TRIO, IPO8, NBN, NSD1, ZC4H2, HDAC8, POGZ, HECTD4, ARID1B, HS2ST1, WDPCP, MAMLD1, FBXW11, SCLT1
HP:0000358	Posteriorly rotated ears	164	0.04527885146327996	1.8688641778310904	6.208496416107406e-17	1.1259382630346649e-14	13.94848542188115	6.386680263249689e-13	PRKAR1B, BBS9, C2CD3, ACTB, PEX1, CPLANE1, RALA, NIPBL, KIF21A, DIS3L2, PIGN, UBAP2L, GPX4, TRPS1, RUSC2, WAC, ASXL1, BBS1, MAPK1, KDM6A, RAB18, EIF4H, PDE4D, SRRM2, CDH2, MARK2, FRA10AC1, FRAS1, TLK2, FHL1, NELFA, TMEM165, MAP1B, RFX7, TBL1XR1, PSMD12, GTF2I, ARID2, USP9X, FRYL, CAMTA1, NF1, ORC4, PEX3, ZMYM2, BBS7, CAMKMT, CC2D2A, LUZP1, SPOP, ALG9, HERC1, ANKH, TCTN1, IL6ST, CTNNB1, ADNP, MAPRE2, NRCAM, KIAA0586, KCNH1, EP300, TUBA1A, OCRL, SPRED1, SUPT16H, SMC3, BRD4, GRIP1, BBS5, MBTPS1, SOS1, EXT1, ASCC3, TTC8, CDH11, CLCN3, RERE, AFF4, GLDN, ASXL2, PTPN11, SDCCAG8, PREPL, CSPP1, ITCH, KAT6A, FBN1, SMARCA2, CEP290, KAT6B, MPDZ, SEMA3E, HS6ST2, SHOC2, DSE, SCAPER, RASA2, ANKRD11, TUBB, CEP120, AHI1, NPHP1, RAB3GAP2, UBE4B, CDC42, KCTD1, NUP88, MAP3K7, KRAS, SOS2, BBS2, SMAD2, CDK13, DHCR24, ASPH, RPGRIP1L, MAP2K1, MRPS28, CRPPA, RAD21, YY1, CHD8, B4GAT1, ZNF148, GPC6, SLC4A10, ARL6, TRRAP, PPM1B, CEP57, SUZ12, HUWE1, SPEN, COG5, BCL11B, DHX30, AP1G1, ATRX, FBXO11, AP3B1, TCF20, IPO8, TOGARAM1, NSD1, B3GLCT, FRMD4A, GNB1, ZC4H2, HDAC8, POGZ, BRAF, TMEM67, ARID1B, RAB3GAP1, HS2ST1, WDPCP, FKTN, PPP1CB, ABL1, RPS28, CTNND2, UNC80, SCLT1
