GO:0005856	cytoskeleton	197	0.07629744384198296	1.9328685773302352	9.003733915608865e-21	1.134470473366717e-18	17.945206802926492	1.7017057100500756e-17	PPP1R12B, KRIT1, ACTR3, KIF5C, PCLO, CDC42BPB, SNTG1, EPB41L1, DYRK1A, TRIP11, APC, DNM3, ARHGAP21, RDX, RAPH1, DGKG, JMY, ACTN2, TUBB3, KALRN, CLU, EML1, CTNNA1, KIF21A, KAZN, DMD, SEPTIN2, MAP9, LRRK2, SGCZ, BCAS3, MAPK1, CCDC6, SEPTIN7, LRRFIP1, SHTN1, PDE4D, MARK2, EML5, TENM1, MACF1, CCSER2, TLK2, EVL, TNIK, ABI1, FGD4, AMBRA1, SPATA7, MAP1A, PARD3, PIAS1, KIF3A, MAP1B, FRMD5, TMOD2, FER, MYCBP2, HOOK3, PRKCE, WIPF2, BAIAP2, MAP2, ABL2, EPB41L3, DST, TBCA, GABARAP, EML4, KLHL2, IFT88, TMSB4X, ADD1, ABI2, ARFGEF2, MICAL3, PDE4DIP, ENAH, CTNNB1, PCM1, MAPRE2, SNAP25, TRIM9, PTPN4, CLIP1, UBR4, GRIN2B, MARK1, ARHGAP26, FARP1, MARCKS, FNBP1L, MAP7, DPYSL2, CALD1, DYNC1I2, KIF16B, FRMD4B, DAPK1, MAP6, MTUS2, RAC1, AUTS2, CCDC146, PEAK1, PKN2, KANK1, SEPTIN11, CAPZB, CYLD, SLC30A9, AKAP9, CLASP2, PREPL, CDC42SE2, NAV1, CTNNA2, ANK3, KLHL3, PTK2, PKP4, SPTAN1, SH3KBP1, SGCD, SPTBN4, ACTR2, ARL13B, ROCK1, WASF3, KATNAL1, BICD1, CAMSAP2, LRPPRC, SSH2, KIF13B, PTPN13, COBL, CORO2B, ROCK2, CDC42BPA, SYBU, SPECC1L, ABLIM1, INVS, SNCA, KIF1B, MAP4, PALLD, CAPZA1, LRRC49, ACTN1, WASF1, MPRIP, EPB41L4B, APPBP2, ARHGAP6, SYNE1, TTC28, ERC2, SPTBN1, RIPOR2, UTRN, PPP1R9A, TTC17, GPHN, EPB41L2, MTSS1, ACTR3B, FMN2, SPIRE1, ATXN7, KIF1A, CLASP1, EML6, SORBS1, ADD3, ANK2, PAFAH1B1, ADD2, TTLL11, CARMIL1, TOGARAM1, FRMD4A, PPP2R2B, DCLK2, EPB41, EPB41L4A, TPM1, SGCE, SLAIN1, STIM1, SIPA1L1, ABL1, KIF5B, DYNC1LI2, WASL, CTNNA3
GO:0005874	microtubule	85	0.03292021688613478	1.8729966491348948	7.604047095857347e-09	3.9921247253251067e-07	6.398795898578488	1.4371649011170386e-05	KIF5C, CNP, DYRK1A, APC, DNM3, KIF13A, TUBB3, EML1, DNAH6, KIF21A, SYNJ1, MAP9, SHTN1, NIN, EML5, MACF1, STAU2, MAP1A, KIF3A, MAP1B, HOOK3, TTLL5, BAIAP2, MAP2, DST, TBCA, DYNC1I1, GABARAP, EML4, LUZP1, MAPRE2, OPA1, CLIP1, NAV3, MAP7, DPYSL2, DYNC1I2, KIF16B, PCNT, MTUS2, MAP6, KIF2A, KANSL1, CYLD, CLASP2, CSPP1, NAV1, DYNC2H1, HSPH1, ZNF207, CCDC66, KATNAL1, IQGAP1, CAMSAP2, LRPPRC, DLG1, KIF13B, SYBU, INVS, KIF1B, DNM1, MAP4, MTUS1, LRRC49, MAP2K1, CEP170, TUBGCP3, APPBP2, CEP57, KIF1A, CLASP1, EML6, TTLL7, PAFAH1B1, FGF13, TBCD, FIGN, TTLL11, TOGARAM1, DYNC2LI1, INO80, STIM1, DNM1L, KIF5B, DYNC1LI2
GO:0015629	actin cytoskeleton	60	0.023237800154918668	1.8695536405886908	1.3929581100595747e-06	4.701233621451064e-05	4.327788166598168	0.002632690828012596	AUTS2, WASF1, ACTR3, FER, MPRIP, ABLIM2, PEAK1, ARHGAP6, MYRIP, CAPZB, DHX9, MYO5A, TTC17, ARHGAP21, PPP1R9A, KALRN, BAIAP2, ACTN2, OPHN1, ABL2, DST, GABARAP, CTNNA2, MTSS1, CTNNA1, KLHL2, DMD, FMN2, ACTR3B, ACTN1, ACTR2, LUZP1, MYO6, CASK, DGKH, LIMCH1, IQGAP1, PRKRIP1, SEPTIN7, ARHGAP35, HNRNPC, ABLIM1, CORO2B, PPP1R12A, SPECC1L, CAPZA2, SNCA, MARCKS, SIPA1L1, LMO7, MACF1, ABL1, CALD1, WASL, PALLD, AKAP13, ADAM17, CAPZA1, SORBS2, DAPK1
GO:0005769	early endosome	77	0.029821843532145623	1.8612445132971858	5.1240650748703225e-08	2.4211207478762276e-06	5.615983550571213	9.68448299150491e-05	EPS15, CCDC93, ZFYVE16, UVRAG, LRP1, SGK3, RASGEF1B, PICALM, MAPK1, GRIA1, WASHC4, APBB2, MVB12B, WIPF3, ATP11B, ZFYVE9, PPP1R21, SH3GL3, INPP5F, TF, ATP11A, KIAA0319, SORT1, EEA1, NSG2, HMGB1, VPS41, DIAPH2, SNX27, LRP6, ECPAS, TRAK2, KIF16B, ATP9A, CLCN3, MYO5A, CNTNAP2, TBCK, ITCH, STX7, MAPKAP1, PTPN1, RAPGEF1, NUMB, ASTN2, RAB1A, RABGAP1L, VPS8, SLC2A13, ANKFY1, SLC9A9, SORL1, SH3GL2, SNX13, RAP1A, MAP2K1, TRAK1, RPS6KC1, RABGEF1, CHMP3, APOE, USP10, RABEP1, PSEN1, STX8, APP, SNX1, AP1G1, HTT, AP3B1, ANK2, AP3S1, DNAJC13, NTRK2, COMMD1, WDFY2, LMTK2
GO:0048471	perinuclear region of cytoplasm	160	0.061967467079783116	1.807764804497469	3.914948804558274e-14	3.6996266203075685e-12	11.431842104290444	7.399253240615138e-11	GALNT2, CYFIP2, ANKRD13C, APC, DNM3, MEIS2, VAMP2, CLU, PTPRM, EML1, USO1, MTDH, GALNT1, EXOC6, RAB3C, ATXN2, RAB40B, SYNJ1, SEC23A, ACSL3, PICALM, FAF1, SHTN1, SH3RF1, DICER1, VAPA, WDR44, ATP9B, TENM1, SERINC5, NDFIP2, TLK2, AMBRA1, CCNT2, CYB5R4, CALN1, EPG5, BPTF, MAP1B, APBA1, MYRIP, PRKCE, HMGCLL1, MTPN, ARMH3, TF, DYNC1I1, MAPK8IP3, UBR5, YTHDC2, TPD52, MYO6, SORT1, ARFGEF2, CTNNB1, CRBN, PRKD1, CDK19, PAK2, LAMP2, SNAP25, FBXW8, PRKAR2B, PTGDS, PTK2B, RAPGEF2, PUM2, KLHL7, HSP90B1, ABCA1, MAP7, FAM168B, CERT1, ATP9A, SORBS2, EXOC1, MAP6, ATP6V0A1, PPP1R16B, PKN2, PLCG2, MAP3K4, LNPEP, CYLD, UBQLN1, ITPR1, AFTPH, STX7, MAPKAP1, PKP4, PTK2, NDFIP1, TRPC4AP, TPD52L1, PRKN, RASA2, PIK3CA, BICD1, FYN, LRPPRC, KCNB1, DLG1, VPS54, TNKS2, COBL, VPS53, SPAG9, AKAP6, FBXL5, SNCA, PTPRR, MAGI2, CNTRL, SH3GL2, ARFGEF1, PATJ, ARF3, USP33, LIMS1, RAP1A, MAP2K1, HEATR5B, DDX6, DAAM1, RBM4, SYNRG, TRIM37, TAOK1, RAB10, ZDHHC20, TRAPPC12, STX16, FMN2, SPIRE1, KIF1A, STX8, DAB1, VPS50, SEC31A, APP, EGFR, CTIF, AP1G1, MMD2, SLC1A3, HTT, PAFAH1B1, UPF2, CPEB4, NTRK2, VTI1A, SLK, SBF2, ABL1, PIK3R1, KIF5B, DNM1L, PRKCA, CCAR1, LMTK2
GO:0005794	Golgi apparatus	249	0.09643687064291247	1.7942310639217933	3.1132901460101344e-21	4.2029416971136814e-19	18.376446634452673	5.884118375959154e-18	ASAP1, GALNT2, CUX1, GOLGB1, SYT1, GRB2, TRIP11, STX12, SLC35A1, KIFAP3, CSGALNACT1, ZDHHC17, RAB2A, ARHGAP21, TM9SF2, DOP1A, CLU, RNF115, MON2, BIRC6, CHPT1, SEC14L1, ATP8A2, USO1, GALNT1, HS6ST3, ATXN2, GALNT18, EXT2, ACSL3, LRRK2, CNST, PICALM, ELMOD1, GOSR1, CCNI, ZDHHC14, MAPK1, FUT9, LARGE1, SH3RF1, RTN3, ATL1, PDXDC1, LGI1, WDR44, ATP9B, RELCH, TENM1, SPPL3, NDFIP2, MACF1, SERINC5, TMEM130, MOSMO, FGD4, CALN1, APBB2, PRKG1, GLCE, CPQ, TBC1D5, ATP11B, SORCS1, RAF1, CHST11, UNC13B, USP32, TRAPPC9, APBA1, OLFM3, ATP2C1, HOOK3, PRKCE, SGSM1, ARMH3, FUT8, TVP23C, GABARAP, WDR11, GNAQ, PRNP, MAPK8IP3, GLG1, GALNTL6, RAP2A, MAN1A1, CCDC88A, KIAA0319L, TRAPPC10, STRN3, CAMKMT, GBF1, MYO6, NAPG, SORT1, HERC1, ARFGEF2, PDE4DIP, CPE, SELENOI, OSBPL9, PRKD1, NSG2, ST8SIA3, CCDC91, JAKMIP2, FBXW8, PTGDS, GALNT13, RNF24, SNX9, GALNT11, VPS41, NUCB2, CASD1, ABCA1, ATP8A1, LRP6, UST, TENM2, MBTPS1, ATP9A, CERT1, MGAT5, EXT1, RASGRP1, MAP6, NMNAT2, TMEM30A, TRAPPC8, CLCN3, VPS45, PIK3C2A, DYM, RNF144A, PDE3B, CNTNAP2, ARFIP1, AKAP9, SPEF2, SLC39A11, CLASP2, PREPL, AFTPH, MAPKAP1, ANK3, TPST1, DYNC2H1, VPS13B, HS6ST2, GOLGA8A, DSE, RAB6A, NDFIP1, PRKN, SIPA1L3, BICD1, DENND5A, RAB11A, CLVS1, CAMSAP2, GNPTAB, ATP1A3, VPS54, DLG1, RAB1A, TBC1D4, RABGAP1L, SLC2A13, ATF6, TBC1D1, GALNT17, VPS53, ZDHHC21, GGA2, DENND4C, NLGN1, TBC1D22A, ARFGEF1, SORL1, USP33, COPA, ARF3, MTUS1, MAP2K1, MAN2A1, VPS13A, HEATR5B, GIGYF2, TNKS, MAN1A2, PKD2, B4GALT5, TTC3, SLC9A7, SYNE1, RICTOR, SYT11, FAIM2, MPHOSPH9, SYNRG, APOE, CLEC16A, CEP57, ARHGAP32, PSEN1, RAB10, CUL3, ZDHHC20, TRAPPC12, OCIAD1, CHSY3, PLEKHM3, STX16, CLVS2, AGBL4, PACS1, COG5, CLASP1, ADAM10, APP, FNDC3A, OPRM1, EGFR, LRBA, WWOX, AP1G1, GOLGA4, HTT, GALNT7, AP3B1, DOP1B, GCC2, SNX1, NDST3, PITPNB, AP3S1, VTI1A, RAB3GAP1, DYNC2LI1, SGCE, HS2ST1, SCAMP1, DNM1L, NEDD4L, SPINT2, CCAR1, LMTK2
GO:0000139	Golgi membrane	152	0.05886909372579396	1.7149474602212904	1.2360667831584219e-11	8.985254692959297e-10	9.046469608017544	2.3361662201694174e-08	ASAP1, GALNT2, ST3GAL5, CUX1, SCFD1, GOLGB1, TRIP11, STX12, SLC35A1, CSGALNACT1, ZDHHC17, RAB2A, ARHGAP21, KIF13A, ATP6V0C, DOP1A, CHPT1, USO1, ATP8A2, SGMS1, GALNT1, RAP1GAP, GALNT18, SEC23A, EXT2, LRRK2, SGCZ, GOSR1, LARGE1, MGAT4A, FUT9, RTN3, ACER3, ATL1, VAPA, NDFIP2, TMEM130, GLCE, ST6GALNAC3, CHST11, USP32, HACE1, ATP2C1, FIG4, ARMH3, FUT8, TVP23C, GABARAP, MAPK8IP3, GLG1, GALNTL6, MAN1A1, KIAA0319L, GAD2, GBF1, ARFGEF2, MGAT4C, ST8SIA3, GALNT13, RNF24, ABCA5, STX18, GALNT11, CASD1, ATP6V1A, LDLRAD4, UST, MBTPS1, SH3GLB1, SCARB2, MGAT5, EXT1, RASGRP1, NMNAT2, CLCN3, ST3GAL3, VPS45, ERC1, ARFIP1, MAPKAP1, RIC1, SAMD8, TPST1, SGCD, HS6ST2, VPS13B, ATP6V1H, DSE, C1GALT1, RAB6A, NDFIP1, ROCK1, PRKN, PJA2, ST8SIA1, DENND5A, GNPTAB, RAB11A, RNF175, TNKS2, RAB1A, HS3ST5, ATF6, SYBU, GALNT17, ZDHHC21, ARFGEF1, SORL1, SH3GL2, COPA, ADAM17, ARF3, PIKFYVE, CHST15, MAN2A1, TNKS, MAN1A2, B4GALT5, SLC9A7, FAIM2, MPHOSPH9, COP1, ARHGAP32, PSEN1, COG6, RAB10, ZDHHC20, HUWE1, CD59, CHSY3, STX16, COG5, ADAM10, FNDC3A, EGFR, AP1G1, MMD2, GOLGA4, GALNT7, DOP1B, NDST3, PITPNB, ST6GALNAC5, PDGFC, RIC3, VTI1A, SGCE, HS2ST1, PRKCI, NCAM1, CYTH1, ICA1
GO:0031410	cytoplasmic vesicle	187	0.07242447714949651	1.642791334109064	2.9191696097654133e-12	2.398795896720274e-10	9.620006702719563	5.517230562456631e-09	RAB7A, CD46, SYT1, STX12, STXBP5, ZDHHC17, AGFG1, RAB2A, ARHGAP21, JMY, VAMP2, ATP6V0C, MFF, CLU, UVRAG, ASTN1, SNX24, LAMP5, ATP6V1C1, SYNPR, SEC23A, SGK3, BTBD8, LRRK2, CNST, PICALM, AP2B1, GPRC5B, ITPR2, IQSEC1, SRGAP2, UQCC1, PIK3C3, AMBRA1, TRPM7, HERC3, TBC1D5, GABRB3, VEZT, MYRIP, PAM, SGSM1, PDPK1, TF, DST, GABARAP, WDR11, DMXL2, DTNBP1, DNAJC6, MAPK8IP3, KIAA0319, USP14, CCDC88A, MAN1A1, SYN3, KIAA0319L, GAD2, MYO6, SORT1, ARFGEF2, PCSK2, CPE, DENND1B, EEA1, LAMP2, SLC4A8, NSG2, TAX1BP1, TRIM9, CLIP1, SCN8A, OSBP2, SNX9, VPS41, SPRED1, ATP6V1A, SLC35F1, CADPS, FNBP1L, ATP8A1, LRP6, ATP2B1, GRIP1, ECPAS, TRAK2, CHIC1, KIF16B, TMEM30A, SH3GLB1, ULK2, MAP6, NMNAT2, ATP6V0A1, RAC1, TBC1D12, CLCN3, VPS45, PIK3C2A, APPL2, RNF144A, LMBRD1, MYO5A, LNPEP, SLC30A9, UBQLN1, ITPR1, PTPRN2, AFTPH, ITCH, CEP290, SH3KBP1, SERPINI1, EPN2, VPS13B, ATP6V1H, DSE, RAB6A, SV2C, GABRB2, BICD1, RAB11A, CLVS1, NUMB, ASTN2, SSH2, RABGAP1L, SPAG9, SYBU, GABRG2, DENND4C, DENND1A, SLC9A9, KIF1B, DNM1, SORL1, PENK, COPA, DGKD, VPS13A, HEATR5B, SPG11, PKD2, TRAK1, SV2B, SEC24B, SYT11, ARFGEF3, CHMP3, DGKI, SYNRG, VOPP1, C2CD5, SORCS2, RABEP1, CAMKV, PSEN1, RAB10, RNF216, FMN2, SPIRE1, CLVS2, KIF1A, ADAM10, SEC31A, APP, FNDC3A, AP1G1, SLC1A3, HTT, AP3B1, ADD2, MCTP1, DENND4A, ITSN1, AP3S1, VTI1A, CLTC, ATM, MIB1, DNM1L, WASL, GRIN2A, COMMD1, PIKFYVE, GABRA2, ICA1
GO:0032991	protein-containing complex	149	0.05770720371804802	1.5996467937778156	3.440713816378521e-09	1.912632092045707e-07	6.718368561473405	6.502949112955404e-06	KRIT1, SEM1, CALM2, GUCY1B1, PLCB1, CALM1, DPYSL5, MAP3K5, MGA, MFF, CLU, PAK1, UVRAG, DMD, MIER1, CNST, DGKH, RBM39, LARGE1, GRIA1, UBE2D2, STAU2, FRMPD4, TANK, ATXN1, KMT2E, FER, TFCP2, ZFYVE9, CALM3, OGT, CCP110, PARD3B, SMARCC1, ADGRV1, ATP2B4, XPO1, NUP58, CRYBG3, PEX3, CBX5, ARHGEF7, MAGED1, XRCC5, STRN3, CAMKMT, UBR5, ATG5, MYSM1, KHDRBS3, SUGT1, RYR2, CTNNB1, KAT2B, MBD2, OSBPL9, PCM1, EP300, CXADR, SSX2IP, RAPGEF2, WNK1, KHDRBS1, HSP90B1, BCL2, MAPK6, SSBP3, GRB10, SH3GLB1, PKN2, SASH1, DHX9, EIF3E, ERCC6L2, PTPN11, URI1, NR3C1, UBQLN1, ITPR1, ITCH, AKAP10, HIF1A, SMAD4, RIC1, HIPK2, CEP290, EYA1, CEP97, PXK, HSPH1, PTPN1, PRKN, SMAD1, PRKAR1A, RBBP6, RAB11A, CAB39, HNRNPC, CRB1, XPO6, RAB3GAP2, CKAP5, TJP1, NCOA1, AKAP6, SNCA, CHD4, MAGI2, SMAD2, RNF111, GIGYF2, WASF1, CHD8, STT3B, FOXO3, NCOA2, HNRNPU, SPTBN1, UTRN, DGKI, PDSS2, CDK8, MEF2C, USP10, FBXW7, RABEP1, PSEN1, RBMX, KPNB1, AKAP7, APP, DTNA, TRA2B, EGFR, SNX1, PRKDC, HTT, KIDINS220, MLLT10, EPB41, CLTC, RAB3GAP1, GATAD2B, UGGT2, ABL1, DNM1L, PRKCA, KDM1A, TRPS1
GO:0005654	nucleoplasm	702	0.27188226181254843	1.5515896548327093	1.927079385544535e-39	9.105450096697928e-37	36.04069858148017	3.642180038679171e-36	RNMT, NSD3, GRB2, MTREX, RPTOR, MAML2, CDK12, JMY, NDUFA13, ADK, NFIA, ARPP19, MGA, MCPH1, NIPBL, DROSHA, NAV2, SECISBP2, ERBB4, KAZN, SENP7, NECAB1, BACH2, MIER1, ENSA, ANKRD17, MAPK1, PIAS2, RUNX1T1, BDP1, ANAPC5, CHD6, REV1, NAP1L4, NCOA6, NRG2, TSPYL1, MTA3, AMMECR1, BRWD1, HECTD1, ZC3H13, ANKRD28, DNMT3A, TFCP2, RBFOX3, RGS12, VEZT, SHLD2, RMND5A, ARID2, USP48, MINDY3, ARID4A, UBE2D3, XPO1, CAND1, PPME1, TET2, HNRNPK, XRRA1, SUPT3H, FUS, ADD1, SETX, KDM2A, ZNF655, KHDRBS3, YTHDC2, HDAC4, DCAF6, CTNNB1, BTRC, GTF2F2, NEXMIF, CDKL5, BTAF1, STAG1, POU2F1, SGK1, RAC1, MAX, PPP4R2, PHACTR3, RERE, AFF4, PDS5B, NFKB1, CHD2, PUM1, UTY, SLTM, UBN2, NAF1, DDX46, JARID2, MSH2, KDM4C, ADAR, SMARCA2, CRTC3, TDRD3, SV2C, PIP4K2A, JAK2, TCERG1, PRDM2, PTPN13, TCF12, ANAPC1, BBX, ARIH2, WRN, SMAD2, ANAPC16, PHF21A, MSH3, XRN2, ZFHX3, TCF4, APPBP2, HNRNPA2B1, SREK1, THRAP3, HNRNPU, PSME4, TRRAP, RBM4, EPB41L2, NSD2, PPM1A, KPNB1, HMGN3, RBPJ, HNRNPD, WWOX, ATF2, ATRX, FBXO11, RPS6KA2, SRSF5, CCNY, CSNK2A1, POGZ, SMURF1, NR3C2, LCOR, CCNH, GATAD2B, INO80, RPRD2, CDC73, ZNF609, TLK1, NR2C2, KPNA1, RBFOX1, FBXW11, ZRANB2, NOL4, KDM1A, NUP153, CUX1, NUP98, SHPRH, ZC3H6, NLK, DYRK1A, THOC2, WDR26, APC, CFLAR, HNRNPH1, TAF15, KDM5A, RSF1, KHDRBS2, ESRRG, ANKRD10, WAC, BTBD8, MPHOSPH8, PPP3CA, THRA, CEP350, SRRM2, USP11, TM7SF3, PTMA, IQSEC1, PRKCB, WDR70, CDC14B, MLLT3, SETBP1, ZNF451, PSPC1, RALYL, UBE2W, GTF2I, PRKACB, EP400, SMARCC1, BAIAP2, PCGF5, GIT2, PPHLN1, SOX5, PPP2R2A, ARNT2, LIN52, SLF2, NUCKS1, ABI2, PLEKHA1, SETD2, MNAT1, STAG2, SP3, CELF2, RPS6KA5, MBD2, ARMC8, IBTK, MED27, PTPN4, TAF3, PELI1, USP15, MEF2A, DZIP1, ESF1, GCFC2, UBR4, HMGB1, KLHL7, DHX15, RAD18, MKLN1, MAPK6, ECPAS, CERT1, ELF2, HMBOX1, ARID5B, PTPN2, FBXL17, RCOR3, REV3L, FARSB, CLOCK, URI1, ZNF638, FOXO1, RPAP2, SMAD4, TCF7L2, ONECUT2, TAF1, CDC40, EYA1, PSMD1, ANKRD11, LRPPRC, ZMYND8, HNRNPC, XPO6, ATF6, NCOA1, ZMYND11, PPP2R5C, TIAM1, EPC1, CHD9, NR6A1, TRA2A, ZHX3, MTF2, INTS6, CWF19L2, TOP2B, PHC3, TFDP2, WAPL, ZNF148, ARID4B, U2SURP, NRIP1, USP47, RBM5, PDS5A, SYNE1, COMMD10, CREBBP, CELF1, AGTPBP1, COP1, PBRM1, ZEB2, CPSF6, ATAD2B, NEK11, TASOR2, ZMAT3, SNRPN, CBFA2T2, SH3BGRL2, PGBD5, BCL11B, FIP1L1, PRKDC, NMD3, TP53BP1, MACROD2, TAB2, NBN, LPIN1, NSD1, KPNA4, SCAI, ARID1B, USP37, MXI1, PHC2, PRKCA, COMMD1, ZEB1, TBL1X, PPP1R12B, GUCY1A1, SEM1, RPS6KA3, INPP4A, NCOR1, ZFC3H1, IWS1, CALM1, RPRD1A, SH3D19, PAPOLA, ICE1, CENPP, BICRAL, HNRNPR, MORF4L2, MSRA, YEATS2, AEBP2, DOCK10, POLK, KATNBL1, PLPPR1, KMT2A, PSMD14, UPF3A, RAD50, RPS6KA6, ASXL1, RBM39, PPIG, UBE2D2, FAF1, SPIN1, CENPC, FUBP1, SCAF11, CAMK2D, SF3B1, TLK2, MINDY2, JAZF1, PIAS1, KMT2E, R3HDM2, ELP1, TBL1XR1, ADARB1, SPECC1, PAK5, AHCTF1, SRSF11, OGT, PTPN9, BTBD10, SIMC1, TPR, ZFPM2, MAML3, ORC4, ATXN3, ZHX2, ZBTB8OS, RNGTT, STRN3, UBR5, THOC1, MYO6, NPAS3, KAT2B, UBE2E3, MECP2, CDK19, PAK2, ZBTB20, PTEN, ARGLU1, ZRANB3, RORA, FOXP2, KHDRBS1, DMTF1, SETD3, CREBRF, NLRP1, RIF1, BRD4, PHYHIP, EMSY, ORC2, PHF20, USP24, QKI, INO80D, LUC7L3, KIF2A, PKN2, PIK3C2A, KMT5B, RYBP, KANSL1, PTPN5, ERCC6L2, PTPN11, UBQLN1, CELF4, DDX17, RB1, RBM25, UHRF2, HIF1A, TASOR, HIPK2, BOD1L1, MAPKAP1, YTHDC1, ST7, KAT6A, ARID1A, GSK3B, MAPK8, PPP3R1, SCAPER, ZNF207, UBA6, TRIM33, PPP3CB, TRIP12, SMYD3, TNPO1, INTS10, TNRC6B, KMT2C, KCTD1, TSPAN5, SMG1, ASH1L, CHD4, USP12, NFAT5, RNF111, CDK6, NEK1, EHMT1, CDC27, FOXO3, NCOA2, ANKRD12, LDB2, SRRM1, RARB, RPS27, HLTF, ZNF131, THRB, CDK8, KPNA5, USP10, DCAF5, RANBP9, PUM3, FBXW7, SUZ12, RGS6, FTO, CUL3, DCAF10, TRAPPC12, SMC5, DDX5, PPP6R3, AGO2, TRA2B, UBE2B, GCC2, RIT2, PARG, NAALADL2, PRKAG2, ATM, HNRNPDL, HERC2, PPP1CB, TNRC6C, BCLAF1, SERGEF, CWC27, NUFIP2, NME7, RAPGEF5, SSBP2, PPM1H, AFDN, CAMK4, TAF1D, RAD51B, RNF38, ATF7IP, PAK1, CREM, MDM4, UIMC1, USP22, SMARCAD1, PWWP2A, SMARCA5, INTS8, TLE4, KDM6A, ZNF248, AFF3, CREB1, HIVEP2, LUC7L2, TOP1, WASHC4, CCNT2, TNIK, STAU2, MED13, PSIP1, BPTF, ATXN1, HIPK3, SFMBT2, MYCBP2, MBD5, SCMH1, RANBP2, EYA3, E2F3, TPT1, ATE1, NF1, ELP4, FANCL, CBX5, NUP214, TIAM2, XRCC5, CAMKMT, FOXP1, LYST, SPOP, MYSM1, TRERF1, MICAL3, PIK3CB, ANKS1B, SMC6, YWHAZ, RAD23B, BAZ1B, EP300, SPIDR, JMJD1C, NFX1, TSEN2, FOXK2, PPP1R12A, WDR20, SPRED1, CHD1, RBFOX2, PHF20L1, SESN1, NFIB, SMURF2, ZBTB38, NRF1, WDR33, ASCC3, NSMCE2, ZNF438, DACH1, MBNL1, SCAF8, FAM133B, DHX9, ANAPC10, EIF3E, YAF2, ASXL2, NR3C1, GTF3C1, RNPC3, TAF2, SENP6, ITCH, XPO4, PSMA1, ZNF462, HNRNPA3, KAT6B, RBM26, SPATA13, HSPH1, AKT3, LRMDA, SMAD1, SUGP2, CMIP, WDR27, ZBTB1, PRPF40A, DHX36, MDN1, SF1, SETD5, PRKRIP1, MRTFA, ATR, MORF4L1, PRMT2, ARFGEF1, CDK13, FNBP4, PPP1R13B, BABAM2, ARIH1, CHD8, KPNA3, SMCHD1, PIP5K1A, MBNL2, CDK14, SMARCA1, STK39, KDM5B, MEF2C, IPO9, MAPK10, SOX6, NKTR, RBMX, RBL2, HUWE1, CSTF3, FAM222B, SPEN, ATXN7, HDAC9, NGRN, MAPK14, TRIM24, SENP5, CASK, PBX1, AQR, ELP2, HTT, TCF20, CUL1, SRSF4, NOVA1, MED13L, PPP4R3B, HDAC8, SFPQ, MLLT10, LMO4, TNRC6A, SLF1, MAP3K2, ABL1, SRPK2, PRKCI, PCBP2, MAPK4, NEDD4L, ICE2, CCAR1, TRPS1
GO:0005829	cytosol	956	0.37025561580170413	1.508562742443501	6.627969816590961e-52	6.263431476678458e-49	48.20318766949205	1.2526862953356916e-48	RAB7A, GRB2, KIFAP3, STXBP5, ARL6IP1, RPTOR, ZFYVE16, RAB2A, TTBK2, RERG, RAPH1, DGKG, RPE, MAP3K5, ADK, SH3BGRL, PPP6R2, CRADD, G2E3, SMAP2, STARD13, MTR, PDE1C, ERBB4, KAZN, GUCY1A2, YWHAG, RBMS1, BACH2, SGK3, FAM120A, HBS1L, DENND6A, RAPGEF4, CSDE1, GOSR1, WNK2, TFG, CIT, GRIA1, DDHD1, MAPK1, AMD1, SEPTIN7, MYO9A, ANAPC5, RBMS3, CAPRIN2, RPL13, SMG6, FAM13A, PIK3C3, PPP2CA, PCCA, ANKRD28, WIPF3, DOCK11, YTHDF3, MAP1B, ZFYVE9, UNC13B, TRAPPC9, APBA1, PRRC2C, MYRIP, PHKB, CCP110, DOCK5, TTLL5, ECHDC1, HMGCLL1, RMND5A, USP48, PDPK1, GPRASP1, WIPF2, MAP2, ARMH3, FNIP1, GAPVD1, UBE2D3, XPO1, CAND1, PLEKHA5, GABARAP, MAGED1, ADD1, HDAC4, SORT1, HERC1, ENAH, SUGT1, CTNNB1, OSBPL9, DENND5B, BTRC, PCM1, TAX1BP1, CCDC91, PRKAR2B, ERI3, DCC, EXOC2, NUCB2, PDE10A, SNX27, HPCA, MAP7, STAG1, FBXO21, GRIP1, SOS1, STRN, EXOC1, RASGRP1, SGK1, RAC1, RUFY3, TACC1, PDS5B, NFKB1, ASB3, RPL37, MYO5A, NAA35, PUM1, PABPC1, NAF1, PREPL, LNX1, RNF217, ADAR, CRTC3, PPIP5K2, ARHGEF9, SPTBN4, TDRD3, ACTR2, ARHGEF4, TRPC4AP, RAB6A, PRKN, GAB2, ACBD6, PIP4K2A, PRKAR1A, RBBP6, CRYM, JAK2, TNKS2, TBC1D4, TPP2, ANAPC1, TSC22D1, DENND4C, PDZD2, NAA16, ARHGEF12, SMAD2, MIPOL1, ANAPC16, ZCCHC7, DGKD, RAP1A, MAP2K1, ACTN1, VPS13A, FCHO2, ME1, CRPPA, HEATR5B, PRKCH, DPYD, TUBGCP3, RABGEF1, HNRNPU, PSME4, SPTBN1, TUT7, TUT4, G3BP2, CLEC16A, C2CD5, EPB41L2, PPM1A, FBXL4, KPNB1, PPP1R1B, HNRNPD, LSM14A, SGIP1, ADD3, LTN1, PPP2R5E, SNX1, AP1G1, WWOX, LRBA, FBXO11, DOP1B, RPS6KA2, PAFAH1B1, CSNK2A1, ITSN1, POGZ, SMURF1, NR3C2, TPM1, CAPRIN1, SBF2, EIF5, INO80, LMO7, RALGAPA2, PAPSS1, LPP, KPNA1, SPART, CYTH1, FBXW11, ITSN2, PDCD6IP, EPS15, CUX1, DIXDC1, EPB41L1, AGO4, SCFD1, NUP98, NLK, GUCY1B1, WDR26, APC, YWHAE, RIMS1, CFLAR, SRGAP3, STRIP2, PDE8B, NAA25, GDAP1, LRP1, BIRC6, EML1, SEC14L1, HLCS, PIGN, DMD, RAB40B, SYNJ1, USP9Y, LRRK2, THRA, UBE3A, PPP3CA, AP2B1, MSI2, CCDC6, ARHGAP5, LRRC1, SH3RF1, PDE4D, DGKE, USP11, TM7SF3, WDR44, PTMA, PRKCB, IQSEC1, UBE2G2, WWP1, PRKG1, LPIN2, MCF2L2, PARD3, TBC1D5, NBEA, N4BP1, AGBL1, PRKACB, PRKCE, SH3GL3, USP9X, SGSM1, GNB5, BAIAP2, SMG7, ABL2, TASP1, DST, MTAP, KLHL13, PRNP, RAP2A, RGS7, KLHL2, PPP2R2A, TMSB4X, GAD2, ABI2, GBF1, ARFGEF2, NSL1, PLEKHA1, STAG2, ULK1, ETNK1, SLC44A1, ARMC8, EEA1, FAM13B, PRKD1, AGO3, PTPN4, CRBN, PELI1, USP15, DZIP1, OSBP2, ATG10, UBR4, PTK2B, WNK1, KLHL7, EIF4G3, CTNND1, HSP90B1, RABGAP1, PAK3, ATP6V1A, CADPS, WDFY3, BCL2, MKLN1, OSBPL8, CALD1, MAPK6, GRB10, CERT1, SH3GLB1, HMBOX1, NMNAT2, ZNF106, PTPN2, MCCC1, UBE2H, RCOR3, PLCG2, FARSB, PDE3B, CLOCK, ARFIP1, URI1, CYLD, SDCCAG8, CLASP2, FOXO1, RPAP2, ASAP2, SMAD4, RASAL2, LRRC7, CEP192, UBE2R2, AGPS, EPN2, CEP97, ATP6V1H, PXK, ARL13B, LONP2, NT5C2, SHOC2, PSMD1, PJA2, RASA2, UBR2, NHLRC2, ANKRD11, KATNAL1, BICD1, PEG10, FYN, VPS54, HNRNPC, XPO6, RAB1A, HECW1, PPFIA2, ATF6, CKAP5, NCOA1, VAV3, ANKFY1, ZFYVE28, SNCA, NSMAF, DENND1A, MAP3K7, RAPGEF6, CHD9, NSF, TIAM1, PPP2R5C, SORL1, USP33, CNTRL, COPA, FGFR1OP2, PTPRR, MTMR7, CAPZA1, GLUL, TOP2B, EFR3B, WAPL, GDA, ARID4B, DAAM1, FHIT, USP47, SEC24B, RICTOR, PDS5A, CREBBP, AGTPBP1, COP1, DPP8, LARP1B, WSB1, CEP57, INPP4B, RPL37A, ANKS1A, RNF216, FMN2, TASOR2, PACS1, CLASP1, APP, PRMT3, HSD17B4, FIP1L1, FOCAD, PRKDC, ANK2, KIDINS220, TAB2, ADD2, NBN, LPIN1, DENND4A, GNB1, NTRK2, PPP2R2B, KPNA4, CLTC, AHCYL1, NDRG4, PITPNM2, USP37, FNIP2, PRKCA, NCAM1, WASL, DYNC1LI2, REPS1, COMMD1, PIKFYVE, ICA1, USP25, PPP1R12B, PPP2R2C, CYFIP2, ASAP1, GUCY1A1, CDC42BPB, SEM1, RPS6KA3, INPP4A, ARHGAP20, OAZ1, NCOR1, AGFG1, ARHGAP21, CALM1, SH3D19, DPYSL5, ACTN2, CENPP, FBXL7, ARHGAP44, DOCK3, MSRA, CEP70, DOCK10, CHKA, CTNNA1, RGL1, CHN1, KMT2A, ALMS1, RAP1GAP, PSMD14, UPF3A, URGCP, RPS6KA6, GNAI1, EVI5, UBE2K, PDE8A, PPIG, VSNL1, UBE2D2, LARP1, SPIN1, FAF1, FAM110B, CENPC, MAP2K4, IRS2, CAMK2D, SRGAP2, ATG7, PI4KA, AMBRA1, ABI1, TANK, CAST, MAP1A, OTUD7A, KIF3A, STON2, PPFIA1, GPBP1, ELP1, FER, RAF1, PAK5, RNF19A, AHCTF1, OGT, NBEAL1, PARN, EPB41L3, ARHGEF11, DYNC1I1, ATXN3, EXOC5, DNAJC6, EML4, IFT88, ZMYM2, PAXBP1, MTMR1, PDE3A, MYO6, KCNAB1, KAT2B, FBXO9, UBE2E3, MECP2, CDK19, PAK2, OLA1, PTEN, FBXW8, RAPGEF2, PUM2, KHDRBS1, GNA12, ARHGAP26, DIAPH2, NLRP1, DOK6, FNBP1L, DPYSL2, KIF16B, DYNC1I2, ATP9A, TTC8, USP24, QKI, KIF2A, PDE5A, PKN2, PIK3C2A, SASH1, PTPN5, LNPEP, PTPN11, AKAP11, UBQLN1, RO60, AHCYL2, PPP3CC, DDX17, SH3PXD2A, AFTPH, RB1, AKAP10, HIF1A, MAPKAP1, RIC1, GALK2, ANK3, CTNNA2, CEP290, KLHL3, UBR1, SPTAN1, NGEF, GSK3B, SH3KBP1, PPP3R1, MAPK8, FRS2, PTPN1, UBA6, ROCK1, RAPGEF1, SAMD4A, PPP3CB, TRIP12, TNPO1, KSR2, HECTD2, OGA, HOMER1, DLG1, TNRC6B, TBC1D15, RAB3GAP2, ROCK2, CDC42BPA, SPAG9, TJP1, VPS13C, SMG1, UBE3D, SOS2, USP12, NFAT5, RNF111, CDK6, NEK1, LIMS1, TNKS, PHACTR1, PHLPP1, TRAK1, CDC27, ELMO1, FOXO3, DDX6, SRRM1, CHMP3, RPS27, RIPOR2, GPHN, PPM1B, FBXW4, KPNA5, USP10, RANBP9, FBXW7, TAOK1, RGS6, FTO, CUL3, STX16, FMNL2, USP34, TRAPPC12, SPIRE1, DDX5, CRLF3, AKAP7, PPP6R3, AGO2, PDE7B, NPEPPS, CTIF, GOLGA4, MAP4K5, GCC2, TTLL7, EPHB1, FGF13, PARG, TTLL11, SNCAIP, UPF2, CARMIL1, PDGFC, CARNMT1, PRKAG2, CUL5, BRAF, RAB3GAP1, DYNC2LI1, ATM, HNRNPDL, HERC2, PPP1CB, TNRC6C, NUP93, SERGEF, KIF5B, DNM1L, FKBP1A, AKAP13, GLS, SCLT1, NUFIP2, BBS9, NME7, ACTR3, SND1, GOLGB1, AFDN, PACRG, RB1CC1, GCLC, PLCB1, KALRN, VAMP2, FBXL20, DOP1A, MTM1, CACNB4, RNF115, LRCH3, PAK1, CLU, AK5, MON2, USO1, XRN1, GMDS, JAK1, EXOC6, ATP6V1C1, LSAMP, SEC23A, MIF, PICALM, CSNK1A1, OTUD4, PDE7A, LRRFIP1, DICER1, LATS1, FKBP5, VAPA, IREB2, SERINC5, PDE1B, EVL, TNIK, STAU2, FGD4, HERC3, PSIP1, ATXN1, EGLN1, MVB12B, HELZ, HIPK3, CNOT4, PER3, DOCK1, AAK1, NAA15, EHBP1, RANBP2, MTPN, RASA1, RIC8B, TPT1, NF1, ATAD1, CTSD, WDR11, DGKB, DTNBP1, ARHGEF7, AKAP5, CCDC88A, USP14, FANCL, TIAM2, NUP214, PAN3, TRAPPC10, XRCC5, CAMKMT, PIK3CB, ATG5, MICAL3, ANKIB1, YWHAZ, DENND1B, SNAP25, DOCK4, RAD23B, EP300, CLIP1, SHANK2, UBE2G1, CRYL1, PPP1R12A, SNX9, VPS41, PPP4R4, MYH10, CAPZA2, DPH6, FARP1, SPRED1, SESN1, SMURF2, TRAK2, S100PBP, PCNT, ULK2, CBLB, RIMKLB, ASCC3, GPI, ACACA, TRAPPC8, EIF3H, MBNL1, CAPZB, DHX9, ANAPC10, EIF3E, TULP4, AKAP9, NR3C1, RIN2, LYPLAL1, SENP6, ITCH, XPO4, CALB1, PSMA1, CSNK1G1, PTK2, CHM, SPATA13, HSPH1, SMAD1, MTHFD1L, CMIP, DLC1, DHX36, IQGAP1, DENND5A, RAB11A, PIK3CA, NEMF, NCKAP1, AHI1, DHFR, PRKRIP1, CAB39, OSBPL6, DOCK9, VPS53, MRTFA, CNOT2, GRK3, PDE4B, FBXL5, PRMT2, BBS2, ARFGEF1, SH3GL2, PALLD, PPP1R13B, ABR, GAB1, LARP4B, WASF1, SPG11, ARIH1, RPLP1, BABAM2, GIGYF2, KPNA3, NBAS, PIP5K1A, ARHGAP6, CDK14, STK39, DGKI, UTRN, PDSS2, MEF2C, IPO9, MAPK10, EIF2AK4, TRIM37, UPP2, ARHGAP32, NKTR, RABEP1, MTMR3, KCNIP4, RAB10, HUWE1, AGBL4, ATXN7, COG5, IQCB1, MAPK14, TRIM24, SORBS1, SEC31A, FNDC3A, CNOT6L, ALDH3A2, CASK, RC3H1, SRGAP1, DAB1, ELP2, HTT, TRIO, CUL1, ARHGAP35, DLG2, EXOC4, SFPQ, MARK3, VTI1A, EPB41, TNRC6A, SLK, REPS2, NRDC, MIB1, MAP3K2, ABL1, SRPK2, PIK3R1, PCBP2, PRKCI, MAPK4, ARL8B, HERC4, NEDD4L, TMCC1, TTC7B
