GO_ID	Name	Gene Count	Gene Ratio	Fold Enrichment	p-value	FDR	-log10 FDR	FWER	Associated Genes
GO:0042405	nuclear inclusion body	9	0.0034856700232378003	5.982571649883812	1.1625585951817901e-06	4.145727820553931e-05	4.382399214039486	0.0021972357448935835	NUP153, NUP98, RAD18, ATXN3, SLF1, RANBP2, NBN, TPR, ATXN1
GO:0099523	presynaptic cytosol	16	0.006196746707978312	4.4009722481903895	4.807844061167539e-08	2.3299551988735e-06	5.632652429647407	9.086825275606648e-05	SENP5, LRRK2, CALM3, PRKCB, CALB1, SYT1, HTT, CALM2, USP14, SH3GL2, SENP7, FUS, CALM1, BAIAP2, PIAS1, ANKS1B
GO:0043194	axon initial segment	13	0.005034856700232378	4.320746191582753	1.1902128832503405e-06	4.165745091376192e-05	4.380307308751154	0.0022495023493431434	PRICKLE2, KCNQ3, LGI1, NRCAM, NAV1, ANK3, IQCJ-SCHIP1, LRRC7, SCN8A, SCN1A, SPTBN4, MAP1A, MAP2
GO:0099524	postsynaptic cytosol	15	0.005809450038729667	4.12591148267849	3.9202372724534866e-07	1.4818496889874181e-05	4.829195846663042	0.0007409248444937089	KIF5C, SENP5, CALM3, UBE3A, CALB1, SYT1, HTT, GNAQ, HOMER1, KIF5B, SENP7, FUS, PLCB1, BAIAP2, PIAS1
GO:0043198	dendritic shaft	20	0.0077459333849728895	3.79845819040242	2.779929553688129e-08	1.3826491727554115e-06	5.859288001860799	5.254066856470564e-05	KIRREL3, GABBR1, HCN1, GRM7, BAIAP2, MAP2, CNIH3, PSEN1, RGS7BP, GRM5, APP, ZNF804A, NEGR1, GRIA1, PRKAR2B, ZMYND8, JPH4, NSF, STAU2, MAP1A
GO:0030136	clathrin-coated vesicle	34	0.013168086754453912	3.5685515104570102	3.775094969470282e-12	2.972887288457847e-10	9.526821555957765	7.1349294922988324e-09	EPS15, PIK3C2A, AAK1, LMBRD1, VAMP2, SYNRG, AFTPH, ASTN1, DNAJC6, RNF216, EPN2, CLVS2, MYO6, SORT1, ADAM10, SGIP1, BTBD8, DENND1B, AP1G1, PICALM, NUMB, CLVS1, ASTN2, SNAP91, SNX9, VPS41, GGA2, GAS7, CLTC, VTI1A, DENND1A, SCAMP1, HEATR5B, FCHO2
GO:0043197	dendritic spine	63	0.024399690162664602	3.3955136391232443	6.345093380781552e-20	7.495141556048208e-18	17.12522016049014	1.1992226489677133e-16	MAP1B, GABRB3, APBA1, GRIA4, SEPTIN11, GRM3, SYT11, GABBR1, DNM3, KCND3, DGKI, BAIAP2, ACTN2, OPHN1, GPHN, ARHGAP44, ARHGAP32, SORCS2, DOCK10, DTNBP1, AKAP5, GRM5, GRID1, ABI2, ARFGEF2, ANKS1B, APP, ZNF804A, GABRB2, NEGR1, PPP3CA, ASIC2, GRIA1, SHANK2, PRKAR2B, PTEN, ZMYND8, HOMER1, CPEB4, PTPRO, PPFIA2, ITSN1, PDE4B, GABRG2, NTRK2, MYH10, FARP1, GRIA3, NLGN1, SRGAP2, SIPA1L1, GRIN2A, GPM6A, TANC2, DIP2A, CTTNBP2, ABR, STRN, FRMPD4, KCND2, GRIA2, GRID2, TENM2
GO:0098982	GABA-ergic synapse	47	0.01820294345468629	3.3775479584929626	4.058865616797814e-15	4.037503166183088e-13	12.393887124089867	7.671256015747868e-12	GABRB3, CLCN3, PCLO, GUCY1A1, SLC4A10, KIF5C, EFNA5, SLC6A1, GABBR1, CACNA2D1, PCDH17, CNTNAP2, PLCB1, ERC2, KCND3, NRXN1, NLGN4X, RPS27, GPHN, GAP43, CALB1, GABARAP, ERBB4, SH3KBP1, LAMP5, ARHGEF9, FUS, GRID1, ARFGEF2, GABRB2, GLRB, GABRA4, GNAO1, CACNA2D3, GABRG3, PTPRO, GABRA5, GABRG2, NLGN1, NSF, PIK3C3, LRFN5, MKLN1, ATP2B2, KCND2, GABRA2, GABRB1
GO:0098839	postsynaptic density membrane	46	0.017815646785437646	3.0834542957384348	4.3747765561600007e-13	3.758330768701091e-11	10.425005000526031	8.268327691142402e-10	NEO1, GRIA4, SHISA9, NLGN4Y, NLGN4X, GSG1L, SLC16A7, EPHA7, SORCS2, ERBB4, RGS7BP, NETO2, GRM5, GRID1, GRM1, PLPPR4, ADGRB3, LIN7A, NETO1, ADAM22, NRCAM, NSG2, ASIC2, KCNH1, GRIA1, RYK, CSMD2, DLG1, DLG2, GRIN2B, DCC, PTPRO, GRIK2, GRIA3, NTM, IQSEC1, SORCS3, LRFN5, LRRTM3, ATP2B2, SLITRK5, GRIN2A, LRRC4C, GRID2, CACNA1C, GRIA2
GO:0014069	postsynaptic density	100	0.038729666924864445	3.079830965191151	9.19896981653779e-27	1.9317836614729358e-24	23.714041511403586	1.7386052953256423e-23	PCLO, SYT1, INPP4A, DTNB, SLC8A1, DNM3, KALRN, ARHGAP44, DROSHA, NETO2, SYN2, GRIA1, RTN3, GRIK2, IQSEC1, CAMK2D, SRGAP2, ABI1, EGLN1, CACNA1C, MAP1B, PDPK1, BAIAP2, GAP43, PLEKHA5, DTNBP1, DNAJC6, AKAP5, PRNP, SYN3, ADD1, GRM1, ANKS1B, NETO1, PAK2, SHANK2, PTEN, PTK2B, GRIN2B, BMPR2, PAK3, GRIP1, STRN, SOS1, DAPK1, GRM3, SHISA9, CAPZB, EIF3E, CPEB3, ITPR1, DLGAP1, LRRC7, CTNNA2, CNKSR2, PKP4, MPDZ, SH3KBP1, ARHGEF9, DLGAP2, PRKN, PJA2, NEGR1, FYN, HOMER1, DLG1, ABLIM1, PPFIA2, PDE4B, NLGN1, MAGI2, RTN4, GRIA2, MAP2K1, SYT11, SPTBN1, RPS27, PPP1R9A, DGKI, GPHN, PRICKLE2, ARHGAP32, SORCS2, CAP2, HNRNPD, ADAM10, NPTN, ADD3, ADD2, DLG2, CPEB4, NTRK2, SORCS3, SIPA1L1, MIB1, ABL1, GRIN2A, KPNA1, CTNND2, PSD3
GO:0098794	postsynapse	88	0.03408210689388071	3.0126827192547947	6.255379857766826e-23	1.0747879937435728e-20	19.968677193634512	1.18226679311793e-19	DIXDC1, DTNB, SLC8A1, KIFAP3, SRGAP3, OPHN1, ARHGAP44, DOCK10, KCTD8, LRRK2, GRIA1, LATS1, ERBIN, PIK3C3, STAU2, FRMPD4, ATXN1, MAP1B, DOCK1, PARN, PURA, BAIAP2, EPB41L3, ATAD1, PRNP, ARHGEF7, STRN3, ATG5, ARFGEF2, MECP2, DOCK4, PRKAR2B, GABRG3, PUM2, MARK1, GABRA5, SNX27, HPCA, MKLN1, STRN, CBLB, RAC1, CYP46A1, HTR4, CPEB3, LNX1, CALB1, GSK3B, PPP3R1, PTPN1, WASF3, PRKN, ADGRB3, GABRA4, NCKAP1, HOMER1, JAK2, SNX14, GABRG2, GRK3, NLGN1, SNCA, KIF1B, SH3GL2, RTN4, GRIA2, WASF1, SLC4A10, ELMO1, SPTBN1, DGKI, GPHN, MEF2C, FRRS1L, PSEN1, CUL3, RGS7BP, SLC24A2, AGO2, APP, ZNF804A, TRIO, CPEB4, BRAF, RAB3GAP1, ABL1, GRIN2A, GABRA2
GO:0031252	cell leading edge	24	0.009295120061967466	2.991285824941905	3.2769846426262965e-07	1.2903127030341043e-05	4.889305027107818	0.0006193500974563701	CDC42BPB, LDB2, AAK1, RAPH1, JMY, PABPC1, CLASP2, DST, CCDC88A, GBF1, IQGAP1, BCAS3, PAFAH1B1, SSX2IP, SHTN1, CARMIL1, CDC42BPA, LMO4, CAPRIN1, SLK, MACF1, ABI1, ABL1, PRKCI
GO:0098685	Schaffer collateral - CA1 synapse	37	0.014329976762199844	2.95140201394268	3.640405844376817e-10	2.1501147018350574e-08	7.667538371226122	6.880367045872184e-07	CALM3, PTPRD, APBA1, CAPZB, GABBR1, BAIAP2, GSG1L, FBXL20, SLC16A7, ITPR1, EPHA7, DTNBP1, RAP2A, GRM5, PPP3R1, GRM1, ATG5, ROCK1, PLPPR4, CTNNB1, CASK, PPP3CA, SYN2, NETO1, EEA1, RAB11A, GRIA1, FYN, PAFAH1B1, DCC, SNX27, PRKCI, LRRC4C, ABR, GRIA2, GABRB1, CDH11
GO:0098978	glutamatergic synapse	203	0.07862122385747483	2.886421972492962	2.953371480934942e-48	1.8606240329890133e-45	44.73034137372241	5.58187209896704e-45	EPS15, NEO1, PCLO, GUCY1A1, DIXDC1, SYT1, PPM1H, GUCY1B1, KIFAP3, GABBR1, ZDHHC17, PLCB1, NRXN1, DPYSL5, OPHN1, ARHGAP44, FBXL20, CACNB4, DOCK10, DROSHA, ERBB4, NETO2, PLPPR4, LRRK2, SYN2, UBE3A, ELMOD1, PPP3CA, AP2B1, RYK, DLGAP4, GRIA1, CNNM2, GRIK2, DGKE, LGI1, LATS1, SRGAP2, ERBIN, PIK3C3, ATP2B2, TNIK, STAU2, CTTNBP2, PRUNE2, LRRC4C, EGLN1, PIAS1, MAP1B, APBA1, DOCK1, CNTN1, FXYD6, OGT, SH3GL3, FLRT2, PARN, PURA, BAIAP2, ATP2B4, NF1, EPB41L3, FZD3, PLEKHA5, ATAD1, CNIH3, DTNBP1, PCDH9, RGS7, USP14, PPP2R2A, SYN3, FUS, GRM1, ATG5, ARFGEF2, ANKS1B, CTNNB1, YWHAZ, NETO1, EEA1, PAK2, NRCAM, DOCK4, SLC4A8, ADAM23, GNAO1, NSG2, SNAP25, CSMD2, PRKAR2B, PTK2B, SEMA3A, PUM2, PTPRO, MARK1, MYH10, FARP1, PDE10A, CDKL5, SNX27, CADPS, PAK3, HPCA, ATP8A1, LRRTM3, LRFN5, ATP2B1, GPM6A, SLC1A2, SOS1, NTRK3, CBLB, DAPK1, RAC1, CDH11, CLCN3, BRINP1, PTPRD, GRM3, SHISA9, PCDH17, HCN1, CNTNAP2, AKAP9, HTR4, GSG1L, CLASP2, PPP3CC, DLGAP1, SLC16A7, EPHA7, CALB1, BTBD9, CNKSR2, SH3KBP1, NGEF, GRM5, GSK3B, DLGAP2, PPP3R1, PTPN1, NRG3, WASF3, PRKN, PJA2, PPP3CB, TENM4, SIPA1L3, PRKAR1A, RAB11A, NUMB, FYN, HOMER1, JAK2, DLG1, PPFIA2, NLGN1, SPARCL1, SH3GL2, KCND2, ADGRL3, ABR, RTN4, RAP1A, MAP2K1, ACTN1, ELMO1, DAAM1, ERC2, SPTBN1, RPS27, IL1RAPL1, NLGN4X, DGKI, PCDH7, APOE, ARHGAP32, RABEP1, CAMKV, PSEN1, CUL3, RGS7BP, HNRNPD, GRID1, MAPK14, AGO2, DAB1, ADAM10, NAPB, TRIO, PAFAH1B1, EPHB1, ITSN1, BRAF, SORCS3, MIB1, ABL1, GRIN2A, WASL, PRKCI, GRID2, KPNA1
GO:1904115	axon cytoplasm	23	0.008907823392718823	2.866648915569326	1.3735978076362052e-06	4.701233621451064e-05	4.327788166598168	0.0025960998564324277	KIF5C, AGTPBP1, DST, ZC3H14, HIF1A, DTNBP1, MAPK8IP3, KIF21A, AGBL4, KIF1A, NETO1, AP3B1, OPA1, PAFAH1B1, DLG2, AP3S1, SYBU, KIF1B, KIF5B, ARL8B, MAP1A, FBXW11, KIF3A
GO:0005905	clathrin-coated pit	26	0.010069713400464756	2.8410385917256455	3.515986581808355e-07	1.3561662529832226e-05	4.867687066864715	0.0006645214639617791	EPS15, AAK1, FCHSD2, INPP5F, TF, LRP1, MYO6, SORT1, APP, SGIP1, AP1G1, PICALM, AP2B1, NUMB, SNAP91, ITSN1, SNX9, BMPR2, GAS7, CLTC, DNM1, DNM1L, DGKD, LRP12, REPS1, FCHO2
GO:0030424	axon	140	0.054221533694810226	2.6909559228393043	9.082604279377892e-30	2.452303155432031e-27	26.610425843047146	1.7166122088024216e-26	PCLO, SYT1, DYRK1A, SLC6A1, SLC8A1, ADCY9, GRM7, TUBB3, OPHN1, PAK1, SEMA6A, BORCS5, KIF21A, SLC38A2, RAP1GAP, MAP9, BTBD8, LRRK2, CREB1, SACS, SHTN1, ATL1, NIN, GRIK2, DSCAM, DSCAML1, IQCJ-SCHIP1, STAU2, MAP1A, MAP1B, MYCBP2, CNTN1, INPP5F, GAP43, NF1, DST, FZD3, DTNBP1, MAPK8IP3, GAD2, SETX, ATG5, DOCK7, ULK1, ADNP, ADAM22, SNAP25, NRCAM, CNTN4, KCNH1, IGF1R, SCN8A, SLC12A6, SEMA3A, DCC, PTPRO, TENM3, BMPR2, MYH10, WDFY3, HPCA, MAP7, GPM6A, FAM168B, SLC1A2, NTRK3, NMNAT2, MAP6, RUFY3, CADM2, GRM3, SEPTIN11, ALCAM, SCN1A, ROBO1, HCN1, CNTNAP2, PUM1, FEZ2, CALB1, CTNNA2, ANK3, GSK3B, MAPK8, SPTBN4, KLHL24, PRKN, DHX36, HOMER1, ATP1A3, KCNB1, KIF13B, COBL, PPFIA2, GABRG2, SNCA, KIF1B, MAP4, PENK, PALLD, ADGRL3, MACO1, ABR, MAP2K1, SPG11, DIP2B, SLC4A10, KIRREL3, SYT11, AGTPBP1, IL1RAPL1, DGKI, PRICKLE2, PSEN1, RGS7BP, AGBL4, KIF1A, ADAM10, APP, NPTN, ZNF804A, OPRM1, HTT, PAFAH1B1, EPHB1, NCAM2, FGF13, SLC38A1, DLG2, CPEB4, SCN2A, NTRK2, SCN9A, SMURF1, SBF2, TANC2, ARL8B, UNC5C, GABRA2, UNC80
GO:0030425	dendrite	157	0.06080557707203718	2.630990893646382	5.379893319761931e-32	1.6946663957250083e-29	28.770915782272276	1.016799837435005e-28	KIF5C, GRIA4, DTNB, DYRK1A, SLC8A1, ADCY9, RPTOR, CHL1, GABBR1, EPHA6, GRM7, DPYSL5, TUBB3, OPHN1, ARHGAP44, PAK1, XRN1, KIF21A, LAMP5, SLC38A2, LRRK2, GLRB, GRIA1, FAT3, BMPR1A, SACS, NIN, NAP1L4, LGI1, HTR1E, GRIK2, MARK2, DSCAM, STAU2, BPTF, MAP1A, CACNA1C, MAP1B, RGS12, INPP5F, KCND3, GNB5, PURA, MAP2, GAP43, NF1, FZD3, CNIH3, PRNP, AKAP5, MAPK8IP3, RGS7, STRN3, LUZP1, GRM1, ARFGEF2, IL6ST, ADNP, TRIM9, SLC4A8, KCNH1, GNAO1, OPA1, NSG2, PRKAR2B, PTK2B, GRIN2B, MARK1, GABRA5, BMPR2, FARP1, GRIP1, TRAK2, TENM2, STRN, SORBS2, RAC1, MAP6, MAX, RUFY3, BRINP1, CYP46A1, ALCAM, HCN1, CNTNAP2, NLGN4Y, URI1, HTR4, CPEB3, EPHA7, CALB1, ANK3, MPDZ, GRM5, GSK3B, NDFIP1, SAMD4A, NEGR1, DHX36, FYN, HOMER1, SNX14, KCNB1, COBL, GABRG2, NLGN1, KIF1B, CNNM1, MAGI2, PENK, KCND2, GRIA2, MAP2K1, SPG11, DIP2B, TRAK1, SLC4A10, KIRREL3, SYT11, RABGEF1, HNRNPU, IL1RAPL1, DGKI, PPP1R9A, NLGN4X, GPHN, APOE, PRICKLE2, SORCS2, PSEN1, KIF1A, AGO2, ADAM10, APP, NPTN, OPRM1, HTT, TTLL7, BRINP3, EPHB1, FGF13, CPEB4, NTRK2, SFPQ, MARK3, HTR2C, SGCE, CAPRIN1, INPP5A, KCNIP1, NRDC, ABL1, KPNA1, CTNND2, UNC5C, GABRA2, GABRB1
GO:0042734	presynaptic membrane	48	0.018590240123934933	2.6046570448473734	1.5472386506693255e-10	1.008372775781043e-08	7.996378887993281	2.924281049765025e-07	UNC13B, PTPRD, SYT1, GRM3, CNTN1, FXYD6, RIMS1, GABBR1, ERC1, CNTNAP2, ERC2, FLRT2, ZDHHC17, NRXN1, GNB5, VAMP2, CNTNAP4, PCDH17, PSEN1, RGS7, ERBB4, RGS7BP, GAD2, NPTN, CTNNB1, KCTD8, CASK, SNAP25, PICALM, SLC4A8, KCNH1, ADAM23, GRIA1, GNAO1, SNCAIP, RAB3GAP2, KCTD16, GRIK2, PPFIA2, GABRA5, NRXN3, DENND1A, RIMS2, GRIN2A, ATP2B1, TENM2, SLC1A2, RAC1
GO:0030426	growth cone	45	0.017428350116189	2.601118108645135	6.024252024390021e-10	3.450253432150648e-08	7.462149003436239	1.138583632609714e-06	MAP1B, NEO1, AUTS2, CALM3, MYO5A, USP9X, ERC2, TUBB3, PSEN1, DTNBP1, MAPK8IP3, KIF21A, TIAM2, EXOC6, NGEF, SETX, DOCK7, APP, PTBP2, ZNF804A, LRRK2, SNAP25, SHANK2, PAFAH1B1, FGF13, CXADR, MYO9A, PTK2B, CPEB4, SHTN1, PTPRO, SLC2A13, MYH10, DSCAM, SNCA, ABI1, ABL1, PALLD, COPA, GPM6A, APBB2, TENM2, UNC5C, LMTK2, RUFY3
GO:0043005	neuron projection	111	0.04298993028659954	2.5225658238826325	2.730930263593461e-21	3.970352460147416e-19	18.40117093789618	5.161458198191641e-18	CYFIP2, KIF5C, SYT1, CADM1, PACRG, CHL1, VAMP2, SLC12A2, RGS17, PLPPR1, SYNPR, UPF3A, LRRK2, GRIA1, FAT3, RTN3, CDH2, CAMK2D, TENM1, ABI1, STAU2, MAP1A, STON2, CPEB2, FLRT2, BAIAP2, MAP2, DTNBP1, ARHGEF7, RGS7, TIAM2, GRM1, DOCK7, PCSK2, SNAP25, NRCAM, SLC4A8, SHANK2, PTEN, CXADR, CNTN3, RAPGEF2, GRIN2B, HMGB1, PTPRO, GNA12, TENM3, MYH10, FARP1, GRIP1, GPM6A, TENM2, GRM3, MYO5A, CPEB3, AHCYL2, CALB1, ANK3, MPDZ, SH3KBP1, GRM5, NDFIP1, PRKN, SAMD4A, TENM4, IQGAP1, HOMER1, KCNB1, DLG1, KIF1B, BBS2, MAGI2, CPNE5, MAP4, MACO1, RTN4, RAP1A, VPS13A, GPR149, SYT11, PPP1R9A, SORCS2, PSEN1, RGS6, ANKS1A, RGS7BP, KIF1A, APP, BCL11B, OPRM1, SLC1A3, ASIC2, ANK2, PAFAH1B1, KCNN3, NCAM2, FGF13, RIT2, DLG2, CPEB4, ITSN1, BRAF, SCN9A, RIC3, SIPA1L1, GRIN2A, NCAM1, KIF5B, TSGA10, UNC5C, FBXW11
GO:0045211	postsynaptic membrane	73	0.028272656855151047	2.4884770965328675	6.014733515255162e-14	5.413260163729646e-12	11.266541100018303	1.1367846343832257e-10	GABRB3, LRRTM4, SYT1, GRIA4, GRM3, SHISA9, FXYD6, SYNE1, CNTN1, FAIM2, GABBR1, SUSD4, HCN1, FLRT2, IL1RAPL1, KCND3, GRM7, GNB5, UTRN, PCDH17, GPHN, EPHA7, ATAD1, DGKB, CNIH3, LRRC7, ANK3, AKAP5, CNKSR2, DTNBP1, RGS7, ERBB4, DMD, GRM5, GRID1, GRM1, CTNNB1, GABRB2, KCTD8, GLRB, GABRA4, ADGRL2, PICALM, GABRA2, NRCAM, GNAO1, GRIA1, ANK2, SHANK2, KCNB1, GABRG3, GRIN2B, KCTD16, GRIK2, GABRA5, GABRG2, GRIA3, NLGN1, SRGAP2, LRRTM3, GRIN2A, GRIP1, KCNMA1, LRRC4C, KCND2, GRID2, TENM2, STRN, ADGRL3, NTRK3, GRIA2, GABRB1, RAC1
GO:0010494	cytoplasmic stress granule	30	0.011618900077459334	2.46703985562219	1.4876437206107768e-06	4.932713389393628e-05	4.306914118071395	0.0028116466319543683	NUFIP2, QKI, PRRC2C, DDX6, MBNL1, RC3H2, RPTOR, CELF1, RBM4, G3BP2, LARP1B, PUM1, PABPC1, HIPK2, KPNB1, HNRNPK, ATXN2, LSM14A, ROCK1, CSDE1, RC3H1, DHX36, LARP1, LARP4B, PUM2, CAPRIN1, STAU2, RBFOX1, YTHDF3, GIGYF2
GO:0030027	lamellipodium	59	0.022850503485670023	2.4640260198474335	2.395967077952478e-11	1.6771769545667346e-09	8.77542111369827	4.5283777773301835e-08	WASF1, PKD2, FER, ACTR3, CDC42BPB, PKN2, PIP5K1A, CAPZB, APC, RDX, RAPH1, TUBB3, BAIAP2, PABPC1, PAK1, PHACTR4, PTPRM, CTNNA2, ARHGEF7, CTNNA1, CCDC88A, KLHL2, TIAM2, ACTR3B, RAB40B, SPATA13, ABI2, ENAH, ROCK1, WASF3, CTNNB1, SNX1, PIK3CA, NCKAP1, PTK2B, SH3RF1, PTPN13, ABLIM1, PTPRO, CDC42BPA, CARMIL1, ITSN1, SHTN1, CDH2, MYH10, ANKRD28, CAPRIN1, SRGAP2, ABI1, EVL, PALLD, WASL, FGD4, APBB2, UNC5C, SORBS2, CTNNA3, RAC1, RUFY3
GO:0055037	recycling endosome	44	0.017041053446940357	2.420534736504714	1.471133851591056e-08	7.514710755424582e-07	6.124087730944076	2.780442979507096e-05	TBC1D12, CLCN3, SLC9A7, FCHSD2, STX12, SYT11, FIG4, MYO5A, RABGEF1, INPP5F, ARHGAP44, TF, RABEP1, STX7, ATP11A, DYNC1I1, RAB10, RAP2A, LAMP5, STX8, ARFGEF2, VPS50, APP, SGK3, DENND6A, ULK1, AP1G1, RAB11A, GRIA1, ANK2, AVL9, MCTP1, ITSN1, VPS53, RELCH, SLC9A9, SLC9A6, TNIK, SORL1, COMMD1, ATP9A, WIPF3, LMTK2, ATP11B
GO:0005938	cell cortex	56	0.021688613477924088	2.363485096250394	3.381702470888277e-10	2.0617476354770464e-08	7.68576449483679	6.391417669978844e-07	PPFIA1, FER, TRAK1, KANK1, GRB2, PARD3B, STK39, GRM7, FRYL, RIC8B, CLASP2, DST, ITCH, EPB41L2, ARHGAP32, C2CD5, PSEN1, ARHGEF7, PARD3, PTK2, KIF21A, SPTAN1, FMN2, SEPTIN2, SPTBN4, SPIRE1, ACTR2, MYO6, CLASP1, NDFIP1, MICAL3, CTNNB1, ADD3, GNAI1, PRKD1, SNAP25, IQGAP1, PAFAH1B1, CLIP1, ASTN2, PTK2B, CLIP4, COBL, MYH10, EPB41, ITPR2, SNCA, WDPCP, MARCKS, FNBP1L, MKLN1, CTTNBP2, AKAP13, FRY, MAP2K1, RAC1
GO:0045202	synapse	221	0.08559256390395042	2.3287509196377316	1.705595531444699e-35	6.447151108860963e-33	32.190632150639615	3.2235755544304813e-32	EPS15, CYFIP2, PCLO, KCNQ3, CNP, SNTG1, RPS6KA3, PPM1H, CADM1, DTNB, STXBP5, SLC8A1, RIMS1, SRGAP3, DNM3, NRXN1, CNTNAP4, DPYSL5, ACTN2, VAMP2, OPHN1, FBXL20, CACNB4, CLU, UNC5C, RGS17, YWHAG, NETO2, DMD, SYNPR, SEPTIN2, GPRIN3, LRRK2, LIN7A, SGCZ, GLRB, SYN2, ELMOD1, AP2B1, DLGAP4, GRIA1, MAPK1, CNNM2, CNTNAP3B, MYO9A, KCNMB4, RTN3, GRIK2, HTR1E, LGI1, CDH2, DSCAM, RPL13, DSCAML1, ATP2B2, PPP2CA, APBB2, MAP1A, STON2, MAP1B, GABRB3, TMOD2, RGS12, ADARB1, UNC13B, CPEB2, PAK5, OLFM3, CNTN1, OGT, MYRIP, FGF12, FLRT2, GNB5, GIT2, CACNA1E, GAP43, CNIH3, ATXN3, DNAJC6, USP14, PPP2R2A, TIAM2, SYN3, GAD2, ATG5, ARFGEF2, ENAH, CTNNB1, CACNA1A, NETO1, SNAP25, MECP2, NRCAM, CNTN4, IGSF11, TRIM9, SHANK2, SLC12A6, RAPGEF2, FARP1, PDE10A, CADPS, ATP8A1, LRP6, LRRTM3, MKLN1, ATP2B1, SLC38A6, TENM2, SLC1A2, SORBS2, EXT1, NMNAT2, RAC1, CDH11, CADM2, QKI, BRINP1, SEPTIN11, SHISA9, RPL37, ERC1, CNTNAP2, NLGN4Y, PURG, PTPRZ1, NR3C1, CPEB3, GSG1L, ITPR1, DLGAP1, PTPRN2, CALB1, MPDZ, SH3KBP1, MAPK8, DLGAP2, PPP3R1, NDFIP1, NRG3, PRKN, SAMD4A, PJA2, PRKAR1A, HOMER1, ATP1A3, SNX14, KCNB1, DLG1, VPS54, NLGN1, SNCA, CACNA1B, TIAM1, DNM1, MAGI2, RIMS2, KCND2, MACO1, ABR, RTN4, ACTN1, PHACTR1, FCHO2, WASF1, SPG11, CNTNAP5, LRRTM4, GPC6, SLC4A10, DAAM1, GNG7, SYT11, ERC2, UTRN, PPP1R9A, NLGN4X, DGKI, PPA2, SORCS2, FRRS1L, CAMKV, PSEN1, RPL37A, HNRNPD, GRID1, KIF1A, CNTNAP3, DAB1, APP, PDE7B, DTNA, OPRM1, CASK, SLC1A3, HTT, ASIC2, RPS6KA2, KIDINS220, RIT2, DLG2, CPEB4, ITSN1, EXOC4, GNB1, NRXN3, RIC3, HTR2C, SGCE, CAPRIN1, EIF5, KCNIP1, SCAMP1, FAM171B, SIPA1L1, GRIN2A, GRID2, ARL8B, SPART, GLS
GO:0043025	neuronal cell body	103	0.03989155693261038	2.3014187859497013	1.2948625960376749e-16	1.4395825332418855e-14	13.84176343137359	2.4472903065112053e-13	KIF5C, GRIA4, SLC6A1, SLC8A1, GABBR1, RPTOR, AGFG1, NRXN1, DPYSL5, TUBB3, SLC12A2, XRN1, PDE1C, SLC38A2, PTBP2, LRRK2, PICALM, GRIA1, BMPR1A, NAP1L4, GRIK2, DSCAM, PDE1B, STAU2, MAP1A, MAP1B, INPP5F, KCND3, PURA, BAIAP2, MAP2, CACNA1E, FZD3, DTNBP1, ARHGEF7, STRN3, IL6ST, CACNA1A, ADNP, SHANK2, PRKAR2B, PTK2B, RAPGEF2, PUM2, GNA12, BMPR2, MYH10, LRP6, GPM6A, TRAK2, STRN, SOS1, SORBS2, RUFY3, BRINP1, ALCAM, SCN1A, HCN1, CNTNAP2, AKAP9, EPHA7, CALB1, CNKSR2, SERPINI1, GRM5, SPTBN4, PRKN, NEGR1, ATP1A3, KCNB1, COBL, SNCA, CACNA1B, CNNM1, CPNE5, SORL1, PENK, KCND2, RTN4, GRIA2, VPS13A, SLC25A27, SLC4A10, APOE, PSEN1, PPP1R1B, ZNF804A, SLC1A3, ASIC2, BRINP3, PAFAH1B1, KCNN3, SNCAIP, SLC38A1, ITSN1, RIC3, SMURF1, VTI1A, ABL1, UNC5C, FBXW11, GABRA2, LMTK2
GO:0005802	trans-Golgi network	56	0.021688613477924088	2.2334934159566227	4.226269439936736e-09	2.2821854975658374e-07	6.641649058736756	7.98764924148043e-06	TRAPPC9, PIK3C2A, B4GALT5, ATP2C1, SLC9A7, SYT11, GOLGA4, VAMP2, CLASP2, DOP1A, PREPL, WDR11, BIRC6, ATP8A2, TPST1, RAB10, STX16, ARL5A, ATXN2, CLVS2, GBF1, STX8, ARFGEF2, ATP9A, RAB6A, LRRK2, CNST, AP1G1, OSBPL9, PRKD1, LAMP2, SNAP25, GCC2, DOP1B, CCDC91, RAB11A, FUT9, DENND5A, CLVS1, BICD1, VPS54, SNX9, GGA2, CLTC, ATP9B, RELCH, ATP8A1, SCAMP1, ARFGEF1, SORL1, RGS20, ECPAS, RBFOX1, RAC1, NBEA, NMNAT2
GO:0030672	synaptic vesicle membrane	38	0.01471727343144849	2.2125325809789276	1.5690179291985833e-06	5.1128342865264184e-05	4.291338283082858	0.0029654438861853225	RAB7A, CLCN3, UNC13B, CALM3, SV2B, SYT1, STX12, DGKI, VAMP2, ATP6V0C, PTPRN2, DMXL2, DTNBP1, BORCS5, LAMP5, ATP6V1C1, SYN3, SYNPR, PRKN, SV2C, LRRK2, SYN2, SNAP25, SLC4A8, RAB11A, GRIA1, MCTP1, SLC35F1, SNCA, SCAMP1, ATP8A1, KIF1B, DNM1L, ATP2B1, GABRA2, ICA1, RAC1, ATP6V0A1
GO:0008021	synaptic vesicle	47	0.01820294345468629	2.2053401376042285	1.2805065099247577e-07	5.309958055605717e-06	5.274908909481795	0.00024201573037577922	CLCN3, SV2B, SEM1, VPS45, APBA1, SYT1, KIRREL3, STXBP5, STX12, SYT11, GABBR1, VAMP2, MFF, STX7, PSMA1, DMXL2, PSEN1, LAMP5, SYN3, RAB3C, RAB40B, SYNPR, PSMD14, PRKN, SV2C, BTBD8, PSMD1, LRRK2, SYN2, UBE3A, SNAP25, PICALM, TRIM9, SLC4A8, AP2B1, GRIA1, SNCAIP, SNAP91, SLC2A13, PPFIA2, PDE4B, VTI1A, IQSEC1, SNCA, GRIN2A, CTTNBP2, STON2
GO:0030054	cell junction	48	0.018590240123934933	2.1754805999577496	1.2225836793457557e-07	5.309958055605717e-06	5.274908909481795	0.0002310683153963478	FER, AFDN, APC, PARD3B, FLRT2, SPTBN1, PTPN5, ARHGAP21, ACTN2, PCDH7, EPB41L3, EPB41L2, LNX1, PTPRK, PARD3, PKP4, CTNNA1, SPTAN1, ADD1, SPTBN4, PTPRJ, CTNNB1, CCDC88C, DTNA, SLIT3, CASK, IQGAP1, MAGI3, CXADR, DLG1, PTK2B, MAGI1, SLC16A10, TJP1, BMPR2, CDH2, EPB41, TIAM1, IQCJ-SCHIP1, PTPRR, ERBIN, PATJ, TENM2, STRN, RTN4, RAP1A, AQP4, ACTN1
GO:0031901	early endosome membrane	55	0.021301316808675447	2.1092400047667286	6.661703043460139e-08	3.070882622473088e-06	5.512736783161768	0.00012590618752139664	EPS15, CLCN3, ZFYVE9, PPP1R21, INPP4A, APPL2, STX12, FIG4, SH3GL3, RABGEF1, ZFYVE16, INPP5F, ATP13A3, ITCH, SORCS2, MAPKAP1, MON2, RABEP1, STX7, KIAA0319, PSEN1, LAMP5, VPS13B, CLVS2, ATP9A, APP, EGFR, SNX1, EEA1, NSG2, KCNH1, CLVS1, GRIA1, DOP1B, EPHB1, OSBPL6, DNAJC13, NTRK2, VPS41, GGA2, ZFYVE28, SNX27, WASHC4, SLC9A6, SLC9A9, LRP6, SORL1, LDLRAD4, KIF16B, ARL8B, TMEM30A, PIKFYVE, SNX13, RAC1, ATP11B
GO:0005912	adherens junction	51	0.019752130131680867	2.0862301138056365	2.9852876900299897e-07	1.2004667519482298e-05	4.920649863633087	0.0005642193734156681	FRMD5, FER, EFNA5, VEZT, DDX6, AFDN, APC, PARD3B, RDX, BAIAP2, PTPRM, PTPRK, LRRC7, CTNNA2, RAB10, PKP4, CTNNA1, ADD1, SPTBN4, FRS2, ABI2, KLHL24, ADAM10, SORBS1, CTNNB1, CTNND2, CDH12, AHI1, CDHR3, FAT3, CXADR, TBCD, SSX2IP, DLG1, DLG2, MAGI1, FRMD4A, CRB1, CDH20, TJP1, BMPR2, CTNND1, CDH2, CDH4, CDH9, CDH18, CYTH1, PARD3, FRMD4B, CTNNA3, CDH11
GO:0036064	ciliary basal body	57	0.022075910147172733	2.029801095496293	1.2422479905095692e-07	5.309958055605717e-06	5.274908909481795	0.00023478487020630858	NME7, PKD2, CCDC146, KIF2A, CEP170, DAAM1, KIFAP3, FAM184A, RTTN, ERC1, TTLL5, ARMC9, MPHOSPH9, TTBK2, CYLD, SDCCAG8, WDR11, CEP192, SCLT1, CCDC88A, IFT88, PTK2, AGBL4, LUZP1, ALMS1, IQCB1, RAB6A, PJA2, CCDC66, INTU, GNAI1, IFT80, PCM1, ODF2L, AHI1, CEP350, CSNK1A1, CAMSAP2, TTLL7, FBXW8, TTLL11, SSX2IP, DZIP1, ARHGAP35, TOGARAM1, NIN, RAB28, CDKL5, DYNC2LI1, BBS2, MAP4, PRKCA, CEP128, SPATA7, MAP2K1, TTC8, KIAA0586
GO:0005911	cell-cell junction	53	0.020526723470178157	2.0228152946975566	4.488710430586376e-07	1.663463277217304e-05	4.778986782218016	0.0008483662713808251	PRKCH, KRIT1, PKD2, ACTR3, CDC42BPB, GRB2, CADM1, KIRREL3, AFDN, GAB1, FLRT2, JAM3, SDCCAG8, PAK1, EPB41L3, PTPRM, PTPRK, PKP4, CTNNA1, SH3KBP1, PTPRJ, FRS2, USP53, CTNNB1, ADD3, CASK, LIN7A, PRKD1, PAK2, IQGAP1, AHI1, MAGI3, IGSF11, GRIA1, CXADR, DLG1, CRB1, MAGI1, RAPGEF2, CDC42BPA, SPECC1L, CDH2, CTNND1, PDZD2, TIAM1, MAGI2, PIK3R1, ADGRL3, LIMS1, ADAM17, PARD3, TENM2, ACTN1
GO:0030659	cytoplasmic vesicle membrane	47	0.01820294345468629	2.0156334591006386	1.883019637244591e-06	6.0320459565970794e-05	4.219535358348414	0.003558907114392277	GABRB3, PKD2, RAB11FIP2, APPBP2, APPL2, STXBP5, RNF144A, SYT11, ZDHHC17, ARHGAP21, LNPEP, SGSM1, SLC12A2, VOPP1, C2CD5, SORCS2, CAMKV, DTNBP1, RAB10, RAP2A, SNX24, LAMP5, SH3KBP1, FMN2, SPIRE1, SORT1, DSE, GABRB2, AP1G1, HTT, NSG2, RAB11A, CLIP1, AP3S1, SNX9, GABRG2, DENND4C, GPRC5B, CLTC, SNCA, SCAMP1, ATP8A1, GRIN2A, TRPM7, ULK2, GABRA2, NMNAT2
GO:0098793	presynapse	60	0.023237800154918668	2.0025344434757524	1.0449723469050285e-07	4.702375561072628e-06	5.327682688356968	0.00019749977356505038	SLC4A10, CYP46A1, DAAM1, SLC6A1, AAK1, STXBP5, SYT11, GABBR1, ERC1, SH3GL3, DNM3, ERC2, DGKI, NRXN1, CANX, GNB5, GIT2, RPS27, ARHGAP44, PPP3CC, BAIAP2, CACNB4, NF1, GAP43, FBXL20, OPHN1, CACNB2, RGS7, KIF21A, RGS7BP, YWHAG, GSK3B, SLC24A2, ARFGEF2, SYNJ1, PRKN, SGIP1, APP, BTBD8, ZNF804A, LIN7A, SLC4A8, GRIA1, PTK2B, ITSN1, AP3S1, GRK3, CDH2, NLGN1, SNCA, CADPS, KIF1B, SCRN1, DNM1, TNIK, SH3GL2, GPM6A, PRUNE2, ITSN2, FCHO2
GO:0016607	nuclear speck	100	0.038729666924864445	1.9842692039415626	8.847603902543169e-12	6.688788550322636e-10	9.174652532987354	1.6721971375806588e-08	MTREX, DYRK1A, THOC2, MAML2, PLCB1, CDK12, CACNB4, KAZN, RSRC1, WAC, RBM39, BMP2K, PPIG, CSNK1A1, RSBN1L, PIAS2, SRRM2, LUC7L2, SF3B1, TENM1, ZC3H13, KMT2E, PIAS1, PSPC1, SFMBT2, SRSF11, EP400, PARN, MAML3, HDAC4, SPOP, THOC1, NSL1, SMC6, DENND1B, PAK2, DZIP1, ARGLU1, DHX15, RAD18, SMURF2, S100PBP, ASCC3, SGK1, ZNF106, PPP1R16B, LUC7L3, DACH1, MRTFB, ZNF638, NR3C1, DDX17, DDX46, RBM25, HIF1A, KAT6A, YTHDC1, CDC40, BNIP3L, PNISR, SCAPER, PRKN, HP1BP3, TRIP12, DHX36, RBBP6, PRPF40A, TCERG1, SON, TCF12, MORF4L1, WRN, CDK13, NRIP1, PIP5K1A, SREK1, SRRM1, THRAP3, HNRNPU, PSME4, COP1, RBM4, MEF2C, CPSF6, ZC3H14, FBXL4, FTO, SMC5, DDX5, MAPK14, SRSF4, CDYL, SRSF5, PPP4R3B, YLPM1, SFPQ, GATAD2B, GPATCH2, BCLAF1, SRPK2
GO:0005813	centrosome	145	0.05615801704105345	1.9603907101314184	5.370506348832861e-16	5.639031666274503e-14	13.248795466601633	1.0150256999294107e-12	BBS9, NME7, CALM2, KIFAP3, APC, SLMAP, CALM1, KIF13A, FBXL7, MCPH1, PAK1, UVRAG, CEP70, CEP126, BIRC6, ALMS1, GNAI1, EVI5, IFT80, KIZ, CSNK1A1, CEP350, MAPK1, FAM110B, PDE4D, NIN, LATS1, CEP128, KMT2E, CNTLN, KIF3A, CALM3, RNF19A, PRKACB, CCP110, RTTN, TTLL5, HOOK3, USP9X, PCGF5, CCDC57, ARHGEF7, CCDC88A, IFT88, LUZP1, ARFGEF2, PDE4DIP, CEP85L, CTNNB1, KAT2B, PCM1, MECP2, KIAA0586, CLIP1, DZIP1, PRKAR2B, PIBF1, SSX2IP, PPP1R12A, RABGAP1, CDKL5, MARCKS, RAD18, ECPAS, DYNC1I2, PCNT, ORC2, FRY, MTUS2, TTC8, PPP4R2, CCDC146, KIF2A, TACC1, DHX9, ERC1, ERCC6L2, CYLD, AKAP9, NR3C1, AKAP11, CLASP2, SDCCAG8, CSPP1, CEP192, CEP290, PTK2, GSK3B, CEP97, PJA2, CCDC66, PRKAR1A, RBBP6, KATNAL1, AHI1, BICD1, RAB11A, CAMSAP2, ANKRD26, ROCK2, CKAP5, PDE4B, TTC19, KIAA1217, CHD4, WRN, MAGI2, CNTRL, USP33, CDK6, MTUS1, NEK1, CCDC92, MAP2K1, TNKS, CDC27, CEP170, TUBGCP3, TTC28, MPHOSPH9, HNRNPU, CEP57, PSEN1, ITSN2, CUL3, CLASP1, IQCB1, CCDC88C, ODF2L, PAFAH1B1, TBCD, FIGN, ZNF365, PPP4R3B, EXOC4, DYNC2LI1, ATM, MIB1, CCDC14, SLF1, NUP93, DYNC1LI2, PDCD6IP, FBXW11, SCLT1
