GO:0005794	Golgi apparatus	172	0.09646662927650028	1.7947847304234867	1.703899439696741e-14	1.6949315479088634e-12	11.770847836673735	3.2203699410268406e-11	ASAP1, GOLGB1, SYT1, SULF2, KIFAP3, CSGALNACT1, ZDHHC17, RAB2A, TM9SF2, ATP1A1, DOP1A, CLU, MON2, BIRC6, CHPT1, GALNT1, ATXN2, TGOLN2, LRRK2, ACSL3, ELMOD1, PICALM, ZDHHC14, CCNI, MAPK1, FUT9, TRAPPC5, RTN3, ATL1, RELCH, MACF1, SPPL3, SERINC5, CALN1, APBB2, PRKG1, GLCE, CPQ, TMEM165, TBC1D5, ATP11B, SORCS1, CHST11, USP32, OLFM3, ATP2C1, HOOK3, PRKCE, ARMH3, FUT8, TVP23C, GABARAP, GNAQ, PRNP, GALNTL6, COPE, GLG1, CCDC88A, MAN1A1, CAMKMT, STRN3, MYO6, TSNAX, HERC1, ARFGEF2, PDE4DIP, CPE, OSBPL9, NSG2, ST8SIA3, CCDC91, JAKMIP2, PTGDS, GALNT13, ITM2B, CASD1, DIPK2A, ATP8A1, HEATR5A, TENM2, GALNT15, CCDC186, ATP9A, MGAT5, CERT1, TMEM30A, NMNAT2, TRAPPC8, PIK3C2A, DYM, CNTNAP2, AKAP9, CLASP2, PREPL, ANK3, DYNC2H1, VPS13B, DSE, RAB6A, NDFIP1, PRKN, RAB11A, CAMSAP2, VPS54, DLG1, RAB1A, RABGAP1L, SLC2A13, ATF6, VPS53, DENND4C, NLGN1, ARFGEF1, SORL1, USP33, ARF3, MTUS1, MAP2K1, MAN2A1, HEATR5B, VPS13A, GIGYF2, TNKS, MAN1A2, PKD2, TTC3, SLC9A7, SYNE1, RICTOR, SYT11, FAIM2, TPP1, HLA-DQB1, APOE, ARHGAP32, AP1S2, PCSK1N, RAB10, ST8SIA4, CUL3, TRAPPC12, OCIAD1, CHSY3, PLEKHM3, TMEM43, RAB1B, AGBL4, STX16, COG5, CLASP1, ADAM10, APP, FNDC3A, LRBA, WWOX, GOLGA4, HTT, SLC35A3, AP3B1, SLC10A7, NDST3, PITPNB, MOB4, VTI1A, RAB3GAP1, SGCE, HS2ST1, SCAMP1, TMBIM4, SELENOH, SPINT2, CCAR1
GO:0032991	protein-containing complex	113	0.0633763320246775	1.756795335639647	3.365519888267732e-09	1.7191439429259495e-07	6.764687758565268	6.360832588826013e-06	MT-CYB, ACTB, UBE2V1, CALM2, GUCY1B1, PLCB1, CALM1, MAP3K5, ATP1A1, MGA, MFF, CLU, PAK1, STK3, HSPA1A, DMD, MBP, DGKH, RBM39, GRIA1, HSP90AA1, STAU2, ATXN1, DCTN1, KMT2E, FER, ZFYVE9, CALM3, OGT, PDSS1, SMARCC1, ADGRV1, ATP2B4, XPO1, CRYBG3, ARHGEF7, RPL23, MAGED1, XRCC5, STRADA, STRN3, UBR5, CAMKMT, CGNL1, MYSM1, SUGT1, RYR2, CTNNB1, KAT2B, OSBPL9, PCM1, SSX2IP, RAPGEF2, WNK1, HSP90B1, DHX9, ERCC6L2, PTPN11, URI1, YWHAQ, NR3C1, ITPR1, AKAP10, HSP90AB1, SMAD4, HIPK2, CEP290, EYA1, HSPH1, PRKN, SMAD1, RPL5, PRKAR1A, RAB11A, SMAD5, CAB39, HNRNPC, RPL3, RAB3GAP2, TJP1, NCOA1, AKAP6, SNCA, CHD4, ARHGAP29, MAGI2, SMAD2, GIGYF2, WASF1, STT3B, FOXO3, NCOA2, HNRNPU, SPTBN1, UTRN, DGKI, CDK8, FBXW7, KPNB1, YWHAB, APP, DTNA, AHR, PRKDC, HTT, KIDINS220, MLLT10, EPB41, CLTC, RAB3GAP1, GATAD2B, PRKCA, TRPS1
GO:0000139	Golgi membrane	103	0.05776780706674145	1.6828652819612544	1.2963956740298948e-07	5.833780533134526e-06	5.234049913068495	0.0002450187823916501	ASAP1, SCFD1, GOLGB1, CSGALNACT1, ZDHHC17, RAB2A, KIF13A, ATP6V0C, DOP1A, CLSTN1, ATP6AP2, CHPT1, SGMS1, GALNT1, LRRK2, SGCZ, MGAT4A, FUT9, RTN3, ACER3, ATL1, VAPA, GLCE, TMEM165, ST6GALNAC3, CHST11, USP32, HACE1, ATP2C1, ARMH3, FUT8, TVP23C, GABARAP, GALNTL6, COPE, GLG1, MAN1A1, ARFGEF2, RTN1, MGAT4C, ST8SIA3, GALNT13, ITM2B, CASD1, DIPK2A, LDLRAD4, PLD3, GALNT15, SCARB2, MGAT5, NMNAT2, ST3GAL3, ERC1, SGCD, VPS13B, ATP6V1H, DSE, RAB6A, NDFIP1, ROCK1, PRKN, PJA2, RAB11A, TNKS2, RAB1A, HS3ST5, ATF6, SYBU, ARFGEF1, SORL1, ARF3, MAN2A1, RNASEK, TNKS, MAN1A2, SLC9A7, FAIM2, COP1, HLA-DQB1, ARHGAP32, AP1S2, COG6, CD59, RAB10, ST8SIA4, HUWE1, STX16, CHSY3, RAB1B, COG5, ADAM10, FNDC3A, GOLGA4, SLC35A3, SLC10A7, NDST3, PITPNB, ST6GALNAC5, VTI1A, SGCE, HS2ST1, TMBIM4, NCAM1
GO:0005829	cytosol	706	0.39596186203028605	1.6132998042286393	3.767140733712633e-49	3.559947993358439e-46	45.448556346510955	7.119895986716877e-46	KIFAP3, STXBP5, RPL7A, ARL6IP1, RPTOR, ZFYVE16, RAB2A, TTBK2, RERG, RAPH1, MAP3K5, ADK, PPP6R2, CRADD, SMAP2, PDE1C, ERBB4, KAZN, GUCY1A2, YWHAG, RBMS1, SGK3, FAM120A, HBS1L, RPL35, RPS19, RAPGEF4, CSDE1, MAPK1, GRIA1, AMD1, SEPTIN7, MYO9A, RBMS3, NME2, RPL13, FAM13A, PIK3C3, PPP2CA, UBXN7, PCCA, ANKRD28, DOCK11, MAP1B, ZFYVE9, PRRC2C, PHKB, DOCK5, HMGCLL1, RMND5A, USP48, PDPK1, MAP2, ARMH3, FNIP1, XPO1, CAND1, PLAAT3, PLEKHA5, GABARAP, KLC1, MAGED1, ADD1, RPL17, HERC1, ENAH, SUGT1, CTNNB1, OSBPL9, PCM1, BTRC, TAX1BP1, CCDC91, PRKAR2B, HTRA1, DCC, RPL18, EXOC2, PDE10A, SNX27, CYB5R3, RPLP2, STAG1, MAP7, GRIP1, SOS1, EXOC1, RUFY3, PEX5L, TACC1, PDS5B, ASB3, RPL37, MYO5A, RPS9, PUM1, PABPC1, RACK1, PREPL, ADAR, PDZRN3, PPIP5K2, TDRD3, ACTR2, LIMS2, RAB6A, PRKN, ACBD6, PIP4K2A, RPL5, PRKAR1A, SMAD5, JAK2, TNKS2, ENDOD1, TSC22D1, ILRUN, DENND4C, PDZD2, ARHGEF12, SMAD2, MIPOL1, ZCCHC7, RAP1A, MAP2K1, VPS13A, HEATR5B, ME1, CRPPA, DPYD, RABGEF1, HNRNPU, MECOM, SPTBN1, CDC16, G3BP2, EPB41L2, KPNB1, PPP1R1B, RPL8, YWHAB, LSM14A, SGIP1, ADD3, PPP2R5E, AHR, WWOX, LRBA, RPS29, FBXO11, PAFAH1B1, CSNK2A1, ITSN1, NET1, ARHGEF10, NR3C2, TPM1, SBF2, INO80, LMO7, ARPC1B, LPP, PAPSS1, RPS28, SPART, KPNA1, FBXW11, YWHAH, EPS15, EPB41L1, SCFD1, UBE2V1, NLK, GUCY1B1, YWHAE, APC, RIMS1, CFLAR, SRGAP3, RPS21, PDE8B, NAA25, GDAP1, LRP1, BIRC6, HSPA1A, HLCS, PIGN, SYNCRIP, DMD, RPL27A, SYNJ1, USP9Y, LRRK2, THRA, UBE3A, PPP3CA, TJP2, AP2B1, MSI2, CCDC6, TRAPPC5, ARHGAP5, PDE4D, RPL13A, USP11, PTMA, IQSEC1, RPL12, WWP1, ATXN10, DISC1, MCF2L2, PARD3, PRKG1, TBC1D5, NBEA, MDH1, AGBL1, PRKACB, PRKCE, SH3GL3, USP9X, GPS2, ABL2, DST, MTAP, ARPC1A, PRNP, RGS7, KLHL2, PPP2R2A, RPL23, STRADA, ABI2, ARFGEF2, PLEKHA1, STAG2, ETNK1, SLC44A1, CRBN, EEA1, FAM13B, PTPN4, USP15, ATG10, WNK1, EIF4G3, CTNND1, HSP90B1, RABGAP1, PAK3, WDFY3, MKLN1, OSBPL8, CERT1, HMBOX1, NMNAT2, ZNF106, RBX1, ECSCR, UBE2H, RCOR3, PLCG2, CSNK1E, ITPRID2, NEDD8, RPL34, CLOCK, CYLD, URI1, EIF4A2, SDCCAG8, CLASP2, PSMA6, DCAF8, SMAD4, RASAL2, LRRC7, CEP192, UBE2R2, EPN2, RPL36, ATP6V1H, LONP2, SHOC2, PHLDB2, PSMD1, PJA2, RASA2, UBR2, NHLRC2, ANKRD11, PEG10, FYN, VPS54, HNRNPC, CSNK2B, RAB1A, RPL3, PPFIA2, ATF6, NCOA1, RPL21, SNCA, PPP2R5C, DENND1A, NSF, TIAM1, RAPGEF6, CHD9, ARHGAP29, SORL1, USP33, MTMR7, GLUL, TOP2B, ARID4B, FHIT, USP47, SEC24B, RICTOR, PDS5A, CREBBP, AGTPBP1, COP1, DPP8, LARP1B, INPP4B, RPL37A, RNF216, FMN2, TASOR2, CLASP1, APP, PRMT3, HSD17B4, FIP1L1, FOCAD, PRKDC, ANK2, KIDINS220, TAB2, DENND4A, GNB1, EEF1G, NTRK2, PPP2R2B, CLTC, AHCYL1, NDRG4, SHB, FNIP2, USP37, PRKCA, NCAM1, WASL, REPS1, COMMD1, USP25, AHNAK, PPP2R2C, CYFIP2, ASAP1, GUCY1A1, RPS6KA3, INPP4A, ARHGAP20, GNAI2, OAZ1, CUEDC2, NCOR1, AGFG1, CALM1, ARHGAP44, DOCK10, CTNNA1, RGL1, CHN1, KMT2A, ALMS1, URGCP, EVI5, UBE2K, PDE8A, PPIG, RPS23, RPL36A, LARP1, SPIN1, FAF1, HSP90AA1, CAMK2D, SRGAP2, ATG7, ABI1, MAP1A, DCTN1, KIF3A, GPBP1, RPS17, FER, AHCTF1, OGT, RPL9, RPL18A, NBEAL1, RPS14, EPB41L3, TLN2, DYNC1I1, PPA1, DNAJC6, ZMYM2, RPS18, MYO6, KAT2B, UBE2E3, MECP2, CDK19, OLA1, PTEN, RAPGEF2, PUM2, ARHGAP26, DIAPH2, DOK6, DPYSL2, DYNC1I2, ATP9A, LGALS3, RPS8, QKI, KIF2A, PDE5A, PIK3C2A, RPS20, ZFP36L1, YWHAQ, PTPN5, AKAP11, PTPN11, LNPEP, RO60, AHCYL2, DDX17, RB1, AKAP10, CTNNA2, ANK3, CEP290, KLHL3, SPTAN1, GSK3B, MAPK8, PPP3R1, SERBP1, FRS2, RPL38, ROCK1, RAPGEF1, FBXO38, PPP3CB, TRIP12, TNPO1, KSR2, HECTD2, OGA, DLG1, TNRC6B, RAB3GAP2, ROCK2, CDC42BPA, SPAG9, TJP1, VPS13C, SOS2, NFAT5, CDK6, NEK1, RPL27, TNKS, PHACTR1, PHLPP1, UBA52, CDC27, ELMO1, FOXO3, DDX6, NCDN, PEBP1, RPS27, RIPOR2, GPHN, PPM1B, KPNA5, RANBP9, FBXW7, TAOK1, AP1S2, CAMK2B, RGS6, FTO, CUL3, STX16, FMNL2, USP34, TRAPPC12, RAB1B, DDX5, PPP6R3, GAPDH, NPEPPS, GOLGA4, MAP4K5, TTLL7, FGF13, PARG, SNCAIP, CARMIL1, PRKAG2, CUL5, BRAF, RPL26, RAB3GAP1, ATM, HNRNPDL, HERC2, SERGEF, TNRC6C, KIF5B, FKBP1A, AKAP13, GLS, SCLT1, NUFIP2, BBS9, NME7, GOLGB1, ACTB, AFDN, PACRG, RB1CC1, EIF4A1, PLCB1, ELOB, VAMP2, FBXL20, DOP1A, NPHP3, CACNB4, LRCH3, PAK1, CLU, AK5, STK3, MON2, XRN1, GMDS, JAK1, EXOC6, MBP, LSAMP, MIF, PICALM, CSNK1A1, PDLIM5, LRRFIP1, DICER1, VAPA, IREB2, SERINC5, EVL, TNIK, STAU2, HERC3, CAPNS1, PSIP1, PRKACA, TAGLN2, ATXN1, HELZ, GNAS, HIPK3, DOCK1, AAK1, NAA15, EHBP1, S100A13, PPP4R3A, FNBP1, MTPN, PSMA2, RASA1, TPT1, NF1, ATAD1, DGKB, DTNBP1, ARHGEF7, PAN3, CCDC88A, USP14, COPE, TIAM2, FXR1, XRCC5, CAMKMT, PIK3CB, TSNAX, ANKIB1, YWHAZ, SNAP25, DOCK4, CLIP1, PSMB7, SDCBP, PPP1R12A, SPRED1, CAPZA2, SESN1, HEATR5A, CBLB, RPS16, ASCC3, GPI, ACACA, TRAPPC8, MBNL1, CAPZB, DHX9, AKAP9, NR3C1, RIN2, SENP6, HSP90AB1, CSNK1G1, PTK2, SPATA13, HSPH1, PIK3R3, SMAD1, DHX36, IQGAP1, AHI1, DHFR, RAB11A, NEMF, NCKAP1, CAB39, OSBPL6, DOCK9, VPS53, MRTFA, CDC42EP5, CNOT2, PDE4B, FBXL5, DYNC1H1, BBS2, ARFGEF1, MAPT, GAB1, GIGYF2, WASF1, BABAM2, RPLP1, NBAS, RPS12, ARHGAP6, CDK14, DGKI, UTRN, MAPK10, ARHGAP32, NKTR, SRSF1, KCNIP4, RAB10, HUWE1, AGBL4, ATXN7, COG5, MAPK14, RPL28, FNDC3A, CASK, RC3H1, HTT, TRIO, UCHL1, DLG2, EXOC4, SFPQ, VTI1A, EPB41, TNRC6A, SLK, MIB1, MAP3K2, PIK3R1, SRPK2, MAPK4, HERC4, CNN3, TMCC1
GO:0005654	nucleoplasm	501	0.2809871003925967	1.6035495482643176	3.687436474378255e-31	1.3938509873149805e-28	27.85578365295679	6.969254936574902e-28	NSD3, MTREX, RPTOR, NDUFA13, ADK, NFIA, ARPP19, MGA, NIPBL, NAV2, ERBB4, KAZN, SENP7, NECAB1, RPS19, ANKRD17, MAPK1, PIAS2, RUNX1T1, BDP1, MGMT, NCOA6, TSPYL1, BRWD1, HECTD1, UBXN7, ZC3H13, ANKRD28, VEZT, RMND5A, ARID2, USP48, ARID4A, XPO1, CAND1, TET2, HNRNPK, SUPT3H, XRRA1, ZNF655, ADD1, KDM2A, SETX, YTHDC2, DCAF6, CTNNB1, BTRC, NEXMIF, CDKL5, STAG1, POU2F1, PHACTR3, RERE, AFF4, PDS5B, CHD2, RPS9, UTY, PUM1, SLTM, UBN2, RACK1, MSH2, KDM4C, ADAR, SMARCA2, TDRD3, SV2C, PIP4K2A, RPL5, SMAD5, IRF2BP2, TCERG1, JAK2, PRDM2, PTPN13, TCF12, BBX, WRN, SMAD2, PHF21A, MSH3, XRN2, ZFHX3, TCF4, APPBP2, HNRNPA2B1, HNRNPU, MECOM, CDC16, RBM4, EPB41L2, KPNB1, RPL8, RBPJ, AHR, WWOX, ATF2, RPS29, ATRX, FBXO11, CSNK2A1, NR3C2, LCOR, CCNH, GATAD2B, INO80, RPRD2, CDC73, ZNF609, TLK1, RPS28, RBFOX1, KPNA1, ZRANB2, FBXW11, SHPRH, UBE2V1, NLK, DYRK1A, THOC2, APC, CFLAR, RPS21, TAF15, KDM5A, RSF1, HSPA1A, KHDRBS2, ESRRG, SYNCRIP, RPL27A, WAC, BTBD8, MPHOSPH8, PPP3CA, THRA, TJP2, SYNE2, CEP350, USP11, PTMA, IQSEC1, WDR70, UBL5, CDC14B, MLLT3, SETBP1, ZNF451, PSPC1, RALYL, UBE2W, GTF2I, PRKACB, SMARCC1, GPS2, GIT2, PPHLN1, SOX5, PPP2R2A, RPL23, ARNT2, STRADA, SLF2, NUCKS1, ABI2, PLEKHA1, SETD2, MNAT1, STAG2, SP3, CELF2, IBTK, MED27, PTPN4, USP15, MEF2A, HMGB1, DHX15, RANBP3, MKLN1, ECPAS, CERT1, ELF2, HMBOX1, ARID5B, RBX1, FBXL17, RCOR3, REV3L, CSNK1E, NEDD8, CLOCK, URI1, ZNF638, PSMA6, DCAF8, SMAD4, EYA1, PSMD1, ANKRD11, LRPPRC, ZMYND8, HNRNPC, CSNK2B, ATF6, NCOA1, ZMYND11, PPP2R5C, RBM27, ZHX1, EPC1, CHD9, NR6A1, TIAM1, ZHX3, TRA2A, TOP2B, PHC3, ZNF148, ARID4B, U2SURP, NRIP1, USP47, MSL2, PDS5A, SYNE1, COMMD10, CREBBP, CELF1, AGTPBP1, COP1, PBRM1, ZEB2, CPSF6, ATAD2B, TASOR2, ZMAT3, SNRPN, BCL11B, FIP1L1, PRKDC, NMD3, TP53BP1, MACROD2, TAB2, NSD1, IER2, ARID1B, SCAI, USP37, MXI1, PRKCA, COMMD1, ZEB1, GUCY1A1, RPS6KA3, INPP4A, NCOR1, CUEDC2, CALM1, RPRD1A, HNRNPR, PAPOLA, AEBP2, DOCK10, KATNBL1, PLPPR1, KMT2A, RAD50, RBM39, PPIG, RPS23, FAF1, SPIN1, HSP90AA1, SCAF11, CAMK2D, SF3B1, TLK2, MINDY2, JAZF1, ETS2, PIAS1, KMT2E, RPS17, TBL1XR1, AHCTF1, SRSF11, OGT, BTBD10, RPS14, TARDBP, RPS18, RNGTT, STRN3, UBR5, MYO6, NPAS3, KAT2B, UBE2E3, MECP2, CDK19, ZBTB20, PTEN, RORA, DMTF1, SUPT16H, CREBRF, RIF1, PHYHIP, LGALS3, RPS8, QKI, KIF2A, PIK3C2A, RYBP, KANSL1, RPS20, PTPN5, ERCC6L2, PTPN11, CELF4, DDX17, RB1, RBM25, TASOR, HIPK2, KAT6A, ARID1A, GSK3B, MAPK8, PPP3R1, ZNF207, TRIM33, PPP3CB, TRIP12, SMYD3, TNPO1, TNRC6B, KMT2C, KCTD1, ASH1L, CHD4, NFAT5, CDK6, NEK1, RPL27, DDX39B, EHMT1, UBA52, CDC27, FOXO3, LDB2, NCOA2, ANKRD12, RARB, RPS27, THRB, CDK8, KPNA5, RANBP9, DCAF5, FBXW7, PUM3, CAMK2B, SUZ12, RGS6, FTO, CUL3, DCAF10, TRAPPC12, DDX5, PPP6R3, RIT2, PARG, PRKAG2, TERF2IP, RPL26, ATM, HNRNPDL, HERC2, BCLAF1, TNRC6C, SERGEF, CWC27, NUFIP2, NME7, RAPGEF5, SSBP2, ACTB, PPM1H, AFDN, CAMK4, RNF38, ELOB, ATF7IP, PAK1, USP22, SMARCAD1, SMARCA5, TLE4, KDM6A, AFF3, LUC7L2, TOP1, TNIK, STAU2, MED13, PRKACA, PSIP1, BPTF, ATXN1, HIPK3, MYCBP2, MBD5, PPP4R3A, ATF7, PSMA2, TPT1, ATE1, NF1, ELP4, TIAM2, XRCC5, CAMKMT, FOXP1, LYST, PIK3CB, MYSM1, TSNAX, ANKS1B, YWHAZ, SPIDR, JMJD1C, PSMB7, SDCBP, PPP1R12A, SPRED1, RBFOX2, PHF20L1, SESN1, ZBTB38, NRF1, WDR33, RPS16, ASCC3, NSMCE2, DACH1, MBNL1, SCAF8, DHX9, NR3C1, RNPC3, SENP6, HSP90AB1, ZNF462, KAT6B, RBM26, SPATA13, HSPH1, AKT3, LRMDA, SMAD1, SUGP2, DHX36, MDN1, MRTFA, ATR, MORF4L1, ARFGEF1, CDK13, BABAM2, SMCHD1, MBNL2, CDK14, RPS12, MAPK10, NKTR, SRSF1, HUWE1, ATXN7, MAPK14, CASK, PBX1, AQR, HTT, UCHL1, MED13L, NEK7, HDAC8, SFPQ, MLLT10, ZNF410, TNRC6A, MAP3K2, SRPK2, CWC15, MAPK4, CCAR1, TRPS1
GO:0005730	nucleolus	112	0.0628154795288839	1.5531183870070742	2.8163786296025425e-06	9.678101108997828e-05	4.014209845045079	0.005322955609948806	RPS6KA3, MTREX, RPL7A, HNRNPR, TAF15, LRP1, CRADD, KDM5A, KATNBL1, SMARCA5, RPL35, RPS19, RPS23, SYNE2, SPIN1, RPL13A, TSPYL1, SCAF11, RPL13, RESF1, TOP1, BRWD1, SF3B1, HECTD1, STAU2, PSIP1, ATXN1, CDC14B, RPS17, PSPC1, RPL9, FGF12, RPS14, XPO1, NF1, AOPEP, RPL23, FXR1, ZNF655, XRCC5, SETX, PIK3CB, NUCKS1, CAMKMT, MYSM1, STAG2, MED27, OLA1, RORA, DHX15, DDX24, NTRK3, RPS16, ZNF106, RPS8, KIF2A, REV3L, DHX9, PTPN11, RPS9, ITPR1, DDX17, KAT6A, ADAR, RPL36, ACTR2, RPL5, TNPO1, MDN1, ZMYND8, RPL3, EPC1, WRN, TRA2A, ARFGEF1, SMAD2, ZCCHC7, MTUS1, XRN2, RPL27, TOP2B, NRIP1, LDB2, RPS12, DDX10, SYNE1, SPTBN1, RPS27, RBM4, CDK8, ZEB2, OXR1, FBXW7, PUM3, SUZ12, RPL8, RBPJ, FMN2, DDX5, ATXN7, ZMAT3, CASK, GNL3L, NMD3, PRKDC, FBXO11, MACROD2, RPL26, ATM, SRPK2, RPS28, ZEB1
GO:0031410	cytoplasmic vesicle	122	0.06842400448681997	1.5520493352539033	8.796773568297112e-07	3.4637295925169874e-05	4.460456019963482	0.001662590204408154	SYT1, STXBP5, ZDHHC17, AGFG1, RAB2A, VAMP2, ATP6V0C, MFF, CLU, ATP6AP2, ASTN1, LAMP5, SYNPR, SGK3, BTBD8, LRRK2, PICALM, AP2B1, IQSEC1, SRGAP2, PIK3C3, TRPM7, HERC3, PRKACA, TBC1D5, GNAS, GABRB3, VEZT, PAM, FNBP1, PDPK1, DST, KLC1, GABARAP, DMXL2, DTNBP1, DNAJC6, COPE, USP14, CCDC88A, MAN1A1, MYO6, ARFGEF2, PCSK2, CPE, EEA1, LAMP2, NSG2, TRIM9, TAX1BP1, CLIP1, SCN8A, SPRED1, SLC35F1, DIPK2A, ATP8A1, ATP2B1, GRIP1, ECPAS, TMEM30A, NMNAT2, ATP6V0A1, SNAP23, PIK3C2A, LMBRD1, MYO5A, LNPEP, SLC30A9, ITPR1, PTPRN2, CEP290, SERPINI1, EPN2, VPS13B, ATP6V1H, DSE, RAB6A, SV2C, GABRB2, RAB11A, NUMB, ASTN2, SSH2, RABGAP1L, SPAG9, SYBU, GABRG2, ANP32E, DENND4C, DENND1A, SLC9A9, KIF1B, DNM1, SORL1, HEATR5B, RNASEK, VPS13A, PKD2, SEC24B, SYT11, DGKI, AP1S2, RAB10, RNF216, FMN2, ADAM10, APP, FNDC3A, SLC1A3, HTT, CALY, AP3B1, MCTP1, DENND4A, ITSN1, VTI1A, CLTC, ATM, MIB1, WASL, COMMD1, GABRA2
GO:0005737	cytoplasm	868	0.4868199663488503	1.551136142778608	3.413084459067834e-57	6.450729627638206e-54	53.19039116050644	6.450729627638206e-54	KIF5C, SNTG1, STXBP5, RPL7A, ARL6IP1, RPTOR, SYNPO2, ZFYVE16, RAB2A, TTBK2, RERG, NDUFA13, MAP3K5, ADK, ARPP19, MFF, PPP6R2, CRADD, SMAP2, CHPT1, KIF21A, KAZN, GUCY1A2, YWHAG, SENP7, ATXN2, SEPTIN2, NECAB1, SGK3, FAM120A, HBS1L, GNAL, RPS19, RAPGEF4, BMP2K, RPL35, CSDE1, ANKRD17, MAPK1, STOX2, SPAG16, SEPTIN7, MYO9A, TAOK3, VWA8, ATL1, RBMS3, NME2, RPL13, BRWD1, PIK3C3, PPP2CA, SUCO, MAP1B, ZFYVE9, TUBA1B, HOOK3, RNF150, DOCK5, RMND5A, CSNK1G3, USP48, SIK3, PDPK1, MAP2, ARMH3, FNIP1, XPO1, CAND1, ZFR, TBCA, PLAAT3, AOPEP, PLEKHA5, KLC1, GNAQ, HNRNPK, XRRA1, MAGED1, ZNF655, ADD1, SETX, YTHDC2, RPL17, HERC1, ENAH, SUGT1, DCAF6, CTNNB1, PCM1, BTRC, TRIM9, TAX1BP1, GNAO1, PRKAR2B, RPL18, MARK1, NEXMIF, CYB5R3, DUSP1, RPLP2, RGS20, GRIP1, SOS1, FRY, EXOC1, RUFY3, PEX5L, TACC1, ASB3, RPL37, MYO5A, ERC1, RPS9, PUM1, PABPC1, FEZ2, RACK1, BTBD9, ADAR, PDZRN3, NAP1L1, TDRD3, ACTR2, LIMS2, NDFIP1, PRKN, ACBD6, PIP4K2A, RPL5, PRKAR1A, SMAD5, NELL2, AVL9, IRF2BP2, JAK2, TNKS2, PTPN13, ABLIM1, TCF12, TSC22D1, ILRUN, GULP1, PDZD2, AKAP6, ARHGEF12, WRN, MAGI2, SMAD2, LANCL1, ARF3, MTUS1, RAP1A, MAP2K1, DPYD, ME1, SCN3A, PKD2, ZFHX3, NEBL, APPBP2, HNRNPA2B1, STRBP, RABGEF1, HNRNPU, MECOM, SPTBN1, CDC16, RBM4, G3BP2, PPA2, DZIP3, KPNB1, PPP1R1B, RPL8, RBPJ, PLEKHM3, YWHAB, LSM14A, ADAM10, LMO3, SGIP1, ADD3, LONRF2, PPP2R5E, ZNF804A, AHR, WWOX, ATF2, RPS29, FBXO11, BRINP3, SIK2, PAFAH1B1, ARAP2, RNF13, PITPNB, TRMT11, FRMD4A, AK3, ITSN1, NET1, ARHGEF10, PTH1R, NR3C2, SBF2, KCNIP1, INO80, LMO7, LPP, PAPSS1, RPS28, SPART, RBFOX1, FBXW11, KPNA1, SPINT2, YWHAH, EPS15, SCFD1, UBE2V1, NLK, DYRK1A, GUCY1B1, YWHAE, APC, THOC2, CFLAR, DNM3, RPS21, BASP1, TM9SF2, OPHN1, NAA25, GDAP1, LRP1, TAF15, RGS17, HSPA1A, HLCS, RSRC1, SYNCRIP, RPL27A, SYNJ1, USP9Y, MPHOSPH8, LRRK2, THRA, DGKH, UBE3A, PPP3CA, RBM33, BCAS3, SYNE2, MSI2, DSTN, CCDC6, TRAPPC5, ARHGAP5, SACS, PDE4D, RPL13A, USP11, CDH2, IQSEC1, MKNK2, RPL12, MACF1, CYB5R4, WWP1, UBL5, APBB2, ATXN10, DISC1, CDC14B, MCF2L2, PARD3, PRKG1, NBEA, TBC1D5, HSPA12A, MDH1, USP32, PSPC1, TMBIM6, UBE2W, ATP2C1, AGBL1, GTF2I, PRKACB, PRKCE, SH3GL3, USP9X, SMARCC1, GPS2, WDR7, GAP43, PPHLN1, MTAP, DST, FZD3, PRNP, RGS7, KLHL2, RPL23, ARNT2, STRADA, NUCKS1, ABI2, ARFGEF2, PLEKHA1, SETD2, CELF2, ETNK1, CACNA1A, CRBN, EEA1, IBTK, PTPN4, OPA1, TBC1D32, USP15, ATG10, HMGB1, WNK1, EIF4G3, RANBP3, RABGAP1, CTNND1, PAK3, TUG1, WDFY3, MKLN1, ECPAS, CERT1, HMBOX1, FRMD4B, DAPK1, NMNAT2, RBX1, ECSCR, FBXL17, PLCG2, CSNK1E, SESN3, ITPRID2, RPL34, NEDD8, CLOCK, URI1, ZNF638, CYLD, SDCCAG8, CLASP2, PSMA6, DCAF8, SMAD4, ERICH3, CEP192, LRRC7, EPN2, EYA1, RPL36, LONP2, SHOC2, KLHL24, PHLDB2, PJA2, RASA2, INTU, UBR2, TENM4, NUMB, FYN, PEG10, LRPPRC, ZMYND8, VPS54, CSNK2B, SSH2, RPL3, RABGAP1L, PPFIA2, SPECC1L, INVS, RPL21, SNCA, DCLK1, NSF, TIAM1, EPC1, CHD9, RAPGEF6, RBM27, ARHGAP29, EIF4EBP2, USP33, MTMR7, GLUL, RPS6KC1, ARID4B, FHIT, USP47, TTC3, SYNE1, CREBBP, COMMD10, SYT11, CELF1, AGTPBP1, COP1, ERC2, PPP1R9A, DPP8, CPSF6, INPP4B, MTSS1, RPL37A, RNF216, ARL5A, AGAP1, FMN2, FARS2, SNRPN, APP, PRMT3, NMD3, TP53BP1, TAB2, PLCL1, MOB4, GNB1, EEF1G, PPP2R2B, IER2, SCAI, GAS7, AHCYL1, NDRG4, SHB, FNIP2, SLIRP, PRKCA, WASL, REPS1, COMMD1, WDFY2, USP25, AHNAK, ASAP1, CYFIP2, GUCY1A1, RPS6KA3, SYT1, INPP4A, GNAI2, OAZ1, GABBR1, CUEDC2, AGFG1, CALM1, HNRNPR, PAPOLA, ARHGAP44, SEPTIN10, NDUFC2, ATP6AP2, PTPRM, DOCK10, MAP4K4, CTNNA1, PRXL2A, ALMS1, URGCP, IFT80, UBE2K, DENND11, PPIG, CCNI, RPS23, RPL36A, LARP1, FAF1, SHTN1, HSP90AA1, CAMK2D, SRGAP2, ATG7, ABI1, SOD2, MAP1A, TAFA5, DCTN1, KMT2E, KIF3A, GPBP1, RPS17, FER, CALM3, AHCTF1, MOB3B, OGT, RPL9, RPL18A, BTBD10, RPS14, EPB41L3, TLN2, DYNC1I1, TARDBP, PPA1, DNAJC6, RPS18, STRN3, UBR5, MYO6, KAT2B, UBE2E3, MECP2, CDK19, MAPRE2, ZBTB20, OLA1, PTEN, RAPGEF2, GRIN2B, PUM2, ARHGAP26, CREBRF, DDX24, PHYHIP, DPYSL2, DYNC1I2, LGALS3, ATP6V0A1, RPS8, QKI, KIF2A, PIK3C2A, LPGAT1, RYBP, STXBP5L, ROBO1, RPS20, ZFP36L1, YWHAQ, ERCC6L2, AKAP11, TBCK, PTPN11, CELF4, RO60, AHCYL2, DDX17, RB1, RBM25, TRIM2, AKAP10, HIPK2, CTNNA2, CEP290, KLHL3, ZYG11B, MPDZ, DYNC2H1, ARPP21, GSK3B, MAPK8, SERBP1, FRS2, RPL38, ROCK1, RAPGEF1, FBXO38, PPP3CB, SMYD3, TNPO1, CAMSAP2, KSR2, OGA, DLG1, RAB3GAP2, ROCK2, CDC42BPA, SLC2A13, SPAG9, TJP1, VPS13C, ANP32E, CHD4, KIF1B, ASPH, NFAT5, CDK6, NEK1, RPL27, TNKS, PHACTR1, PHLPP1, DDX39B, DIP2B, RALGPS2, UBA52, CDC27, ELMO1, FOXO3, ANKHD1, DDX6, NCOA2, PEBP1, RARB, RPS27, RIPOR2, GPHN, APOE, KPNA5, RANBP9, DCAF5, FBXW7, TAOK1, AP1S2, CAMK2B, ARHGAP12, RGS6, FTO, CUL3, STX16, FMNL2, TRAPPC12, RAB1B, DDX5, PPP6R3, GAPDH, RHOQ, NPEPPS, GOLGA4, MAP4K5, KCNN3, FGF13, PARG, SNCAIP, RIT2, CARMIL1, PRKAG2, CUL5, BRAF, RPL26, RAB3GAP1, ATM, TERF2IP, HNRNPDL, HERC2, BCLAF1, SERGEF, KIF5B, FKBP1A, AKAP13, CTNND2, NUFIP2, BBS9, NME7, SSBP2, SEPTIN9, ACTB, PPM1H, AFDN, CALM2, CAMK4, RB1CC1, EIF4A1, GLCCI1, KIF13A, PLCB1, SLMAP, ELOB, FBXL20, LRCH3, CLU, PAK1, AK5, STK3, USP22, SPARC, GMDS, XRN1, JAK1, EXOC6, MIF, ACAP2, CSNK1A1, FAXDC2, LRRFIP1, NIN, DICER1, TOP1, IREB2, ATP2B2, ERBIN, EVL, TNIK, STAU2, HERC3, CAPNS1, PRKACA, BPTF, ATXN1, CPQ, AQP4, HELZ, GNAS, HIPK3, CPEB2, DOCK1, HACE1, MYCBP2, NAA15, EHBP1, S100A13, FGF12, PPP4R3A, FNBP1, ATF7, ADGRV1, MTPN, CAMTA1, ATE1, NF1, TPT1, PSMA2, RASA1, ELP4, DGKB, DTNBP1, ARHGEF7, PAN3, CCDC88A, USP14, COPE, TIAM2, FAM107A, XRCC5, FXR1, CAMKMT, PIK3CB, LYST, ABCB1, MYSM1, TSNAX, PDE4DIP, ANKS1B, CPE, ANKIB1, YWHAZ, SNAP25, DOCK4, CLIP1, RALGAPA1, PSMB7, SDCBP, PPP1R12A, SPRED1, PLCL2, MARCKS, RBFOX2, SESN1, SLC1A1, NTRK3, CBLB, RPS16, GPI, TRAPPC8, SNAP23, DYM, MBNL1, DACH1, SCAF8, CAPZB, DHX9, TENT2, NR3C1, AKAP9, RIN2, ITPR1, SENP6, MAP4K3, HSP90AB1, CSNK1G1, CNKSR2, PTK2, GRM5, SPATA13, HSPH1, AKT3, SMAD1, DHX36, IQGAP1, MDN1, DHFR, RAB11A, CAB39, PHF14, UBR3, LRRC8D, MRTFA, UBE4B, CDC42EP5, CNOT2, PDE4B, DYNC1H1, BBS2, ARFGEF1, DNM1, MAPT, GAB1, CCDC92, NUDCD3, GIGYF2, WASF1, BABAM2, RPLP1, DTD1, NBAS, MBNL2, PCMTD1, RPS12, ARHGAP6, CDK14, DDX10, TTC17, DGKI, UTRN, MAPK10, LRRC8C, ARHGAP32, NKTR, SRSF1, KCNIP4, HUWE1, AGBL4, ATXN7, MAPK14, RPL28, FNDC3A, CASK, PBX1, RC3H1, DTNA, HTT, TRIO, UCHL1, ICA1L, CPEB4, NEK7, EXOC4, HDAC8, SFPQ, DCLK2, VTI1A, ACAD11, SLK, MIB1, MAP3K2, SLIT2, SRPK2, PIK3R1, MAPK4, HERC4, PKIA
GO:0070062	extracellular exosome	260	0.14582164890633764	1.4593501850704227	1.2741486364677342e-10	8.027136409746726e-09	8.095439356744555	2.4081409229240177e-07	AHNAK, RAB5C, PCLO, CYFIP2, ATP1B1, A2M, ACTB, UBE2V1, YWHAE, CAMK4, GNAI2, CHL1, UBL3, PLCB1, RAB2A, RDX, EIF4A1, TM9SF2, BASP1, DNM3, ATP6V0C, ATP1A1, THY1, CLU, ATP6AP2, PLPP1, MON2, NIPBL, DOCK10, HSPA1A, GMDS, YWHAG, N4BP2L2, SEPTIN2, HSPE1, HBS1L, LRRK2, RPS19, MIF, GNAL, PDE8A, MGAT4A, SYNE2, DSTN, PTPRA, SEPTIN7, ITGAV, HSP90AA1, DICER1, NME2, EML5, SLC4A4, RPL12, SERINC5, ABI1, SOD2, PPP2CA, TNIK, WWP1, CAPNS1, PRKACA, ATP2B2, TAGLN2, BPTF, CPQ, MLLT3, GNAS, KIF3A, HSPA12A, MDH1, AHCTF1, PSAP, CNTN1, PRKACB, MBD5, PAM, FLRT2, ITFG1, CPNE8, RPS14, CANX, PSMA2, ADGRV1, TPT1, LSR, CAND1, MTAP, FUT8, ARPC1A, ITGB8, GNAQ, PPA1, GPR155, HNRNPK, GLG1, USP14, RPL23, MAN1A1, RPS18, TIAM2, PRNP, ABCB1, PTPRJ, MYO6, SSBP1, PLEKHA1, CPE, CTNNB1, IL6ST, YWHAZ, SLC44A1, EEA1, SLC20A2, LAMP2, TNXB, TAX1BP1, OLA1, PRKAR2B, HTRA1, PTGDS, ITM2B, LIFR, PTPRO, SDCBP, CAPZA2, HSP90B1, CTNND1, MARCKS, ATP8A1, RPLP2, SLC1A1, DPYSL2, ATP2B1, GPM6A, CFH, PLD3, NRF1, SCARB2, MGAT5, RPS16, LGALS3, GPI, ATP6V0A1, RPS8, SNAP23, PTPRD, PIK3C2A, PPM1L, ALCAM, PLCG2, CAPZB, MYO5A, NEDD8, RPL34, RPS20, YWHAQ, RPS9, PABPC1, RACK1, PSMA6, HSP90AB1, RHOJ, CNKSR2, SPTAN1, SERPINI1, DYNC2H1, SERBP1, ACTR2, HSPH1, ATP6V1H, RAB6A, RPL5, GABRB2, DHX36, IQGAP1, TNPO1, RAB11A, ROBO2, NCKAP1, CAB39, HNRNPC, DLG1, RAB1A, CSNK2B, PTPN13, CDC42BPA, RPL3, PPFIA2, ENDOD1, SPAG9, VPS13C, DYNC1H1, ARHGEF12, DNM1, RIMS2, SORL1, ARF3, GLUL, RAP1A, RPL27, MAN2A1, CAPN7, MAN1A2, PKD2, DIP2B, UBA52, TOMM70, NEBL, APLP2, HNRNPA2B1, PEBP1, CACNA2D1, LAMA3, SPTBN1, UTRN, TPP1, APOE, EPB41L2, TAOK1, KPNB1, CD59, RPL37A, RAB10, CUL3, HUWE1, RAB1B, ERP44, ACTR3B, DDX5, GRID1, YWHAB, COBLL1, GAPDH, ADAM10, VPS50, APP, RPL28, NPEPPS, CFI, RHOQ, GOLGA4, RPS29, PAFAH1B1, VPS13D, CARMIL1, GNB1, EEF1G, EDIL3, RPL26, CLTC, AHCYL1, SLK, RAB3GAP1, ARPC1B, SLIT2, PRKCA, WASL, ARL15, RPS28, YWHAH
