GO_ID	Name	Gene Count	Gene Ratio	Fold Enrichment	p-value	FDR	-log10 FDR	FWER	Associated Genes
GO:0022625	cytosolic large ribosomal subunit	27	0.01514301738642737	5.670647019833783	5.88037267090307e-15	6.174391304448223e-13	12.209405850400175	1.1113904348006803e-11	RPLP1, UBA52, RPL9, RPL7A, RPL37, RPL18A, RPL34, RPL37A, RPL8, RPL23, RPL36, RPL27A, RPL17, RPL38, RPL28, RPL5, RPL35, RPL36A, RPL3, RPL18, RPL13A, RPL13, RPL21, RPL26, RPL12, RPLP2, RPL27
GO:0022626	cytosolic ribosome	43	0.02411665731912507	5.017239132774747	2.1930306678138456e-20	3.270475855211704e-18	17.48538905276563	4.144827962168168e-17	RPS8, RPS17, RPLP1, UBA52, RPS12, RPL7A, RPL9, RPL37, RPL18A, RPL34, RPS20, RPS21, RPS9, RPS14, RPS27, RPS16, RPL37A, RPL8, RPL23, RPS18, RPL36, RPL27A, RPL17, RPL38, RPL28, RPL5, HBS1L, RPL35, RPS19, RPS29, RPS23, RPL36A, NEMF, RPL3, RPL18, RPL13A, RPL13, RPL21, RPL26, RPL12, RPS28, RPL27, ASCC3
GO:0022627	cytosolic small ribosomal subunit	15	0.008412787436904094	4.331744251261918	5.415884938115532e-07	2.2252222897909467e-05	4.652626598432483	0.0010236022533038356	RPS8, RPS17, RACK1, RPS21, RPS19, RPS29, RPS23, RPS12, RPS18, RPS28, RPS20, RPS27, RPS9, RPS14, RPS16
GO:0098982	GABA-ergic synapse	40	0.022434099831744252	4.162637118329771	1.1571495055110536e-15	1.366882853384932e-13	12.864268704385042	2.1870125654158915e-12	GABRB3, PCLO, GUCY1A1, SLC4A10, KIF5C, EFNA5, SLC6A1, GABBR1, CACNA2D1, PCDH17, CNTNAP2, PLCB1, ERC2, RPS27, NRXN1, NLGN4X, GPHN, GAP43, GABARAP, ERBB4, LAMP5, GRID1, ARFGEF2, GABRB2, GABRA4, GNAO1, CACNA2D3, PTPRO, GABRA5, GABRG2, NLGN1, NSF, PIK3C3, LRFN5, MKLN1, ATP2B2, KCND2, DISC1, GABRA2, GABRB1
GO:0043198	dendritic shaft	15	0.008412787436904094	4.125470715487541	1.124855605535968e-06	4.254258118940416e-05	4.371176163650329	0.0021259770944629794	ZNF804A, NEGR1, NSF, GRM7, KIRREL3, GRIA1, SLC1A1, STAU2, PRKAR2B, GABBR1, ZMYND8, GRM5, MAP1A, MAP2, APP
GO:0043197	dendritic spine	51	0.02860347728547392	3.980521744402844	1.304921899221033e-18	1.6442015930185017e-16	15.784044935355533	2.4663023895277526e-15	MAP1B, GABRB3, GRIA4, SEPTIN11, GRM3, SYT11, GABBR1, DNM3, DGKI, OPHN1, GPHN, ARHGAP44, ARHGAP32, DOCK10, DTNBP1, FXR1, GRM5, GRID1, ABI2, ARFGEF2, ANKS1B, APP, ZNF804A, GABRB2, NEGR1, PPP3CA, ASIC2, GRIA1, PRKAR2B, PTEN, ZMYND8, CPEB4, PTPRO, PPFIA2, ITSN1, PDE4B, GABRG2, NTRK2, GRIA3, NLGN1, SRGAP2, SIPA1L1, SLC1A1, GPM6A, TANC2, CTTNBP2, KCND2, MAPT, GRID2, TENM2, GRIA2
GO:0014069	postsynaptic density	87	0.04879416713404375	3.8801724567288227	6.724012162926382e-30	2.1180638313218104e-27	26.67406095585596	1.2708382987930862e-26	PCLO, SYT1, INPP4A, SLC8A1, DNM3, ARHGAP44, ATP1A1, CLSTN1, NETO2, RPS19, SYN2, GRIA1, PDLIM5, RTN3, GRIK2, IQSEC1, CAMK2D, SRGAP2, RPL12, ABI1, DISC1, MAP1B, RPL18A, PDPK1, RPS14, GAP43, PLEKHA5, DTNBP1, DNAJC6, PRNP, RPS18, ADD1, ANKS1B, RTN1, PTEN, GRIN2B, BMPR2, PAK3, GRIP1, SOS1, DAPK1, GRM3, SHISA9, CAPZB, ITPR1, DLGAP1, LRRC7, CTNNA2, CNKSR2, MPDZ, DLGAP2, RPL38, PRKN, PJA2, NEGR1, FYN, DLG1, ABLIM1, PPFIA2, PDE4B, NLGN1, MAGI2, RTN4, GRIA2, MAP2K1, SYT11, SPTBN1, RPS27, PPP1R9A, DGKI, GPHN, OPCML, ARHGAP32, CAMK2B, RPL8, ADAM10, NPTN, ADD3, DLG2, CPEB4, NTRK2, SORCS3, SIPA1L1, MIB1, KPNA1, CTNND2, PSD3
GO:0098839	postsynaptic density membrane	37	0.02075154234436343	3.5915862699538588	2.4727359983625616e-12	2.0319439290892353e-10	9.692088280454614	4.6734710369052415e-09	NEO1, GRIA4, SHISA9, NLGN4Y, NLGN4X, GPR158, EPHA7, CLSTN1, ERBB4, NETO2, GRM5, GRID1, PLPPR4, ADGRB3, ADAM22, NRCAM, NSG2, ASIC2, KCNH1, GRIA1, DLG1, DLG2, GRIN2B, DCC, PTPRO, GRIK2, ANP32E, GRIA3, NTM, IQSEC1, SORCS3, LRFN5, LRRTM3, ATP2B2, LRRC4C, GRID2, GRIA2
GO:0030136	clathrin-coated vesicle	23	0.012899607403252944	3.495793606281548	5.9276316029953026e-08	2.8008059324152806e-06	5.552716982358529	0.00011203223729661122	EPS15, PIK3C2A, AAK1, LMBRD1, VAMP2, ASTN1, DNAJC6, RNF216, EPN2, MYO6, ADAM10, SGIP1, BTBD8, PICALM, NUMB, ASTN2, SNAP91, GAS7, CLTC, VTI1A, DENND1A, SCAMP1, HEATR5B
GO:0010494	cytoplasmic stress granule	29	0.016264722378014584	3.453486825748334	1.5852889843246926e-09	8.322767167704636e-08	7.079732254735726	2.996196180373669e-06	NUFIP2, QKI, PRRC2C, DDX6, MBNL1, RPTOR, CELF1, EIF4A1, RBM4, G3BP2, LARP1B, PUM1, PABPC1, TARDBP, HIPK2, KPNB1, HNRNPK, FXR1, ATXN2, LSM14A, ROCK1, CSDE1, RC3H1, DHX36, LARP1, PUM2, STAU2, RBFOX1, GIGYF2
GO:1904115	axon cytoplasm	19	0.01065619742007852	3.4292975322490187	1.1479744130474138e-06	4.254258118940416e-05	4.371176163650329	0.0021696716406596124	KIF5C, AGTPBP1, DST, DTNBP1, KIF21A, AGBL4, AP3B1, UCHL1, OPA1, PAFAH1B1, DLG2, SYBU, DYNC1H1, KIF1B, KIF5B, MAPT, MAP1A, FBXW11, KIF3A
GO:0031252	cell leading edge	19	0.01065619742007852	3.4292975322490187	1.1479744130474138e-06	4.254258118940416e-05	4.371176163650329	0.0021696716406596124	LDB2, AAK1, RAPH1, PABPC1, CLASP2, DST, CCDC88A, PHLDB2, IQGAP1, BCAS3, PAFAH1B1, SSX2IP, SHTN1, CARMIL1, CDC42BPA, SLK, MACF1, ABI1, DCTN1
GO:0098794	postsynapse	68	0.03813796971396523	3.3712001039863857	8.201673225788017e-20	1.1072258854813823e-17	16.95576376953624	1.550116239673935e-16	MAP1B, WASF1, SLC4A10, ELMO1, DOCK1, SLC8A1, KIFAP3, NCDN, SRGAP3, NEDD8, SPTBN1, DGKI, CBLB, OPHN1, GPHN, ARHGAP44, THY1, EPB41L3, ATAD1, FRRS1L, DOCK10, PRNP, ARHGEF7, RPL8, CUL3, FXR1, GSK3B, STRN3, PPP3R1, SLC24A2, ARFGEF2, APP, PRKN, ZNF804A, GABRA2, LRRK2, ADGRB3, GABRA4, MECP2, DOCK4, TRIO, GRIA1, DSTN, NCKAP1, PRKAR2B, JAK2, SNX14, PDLIM5, MOB4, CPEB4, PUM2, MARK1, GABRA5, GABRG2, BRAF, RAB3GAP1, SNX27, NLGN1, SNCA, KIF1B, PIK3C3, ERBIN, MKLN1, STAU2, PRKACA, ATXN1, RTN4, GRIA2
GO:0098685	Schaffer collateral - CA1 synapse	28	0.015703869882220976	3.2343690409422323	1.51300480283477e-08	7.332254044506962e-07	6.134762496217162	2.8595790773577153e-05	CALM3, PTPRD, ACTB, CAPZB, GABBR1, FBXL20, ITPR1, EPHA7, DTNBP1, GRM5, PPP3R1, ROCK1, PLPPR4, CTNNB1, CASK, PPP3CA, SYN2, EEA1, RAB11A, GRIA1, FYN, PAFAH1B1, DCC, SNX27, SLC1A1, LRRC4C, GRIA2, GABRB1
GO:0098978	glutamatergic synapse	154	0.08637128435221536	3.1709500401394433	4.915023099481187e-40	2.3223484145048607e-37	36.63407262389732	9.289393658019443e-37	EPS15, NEO1, PCLO, GUCY1A1, ACTB, SYT1, PPM1H, GUCY1B1, KIFAP3, GABBR1, ZDHHC17, PLCB1, NRXN1, OPHN1, ARHGAP44, FBXL20, THY1, CACNB4, CLSTN1, DOCK10, ERBB4, NETO2, PLPPR4, LRRK2, SYN2, UBE3A, ELMOD1, PPP3CA, AP2B1, GRIA1, DSTN, GRIK2, SRGAP2, ERBIN, PIK3C3, ATP2B2, TNIK, STAU2, CTTNBP2, LRRC4C, PRKACA, DISC1, PIAS1, MAP1B, DOCK1, CNTN1, OGT, SH3GL3, FLRT2, ATP2B4, NF1, EPB41L3, FZD3, PLEKHA5, ARPC1A, ATAD1, DTNBP1, PCDH9, RGS7, USP14, PPP2R2A, FXR1, ARFGEF2, ANKS1B, CTNNB1, YWHAZ, EEA1, SNAP25, NRCAM, DOCK4, NSG2, ADAM23, GNAO1, PRKAR2B, SEMA3A, PUM2, PTPRO, MARK1, PDE10A, CDKL5, SNX27, PAK3, ATP8A1, LRRTM3, LRFN5, ATP2B1, GPM6A, SLC1A2, SOS1, NTRK3, CBLB, DAPK1, PTPRD, GRM3, SHISA9, PCDH17, CNTNAP2, NEDD8, AKAP9, CLASP2, EPHA7, DLGAP1, BTBD9, CNKSR2, GRM5, GSK3B, DLGAP2, PPP3R1, PRKN, PJA2, PPP3CB, TENM4, PRKAR1A, RAB11A, NUMB, FYN, JAK2, DLG1, PPFIA2, ANP32E, NLGN1, SPARCL1, KCND2, ADGRL3, RTN4, RAP1A, MAP2K1, ELMO1, NCDN, ERC2, SPTBN1, RPS27, DGKI, NLGN4X, PCDH7, APOE, ARHGAP32, CUL3, GRID1, CDH8, MAPK14, ADAM10, TRIO, CALY, PAFAH1B1, MOB4, ITSN1, BRAF, SORCS3, MIB1, WASL, GRID2, KPNA1, YWHAH
GO:0030426	growth cone	37	0.02075154234436343	3.097092508148618	3.016746932619596e-10	1.781766157078449e-08	7.749149294325201	5.701651702651037e-07	MAP1B, NEO1, AUTS2, CALM3, MYO5A, USP9X, ERC2, BASP1, THY1, KLC1, DTNBP1, KIF21A, TIAM2, EXOC6, SETX, DOCK7, APP, PTBP2, ZNF804A, LRRK2, SNAP25, PAFAH1B1, FGF13, MYO9A, SHTN1, CPEB4, PTPRO, SLC2A13, DSCAM, SNCA, ABI1, GPM6A, MAPT, APBB2, TENM2, UNC5C, RUFY3
GO:0043005	neuron projection	93	0.05215928210880538	3.0606056248232356	2.7927887257666736e-23	5.278370691699014e-21	20.277500113224303	5.278370691699013e-20	CYFIP2, KIF5C, SYT1, CADM1, PACRG, CHL1, VAMP2, CLSTN1, RGS17, PLPPR1, SYNPR, LRRK2, GRIA1, FAT3, RTN3, CDH2, CAMK2D, ABI1, STAU2, MAP1A, DCTN1, CPEB2, FLRT2, MAP2, DTNBP1, ARHGEF7, RGS7, TIAM2, FXR1, FAM107A, DOCK7, PCSK2, RTN1, SNAP25, NRCAM, PTEN, RAPGEF2, GRIN2B, HMGB1, PTPRO, TENM3, SLC1A1, GRIP1, GPM6A, TENM2, SNAP23, GRM3, MYO5A, AHCYL2, RACK1, ANK3, MPDZ, GRM5, NDFIP1, PRKN, TENM4, IQGAP1, KCNB1, DLG1, KIF1B, BBS2, MAGI2, MAP4, MAPT, MACO1, RTN4, RAP1A, VPS13A, GPR149, NCDN, SYT11, PPP1R9A, CAMK2B, RGS6, APP, BCL11B, SLC1A3, ASIC2, ANK2, PAFAH1B1, KCNN3, NCAM2, FGF13, RIT2, DLG2, CPEB4, ITSN1, BRAF, SIPA1L1, NCAM1, KIF5B, UNC5C, FBXW11
GO:0030424	axon	109	0.061132922041503085	3.0339606322091504	9.324186231284764e-27	2.5175302824468864e-24	23.59902529677415	1.7622711977128206e-23	PCLO, ACTB, SYT1, DYRK1A, SLC6A1, SLC8A1, ADCY9, GRM7, OPHN1, ATP1A1, ATP6AP2, PAK1, KIF21A, BTBD8, LRRK2, SHTN1, SACS, ATL1, GRIK2, NIN, DSCAM, STAU2, DISC1, MAP1A, DCTN1, MAP1B, MYCBP2, CNTN1, GAP43, NF1, DST, FZD3, DTNBP1, FXR1, SETX, DOCK7, ADNP, ADAM22, SNAP25, NRCAM, CNTN4, KCNH1, SCN8A, SLC12A6, SEMA3A, DCC, PTPRO, TENM3, BMPR2, WDFY3, MAP7, SLC1A1, GPM6A, SLC1A2, NTRK3, NMNAT2, RUFY3, CADM2, GRM3, SEPTIN11, ALCAM, ROBO1, CNTNAP2, PUM1, FEZ2, CTNNA2, ANK3, GSK3B, MAPK8, KLHL24, PRKN, DHX36, KCNB1, PPFIA2, GABRG2, SNCA, KIF1B, MAP4, MAPT, ADGRL3, MACO1, MAP2K1, NFASC, DIP2B, SLC4A10, KIRREL3, NCDN, SYT11, AGTPBP1, DGKI, AGBL4, ADAM10, APP, NPTN, ZNF804A, HTT, UCHL1, PAFAH1B1, NCAM2, FGF13, DLG2, CPEB4, SCN2A, NTRK2, SBF2, TANC2, UNC5C, GABRA2, UNC80
GO:0042734	presynaptic membrane	38	0.02131239484015704	2.986054994067173	5.502454222795099e-10	3.058717200318452e-08	7.514460674704995	1.0399638481082738e-06	PTPRD, SYT1, GRM3, CNTN1, RIMS1, GABBR1, ERC1, CNTNAP2, ERC2, FLRT2, ZDHHC17, NRXN1, PCDH17, VAMP2, GPR158, RGS7, ERBB4, NPTN, CTNNB1, CASK, SNAP25, PICALM, KCNH1, ADAM23, GRIA1, GNAO1, SNCAIP, RAB3GAP2, GRIK2, PPFIA2, GABRA5, NRXN3, DENND1A, RIMS2, ATP2B1, TENM2, SLC1A2, KCTD12
GO:0045211	postsynaptic membrane	59	0.03309029725182277	2.9125118042672726	3.3396650153413395e-14	3.155983439497566e-12	11.500865284345284	6.311966878995132e-11	GABRB3, LRRTM4, SYT1, GRIA4, GRM3, SHISA9, CNTN1, SYNE1, FAIM2, GABBR1, SUSD4, PCDH17, FLRT2, GRM7, UTRN, GPHN, GPR158, EPHA7, CLSTN1, ATAD1, DGKB, LRRC7, ANK3, CNKSR2, DTNBP1, RGS7, ERBB4, DMD, GRM5, GRID1, CTNNB1, GABRB2, GABRA2, GABRA4, PICALM, NRCAM, GNAO1, GRIA1, ANK2, KCNB1, GRIN2B, GRIK2, GABRA5, GABRG2, GRIA3, NLGN1, SRGAP2, LRRTM3, GRIP1, KCNMA1, LRRC4C, KCND2, GRID2, TENM2, ADGRL3, NTRK3, GRIA2, GABRB1, KCTD12
GO:0045202	synapse	185	0.10375771172181716	2.822977319184341	2.5428665819679185e-40	1.6020059466397887e-37	36.79533587614937	4.806017839919366e-37	EPS15, CYFIP2, PCLO, KCNQ3, SNTG1, RPS6KA3, ACTB, PPM1H, CADM1, SLC8A1, STXBP5, RPL7A, RIMS1, SRGAP3, DNM3, RPS21, NRXN1, VAMP2, OPHN1, FBXL20, CACNB4, CLU, UNC5C, RGS17, YWHAG, NETO2, DMD, SYNPR, SEPTIN2, MBP, RPL27A, LRRK2, SGCZ, SYN2, ELMOD1, RPS23, AP2B1, GRIA1, MAPK1, MYO9A, RTN3, GRIK2, RPL13A, CDH2, DSCAM, RPL13, ATP2B2, PPP2CA, APBB2, MAP1A, MAP1B, GABRB3, TMOD2, CPEB2, OLFM3, CNTN1, OGT, FGF12, FLRT2, RPS14, GIT2, CACNA1E, GAP43, TLN2, ARPC1A, DNAJC6, USP14, PPP2R2A, TIAM2, RPL23, RPS18, FAM107A, ARFGEF2, ENAH, CTNNB1, CACNA1A, SNAP25, MECP2, NRCAM, CNTN4, IGSF11, TRIM9, SLC12A6, RAPGEF2, SDCBP, PDE10A, ATP8A1, LRRTM3, MKLN1, SLC1A1, ATP2B1, TENM2, SLC1A2, RPS16, NMNAT2, SNAP23, CADM2, QKI, SEPTIN11, SHISA9, RPL37, ERC1, CNTNAP2, NLGN4Y, RPL34, RPS20, YWHAQ, RPS9, LAMA2, NR3C1, ITPR1, DLGAP1, PTPRN2, PDZRN3, MPDZ, MAPK8, DLGAP2, RPL36, PPP3R1, RPL38, NDFIP1, PRKN, PJA2, PRKAR1A, SNX14, KCNB1, DLG1, VPS54, RPL21, NLGN1, CACNA1B, SNCA, TIAM1, DNM1, MAGI2, RIMS2, KCND2, MACO1, RTN4, RPL27, PHACTR1, WASF1, CNTNAP5, LRRTM4, GPC6, SLC4A10, SYT11, LAMA3, ERC2, UTRN, PPP1R9A, NLGN4X, DGKI, PPA2, CAMK2B, FRRS1L, RPL37A, RPL8, GRID1, APP, RPL28, DTNA, CASK, SLC1A3, HTT, ASIC2, KIDINS220, RIT2, DLG2, CPEB4, ITSN1, EXOC4, GNB1, NRXN3, HTR2C, SGCE, KCNIP1, SCAMP1, FAM171B, SIPA1L1, GRID2, RPS28, SPART, GLS, YWHAH
GO:0005925	focal adhesion	99	0.055524397083567024	2.8097800548725957	1.0195446366643218e-21	1.7517630575414256e-19	18.756524636616145	1.9269393632955683e-18	AHNAK, ACTB, YWHAE, RPL7A, SYNPO2, RDX, ATP6V0C, THY1, PAK1, LRP1, HSPA1A, MAP4K4, CTNNA1, YWHAG, JAK1, RPS19, SYNE2, MAPK1, PTPRA, ITGAV, RPL13A, CDH2, NME2, RPL12, EVL, RPS17, RPL9, FLRT2, PDPK1, RPS14, GIT2, DST, TLN2, ITGB8, ARHGEF7, HNRNPK, RPL23, RPS18, FAM107A, ADD1, ENAH, DOCK7, CTNNB1, YWHAZ, MAPRE2, RPL18, PPP1R12A, SDCBP, ARHGAP26, HSP90B1, MARCKS, RPLP2, SCARB2, RPS16, RPS8, SNAP23, PEAK1, ALCAM, PTPN11, RPS9, YWHAQ, PABPC1, CLASP2, PTK2, ACTR2, RPL38, LIMS2, TNS1, RPL5, PHLDB2, IQGAP1, NUMB, NCKAP1, SSH2, RPL3, MAP2K1, RPL27, WASF1, NFASC, RPLP1, MPRIP, ITGA6, EPB41L2, CD59, RPL37A, RAB10, STX16, RPL8, YWHAB, CLASP1, ADAM10, CASK, FOCAD, RPS29, CLTC, LMO7, ARPC1B, LPP, CNN3
GO:0030425	dendrite	113	0.0633763320246775	2.742224652059365	1.0600176733995633e-23	2.2260371141390828e-21	20.65246759906176	2.0034334027251746e-20	KIF5C, GRIA4, DYRK1A, SLC8A1, GNAI2, ADCY9, RPTOR, CHL1, GABBR1, EPHA6, GRM7, OPHN1, ARHGAP44, THY1, PAK1, XRN1, KIF21A, LAMP5, LRRK2, MT-ND1, GRIA1, FAT3, BMPR1A, SACS, GRIK2, NIN, DSCAM, STAU2, BPTF, ATXN10, MAP1A, MAP1B, MAP2, GAP43, NF1, FZD3, PRNP, RGS7, FXR1, STRN3, ARFGEF2, RTN1, IL6ST, ADNP, TRIM9, NSG2, KCNH1, GNAO1, OPA1, PRKAR2B, GRIN2B, MARK1, GABRA5, BMPR2, SLC1A1, GRIP1, TENM2, RUFY3, ALCAM, CNTNAP2, NLGN4Y, URI1, EPHA7, RACK1, ANK3, MPDZ, GRM5, GSK3B, NDFIP1, NEGR1, DHX36, FYN, SNX14, KCNB1, GABRG2, NLGN1, KIF1B, MAGI2, MAPT, KCND2, GRIA2, MAP2K1, DIP2B, SLC4A10, KIRREL3, NCDN, SYT11, RABGEF1, HNRNPU, DGKI, PPP1R9A, NLGN4X, GPHN, APOE, ADAM10, APP, NPTN, RPL28, HTT, TTLL7, BRINP3, FGF13, CPEB4, NTRK2, SFPQ, HTR2C, SGCE, KCNIP1, KPNA1, CTNND2, UNC5C, GABRA2, GABRB1
GO:0005840	ribosome	47	0.026360067302299495	2.741979526051315	1.258760030954259e-10	8.027136409746726e-09	8.095439356744555	2.3790564585035493e-07	MRPS28, RPS8, NUFIP2, RPLP1, RPS17, UBA52, RPS12, RPL7A, RPL9, RPL37, RPL18A, RPL34, RPS20, RPS21, RPS9, RPS14, RPS27, RPS16, RACK1, PSMA6, RPL37A, RPL8, RPL23, FXR1, RPS18, RPL36, RPL27A, RPL17, RPL38, RPL28, RPL5, RPL35, RPS19, RPS29, RPS23, RPL36A, RPL3, RPL18, RPL13A, RPL13, RPL21, RPL26, SNCA, RPL12, RPLP2, RPS28, RPL27
GO:0005912	adherens junction	46	0.025799214806505887	2.724926298229719	2.4673236408109206e-10	1.5042715100427872e-08	7.822673769681015	4.66324168113264e-07	FRMD5, SNAP23, FER, EFNA5, ACTB, VEZT, TMOD3, AFDN, DDX6, APC, LAMA3, RDX, PTPRM, PTPRK, LRRC7, CTNNA2, RAB10, CTNNA1, ADD1, FRS2, ABI2, KLHL24, CDH8, ADAM10, CTNNB1, CDH12, AHI1, TJP2, FAT3, SSX2IP, DLG1, DLG2, PDLIM5, FRMD4A, SDCBP, CDH20, TJP1, BMPR2, CTNND1, CDH2, CDH9, CTNND2, PARD3, FRMD4B, CTNNA3, CNN3
GO:0043025	neuronal cell body	80	0.044868199663488505	2.5885306450117906	1.351555087636402e-15	1.5026112444898823e-13	12.823153365528448	2.5544391156328e-12	KIF5C, GRIA4, SLC6A1, SLC8A1, GABBR1, RPTOR, AGFG1, NRXN1, XRN1, PDE1C, MBP, PTBP2, LRRK2, MT-ND1, PICALM, GRIA1, BMPR1A, HSP90AA1, GRIK2, DSCAM, STAU2, ATXN10, MAP1A, DCTN1, MAP1B, MAP2, CACNA1E, FZD3, DTNBP1, ARHGEF7, STRN3, RTN1, IL6ST, CACNA1A, ADNP, PRKAR2B, RAPGEF2, PUM2, BMPR2, SLC1A1, GPM6A, SOS1, RUFY3, ALCAM, CNTNAP2, AKAP9, EPHA7, RACK1, HSP90AB1, CNKSR2, SERPINI1, GRM5, PRKN, NEGR1, KCNB1, SNCA, CACNA1B, SORL1, MAPT, KCND2, RTN4, GRIA2, VPS13A, SLC4A10, NCDN, APOE, PPP1R1B, ZNF804A, SLC1A3, ASIC2, BRINP3, UCHL1, PAFAH1B1, KCNN3, SNCAIP, ITSN1, VTI1A, UNC5C, FBXW11, GABRA2
GO:0030027	lamellipodium	42	0.023555804823331465	2.540080398645732	1.3567771322616585e-08	6.748180999932986e-07	6.170813277265795	2.5643087799745344e-05	WASF1, PKD2, FER, ACTB, CAPZB, APC, RDX, RAPH1, PABPC1, PAK1, PTPRM, CTNNA2, ARHGEF7, CTNNA1, CCDC88A, KLHL2, TIAM2, ACTR3B, SPATA13, ABI2, ENAH, ROCK1, CTNNB1, NCKAP1, CARMIL1, SHTN1, PTPN13, ABLIM1, ITSN1, CDC42BPA, PTPRO, CDH2, NME2, SRGAP2, ABI1, EVL, WASL, APBB2, UNC5C, ANKRD28, CTNNA3, RUFY3
GO:0015629	actin cytoskeleton	56	0.03140773976444195	2.526850813236119	6.795137949257363e-11	5.137124289638567e-09	8.28927992665425	1.2842810724096415e-07	AHNAK, AUTS2, WASF1, FER, MPRIP, SEPTIN9, PEAK1, ACTB, ARHGAP6, CAPZB, DHX9, SYNPO2, MYO5A, TTC17, PPP1R9A, OPHN1, ABL2, SEPTIN10, DST, ARPC1A, TLN2, GABARAP, CTNNA2, MTSS1, CNN3, CTNNA1, KLHL2, FAM107A, FMN2, DMD, ACTR3B, ACTR2, CGNL1, MYO6, CASK, DGKH, LIMCH1, IQGAP1, DSTN, SEPTIN7, HNRNPC, PDLIM5, ABLIM1, PPP1R12A, SPECC1L, CAPZA2, SNCA, MARCKS, SIPA1L1, LMO7, MACF1, ARPC1B, WASL, AKAP13, TAGLN2, DAPK1
GO:0098793	presynapse	52	0.029164329781267526	2.5132574735355058	3.9690003862386146e-10	2.2731547666639337e-08	7.64337099453462	7.501410729990982e-07	SNAP23, SLC4A10, ACTB, SLC6A1, AAK1, STXBP5, SYT11, GABBR1, ERC1, SH3GL3, DNM3, ERC2, DGKI, NRXN1, CANX, GIT2, RPS27, OPHN1, ARHGAP44, FBXL20, THY1, CACNB4, NF1, GAP43, CACNB2, RGS7, KIF21A, YWHAG, FXR1, GSK3B, SLC24A2, ARFGEF2, SYNJ1, PRKN, SGIP1, APP, BTBD8, ZNF804A, GRIA1, DSTN, PDLIM5, ITSN1, CDH2, NLGN1, SNCA, KIF1B, DNM1, SLC1A1, TNIK, GPM6A, DISC1, YWHAH
GO:0043204	perikaryon	32	0.0179472798653954	2.4479614311767133	2.7390872012468697e-06	9.586805204364045e-05	4.01832609702939	0.005176874810356584	MAP1B, DIP2B, SLC4A10, NCDN, SYT11, CNTNAP2, GAP43, RACK1, ASTN1, TIAM2, SERPINI1, KLHL24, APP, RUFY3, LRRK2, DHX36, KCNH1, TTLL7, FYN, ASTN2, KCNB1, DLG2, SHTN1, GRIK2, TOP1, WDFY3, SLC1A1, GRIP1, KCND2, CTNND2, MAP2K1, GIGYF2
GO:0008021	synaptic vesicle	36	0.020190689848569827	2.446161459536142	5.782273023544683e-07	2.3252119179786066e-05	4.633537459713981	0.001092849601449945	SYT1, KIRREL3, STXBP5, SYT11, GABBR1, VAMP2, PSMA2, MFF, PSMA6, DMXL2, LAMP5, RAB3C, SYNPR, PRKN, SV2C, BTBD8, PSMD1, LRRK2, SYN2, UBE3A, SNAP25, PICALM, TRIM9, AP2B1, GRIA1, SNCAIP, SNAP91, PSMB7, SLC2A13, PPFIA2, PDE4B, VTI1A, IQSEC1, SNCA, CTTNBP2, DISC1
GO:0005938	cell cortex	40	0.022434099831744252	2.44472338695558	1.2437763152926413e-07	5.733505453422175e-06	5.2415797700767435	0.0002350737235903092	FER, FNBP1, FRYL, GRM7, CLASP2, DST, EPB41L2, ARHGAP32, PARD3, ARHGEF7, PTK2, KIF21A, SPTAN1, FMN2, SEPTIN2, ACTR2, COBLL1, NDFIP1, MYO6, CLASP1, CTNNB1, ADD3, PHLDB2, SNAP25, IQGAP1, PAFAH1B1, CLIP1, ASTN2, CLIP4, EPB41, SNCA, WDPCP, MARCKS, DYNC1H1, MKLN1, CTTNBP2, AKAP13, FRY, DCTN1, MAP2K1
GO:0031982	vesicle	39	0.021873247335950644	2.38360530228169	2.9601447152730795e-07	1.3010868632246791e-05	4.8856937080811065	0.000559467351186612	AHNAK, PKD2, UBA52, CALM3, ACTB, PIK3C2A, CALM2, PACRG, SYT11, RABGEF1, MYO5A, CALM1, NRXN1, BASP1, VAMP2, DYNC1I1, CD59, DNAJC6, HSPA1A, YWHAG, RAB3C, GAPDH, CASK, MIF, YWHAZ, SNAP25, PICALM, RAB11A, PAFAH1B1, SYBU, VAPA, SLC1A1, KIF5B, DYNC1I2, ANO5, TAGLN2, SLC1A2, WDFY2, GIGYF2
GO:1990904	ribonucleoprotein complex	79	0.0443073471676949	2.3102636006730233	1.4046358799742223e-12	1.2067099150687637e-10	9.918397118822577	2.6547618131512802e-09	ACTB, DYRK1A, RPL7A, RPS21, HNRNPR, HSPA1A, RBMS1, SYNCRIP, ATXN2, RPL27A, RPL35, LRRK2, RPS19, RPS23, RPL36A, RBMS3, RPL13A, RPL13, RPL12, RPS17, RPL9, ZNF827, RPL18A, RPS14, XPO1, HNRNPK, RPL23, RPS18, XRCC5, RPL17, CELF2, RPL18, RPLP2, RPS16, RPS8, SECISBP2L, DHX9, RPL37, CSNK1E, RPL34, RPS20, ZFP36L1, RPS9, PABPC1, CELF4, RO60, RACK1, DDX17, RPL36, RPL38, RPL5, IQGAP1, LRPPRC, HNRNPC, RPL3, RPL21, TOP2B, RPL27, MRPS28, RPLP1, UBA52, RPS12, HNRNPA2B1, CELF1, HNRNPU, RPS27, CPSF6, SUZ12, RPL37A, RPL8, DDX5, SNRPN, LSM14A, GAPDH, RPL28, RPS29, RPL26, SLIRP, RPS28
GO:0005856	cytoskeleton	162	0.09085810431856421	2.30173864273696	2.2843075727849303e-24	5.396676640704397e-22	21.267873603310537	4.317341312563518e-21	KIF5C, PCLO, SNTG1, SEPTIN9, EPB41L1, ACTB, DYRK1A, APC, SYNPO2, DNM3, RDX, RAPH1, BASP1, SEPTIN10, CLU, CTNNA1, KIF21A, KAZN, DMD, SEPTIN2, LRRK2, SGCZ, BCAS3, SYNE2, MAPK1, CCDC6, SEPTIN7, LRRFIP1, SHTN1, PDE4D, EML5, MACF1, CCSER2, TLK2, EVL, TNIK, ABI1, DISC1, MAP1A, DCTN1, PARD3, PIAS1, KIF3A, MAP1B, FRMD5, TMOD2, FER, MYCBP2, TUBA1B, HOOK3, PRKCE, FNBP1, MAP2, ABL2, EPB41L3, DST, TLN2, TBCA, GABARAP, KLC1, ARPC1A, KLHL2, ADD1, ABI2, ARFGEF2, PDE4DIP, ENAH, CTNNB1, PCM1, MAPRE2, SNAP25, TRIM9, PTPN4, CLIP1, GRIN2B, MARK1, SDCBP, ARHGAP26, MARCKS, MAP7, DPYSL2, DYNC1I2, FRMD4B, DAPK1, AUTS2, PEAK1, SEPTIN11, CAPZB, CYLD, SLC30A9, AKAP9, CLASP2, PREPL, CDC42SE2, CTNNA2, ANK3, KLHL3, PTK2, SPTAN1, SGCD, ACTR2, ROCK1, TNS1, CAMSAP2, LRPPRC, SSH2, PTPN13, ROCK2, CDC42BPA, ABLIM1, CDC42EP5, SYBU, SPECC1L, INVS, SNCA, DYNC1H1, KIF1B, MAP4, MAPT, LRRC49, WASF1, MPRIP, TMOD3, APPBP2, ARHGAP6, SYNE1, TTC28, ERC2, SPTBN1, RIPOR2, UTRN, PPP1R9A, TTC17, GPHN, FRMD3, TMSB10, EPB41L2, CAMK2B, MTSS1, ACTR3B, FMN2, ATXN7, CLASP1, GAPDH, EML6, ADD3, ANK2, PAFAH1B1, CARMIL1, FRMD4A, PPP2R2B, DCLK2, EPB41, EPB41L4A, TPM1, SGCE, SLAIN1, SIPA1L1, ARPC1B, KIF5B, WASL, CTNNA3
GO:0015630	microtubule cytoskeleton	42	0.023555804823331465	2.299314484082156	3.582256748204852e-07	1.538742103206175e-05	4.812834162845539	0.000677046525410717	FER, SEPTIN9, SEPTIN11, TUBA1B, MYCBP2, KIFAP3, STRBP, APC, AGBL1, AGTPBP1, TTBK2, SEPTIN10, DST, TBCA, TAOK1, KATNBL1, DTNBP1, SEPTIN2, AGBL4, ATXN7, LYST, ALMS1, GAPDH, MAPRE2, PAFAH1B1, CLIP1, SEPTIN7, BMERB1, SHTN1, MARK1, SPECC1L, VAPA, MIB1, CCSER2, PPP2CA, MAP7, DPYSL2, MAP4, MAPT, MTUS1, DCTN1, KIF3A
GO:0005802	trans-Golgi network	39	0.021873247335950644	2.2525070106561973	1.4383167080014886e-06	5.2277280348515644e-05	4.2816870140592656	0.0027184185781228133	PIK3C2A, ATP2C1, SLC9A7, SYT11, VAMP2, CLASP2, DOP1A, PREPL, BIRC6, PCSK1N, RAB10, STX16, ARL5A, ATXN2, ATP9A, ARFGEF2, RAB6A, TGOLN2, LRRK2, OSBPL9, SNAP25, GOLGA4, LAMP2, RAB11A, CCDC91, FUT9, VPS54, CLTC, RELCH, ATP8A1, SCAMP1, ARFGEF1, SORL1, RGS20, ECPAS, RBFOX1, CCDC186, NBEA, NMNAT2
GO:0005874	microtubule	68	0.03813796971396523	2.169860840411127	1.0818231464442885e-09	5.841844990799158e-08	7.233449970904698	2.0446457467797053e-06	MAP1B, KIF5C, SEPTIN9, CEP170, KIF2A, APPBP2, DYRK1A, TUBA1B, APC, HOOK3, KANSL1, DNM3, KIF13A, CYLD, MAP2, CLASP2, CSPP1, DST, TBCA, KLC1, GABARAP, DYNC1I1, DNAH6, KIF21A, DYNC2H1, HSPH1, CLASP1, ZNF207, EML6, SYNJ1, DCTN1, CCDC66, MAPRE2, IQGAP1, CAMSAP2, OPA1, LRPPRC, PAFAH1B1, CLIP1, FGF13, TTLL7, DLG1, NAV3, SHTN1, NEK7, NIN, SYBU, INVS, TCP11L1, EML5, DYNC1H1, INO80, KIF1B, MACF1, MAP7, DNM1, DPYSL2, MAP4, STAU2, KIF5B, MAPT, DYNC1I2, MTUS1, DISC1, MAP1A, LRRC49, MAP2K1, KIF3A
GO:0005813	centrosome	105	0.05888951205832866	2.0557430344971817	1.002723944336282e-12	9.024515499026539e-11	10.044576104851387	1.8951482547955733e-09	BBS9, NME7, CALM2, KIFAP3, GNAI2, APC, SLMAP, CALM1, KIF13A, PAK1, STK3, BIRC6, HSPA1A, ALMS1, EVI5, IFT80, CSNK1A1, CEP350, MAPK1, PDE4D, NIN, PRKACA, DISC1, DCTN1, KMT2E, KIF3A, CALM3, PRKACB, HOOK3, USP9X, PPP4R3A, CEP112, ARHGEF7, CCDC88A, ARFGEF2, PDE4DIP, CEP85L, CTNNB1, KAT2B, PCM1, MECP2, CLIP1, PRKAR2B, SSX2IP, PPP1R12A, RABGAP1, CDKL5, MARCKS, ECPAS, DYNC1I2, FRY, RBX1, KIF2A, TACC1, DHX9, ERC1, ERCC6L2, CYLD, AKAP9, NR3C1, AKAP11, CLASP2, SDCCAG8, CSPP1, CEP192, CEP290, PTK2, GSK3B, PJA2, CCDC66, PRKAR1A, AHI1, RAB11A, CAMSAP2, ROCK2, PDE4B, TTC19, CHD4, DYNC1H1, WRN, MAGI2, USP33, CDK6, MTUS1, NEK1, CCDC92, MAP2K1, TNKS, CDC27, CEP170, TTC28, HNRNPU, CDC16, CAMK2B, CUL3, CLASP1, ODF2L, PAFAH1B1, NEK7, EXOC4, ARHGEF10, ATM, MIB1, FBXW11, SCLT1
GO:0048471	perinuclear region of cytoplasm	118	0.06618059450364554	1.9306735473046508	2.730980210651788e-12	2.150646915888283e-10	9.66743088439089	5.161552598131879e-09	CYFIP2, SEPTIN9, ANKRD13C, APC, EIF4A1, DNM3, MEIS2, VAMP2, CLU, PTPRM, HSPA1A, GALNT1, EXOC6, RAB3C, ATXN2, SYNJ1, ACSL3, PICALM, FAF1, HSP90AA1, SHTN1, DICER1, NME2, VAPA, SERINC5, TLK2, CYB5R4, CALN1, PRKACA, BPTF, DISC1, ATXN10, GNAS, MAP1B, PRKCE, HMGCLL1, S100A13, MTPN, ARMH3, PLAAT3, DYNC1I1, FXR1, UBR5, YTHDC2, MYO6, TSNAX, ARFGEF2, CTNNB1, CRBN, CDK19, SNAP25, LAMP2, PRKAR2B, PTGDS, RAPGEF2, PUM2, HSP90B1, MAP7, CERT1, ATP9A, EXOC1, ATP6V0A1, PLCG2, LNPEP, CYLD, EIF4A2, ITPR1, RACK1, HSP90AB1, PTK2, SERBP1, NDFIP1, PRKN, RASA2, FYN, LRPPRC, KCNB1, DLG1, VPS54, TNKS2, VPS53, SPAG9, AKAP6, FBXL5, SNCA, MAGI2, ARFGEF1, USP33, ARF3, RAP1A, MAP2K1, HEATR5B, DDX6, RBM4, TAOK1, RAB10, STX16, TRAPPC12, RAB1B, FMN2, YWHAB, GAPDH, VPS50, APP, SLC1A3, HTT, PAFAH1B1, MOB4, CPEB4, NTRK2, VTI1A, SLK, SBF2, SLIRP, PIK3R1, PRKCA, KIF5B, CCAR1
GO:0016607	nuclear speck	66	0.03701626472237801	1.8964850453286008	3.7431209271589556e-07	1.5721107894067613e-05	4.803516851723718	0.0007074498552330426	PSPC1, NRIP1, DACH1, DYRK1A, SRSF11, MTREX, THOC2, COP1, PPP4R3A, PLCB1, MECOM, MRTFB, BASP1, RBM4, ZNF638, NR3C1, HNRNPU, CACNB4, DDX17, DDX39B, RBM25, CPSF6, KAT6A, TARDBP, SRSF1, FTO, HSPA1A, KAZN, BNIP3L, RSRC1, FAM107A, DDX5, MAPK14, PRKN, HP1BP3, WAC, RBM39, TRIP12, BMP2K, DHX36, PPIG, CSNK1A1, PIAS2, KMT2E, PIAS1, TCERG1, SON, TCF12, YLPM1, DHX15, ILRUN, SFPQ, MORF4L1, LUC7L2, GATAD2B, SF3B1, RBM27, WRN, BCLAF1, CDK13, SRPK2, CWC15, PRKACA, ZC3H13, ASCC3, ZNF106
