GO_ID	Name	Gene Count	Gene Ratio	Fold Enrichment	p-value	FDR	-log10 FDR	FWER	Associated Genes
GO:0051010	microtubule plus-end binding	12	0.0050062578222778474	4.909946957506407	6.418647571930043e-07	7.469114040409327e-05	4.1267309095875975	0.0030623367565678233	DST, CKAP5, MAPRE2, FBXW11, APC, CLIP2, CLIP1, PAFAH1B1, TTBK2, CLIP4, CLASP1, CLASP2
GO:0005158	insulin receptor binding	13	0.005423445974134335	4.856577968837859	2.568548171494467e-07	3.224879822684238e-05	4.4914864650031525	0.0012254543326200103	SORBS1, IRS2, SNX1, IGF1R, PIK3R1, CCDC88A, LMBRD1, GRB10, SNX2, PTPN11, PTPN1, PHIP, APP
GO:0048156	tau protein binding	22	0.00917813934084272	4.296203587818106	4.169432185332715e-10	7.956944382488953e-08	7.099253677563222	1.989236095622238e-06	ACTB, DYRK1A, CREBBP, TTBK2, MAP2, APOE, CLU, PPP2CB, TAOK1, HSP90AB1, PPP2R2A, GSK3B, ROCK1, PICALM, FYN, EP300, HSP90AA1, ROCK2, MARK3, SNCA, SMAD2, MAP1A
GO:0003730	mRNA 3'-UTR binding	34	0.014184397163120567	2.9509277168851638	2.5116047128032394e-09	4.1320227878566395e-07	6.38383729203792	1.1982866084784255e-05	QKI, CPEB2, ANGEL2, UTP23, SECISBP2L, HNRNPA2B1, CELF1, HNRNPU, PUM1, PABPC1, CPEB3, TAF15, ZC3H14, SECISBP2, HNRNPA3, FXR1, FUS, SERBP1, DDX5, CELF2, RC3H1, AUH, DHX36, LRPPRC, NOVA1, LARP1, HNRNPC, CPEB4, PUM2, RBMS3, FUBP1, ELAVL3, TIAL1, LARP4B
GO:0008013	beta-catenin binding	36	0.015018773466833541	2.8378592506688407	2.895336347118613e-09	4.6045499040343006e-07	6.336812815792376	1.3813649712102901e-05	CHD8, TBL1XR1, AMER2, FOXO3, TCF4, KANK1, SKP1, APC, FOXO1, TCF7L2, PTPRK, CTNNA2, PSEN1, CTNNA1, CDH19, GSK3B, PTPRJ, CDH8, PRKN, ADNP, CDH12, BTRC, RNF220, EP300, PTEN, RORA, CDH20, SPECC1L, CDH2, CDH9, MED12L, CDH13, GRIP1, CTNND2, CTNNA3, CDH11
GO:0035091	phosphatidylinositol binding	35	0.014601585314977055	2.6851272423863164	2.3999560645795328e-08	3.3677030541496913e-06	5.472666209223941	0.0001145019038410895	PLD1, RPS6KC1, MCF2L, PIK3C2A, APPL2, PITPNC1, PARD3B, SNX2, ITPR1, MTM1, STAM, ARHGAP32, CCDC88A, PXK, APPL1, HIP1, SNX25, SGK3, SNX1, ZCCHC2, BCAS3, SNX14, PITPNB, SNX9, SNX30, SNX27, ITPR2, SBF2, WDPCP, MAPT, KIF16B, SNX13, ESYT2, PARD3, FCHO2
GO:0045296	cadherin binding	93	0.03879849812265332	2.5860642955798308	1.311836774769349e-18	1.043128875404094e-15	14.981662032494606	6.258773252424564e-15	EPS15, ASAP1, NEO1, CD46, SND1, AFDN, YWHAE, APC, HDLBP, SNX2, RDX, NDRG1, PTPRM, USO1, HSPA1A, CTNNA1, PPFIBP1, CDH19, SEPTIN2, PICALM, TJP2, LARP1, SEPTIN7, SHTN1, PDXDC1, CDH9, CDH2, VAPA, MACF1, PI4KA, ABI1, CAST, HNRNPK, ANLN, USP8, ADD1, PTPRJ, CTNNB1, YWHAZ, PAK2, OLA1, ARGLU1, PTPRO, SNX9, CDH20, BMPR2, FNBP1L, CDH13, ESYT2, SH3GLB1, CDH11, PKN2, CAPZB, ERC1, EIF3E, PTPN11, MRTFB, PKM, HSP90AB1, ITGB1, CTNNA2, ANK3, PKP4, SPTAN1, EPN2, SERBP1, PTPN1, CDH12, IQGAP1, DLG1, RAB1A, HSPA8, DOCK9, CKAP5, TJP1, CAPZA1, RTN4, GIGYF2, MPRIP, DDX6, SPTBN1, PSEN1, FMNL2, YWHAB, CDH8, EIF4G2, SNX1, SLK, EIF5, KIF5B, CTNND2, KTN1, CTNNA3
GO:0017124	SH3 domain binding	34	0.014184397163120567	2.585326052846294	1.0670901480015669e-07	1.4141908600320765e-05	4.849491973944289	0.0005091087096115476	EPS15, ARHGAP17, QKI, ELMO1, DOCK1, DOCK3, RUFY2, FUT8, UVRAG, DNAJC6, KHDRBS2, USP8, SH3KBP1, LRP2, ABI2, KHDRBS3, ENAH, RAPGEF1, PRKN, SGIP1, ADAM10, DOCK4, CCDC6, PTPN12, KHDRBS1, SOS1, PAK3, WIPF1, ABI1, LANCL1, CTTNBP2, MAPT, REPS1, ADAM17
GO:0031267	small GTPase binding	87	0.03629536921151439	2.568864000963403	2.7036549841397462e-17	1.84273398990439e-14	13.73453735336191	1.289913792933073e-13	RAB7A, IPO7, CYFIP2, AFDN, TRIP11, RIMS1, RPTOR, DOCK3, PAK1, NDRG1, DOCK10, RASGRP3, RAPGEF4, EVI5, PICALM, GRIA1, WDR44, DOCK11, KIF3A, RAF1, UNC13B, DOCK1, HACE1, MYCBP2, MYRIP, EHBP1, DOCK5, GIT2, XPO1, DMXL2, EXOC5, STRN3, ABI2, DOCK7, DENND1B, DENND5B, PAK2, DOCK4, EXOC2, DIAPH2, RABGAP1, ABCA1, CDKL5, PAK3, PEX5L, CORO1C, PKN2, MYO5A, ERC1, CDC42SE2, XPO4, MAPKAP1, DAAM2, RIC1, CHM, ROCK1, IQGAP1, BICD1, DENND5A, TNPO1, XPO7, NCKAP1, XPO6, RAB3GAP2, RABGAP1L, ROCK2, RAPGEF6, RIMS2, USP33, RAP1A, WASF1, RAB11FIP2, GIT1, RABGEF1, IPO9, RANBP9, KPNB1, FMNL2, RHOBTB3, AP1G1, SRGAP1, GOLGA4, GCC2, EPS8, BRAF, RAB3GAP1, DNM1L
GO:0003712	transcription coregulator activity	43	0.017939090529828953	2.565788253835813	3.0097148371303276e-09	4.6320482219189657e-07	6.334226928036168	1.4359349487948793e-05	SND1, AFF4, NRIP1, NCOA2, LDB2, NFKB1, CREBBP, DHX9, RYBP, THRAP3, YAF2, EWSR1, TRRAP, ATF7IP, CAMTA1, TAF15, AEBP2, AFF1, ZBTB16, KAT6A, MTDH, KAT6B, FUS, KDM2A, MED14, KAT2B, TP53BP1, PIAS2, EP300, MED13L, TCERG1, JMJD1C, ZXDC, NSD1, CNOT2, MED12L, LMO4, NFKBIZ, BTAF1, BCLAF1, BRD4, MED13, PIAS1
GO:0004842	ubiquitin-protein transferase activity	73	0.03045473508552357	2.4890703326247756	8.25364336381655e-14	3.029087114520674e-11	10.518688236468536	3.937813248876876e-10	ARIH1, CNOT4, RNF19A, SHPRH, UBE2H, HACE1, TTC3, UBE2W, RNF144A, HECW2, RMND5A, COP1, RNF169, CBLB, FBXL3, DZIP3, UBE2D3, RNF115, ITCH, UHRF2, TRIM2, FANCL, RNF217, BIRC6, G2E3, UBE2R2, CUL3, HUWE1, MDM2, UBR1, UBR5, HERC1, TRIM24, TRIM33, PRKN, LTN1, PJA2, ANKIB1, UBE2B, UBE3A, UBE2K, RBBP6, RC3H1, FBXO11, TRIP12, UBE2E3, RNF220, PELI1, UBE2G1, RNF13, UBE2D2, UBE4A, TRIM23, UBR3, UBE4B, CUL5, RNF130, HECTD4, FBXL5, UBE2G2, HECTD1, LMO7, MIB1, UBE3C, HERC2, WWP1, HERC3, FBXO21, SMURF2, HERC4, NEDD4L, UBE2E2, UBE2E1
GO:0019904	protein domain specific binding	62	0.025865665415102213	2.4105395696354983	2.177407412336903e-11	4.722004892845166e-09	8.325873567249975	1.0388410764259364e-07	HNRNPM, ZFYVE9, CALM3, DIXDC1, DDX6, NCOA2, YWHAE, GPSM2, RDX, YWHAQ, ARFIP1, MAP3K5, ITPR1, XPO1, ZNF521, PRKAR2A, ZBTB16, RABEP1, RFC1, RBMX, KPNB1, HNRNPK, MDM2, YWHAG, PPP3R1, YWHAB, STXBP1, KHDRBS3, ENAH, RAB6A, KCNAB1, ACSL3, THRA, TRA2B, PRKAR1A, PRKDC, TRIM9, TJP2, VRK2, LAMP2, GRIA1, YWHAZ, IQGAP1, SSX2IP, ZMYND8, FAF1, ICA1L, TFDP2, KHDRBS1, CNOT1, STX18, DICER1, VAPA, IRS2, SNCA, TOP1, SCAMP1, ABL1, MYO1D, SKP1, PIAS1, TRPS1
GO:0005085	guanyl-nucleotide exchange factor activity	67	0.027951606174384646	2.398713669865109	4.234561558748702e-12	1.1223940664883365e-09	8.9498546378619	2.0203093196790055e-08	RAPGEF5, RALGPS2, MCF2L, ELMO1, DOCK1, MYCBP2, SLC38A9, ARFGEF3, DOCK5, RABGEF1, RAP1GDS1, KALRN, DOCK3, RIC8B, KIAA1755, ARHGEF11, MON2, DOCK10, RIC1, ARHGEF7, RASGRP3, RGL1, CCDC88A, RALGPS1, ITSN2, TIAM2, ARHGEF9, SPATA13, GBF1, ARFGEF2, DOCK7, HERC1, RAPGEF1, DENND6A, RAPGEF4, DENND1B, DENND5B, RASGEF1B, DENND11, DOCK4, TRIO, PSD3, DENND5A, RAPGEF2, RAB3GAP2, FARP2, DENND4A, ITSN1, DOCK9, RAB3IP, ARHGEF10, DENND4C, RAB3GAP1, SBF2, WDR41, TIAM1, RAPGEF6, ARHGEF12, SERGEF, SOS2, ARFGEF1, HERC2, DENND1A, SOS1, MCF2L2, RAP1A, DOCK11
GO:0003729	mRNA binding	73	0.03045473508552357	2.3145598664997915	4.569673266674874e-12	1.1474690081739908e-09	8.940259035429728	2.1801911155305827e-08	N4BP1, QKI, NUP98, PPP1R21, RBM5, DDX6, RC3H2, SCAF8, THOC2, DHX9, HDLBP, TPR, CELF1, HNRNPR, G3BP2, PKM, ZNF638, CELF4, PABPC1, DDX17, RBM25, CPSF6, PPHLN1, PUM3, NSRP1, RBMX, YTHDC1, CDC40, KHDRBS2, HNRNPK, CSTF3, SPEN, FXR1, ATXN2, HNRNPD, DDX5, LSM14A, KHDRBS3, AGO2, PTBP2, CSDE1, GPATCH8, TRA2B, RC3H1, EIF4G2, AQR, DHFR, MECP2, MSI2, PEG10, LRPPRC, ZC3H12C, SF1, NOVA1, HSP90AA1, KHDRBS1, RPL13A, SRRM2, G3BP1, PURB, EIF4G3, PAIP2, LUC7L2, CAPRIN1, SF3B1, RBFOX2, ADARB2, TRA2A, STAU2, COPA, PCBP2, RBFOX1, YTHDF3
GO:0044325	transmembrane transporter binding	40	0.016687526074259492	2.306686490103681	2.7160042503314845e-07	3.3225785329055165e-05	4.478524745222119	0.0012958056278331513	PKD2, CALM3, SLC8A1, CALM2, YWHAE, FGF12, CNTNAP2, STK39, CALM1, YWHAQ, AKAP9, ATP1A1, PPP2CB, ANK3, PRNP, PACS1, TRPC1, DPP10, KCNAB1, RYR2, CTNNB1, NEGR1, CRBN, YWHAZ, TCAF1, HTT, FYN, ANK2, HOMER1, DLG1, HSP90AA1, PDE4D, PDE4B, AKAP6, ITPR2, CAMK2D, ATP2A2, RIMS2, ASPH, NEDD4L
GO:0005096	GTPase activator activity	73	0.03045473508552357	2.306050455225895	5.0602852781739604e-12	1.2071310531083984e-09	8.918245577829612	2.4142621062167965e-08	ASAP1, ARHGAP17, RALGAPB, DOCK1, GIT1, STXBP5, DOCK5, HACD3, STXBP5L, AGFG1, PLCB1, ARHGAP21, TBCK, GIT2, DOCK3, RASA1, OPHN1, THY1, NF1, ARHGEF11, ARHGAP32, ASAP2, RABEP1, ARHGAP12, RASAL2, RGS6, GNAQ, STARD13, RASGRP3, RGS7, CHM, TIAM2, AGAP1, CHN1, SMAP1, DOCK7, RASA2, EVI5, SRGAP1, ADGRB3, DLC1, ACAP2, DOCK4, FAM13B, ELMOD1, IQGAP1, ARHGAP5, ARAP2, RALGAPA1, TBC1D15, MYO9A, RAB3GAP2, RABGAP1L, RAPGEF2, ARHGAP35, ARHGAP26, ARHGAP24, TBC1D19, RABGAP1, RAB3GAP1, FAM13A, EIF5, WDR41, SIPA1L1, ARHGEF12, TBC1D22A, ARFGEF1, PIK3R1, DNM1L, RALGAPA2, TBC1D8, SOS1, TBC1D5
GO:0106310	protein serine kinase activity	96	0.04005006257822278	2.2976910553233325	2.5948665183088303e-15	1.2380108158851431e-12	11.907275561084305	1.238010815885143e-11	CDC42BPB, RPS6KA3, NLK, DYRK1A, CAMK4, TTBK2, KALRN, MAP3K5, PAK1, STK3, MAP4K4, SGK3, BMP2K, CSNK1A1, MAPK1, TAOK3, RPS6KB1, MAP2K4, LATS1, CAMK2D, PRKCB, TLK2, TNIK, TRPM7, PRKG1, RAF1, HIPK3, CDK17, AAK1, PRKACB, PRKCE, CSNK1G3, SIK3, PIK3CB, RPS6KA5, PRKD1, CDK19, PAK2, VRK2, WNK1, MAST4, CDKL5, PAK3, MAPK6, SGK1, DAPK1, PKN2, MAP3K4, MAP4K3, HIPK2, CSNK1G1, GSK3B, MAPK8, AKT3, ROCK1, PIK3CA, ROCK2, CDC42BPA, ATR, SMG1, DCLK1, MAP3K7, CLK1, CDK13, CDK6, NEK1, RPS6KC1, CDK14, STK39, CDK8, MAPK10, TAOK1, CAMK2B, MAP2K5, MAPK14, CASK, PRKDC, CDKL1, TRIO, MAP4K5, RPS6KA2, SIK2, NEK7, DCLK2, MARK3, BRAF, CAMK1D, ATM, SLK, MAP3K2, SRPK2, PRKCA, TLK1, PRKCI, MAPK4, PIKFYVE
GO:0003713	transcription coactivator activity	79	0.03295786399666249	2.2702346718236144	1.9136253411615347e-12	5.370533236871578e-10	9.269982591333278	9.129906502681683e-09	ZMIZ1, SSBP2, NUP98, DYRK1A, TRIP11, MAML2, JMY, BRD7, KDM5A, USP22, MTDH, ASXL1, UBE3A, JUND, NCOA6, MTA3, PRKCB, MED13, PSIP1, KMT2E, ZFPM2, SMARCC1, MAML3, SUPT3H, MAGED1, FUS, NUCKS1, MYSM1, MED14, DCAF6, CTNNB1, KAT2B, MED27, EP300, ARGLU1, HMGB1, SETD3, MYT1L, BRD4, ARID5B, QKI, RERE, TACC1, DHX9, CBFB, YAF2, MRTFB, SLC30A9, PKM, DDX17, KDM4C, KAT6A, HIPK2, SMARCA2, CRTC3, KAT6B, ARID1A, NCOA7, TDRD3, TCERG1, KMT2C, MRTFA, TSC22D1, NCOA1, NRIP1, NCOA2, CREBBP, THRAP3, TRIM24, LMO3, WWOX, TP53BP1, MED13L, ZXDC, SS18, ARID1B, MED12L, ABL1, CCAR1
GO:0042393	histone binding	45	0.01877346683354193	2.235019207535431	1.432282560168717e-07	1.8468702958283644e-05	4.73356360363067	0.0006833420094564949	IPO7, CHD8, TBL1XR1, SFMBT2, SCMH1, CHD2, SMARCC1, AASS, RBBP4, IPO9, UHRF2, BRD7, KDM5A, UIMC1, SMARCA2, RSF1, ATAD2B, L3MBTL4, NAP1L1, PWWP2A, SMARCA5, MYSM1, ZZEF1, ATRX, BCAS3, TP53BP1, BAZ1B, DEK, JAK2, NBN, PHF14, NAP1L4, CHD6, MLLT10, PTMA, SNCA, PRKCB, CHD4, CHD1, BRD4, CHD7, MBTD1, MLLT3, TNKS, PHC3
GO:0008017	microtubule binding	70	0.02920317062995411	2.19514051932312	1.2984003807866425e-10	2.5811117569721133e-08	7.58819319096735	6.194668216733071e-07	MAP1B, KIF5C, KIF6, KIF2A, STRBP, CLIP2, APC, CCP110, HOOK3, DNM3, KIF13A, JMY, MAP2, CLASP2, CEP57, DST, NDRG1, DYNC1I1, CDK5RAP2, STARD9, KATNBL1, PRNP, MAP4K4, CCDC88A, KIF21A, SPAST, SPIRE1, CLASP1, CRYAB, GAPDH, ZNF207, SGIP1, CCDC66, KIF27, MAPRE2, CCSAP, KATNAL1, CEP350, RAB11A, TPPP, LRPPRC, PAFAH1B1, JAKMIP2, CLIP1, CAMSAP2, REEP3, SUN2, KIF13B, NAV3, TOGARAM1, CKAP5, OPA1, VPS41, DCLK2, VAPA, SNCA, EML5, KIF1B, MACF1, CCSER2, MAP4, DNM1L, KIF5B, MAPT, MACO1, MTUS1, KIF16B, MAP1A, MTUS2, KIF3A
GO:0004674	protein serine/threonine kinase activity	105	0.04380475594493116	2.148101793909053	1.8621881076197573e-14	8.076817692230785e-12	11.092759719786956	8.884499461453862e-11	CDC42BPB, RPS6KA3, NLK, DYRK1A, CAMK4, RPTOR, TTBK2, KALRN, MAP3K5, PAK1, STK3, MAP4K4, SGK3, BMP2K, CSNK1A1, MAPK1, BMPR1A, TAOK3, MAP2K4, RPS6KB1, LATS1, TOP1, CAMK2D, PRKCB, TLK2, TNIK, TRPM7, PRKG1, RAF1, HIPK3, CDK17, AAK1, PRKACB, PRKCE, CSNK1G3, SIK3, PIK3CB, RPS6KA5, PRKD1, CDK19, PAK2, VRK2, WNK1, BMPR2, MAST4, CDKL5, PAK3, BRD4, MAPK6, SGK1, DAPK1, PKN2, MAP3K4, PKM, MAP4K3, MAPKAP1, HIPK2, CSNK1G1, GSK3B, MAPK8, AKT3, ROCK1, PIK3CA, ROCK2, CDC42BPA, ATR, SMG1, DCLK1, MAP3K7, CLK1, CDK13, CDK6, NEK1, RPS6KC1, RICTOR, CDK14, STK39, CDK8, MAPK10, TAOK1, CAMK2B, MAP2K5, MAPK14, CASK, PRKDC, CDKL1, TRIO, MAP4K5, RPS6KA2, SIK2, NEK7, DCLK2, MARK3, BRAF, CAMK1D, ATM, SLK, MAP3K2, ABL1, SRPK2, PRKCA, TLK1, PRKCI, MAPK4, PIKFYVE
GO:0031625	ubiquitin protein ligase binding	72	0.030037546933667083	2.125956414590403	4.4722054126360023e-10	8.206496932187065e-08	7.085842188517971	2.133689202368637e-06	ARIH1, SHPRH, FHIT, TMBIM6, NLK, PACRG, YWHAE, APC, SYT11, UBE2W, RFFL, HLTF, ATP6V0C, FOXO1, RB1, CLU, PRKAR2A, FBXW7, FANCL, HSP90AB1, ATXN3, CKB, HSPA1A, CUL3, MDM2, JAK1, CACUL1, BOK, RHOBTB3, SH3KBP1, SLF2, XRCC5, DNAJA1, ABI2, STX8, SPOP, GSK3B, SMC6, PRKN, CTNNB1, PSMD1, UBE2B, YWHAZ, UBE2K, PRKAR1A, SMAD5, CUL1, LRPPRC, UBE2G1, UCHL1, PIAS2, FAF1, HSP90AA1, ERBB3, HSPA8, GRIK2, SNX9, CUL5, MAP3K7, BCL2, AMBRA1, HERC2, SMAD2, DNM1L, PCBP2, TANK, GPR37, UBXN7, SPART, RTN4, PIAS1, USP25
GO:0005516	calmodulin binding	49	0.020442219440967878	2.0537948858837773	8.26332953450868e-07	9.386748859319267e-05	4.027484801444986	0.003942434520914091	KCNQ3, UNC13B, SYT1, SLC8A1, PHKB, CAMK4, MYO5A, PLCB1, SPTBN1, EWSR1, VAMP2, MAP2, RYR3, CAMK2B, CDK5RAP2, PDE1C, PCP4, SPTAN1, ARPP21, STRN3, PPP3R1, MBP, CEP97, ADD1, MYO6, IQCB1, RYR2, ADD3, CASK, PPP3CA, PDE1A, PPP3CB, EEA1, IQGAP1, KCNH1, CAMSAP2, MARCKSL1, SCN2A, GRIN1, TJP1, INVS, CAMK1D, ITPKB, CAMK2D, ATP2B2, ATP2B1, STRN, MYO1D, DAPK1
GO:0003714	transcription corepressor activity	51	0.02127659574468085	2.0477232054086296	4.817554313303951e-07	5.7461379071932885e-05	4.240623955160231	0.0022984551628773154	DNMT3A, ZNF451, RERE, TBL1XR1, NRIP1, SFMBT2, NCOR1, RCOR3, RYBP, CREBBP, YAF2, HNRNPU, ZFPM2, AASS, URI1, ATF7IP, RB1, BRD7, HIPK2, NIPBL, HSPA1A, SPEN, N4BP2L2, CBFA2T2, HDAC9, MIER1, PRKN, TLE4, MECP2, PIAS2, SETD5, CDYL, IRF2BP2, TCERG1, ZMYND8, RUNX1T1, SF1, NSD1, HMGB1, KCTD1, ZMYND11, SCAI, MTA3, LCOR, LMO4, CHD4, RBFOX2, JAZF1, COPS2, PIAS1, CCAR1
GO:0016887	ATP hydrolysis activity	91	0.03796412181894034	2.015229517997153	4.0427878536048004e-11	8.38614819545587e-09	8.076437467248446	1.9288140849548501e-07	KIF5C, ABCA6, ACTB, MTREX, KIF13A, ATF7IP, ATP13A3, ATP1A1, CLU, ATP8A2, RSF1, NAV2, HSPA1A, KIF21A, SMARCAD1, SMARCA5, RAD50, KIF27, HSP90AA1, VWA8, CHD6, ATP9B, ATP2B2, KIF3A, ATP11B, ATP2C1, MCM9, ABCD3, ACIN1, XRCC5, YTHDC2, SMC6, OLA1, NAV3, DHX15, HSP90B1, ABCA1, ATP6V1A, CHD1, ATP8A1, DDX24, BTAF1, ATP2A2, CHD7, ATP2B1, KIF16B, ATP9A, ASCC3, YME1L1, KIF6, KIF2A, DHX9, CHD2, MYO5A, CARNS1, EIF4A2, ATP11C, DDX17, HSP90AB1, SMARCA2, SPAST, LONP2, ATP6V1H, DHX36, KATNAL1, MDN1, KIF13B, HSPA8, ATP10B, G3BP1, CHD4, NSF, KIF1B, WRN, CHD9, CHD8, DDX6, SMCHD1, DDX10, PMS1, RHOT1, RFC1, ATAD2B, SMC5, RHOBTB3, DDX5, AQR, ATRX, FIGN, ABCA8, KIF5B
GO:0004672	protein kinase activity	119	0.04964539007092199	1.9854300075741929	1.0507171100047241e-13	3.3419808878883593e-11	10.475996038077684	5.012971331832539e-10	NME7, CDC42BPB, RPS6KA3, NLK, DYRK1A, CAMK4, EPHA6, TTBK2, KALRN, MAP3K5, PAK1, STK3, MAP4K4, ERBB4, JAK1, SGK3, BMP2K, CSNK1A1, MAPK1, RYK, BMPR1A, TAOK3, MAP2K4, RPS6KB1, LATS1, CAMK2D, PRKCB, PIK3C3, TLK2, TNIK, TRPM7, PRKG1, RAF1, HIPK3, FER, CDK17, AAK1, PRKACB, PRKCE, CSNK1G3, SIK3, ABL2, PAN3, RPS6KA5, PRKD1, CDK19, PAK2, IGF1R, VRK2, ERBB3, WNK1, BMPR2, MAST4, CDKL5, PAK3, MAPK6, NTRK3, SGK1, DAPK1, PEAK1, PKN2, MAP3K4, TBCK, EPHA7, MAP4K3, HIPK2, CSNK1G1, PTK2, GSK3B, MAPK8, PXK, AKT3, ROCK1, FYN, JAK2, PDK4, ROCK2, CDC42BPA, ATR, SMG1, DCLK1, MAP3K7, CLK1, CDK13, CDK6, NEK1, RPS6KC1, CDK14, STK39, CDK8, MAPK10, TAOK1, CAMK2B, ROR1, MAP2K5, MAPK14, TRIM24, CASK, PRKDC, CDKL1, TRIO, MAP4K5, RPS6KA2, SIK2, NEK7, NTRK2, DCLK2, MARK3, BRAF, CAMK1D, ATM, SLK, MAP3K2, ABL1, SRPK2, PRKCA, TLK1, PRKCI, MAPK4
GO:0019901	protein kinase binding	106	0.04422194409678765	1.929650764019997	1.7912723262327007e-11	4.069600127836293e-09	8.390448261734429	8.546160268456215e-08	PPP1R12B, ATP1B1, RPS6KA3, ACTB, CALM2, RB1CC1, APC, RPTOR, RFFL, CALM1, MAP3K5, SLC12A2, CACNB4, PAK1, CACUL1, STXBP1, ACSL3, KIZ, GRIA1, FAF1, SNAP91, CDH2, LATS1, IRS2, GPRC5B, CCNT2, NBEA, FRMD5, CALM3, PTPRK, ARHGEF7, STRN3, ATG13, PTPRJ, RYR2, CTNNB1, KAT2B, YWHAZ, MAPRE2, IBTK, PAK2, VRK2, MEF2A, SLC12A6, RGCC, WNK1, PPP1R12A, EXOC2, SPRED1, CADPS, MAPK6, SOS1, RAC1, PLCG2, SASH1, ERCC6L2, CYLD, PTPN11, NR3C1, HSP90AB1, ITGB1, MAPKAP1, LRRC7, TCF7L2, CNKSR2, MT-ND2, PTK2, CDK5RAP2, RHOBTB1, GSK3B, PTPN1, PRKN, RBBP6, IQGAP1, BICD1, JAK2, DLG1, KIF13B, CDC42, MAP3K7, NSF, CDK13, MAPT, LIMS1, SPG11, RAB11FIP2, FOXO3, RICTOR, PEBP1, STK39, UTRN, AKAP7, RHOQ, ELP2, ATF2, LRBA, ANK2, DLG2, CCNY, CLTC, USP37, MAP3K2, ABL1, MAPK4, UNC5C, POLA1
GO:0016301	kinase activity	139	0.05798915310805173	1.8779003103984802	9.222890149511272e-14	3.1430292073798775e-11	10.502651583174282	4.400240890331828e-10	NME7, CDC42BPB, RPS6KA3, NLK, DYRK1A, CAMK4, EPHA6, TTBK2, KALRN, MAP3K5, ADK, AK5, PAK1, STK3, CHKA, SGMS1, MAP4K4, ERBB4, JAK1, SGK3, DGKH, BMP2K, CSNK1A1, MAPK1, RYK, BMPR1A, TAOK3, RPS6KB1, MAP2K4, LATS1, CAMK2D, PRKCB, PIK3C3, PI4KA, TLK2, TNIK, TRPM7, PRKG1, RAF1, HIPK3, FER, CDK17, AAK1, PRKACB, PRKCE, CSNK1G3, SIK3, ABL2, DGKB, PIK3CB, RPS6KA5, ETNK1, PRKD1, CDK19, PAK2, IGF1R, VRK2, BAZ1B, ERBB3, WNK1, BMPR2, MAST4, CDKL5, ITPKB, PANK3, PAK3, MAPK6, CERT1, NTRK3, DAPK1, SGK1, PKN2, PIK3C2A, MAP3K4, PKM, EPHA7, MAP4K3, HIPK2, GALK2, CSNK1G1, CKB, PTK2, PPIP5K2, GSK3B, MAPK8, AKT3, ROCK1, PIP4K2A, PIK3CA, FYN, JAK2, PDK4, ROCK2, CDC42BPA, ATR, SMG1, DCLK1, MAP3K7, CLK1, CDK13, CDK6, NEK1, RPS6KC1, CDK14, STK39, DGKI, TRRAP, CDK8, MAPK10, TAOK1, CAMK2B, ROR1, MAP2K5, MAPK14, CASK, PRKDC, CDKL1, TRIO, MAP4K5, RPS6KA2, SIK2, NEK7, NTRK2, DCLK2, MARK3, BRAF, CAMK1D, ATM, CCNH, SLK, MAP3K2, ABL1, SRPK2, PRKCA, TLK1, PAPSS1, PRKCI, MAPK4, PIKFYVE
GO:0003676	nucleic acid binding	129	0.05381727158948686	1.862891639759784	1.8175160248497076e-12	5.370533236871578e-10	9.269982591333278	8.671368954557955e-09	SND1, MTREX, HDLBP, HNRNPH1, HNRNPR, EWSR1, PNPT1, TAF15, XRN1, KHDRBS2, SYNJ1, PTBP2, CSDE1, RBM33, RBM39, MSI2, ANKRD17, RBMS3, DICER1, FUBP1, RBFOX1, RCAN1, TIAL1, R3HDM2, CNOT4, CPEB2, PSPC1, RALYL, SRSF11, ZFR, TSEN15, HNRNPK, ACIN1, FXR1, FUS, YTHDC2, KHDRBS3, CELF2, ZNF318, MECP2, AGO3, ZRANB3, ERI3, KHDRBS1, HNRNPH3, DHX15, RBFOX2, DDX24, RCAN2, ASCC3, HNRNPM, QKI, SCAF8, REV3L, DHX9, RYBP, ZCCHC24, MTERF1, ZNF638, PABPC1, CPEB3, CELF4, EIF4A2, RNPC3, SLTM, ENOX2, FOXO1, RBM25, DDX17, HNRNPA3, ARPP21, RBM26, R3HDM1, SCAPER, ZCCHC2, DHX36, RBBP6, FAN1, PEG10, SF1, HNRNPC, TNRC6B, SON, G3BP1, WRN, TRA2A, ZCCHC7, ENPP2, XRN2, TTC14, LARP4B, ZFHX3, ANKHD1, DDX6, U2SURP, RBM5, HNRNPA2B1, SREK1, DDX10, CELF1, TUT7, TUT4, HLTF, G3BP2, CPSF6, ZNF407, RBMX, SPEN, HNRNPD, DDX5, AGO2, TRA2B, ENOX1, SCAF4, NOVA1, TRMT11, CPEB4, POGZ, SFPQ, TNRC6A, LEMD3, HNRNPDL, ZFHX4, TNRC6C, ELAVL3, PCBP2, GPATCH8, POLA1, RBM6
GO:0003779	actin binding	84	0.03504380475594493	1.8602118627666027	1.4047338009654295e-08	2.0309045346685043e-06	5.692310490697167	6.701984964406064e-05	ACTR3, DIXDC1, SNTG1, EPB41L1, DYRK1A, PACRG, RDX, JMY, OPHN1, DMD, DSTN, PDLIM5, MYO9A, WIPF1, MACF1, TRPM7, KCNMA1, MAP1A, MAP1B, TMOD2, CLMN, MYRIP, DST, TLN2, ANLN, CCDC88A, KLHL2, TMSB4X, ADD1, ERMN, MYO6, MICAL3, ENAH, LIMCH1, MARCKSL1, SETD3, DIAPH2, CAPZA2, PHACTR3, CORO1C, CAPZB, MYO5A, PHACTR4, DAAM2, ITGB1, KLHL3, PTK2, SPTAN1, PXK, ACTR2, PRKN, KLHL4, SSH2, COBL, ABLIM1, MRTFA, SNCA, KLHL5, MAPT, LIMS1, CAPZA1, PHACTR1, WASF1, MPRIP, NEBL, SYNE1, HNRNPU, SPTBN1, UTRN, PPP1R9A, EPB41L2, CAMK2B, MTSS1, FMNL2, FMN2, SPIRE1, HIP1, SORBS1, ADD3, LDB3, SHROOM4, EPS8, WASL, MYO1D
GO:0003682	chromatin binding	103	0.04297037964121819	1.8323352776201445	9.48704936109894e-10	1.6763967593260387e-07	6.775623187380176	4.526271250180304e-06	TTC21B, NFIA, NIPBL, KDM5A, SMARCAD1, PWWP2A, KMT2A, SMARCA5, WAC, ASXL1, TLE4, MPHOSPH8, BCAS3, ANKRD17, NAP1L4, CHD6, NCOA6, MTA3, TOP1, PRKCB, CCNT2, MBTD1, PSIP1, MITF, ATXN1, MLLT3, DNMT3A, SFMBT2, MBD5, SCMH1, EP400, MCM9, TPR, SMARCC1, CBX5, FUS, NUCKS1, SSBP1, SP3, STAG2, CTNNB1, KAT2B, ADNP, MECP2, EP300, MEF2A, CHD1, STAG1, BRD4, CHD7, AUTS2, RERE, KMT5B, NFKB1, CHD2, ASXL2, SLC30A9, URI1, TAF2, FOXO1, JARID2, SMAD4, TASOR, KAT6A, SMARCA2, KAT6B, NAP1L1, TDRD3, NCOA1, MORF4L1, ASH1L, CHD4, SMAD2, NFAT5, PHF21A, TOP2B, PHC3, RAD21, CHD8, YY1, NCOA2, CREBBP, PBRM1, HNRNPU, THRB, RBMX, SUZ12, HMGN3, ATAD2B, RBPJ, L3MBTL4, HNRNPD, TRIM24, APP, ATF2, ATRX, CDYL, NSD1, SFPQ, MLLT10, ZEB1, POLA1, ASXL3
GO:0061630	ubiquitin protein ligase activity	80	0.033375052148518984	1.8233224775885863	9.131999011162705e-08	1.2448219223502075e-05	4.904892771999719	0.00043568767282257264	SHPRH, RFFL, RNF38, RNF115, G2E3, MKRN3, UBE3A, RNF220, TRIM23, UBE2D2, UBE4A, SH3RF1, HECTD1, WWP1, HERC3, CNOT4, RNF19A, HACE1, MYCBP2, RNF150, HECW2, RMND5A, UBE2D3, FANCL, UBR5, HERC1, ANKIB1, BTRC, TRIM9, PELI1, UBE3C, SMURF2, CBLB, TRIM59, RC3H2, RNF144A, RNF169, ITCH, UHRF2, TRIM2, RNF217, UBR1, NT5C2, TRIM33, PRKN, C10orf90, PJA2, UBR2, TRIP12, RBBP6, UBR3, UBE4B, CDC42, RNF130, UBE3D, RNF111, ARIH1, MSL2, TTC3, RABGEF1, COP1, HLTF, DZIP3, CUL3, MDM2, RNF216, HUWE1, RNF145, TRIM24, LONRF2, LTN1, RC3H1, RNF13, TRIM44, HECTD4, MIB1, HERC2, HERC4, NEDD4L, PELI2
GO:0005524	ATP binding	310	0.12932832707551106	1.8194304811797992	1.9738693223973447e-27	4.708665268578866e-24	23.327102181754373	9.417330537157732e-24	KIF5C, MTREX, TTBK2, NAIP, ADCY5, MAP3K5, ADK, NAV2, KIF21A, ERBB4, DNAJA1, SGK3, ACSL3, BMP2K, MAPK1, MYO9A, TAOK3, VWA8, CHD6, SUCLG2, ITPR2, PIK3C3, PCCA, MCM9, CSNK1G3, SIK3, UBE2D3, SETX, YTHDC2, VRK2, MAT2A, CDKL5, PNPLA8, BTAF1, CHD7, SGK1, CHD2, MYO5A, PKM, ATP11C, SMARCA2, CKB, PPIP5K2, SPAST, ACTR2, PIP4K2A, JAK2, HSPA8, G3BP1, WRN, CLK1, MSH3, THRAP3, HNRNPU, MAP2K5, ATRX, RPS6KA2, SIK2, CAPRIN1, PAPSS1, TLK1, SHPRH, NLK, DYRK1A, ATP13A3, HSPA1A, HLCS, DGKH, KIF27, RYK, PRKCB, UBE2G2, PRKG1, HSPA12A, UBE2W, ATP2C1, PRKACB, EP400, PRKCE, ABL2, ETNK1, RPS6KA5, PRKD1, NAV3, WNK1, DHX15, MAST4, HSP90B1, PAK3, PANK3, ATP6V1A, ATP8A1, MAPK6, NUBPL, NMNAT2, DAPK1, CLCN3, MCCC1, KIF6, PEAK1, UBE2H, EIF4A2, UBE2R2, PXK, LONP2, NT5C2, KATNAL1, FYN, ATP10B, DCLK1, MAP3K7, NSF, CHD9, GLUL, TOP2B, RPS6KC1, RICTOR, PMS1, RFC1, ATAD2B, FARS2, PRKDC, FIGN, GLUD1, NTRK2, CAMK1D, PRKCA, DYNC1LI2, PIKFYVE, MYO1D, RARS2, CDC42BPB, ABCA6, RPS6KA3, PAPOLA, ATP1A1, CHKA, DNAH6, MAP4K4, RAD50, SYN2, UBE2K, CNNM2, BMPR1A, UBE2D2, HSP90AA1, MAP2K4, CAMK2D, PI4KA, TLK2, TRPM7, KIF3A, ATP11B, RAF1, FER, ABCD3, ORC4, RNGTT, MYO6, UBE2E3, CDK19, PAK2, OLA1, ZRANB3, ITM2B, ERBB3, BMPR2, TTL, DDX24, ATP2B1, KIF16B, ATP9A, YME1L1, KIF2A, PKN2, PIK3C2A, ERCC6L2, TBCK, EPHA7, DDX17, HSPA4, HIPK2, GALK2, DYNC2H1, GSK3B, MAPK8, UBA6, ROCK1, ROCK2, CDC42BPA, SMG1, CACNA1B, CHD4, KIF1B, CDK6, NEK1, UBE2E1, DDX6, PEBP1, HLTF, CDK8, GPHN, TAOK1, CAMK2B, ROR1, SMC5, DDX5, UBE2B, MAP4K5, TTLL7, TTLL11, BRAF, ATM, KIF5B, UBE2E2, NME7, ACTR3, ACTB, CAMK4, GCLC, ADCY9, RAD51B, KIF13A, EPHA6, KALRN, PAK1, AK5, STK3, ATP8A2, JAK1, SMARCAD1, SMARCA5, CSNK1A1, RPS6KB1, DICER1, LATS1, TOP1, ATP9B, ATP2B2, TNIK, HELZ, ACSL4, HIPK3, CDK17, AAK1, DGKB, PAN3, XRCC5, PIK3CB, SMC6, IGF1R, BAZ1B, UBE2G1, DPH6, ABCA1, ITPKB, CHD1, ATP2A2, NTRK3, ASCC3, ACACA, DNHD1, DHX9, MAP3K4, CARNS1, TENT2, ITPR1, MAP4K3, HSP90AB1, CSNK1G1, KIAA0232, PTK2, HSPH1, AKT3, DHX36, PIK3CA, MDN1, KIF13B, MAGI1, PDK4, CLCN4, UBE4B, ATR, DYNC1H1, CDK13, CHD8, SMCHD1, CDK14, DDX10, STK39, DGKI, MAPK10, STARD9, RHOBTB3, CHORDC1, MAPK14, CASK, AQR, CDKL1, TRIO, NEK7, ABCA8, DCLK2, MARK3, SLK, MAP3K2, ABL1, SRPK2, PRKCI, MAPK4
