HP:0001260	Dysarthria	217	0.050336348874971	1.799874030258512	9.20720613630539e-21	1.787066594795727e-18	17.747859263267486	9.471452952417355e-17	ERCC8, ALS2, UBA5, NEFL, MYORG, ACTB, SLC35A1, GCLC, CLN5, TTBK2, XPR1, EPM2A, PGM3, PDE8B, WASHC5, CACNB4, WFS1, PNPT1, TAF15, SPRED2, TUBB4A, ERBB4, ATXN2, SLC30A10, SYNJ1, WAC, TMEM106B, NEB, KDM6A, CA8, NDUFAF6, BMPR1A, SACS, PON2, ATL1, XRCC4, FBXO7, GPRC5B, ATG7, PI4KA, GALC, ATXN1, ATXN10, AQP4, FMR1, RAF1, ANO10, TTPA, SIL1, PSAP, HACE1, PPP1R21, UBAP1, PRKRA, GTF2I, FIG4, RANBP2, DDHD2, RTTN, MT-ATP6, HS6ST1, FTH1, ABHD12, POLR3B, CAMTA1, ANOS1, WDR11, ATXN3, PRNP, DNAJC6, TARDBP, RUBCN, DMXL2, TTN, FUS, SETX, ATG5, GBF1, SELENOI, SLC17A5, RNF170, CACNA1A, SLC44A1, SNAP25, NDUFA9, SLC20A2, BAZ1B, OPA1, SCN8A, HTRA1, PANK2, EEFSEC, DCC, PDGFRB, SRPX2, SEMA3A, VPS41, APTX, PDE10A, VAPB, PNPLA8, GTF2E2, HPCA, ATP5F1A, TBC1D23, RRAS2, CHD7, SLC13A3, DYNC1I2, PLD3, SOS1, SCARB2, NUBPL, DCAF17, RERE, DNAJB6, PLP1, HEPACAM, RPS20, PTPN11, GFAP, FBXL3, ITPR1, FGF14, TPK1, NPC1, COX20, MSH2, ADAR, SOD1, SPTAN1, SERPINI1, SMS, EIF2AK2, SPAST, RYR1, TBC1D24, NT5C2, RASA2, AUH, PIK3CA, MMUT, JAK2, MRE11, TTC19, TRAPPC11, TNR, SNCA, GOSR2, KRAS, SOS2, CBL, ABCB7, PEX2, TECPR2, LRP12, NEK1, ATP1A2, MAP2K1, VPS13A, SPG11, ZFHX3, PRRT2, SYNE1, TK2, PMS1, SYT14, TPP1, NUP54, APOE, JAM2, FTL, TRIM37, C9orf72, RFC1, PSEN1, CYP7B1, GJA1, RNF216, FARS2, ADGRG1, ATXN7, PACS1, TBK1, DAB1, ADD3, HSD17B4, NPAT, GAN, FAR1, WWOX, PPARGC1A, SLC1A3, ALDH3A2, UCHL1, GDAP2, MED13L, SNCAIP, VPS13D, ELOVL5, SCN2A, AFG3L2, ZC4H2, CNOT1, PPP2R2B, BRAF, ATM, NARS2, CAPRIN1, MRAS, ERCC5, NUS1, GRID2, REPS1, SPART, IFRD1, GLB1
HP:0001319	Neonatal hypotonia	67	0.015541637671073997	1.7982897161429214	3.676984664526292e-07	1.2162424837293237e-05	4.914979830616677	0.0037825141243981964	CRPPA, AP4E1, PCLO, PGAP1, NADK2, ZNF148, SYT1, GRIA4, SYNE1, PEX1, KANSL1, ERCC6L2, LAMA2, TBCK, PDSS2, PURA, ITPR1, CAMTA1, TMEM260, MTM1, DST, PRDM5, KAT6A, RBL2, CCDC88A, MKRN3, PDHX, VPS13B, FXR1, SLF2, ATXN7, RYR1, TMCO1, SNRPN, SLC25A46, WAC, HSD17B4, CASK, MECP2, LARGE1, GNPTAB, NEB, PAFAH1B1, WDR19, SUMF1, SON, COPB1, NSD1, VPS53, SLC12A6, PDE4D, BRAF, ARID1B, CDKL5, FKTN, MEGF10, GATAD2B, USP7, HERC2, LYRM4, STAG1, PEX2, FOXG1, CWC27, ACOX1, GABRA2, PHIP
HP:0007256	Abnormal pyramidal sign	76	0.017629320343307817	1.797492484112712	4.497320555443606e-08	1.713479131624014e-06	5.7661211804525125	0.00046263936553848375	ALS2, SPG11, ERAP1, TTPA, MYORG, PLP1, GBE1, SLC6A1, PRKRA, BSCL2, CHD2, PMS1, RNASEH2B, RTTN, MT-ATP6, TTBK2, XPR1, UBAC2, POLR3B, GFAP, NDUFA13, RPS20, ITPR1, CAMTA1, TAF2, JAM2, SAMHD1, MSH2, ATXN3, DMXL2, PRNP, ADAR, SOD1, TLR4, HSPD1, DNAJC6, SPTAN1, SETX, ADGRG1, TBC1D24, SYNJ1, ADD3, NPAT, ALDH3A2, GAN, IFNGR1, NDUFS2, SLC20A2, CACNA1A, HTT, PIK3CA, SLC1A3, TMEM106B, ALG13, VPS13D, BMPR1A, HTRA1, PANK2, RORA, SACS, PDGFRB, SCN2A, FBXO7, PPP2R2B, VPS13C, VPS41, VAPB, ATM, SNCA, AP2M1, GTF2E2, KRAS, DNM1L, ATXN10, ATP1A2, NALCN
HP:0001288	Gait disturbance	251	0.05822315008118766	1.7951556872337442	1.149748871275223e-23	3.032683753540569e-21	20.518172875298664	1.182746663880822e-19	ERCC8, ALS2, CYFIP2, UBA5, PGAP1, NEFL, RPS6KA3, MYORG, DYRK1A, THOC2, B3GALNT2, ARL6IP1, ARMC9, TTBK2, CPLANE1, XPR1, EPM2A, PDE8B, WASHC5, KCNA2, ATP6AP2, MED23, GDAP1, SAMHD1, MTOR, TUBB4A, KDM5A, MTR, YWHAG, DMD, SLC30A10, LRP4, SYNJ1, TMEM106B, PPP3CA, GLRB, MT-ND1, LARGE1, TFG, SYNE2, NEB, CA8, NDUFAF6, BMPR1A, DDHD1, SACS, PMP22, ARL3, ATL1, MYO9A, XRCC4, USP7, PI4KA, FHL1, FOXG1, GALC, ATXN1, ACOX1, FMR1, AP4E1, ELP1, TTPA, PSAP, HACE1, GLB1, UBAP1, PRKRA, GTF2I, FIG4, FGF12, RNASEH2B, USP9X, MT-ATP6, HS6ST1, DDHD2, ABCD3, RANBP2, HSPB1, IFT74, PRDM5, ATAD1, AOPEP, WDR11, ANOS1, PRNP, EED, TLR4, TTN, FUS, STRADA, CC2D2A, KCNJ10, LUZP1, TMCO1, LYST, HERC1, CRYAB, SETX, GBF1, TCTN1, CELF2, RNF170, CACNA1A, SLC20A2, SNAP25, MECP2, CDK19, LAMP2, BAZ1B, OPA1, ZBTB20, SCN8A, MT-CO2, HTRA1, PIBF1, PANK2, SEMA3A, DCC, PDGFRB, BICD2, APTX, CDKL5, ATP6V1A, MT-CO3, HPCA, TBC1D23, SLC9A6, ALG14, CHD7, FAM149B1, SPTLC1, SLC1A2, MICU1, NUBPL, PHIP, SMARCE1, ERAP1, RERE, OFD1, PLP1, GBE1, DYM, DAG1, RPS20, PMP2, SLC30A9, UBAC2, ITPR1, FGF14, TPK1, KIAA0753, CSPP1, JARID2, MSH2, RIC1, ADAR, CNKSR2, TAF1, SPTAN1, SGCD, AP4S1, EIF2AK2, RYR1, TUBB2B, ARL13B, TBC1D24, PRKN, EIF2S3, FBXO38, IFNGR1, PHKA1, PIK3CA, GNPTAB, AHI1, KCNB1, NPHP1, UBE4B, GABRG2, TRAPPC11, RSPRY1, CACNA1B, MEGF10, DYNC1H1, SNCA, GOSR2, MT-CO1, KRAS, DNM1, ABCB7, RPGRIP1L, LRP12, ERCC6, ATP1A2, CRPPA, SPG11, VPS37A, TRAK1, KPNA3, SMCHD1, DDX6, SLC9A7, SYNE1, BSCL2, CACNA2D1, PMS1, TK2, SYT14, TPP1, CDK8, NUP54, WDR48, GPHN, PIGL, APOE, JAM2, FTL, FRRS1L, GJA1, PSEN1, MT-ND5, SPEN, TMEM43, DAB1, APP, ASAH1, NPAT, CASK, GAN, WWOX, LNPK, MT-ND4, HTT, GDAP2, LPIN1, TOGARAM1, ELOVL5, SLC13A5, PPP2R2B, NTRK2, TMEM67, CLTC, ATM, SBF2, FKTN, DNM1L, NUS1, ANO5, GRID2, SPART, GABRA2, KIAA0586
HP:0001347	Hyperreflexia	231	0.05358385525400139	1.7944928175795327	1.0275891599936728e-21	2.1573080997663088e-19	18.666087825934518	1.0570809688854912e-17	ERCC8, RARS2, CYFIP2, PCLO, ALS2, PEX14, PGAP1, MYORG, DMXL2, PEX1, GCLC, PLCB1, GRM7, XPR1, TTBK2, WASHC5, SLC12A2, MCPH1, ATP6AP2, MFF, TAF15, CHKA, ERBB4, TMX2, PIGN, ATXN2, GLDC, SYNJ1, ABAT, TMEM106B, LRRK2, GLRB, UBE3A, MT-ND1, BCAS3, TFG, DDHD1, CA8, EXTL3, SACS, PON2, ATL1, FBXO7, IREB2, PI4KA, EXOSC3, PHC1, FRMPD4, GALC, ATXN1, ATXN10, ACOX1, NDUFS1, NALCN, AP4E1, RFX7, ANO10, PSAP, UBAP1, PRKRA, GTF2I, FIG4, GFM1, DDHD2, MCCC2, MT-ATP6, FTH1, ABHD12, POLR3B, CACNA1E, ZFR, ATAD1, TSEN15, HSPD1, ATXN3, PRNP, GNAQ, DNAJC6, CCDC88A, FANCL, TLR4, PEX3, TARDBP, CEP63, TRAPPC10, FUS, CC2D2A, SETX, GCSH, ALG9, SELENOI, SLC25A46, NDUFS4, CACNA1A, SLC20A2, MECP2, BAZ1B, OPA1, EP300, GNAO1, HTRA1, PANK2, EEFSEC, DCC, PDGFRB, SRPX2, WLS, BICD2, VAPB, CDKL5, ATP6V1A, SLC9A6, DSTYK, DYNC1I2, SPTLC1, NUBPL, AUTS2, UGP2, MCCC1, ERAP1, PLP1, DYM, DHX9, SLC33A1, MT-ND3, UBAC2, GFAP, ITPR1, TAF2, NSRP1, PTS, CDK5RAP2, MT-ND2, ADAR, SOD1, SPTAN1, EYA1, AP4S1, SPAST, OSTM1, TUBB2B, NT5C2, PRKN, EIF2S3, IFNGR1, NDUFS2, AUH, RLIM, DENND5A, TRAPPC6B, VPS13C, HIBCH, TTC19, TRAPPC11, TNR, SNCA, KRAS, DNM1, ABCB7, PEX2, RPGRIP1L, NEK1, ERCC6, ATP1A2, PSAT1, DPYD, SPG11, VPS37A, TRAK1, KPNA3, SLC4A10, SYNE1, CREBBP, BSCL2, AGTPBP1, CCDC47, COPB2, JAM3, TPP1, NUP54, GPHN, ZEB2, JAM2, FTL, GJA1, FBXL4, PSEN1, CYP7B1, MT-ND5, HUWE1, SNRPN, ADGRG1, ATXN7, TBK1, KIF1A, SEC31A, CASK, GAN, ELP2, WWOX, PPARGC1A, MT-ND4, ATRX, TRIM8, HTT, TRIO, UCHL1, SLC1A3, KIDINS220, GDAP2, VPS13D, NUP214, NSD1, SCN2A, SLC1A4, AFG3L2, GNB1, ZC4H2, PPP2R2B, GRIA3, HECTD4, ANKLE2, NTRK2, RAB3GAP1, NARS2, TMEM67, MED17, GRID2, PDCD6IP, SPART, GLB1
HP:0003677	Slowly progressive	60	0.013917884481558803	1.791579679888657	1.2895523285045925e-06	3.8229466292007904e-05	4.417601764969564	0.013265624803326744	CRPPA, SPG11, ALS2, NEFL, DNAJB6, PLP1, GBE1, HEPACAM, SYNE1, BSCL2, LAMA2, PMP2, SYT14, CLCN5, ABHD12, TPP1, NDUFA13, HSPB1, ITPR1, PDE8B, COX6A1, ATP6AP2, ATP1A1, RFC1, DNAJC6, TTN, TMEM43, SETX, MAP3K20, RYR1, KIF1A, TEAD1, FARS2, TBC1D24, DAB1, FBXO38, LRRK2, GAN, MECP2, TFG, DDHD1, GDAP2, PMP22, ELOVL5, WNK1, PLD3, AFG3L2, FBXO7, FN1, HNRNPDL, DYNC1H1, HPCA, STIM1, KIF1B, ALG14, DNM1L, PEX2, TOR1AIP1, LRP12, GNB4
HP:0000325	Triangular face	64	0.014845743446996056	1.7880873218381916	6.438842727858188e-07	2.0380423120454518e-05	4.690786803795194	0.006623637514147718	RAF1, MTX2, DCAF17, PEX14, RERE, ZNF148, FLCN, PSMD12, BSCL2, RAP1GDS1, ERI1, PAPPA2, PTPN11, ATP6V1E1, PLOD2, CEP57, TRIM37, JARID2, SOX6, TAOK1, KAT6A, SPRED2, FBN1, SMARCA2, HUWE1, ZMYM2, SIN3A, SMC5, RPL17, HERC1, SEC31A, STAG2, ERCC6, RASA2, FOCAD, ANKRD11, IGF1R, FBXO11, ANKRD17, NOTCH2, MED13L, TNRC6B, NSD1, XRCC4, SPRED1, BRAF, MED12L, LARP7, ATP6V1A, LEMD3, KRAS, FRA10AC1, SOS2, CBL, MRAS, RRAS2, PIK3R1, EPG5, BPTF, SOS1, MAP2K1, UNC80, NALCN, TRPS1
HP:0002808	Kyphosis	116	0.026907909997680352	1.7877268203620147	1.9118232327108833e-11	1.2854199735226704e-09	8.890954956080135	1.9666925594896857e-07	ERCC8, RPS6KA3, ACTB, DYRK1A, MEIS2, WASHC5, CUL4B, LFNG, SPRED2, MKRN3, ALMS1, SYNE2, NEB, EXTL3, RAB18, DICER1, MARK2, USP7, PI4KA, TLK2, FHL1, FOXG1, NELFA, UPF3B, IDS, KMT2E, GNAS, SIL1, PSAP, HACE1, GTF2I, FIG4, PLOD2, NF1, PLAAT3, MAPK8IP3, USP8, SIN3A, LUZP1, HDAC4, ALG9, HERC1, MECP2, BAZ1B, ZBTB20, NOTCH2, PTEN, EEFSEC, DCC, PDGFRB, BICD2, CDKL5, MBTPS1, CRTAP, ASCC3, AUTS2, RERE, DYM, KANSL1, ASXL2, LAMA2, ITPR1, UFSP2, SMAD4, FBN1, ATP6V1B2, TAF1, SMS, VPS13B, ACBD6, PRKAR1A, ANKRD11, PIK3CA, GNPTAB, SETD5, VPS35L, SON, RAB3GAP2, COPB1, KMT2C, SDHC, TCF12, UBE4B, ERCC6, EHMT1, CHD8, VPS37A, SYNE1, SPTBN1, PTCH1, USF3, ZNF407, NSD2, SH3PXD2B, SPEN, SMC5, TMEM43, FGFR3, ALDH3A2, ATRX, HTT, TRIO, SCAF4, IPO8, KCNN3, SOX9, NSD1, ZC4H2, GRIA3, ARID1B, RAB3GAP1, HS2ST1, YARS2, HERC2, ABL1, GLB1
HP:0008872	Feeding difficulties in infancy	168	0.03897007654836465	1.7836171035335964	8.769085247162187e-16	9.805171732343197e-14	13.008544795493814	9.020757993755741e-12	ERCC8, ZMIZ1, PEX14, EPB41L1, ST3GAL5, RPS6KA3, MID1, DYRK1A, PEX1, WDR26, RREB1, ARMC9, TTC21B, CPLANE1, WASHC5, MTM1, WFS1, PNPT1, SAMHD1, SPRED2, NIPBL, KDM3B, HLCS, PIGN, MKRN3, RNF6, ABAT, ASXL1, UBE3A, IFT80, LARGE1, HADHA, KDM6A, PCCB, ARL3, EFEMP1, TSPYL1, USP7, HADHB, EPG5, PCCA, NALCN, RAF1, ELP1, SUCLA2, PSAP, PURA, IFT74, BTD, PEX3, HSPD1, SEC63, COX10, HNRNPK, SIN3A, CC2D2A, FOXP1, LUZP1, TCTN1, NDUFS4, MECP2, OPA1, EP300, SCYL2, PIBF1, COX16, PANK2, JMJD1C, LIFR, WNK1, FAT4, TRAF3IP2, SUPT16H, SMC3, SLC9A6, ALG14, BRD4, RRAS2, CHD7, FAM149B1, SOS1, PHIP, RAC1, AUTS2, UGP2, MCCC1, OFD1, RERE, REV3L, KANSL1, ASXL2, LAMA2, PTPN11, KIAA0753, CSPP1, ITCH, RIC1, FBN1, SRP54, DYNC2H1, VPS13B, RYR1, ARL13B, RASA2, SATB2, AHI1, VPS35L, DLG1, SON, RAB3GAP2, UBE4B, CNOT2, TRAPPC11, MAP3K7, KRAS, SOS2, CBL, SMAD2, ASPH, PEX2, RPGRIP1L, ERCC6, MAP2K1, PSAT1, DPYD, TGFB2, RAD21, YY1, CHD8, FLCN, CREBBP, TK2, TIMMDC1, CDK8, SUZ12, SPEN, FARS2, SNRPN, KIF1A, NAPB, HSD17B4, CASK, WWOX, ATRX, TRIO, IPO8, RNF13, SOX9, WDR19, TOGARAM1, NSD1, B3GLCT, HDAC8, POGZ, BRAF, TMEM67, MED12L, DYNC2LI1, RAB3GAP1, ARID1B, FKTN, DDX3X, MRAS, HERC2, ERCC5, PPP1CB, ABL1, KIAA0586
HP:0001263	Global developmental delay	806	0.18696358153560658	1.7802597897861088	1.0752653401149139e-76	1.1061254553762119e-72	71.95619561309668	1.1061254553762119e-72	ALS2, GALNT2, C2CD3, KCNQ3, KIF5C, NEFL, ST3GAL5, GRIA4, B3GALNT2, PEX1, MEIS2, NDUFA13, NFIA, MCPH1, MFF, SLC25A12, SAMHD1, MTOR, NIPBL, MTR, YWHAG, TMX2, HGSNAT, IFT122, ARHGAP31, ABAT, TMEM106B, RPS19, MAPK1, ANKRD17, EXTL3, CEP295, ARL3, MARK2, RPL13, AMMECR1, USP7, HADHB, PPP2CA, FRMPD4, GALC, PCCA, MAP1B, GABRB3, ZIC1, CHST11, FRMD5, SIX3, SIL1, TRAPPC9, PPP1R21, ARID2, MT-ATP6, FTH1, SIK3, POLR3B, FNIP1, PLOD2, ZFR, PLAAT3, PEX3, HNRNPK, CEP63, NDUFV2, C2orf69, SIN3A, FUS, GCSH, KCNJ10, HDAC4, HERC1, MTHFS, SLC25A46, CTNNB1, CEP85L, BTRC, NRCAM, LAMP2, GNAO1, ACTG1, SCYL2, PIBF1, PANK2, DCC, MIA3, CDKL5, TBC1D23, GTF2E2, ALDH5A1, STAG1, CHD7, SGPL1, SOS1, NGLY1, DNAJC21, RAC1, MAX, AUTS2, RERE, OFD1, AFF4, ARF1, CHD2, EDEM3, MYO5A, PUM1, GFAP, ZBTB7A, UFSP2, PREPL, USP45, KIAA0753, JARID2, CDK5RAP2, SMARCA2, ADAR, ATP6V1B2, ARHGEF9, SMS, EDNRB, AP4S1, TBC1D24, EIF2S3, ACBD6, AUH, PRKAR1A, TUBB, NDUFS2, RLIM, NSUN6, DLD, NPHP1, CRB1, BLOC1S6, TPP2, SON, ANAPC1, TCF12, GABRG2, TTC19, TUSC3, MT-CO1, SMAD2, PHF21A, ATP1A2, PSAT1, MAP2K1, DPYD, CRPPA, TGFB2, YY1, VPS37A, STT3B, TCF4, SLC9A7, HNRNPU, SPTBN1, CLCN5, SYT14, TRRAP, NDUFB8, LIPA, RYR3, IARS2, PIGL, OXR1, NSD2, TMTC3, COG6, FBXL4, MT-ND5, SH3PXD2B, RBPJ, KIF1A, ASAH1, ADD3, FAR1, WWOX, LNPK, MT-ND4, ATRX, SLC35A3, ALG13, RAP1B, SCAF4, DHX30, PAFAH1B1, FBXO11, SUCLG1, WDR19, FRMD4A, CSNK2A1, SALL1, POGZ, PRORP, CAPRIN1, HS2ST1, LEMD3, GATAD2B, ANTXR2, MRAS, MED17, CDC73, NUS1, RPS28, ACADM, SPART, PDCD6IP, KDM1A, GLB1, KIAA0586, SATB2, ERCC8, PCLO, CUX1, MANBA, ZMIZ1, GATM, EPB41L1, PDZD8, UBA5, DYRK1A, YWHAE, WDR26, SLC35A1, HNRNPH1, PGM1, ATP6V1E1, P4HA1, OPHN1, WASHC5, SLC12A2, KCNA2, LFNG, EML1, KDM5A, HLCS, DIS3L2, PIGN, RSRC1, DMD, SOX2, SYNJ1, WAC, PPP3CA, MT-ND1, UBE3A, BCAS3, CHSY1, PCCB, PDE4D, GRIK2, SRRM2, XRCC4, CDH2, LARP7, IQSEC1, MACF1, KCNMA1, NELFA, LPIN2, SPATA7, NBEA, NDUFS1, TENT5A, AP4E1, MDH1, PSMD12, PRKACB, POLD3, FIG4, DDHD2, USP9X, RAP1GDS1, ID4, MRPL3, PURA, OGDH, TASP1, MTAP, IFT74, BTD, TSEN15, ATP11A, COX10, EED, SOX5, ARNT2, STRADA, CC2D2A, SLF2, ARFGEF2, DOCK7, SETD2, STAG2, TCTN1, IL6ST, CELF2, CRBN, CACNA1A, PRKD1, UQCRC2, DIAPH1, MED27, MT-CO2, OPA1, TBC1D32, SCN8A, ABCC9, LIFR, SUGCT, NUP133, APTX, ADAMTS17, ATP6V1A, ALG14, FAM149B1, SLC25A36, SPTLC1, CERT1, CRTAP, CD109, EXT1, NUBPL, CDH11, SMARCE1, CLCN3, MCCC1, FARSB, EIF4A2, SDCCAG8, TPK1, NSRP1, SMAD4, TAF1, AGPS, EYA1, TUBB2B, ARL13B, SHOC2, NT5C2, INTU, NHLRC2, ANKRD11, GNPTAB, LRPPRC, VPS35L, KCNB1, TRAPPC6B, RDH11, HNRNPC, SPECC1L, INVS, CDC42, ZMYND11, ARSB, NLGN1, MAP3K7, TIAM1, KRAS, ASCC1, THUMPD1, GRIA2, RAD21, FLCN, ZNF148, B4GAT1, CREBBP, AGTPBP1, LMBRD2, CEP57, ZNF407, GMNN, FMN2, FGFR3, FARS2, ADGRG1, PACS1, SNRPN, MAP3K20, APP, DDRGK1, RORB, HSD17B4, TRIM8, MESD, SLC10A7, LCA5, TAB2, KIDINS220, TBCD, SLITRK2, NSD1, SLC1A4, GLUD1, SCN2A, GNB1, CNOT1, NTRK2, ZC4H2, HECTD4, ARID1B, CLTC, FN1, WDPCP, DDX3X, FKTN, PGK1, ANO5, FASTKD2, GABRA2, CYFIP2, CDC42BPB, RPS6KA3, MYORG, SYT1, TRIP11, LMBR1, NSUN3, SEL1L, HNRNPR, DOCK3, ATP6V0C, ATP1A1, COL11A1, ATP6AP2, MED23, COG3, NDUFC2, PIGF, CHN1, ALMS1, KMT2A, LRP4, EXT2, ASXL1, GNAI1, BBS1, IFT80, GLIS3, LARGE1, NDUFAF6, CNNM2, PMP22, STAT5B, PLCH1, PI4KA, TLK2, NDUFAF2, EXOSC3, KCNN2, FOXG1, CARS2, OTUD7A, ACOX1, IDS, KMT2E, NALCN, FMR1, RAF1, TBL1XR1, SUCLA2, ADARB1, OGT, CAMK2G, TPR, RNASEH2B, NEK9, PARN, ORC4, QDPR, MAPK8IP3, DLG5, ZMYM2, ZFX, PDE3A, ALG9, ANKH, NDUFS4, ADNP, MAPRE2, MECP2, PAK2, CDK19, ZBTB20, NOTCH2, PTEN, TUBA1A, RORA, GRIN2B, EEFSEC, SEMA3A, TENM3, SUPT16H, SMC3, MT-CO3, GPC4, BRD4, RRAS2, ATP2B1, MLYCD, DYNC1I2, SLC1A2, TTC8, ATP6V0A1, LINGO1, YME1L1, KIF2A, VPS45, PIK3C2A, PLP1, KMT5B, ROBO1, KANSL1, CBFB, AASS, PTPN11, SLC30A9, TBCK, MFSD8, PTS, KAT6A, RIC1, FBN1, ANK3, CEP290, DYNC2H1, ARID1A, EIF2AK2, PAX6, ZNF292, TRIP12, TRIT1, SNX14, TNRC6B, RAB3GAP2, KMT2C, HIBCH, TRAPPC11, TNR, CACNA1B, ASH1L, CHD4, RSPRY1, SOS2, CBL, ABCB7, ASPH, PEX2, RPGRIP1L, TECPR2, ERCC6, EXOC6B, NEK1, EHMT1, DIP2B, NADK2, TRAK1, DDX6, CACNA2D1, RIPOR2, ARL6, PTCH1, COPB2, TIMMDC1, MIPEP, PPM1B, FBXW4, JAM2, FBXW7, TAOK1, GJA1, PMPCB, SUZ12, PDHX, TBK1, PIGC, ALDH7A1, NAPB, TAPT1, UBA2, STAT3, IPO8, KCNN3, SUMF1, TOGARAM1, SLC13A5, EFL1, GRIA3, BRAF, AGO1, ZSWIM6, DYNC2LI1, NARS2, RAB3GAP1, ANKLE2, TMEM67, STIM1, PPP1CB, KCNQ5, HERC2, ERCC5, DNM1L, KIF5B, CWC27, GLS, NDST1, NDUFA10, BBS9, PGAP1, PEX14, MID1, ACTB, SMARCC2, SLC6A1, CRLS1, CSGALNACT1, GCLC, RREB1, ARMC9, TTC21B, CPLANE1, PAPPA2, GRM7, VAMP2, PGM3, XPR1, RALA, NPHP3, WDR37, PAK1, ZBTB16, GLI2, SPRED2, SPARC, GPX4, AP1G1, UBAP2L, MKRN3, STXBP1, INTS8, HADHA, KDM6A, MTSS2, PPP2R1A, HIVEP2, RAB18, NIN, EFEMP1, DICER1, WASHC4, IREB2, RHOA, MED13, PHC1, EPG5, BPTF, TMEM165, TAMM41, AQP4, CACNA1C, GNAS, HSPA9, ALDH6A1, PSAP, HACE1, NAA15, MBD5, FGF12, MCCC2, SLC35D1, FRYL, CAMTA1, NF1, GABRB1, FANCL, ATAD1, WDR11, DMXL2, HSPD1, NUP214, BMPR1B, RUBCN, DPH5, CAMKMT, TRAPPC10, LUZP1, FOXP1, ATG5, PIGK, MYSM1, GLI3, ZNF423, SLC17A5, SLC20A2, SNAP25, NAT8L, IGF1R, EP300, JMJD1C, SLC12A6, PDGFRB, SRPX2, PPP1R12A, FAT4, VPS41, SPRED1, TKT, AP2M1, CHD1, LAMA1, ATP5F1A, UBE3C, SLC25A26, SOBP, MICU1, ASCC3, PHIP, NSMCE2, ACACA, DYM, PCYT1A, NR2F1, DHX9, LMBRD1, CNTNAP2, ASXL2, DAG1, MT-ND3, GNAI3, FBXL3, MPC1, ITPR1, RNPC3, TAF2, CSPP1, ITCH, NPC1, MT-ND2, CNKSR2, SRP54, KAT6B, VPS13B, OSTM1, POR, DSE, AKT3, BRCC3, CRIPT, DHFR, PIK3CA, AHI1, WDR35, DENND5A, MMUT, NEMF, SETD5, CLCN4, SDHC, VPS53, UBE4B, TRPM3, CLCN6, ATR, DYNC1H1, RIMS2, CDK13, ARFGEF1, BBS2, DNM1, IFT43, IFT81, SPG11, GPC6, SLC4A10, CHD8, NBAS, NPM1, SLC25A13, ERI1, ACADSB, USF3, JAM3, KDM5B, TRIM37, SOX6, FRRS1L, HUWE1, SPEN, ATXN7, IQCB1, CASK, PBX1, ELP2, HTT, TRIO, MED13L, SOX9, B3GLCT, HDAC8, ABL1, PIK3R1, GRID2, NEDD4L, POLA1, TRPS1
HP:0002119	Ventriculomegaly	246	0.05706332637439109	1.7753417975935935	2.3627014116255236e-22	5.171299876891864e-20	19.286400277330767	2.430510942139176e-18	ERCC8, CYFIP2, ZMIZ1, MID1, RPS6KA3, ACTB, DYRK1A, THOC2, YWHAE, B3GALNT2, CSGALNACT1, WDR26, ARMC9, P4HA1, OPHN1, ATP1A1, WASHC5, NFIA, MCPH1, CUL4B, SAMHD1, MTOR, EML1, NIPBL, SPARC, ARHGAP31, TMX2, PIGN, MKRN3, TRPS1, WAC, ASXL1, IFT80, RPGR, LARGE1, KDM6A, EXTL3, PPP2R1A, RAB18, GRIK2, XRCC4, PLCH1, USP7, PI4KA, PPP2CA, PHC1, TENT5A, AP4E1, TBL1XR1, SUCLA2, PSAP, PPP1R21, GLB1, FIG4, RNASEH2B, RTTN, USP9X, MT-ATP6, DNAH9, PARN, PLOD2, OGDH, FANCL, TSEN15, ATP11A, PRNP, HNRNPK, CCDC88A, CEP63, SIN3A, TRAPPC10, STRADA, CC2D2A, LUZP1, TMCO1, HDAC4, HERC1, SETD2, GLI3, CTNNB1, CELF2, ADNP, MAPRE2, NRCAM, DIAPH1, ZBTB20, GNAO1, ACTG1, COX16, TUBA1A, SLC12A6, LIFR, BICD2, FAT4, SMC3, MIA3, TBC1D2B, ATP6V1A, GTF2E2, SLC9A6, BRD4, NFIB, RRAS2, NGLY1, CRTAP, EXT1, RAC1, MAX, CFAP221, YME1L1, RERE, OFD1, KMT5B, KANK1, HEPACAM, DHX9, ROBO1, GPSM2, KANSL1, ASXL2, DAG1, TBCK, EIF4A2, ITPR1, KIAA0753, CSPP1, CDK5RAP2, FBN1, ADAR, TAF1, SPAG1, ZNF462, MPDZ, DYNC2H1, RNF213, PAX6, OSTM1, TUBB2B, DSE, TBC1D24, AKT3, ZNF292, EIF2S3, ACBD6, DNAAF4, INTU, NDUFS2, NHLRC2, ANKRD11, PIK3CA, DENND5A, WDR35, VPS35L, TRAPPC6B, SON, RAB3GAP2, CLCN4, KMT2C, VPS53, UBE4B, CDC42, TRPM3, HIBCH, RSPH3, CHD4, GOSR2, KRAS, HYDIN, DNM1, IFT43, ERCC6, PSAT1, PHACTR1, WASF1, EHMT1, CRPPA, RAD21, YY1, CHD8, B4GAT1, KPNA3, ZNF148, TCF4, VPS37A, NADK2, NBAS, ANTXR1, HNRNPU, SPTBN1, TRRAP, COPB2, JAM3, ZEB2, MEF2C, TIMMDC1, PTCH1, CEP57, TRIM37, NSD2, TMTC3, FBXL4, COG6, HUWE1, TRAPPC12, SPEN, PDHX, FGFR3, FARS2, SNRPN, ADGRG1, TBK1, ALDH7A1, SEC31A, HSD17B4, TAPT1, TTC12, DHX30, HTT, MESD, RAP1B, SLC10A7, PAFAH1B1, KIDINS220, TBCD, SOX9, SLITRK2, SUMF1, NSD1, B3GLCT, TUBB2A, ZC4H2, HDAC8, GRIA3, ANKLE2, POGZ, ZSWIM6, SIN3B, ARID1B, FKTN, DDX3X, HERC2, ERCC5, KIF5B, PDCD6IP, NDST1, KIAA0586
HP:0000639	Nystagmus	370	0.08582695430294596	1.7747911152846134	1.867137689280527e-33	1.200452838101799e-30	29.920654897293318	1.9207245409628783e-29	ALS2, GALNT2, NEFL, GRIA4, PEX1, TTBK2, WFS1, SAMHD1, NIPBL, TUBB4A, MTR, YWHAG, HGSNAT, IFT122, ATXN2, TMEM106B, EXTL3, MYO9A, ARL3, CHD6, IDH3A, USP7, FRMPD4, GALC, FRMD5, SIL1, TTLL5, MT-ATP6, ABHD12, PEX3, USP8, NDUFV2, SIN3A, FUS, SETX, SLC25A46, CTNNB1, HTRA1, PIBF1, DCC, GTF2E2, CHD7, SOS1, PLD3, RERE, OFD1, MYO5A, GFAP, KIAA0753, USP45, ADAR, EDNRB, SPAST, TBC1D24, EIF2S3, ACBD6, NDUFS2, NPHP1, CRB1, BLOC1S6, SON, GABRG2, HPS5, TTC19, PHF21A, ATP1A2, MAP2K1, DPYD, ANTXR1, SYT14, TPP1, IARS2, PIGL, OXR1, CEP78, NSD2, FBXL4, MT-ND5, KIF1A, ASAH1, ADD3, WWOX, MT-ND4, SLC1A3, ALG13, RAP1B, WDR19, AFG3L2, POGZ, SALL2, YARS2, MRAS, NUS1, SPART, KIAA0586, ERCC8, UBA5, THOC2, SLC35A1, APC, HNRNPH1, ATP6V1E1, OPHN1, KCNA2, PNPT1, SOX2, PIGN, SYNJ1, PPP3CA, MT-ND1, KIZ, UBE3A, BCAS3, SACS, XRCC4, KCNMA1, NELFA, ATXN10, SPATA7, NDUFS1, AP4E1, ANO10, PSMD12, GFM1, PURA, CACNA1E, IFT74, PTCD3, COX10, PRNP, AGK, ARNT2, CC2D2A, TCTN1, CELF2, CACNA1A, PRKD1, OPA1, SCN8A, ABCC9, KLHL7, APTX, ATP6V1A, FAM149B1, BBS5, SPTLC1, NUBPL, CLCN3, KANK1, SDCCAG8, TPK1, TAF1, SERPINI1, ARL13B, NT5C2, RASA2, ANKRD11, LRPPRC, KCNB1, ATF6, RAB28, KRAS, RAD21, SYNE1, CREBBP, AGTPBP1, LMBRD2, WDR48, RFC1, CYP7B1, RNF216, ADGRG1, PACS1, SNRPN, HSD17B4, GAN, FOCAD, LCA5, KIDINS220, TBCD, TRIM44, NSD1, ELOVL5, SCN2A, ADAM9, GNB1, NTRK2, ARID1B, CLTC, WDPCP, REPS1, FASTKD2, GABRA2, CYFIP2, SYT1, GABBR1, NSUN3, HNRNPR, COL11A1, COG3, CHKA, CHN1, ALMS1, LRP4, EXT2, BBS1, PMP22, MAK, PI4KA, NDUFAF2, EXOSC3, FOXG1, ACOX1, NALCN, FMR1, RAF1, RFX7, OGT, RNASEH2B, HS6ST1, ANOS1, MAPK8IP3, BBS4, IFT88, ZFX, ANKH, NDUFS4, YAP1, PAK2, CDK19, TUBA1A, RORA, SREBF1, EEFSEC, SEMA3A, SMC3, SLC9A6, BRD4, RRAS2, SLC1A2, TTC8, UGP2, KIF2A, PLP1, ROBO1, SLC33A1, PTPN11, TBCK, FBN1, CEP290, SPTAN1, PAX6, SCAPER, ZNF292, SNX14, HIBCH, CACNA1B, GOSR2, SOS2, CBL, ABCB7, PEX2, RPGRIP1L, ERCC6, NADK2, TRAK1, CACNA2D1, RIPOR2, ARL6, TIMMDC1, JAM2, TAOK1, GJA1, STX16, IPO8, TOGARAM1, SLC13A5, BRAF, TMEM67, NARS2, ATM, PPP1CB, ERCC5, DNM1L, IFRD1, NDST1, SCLT1, BBS9, PGAP1, PEX14, EYS, CRLS1, CLN5, ARMC9, CPLANE1, CACNB4, SPRED2, TSPAN7, UBAP2L, POC1B, RPGR, KDM6A, MTSS2, WNK3, RAB18, RHOA, EPG5, ATXN1, GNAS, TTPA, FGF12, ADGRV1, CAMTA1, FANCL, HSPD1, WDR11, DTNBP1, RUBCN, PRPF3, BBS7, LUZP1, FOXP1, LYST, ZNF423, SLC17A5, SNAP25, EP300, SLC12A6, SRPX2, VPS41, LAMA1, ATP5F1A, PHIP, PCYT1A, NR2F1, CNTNAP2, MT-ND3, ITPR1, TAF2, CSPP1, MT-ND2, CNKSR2, VPS13B, OSTM1, LRMDA, CRIPT, AHI1, WDR35, ACO2, UBE4B, CLCN6, RIMS2, BBS2, DNM1, IFT43, SPG11, FRRS1L, HUWE1, SPEN, ATXN7, IQCB1, DAB1, CASK, PBX1, MERTK, AP3B1, B3GLCT, HDAC8, GRID2, UNC80
HP:0000504	Abnormality of vision	65	0.01507770818835537	1.7745170162706698	8.218764961573302e-07	2.493995137454412e-05	4.603104397601172	0.008454643515970455	CYFIP2, UBA5, YY1, TRAK1, RERE, DYRK1A, CACNA2D1, FGF12, KCNA2, CEP57, LRP1, FANCL, GJA1, PRNP, CNKSR2, MAP2K1, PSEN1, GNAQ, YWHAG, SPEN, EDNRB, SNRPN, PAX6, TUBB2B, LUZP1, APP, SYNJ1, WAC, CELF2, PPP3CA, CACNA1A, WWOX, CDK19, CA8, SCN8A, JAK2, KCNB1, LIFR, B3GLCT, SLC13A5, UBE4B, GABRG2, NTRK2, SALL1, BRAF, CTNND1, TRAF3IP2, STOX1, ATP6V1A, CACNA1B, CLTC, DDX3X, ARID1B, KRAS, DNM1, ATP1A2, CHD7, SORL1, FOXG1, NUS1, MITF, SLC1A2, GABRA2, DPYD, SATB2
HP:0001251	Ataxia	335	0.07770818835536998	1.768483809245525	5.486849807826792e-30	2.2577289589245686e-27	26.64632819647164	5.64432239731142e-26	ALS2, NEFL, PEX1, EPM2A, WFS1, TUBB4A, YWHAG, ATXN2, MYO9A, ARL3, FRMPD4, GALC, GABRB3, FRMD5, SIL1, MT-ATP6, FTH1, ABHD12, POLR3B, PEX3, NDUFV2, FUS, SETX, KCNJ10, SLC25A46, NRCAM, HTRA1, PIBF1, PANK2, DCC, TBC1D23, ALDH5A1, CHD7, SGPL1, OFD1, CHD2, MYO5A, UBAC2, GFAP, PUM1, KIAA0753, ADAR, SOD1, EDNRB, SPAST, TBC1D24, ACBD6, AUH, NDUFS2, TUBB, DLD, NPHP1, MRE11, GABRG2, TTC19, MT-CO1, MT-ND4L, LRP12, ATP1A2, MAP2K1, TCF4, BSCL2, SPTBN1, SYT14, XPA, TPP1, IARS2, PIGL, OXR1, FTL, CEP78, NSD2, FBXL4, MT-ND5, KIF1A, WWOX, MT-ND4, SLC1A3, DHX30, PAFAH1B1, WDR19, FRMD4A, CSNK2A1, AFG3L2, CAPRIN1, NUS1, ACADM, PDCD6IP, KIAA0586, ERCC8, GLB1, UBA5, DYRK1A, YWHAE, SLC35A1, HNRNPH1, OPHN1, KCNA2, PNPT1, KDM5A, HLCS, SYNJ1, PPP3CA, MT-ND1, UBE3A, SACS, GRIK2, XRCC4, KCNMA1, NELFA, NDUFS1, GTF2I, PURA, OGDH, IFT74, BTD, COX10, PRNP, CC2D2A, TCTN1, CELF2, CACNA1A, MT-CO2, OPA1, SCN8A, APTX, ATP6V1A, FAM149B1, BBS5, SPTLC1, SLC13A3, NUBPL, SMARCE1, GBE1, SDCCAG8, TPK1, SMAD4, TAF1, TUBB2B, ARL13B, LRPPRC, KCNB1, CDC42, INVS, SORL1, XPC, SYNE1, AGTPBP1, NUP54, RFC1, RNF216, SNRPN, APP, HSD17B4, TRIM8, TBCD, ELOVL5, SCN2A, NTRK2, PPP2R2B, CLTC, WDPCP, PGK1, REPS1, FASTKD2, GABRA2, CYFIP2, MYORG, SYT1, SEL1L, ALMS1, RAD50, BBS1, NDUFAF6, ATG7, PI4KA, NDUFAF2, KCNN2, EXOSC3, FOXG1, NALCN, FMR1, ELP1, SUCLA2, HS6ST1, PARN, ANOS1, ATXN3, MAPK8IP3, BBS4, NDUFS4, CDK19, MECP2, ZBTB20, PTEN, TUBA1A, RORA, ITM2B, SEMA3A, MT-CO3, SLC9A6, SLC1A2, SCARB2, TTC8, ATP6V0A1, YME1L1, ERAP1, PLP1, MFSD8, PTS, COX20, CEP290, SPTAN1, PAX6, SCAPER, IFNGR1, SNX14, HIBCH, TRAPPC11, CACNA1B, GOSR2, KIF1B, ABCB7, PEX2, MLC1, RPGRIP1L, ERCC6, PRRT2, NADK2, TRAK1, TK2, CACNA2D1, ARL6, TIMMDC1, GPHN, FBXW7, GJA1, PMPCB, PDHX, STAT3, VPS13D, SUMF1, TOGARAM1, SLC13A5, BRAF, TMEM67, ZSWIM6, ATM, ERCC5, DNM1L, NDST1, SCLT1, BBS9, PEX14, MT-CYB, SLC6A1, GCLC, CLN5, ARMC9, CPLANE1, PGM3, NPHP3, CACNB4, AMFR, STXBP1, GLRB, CA8, HIVEP2, TTPA, PSAP, HACE1, MBD5, FGF12, ADGRV1, CAMTA1, ATAD1, CTSD, WDR11, DMXL2, NUP214, RUBCN, TLR4, BBS7, TDP2, LYST, ATG5, PIGK, ZNF423, SLC17A5, SNAP25, BAZ1B, SPIDR, FAT4, ABCA5, VPS41, AP2M1, LAMA1, ATP5F1A, UBE3C, MICU1, GPI, HEPACAM, DHX9, CNTNAP2, MT-ND3, ITPR1, CSPP1, NPC1, MT-ND2, CNKSR2, RYR1, DHFR, PIK3CA, AHI1, NEMF, SETD5, SDHC, ACO2, RIMS2, BBS2, DNM1, SPG11, SLC4A10, USF3, PSEN1, SPEN, ATXN7, IQCB1, DAB1, HTT, UCHL1, MED13L, GRID2, NEDD4L, GABRB1
HP:0008736	Hypoplasia of penis	77	0.017861285084667132	1.7601484574344701	1.19376468224859e-07	4.2639782244066825e-06	5.370185021862386	0.0012280257286291245	BBS9, YWHAE, B3GALNT2, WASHC5, CUL4B, GLI2, NIPBL, DIS3L2, SOX2, BBS1, IFT80, LARGE1, KDM6A, RAB18, XRCC4, TSPYL1, SIX3, GTF2I, MBD5, ZFPM2, HS6ST1, IFT74, ORC4, ANOS1, WDR11, BBS4, ARNT2, BBS7, LUZP1, DISP1, BAZ1B, SEMA3A, DCC, SMC3, GPC4, BRD4, CHD7, GRIP1, BBS5, TTC8, RERE, ROBO1, DAG1, SDCCAG8, CEP290, UBR1, DYNC2H1, SCAPER, EIF2S3, WDR35, PRRX1, VPS35L, NPHP1, RAB3GAP2, UBE4B, BBS2, EHMT1, CRPPA, RAD21, B4GAT1, SMCHD1, ARL6, PTCH1, GMNN, SUZ12, SPEN, WWOX, ATRX, PAFAH1B1, SOX9, NSD1, SALL1, HDAC8, RAB3GAP1, FKTN, WDPCP, SCLT1
HP:0000135	Hypogonadism	61	0.014149849222918117	1.7556041843085637	3.0014919020098493e-06	8.576763109993144e-05	4.066676584960655	0.03087634719597532	TGFB2, BBS9, ERCC8, RERE, SIL1, SMCHD1, PEX1, ANTXR1, MT-ATP6, XPA, ARL6, PTPN11, PPM1B, SDCCAG8, WFS1, CUL4B, PREPL, IFT74, SLC30A7, FANCL, GLI2, SMAD4, CNBP, BBS4, RNF216, CEP290, MDM2, SPEN, BBS7, CAMKMT, LUZP1, SCAPER, CTNNB1, BBS1, PRKAR1A, ATRX, ZBTB20, OPA1, NPHP1, SEMA3A, PDE4D, ANAPC1, UBE4B, HDAC8, BRAF, WDPCP, USP7, WRN, ATP5F1A, ERCC5, BBS2, DNM1L, SGPL1, BBS5, XPC, ERCC6, MAP2K1, FMR1, GNAS, TTC8, SCLT1
