GO_ID	Name	Gene Count	Gene Ratio	Fold Enrichment	p-value	FDR	-log10 FDR	FWER	Associated Genes
HP:0012391	Hyporeflexia of upper limbs	9	0.0020876826722338203	4.777545813036419	7.661016684968405e-07	2.359708213431065e-05	4.6271416958143154	0.007880887863826997	ATP6AP2, ST3GAL5, GDAP1, RUBCN, SPTAN1, ACOX1, RYR1, PMP22, HSPB1
HP:0004309	Ventricular preexcitation	11	0.002551612154952447	4.042538764876969	1.7060843766470234e-06	4.985934654138616e-05	4.302253417676004	0.01755048998256793	MT-CYB, MT-CO3, NDUFS2, MT-ND4, MT-ND1, MT-CO1, MT-ND2, MT-ND5, MT-ND4L, MT-ATP6, PRKAG2
HP:0000576	Centrocecal scotoma	11	0.002551612154952447	4.042538764876969	1.7060843766470234e-06	4.985934654138616e-05	4.302253417676004	0.01755048998256793	MT-CYB, MT-CO3, NDUFS2, MT-ND4, MT-ND1, MT-CO1, MT-ND2, OPA1, MT-ND5, MT-ND4L, MT-ATP6
HP:0012209	Juvenile myelomonocytic leukemia	14	0.003247506379030387	3.715868965694992	3.9242264214109225e-07	1.2897289839314428e-05	4.889501540203612	0.004036851719705416	RAF1, BRAF, NF1, RASA2, SPRED2, KRAS, CBL, SOS2, MRAS, RRAS2, SOS1, PTPN11, MAP2K1, ARHGAP26
HP:0040082	Happy demeanor	16	0.003711435861749014	3.6400349051706047	9.072130769803107e-08	3.344982409640307e-06	5.475606161727619	0.0009332500922896457	ZSWIM6, TASP1, ASXL1, ADNP, UBE3A, SLC9A6, TCF4, TBC1D23, DYRK1A, WDR26, HNRNPC, SNRPN, HDAC8, GRIK2, ZEB2, SATB2
HP:0200125	Mitochondrial respiratory chain defects	14	0.003247506379030387	3.52029691486894	1.2018892428922664e-06	3.583720185980506e-05	4.445665907053623	0.012363834641632744	PREPL, PNPT1, MT-CYB, MT-CO3, NDUFS2, MT-ND4, MT-ND1, MT-CO1, MT-ND2, MT-ND5, MT-ND4L, CAMKMT, MT-ATP6, PPM1B
HP:0007183	Focal T2 hyperintense basal ganglia lesion	15	0.003479471120389701	3.412532723597442	9.377693162820292e-07	2.8207113908167352e-05	4.549641347658115	0.009646832956593234	NDUFS1, SPG11, NDUFS4, MT-ND1, MT-ND4, MT-ND2, PRNP, LRPPRC, MT-ND5, SUCLG1, MT-ATP6, MT-ND3, GFAP, PDSS2, IARS2
HP:0002236	Frontal upsweep of hair	19	0.004407330085826954	3.36197668324785	4.595860589204213e-08	1.7445615454296582e-06	5.758313704708845	0.0004727761788114374	YY1, TCF4, OGT, CREBBP, CAMTA1, UBR1, UBAP2L, MKRN3, FOXP1, HDAC4, MED27, FBXO11, TRIO, EP300, MED13L, HERC2, BRD4, FRMPD4, POLA1
HP:0002310	Orofacial dyskinesia	18	0.0041753653444676405	3.071279451237697	8.454886113290666e-07	2.5581003955123844e-05	4.592082415150001	0.008697541344742108	PDE10A, FTL, PRRT2, PNPT1, JAM2, IREB2, PLP1, GNAO1, PRKRA, LRPPRC, SLC35A1, CACNA2D1, PANK2, ATXN7, MRE11, MICU1, VPS13A, FGF14
HP:0007270	Atypical absence seizure	23	0.005335189051264208	3.052320936106601	2.933408730140877e-08	1.1606144464215078e-06	5.935312027979573	0.00030175975606959205	GABRB3, CHD2, HNRNPU, EPM2A, ZEB2, EIF4A2, MAPK10, CACNB4, FRRS1L, CEP85L, PPP3CA, CACNA1A, UBE3A, TRIM8, PAFAH1B1, KCNB1, SCN2A, SRPX2, GABRG2, AP2M1, DNM1, KCNMA1, OTUD7A
HP:0000391	Thickened helices	30	0.006958942240779402	2.9250280487978073	1.029811555582007e-09	5.1177156870879736e-08	7.29092384485731	1.0593671472272106e-05	RAF1, AFF4, TCF4, DYRK1A, EDEM3, PTPN11, PIGL, RB1, SPRED2, FBN1, TAF1, DIS3L2, SIN3A, SMS, ZFX, RASA2, PBX1, CDH2, MARK2, BRAF, SUPT16H, DDX3X, KRAS, MRAS, SOS2, CBL, PPP1CB, RRAS2, SOS1, MAP2K1
HP:0010747	Medial flaring of the eyebrow	22	0.005103224309904894	2.9196113301889226	1.8654264592780306e-07	6.482987157632804e-06	5.188224838704783	0.0019189641986593101	BBS9, ARL6, SDCCAG8, IFT74, CEP290, BBS4, UBAP2L, SIN3A, BBS7, SCAPER, BBS1, PRKD1, NRCAM, NPHP1, APTX, WDPCP, FRA10AC1, BBS2, ABL1, BBS5, TTC8, SCLT1
HP:0000090	Nephronophthisis	22	0.005103224309904894	2.840702915859492	3.6901570060686064e-07	1.216687343635505e-05	4.914821009591546	0.0037960645121427753	CEP83, TRIP11, TTC21B, SDCCAG8, NPHP3, KIAA0753, CEP290, DYNC2H1, IQCB1, ZNF423, IFT80, AHI1, FAN1, XPNPEP3, NPHP1, WDR19, INVS, MAPKBP1, TMEM67, DYNC2LI1, RPGRIP1L, IFT43
HP:0000640	Gaze-evoked nystagmus	24	0.0055671537926235215	2.7966121832408306	1.6426389726444325e-07	5.728076986980772e-06	5.241991153619852	0.0016897827111593277	SPG11, UBAP1, POLR3B, ITPR1, FGF14, CACNB4, ATXN3, RFC1, ATXN2, SETX, TMEM106B, CACNA1A, WWOX, SLC1A3, UCHL1, SCN8A, GDAP2, VPS13D, MRE11, AFG3L2, APTX, GRID2, ATXN1, ATXN10
HP:0002539	Cortical dysplasia	26	0.006031083275342148	2.7603598030877086	7.254201016420934e-08	2.7235024035008084e-06	5.564872237124215	0.0007462396585592215	KIF5C, YY1, VPS37A, B4GAT1, KIF2A, PRRT2, FIG4, RTTN, FRYL, ADGRV1, SLC12A2, CUL4B, MTOR, TSC1, ARHGAP31, SIN3A, ADGRG1, TUBB2B, HSD17B4, TUBB, SCN2A, TUBB2A, GABRG2, DDX3X, NEDD4L, ATP6V0A1
HP:0000011	Neurogenic bladder	38	0.008814660171653908	2.7507081953846044	8.340544595692221e-11	4.959490303808433e-09	8.304562954481124	8.579918225588587e-07	ERCC8, BBS9, PLP1, GBE1, ARL6, TBCK, SDCCAG8, WFS1, COG7, IFT74, PEX3, ATXN3, GJA1, CEP290, BBS4, TRAPPC12, ARNT2, BBS7, FARS2, COG5, SCAPER, CEP85L, BBS1, TBCD, NPHP1, ACER3, GNB1, FBXO7, CLCN6, SNCA, WDPCP, MAP3K7, MACF1, BBS2, BBS5, ERCC6, TTC8, SCLT1
HP:0000078	Abnormality of the genital system	20	0.004639294827186268	2.730026178877954	2.99529234949069e-06	8.576763109993144e-05	4.066676584960655	0.030812572399210727	RAF1, EHMT1, STT3B, PTPN11, ZEB2, ETFA, NSD2, SPRED2, SOX5, RASA2, KMT2C, BRAF, KRAS, MRAS, SOS2, CBL, ETFDH, RRAS2, NELFA, SOS1
HP:0012447	Abnormal myelination	39	0.009046624913013222	2.700351981281454	1.0189858113689094e-10	5.955856273609074e-09	8.225055791163587	1.0482307041551972e-06	ERCC8, CYFIP2, C2CD3, PGAP1, TRAK1, UBA5, PLP1, CACNA2D1, FGF12, KCNA2, ZFR, CNKSR2, YWHAG, OSTM1, SLC30A10, SYNJ1, GABRA2, CELF2, PPP3CA, CACNA1A, WWOX, CDK19, TFG, SCN8A, KCNB1, RAB3GAP2, SLC13A5, GABRG2, NTRK2, CLTC, ATP6V1A, CACNA1B, DNM1, FOXG1, NUS1, SLC1A2, ERCC6, NGLY1, ATP1A2
HP:0002263	Exaggerated cupid's bow	23	0.005335189051264208	2.680086675605796	8.492125583739782e-07	2.561832723751646e-05	4.5914492311578154	0.008735849587993113	CLCN3, ZMIZ1, CHD8, HNRNPU, TBCK, RALA, JARID2, SMARCA2, HNRNPK, ZNF462, KMT2A, CACNA1A, TRIP12, SLC1A3, MED27, NRCAM, B3GLCT, SCN2A, EXOC2, POGZ, SUPT16H, GPC4, ATP1A2
HP:0032792	Tonic seizure	46	0.010670378102528416	2.6477964746948826	5.599861220794465e-12	4.0567445336839906e-10	9.391822340361893	5.760577237831267e-08	CLCN3, TBL1XR1, ST3GAL3, PSAP, CHD2, FGF12, CNTNAP2, PLCB1, HNRNPU, ATP6V0C, UFSP2, COG3, SLC25A12, DMXL2, CUL3, ARHGEF9, DOCK7, MTHFS, SYNJ1, NAPB, CEP85L, PPP3CA, CACNA1A, ADNP, LNPK, MECP2, TRIM8, DENND5A, ALG13, SCN8A, CACNA1C, SCN2A, VPS53, GRIK2, GNB1, GABRG2, ATP6V1A, CACNA1B, NSF, KCNQ5, ARFGEF1, DNM1, GLUL, GRIA2, PHACTR1, ATP6V0A1
HP:0009928	Thick nasal alae	21	0.0048712595685455815	2.6402226861517053	3.5337219577732666e-06	9.8513273115484e-05	4.006505251203292	0.036351397779613596	RAD21, SMARCE1, RPS6KA3, PIK3C2A, SMARCC2, SLC6A1, KANSL1, ANTXR1, CHD2, ARID2, NF1, SMARCA2, ARID1A, ANKRD17, ABCA5, ARID1B, ZSWIM6, AP2M1, RHOA, EXT1, TRPS1
HP:0001338	Partial agenesis of the corpus callosum	33	0.007654836464857342	2.62765019717003	7.103629632732746e-09	2.9705300012976323e-07	6.527166057045175	7.307503803192176e-05	CRPPA, CLCN3, C2CD3, MDH1, ROBO1, GPSM2, PTCH1, TBCK, KDM5B, TMEM260, GLI2, CDK5RAP2, CDC40, TRAPPC12, PDHX, OSTM1, TUBB2B, ACBD6, TUBB, LRPPRC, KIDINS220, TUBA1A, FRMD4A, NSD1, TCF12, HECTD4, SUPT16H, PLCH1, TNR, ARID1B, DDX3X, GTF2E2, FRA10AC1
HP:0002419	Molar tooth sign on MRI	22	0.005103224309904894	2.62765019717003	2.306527510498714e-06	6.683731971971907e-05	4.17498097431239	0.02372724850050027	C2CD3, OFD1, ARMC9, CPLANE1, KIAA0753, CSPP1, IFT74, CEP290, CC2D2A, ARL13B, TCTN1, ZNF423, AHI1, PIBF1, NPHP1, TOGARAM1, ARL3, EXOC2, TMEM67, FAM149B1, RPGRIP1L, KIAA0586
HP:0200134	Epileptic encephalopathy	70	0.016237531895151938	2.5924667202523204	8.012453264835e-17	9.696953733571487e-15	14.013364676505194	8.242410673535764e-13	GABRB3, CYFIP2, UBA5, MDH1, ST3GAL3, SLC6A1, CRLS1, CHD2, FGF12, HNRNPU, PLCB1, GRM7, NRXN1, HNRNPR, MEF2C, CACNA1E, KCNA2, SLC25A12, CHKA, FRRS1L, DMXL2, PMPCB, SPTAN1, GUF1, ARHGEF9, STXBP1, ALG9, DOCK7, TBC1D24, SYNJ1, NAPB, ABAT, CELF2, CASK, PPP3CA, CACNA1A, WWOX, ADAM22, TRIM8, DENND5A, TRIT1, GNAO1, SCN8A, RNF13, PAFAH1B1, KCNB1, GRIN2B, CLCN4, SCN2A, SLC13A5, GABRG2, NTRK2, CDKL5, ATP6V1A, CACNA1B, AP2M1, NSF, SLC9A6, KCNQ5, DNM1, STAG1, DNM1L, NUS1, SLC1A2, CARS2, GLS, GLUL, GABRB1, KMT2E, PHACTR1
HP:0012547	Abnormal involuntary eye movements	36	0.008350730688935281	2.567039541333001	3.467237450019992e-09	1.5643627915945463e-07	6.805662522301436	3.5667471648355655e-05	CYFIP2, UBA5, TRAK1, NADK2, CACNA2D1, FGF12, TBCK, KCNA2, CNKSR2, KIF21A, YWHAG, TUBB2B, SYNJ1, CELF2, PPP3CA, CACNA1A, WWOX, CDK19, SLC1A3, HTT, SCN8A, TUBA1A, KCNB1, SCN2A, SLC13A5, GABRG2, NTRK2, CLTC, ATP6V1A, CACNA1B, DNM1, ATP1A2, FOXG1, NUS1, SLC1A2, GABRA2
HP:0011153	Focal motor seizure	29	0.006726977499420088	2.5657190477417804	1.163650111494725e-07	4.173773373762653e-06	5.379471135815927	0.0011970468696946236	KCNQ3, PRRT2, GRM7, BTD, MTOR, FRRS1L, DMXL2, YWHAG, SMS, STXBP1, TBC1D24, AKT3, FAR1, CASK, CACNA1A, PPP3CA, SLC1A3, PIK3CA, TRIM8, SLC35A3, GNAO1, NDUFAF6, SCN8A, PAFAH1B1, SCN2A, CDKL5, ATXN10, ATP1A2, DPYD
HP:0002483	Bulbar signs	23	0.005335189051264208	2.555431481391573	2.595892137787626e-06	7.501107421747558e-05	4.124874615054943	0.02670394242142131	ALS2, SPG11, PSAP, FIG4, MT-ATP6, MT-ND3, GFAP, MT-ND2, MT-ND5, FUS, RYR1, CACNA1A, MT-ND1, MT-ND4, SLC1A3, TFG, NEB, SCN2A, VAPB, SPTLC1, NEK1, ATXN1, ATP1A2
HP:0000297	Facial hypotonia	27	0.006263048016701462	2.52928895984281	4.647517129002961e-07	1.508170621642065e-05	4.821549523289879	0.004780900870605346	AP4E1, YY1, ZMIZ1, CAMK2G, SLC30A9, PURA, VPS13B, AP4S1, STRADA, DSE, HERC1, STAG2, ASXL1, CACNA1A, SLC1A3, MECP2, PPP2R1A, SCN2A, SRRM2, GRIA3, POGZ, DYNC1H1, GPC4, NGLY1, ATP1A2, UNC80, SATB2
HP:0001273	Abnormal corpus callosum morphology	56	0.012990025516121549	2.5239864672645225	4.267893379494854e-13	3.456993637390832e-11	10.461301419777406	4.390381919486356e-09	CYFIP2, UBA5, MID1, TRAK1, SIX3, PLP1, CREBBP, CACNA2D1, FGF12, PLCB1, PTCH1, ZEB2, KCNA2, PNPT1, CSPP1, MTOR, GLI2, CNKSR2, YWHAG, ARID1A, PDHX, TUBB2B, KMT2A, TBC1D24, DISP1, SYNJ1, GLI3, ABAT, CELF2, PPP3CA, CACNA1A, WWOX, CDK19, EP300, SCN8A, PAFAH1B1, TUBA1A, KCNB1, SCN2A, SLC13A5, GABRG2, NTRK2, CLTC, ATP6V1A, CACNA1B, DDX3X, DNM1, ATP1A2, FOXG1, NUS1, GALC, SLC1A2, RPGRIP1L, GABRA2, KMT2E, KIAA0586
HP:0010844	EEG with multifocal slow activity	28	0.006495012758060774	2.5239864672645225	3.0252922224445205e-07	1.030502685175059e-05	4.986950872244602	0.0031121181092286783	CYFIP2, UBA5, TRAK1, CACNA2D1, FGF12, KCNA2, CNKSR2, YWHAG, SYNJ1, GABRA2, CELF2, PPP3CA, CACNA1A, WWOX, CDK19, SCN8A, KCNB1, SLC13A5, GABRG2, NTRK2, CLTC, ATP6V1A, CACNA1B, DNM1, FOXG1, NUS1, SLC1A2, ATP1A2
HP:0012469	Infantile spasms	82	0.0190211087914637	2.511274081211451	2.483629089459176e-18	3.6498703490380776e-16	15.437722562309933	2.5549092443266545e-14	UBA5, PLCB1, GRM7, SEL1L, ATP6V0C, STXBP1, MT-ND1, MAPK1, DEPDC5, CDH2, MACF1, PI4KA, OTUD7A, GABRB3, SUCLA2, MT-ATP6, BTD, ATAD1, TSEN15, DMXL2, GNAQ, GUF1, STRADA, GCSH, HDAC4, DOCK7, CEP85L, CDK19, MECP2, GNAO1, TUBA1A, RALGAPA1, GRIN2B, SRPX2, CDKL5, ATP6V1A, ALG14, ATP2B1, NGLY1, CNTNAP2, MT-ND3, EIF4A2, UFSP2, MT-ND2, TSC1, CDC40, SPTAN1, TUBB2B, ACBD6, KCNB1, CLCN4, VPS53, GABRG2, TRPM3, HIBCH, DNM1, ARFGEF1, GLUL, PHACTR1, PRRT2, SPTBN1, IARS2, FBXL4, CUL3, MT-ND5, ADGRG1, ASAH1, CASK, MT-ND4, ALG13, TRIM8, PAFAH1B1, RNF13, SLC1A4, SCN2A, TUBB2A, GNB1, NTRK2, CAPRIN1, KCNQ5, ERCC5, NEDD4L
HP:0009765	Low hanging columella	32	0.007422871723498028	2.5062535412650067	5.444995213919467e-08	2.0592891825584398e-06	5.686282661846876	0.0005601266576558955	CLCN3, ZMIZ1, CDC42BPB, ZNF148, KMT5B, PPP1R21, CREBBP, EDEM3, CNTNAP2, HNRNPR, PUM1, KDM5B, ZEB2, ITCH, KAT6A, GJA1, KDM3B, SMARCA2, ZFX, RYR1, SETD2, CTNNB1, TRIP12, TRIO, EP300, CEP295, TBCD, HIVEP2, LIFR, CAPRIN1, RAC1, CDH11
HP:0000455	Broad nasal tip	86	0.01994896775690095	2.5052984141532435	4.546077252062471e-19	7.542822047091393e-17	16.122466138191243	4.676549669196664e-15	CDC42BPB, RPS6KA3, ACTB, SMARCC2, DYRK1A, WDR26, APC, CPLANE1, ATP6V1E1, GLI2, NIPBL, KDM5A, KDM3B, KMT2A, WAC, EXT2, KDM6A, EXTL3, XRCC4, WASHC4, PPP2CA, TLK2, BPTF, RFX7, TBL1XR1, TPR, ARID2, PURA, HNRNPK, ZMYM2, ZFX, FOXP1, HDAC4, DOCK7, PHF8, SETD2, CTNNB1, ADNP, IGF1R, ZBTB20, TBC1D32, ABCC9, SUPT16H, SMC3, ATP6V1A, FAM149B1, PHIP, CDH11, SMARCE1, OFD1, ASXL2, KIAA0753, KAT6A, ATP6V1B2, TAF1, ARID1A, RYR1, TBC1D24, EIF2S3, PRKAR1A, SATB2, AGL, RAB3GAP2, MAP3K7, PHF21A, NEK1, DPYD, PTPRF, YY1, COG6, HUWE1, SH3PXD2B, SNRPN, CASK, FBXO11, KCNN3, NSD1, HDAC8, POGZ, ARID1B, ZSWIM6, RAB3GAP1, CAPRIN1, HS2ST1, GATAD2B, GLB1
HP:0033725	Thin corpus callosum	76	0.017629320343307817	2.4869416561011493	8.7904138576518e-17	1.0514765971356286e-14	13.978200389024225	9.042698735366407e-13	SPG11, CLCN3, ALDH6A1, SLC4A10, RERE, KIF2A, KPNA3, SMARCC2, PLP1, DYRK1A, WDR26, ROBO1, CNTNAP2, AGTPBP1, FTH1, FRYL, COPB2, POLR3B, LMBRD2, TBCK, CCDC47, ITPR1, PUM1, PIGL, ATP6AP2, MED23, COG3, EIF4A2, AMFR, TSEN15, ATP11A, GLI2, FBXL4, SMARCA2, RBL2, CHKA, KAT6B, GCSH, HDAC4, NT5C2, SLC25A46, SYNJ1, CEP85L, WWOX, NHLRC2, TUBB, MED27, BCAS3, DIAPH1, RAP1B, GNPTAB, AHI1, NRCAM, DEPDC5, SLITRK2, HIVEP2, EEFSEC, SLC1A4, GRIK2, POGZ, SUPT16H, TNR, ATP6V1A, CLTC, TIAM1, MACF1, UBE3C, PI4KA, DNM1, EXOSC3, NFIB, CARS2, OTUD7A, GLUL, ATP1A2, GLB1
HP:0007334	Bilateral tonic-clonic seizure with focal onset	28	0.006495012758060774	2.4772459771299946	5.030137572698152e-07	1.617032037823309e-05	4.791281375447935	0.005174502521034589	EHMT1, KCNQ3, PRRT2, PSAP, FIG4, CNTNAP2, PLCB1, EPM2A, TBCK, PDSS2, ATP6V0C, STXBP1, TBC1D24, CEP85L, WWOX, ADAM22, TRIM8, KDM6A, SCN8A, DEPDC5, KCNB1, SCN2A, SRPX2, LGI1, GABRG2, PPP2CA, KCNMA1, ATP1A2
HP:0002967	Cubitus valgus	29	0.006726977499420088	2.474086224608145	3.269661103145507e-07	1.0991831296750926e-05	4.958929945809671	0.003363500376805783	RAF1, SIL1, PSMD12, PRKACB, PEX1, PTPN11, LMBRD2, LARS2, CUL4B, NF1, WDR11, GJA1, SPRED2, VPS13B, POR, SHOC2, IL6ST, FBXO11, MAPK1, BRAF, DYNC2LI1, RSPRY1, KRAS, CBL, ASPH, PEX2, BPTF, SOS1, MAP2K1
HP:0100660	Dyskinesia	94	0.02180468568777546	2.4540399258219856	6.772668850371814e-20	1.2012145597202559e-17	16.920379412430563	6.967044446377484e-16	CYFIP2, PGAP1, UBA5, MYORG, SYT1, GRM7, XPR1, NDUFA13, KCNA2, VPS35, PNPT1, CHKA, YWHAG, STXBP1, SYNJ1, LRRK2, PPP3CA, MT-ND1, BCAS3, BMPR1A, IREB2, ATG7, KCNN2, FOXG1, ATXN10, GNAS, GABRB3, SIL1, PRKRA, FGF12, MT-ATP6, PURA, DMXL2, DNAJC6, KCNJ10, CELF2, NDUFS4, CACNA1A, SLC20A2, CDK19, GNAO1, SCN8A, GRIN2B, PDGFRB, PDE10A, CDKL5, ATP6V1A, SLC1A2, RPS20, SLC30A9, MT-ND3, ITPR1, MSH2, MT-ND2, CNKSR2, PRKN, PIK3CA, LRPPRC, KCNB1, GABRG2, VPS13C, SNCA, CACNA1B, KRAS, DNM1, ATP1A2, GIGYF2, PRRT2, TRAK1, CACNA2D1, PMS1, IARS2, JAM2, FTL, STX16, MT-ND5, TMEM43, NPAT, CASK, WWOX, MT-ND4, TRIM8, UCHL1, SCN2A, SLC13A5, DNAJC13, NTRK2, CLTC, ATM, DDX3X, NUS1, FASTKD2, GABRA2, UNC80
HP:0011097	Epileptic spasm	38	0.008814660171653908	2.4533343364241067	6.864502756208165e-09	2.882250606249526e-07	6.540268260794902	7.06151398531134e-05	EHMT1, TBL1XR1, ST3GAL3, SLC6A1, NCDN, CHD2, PLCB1, PURA, EIF4A2, MFF, MTOR, TSC1, SMARCA2, TRAPPC12, STXBP1, TBC1D24, AKT3, SYNJ1, ALDH7A1, CELF2, CASK, PPP3CA, WWOX, PIK3CA, SCN8A, TBCD, GRIN2B, COX4I1, SCN2A, GRIK2, CACNA1B, AP2M1, NSF, DNM1, SLC1A2, PSAT1, PHACTR1, ATP6V0A1
HP:0000752	Hyperactivity	109	0.02528415680816516	2.4448473878918757	1.1182273333526503e-22	2.5006966474345027e-20	19.601938988131838	1.1503204578198714e-18	MANBA, SMARCC2, SLC6A1, DYRK1A, GRM7, OPHN1, ATP1A1, CUL4B, MTOR, CHKA, HGSNAT, STXBP1, KMT2A, GLDC, UBE3A, PPP2R1A, HIVEP2, PDE4D, FRMPD4, AQP4, FMR1, GABRB3, TRAPPC9, MBD5, ARID2, CAMTA1, DMXL2, SIN3A, GCSH, HDAC4, STAG2, CACNA1A, ADNP, MECP2, GNAO1, EP300, PANK2, SPRED1, CDKL5, AP2M1, UBE3C, ALDH5A1, ALG14, ATP9A, DNAJC21, MICU1, RAC1, ATP6V0A1, AUTS2, CLCN3, SMARCE1, YME1L1, DYM, CHD2, KANSL1, CNTNAP2, AASS, SMAD4, ANK3, CNKSR2, TSC1, ARID1A, SHOC2, DPP6, TRIP12, DENND5A, CLCN4, ATR, ASH1L, KRAS, BBS2, DNM1, DPYD, VPS13A, FLCN, SLC4A10, CREBBP, BSCL2, SLC25A13, SPTBN1, IL1RAPL1, PTCH1, THRB, MAPK10, NSD2, CUL3, HUWE1, SNRPN, CASK, AP1G1, LNPK, ATRX, TRIM8, FBXO11, HTT, MED13L, NBN, SLITRK2, SLC1A4, SCN2A, POGZ, AGO1, ARID1B, ZSWIM6, GATAD2B, DDX3X, HERC2, PDCD6IP, SATB2
HP:0002061	Lower limb spasticity	68	0.01577360241243331	2.4426550021539586	1.1662068797777242e-14	1.1535355934878316e-12	11.93796900034803	1.199677017227345e-10	ALS2, RARS2, SPG11, ERCC8, PGAP1, PRRT2, KPNA3, ACTB, PSAP, HACE1, PLP1, UBAP1, HEPACAM, SYNE1, BSCL2, CNTNAP2, SLC33A1, MT-ATP6, NDUFA13, WASHC5, WDR48, TPK1, ZFR, HSPD1, CYP7B1, SOD1, USP8, FUS, FARS2, ADGRG1, SPAST, KIF1A, ALG9, SELENOI, NT5C2, ERCC6, ACBD6, RNF170, WWOX, MECP2, TFG, DDHD1, UCHL1, TBCD, UBE4A, SACS, RAB3GAP2, CLCN4, RAB18, SRPX2, ATL1, EEFSEC, SLC1A4, FBXO7, BICD2, MRE11, GPRC5B, VPS41, CLTC, GATAD2B, PI4KA, SPTLC1, GALC, REPS1, SPART, ATXN10, CACNA1C, SATB2
HP:0001266	Choreoathetosis	68	0.01577360241243331	2.4426550021539586	1.1662068797777242e-14	1.1535355934878316e-12	11.93796900034803	1.199677017227345e-10	DCAF17, ST3GAL5, PRRT2, NADK2, MYORG, SYT1, PLP1, MT-ATP6, GRM7, XPA, SLC30A9, NDUFA13, XPR1, NUP54, IARS2, PNPT1, FTL, JAM2, MED23, COX20, PTS, QDPR, TSEN15, TUBB4A, FBXL4, DMXL2, ADAR, HSPD1, FRRS1L, CHKA, PIGN, GUF1, SETX, EIF2AK2, STXBP1, ABAT, TMEM106B, CASK, ELP2, CACNA1A, SLC20A2, MECP2, SLC1A3, TRIM8, NDUFA9, GNAO1, MMUT, SCN8A, PANK2, SUCLG1, MRE11, PDGFRB, SCN2A, GRIK2, SLC13A5, GABRG2, TRPM3, TNR, ATM, CACNA1B, CDKL5, IREB2, ATG7, ERCC6, NGLY1, MICU1, ATP1A2, GNAS
HP:0007108	Demyelinating peripheral neuropathy	27	0.006263048016701462	2.433844093433647	1.263909661793012e-06	3.757756847070727e-05	4.4250713251912925	0.013001838690864714	ERCC8, MANBA, PLP1, RNASEH2B, MT-ATP6, MT-ND3, POLR3B, ABHD12, GDAP1, SAMHD1, PLAAT3, RFC1, DMXL2, MT-ND2, ADAR, MT-ND5, MT-ND1, MT-ND4, NRCAM, DNAJC3, SLC12A6, SACS, PMP22, ACO2, AFG3L2, ERCC5, ERCC6
HP:0010862	Delayed fine motor development	28	0.006495012758060774	2.4322051411821763	8.203809128512941e-07	2.493995137454412e-05	4.603104397601172	0.008439258450501263	AUTS2, CLCN3, FIG4, SPTBN1, TRRAP, EIF4A2, ITPR1, FNIP1, NFIA, ASCC3, TSEN15, TMTC3, CDC40, SIN3A, ZFX, POR, LNPK, SNX14, HNRNPC, TNRC6B, TRAPPC6B, WLS, POGZ, CDH2, WASHC4, PI4KA, NDST1, CDH11
HP:0010841	Multifocal epileptiform discharges	28	0.006495012758060774	2.4322051411821763	8.203809128512941e-07	2.493995137454412e-05	4.603104397601172	0.008439258450501263	ST3GAL5, CHD2, FGF12, PLCB1, SPTBN1, TBCK, ADK, SPTAN1, STXBP1, DOCK7, TBC1D24, ALDH7A1, PPP3CA, MECP2, GNAO1, LRPPRC, SCN8A, MED13L, DEPDC5, SCN2A, TUBB2A, GNB1, GABRG2, CDKL5, ARFGEF1, KCNMA1, CARS2, DPYD
HP:0025269	Panic attack	28	0.006495012758060774	2.4322051411821763	8.203809128512941e-07	2.493995137454412e-05	4.603104397601172	0.008439258450501263	SDHAF2, CREBBP, USP48, NR3C1, NF1, DNAJC6, USP8, ZNRF3, SYNJ1, PRKN, CTNNB1, LRRK2, PRKAR1A, MECP2, ATRX, EP300, UCHL1, SDHC, SPECC1L, VPS13C, BRAF, CDKL5, SNCA, SGCE, KIF1B, KCNN2, SPART, MAX
HP:0011443	Abnormality of coordination	28	0.006495012758060774	2.4322051411821763	8.203809128512941e-07	2.493995137454412e-05	4.603104397601172	0.008439258450501263	CYFIP2, UBA5, TRAK1, CACNA2D1, FGF12, KCNA2, CNKSR2, YWHAG, SYNJ1, GABRA2, CELF2, PPP3CA, CACNA1A, WWOX, CDK19, SCN8A, KCNB1, SLC13A5, GABRG2, NTRK2, CLTC, ATP6V1A, CACNA1B, DNM1, FOXG1, NUS1, SLC1A2, ATP1A2
HP:0000766	Abnormal sternum morphology	29	0.006726977499420088	2.430681203123792	5.327397811290466e-07	1.701954698284007e-05	4.769052003914835	0.005480294128474503	RAF1, TGFB2, PIK3C2A, TTC21B, PTPN11, PTCH1, RIN2, KIAA0753, SMAD4, FBN1, MYLK, DYNC2H1, SHOC2, DSE, HEY2, ASAH1, IFT80, WDR19, MAT2A, REST, SPRED1, BRAF, CDC42, DYNC2LI1, RSPRY1, SMAD2, PRKG1, SOS1, MAP2K1
HP:0009890	High anterior hairline	30	0.006958942240779402	2.429260582899874	3.4609799670841144e-07	1.1484871264965899e-05	4.939873868490573	0.0035603100921394286	CLCN3, TBL1XR1, UGP2, ADARB1, SLC9A7, PEX1, ERI1, MEIS2, JARID2, NSD2, SIN3A, SPEN, ZFX, PIGK, SETD2, STAG2, ADNP, PRKD1, ANKRD17, RALGAPA1, NSD1, FAT4, EFEMP1, ZC4H2, HS2ST1, PPP1CB, NELFA, CWC27, SOS1, KDM1A
HP:0010579	Cone-shaped epiphysis	31	0.0071909069821387145	2.427933118100475	2.249330138148296e-07	7.764717829238764e-06	5.109874321961332	0.002313885913113152	NSMCE2, ZMIZ1, OFD1, CDC42BPB, TRIP11, TTC21B, SDCCAG8, NPHP3, KIAA0753, CSPP1, SMAD4, BMPR1B, FBN1, CEP290, GPX4, DYNC2H1, FGFR3, PDE3A, IQCB1, IFT80, PRKAR1A, KIAA0586, NPHP1, WDR19, PDE4D, INVS, ATR, DYNC2LI1, RSPRY1, MAP3K7, TRPS1
HP:0000729	Autistic behavior	223	0.05172813732312689	2.4158564995626337	4.3562381853059006e-44	4.979180245804644e-41	40.30284215202511	4.48126222122418e-40	GALNT2, PDZD8, ZMIZ1, MID1, CDC42BPB, SYT1, SMARCC2, SLC6A1, DYRK1A, THOC2, WDR26, GABBR1, GRM7, MEIS2, VAMP2, OPHN1, ATP1A1, SLC12A2, WFS1, RALA, MTOR, CHKA, NIPBL, KDM5A, KDM3B, UBAP2L, RSRC1, STXBP1, ALMS1, WAC, EXT2, GNAI1, UBE3A, ANKRD17, KDM6A, MTSS2, DEPDC5, UBE4A, HIVEP2, PDE4D, GRIK2, SRRM2, CDH2, MARK2, ATG7, FRA10AC1, USP7, KCNN2, PPP2CA, TLK2, MED13, FRMPD4, CARS2, SPATA7, UPF3B, TAF1, NBEA, MAP1B, GABRB3, ZIC1, RFX7, TBL1XR1, PSMD12, NAA15, MBD5, ARID2, USP9X, ZFPM2, ADGRV1, CAMTA1, NF1, DMXL2, GNAQ, MAPK8IP3, ZMYM2, SIN3A, CC2D2A, FOXP1, GCSH, HDAC4, SLF2, SETD2, STAG2, CTNNB1, ZNF423, CELF2, CEP85L, CACNA1A, ADNP, MECP2, GNAO1, EP300, SCN8A, PTEN, RORA, SUPT16H, CDKL5, AP2M1, CHD1, TBC1D23, UBE3C, STAG1, ATP2B1, ATP9A, DNAJC21, RAC1, CDH11, ATP6V0A1, MAX, CLCN3, SMARCE1, AUTS2, RERE, KMT5B, HEPACAM, PCYT1A, NR2F1, CHD2, KANSL1, CNTNAP2, ZBTB7A, USP45, JARID2, KAT6A, ATP6V1B2, ANK3, CEP290, ZNF462, TSC1, SMARCA2, SPTAN1, ARID1A, SRP54, VPS13B, TBC1D24, ZNF292, ACBD6, TRIP12, RLIM, SETD5, SNX14, ADH5, CRB1, SON, TNRC6B, CLCN4, KMT2C, TCF12, SPECC1L, TRPM3, GABRG2, RSPRY1, NLGN1, ASH1L, TIAM1, RIMS2, DNM1, PHF21A, RPGRIP1L, GRIA2, DPYD, PHACTR1, EHMT1, YY1, PRRT2, TCF4, CREBBP, SPTBN1, NLGN4X, TRRAP, CDK8, MEF2C, MAPK10, PIGL, JAM2, SOX6, TAOK1, NSD2, FRRS1L, TMTC3, CUL3, SPEN, SNRPN, PACS1, IQCB1, COG5, AGO2, CASK, DHX30, AP1G1, UBA2, SLC35A3, TRIM8, FBXO11, TRIO, LCA5, SCAF4, MED13L, SLITRK2, TOGARAM1, NSD1, SCN2A, EFL1, SIN3B, GRIA3, AGO1, POGZ, ZSWIM6, MED12L, NTRK2, CAPRIN1, GATAD2B, DDX3X, SBF2, PRORP, ARID1B, HERC2, TANC2, NUS1, FBXW11, GABRA2, POLA1, SATB2
HP:0000319	Smooth philtrum	98	0.02273254465321271	2.4133994313276754	6.484001860100157e-20	1.170191704120181e-17	16.93174298507302	6.670092713485032e-16	ZMIZ1, MID1, CDC42BPB, SYT1, DYRK1A, MEIS2, ATP6V1E1, WDR37, MTOR, NIPBL, KDM5A, DIS3L2, PIGN, SEC23A, ANKRD17, MAPK1, KDM6A, CEP295, ACER3, SRRM2, CDH2, ATG7, FRA10AC1, MED13, FOXG1, NALCN, TBL1XR1, TRAPPC9, RTTN, TPR, RAP1GDS1, USP9X, TASP1, ORC4, SIN3A, ZFX, ALG9, STAG2, CTNNB1, ADNP, IGF1R, EP300, EXOC2, SMC3, ATP6V1A, CERT1, ATP9A, RERE, DYM, DHX9, CNTNAP2, AASS, COG7, JARID2, FBN1, SMARCA2, SMS, ZNF292, TRIP12, ANKRD11, PIK3CA, SATB2, WDR35, SETD5, HNRNPC, SON, CDC42, ASH1L, BBS2, CDK13, THUMPD1, PTPRF, RAD21, CHD8, FLCN, ZNF148, DDX6, CREBBP, HNRNPU, SPTBN1, TRRAP, KDM5B, FBXL4, PACS1, FAR1, CASK, DHX30, TRIM8, AP3B1, RAP1B, FBXO11, WDR19, SUMF1, ZC4H2, PPP1CB, ABL1, UNC80, TRPS1
HP:0005484	Secondary microcephaly	65	0.01507770818835537	2.3887729065182093	2.227749058181386e-13	1.878430701763272e-11	10.726204822105494	2.2916854561511915e-09	KIF5C, UBA5, TRAPPC9, GLS, TCF4, DYRK1A, CRLS1, CREBBP, MBD5, FGF12, HNRNPR, JAM3, ZEB2, ITPR1, NGLY1, TAF2, WDR37, MFF, SLC25A12, HSPD1, COG6, PMPCB, FTO, TRAPPC12, ARNT2, C2orf69, GCSH, SNRPN, TBC1D24, VPS50, WWOX, ADAM22, DHFR, NAT8L, TRIO, MECP2, RAP1B, UBE3A, ACTG1, PAFAH1B1, EP300, TBCD, RAB3GAP2, SLC1A4, RAB18, VPS53, PPP1R12A, EEFSEC, EXOC2, NTRK2, SMC3, CLTC, PRORP, CACNA1B, CDKL5, SLC9A6, FRA10AC1, MED17, DNM1, CERT1, ATP9A, CARS2, TMEM165, ATP1A2, PSAT1
HP:0002558	Supernumerary nipple	26	0.006031083275342148	2.3887729065182093	3.1222539664042734e-06	8.848106488264672e-05	4.053149659209875	0.03211862655240076	TCF4, ACTB, DDX6, TRRAP, ZEB2, KDM5B, PIGL, CSPP1, JARID2, HNRNPK, RNF216, ARHGAP31, TMCO1, HDAC4, ASXL1, UBA2, WDR19, TNRC6B, CDH2, ZMYND11, HS2ST1, KRAS, GPC4, STAG1, KDM1A, KIAA0586
HP:0010819	Atonic seizure	48	0.011134307585247043	2.3887729065182093	3.979562221217748e-10	2.1433380402967e-08	7.668909328044598	4.093775656966697e-06	EHMT1, GABRB3, PRRT2, ST3GAL3, RPS6KA3, SLC6A1, DYRK1A, CHD2, CNTNAP2, HNRNPU, GRM7, EPM2A, ATP6V0C, MAPK10, ADGRV1, ATP6AP2, MTOR, FRRS1L, DMXL2, SPTAN1, ADGRG1, STXBP1, DOCK7, AKT3, MTHFS, ALDH7A1, ASAH1, ACBD6, CEP85L, CASK, CACNA1A, PIK3CA, TRIM8, ALG13, GNAO1, PAFAH1B1, KCNB1, SCN2A, CSNK2A1, GRIK2, GNB1, GABRG2, CDKL5, AP2M1, GOSR2, DNM1, ARFGEF1, NGLY1
HP:0000717	Autism	133	0.03085131060078868	2.379826191512523	9.150453450824001e-26	3.0364746660847253e-23	22.517630337932	9.41307146486265e-22	BBS9, CYFIP2, UBA5, GATM, DYRK1A, RREB1, MEIS2, KCNA2, WFS1, NIPBL, MAOA, YWHAG, SOX2, MKRN3, KMT2A, SYNJ1, EXT2, PPP3CA, BBS1, UBE3A, PDE4D, DICER1, FOXG1, CACNA1C, FMR1, GTF2I, FGF12, FRYL, IFT74, BBS4, ARNT2, SIN3A, BBS7, ZFX, LUZP1, RPL17, HDAC4, DOCK7, SETD2, CELF2, CACNA1A, ADNP, CDK19, MECP2, PAK2, BAZ1B, ZBTB20, EP300, SCN8A, PTEN, JMJD1C, SMC3, SUPT16H, ATP6V1A, PTCHD1, CHD1, SLC9A6, ALDH5A1, ALG14, BRD4, NFIB, CHD7, BBS5, SLC1A2, ASCC3, TTC8, RERE, HEPACAM, REV3L, NR2F1, CNTNAP2, TBCK, EIF4A2, SDCCAG8, SMAD4, TSC1, CNKSR2, CEP290, SCAPER, ANKRD11, PIK3CA, NSUN6, SATB2, KCNB1, NPHP1, SDHC, TCF12, UBE4B, GABRG2, CACNA1B, BBS2, CDK13, ABCB7, DNM1, MLC1, ATP1A2, DPYD, EHMT1, RAD21, YY1, CHD8, TRAK1, FLCN, CREBBP, CACNA2D1, SPTBN1, IL1RAPL1, ERI1, ARL6, USF3, PIGL, TAOK1, SPEN, SNRPN, WWOX, ATRX, ALG13, MED13L, TMLHE, SCN2A, SLC13A5, GNB1, HDAC8, GRIA3, HECTD4, BRAF, NTRK2, CLTC, WDPCP, HERC2, NUS1, GABRA2, SCLT1
