HP:0000954	Single transverse palmar crease	230	0.05335189051264208	1.597144675869733	9.35945898310118e-15	9.532747976154639e-13	12.020781888569386	9.628075455916184e-11	GALNT2, MANBA, CDC42BPB, RPS6KA3, ACTB, THOC2, PEX1, APC, LMBR1, CSGALNACT1, RREB1, TRIP11, PAPPA2, CPLANE1, TTC21B, RALA, COL11A1, SLC25A12, ZBTB16, GLI2, SPRED2, LFNG, NIPBL, SPARC, GPX4, SOX2, IFT122, HGSNAT, ARHGAP31, SMARCAD1, STXBP1, KMT2A, ALMS1, TRPS1, LRP4, WAC, EXT2, PPP3CA, IFT80, MAPK1, CHSY1, KDM6A, EXTL3, DEPDC5, ARL3, PDE4D, NIN, XRCC4, STAT5B, RPL13, AMMECR1, PPP2CA, LPIN2, TMEM165, IDS, GNAS, HSPA9, MAP1B, RAF1, TENT5A, CHST11, ALDH6A1, PPP1R21, GLB1, PRKACB, FIG4, NEK9, SLC35D1, ID4, POLR3B, PLOD2, NF1, TASP1, MTAP, ORC4, BMPR1B, CEP63, ZMYM2, ZFX, FOXP1, PDE3A, CC2D2A, HDAC4, ALG9, SETD2, GLI3, ANKH, IL6ST, SLC17A5, ADNP, CDK19, BTRC, IGF1R, EP300, NOTCH2, ABCC9, LIFR, SEMA3A, BICD2, SPRED1, ADAMTS17, SMC3, ATP6V1A, STAG1, RRAS2, DNAJC21, NGLY1, CRTAP, EXT1, IFT57, SOS1, NSMCE2, SMARCE1, RERE, OFD1, DYM, PCYT1A, PTPN11, TBCK, GNAI3, RIN2, RNPC3, UFSP2, KIAA0753, JARID2, ITCH, SMAD4, FBN1, SMARCA2, CEP290, ZNF462, SRP54, UBR1, AGPS, KAT6B, VPS13B, DYNC2H1, SMS, OSTM1, POR, SHOC2, DSE, ZNF292, INTU, CRIPT, PRKAR1A, ANKRD11, SATB2, WDR35, GNPTAB, VPS35L, TCF12, CDC42, SPECC1L, ATR, ARSB, RSPRY1, MAP3K7, KRAS, SOS2, CBL, SMAD2, PEX2, RPGRIP1L, NEK1, IFT43, EXOC6B, IFT81, MAP2K1, PSAT1, EHMT1, TGFB2, RAD21, GPC6, TCF4, NBAS, CREBBP, SPTBN1, CLCN5, MEF2C, IARS2, FBXW4, CEP57, TRIM37, GMNN, NSD2, GJA1, SH3PXD2B, RBPJ, SMC5, FGFR3, PACS1, MAP3K20, DDRGK1, FAR1, TAPT1, DHX30, TRIM8, FBXO11, TRIO, MESD, STAT3, TAB2, SLC10A7, SOX9, WDR19, SUMF1, NSD1, CSNK2A1, B3GLCT, EFL1, ZC4H2, SALL1, HDAC8, BRAF, TMEM67, ZSWIM6, DYNC2LI1, FN1, ARID1B, HS2ST1, LEMD3, ANTXR2, STIM1, MRAS, PPP1CB, PIK3R1, CDC73, ANO5, KIAA0586
HP:0000193	Bifid uvula	227	0.05265599628856414	1.5878519759286487	3.4234488345802747e-14	3.172704338858314e-12	11.498570397482029	3.5217018161327285e-10	GALNT2, PGAP1, MANBA, SEPTIN9, ACTB, B3GALNT2, CSGALNACT1, LMBR1, TRIP11, RREB1, ARMC9, PAPPA2, PGM1, CPLANE1, TTC21B, RALA, COL11A1, ZBTB16, GLI2, SPRED2, LFNG, NIPBL, SPARC, GPX4, SOX2, IFT122, HGSNAT, ARHGAP31, KMT2A, ALMS1, TRPS1, LRP4, SEC23A, EXT2, IFT80, LARGE1, MAPK1, CHSY1, KDM6A, EXTL3, PDE4D, NIN, XRCC4, STAT5B, RPL13, PLCH1, AMMECR1, LPIN2, TMEM165, IDS, GNAS, HSPA9, RAF1, TENT5A, RFX7, CHST11, SIX3, PPP1R21, GLB1, PRKACB, FIG4, USP9X, NEK9, SLC35D1, ID4, POLR3B, PLOD2, NF1, MTAP, ORC4, BMPR1B, HNRNPK, CEP63, TTN, CC2D2A, PDE3A, HDAC4, ALG9, SELENOI, DISP1, SETD2, STAG2, GLI3, CTNNB1, IL6ST, SLC17A5, ANKH, BTRC, IGF1R, EP300, NOTCH2, ABCC9, LIFR, SEMA3A, SPRED1, ADAMTS17, SMC3, SUPT16H, RRAS2, DNAJC21, SOS1, CRTAP, EXT1, CDH11, NSMCE2, SMARCE1, OFD1, DYM, PCYT1A, DAG1, PTPN11, GNAI3, RNPC3, UFSP2, KIAA0753, SMAD4, FBN1, ATP6V1B2, CEP290, SRP54, KAT6B, AGPS, DYNC2H1, SMS, EYA1, OSTM1, RYR1, SHOC2, DSE, POR, RPL5, INTU, CRIPT, PRKAR1A, ANKRD11, ARID1B, SATB2, WDR35, GNPTAB, VPS35L, SON, KMT2C, TCF12, KCTD1, CDC42, SPECC1L, ATR, ARSB, RSPRY1, CHD4, MAP3K7, KRAS, SOS2, CBL, SMAD2, ASPH, RPGRIP1L, NEK1, IFT43, EXOC6B, IFT81, MAP2K1, PSAT1, CRPPA, TGFB2, RAD21, GPC6, B4GAT1, SMCHD1, NBAS, CREBBP, CLCN5, PTCH1, VCAN, ZEB2, IARS2, FBXW4, PIGL, TRIM37, GMNN, NSD2, GJA1, FTO, CUL3, SH3PXD2B, RBPJ, FGFR3, SNRPN, MAP3K20, DDRGK1, FAR1, TAPT1, FBXO11, MESD, SLC10A7, STAT3, TAB2, IPO8, KCNN3, SOX9, WDR19, SUMF1, NSD1, EFL1, ZC4H2, SALL1, HDAC8, BRAF, POGZ, ZSWIM6, DYNC2LI1, FN1, TMEM67, HS2ST1, DDX3X, ANTXR2, STIM1, LEMD3, PPP1CB, FKTN, MRAS, PIK3R1, CDC73, ANO5, RPS28, POLA1, KIAA0586
HP:0000006	Autosomal dominant inheritance	744	0.17258176757132915	1.5875364380969608	4.0191073591712396e-47	6.890759567299089e-44	43.16173290324406	4.134455740379454e-43	RAB7A, KIF5C, KCNQ3, NEFL, GRIA4, GPD2, PEX1, MEIS2, TTBK2, NFIA, WFS1, SAMHD1, MTOR, NIPBL, TUBB4A, KIF21A, ERBB4, YWHAG, HGSNAT, ARHGAP31, ATXN2, BACH2, GNAL, RPL35, RPS19, TMEM106B, TFG, MAPK1, ANKRD17, ARL3, VWA8, ATL1, ZNF644, MARK2, IDH3A, GPRC5B, RPL13, VIM, USP7, PPP2CA, RPSA, MAP1B, GABRB3, ZIC1, FRMD5, POT1, SIX3, BARD1, TTLL5, ARID2, USP48, FTH1, ABHD12, POLR3B, HSPB1, LAMA4, GNAQ, SYCP2, HNRNPK, USP8, SIN3A, FUS, SETX, RPL17, HDAC4, SLC25A46, ALDH2, CTNNB1, CEP85L, RNF170, GNAO1, ACTG1, HTRA1, PANK2, DCC, RPL18, MAT2A, VAPB, PDE10A, LRP6, STAG1, CHD7, SOS1, PLD3, RAC1, MAX, AUTS2, RERE, OFD1, AFF4, DNAJB6, ARF1, NFKB1, CHD2, PUM1, GFAP, ZBTB7A, UFSP2, NAF1, USP45, TMEM260, JARID2, CD164, SDC3, MSH2, TSC1, SMARCA2, ADAR, SOD1, ATP6V1B2, EDNRB, SPAST, TBC1D24, TNS1, PRKN, RPL5, PRKAR1A, TUBB, COCH, CRYM, JAK2, NPHP1, CRB1, SON, MCC, TCF12, GABRG2, SMAD2, PHF21A, MSH3, CYP4V2, LRP12, ATP1A2, MAP2K1, TGFB2, PKD2, BICC1, SDHAF2, YY1, ZFHX3, TCF4, HNRNPA2B1, BSCL2, ANTXR1, HNRNPU, SPTBN1, TRRAP, FTL, CEP78, NSD2, C9orf72, RBPJ, KIF1A, ADAM10, FAR1, DHX30, SLC1A3, RPS29, AP1G1, FBXO11, RAP1B, SCAF4, PAFAH1B1, RNF13, WDR19, CSNK2A1, AFG3L2, SALL1, ARHGEF10, POGZ, NR3C2, TPM1, CAPRIN1, LEMD3, SGCE, GATAD2B, MRAS, CDC73, LPP, NUS1, RPS28, FBXW11, KDM1A, SATB2, CUX1, ZMIZ1, EPB41L1, GATM, DYRK1A, WDR26, APC, HNRNPH1, P4HA1, PDE8B, SPRY2, SLC12A2, KCNA2, WASHC5, PNPT1, CCM2, GDAP1, LRP1, CACNB2, KDM5A, SOX2, WAC, LRRK2, PPP3CA, UBE3A, KIZ, THRA, SYNE2, DEPDC5, PDE4D, GRIK2, SRRM2, LGI1, CDH2, MACF1, OAT, KCNMA1, MITF, PRKG1, ATXN10, SPATA7, NBEA, ANGPT1, AP4E1, PSMD12, ATP2C1, PRKACB, FIG4, SMARCC1, PURA, CHIC2, ZCCHC8, CACNA1E, STAT1, IFT74, MTAP, SCD5, ATP11A, EED, PRNP, CNBP, MYLK, SOX5, BMS1, CC2D2A, TEAD1, GBF1, SETD2, RYR2, IL6ST, CELF2, CACNA1A, PRKD1, DIAPH1, OPA1, SCN8A, MEF2A, ABCC9, DZIP1, WNK1, AAGAB, KLHL7, CTNND1, ATP6V1A, WDFY3, RPS24, BBS5, SPTLC1, CERT1, EXT1, ATP5F1B, CDH11, SMARCE1, CLCN3, PLCG2, SYCP3, PMP2, CYLD, EIF4A2, SDCCAG8, DCAF8, SMAD4, TCF7L2, TAF1, SERPINI1, EYA1, TUBB2B, SHOC2, KLHL24, DPP6, ANKRD11, ANKRD26, VCL, KCNB1, RDH11, HNRNPC, ATF6, SPECC1L, INVS, CDC42, ZMYND11, RAB28, NLGN1, RPL21, SNCA, MAP3K7, NSF, KRAS, COPA, ECE1, GLUL, GRIA2, RAD21, FLCN, ZNF148, NRIP1, SYNE1, CREBBP, PMS1, LRRC8A, LMBRD2, VCAN, ZEB2, GMNN, TMEM43, FGFR3, PACS1, SNRPN, TNNI3K, VEGFC, APP, RORB, TRIM8, ANK2, SAMD12, LCA5, TAB2, KIDINS220, TNPO3, GLMN, TRIM44, NSD1, ELOVL5, GLUD1, ADAM9, GNB1, CNOT1, NTRK2, PPP2R2B, SCN2A, ARID1B, CLTC, FN1, WDPCP, MXI1, PGK1, CHI3L1, ANO5, PIKFYVE, ABCC1, ZEB1, GABRA2, KRIT1, CYFIP2, RPL15, CD46, CDC42BPB, A2ML1, MYORG, SYT1, LMBR1, CALM1, SEL1L, HNRNPR, ATP6V0C, ATP1A1, ANXA5, COL11A1, YEATS2, CTNNA1, CHN1, ALMS1, KMT2A, LRP4, GJB6, EXT2, ASXL1, GNAI1, BBS1, SYN2, SPTLC2, CNNM2, BMPR1A, ADGRA3, PMP22, MAK, STAT5B, MLH3, TIMP3, IRS2, PER2, KCNN2, TLK2, TRPM7, FOXG1, GNB4, ACOX1, NFE2L2, KMT2E, NALCN, RAF1, ELP1, RFX7, TBL1XR1, CALM3, CAMK2G, ZFPM2, HS6ST1, PARN, ATXN3, TARDBP, MAPK8IP3, BBS4, TTN, ZMYM2, PDE3A, THOC1, PTPRJ, MYO6, TSPAN12, APPL1, SSBP1, ANKH, CRYAB, ADNP, YAP1, MAPRE2, PTCH2, PAK2, CDK19, ZBTB20, NOTCH2, PTEN, TUBA1A, GDPD1, RORA, SREBF1, ITM2B, GRIN2B, RAPGEF2, SEMA3A, ARHGAP26, BMPR2, SUPT16H, SMC3, GPC4, BRD4, DSTYK, ATP2B1, SLC4A7, RRAS2, C1S, SLC1A2, TTC8, ATP6V0A1, KIF2A, KMT5B, ANO3, SASH1, ROBO1, KANSL1, CBFB, SLC33A1, PTPN11, TNC, LGR4, MFSD8, FGF14, RB1, KAT6A, FBN1, KLHL3, CEP290, DYNC2H1, SPTAN1, ARID1A, EIF2AK2, PAX6, PTPN1, SCAPER, ZNF292, DNAAF4, FBXO38, IFNGR1, TRIP12, TNRC6B, KMT2C, KCTD1, ASH1L, CHD4, KIF1B, SOS2, CBL, ASPH, PEX2, RPGRIP1L, NEK1, ERCC6, PHACTR1, EHMT1, DIP2B, PRRT2, DGCR2, DDX6, NCDN, RPS27, ARL6, PTCH1, RIPOR2, THRB, CDK8, GPHN, APOE, COPB2, JAM2, FBXW7, TAOK1, GJA1, SUZ12, CUL3, STX16, TBK1, AGO2, UBA2, STAT3, IPO8, KCNN3, SNCAIP, PRKAG2, BRAF, AGO1, MED12L, ZSWIM6, ATM, RPL26, HNRNPDL, TMEM67, STIM1, PPP1CB, KCNQ5, HERC2, DNM1L, CWC27, GLS, CTNNA3, BBS9, EFHC1, TRDN, EYS, SEPTIN9, ACTB, SMARCC2, SLC6A1, CALM2, CSGALNACT1, RB1CC1, TTC21B, CPLANE1, XPR1, VAMP2, RALA, NPHP3, CACNB4, WDR37, PAK1, VPS35, GLI2, MDM4, KDM3B, JAK1, UBAP2L, MKRN3, POC1B, SMARCAD1, STXBP1, RPGR, PICALM, KDM6A, MTSS2, PPP2R1A, CCDC50, AP1S3, HIVEP2, EFEMP1, DICER1, DIAPH3, MED13, TSHZ1, ATXN1, BPTF, EGLN1, CACNA1C, AQP4, GNAS, HSPA9, TTPA, PSAP, SRP72, PER3, UBAP1, NAA15, MBD5, RANBP2, FGF12, FRYL, CRY1, ADGRV1, RASA1, CAMTA1, NF1, ELP4, DPH5, CTSD, WDR11, DMXL2, B2M, NUP214, HSPD1, BMPR1B, PRPF3, SEC63, BBS7, FOXP1, GLI3, HEY2, ZNF423, SLC20A2, SNAP25, IGF1R, EP300, SLC12A6, PDGFRB, BICD2, SRPX2, PPP1R12A, SPRED1, ABCA1, AP2M1, CHD1, RBFOX2, ATP5F1A, ATP2A2, LAMA1, NFIB, OTULIN, PHIP, PPP2R1B, HEPACAM, PCYT1A, NR2F1, DHX9, ASXL2, AKAP9, NR3C1, GNAI3, ITPR1, CSPP1, ZNF462, SRP54, MYBPC1, KAT6B, CHM, SGCD, RNF213, VPS13B, RYR1, POR, AKT3, DLC1, CADM3, AHI1, PRRX1, PIK3CA, SETD5, SDHC, ACO2, SF3B2, CNOT2, TRPM3, CLCN6, ATR, DYNC1H1, RIMS2, CDK13, ARFGEF1, PALLD, BBS2, DNM1, IFT43, IFT81, GIGYF2, WASF1, ARIH1, CHD8, SLC4A10, KPNA3, SMCHD1, NPM1, NBAS, MEF2C, SOX6, PSEN1, SPEN, ATXN7, IQCB1, DAB1, EGFR, PBX1, DTNA, SRGAP1, HTT, MERTK, TRIO, UCHL1, MED13L, SOX9, PTPN12, PDCD10, TUBB2A, REST, MLLT10, TNRC6A, MIB1, ABL1, PIK3R1, TANC2, SHROOM3, NEDD4L, GABRB1, TRPS1
HP:0001561	Polyhydramnios	106	0.02458826258408722	1.5875230601312238	3.195235041952283e-07	1.0776846844774797e-05	4.967508289077734	0.0032869382876563134	CDC42BPB, ACTB, DYRK1A, YWHAE, TRIP11, RREB1, GRM7, MTM1, NPHP3, SLC25A12, SPRED2, KDM3B, KIF21A, DIS3L2, PIGN, MKRN3, ITGA7, EXT2, ASXL1, NEB, KDM6A, EXTL3, MYO9A, AMMECR1, PI4KA, ADAMTS3, NALCN, RAF1, ADARB1, FIG4, SLC35D1, FUT8, DPH5, MYLK, SIN3A, STRADA, ZFX, TMCO1, TTC7A, ALG9, SLC25A46, SNAP25, NRCAM, EP300, SCN8A, SCYL2, TUBA1A, JMJD1C, SREBF1, BICD2, ALG14, GPC4, SLC25A26, RRAS2, CHD7, SOS1, ATP6V0A1, RERE, OFD1, GBE1, TBCK, FBN1, ATP6V1B2, SOD1, KAT6B, EDNRB, RYR1, SHOC2, TBC1D24, WDR35, PRRX1, SEMA3D, KRAS, CBL, CDK13, ASCC1, ECE1, ATP1A2, PSAT1, PHACTR1, CHD8, SYNE1, CREBBP, CCDC47, CEP57, ITGA6, TRAPPC12, FGFR3, MAP3K20, HSD17B4, EGFR, TAPT1, PAFAH1B1, KIDINS220, IPO8, TBCD, SOX9, B3GLCT, CSNK2A1, ZC4H2, BRAF, DYNC2LI1, MAMLD1, HERC2, PPP1CB, KIAA0586
HP:0000737	Irritability	92	0.02134075620505683	1.5867661184092077	1.614731451544343e-06	4.7459264120104735e-05	4.323679000022083	0.016610742442036655	UBA5, ST3GAL5, GRIA4, MED23, SAMHD1, GLI2, HLCS, GLDC, TMEM106B, BMPR1A, PLCH1, FOXG1, GALC, ACOX1, NDUFS1, FMR1, GNAS, GABRB3, SUCLA2, SIX3, PSAP, HACE1, FIG4, RNASEH2B, MT-ATP6, GAPVD1, TSEN15, QDPR, PRNP, TLR4, GCSH, ALG9, MTHFS, DISP1, ZNRF3, STAG2, CTNNB1, CACNA1A, ADNP, MECP2, NRCAM, HTRA1, PANK2, NUP133, ATP5F1A, SLC1A2, ERAP1, ST3GAL3, CHD2, RPS20, UBAC2, PTS, MSH2, ADAR, OSTM1, IFNGR1, NHLRC2, PRKAR1A, PIK3CA, VPS53, HIBCH, ARHGAP24, ANKFY1, ASH1L, KRAS, DNM1, MAGI2, NUP160, DPYD, VPS13A, EHMT1, PRRT2, TK2, PMS1, SLC25A13, SPTBN1, PTCH1, MAPK10, PSEN1, STX16, VPS50, ALDH7A1, ASAH1, NPAT, FOCAD, HTT, RNF13, SLC1A4, POGZ, ATM, CD2AP, NUP205
HP:0000678	Dental crowding	226	0.052424031547204826	1.5762413923302636	8.019088477430949e-14	7.050629330541211e-12	11.151772116684757	8.249236316733218e-10	GALNT2, BBS9, MANBA, RPS6KA3, ACTB, TRIP11, CSGALNACT1, LMBR1, RREB1, HNRNPH1, PAPPA2, CPLANE1, TTC21B, ATP6V1E1, RALA, COL11A1, ZBTB16, GLI2, SPRED2, LFNG, NIPBL, SPARC, GPX4, SOX2, IFT122, HGSNAT, ARHGAP31, KMT2A, ALMS1, TRPS1, LRP4, ITGA7, EXT2, BBS1, IFT80, MAPK1, CHSY1, EXTL3, CEP295, PDE4D, NIN, XRCC4, EFEMP1, STAT5B, RPL13, AMMECR1, LGI4, PRKG1, LPIN2, UPF3B, TMEM165, IDS, GNAS, HSPA9, RAF1, TENT5A, CHST11, PPP1R21, GLB1, PRKACB, FIG4, NEK9, SLC35D1, ID4, POLR3B, PLOD2, NF1, IFT74, MTAP, ORC4, BMPR1B, MYLK, CEP63, SOX5, BBS4, BBS7, ZFX, CC2D2A, PDE3A, HDAC4, PIGK, ALG9, SETD2, GLI3, HEY2, ANKH, IL6ST, SLC17A5, BTRC, IGF1R, KIAA0586, EP300, NOTCH2, ABCC9, LIFR, SEMA3A, MAT2A, SPRED1, ADAMTS17, SMC3, RRAS2, GRIP1, BBS5, SOBP, DNAJC21, SOS1, CRTAP, EXT1, TTC8, NSMCE2, SMARCE1, OFD1, DYM, PCYT1A, PTPN11, GNAI3, SDCCAG8, ZBTB7A, UFSP2, KIAA0753, RNPC3, SMAD4, FBN1, CEP290, SRP54, KAT6B, AGPS, DYNC2H1, SMS, OSTM1, POR, SHOC2, DSE, SCAPER, INTU, CRIPT, PRKAR1A, ANKRD11, SATB2, WDR35, GNPTAB, SETD5, VPS35L, SNX14, NPHP1, TCF12, CDC42, SPECC1L, ATR, ARSB, RSPRY1, MAP3K7, KRAS, SOS2, BBS2, SMAD2, CBL, RPGRIP1L, TECPR2, NEK1, EXOC6B, IFT81, MAP2K1, PSAT1, IFT43, TGFB2, RAD21, ARIH1, GPC6, FLCN, NBAS, CREBBP, IL1RAPL1, CLCN5, ARL6, CCDC47, ZEB2, IARS2, FBXW4, TRIM37, GMNN, NSD2, GJA1, SH3PXD2B, RBPJ, SPEN, FGFR3, MAP3K20, DDRGK1, FAR1, TAPT1, TRIO, MESD, RAP1B, SLC10A7, STAT3, TAB2, KIDINS220, IPO8, SOX9, WDR19, SUMF1, NSD1, EFL1, ZC4H2, SALL1, HDAC8, BRAF, TMEM67, ZSWIM6, DYNC2LI1, FN1, ARID1B, HS2ST1, WDPCP, ANTXR2, STIM1, LEMD3, PPP1CB, MRAS, ABL1, PIK3R1, CDC73, ANO5, NEDD4L, SCLT1
HP:0000668	Hypodontia	243	0.05636743215031315	1.5709656732988493	1.2608062997374662e-14	1.2352299433713635e-12	11.908252189091133	1.2969914405399315e-10	GALNT2, CYFIP2, BBS9, MID1, MANBA, UBA5, RPS6KA3, ACTB, TRIP11, APC, LMBR1, CSGALNACT1, RREB1, PAPPA2, CPLANE1, TTC21B, P4HA1, RALA, KCNA2, COL11A1, ZBTB16, GLI2, SPRED2, LFNG, NIPBL, SPARC, GPX4, YWHAG, IFT122, HGSNAT, SOX2, ARHGAP31, KMT2A, ALMS1, TRPS1, LRP4, SYNJ1, EXT2, PPP3CA, BBS1, IFT80, MAPK1, CHSY1, KDM6A, EXTL3, TMEM67, PDE4D, NIN, XRCC4, STAT5B, RPL13, AMMECR1, FOXG1, NELFA, LPIN2, ACOX1, TMEM165, IDS, GNAS, HSPA9, MTX2, RAF1, TENT5A, CHST11, PPP1R21, GLB1, PRKACB, GTF2I, FIG4, FGF12, NEK9, SLC35D1, ID4, PARN, POLR3B, PLOD2, NF1, IFT74, MTAP, ORC4, BMPR1B, MAPK8IP3, CEP63, BBS4, BBS7, CC2D2A, PDE3A, HDAC4, ALG9, SETD2, GLI3, ANKH, CTNNB1, IL6ST, SLC17A5, CELF2, CACNA1A, CEP85L, CDK19, BTRC, IGF1R, KIAA0586, BAZ1B, EP300, NOTCH2, SCN8A, ABCC9, LIFR, SEMA3A, SPRED1, ADAMTS17, SMC3, ATP6V1A, UBE3C, RRAS2, BBS5, SLC1A2, DNAJC21, SOS1, CRTAP, EXT1, NTRK2, TTC8, NSMCE2, SMARCE1, OFD1, DYM, PCYT1A, PTPN11, TRAF6, GNAI3, SDCCAG8, RNPC3, UFSP2, KIAA0753, SMAD4, FBN1, ATP6V1B2, CNKSR2, CEP290, SRP54, KAT6B, AGPS, DYNC2H1, OSTM1, POR, SHOC2, DSE, SCAPER, INTU, CRIPT, PRKAR1A, ANKRD11, ARID1B, SATB2, WDR35, GNPTAB, VPS35L, KCNB1, NPHP1, TCF12, CDC42, SPECC1L, GABRG2, ATR, ARSB, RSPRY1, CACNA1B, MAP3K7, KRAS, SOS2, BBS2, SMAD2, CBL, DNM1, RPGRIP1L, IFT43, NEK1, EXOC6B, IFT81, ATP1A2, PSAT1, MAP2K1, TGFB2, RAD21, GPC6, TRAK1, NBAS, NPM1, CREBBP, CACNA2D1, RBM28, CLCN5, ARL6, IARS2, FBXW4, PIGL, TRIM37, GMNN, NSD2, GJA1, SH3PXD2B, RBPJ, FGFR3, MAP3K20, DDRGK1, FAR1, TAPT1, WWOX, MESD, SLC10A7, STAT3, TAB2, RNF13, KCNN3, SOX9, WDR19, SUMF1, NSD1, SLC13A5, EFL1, ZC4H2, SALL1, HDAC8, HECTD4, BRAF, ZSWIM6, DYNC2LI1, CLTC, FN1, HS2ST1, WDPCP, ANTXR2, STIM1, LEMD3, PPP1CB, MRAS, PIK3R1, CDC73, NUS1, ANO5, GABRA2, SCLT1
HP:0000768	Pectus carinatum	220	0.05103224309904895	1.5687463863701674	2.829005197582275e-13	2.3660143469535656e-11	10.625982626240686	2.910197646752886e-09	GALNT2, MANBA, RPS6KA3, ACTB, TRIP11, CSGALNACT1, LMBR1, RREB1, HNRNPH1, PAPPA2, CPLANE1, TTC21B, P4HA1, SLC12A2, COL11A1, RALA, ZBTB16, GLI2, SPRED2, LFNG, NIPBL, SPARC, GPX4, SOX2, IFT122, HGSNAT, ARHGAP31, KMT2A, ALMS1, TRPS1, LRP4, EXT2, IFT80, MAPK1, CHSY1, EXTL3, MYO9A, ARL3, PDE4D, NIN, XRCC4, EFEMP1, STAT5B, RPL13, AMMECR1, PRKG1, LPIN2, UPF3B, TMEM165, IDS, NALCN, GNAS, HSPA9, RAF1, TENT5A, CHST11, SIL1, PPP1R21, GLB1, PRKACB, FIG4, NEK9, SLC35D1, ID4, FRYL, POLR3B, PLOD2, NF1, MTAP, ORC4, BMPR1B, MYLK, CEP63, SOX5, ZFX, CC2D2A, PDE3A, HDAC4, ALG9, SETD2, GLI3, HEY2, ANKH, IL6ST, SLC17A5, SNAP25, BTRC, IGF1R, EP300, NOTCH2, ABCC9, LIFR, SEMA3A, MAT2A, SPRED1, ADAMTS17, SMC3, GPC4, BRD4, RRAS2, ATP2B1, FAM149B1, MBTPS1, DNAJC21, CRTAP, EXT1, SOS1, MAX, NSMCE2, SMARCE1, OFD1, DYM, PCYT1A, KANSL1, PTPN11, GNAI3, RNPC3, UFSP2, KIAA0753, SMAD4, FBN1, CEP290, SRP54, SPTAN1, AGPS, KAT6B, DYNC2H1, SMS, OSTM1, POR, SHOC2, DSE, RASA2, INTU, CRIPT, PRKAR1A, ANKRD11, SATB2, WDR35, GNPTAB, VPS35L, SNX14, RAB3GAP2, TCF12, CDC42, SPECC1L, ATR, ARSB, RSPRY1, ASH1L, MAP3K7, KRAS, SOS2, CBL, SMAD2, ASPH, RPGRIP1L, NEK1, IFT43, EXOC6B, IFT81, MAP2K1, PSAT1, TGFB2, RAD21, ARIH1, GPC6, VPS37A, NBAS, CREBBP, ERI1, CLCN5, ZEB2, IARS2, FBXW4, TRIM37, GMNN, NSD2, GJA1, SH3PXD2B, RBPJ, FGFR3, MAP3K20, DDRGK1, FAR1, TAPT1, AP1G1, MESD, RAP1B, UCHL1, STAT3, TAB2, SLC10A7, IPO8, TBCD, SOX9, WDR19, SUMF1, NSD1, EFL1, ZC4H2, SALL1, HDAC8, BRAF, TMEM67, ZSWIM6, DYNC2LI1, FN1, ARID1B, HS2ST1, LEMD3, ANTXR2, STIM1, MRAS, PPP1CB, ABL1, PIK3R1, CDC73, ANO5, KIAA0586
HP:0001324	Muscle weakness	167	0.038738111807005336	1.567485561448098	3.1908152722093426e-10	1.7552896633806156e-08	7.755651204652658	3.282391670521751e-06	ERCC8, ALS2, KRIT1, SEPTIN9, GATM, RPS6KA3, B3GALNT2, NSUN3, CPLANE1, PGM1, ATP6V1E1, ETFA, ATP13A3, ADK, MFF, PNPT1, CCM2, ZBTB16, CEP126, SPRED2, SPARC, DMD, LRP4, ITGA7, MT-ND1, LARGE1, SPTLC2, TFG, HADHA, NDUFAF6, CNNM2, SACS, PMP22, MYO9A, ATL1, STAT5B, ATG7, NDUFAF2, HADHB, EXOSC3, TRPM7, GALC, ATXN1, TMEM165, NFE2L2, FMR1, NDUFS1, RAF1, TBL1XR1, TTPA, PSAP, PHKB, MT-ATP6, HS6ST1, USP48, NF1, STAT1, COX10, WDR11, TARDBP, PRNP, ANOS1, AGK, HNRNPK, USP8, NDUFV2, FUS, LYST, SLC25A46, ZNRF3, CTNNB1, NDUFS4, CACNA1A, LAMP2, MT-CO2, PTEN, SLC12A6, SEMA3A, DCC, APTX, MT-CO3, ATP5F1A, ETFDH, SLC25A26, RRAS2, CHD7, TOR1AIP1, SPTLC1, ATP9A, SOS1, NUBPL, GPI, PLP1, GBE1, SLC33A1, LAMA2, DAG1, PTPN11, MT-ND3, NR3C1, PREPL, TRIM2, FBN1, MT-ND2, SOD1, RYR1, DSE, KLHL24, RASA2, BRCC3, PRKAR1A, NDUFS2, PHKA1, PIK3CA, MMUT, LRPPRC, AGL, TRAPPC6B, TTC19, GOSR2, MT-CO1, SOS2, KRAS, CBL, ASCC1, LRP12, ERCC6, ATP1A2, CRPPA, SPG11, TGFB2, PRRT2, B4GAT1, NPM1, HNRNPA2B1, SLC9A7, TK2, AGTPBP1, TIMMDC1, IARS2, CPT1A, C9orf72, GJA1, MT-ND5, BET1, ATXN7, TBK1, FIP1L1, CASK, MT-ND4, ATRX, STAT3, TBCD, NBN, LPIN1, PDCD10, ZC4H2, CNOT1, BRAF, NARS2, FKTN, YARS2, MRAS, PGK1, SAT1, CDC73, IFRD1
HP:0000311	Round face	207	0.04801670146137787	1.5647974419280672	2.3184649267595697e-12	1.753680051586448e-10	9.756049638167921	2.3850048701575692e-08	GALNT2, MANBA, SEPTIN9, ACTB, PEX1, CSGALNACT1, LMBR1, TRIP11, RREB1, PAPPA2, CPLANE1, TTC21B, RALA, COL11A1, ZBTB16, GLI2, SPRED2, LFNG, NIPBL, SPARC, DIS3L2, GPX4, UBAP2L, IFT122, HGSNAT, SOX2, ARHGAP31, STXBP1, KMT2A, ALMS1, TRPS1, LRP4, EXT2, IFT80, MAPK1, CHSY1, EXTL3, PDE4D, NIN, XRCC4, STAT5B, RPL13, AMMECR1, LPIN2, CACNA1C, TMEM165, IDS, GNAS, HSPA9, RAF1, TENT5A, CHST11, ADARB1, TRAPPC9, PPP1R21, GLB1, PRKACB, FIG4, NEK9, SLC35D1, ID4, POLR3B, PLOD2, NF1, MTAP, ORC4, BMPR1B, EED, MAPK8IP3, CEP63, CC2D2A, PDE3A, HDAC4, ALG9, SETD2, GLI3, ANKH, CPE, IL6ST, SLC17A5, BTRC, IGF1R, EP300, NOTCH2, ABCC9, LIFR, SEMA3A, SPRED1, ADAMTS17, SMC3, RRAS2, DNAJC21, SOS1, CRTAP, EXT1, PHIP, NSMCE2, SMARCE1, OFD1, AFF4, DYM, PCYT1A, PTPN11, GNAI3, RNPC3, UFSP2, KIAA0753, SMAD4, FBN1, CEP290, SRP54, KAT6B, AGPS, DYNC2H1, OSTM1, POR, SHOC2, DSE, EIF2S3, INTU, CRIPT, PRKAR1A, ANKRD11, ARID1B, SATB2, WDR35, GNPTAB, VPS35L, HNRNPC, TCF12, CDC42, SPECC1L, ATR, ARSB, RSPRY1, MAP3K7, KRAS, SOS2, BBS2, SMAD2, CBL, PEX2, RPGRIP1L, TECPR2, NEK1, EXOC6B, IFT81, MAP2K1, PSAT1, IFT43, MRPS28, TGFB2, RAD21, GPC6, NBAS, CREBBP, CLCN5, IARS2, FBXW4, PIGL, TRIM37, GMNN, NSD2, GJA1, SUZ12, RBL2, STX16, SH3PXD2B, RBPJ, FGFR3, MAP3K20, DDRGK1, FAR1, TAPT1, WWOX, MESD, SLC10A7, STAT3, TAB2, MED13L, SOX9, WDR19, SUMF1, NSD1, B3GLCT, EFL1, ZC4H2, SALL1, HDAC8, AGO1, BRAF, ZSWIM6, DYNC2LI1, FN1, TMEM67, HS2ST1, LEMD3, ANTXR2, STIM1, MRAS, PPP1CB, PIK3R1, CDC73, ANO5, CTNND2, NEDD4L, KIAA0586
HP:0000821	Hypothyroidism	108	0.025052192066805846	1.5588367003260821	5.476703878192003e-07	1.7442369286365678e-05	4.758394522952391	0.005633885279496114	BBS9, DYRK1A, APC, RREB1, GRM7, SEL1L, WFS1, SAMHD1, GLI2, MDM4, SECISBP2, JAK1, ALMS1, LRP4, EXT2, BBS1, MT-ND1, KDM6A, CHD6, XRCC4, MARK2, CACNA1C, FMR1, GNAS, SIX3, GTF2I, RNASEH2B, MT-ATP6, TF, STAT1, FUT8, IFT74, PLAAT3, WDR11, ATP11A, HNRNPK, BBS4, BBS7, ZFX, KCNJ10, FOXP1, LUZP1, HDAC4, SLF2, DISP1, IL6ST, BAZ1B, OPA1, ZBTB20, MT-CO2, PTEN, JMJD1C, LIFR, GRIN2B, SUPT16H, ARL6IP6, MT-CO3, ATP5F1A, CHD7, SGPL1, BBS5, SLC25A36, CBLB, TTC8, RERE, AFF4, PIK3C2A, ROBO1, KANSL1, TBCK, SDCCAG8, ITCH, FBN1, ADAR, TSC1, CEP290, UBR1, KAT6B, SCAPER, PIK3CA, NPHP1, ANAPC1, UBE4B, ASH1L, TIAM1, MT-CO1, BBS2, PHF21A, YY1, CHD8, FLCN, ARL6, CCDC47, PTCH1, APOE, CEP57, MT-ND5, SPEN, LRBA, MT-ND4, DCLRE1C, STAT3, IPO8, NSD1, SALL1, WDPCP, DNM1L, SCLT1
HP:0011304	Broad thumb	200	0.046392948271862675	1.5587425164882278	6.9723805384534445e-12	5.015725776158782e-10	9.29966621562961	7.172487859907059e-08	GALNT2, MANBA, ACTB, TRIP11, CSGALNACT1, LMBR1, RREB1, PAPPA2, CPLANE1, TTC21B, MEIS2, HNRNPR, RALA, COL11A1, ZBTB16, GLI2, SPRED2, LFNG, NIPBL, SPARC, GPX4, SOX2, IFT122, HGSNAT, ARHGAP31, KMT2A, ALMS1, TRPS1, LRP4, EXT2, IFT80, MAPK1, CHSY1, EXTL3, BMPR1A, PDE4D, NIN, XRCC4, STAT5B, RPL13, AMMECR1, BPTF, LPIN2, TMEM165, IDS, GNAS, HSPA9, RAF1, TENT5A, CHST11, PSMD12, PPP1R21, GLB1, PRKACB, FIG4, USP9X, NEK9, SLC35D1, ID4, POLR3B, PLOD2, NF1, MTAP, ORC4, BMPR1B, EED, CEP63, CC2D2A, PDE3A, HDAC4, ALG9, SETD2, GLI3, ANKH, IL6ST, SLC17A5, ADNP, PRKD1, BTRC, IGF1R, EP300, NOTCH2, PTEN, ABCC9, LIFR, SEMA3A, SPRED1, ADAMTS17, SMC3, GPC4, RRAS2, DNAJC21, SOS1, CRTAP, EXT1, NSMCE2, SMARCE1, RERE, OFD1, DYM, PCYT1A, CBFB, PTPN11, GNAI3, RNPC3, UFSP2, KIAA0753, SMAD4, FBN1, CEP290, SRP54, KAT6B, AGPS, DYNC2H1, OSTM1, POR, SHOC2, DSE, INTU, CRIPT, PRKAR1A, ANKRD11, ARID1B, RLIM, WDR35, SATB2, GNPTAB, SETD5, VPS35L, TCF12, KCTD1, CDC42, TRPM3, SPECC1L, ATR, ARSB, RSPRY1, MAP3K7, KRAS, SOS2, CBL, SMAD2, RPGRIP1L, NEK1, IFT43, EXOC6B, IFT81, MAP2K1, PSAT1, TGFB2, RAD21, GPC6, NBAS, CREBBP, CLCN5, IARS2, FBXW4, TRIM37, GMNN, NSD2, GJA1, SUZ12, SH3PXD2B, RBPJ, FGFR3, PACS1, MAP3K20, DDRGK1, FAR1, TAPT1, DHX30, MESD, SLC10A7, STAT3, TAB2, SOX9, WDR19, SUMF1, NSD1, EFL1, ZC4H2, SALL1, HDAC8, BRAF, POGZ, ZSWIM6, DYNC2LI1, FN1, TMEM67, HS2ST1, LEMD3, ANTXR2, STIM1, MRAS, PPP1CB, PIK3R1, CDC73, DNM1L, ANO5, KIAA0586
HP:0001508	Failure to thrive	332	0.07701229413129204	1.550484076176042	1.10682865016731e-18	1.6993949737718086e-16	15.76970567057536	1.1385946324271117e-14	ST3GAL5, GRIA4, PEX1, NDUFA13, ADK, NFIA, ELMO2, NIPBL, MTR, YWHAG, ARHGAP31, ABAT, TMEM106B, RPS19, EXTL3, USP7, GALC, PCCA, CA12, SIX3, SIL1, MT-ATP6, FTH1, PEX3, HNRNPK, NDUFV2, C2orf69, SIN3A, RPL17, SLC25A46, TFRC, NRCAM, GNAO1, ACTG1, CDKL5, STAG1, CHD7, DNAJC21, NGLY1, RASGRP1, RERE, OFD1, GFAP, PREPL, KIAA0753, SMARCA2, ADAR, TBC1D24, RPL5, AUH, NDUFS2, DLD, SON, COX4I1, GABRG2, COL4A5, MT-CO1, LYRM4, SMAD2, ATP1A2, MAP2K1, DPYD, VPS37A, STT3B, TCF4, SPTBN1, XPA, NDUFB8, LIPA, RYR3, IARS2, NSD2, COG6, FBXL4, MT-ND5, RBPJ, ASAH1, LRBA, WWOX, MT-ND4, SLC1A3, RNF13, SUCLG1, CSNK2A1, SALL1, POGZ, NR3C2, LEMD3, ANTXR2, YARS2, MED17, NUS1, GLB1, ERCC8, KIAA0586, UBA5, GATM, DYRK1A, WDR26, HNRNPH1, ATP6V1E1, KCNA2, PNPT1, SYNJ1, ITGA7, PPP3CA, MT-ND1, TJP2, PCCB, NELFA, LPIN2, NDUFS1, PRKACB, MRPL3, TASP1, COX10, STRADA, ARFGEF2, DISP1, SETD2, STAG2, CELF2, CACNA1A, MT-CO2, SCN8A, SUGCT, ATP6V1A, FAM149B1, NUBPL, ATP5F1B, CLCN3, PTPN2, MCCC1, GBE1, FARSB, EIF4A2, COG7, NSRP1, SMAD4, AGPS, SHOC2, NHLRC2, GNPTAB, LRPPRC, KCNB1, ADH5, MAP3K7, KRAS, XPC, RAD21, FLCN, CREBBP, AGTPBP1, SLC25A3, LRRC8A, ZEB2, NUP54, GMNN, CYP7B1, PACS1, SNRPN, MAP3K20, HSD17B4, FOCAD, TRIM8, SCN2A, GLUD1, GNB1, NTRK2, ARID1B, CLTC, FASTKD2, ADAM17, GABRA2, SAR1B, RARS2, CYFIP2, NSUN3, KMT2A, NNT, GJB6, ASXL1, BMPR1A, STAT5B, PLCH1, NDUFAF2, TLK2, EXOSC3, FOXG1, CARS2, ACOX1, NFE2L2, NALCN, FMR1, TBL1XR1, SUCLA2, PARN, FUT8, ORC4, TTN, ALG9, NDUFS4, ADNP, CDK19, MECP2, NOTCH2, PTEN, SMC3, MT-CO3, SLC9A6, BRD4, MLYCD, SLC1A2, ATP9A, VPS45, KMT5B, PLP1, ROBO1, KANSL1, CBFB, AASS, FBN1, UBR1, TRIT1, KMT2C, HIBCH, CACNA1B, KIF1B, CBL, PEX2, ERCC6, MRPS28, EHMT1, NADK2, TRAK1, CACNA2D1, PTCH1, MIPEP, TIMMDC1, PPM1B, TAOK1, GJA1, PMPCB, FTO, CUL3, PDHX, UBA2, STAT3, IPO8, SLC13A5, EFL1, BRAF, ZSWIM6, ATM, DYNC2LI1, RAB3GAP1, PPP1CB, ERCC5, DNM1L, PGAP1, PEX14, MT-CYB, ACTB, SMARCC2, GCLC, RREB1, PLCB1, GRM7, CPLANE1, PGM3, NPHP3, GLI2, JAK1, UBAP2L, MIF, HADHA, KDM6A, HIVEP2, EFEMP1, EPG5, TMEM165, TAMM41, PSAP, FGF12, MCCC2, WDR11, DMXL2, NUP214, CAMKMT, LUZP1, FOXP1, SLC17A5, EP300, JMJD1C, PDGFRB, DCTN4, ATP5F1A, DYM, DHX9, LMBRD1, MT-ND3, CSPP1, MT-ND2, CNKSR2, SRP54, KAT6B, RYR1, PIK3CA, MMUT, SDHC, ACO2, VPS53, UBE4B, MEGF10, DNM1, SLC4A10, SLC25A13, USF3, SPEN, ATXN7, SEC31A, EGFR, PBX1, CASK, DCLRE1C, TRIO, SOX9, HDAC8, ABL1, PIK3R1, NEDD4L, POLA1
HP:0001769	Broad foot	190	0.04407330085826954	1.5490336253872345	4.354176396633637e-11	2.7820753162838644e-09	8.555631116973835	4.479141259217022e-07	GALNT2, MANBA, CDC42BPB, ACTB, TRIP11, CSGALNACT1, LMBR1, RREB1, PAPPA2, CPLANE1, TTC21B, RALA, COL11A1, ZBTB16, GLI2, SPRED2, LFNG, NIPBL, SPARC, GPX4, SOX2, IFT122, HGSNAT, ARHGAP31, KMT2A, ALMS1, TRPS1, LRP4, EXT2, BBS1, IFT80, MAPK1, CHSY1, EXTL3, PDE4D, NIN, XRCC4, STAT5B, RPL13, AMMECR1, LPIN2, TMEM165, IDS, GNAS, HSPA9, RAF1, TENT5A, CHST11, TBL1XR1, PPP1R21, GLB1, PRKACB, FIG4, NEK9, SLC35D1, ID4, POLR3B, PLOD2, NF1, MTAP, ORC4, BMPR1B, CEP63, DLG5, CC2D2A, PDE3A, HDAC4, ALG9, SETD2, GLI3, ANKH, IL6ST, SLC17A5, BTRC, IGF1R, EP300, NOTCH2, ABCC9, LIFR, SEMA3A, SPRED1, ADAMTS17, SMC3, GPC4, RRAS2, DNAJC21, SOS1, CRTAP, EXT1, NSMCE2, SMARCE1, OFD1, DYM, PCYT1A, PTPN11, GNAI3, RNPC3, UFSP2, KIAA0753, SMAD4, FBN1, CEP290, SRP54, KAT6B, AGPS, DYNC2H1, OSTM1, POR, SHOC2, DSE, INTU, CRIPT, PRKAR1A, ANKRD11, ARID1B, SATB2, WDR35, GNPTAB, VPS35L, TCF12, CDC42, SPECC1L, ATR, ARSB, RSPRY1, DYNC1H1, MAP3K7, KRAS, SOS2, CBL, SMAD2, RPGRIP1L, NEK1, IFT43, EXOC6B, IFT81, MAP2K1, PSAT1, TGFB2, RAD21, GPC6, NBAS, CREBBP, ERI1, CLCN5, ARL6, IARS2, FBXW4, TRIM37, GMNN, NSD2, GJA1, SUZ12, SH3PXD2B, RBPJ, FGFR3, MAP3K20, DDRGK1, FAR1, TAPT1, FBXO11, MESD, SLC10A7, STAT3, TAB2, SOX9, WDR19, SUMF1, NSD1, B3GLCT, EFL1, ZC4H2, SALL1, HDAC8, BRAF, POGZ, ZSWIM6, DYNC2LI1, FN1, TMEM67, HS2ST1, LEMD3, ANTXR2, STIM1, MRAS, PPP1CB, PIK3R1, CDC73, ANO5, KIAA0586
