GO_ID	Name	Gene Count	Gene Ratio	Fold Enrichment	p-value	FDR	-log10 FDR	FWER	Associated Genes
GO:0051963	regulation of synapse assembly	17	0.006369426751592357	3.8583739228175347	2.0303309059144253e-07	7.335040450997645e-05	4.134597486783667	0.0024538579328881745	RAP2A, LSAMP, SRGAP2C, SEMA4D, MEF2C, SRGAP2, SRGAP2B, SETD5, OPCML, CTNNB1, NEGR1, CRTAC1, CHD4, OGT, NLGN4X, CLSTN3, SRGAP3
GO:0007612	learning	27	0.010116148370176097	3.205418335879183	9.435766268168036e-09	6.3355928398377155e-06	5.198212740682067	0.00011404067111707889	SHANK2, SLC12A5, ELAVL4, ATXN1, NLGN4X, SYT11, CNTNAP2, ATP8A1, SLC8A3, NRXN1, SYNJ1, NTRK2, PPP3CB, FGF13, GRM5, APP, FYN, NLGN4Y, BCHE, PRKN, GABRB3, NRXN3, PAK5, PLCB1, SLC24A2, GRIN2A, ATAD1
GO:0042752	regulation of circadian rhythm	28	0.01049082053203447	3.177484407026205	6.372177566030623e-09	4.530243415473301e-06	5.343878462190978	7.701413806304611e-05	CSNK1E, ROCK2, OPN3, MAPK9, USP9X, KDM2A, SKP1, USP7, RORA, PPARGC1A, NR1D2, ADCY1, PSPC1, MAPK10, MAPK8, MAGED1, FBXW7, SFPQ, UBE3A, CLOCK, PROX1, TARDBP, PRKDC, HNRNPD, BTRC, GSK3B, PRKAA2, ATG7
GO:0050808	synapse organization	29	0.010865492693892843	3.024130912478608	1.3208160547920316e-08	8.401780441166577e-06	5.075628671814417	0.00015963382838216495	NPTN, SHANK2, PPFIA2, NLGN4X, SYN3, SLC8A3, CAPS2, CTNNB1, CNTN4, SYN2, GRM5, APP, SNCB, SLC6A1, NBEA, SYN1, CNTN6, NRCAM, APBB2, PAK3, TSC1, CTNND2, LARGE1, CD2AP, GET1, GPHN, TNR, CAPRIN1, MAPT
GO:0048812	neuron projection morphogenesis	27	0.010116148370176097	2.8541396141389983	1.7016458690257988e-07	6.63422321711155e-05	4.178209920165206	0.0020566091973045803	NEGR1, EPB41L3, CNTNAP2, CNTNAP1, TNIK, TAOK3, DICER1, NRXN1, KIRREL3, GAS7, NLGN1, GPM6A, KDM1A, SGK1, ATP9A, GABRB3, NCKAP1, VPS54, MAP4K4, PACSIN1, TRIO, SRGAP2, PPP1R12A, PLXNA4, SLIT1, NYAP2, PPP1R12B
GO:0050804	modulation of chemical synaptic transmission	44	0.016485575121768452	2.853251304268429	2.5469926453779193e-11	3.4203281235597257e-08	7.46593222861761	3.078295311203753e-07	NPTN, BSN, GRIK1, JAK2, GRIA4, NLGN4X, DLGAP1, SYN3, GRID1, CACNA1B, LRP8, MAPK9, EPHA7, ARHGAP44, RTN4, NLGN1, GRM5, ADCY1, LRRC4C, FYN, AKAP7, STAU1, NXPH1, GRIA1, DGKE, SYN1, PXK, PRKN, PLPPR4, UBE3A, NRG3, PCDH8, CDKL5, DLGAP2, GRIA2, GRIK2, PPP3CA, PRKAR1B, BTBD9, TNR, CPLX2, PAFAH1B1, PTPRD, GRIN2A
GO:0007416	synapse assembly	28	0.01049082053203447	2.770114611253615	2.098928379014185e-07	7.335040450997645e-05	4.134597486783667	0.002536764838876544	SHANK2, ADGRL3, DSCAM, NLGN4X, CLSTN3, SLC25A46, NRXN1, KIRREL3, NLGN1, GPM6A, NLGN4Y, GRIA1, RYK, MAP1B, ADD2, NRCAM, CDH2, ERBB4, FARP1, PLXNA2, PLXNA4, GPHN, CAPRIN1, MAPT, DNER, DNM3, NRG3, PTEN
GO:0070936	protein K48-linked ubiquitination	34	0.012738853503184714	2.704839451047344	2.1706942570560753e-08	1.3117505395389863e-05	4.882148748498973	0.0002623501079077973	HUWE1, UBE2K, ANAPC10, KLHL3, RNF216, UBE2H, UBR4, UBE2D3, ZNRF2, NEDD4L, ANAPC5, UBE3C, HACE1, ASB3, TTC3, SKP1, MYCBP2, UBE2D2, ANAPC4, KBTBD6, ITCH, FBXO38, ANAPC1, PRKN, CDC27, UBE3A, UBE2E1, CUL3, UBR5, BTRC, UBE2E2, CDC16, UBE2E3, RFFL
GO:0017148	negative regulation of translation	32	0.011989509179467965	2.5722492818783564	2.1241636255578155e-07	7.335040450997645e-05	4.134597486783667	0.0025672641578491757	PAIP2, IREB2, CIRBP, PURB, CPEB3, CPEB1, HELZ, RBM4, CSNK2A1, NCL, ZNF540, LSM14A, GIGYF2, SAMD4A, SERBP1, XRN1, ILF3, PRKCA, FXR1, DDX6, LARP1, CNOT9, DAPK1, PURA, EPHA4, CELF4, SYNCRIP, EIF2AK2, PUS7, CAPRIN1, QKI, GAPDH
GO:0048511	rhythmic process	48	0.01798426376920195	2.5370129903457763	3.7211888127281655e-10	2.998285866042174e-07	6.523126962506398	4.497428799063261e-06	CSNK1E, HUWE1, AHR, ROCK2, PER3, OGT, CSNK2A1, USP9X, LGR4, MAPK9, CREB1, FBXW11, KDM2A, USP7, RORA, MYCBP2, PPARGC1A, NR1D2, NLGN1, ADCY1, PSPC1, MAPK10, MAPK8, MAGED1, DNM1L, FBXW7, SFPQ, NRIP1, HLF, UBE3A, CLOCK, CREBBP, PROX1, TARDBP, NCOA2, PRKDC, HNRNPD, ENOX1, KMT2A, BTRC, EP300, GSK3B, GPR176, NCOR1, PRKAA2, ATG7, SIRT1, HNRNPU
GO:0031175	neuron projection development	52	0.019482952416635443	2.5237162765598966	8.696636776603547e-11	9.555232007457317e-08	7.019758763518942	1.0510755208203047e-06	HDGFL3, MAP2, SH3GL2, ARFGEF1, GPRIN3, WASF1, MYH10, HMGB1, ROCK1, VAPA, NEDD4L, CNTNAP2, CNTNAP1, VPS13B, PTPRG, NRXN1, PTPRM, CNTN4, BICDL1, UBE4B, GPM6A, NLGN1, APP, ATXN10, TMEM108, CNTN1, BLOC1S6, EXT1, RYK, MAP4, FRY, MAP1B, CYFIP2, TBC1D24, LGI1, CDC27, RAB6A, HERC1, FRYL, RAPGEF2, TBC1D23, ERCC6, DOCK7, CD2AP, GSK3B, MAPT, RAPGEF6, PPP1R9A, LONRF2, CAMSAP1, CHL1, CAMSAP2
GO:0000209	protein polyubiquitination	50	0.018733608092918696	2.5218130214493693	2.0509822231487296e-10	1.906782396075042e-07	6.719698866249275	2.4788171148975546e-06	HUWE1, UBE2K, KLHL3, DZIP3, UBE2H, TAF1, UBE2D3, TNKS2, PIK3R1, UBE2V2, FBXW11, RMND5A, PELI2, UBE3C, TNKS, SKP1, CTNNB1, HLTF, UBE2D2, RC3H1, UBE2W, TRIP12, UBE3D, LNPEP, BIRC2, BCL2, UBE4B, TRIM2, SMURF1, RNF111, NPEPPS, KLHL42, WSB2, ITCH, SHPRH, PRKN, UBE2N, UBE3A, UBE2E1, CBL, CUL3, UBR5, HECTD2, FBXL17, BTRC, NFE2L1, SPOP, RNF180, TPP2, UBE2V1
GO:0006897	endocytosis	72	0.026976395653802922	2.4584329419722346	1.176048555801305e-13	2.0305318350592245e-10	9.692390197170168	1.4213722845414572e-09	CSNK1E, AAK1, HEATR5A, DENND1B, SGIP1, SH3GL2, USP33, LRP1B, LMBRD1, MYO5A, FCHO2, PIK3CB, FCHSD2, RNASEK, RUBCN, DNM1, GHR, SCAMP1, LRP8, MIB1, RABEP1, DPYSL2, PICALM, ABL1, DENND1A, SYNJ1, RABGEF1, CDC42, RAB7A, RAB5B, REPS1, LRP6, AP2A2, SORT1, APP, SH3KBP1, EHBP1, ATP9B, SNX10, ITSN1, MYO6, ANK2, FNBP1, MAGI2, AP2B1, DNM1L, ATP9A, SH3GLB1, EPS15, FNBP1L, EPN2, REPS2, CSNK1G3, C9orf72, ESYT2, SH3GL3, PACSIN1, RABGAP1L, CSNK1G1, HEATR5B, AMPH, EEA1, ITSN2, ZFYVE9, RAB5A, OCIAD1, DNER, GAPVD1, CLCN5, PIK3C3, DNM3, KCNQ3
GO:0001764	neuron migration	41	0.015361558636193332	2.396868649023014	5.367777325385831e-08	2.7031231981088818e-05	4.568134160353961	0.0006487495675461315	ASTN2, NDN, ADGRL3, MYH10, MARK1, CEP85L, ASTN1, USP9X, NTRK3, KIRREL3, ABI2, CTNNB1, NTRK2, AUTS2, BBS4, FGF13, GPM6A, FYN, BBS1, PCM1, HSP90AA1, MAP1B, NRCAM, APBB2, NAV1, FZD3, SEPTIN4, KIAA0319L, CDKL5, RAPGEF2, KIAA0319, MEF2C, LARGE1, NEO1, DCX, TOP2B, SDCCAG8, DNER, PAFAH1B1, SPOCK1, CHL1
GO:0006887	exocytosis	40	0.014986886474334956	2.374383952503098	9.766060220104396e-08	4.59520281008271e-05	4.337695316191675	0.0011803260382018173	EXOC6, ARFGEF1, SYTL5, MYH10, MICAL3, RAB3C, SRCIN1, SCAMP1, EXOC6B, EXOC2, RIMS1, ARHGAP44, EXOC1, EXOC4, RAPGEF4, RAB10, ITSN1, MIA3, RIMS2, SNAP25, RAB3B, PRSS12, CADPS, RAB8B, EXOC5, STXBP5, STXBP3, NSF, VAMP2, RAB27B, STXBP5L, SYTL2, SCAMP5, LIN7A, DNAJC5, STXBP1, CPLX2, KCNQ3, ARFGEF2, KCNB1
GO:0007411	axon guidance	58	0.021730985387785687	2.3311009117022605	3.2434627200961953e-10	2.80003503107733e-07	6.552836535190492	3.920049043508262e-06	NPTN, ARHGAP35, PTPRJ, USP33, NTN4, EPHA6, UNC5D, MYH10, DSCAM, ULK2, PTPRO, EPHA7, ROBO2, FLRT2, EFNB2, EVL, SEMA4D, EFNA5, NRXN1, MYCBP2, PGRMC1, CNTN4, SEMA5A, KIF5C, ENAH, ROBO1, FEZ1, FYN, CNTN1, SMAD4, UNC5C, ETV1, NFASC, EXT1, RYK, CNTN6, LGI1, CYFIP2, NRCAM, APBB2, KALRN, TUBB3, NRXN3, SEMA5B, TRIO, KIF5A, EPHA4, SOS1, DSCAML1, NEO1, PLXNA4, SLIT1, TNR, CRPPA, PALLD, CHL1, ABLIM1, PTK2
GO:0000226	microtubule cytoskeleton organization	43	0.01611090295991008	2.257279982056517	1.6951161852397787e-07	6.63422321711155e-05	4.178209920165206	0.0020487174214807967	TTLL7, MAP2, RANBP10, TTBK2, MARK1, SIK3, SON, DST, PARD3, KIF2A, GABARAP, SPATA7, EML4, BBS4, FER, MID1, TAOK1, CLASP2, BBS1, RNF19A, MAP4, TTLL11, MAP1B, NAV3, ATXN7, CLASP1, MARK3, TUBB3, DCLK2, CDK5RAP2, DYNC1LI1, TBCD, CAMSAP1, TOGARAM1, DOCK7, MAP7, TBCEL, CDC14B, MAPT, PAFAH1B1, CAMSAP2, ULK4, GAPDH
GO:0007417	central nervous system development	45	0.016860247283626825	2.240346148732762	1.0265755581782493e-07	4.595256368941601e-05	4.33769025435169	0.0012407192196142321	SH3GL2, GRIK1, NDN, SHC3, RPS6KA6, DSCAM, ZBTB16, MBP, ROBO2, CNTNAP2, CNTNAP1, HTT, ALDH5A1, BTD, VPS13B, APLP2, MSI2, APP, GABRA4, IL1RAPL2, CHD7, CNTN6, HPCAL4, PRKN, ARNT2, NRCAM, RNF103, HAPLN1, NCKAP1, SH3GL3, DCLK2, PROX1, SOX6, SPTBN1, DCLK1, ADAM22, ADAM23, DSCAML1, WWP1, DCX, JARID2, ZEB2, DNER, MARCKSL1, PTEN
GO:0006511	ubiquitin-dependent protein catabolic process	74	0.02772573997751967	2.230622424128887	1.2737890182981114e-11	1.9243767593938717e-08	7.715709896691498	1.5395014075150974e-07	HUWE1, UBQLN1, NDFIP1, UBE2K, PSMA6, KLHL3, UBE2H, USP33, RLIM, TAF1, FBXO10, ARRB1, UBR4, UBE2D3, RBBP6, RNF217, UBE2Z, PSMD14, NEDD4L, FBXW11, UBE3C, UBR2, HACE1, MIB1, ATE1, TTC3, SKP1, UBE2D2, RC3H1, KLHL8, PSMD11, TRIP12, ANKIB1, UBE4B, SMURF1, HERC4, RNF111, UCHL1, TRPC4AP, ITCH, RNF19A, FBXW4, ARIH1, HERC6, PRKN, HECW2, UBE2N, RNF144B, UBE3A, HECTD1, FAF1, UBE2E1, RNF130, CUL3, FBXO11, COP1, HERC3, CBL, UBR1, RNF11, CNOT4, PSMA1, WWP1, UBR3, RNF144A, FBXL2, BTRC, FBXO8, SMURF2, RFFL, UBA6, RNF150, RNF13, HECW1
GO:0007010	cytoskeleton organization	50	0.018733608092918696	2.1084010507199644	1.8426682188528385e-07	6.959527529079815e-05	4.157420242929438	0.0022270488093055407	PHIP, RANBP10, DMD, DIAPH1, ZMYM6, MARK1, MICAL3, SEPTIN2, MICAL2, DST, CNTNAP1, PRPF40A, DPYSL2, TNIK, CAP2, MAST4, PCLO, ZRANB1, ABI2, CTNNA2, SH3KBP1, BRWD3, MAPKAP1, RANBP9, SORBS1, CAPZB, MAST2, ZMYM4, ANK3, FMNL2, CDC42BPA, PACSIN1, ADD1, NAA25, ABLIM3, LARGE1, SH3D19, CCDC6, RICTOR, MAP3K20, PAK5, BRWD1, SEPTIN3, PALLD, SEPTIN7, PDZD8, CAMSAP1, SORBS2, ABLIM1, SEPTIN6
GO:0006468	protein phosphorylation	66	0.024728362682652678	2.095906822271253	3.310873615021351e-09	2.500951156946753e-06	5.601894789867114	4.001521851114805e-05	CSNK1E, AAK1, ROCK2, MAP3K9, TBCK, JAK1, MARK1, CSNK1A1, SIK3, CAMK2D, NLK, NEK10, MAPK9, CREB1, HIPK2, NUAK1, TNIK, TAOK3, NEK1, TLK1, PPP3CB, STK39, BIRC6, CAMK4, YWHAZ, PKN2, FER, MAPK10, MAPK8, HIPK3, SGK1, SNRK, MAST2, RYK, MERTK, RAF1, TNNI3K, PAK2, PRKCA, PXK, WNK1, SRPK2, TLK2, BRAF, KALRN, MARK3, MAP4K4, CDC42BPA, DAPK1, DYRK1A, DCLK1, STRADA, SIK2, PRKDC, CDK17, MAPK1, PRKACB, MAP3K20, MAP4K3, MAML1, PPP4R1, MAP3K13, EIF2AK2, GSK3B, COPS2, ILF3
GO:0007399	nervous system development	169	0.06331959535406519	2.0377037279880104	1.618166110992617e-20	6.519051872485591e-17	16.1858155632389	1.955715561745677e-16	NPTN, CRMP1, RBFOX3, DCTN1, SDC2, DSCAM, NRG2, SPAST, PCSK2, VPS13B, BTBD3, NAV2, NTRK2, CNTN4, ST8SIA4, FGF13, NLGN1, TMEM14B, RBM45, FEZ1, GLRB, ZSWIM6, NOVA2, GABRB3, NUMB, DIP2A, NRXN3, SRGAP3, PURA, DCLK1, LSAMP, DSCAML1, KIAA0319, SRGAP2C, LHX6, DOCK7, SCN3B, EP300, ITM2B, NEXMIF, LRP6, CHL1, PTEN, EP400, TTLL7, CRIM1, SRGAP2B, GRIK1, ARID1B, DIP2B, SMARCC1, EVL, GPM6B, FGF14, EFNA5, SCN2A, CTNNB1, DLG3, ALK, GPM6A, CIT, NAP1L1, BRINP2, RAPGEF5, MAGI2, TRAPPC6B, MERTK, MAP1B, PHACTR4, NAV1, ERCC6, DCX, PCDH10, PLXNA2, PLXNA4, SLIT1, CAPRIN1, CPLX2, PPP1R9A, PTPRD, DPF3, RBFOX1, ROBO1, NRG3, TBC1D23, MBD5, MTR, TRPC5, TCF12, TENM1, ROBO2, INA, TMOD2, EPHA7, HDAC4, CNTNAP1, EFNB2, DPYSL2, KIF2A, KIDINS220, RAP1A, SEMA4D, NTRK3, NRXN1, ABI2, SMARCA2, CDC42, ARHGEF7, FGF12, CAMK1D, MYT1L, IL1RAPL2, NOVA1, PHF10, ATXN10, BMPR1A, ELAVL3, VPS13A, MBNL1, ERBB4, FZD3, RBFOX2, SEMA5B, DYRK1A, FBXL17, MEF2C, SRGAP2, DLG2, GSK3B, ZEB2, MEF2A, PAFAH1B1, USP33, CNTNAP4, APBA1, CHN1, ACVR1B, ULK2, SMARCE1, CNTNAP2, TNIK, ARID1A, APBA2, GAS7, SEMA5A, ZMYND8, BICDL1, RTN4, CABLES1, RUFY3, ADNP2, LGI1, ADGRG6, CNTNAP5, IGF1, PRKD1, NAV3, KALRN, FGF2, TSC1, EPHA4, RAPGEF2, TCF4, MDGA2, DLG1, TNR, DNER, WDPCP, SPOCK1
GO:0015031	protein transport	175	0.06556762832521544	2.0368489788629525	3.8031960385478686e-21	2.298271366094477e-17	16.63859869373326	4.596542732188954e-17	ASTN2, NUP42, DENND1B, BBS5, MYO5A, TNPO1, FCHSD2, SCAMP1, ARF3, XPO6, SNX14, KIF3A, ATG4C, RAB2B, TNKS, VTA1, RAB7A, APPBP2, NAPB, SENP2, SNX10, XPO4, MYO6, COG3, NUP93, CADPS, SEC23A, CASK, RAB6A, SCFD2, RABGAP1L, PGAP1, SNX3, RAB21, TMEM9, DNAJC15, DENND4C, GOPC, TIMM23B, ARFGEF2, SAR1B, SCFD1, GCC2, ARFGEF1, TMED7, AFTPH, C2CD5, ARL8B, PIK3R1, RAB3C, EXOC6B, RABEP1, GABARAP, NUP54, SNAP91, GPM6B, COG5, DENND1A, DOP1B, EHBP1, SEC31B, KPNA4, RAB8B, EPS15, VPS50, LYST, SNX2, SEC31A, STXBP5, FMN2, HEATR5B, IPO8, VPS35L, AP4E1, RAB3IP, CCDC93, CD2AP, BLZF1, ATG7, AHCTF1, IER3IP1, SNX13, AP3S2, SEC63, STX16, ARRB1, BBS9, HOOK3, PEX14, AP5M1, COPB1, XPO1, KPNA1, DOP1A, STAM, SNX4, VPS8, EXOC1, DENND10, AP2A2, RANBP17, KPNA3, RAB2A, ITSN1, RPH3A, BBS1, SEC22B, STX12, AP2B1, GOLPH3, MON2, BCAP29, FRMPD1, EXOC5, SEC62, KPNA5, VPS54, TSG101, STXBP3, STXBP5L, SCAMP5, DNAJC13, DENND2A, LIN7A, VTI1B, AGAP1, STXBP1, UBAP1, ERC1, SNX27, VTI1A, CCDC91, KCNQ3, EXOC6, TMED5, STX18, SNX7, RAB11FIP2, SPIRE1, LRP1B, APBA1, COPG2, MTX2, VPS45, ZMAT3, AP3S1, IPO9, EXOC2, IPO7, APBA2, RABGEF1, RAB5B, EXOC4, BBS4, RBSN, NBAS, RAB10, VPS41, NUP153, ANK2, BBS7, MIA3, RAB3B, SNX25, TBC1D5, VAMP2, XPO7, NSF, GBF1, TRAM1, COG6, ATG10, RAB5A, STAM2, SEC24B
GO:0007268	chemical synaptic transmission	61	0.02285500187336081	1.9695465212708754	1.6084807794627866e-07	6.63422321711155e-05	4.178209920165206	0.0019440098700587239	SLC12A5, BSN, GRIK1, APBA1, KCND3, CACNB2, MBP, GABBR2, DLGAP1, SYN3, CACNA1B, LRP8, GABRB2, GABARAP, RPS6KA2, SYT1, CACNB4, SLITRK5, NRXN1, CTNNB1, APBA2, DTNA, DLG3, EXOC4, FGF12, SYN2, GRM5, APP, CDH8, GLRB, SNCB, SLC6A1, GRIA1, SYN1, SPG11, GAD2, AP2B1, SNAP25, HOMER1, GABRB3, KCNIP1, GAD1, PCDH8, AMPH, KIF5A, GRIK2, AKAP9, GRIN2B, MAPK1, PRKAR1B, LARGE1, KCND2, DLG2, DLG1, GPR176, GLS, GABRG2, PAFAH1B1, LRP6, GRIN2A, KCNQ3
GO:0006886	intracellular protein transport	70	0.026227051330086175	1.9430660042966004	2.584286224457802e-08	1.4197128776725907e-05	4.847799478328761	0.00031233683308796995	EXOC6, SAR1B, TMED5, SCFD1, STX18, TMED7, COPG2, STX16, RAB3GAP2, SYTL5, APBA1, ARL4C, VPS45, CHM, TNPO1, AP3S1, COPB1, XPO1, ARF3, EXOC6B, IPO9, XPO6, ARL5A, IPO7, ARFIP1, RIMS1, TLK1, MYRIP, RAB5B, APPBP2, NAPB, AP2A2, RANBP17, VPS41, SNX10, MYO6, RPH3A, COG3, RIMS2, STX12, SPG11, AP2B1, SNX2, BCAP29, SEC23A, RAB6A, SCFD2, STXBP3, NSF, XPO7, AP4E1, IPO8, SYTL2, HERC2, LARGE1, PDCD6, RAB5A, FAM91A1, CLTC, STXBP1, RAB21, VTI1B, DNAJC15, SNX27, RFFL, STX7, VTI1A, SEC24B, SNX13, AP3S2
GO:0016567	protein ubiquitination	133	0.04983139752716373	1.936466912206536	1.785820291284459e-14	3.597237340077329e-11	10.444030907167459	2.1583424040463973e-10	UBE2K, MED17, KLHL3, RNF216, RNF138, FBXO10, UBR4, UBE2D3, ZNRF2, UBR2, HACE1, DCAF8, TTC3, DCAF7, USP7, UBE2W, APPBP2, UBE4B, TRIM2, RNF157, TRPC4AP, CDC27, RNF103, HECW2, UBE2N, HERC1, HECTD1, RNF130, KLHL2, HERC2, PCMTD1, UBR3, UBE2E2, RFFL, COP1, DZIP3, UHRF2, FANCL, PCNP, WDSUB1, ZBTB16, ANAPC5, MIB1, TRIM37, MYCBP2, KLHL8, ZFP91, ANKIB1, G2E3, WSB2, KBTBD6, DCAF10, PDZRN3, SHPRH, KLHL12, CUL3, TRIM13, UBR1, CNOT4, HECTD2, WWP1, FBXL2, RNF144A, RNF38, CDC16, UBE2E3, UBA6, SMURF2, RNF13, HECW1, RNF180, HUWE1, KLHL7, CAND1, UBE2H, RLIM, ARRB1, RNF217, UBE2Z, RBBP6, UBE2V2, TRIM33, PELI2, UBE3C, SKP1, KLHDC1, HLTF, UBE2D2, TRIP12, UBE3D, ANAPC4, RNF111, ARIH1, KLHL24, HERC6, ANAPC1, PRKN, UBE2E1, DCAF17, FBXO11, FBXL17, FEM1B, BTRC, KLHL42, HECTD4, ANAPC10, TRIM9, DCAF6, NEDD4L, USP9X, FBXW11, ASB3, RC3H1, BIRC6, DCAF5, RNF10, SMURF1, HERC4, ITCH, FBXL5, RNF19A, FBXO38, FBXW7, KLHL13, UBE3A, RNF144B, PJA2, HERC3, CBL, UBR5, SPOP, SH3RF3, SIRT1
GO:0006338	chromatin remodeling	79	0.02959910078681154	1.870009447255124	2.4910836888426506e-08	1.4197128776725907e-05	4.847799478328761	0.00030107237463352276	TAF1, USP16, WAC, HNRNPC, PRMT3, ARID2, KDM2B, MIER1, PRKCA, KMT5B, CREBBP, EP300, BICRAL, JAK2, ARID1B, PRDM2, SETD7, SMARCC1, UTY, MLLT10, ATRX, NIPBL, KAT14, KDM4C, CHD6, TP53BP1, GATAD2B, SMARCAD1, SFPQ, BRPF3, RERE, ERCC6, RSBN1, JARID2, DPF3, USP22, HUWE1, RYBP, CHD2, HCFC2, CFDP1, DEK, HDAC4, RSF1, SKP1, SETD5, HLTF, SMARCA2, PHF10, CHD7, CLOCK, DYRK1A, USP49, BAZ2B, PRKAA2, HMGB1, SF3B1, SMARCE1, ASH1L, PSIP1, PWWP2A, KDM2A, NCOA3, ARID1A, JMJD1C, NSD3, MYSM1, KDM1A, JADE3, PHF8, RBBP4, CHD4, INO80D, KMT2C, PRKDC, KDM4A, SETBP1, KDM5D, JADE1
GO:0006325	chromatin organization	106	0.03971524915698764	1.8675234512267522	1.2827947207419017e-10	1.2919880829072186e-07	6.888741492185752	1.5503856994886623e-06	PHIP, PHF21A, TAF1, EPC2, USP16, OGT, WAC, SETD2, NR3C1, PHF14, ARID2, EPC1, TAF3, KDM2B, TET2, KMT5B, SUZ12, L3MBTL1, NUCKS1, PYGO1, CABIN1, MLLT3, EP400, ARID4B, BABAM2, KMT2E, JAK2, ARID1B, UBN2, CTR9, SETD7, HDAC5, SMARCC1, ZMYND11, PTMA, SMYD3, UTY, ATRX, TLK1, ZNF618, KDM4C, ASXL1, CHD6, MORF4L1, TP53BP1, KAT6A, SMARCAD1, HDAC9, BRPF3, RSBN1, JARID2, KMT2A, FAM47E, SMCHD1, DPF3, IER3IP1, USP22, CHD2, DEK, HDAC4, RSF1, AEBP2, KAT6B, SETD5, HLTF, CHD7, ASH2L, SPIN1, PWWP3A, USP49, NCOR1, PRKAA2, MORF4L2, TBL1XR1, HNRNPU, HDAC8, HMGB1, ZNF518A, ARID4A, SMARCE1, ASH1L, KANSL1, KDM2A, ARID1A, JMJD1C, NSD3, ZMYND8, MYSM1, KDM1A, KAT7, PHF8, RBBP4, CTCF, CHD4, TLK2, CHD9, FGF2, KMT2C, SAFB, SFMBT1, ZCWPW2, KDM4A, APBB1, KDM5D, L3MBTL4, SIRT1
GO:0043161	proteasome-mediated ubiquitin-dependent protein catabolic process	80	0.029973772948669913	1.8373209156273975	4.27820360804746e-08	2.2481029916026782e-05	4.648183796457007	0.000517063688068616	PSMA6, RANBP10, KLHL3, RNF216, UBR4, UBE2D3, ZNRF2, UBR2, UBE2W, PSMD11, APPBP2, UBE4B, ARMC8, TRIM2, UBE2N, KLHL2, HERC2, RFFL, COP1, PCNP, MYCBP2, CTNNB1, KLHL8, WDR26, KLHL32, KBTBD6, UBXN2B, SH3BGRL, KLHL12, FAF1, CUL3, TRIM13, UBR1, WWP1, KLHL5, SMURF2, HUWE1, KLHL7, UBE2H, ARRB1, CSNK1A1, SKP1, TRIP12, BIRC2, UBE3D, MKLN1, PCBP2, KLHL24, PRKN, CLOCK, FBXO11, FBXL17, FEM1B, BTRC, GSK3B, PSMD12, KLHL42, TBL1XR1, NDFIP1, TRIM9, RNF145, PSMD14, NEDD4L, FBXW11, RMND5A, SMURF1, KLHL23, RANBP9, UCHL1, ITCH, FBXW7, KLHL13, PPP2R5C, UBE3A, PJA2, UBR5, PSMA1, SPOP, ZYG11B, SIRT1
GO:0016192	vesicle-mediated transport	80	0.029973772948669913	1.7945925222407138	1.5018157514133908e-07	6.482480418422228e-05	4.188258786426566	0.001815094517158224	MYO5A, CHM, IQSEC1, SYT11, ARF3, VPS13B, RAB2B, NAPB, SEC23A, RAB6A, SCFD2, KIF16B, SYT13, FBXO8, TVP23C, GAPVD1, LRP6, SAR1B, SCFD1, ARFGEF1, SYT17, NCALD, RABEP1, SYT1, MAPK8IP3, SEC31B, RTN3, KLHL12, SEC31A, FMN2, BORCS7, CUL3, AP4E1, CYTH1, BLZF1, ERGIC2, TBC1D23, AP3S2, STX16, AP5M1, COPB1, PICALM, ARL5A, OSBPL1A, AP2A2, SPAG9, RAB2A, SEC22B, KIF1B, STX12, AP2B1, BCAP29, SEC24B, STXBP3, SPTBN1, VTI1B, STXBP1, VTI1A, UVRAG, STX18, RAB11FIP2, COPG2, SPIRE1, VPS45, AP3S1, RABGEF1, RAB10, VPS41, CYTH3, MIA3, KALRN, VAMP2, GOLGA4, NSF, SYTL2, KIF5A, ARFGEF3, TRAPPC8, CLTC, STX7
GO:0006974	DNA damage response	122	0.04571000374672162	1.5983756148853625	9.885427193624894e-08	4.59520281008271e-05	4.337695316191675	0.0011947527306215046	RAD50, PSMA6, NFAT5, ERCC6L2, RNF138, TAF1, UBE2D3, EPC2, USP16, WAC, IMMP2L, HIPK2, SETD2, CDK6, USP7, UBE2W, DCUN1D5, POGZ, PSME4, BCL2, NBN, TAOK1, WNK1, UBE2N, CDC5L, HERC2, NUCKS1, PARG, MCTS1, UBE2E2, ERCC5, FOXP1, SPIDR, ASCC3, BABAM2, FANCL, SETD7, CSNK2A1, NUAK1, ZBTB4, ABL1, ATRX, CEP63, RIF1, TLK1, INTS7, NIPBL, CBX5, MORF4L1, SHLD2, DELE1, SGK1, TP53BP1, SMARCAD1, JMY, SHPRH, SFPQ, SMC5, FMN2, USP1, RAD51D, PPP4R3B, WRN, ERCC6, ATF2, SLF2, UBA6, SMCHD1, ZBTB38, HUWE1, NCOA6, BCLAF1, CHD2, RBBP6, REV3L, PARP1, HLTF, USP10, TRIP12, PIAS1, RNF111, SMG1, ASH2L, PMS2, PWWP3A, CLOCK, NSMCE2, XRCC5, METTL14, MAPT, UVRAG, MORF4L2, CDC14B, USP47, GTF2H1, ZMAT3, HMGB1, PSMD14, TAOK3, WRNIP1, MSH2, KAT7, XIAP, MCM9, RBBP4, MACROD2, STXBP4, FBXW7, MAPK14, TLK2, CBL, CRADD, INO80D, UBR5, PSMA1, PRKDC, MAPK1, MSH3, REV1, APBB1, MTREX, SIRT1
GO:0007186	G protein-coupled receptor signaling pathway	55	0.020606968902210566	0.42399713437555325	2.0904677139539277e-15	5.053078558169434e-12	11.296443949908555	2.526539279084717e-11	ARHGEF11, GNG4, RGS12, OPN3, ADGRL3, TAFA5, TACR1, RIC8B, PIK3CB, PDE3B, GNB5, GABBR2, LGR4, CALM2, GPR83, CALM1, RGS7, PLCB4, GRK3, APLP2, GPR63, SORT1, RAPGEF4, APP, GRM5, GNAQ, GNAS, FRS2, GNB4, GPR19, ADGRL2, CNR1, TAPT1, ADGRG6, RGS7BP, ADRA1A, PLPPR4, GNB1, FZD3, CALM3, GNAO1, GNA13, RGS17, GNAI1, GABBR1, GNAI3, ADGRB3, RAPGEF2, ECE2, ARHGEF12, GPR176, LANCL1, PDE4A, PLCB1, PDE3A
GO:0006955	immune response	15	0.005620082427875608	0.2769167887189618	4.8734034836258337e-11	5.8899954503101826e-08	7.2298850406808	5.889995450310183e-07	SEMA4D, BMPR1A, PIK3R3, IL1RAP, IGF1R, LYST, CERT1, HMGB1, ITGB8, TCF12, PIK3R1, MBP, TENM1, DPP8, STXBP3
GO:0007608	sensory perception of smell	6	0.0022480329711502436	0.1064379013191044	7.863558795163143e-19	2.3759742899585436e-15	14.624158263097218	9.503897159834175e-15	BBS1, UBR3, RIC8B, BBS4, PDE4A, GNAS
GO:0050911	detection of chemical stimulus involved in sensory perception of smell	0	0.0	0.0	2.169360801032779e-25	2.6218894641282167e-21	20.58138562162041	2.6218894641282167e-21	
