GO_ID	Name	Gene Count	Gene Ratio	Fold Enrichment	p-value	FDR	-log10 FDR	FWER	Associated Genes
HP:0000915	Pectus excavatum of inferior sternum	6	0.0033651149747616375	11.551318003365115	4.1770501921792393e-07	1.9355547444571097e-05	4.7131945407596945	0.004296931532694784	SOS1, MAP2K1, PTPN11, BRAF, NF1, FBXO11
HP:0001112	Leber optic atrophy	8	0.00448681996634885	9.241054402692091	1.1931715752843447e-07	6.1065452711194294e-06	5.214204418893344	0.0012274155994950054	MT-ATP6, MT-ND4L, MT-CO3, MT-ND1, MT-ND4, MT-ND2, MT-CYB, MT-ND5
HP:0012429	Aplasia/Hypoplasia of the cerebral white matter	7	0.003925967470555244	8.984358447061757	1.1093867150197906e-06	4.601718200567978e-05	4.33707998012316	0.011412261137408586	MT-CO1, MT-CO2, MT-CO3, MT-ND1, MT-ND4, ZEB2, MT-ND5
HP:0000576	Centrocecal scotoma	10	0.005608524957936063	8.88562923335778	5.17447510603357e-09	3.671022442466713e-07	6.435212960467503	5.322982541576733e-05	MT-CO1, MT-ATP6, MT-ND4L, OPA1, MT-CO3, MT-ND1, MT-ND4, MT-ND2, MT-CYB, MT-ND5
HP:0004309	Ventricular preexcitation	10	0.005608524957936063	8.88562923335778	5.17447510603357e-09	3.671022442466713e-07	6.435212960467503	5.322982541576733e-05	MT-CO1, MT-ATP6, MT-ND4L, MT-CO3, MT-ND1, MT-ND4, MT-ND2, PRKAG2, MT-CYB, MT-ND5
HP:0032036	Reduced contrast sensitivity	9	0.005047672462142457	8.663488502523837	4.6304918239393584e-08	2.6760600782507966e-06	5.572504140769715	0.0004763386939286418	MT-CO1, MT-ATP6, MT-ND4L, MT-CO3, MT-ND1, MT-ND4, MT-ND2, MT-CYB, MT-ND5
HP:0007768	Central retinal vessel vascular tortuosity	9	0.005047672462142457	8.663488502523837	4.6304918239393584e-08	2.6760600782507966e-06	5.572504140769715	0.0004763386939286418	MT-ATP6, NEK1, MT-ND4L, MT-CO3, MT-ND1, MT-ND4, MT-ND2, MT-CYB, MT-ND5
HP:0200125	Mitochondrial respiratory chain defects	12	0.006730229949523275	7.2955692652832305	4.839926009327379e-09	3.506219637883855e-07	6.455160882157437	4.978831885795075e-05	CAMKMT, MT-CO1, MT-ATP6, PREPL, MT-ND4L, MT-CO3, MT-ND1, MT-ND4, MT-ND2, MT-CYB, PPM1B, MT-ND5
HP:0020120	Retinal nerve fiber edema	9	0.005047672462142457	6.930790802019069	8.275457770941185e-07	3.561909376136903e-05	4.448317134267594	0.008512963408967197	MT-CO1, MT-ATP6, MT-ND4L, MT-CO3, MT-ND1, MT-ND4, MT-ND2, MT-CYB, MT-ND5
HP:0100033	Tics	9	0.005047672462142457	6.497616376892877	1.7455705177260855e-06	6.893122091410131e-05	4.16158402918663	0.017956683915848242	SPTBN1, FRYL, ZSWIM6, GATAD2B, MAPK1, VPS13A, ZBTB20, ARID2, ACBD6
HP:0025268	Stuttering	10	0.005608524957936063	6.417398890758398	5.274030717955461e-07	2.3691682967514337e-05	4.625404087544699	0.005425395399560782	MT-CO1, KANSL1, MT-CO2, MT-CO3, MT-ND1, MT-ND4, MAPT, NEXMIF, NSD1, MT-ND5
HP:0007270	Atypical absence seizure	19	0.01065619742007852	6.096528946220478	1.2022024198497352e-11	1.2124564993131594e-09	8.916333834125416	1.2367056292994225e-07	CHD2, CEP85L, KCNMA1, DNM1, CACNB4, SCN2A, MAPK10, KCNT2, FRRS1L, EIF4A2, GABRB3, UBE3A, CACNA1A, PPP3CA, ZEB2, GABRG2, PAFAH1B1, HNRNPU, KCNB1
HP:0007763	Retinal telangiectasia	11	0.0061693774537296695	6.050690382715061	3.0917312507127053e-07	1.472437008151926e-05	4.831963275554233	0.00318046393760816	MT-CO1, SETD2, MT-ATP6, SMAD4, MT-ND4L, MT-CO3, MT-ND1, MT-ND4, MT-ND2, MT-CYB, MT-ND5
HP:0000234	Abnormality of the head	14	0.007851934941110488	5.775659001682557	1.5812570973214902e-08	1.0166494850091356e-06	5.992828755007738	0.0001626639176014617	RPS27, RPL5, RPL35, RPS19, CDC73, RPS28, RPS29, RPL27, RPS20, RPL18, RPL26, RPS17, RPL8, RPL9
HP:0020118	Radial artery aplasia	13	0.007291082445316881	5.775659001682557	5.209940102591272e-08	2.9447611997448576e-06	5.530949917799816	0.0005359465383535641	RPS27, RPL5, RPL35, RPS19, RPS28, RPS29, RPL27, RPS20, RPL18, RPL26, RPS17, RPL8, RPL9
HP:0030270	Elevated red cell adenosine deaminase activity	13	0.007291082445316881	5.775659001682557	5.209940102591272e-08	2.9447611997448576e-06	5.530949917799816	0.0005359465383535641	RPS27, RPL5, RPL35, RPS19, RPS28, RPS29, RPL27, RPS20, RPL18, RPL26, RPS17, RPL8, RPL9
HP:0001227	Abnormality of the thenar eminence	13	0.007291082445316881	5.775659001682557	5.209940102591272e-08	2.9447611997448576e-06	5.530949917799816	0.0005359465383535641	RPS27, RPL5, RPL35, RPS19, RPS28, RPS29, RPL27, RPS20, RPL18, RPL26, RPS17, RPL8, RPL9
HP:0012133	Erythroid hypoplasia	15	0.008412787436904094	5.5893474209831195	8.57017616169292e-09	5.724766375021757e-07	6.242242231976575	8.816140217533507e-05	RPS27, RPL5, RPL35, RPS14, RPS19, RPS28, RPS29, RPL27, RPS20, RPL18, TET2, RPL26, RPS17, RPL8, RPL9
HP:0003763	Bruxism	19	0.01065619742007852	5.48687605159843	1.3085476031879644e-10	1.0943926173979341e-08	7.96082684529698	1.346102919399459e-06	MBD5, CAMK2B, CACNA1B, HTT, ADNP, AFF3, CERT1, MECP2, MYT1L, ITPR1, VPS13A, ANK3, CDKL5, SPTBN1, HNRNPK, CACNA2D1, ZEB2, ATG7, NEXMIF
HP:0002883	Hyperventilation	16	0.0089736399326977	5.43591435452476	4.541722757709742e-09	3.337193000611437e-07	6.476618675971297	4.6720702008560115e-05	MT-ATP6, SYT1, CAMK2B, TCF4, NRXN1, MT-ND1, GABRB3, HLCS, MT-ND4, MT-ND2, TLK2, GABRG2, MT-ND3, CNTNAP2, CDKL5, MT-ND5
HP:0031546	Cardiac conduction abnormality	13	0.007291082445316881	5.363111930133803	1.589603807264692e-07	7.937987555986354e-06	5.100289586251568	0.0016352254365331886	MT-CO1, MT-ATP6, MT-CO2, SCN2A, MT-CO3, MT-ND1, MT-ND4, MT-ND2, SLC1A3, MT-ND3, CREBBP, CACNA1A, MT-ND5
HP:0005532	Macrocytic dyserythropoietic anemia	13	0.007291082445316881	5.363111930133803	1.589603807264692e-07	7.937987555986354e-06	5.100289586251568	0.0016352254365331886	RPS27, RPL5, RPL35, RPS19, RPS28, RPS29, RPL27, RPS20, RPL18, RPL26, RPS17, RPL8, RPL9
HP:0032792	Tonic seizure	37	0.02075154234436343	5.149382724391677	3.3624326728845553e-18	9.102459185779848e-16	15.040841259708529	3.458934490596342e-14	ARFGEF1, CHD2, CEP85L, DNM1, CACNA1B, CNTNAP2, ADNP, GLUL, SCN2A, SYNJ1, FGF12, ATP6V0A1, MECP2, SLC25A12, GABRA5, KCNT2, PSAP, KCNQ5, VPS53, PHACTR1, GNB1, CUL3, NSF, SCN8A, CACNA1A, DMXL2, GRIA2, GRIK2, PPP3CA, ATP6V0C, DOCK7, ST3GAL3, GABRG2, PLCB1, NEXMIF, TBL1XR1, HNRNPU
HP:0004324	Increased body weight	15	0.008412787436904094	5.096169707366962	4.119962501865786e-08	2.421831671811048e-06	5.615856045562942	0.00042382054256693343	CFH, PHIP, ATRX, CTNNB1, NR3C1, THRB, PRKACA, CFI, PRKAR1A, BRAF, USP48, PHKB, THRA, NSD1, GNAS
HP:0011443	Abnormality of coordination	24	0.01346045989904655	5.04057512874114	4.7852214435724315e-12	5.293072364519312e-10	9.276292168488123	4.92255729900296e-08	DNM1, CACNA1B, GABRB2, SYNJ1, NTRK2, SLC1A2, FGF12, SCN3A, MYT1L, GABRA5, CNKSR2, CYFIP2, GABRA2, CACNA1A, SCN8A, WWOX, PPP3CA, CLTC, CACNA2D1, YWHAG, GABRG2, CELF2, CDK19, KCNB1
HP:0010844	EEG with multifocal slow activity	23	0.012899607403252944	5.01283611466788	1.5318265841083297e-11	1.5298932107497466e-09	8.815338882646916	1.5757900070722387e-07	DNM1, CACNA1B, GABRB2, SYNJ1, NTRK2, SLC1A2, FGF12, SCN3A, GABRA5, CNKSR2, CYFIP2, GABRA2, CACNA1A, SCN8A, WWOX, PPP3CA, CLTC, CACNA2D1, YWHAG, GABRG2, CELF2, CDK19, KCNB1
HP:0012410	Pure red cell aplasia	13	0.007291082445316881	5.005571134791549	4.309864130540921e-07	1.979266621021181e-05	4.7034956993565595	0.0044335572310874455	RPS27, RPL5, RPL35, RPS19, RPS28, RPS29, RPL27, RPS20, RPL18, RPL26, RPS17, RPL8, RPL9
HP:0002669	Osteosarcoma	16	0.0089736399326977	4.995164541995726	2.0636134240674843e-08	1.3029117554265048e-06	5.885084997510071	0.0002122839129338221	RPS27, RPL5, WRN, RPL35, RB1, RPS19, RPS28, RPS29, RPL27, RPS20, RPL18, RPL26, RPS17, RPL8, MTAP, RPL9
HP:0010794	Impaired visuospatial constructive cognition	12	0.006730229949523275	4.950564858585049	1.3934889966440927e-06	5.697789483369558e-05	4.244293600709019	0.014334821308477783	MT-CO1, BPTF, MT-CO2, MT-CO3, MT-ND1, GABRB3, MT-ND4, GABRG2, MAPT, NF1, HTT, MT-ND5
HP:0012547	Abnormal involuntary eye movements	28	0.015703869882220976	4.8274164790182565	2.990259291059116e-13	3.7976292996450775e-11	10.420487430587913	3.076079732712513e-09	TBCK, DNM1, CACNA1B, HTT, GABRB2, SCN2A, SYNJ1, NTRK2, SLC1A2, FGF12, SCN3A, GABRA5, CNKSR2, CYFIP2, SLC1A3, GABRA2, CACNA1A, SCN8A, WWOX, PPP3CA, CLTC, CACNA2D1, YWHAG, KIF21A, GABRG2, CELF2, CDK19, KCNB1
HP:0040276	Adenocarcinoma of the colon	15	0.008412787436904094	4.813049168068798	1.0461006941277928e-07	5.54702981468691e-06	5.255939499828897	0.0010761237840492604	APC, RPS27, RPL5, RPL35, BMPR1A, RPS19, RPS28, RPS29, RPL27, RPS20, RPL18, RPL26, RPS17, RPL8, RPL9
HP:0001895	Normochromic anemia	16	0.0089736399326977	4.739002257790816	5.1122547169743283e-08	2.9379756577382635e-06	5.5319518068281806	0.0005258976427351492	RPS27, RPL5, RPL35, RPS19, SCARB2, RPS28, RPS29, SF3B1, RPS20, RPL27, RPL18, TET2, RPL26, RPS17, RPL8, RPL9
HP:0010819	Atonic seizure	39	0.021873247335950644	4.692722938867078	2.1568854377509978e-17	4.823452282205329e-15	14.316642013538061	2.2187880498144515e-13	CAMK2B, COX8A, ARFGEF1, CHD2, CEP85L, DNM1, CSNK2A1, ADGRV1, CNTNAP2, SCN2A, CTNNA2, ACBD6, FGF13, AKT3, MAPK10, SLC6A1, PAFAH1B1, FRRS1L, RPS6KA3, GRM7, ATP6AP2, GABRB3, CASK, GNB1, GNAO1, CACNA1A, DYRK1A, CDKL5, DMXL2, GRIK2, ATP6V0C, DOCK7, ST3GAL3, GABRG2, EHMT1, NEXMIF, SPTAN1, HNRNPU, KCNB1
HP:0012171	Stereotypical hand wringing	13	0.007291082445316881	4.692722938867077	1.0598533859617422e-06	4.414053352788843e-05	4.355162421812842	0.010902711781388442	GRIA2, AP1S2, CASK, CELF2, CACNA1B, MECP2, PUM1, NEXMIF, VAMP2, CNTNAP2, CDKL5, DYRK1A, KCNB1
HP:0011097	Epileptic spasm	30	0.01682557487380819	4.682966758120993	1.1269471908609278e-13	1.5457207669848486e-11	10.810868958225317	1.1592905752386364e-09	MFF, CHD2, DNM1, CACNA1B, TRAPPC12, NCDN, SCN2A, SYNJ1, SMARCA2, SLC1A2, ATP6V0A1, AKT3, SLC6A1, KCNT2, EIF4A2, CASK, PHACTR1, NSF, SCN8A, WWOX, GRIK2, PPP3CA, GRIN2B, ST3GAL3, SETBP1, PLCB1, EHMT1, NEXMIF, CELF2, TBL1XR1
HP:0200134	Epileptic encephalopathy	51	0.02860347728547392	4.566800140865278	1.1130693793944377e-21	5.452449859919324e-19	18.263408319451322	1.145014470583058e-17	KMT2E, CHD2, DNM1, CACNA1B, MDH1, CACNA1E, GABRB2, GLUL, NRXN1, SCN2A, SYNJ1, NEXMIF, NTRK2, GABRB1, AFF3, SLC1A2, FGF12, SCN3A, STAG1, SLC25A12, SLC6A1, KCNT2, HNRNPR, FRRS1L, KCNQ5, CYFIP2, GRM7, GABRB3, CASK, PHACTR1, GNAO1, NSF, SCN8A, CACNA1A, WWOX, DMXL2, ADAM22, CDKL5, PPP3CA, DOCK7, GRIN2B, SPTAN1, ST3GAL3, GLS, GABRG2, PLCB1, PAFAH1B1, RNF13, CELF2, HNRNPU, KCNB1
HP:0009928	Thick nasal alae	15	0.008412787436904094	4.5597307908020195	2.4605005652926573e-07	1.1883178082237355e-05	4.92506739445616	0.0025311169315165565	SLC6A1, PIK3C2A, KANSL1, ARID1A, ZSWIM6, ARID1B, TRPS1, RPS6KA3, SMARCA2, ANKRD17, ARID2, CHD2, KCNH1, NEXMIF, NF1
HP:0006758	Malignant genitourinary tract tumor	14	0.007851934941110488	4.492179223530878	7.700492391305711e-07	3.342403596175606e-05	4.475941110095222	0.007921496522936186	RPS27, RPL5, RPL35, RPS19, RPS28, RPS29, RPL27, RPS20, RPL18, MSH2, RPL26, RPS17, RPL8, RPL9
HP:0010841	Multifocal epileptiform discharges	21	0.011777902411665733	4.4105032376484985	2.0280016968313e-09	1.522777624474714e-07	6.8173635132856685	2.0862053455303583e-05	ARFGEF1, TBCK, CHD2, ADK, KCNMA1, DPYD, SCN2A, FGF12, MECP2, LRPPRC, MED13L, GNB1, GNAO1, CDKL5, SCN8A, SPTBN1, PPP3CA, DOCK7, GABRG2, PLCB1, SPTAN1
HP:0025269	Panic attack	21	0.011777902411665733	4.4105032376484985	2.0280016968313e-09	1.522777624474714e-07	6.8173635132856685	2.0862053455303583e-05	USP48, VPS13C, ATRX, CTNNB1, SYNJ1, NR3C1, MECP2, UCHL1, SPART, KIF1B, PRKN, PRKAR1A, BRAF, LRRK2, SPECC1L, NF1, CREBBP, CDKL5, DNAJC6, SNCA, SGCE
HP:0007302	Bipolar affective disorder	14	0.007851934941110488	4.37076897424626	1.1402483258636498e-06	4.710736758296934e-05	4.326911163987893	0.011729734528159366	MT-CO1, GRIA1, MT-CO2, JMJD1C, RPS6KA3, TBCK, MT-CO3, MT-ND1, MT-ND4, MECP2, CEP85L, EHMT1, ATP2A2, MT-ND5
HP:0012760	Reduced social responsiveness	26	0.014582164890633763	4.352670551992652	3.512561736528847e-11	3.197674564926748e-09	8.495165737540463	3.613372258367225e-07	MBD5, CHD2, CNTNAP2, SNRPN, VPS13C, ZMYND11, ADNP, SYNJ1, MECP2, NLGN1, SLC6A1, UCHL1, OPHN1, PRKN, HERC1, LRRK2, NF1, CREBBP, CDKL5, SPTBN1, GRIK2, DNAJC6, SNCA, CLTC, TTC19, NEXMIF
HP:0012447	Abnormal myelination	26	0.014582164890633763	4.352670551992652	3.512561736528847e-11	3.197674564926748e-09	8.495165737540463	3.613372258367225e-07	RAB3GAP2, DNM1, CACNA1B, GABRB2, SYNJ1, NTRK2, SLC1A2, FGF12, SCN3A, GABRA5, CNKSR2, CYFIP2, GABRA2, CACNA1A, SCN8A, WWOX, PPP3CA, ZFR, PGAP1, CLTC, CACNA2D1, YWHAG, GABRG2, CELF2, CDK19, KCNB1
HP:0100660	Dyskinesia	68	0.03813796971396523	4.29229302857283	1.4176043050110284e-26	1.215241290470704e-23	22.915337482793284	1.458289548564845e-22	NDUFS8, PDE10A, CAMK2B, SLC30A9, IREB2, STX16, ADCY5, CACNA1B, DNM1, VPS13C, GABRB2, SYT1, SCN2A, SYNJ1, NTRK2, NDUFA13, SLC1A2, MT-ND4, MT-ND2, FGF12, XPR1, TMEM43, SCN3A, MSH2, LRPPRC, GNAS, GIGYF2, ATXN10, ITPR1, GABRA5, UCHL1, BMPR1A, BCAS3, CNKSR2, CYFIP2, PRKN, GRM7, GABRB3, CASK, LRRK2, ATM, GNAO1, ATG7, SCN8A, GABRA2, MT-ND5, DMXL2, CACNA1A, WWOX, CDKL5, MT-ATP6, PGAP1, UNC80, PPP3CA, DNAJC6, GRIN2B, SNCA, CLTC, MT-ND1, CACNA2D1, YWHAG, RPS20, GABRG2, MT-ND3, SLC20A2, CELF2, CDK19, KCNB1
HP:0000912	Sprengel anomaly	20	0.011217049915872126	4.278265927172265	9.094058716432772e-09	5.996832180509226e-07	6.222078104588699	9.355058201594393e-05	RPL8, RPS19, RPS28, RPS29, TMEM43, RPL26, RPS17, RPS27, RPL35, RPL27, CDH2, BRAF, SEPTIN9, RPL5, SYNE2, PTPN11, RPS20, SYNE1, RPL18, RPL9
HP:0011153	Focal motor seizure	20	0.011217049915872126	4.278265927172265	9.094058716432772e-09	5.996832180509226e-07	6.222078104588699	9.355058201594393e-05	DPYD, SCN2A, SLC35A3, AKT3, ATXN10, FRRS1L, GRM7, CASK, SLC1A3, FAR1, GNAO1, CDKL5, CACNA1A, SCN8A, DMXL2, PPP3CA, YWHAG, NDUFA2, PAFAH1B1, KCNQ3
HP:0009944	Partial duplication of thumb phalanx	14	0.007851934941110488	4.255748738081884	1.6618639829753732e-06	6.62619953211925e-05	4.178735490519615	0.017095594792867663	RPS27, RPL5, RPL35, RPS19, RPS28, RPS29, RPL27, RPS20, RPL18, INTU, RPL26, RPS17, RPL8, RPL9
HP:0002263	Exaggerated cupid's bow	15	0.008412787436904094	4.226091952450652	7.85847320057711e-07	3.3966434375771734e-05	4.468950040772083	0.008084011381433673	EXOC2, SCN2A, MED27, HNRNPK, TBCK, SMARCA2, KMT2A, NRCAM, TRIP12, SUPT16H, SLC1A3, MYT1L, ZNF462, CACNA1A, HNRNPU
HP:0000751	Personality changes	18	0.010095344924284913	4.07693576589357	1.1857675017049801e-07	6.1065452711194294e-06	5.214204418893344	0.0012197990290039131	MT-CO1, MT-CO2, RNF216, HLA-DQB1, DCTN1, MT-CO3, VPS13A, MT-ND1, SNCAIP, PRNP, MT-ND4, XPR1, ATXN2, MAPT, APOE, SLC20A2, HTT, MT-ND5
HP:0011182	Interictal epileptiform activity	17	0.009534492428491307	4.007600123616468	3.531287230633206e-07	1.643726323145873e-05	4.784170489862687	0.003632635174152379	SLC6A1, NBEA, GRIA3, KANSL1, GRIA1, STRADA, FRRS1L, SCN2A, MAP1B, KCNQ3, GRM7, SLC12A6, CHD2, GABRG2, NEXMIF, CNTNAP2, SCN8A
HP:0002121	Generalized non-motor (absence) seizure	46	0.025799214806505887	3.8785447310568997	2.0053242430117688e-16	4.125754097572413e-14	13.384496660330363	2.0628770487862067e-12	CDK13, CHD2, CEP85L, KCNMA1, SON, DHFR, ADGRV1, GLUL, PPP2CA, CACNB4, SCN2A, SMARCA2, NTRK2, NEXMIF, AFF3, MECP2, MYT1L, FGF13, SLC35A3, LAMA2, NBEA, SLC6A1, GATAD2B, EIF4A2, GRM7, GABRB3, CASK, PAK3, GNB1, GNAO1, NSD1, SCN8A, WWOX, CDKL5, DMXL2, PGAP1, ATP6V0C, DOCK7, CACNA2D1, YWHAG, GABRG2, EHMT1, FAR1, SPTAN1, KCNQ3, RFX7
HP:0010818	Generalized tonic seizure	21	0.011777902411665733	3.7902762198541784	4.620497583189504e-08	2.6760600782507966e-06	5.572504140769715	0.0004753105863827042	CHD2, DNM1, ADGRV1, CACNB4, SCN2A, SLC1A2, MAPK10, GRM7, VPS50, GABRB3, CASK, GNB1, GNAO1, CDKL5, CACNA1A, SCN8A, DMXL2, DOCK7, GABRG2, PAFAH1B1, KCNQ3
HP:0001350	Slurred speech	18	0.010095344924284913	3.7804313465558557	4.3754221212603254e-07	1.9915914761683612e-05	4.700799741133758	0.004500996736140497	ITPR1, VPS13C, SETD2, SPART, SCN2A, HLA-DQB1, VPS13A, ANO10, ATP6AP2, PRNP, ATXN1, SUPT16H, SLC1A3, XPR1, PDE8B, ATM, SLC20A2, CACNA1A
HP:0005484	Secondary microcephaly	42	0.023555804823331465	3.731964278010268	1.8696926583862155e-14	2.8284600554145586e-12	11.54844995015162	1.9233528376819e-10	MBD5, MFF, RAB3GAP2, PRORP, TMEM165, DNM1, DHFR, CACNA1B, SNRPN, EXOC2, TRAPPC12, GABRB2, NEXMIF, NTRK2, CTNNA2, KIF5C, FGF12, CERT1, MECP2, SLC25A12, GABRA5, ITPR1, HNRNPR, ATP9A, ARNT2, VPS50, VPS53, UBE3A, CREBBP, CDKL5, WWOX, DYRK1A, TRIO, ADAM22, TCF4, FTO, COG6, PPP1R12A, CLTC, GLS, ZEB2, PAFAH1B1
HP:0001273	Abnormal corpus callosum morphology	34	0.019068984856982614	3.705139736928433	7.141862308392985e-12	7.496769139432515e-10	9.125125862905294	7.346833756643864e-08	KMT2E, DNM1, CACNA1B, GABRB2, ARID1A, SCN2A, SYNJ1, NTRK2, SLC1A2, FGF12, SCN3A, GABRA5, CSPP1, CNKSR2, CYFIP2, DISP1, PDHX, CREBBP, GABRA2, SCN8A, CACNA1A, WWOX, PPP3CA, KMT2A, CLTC, CACNA2D1, YWHAG, ZEB2, GABRG2, PLCB1, PAFAH1B1, CELF2, CDK19, KCNB1
HP:0012469	Infantile spasms	50	0.028042624789680313	3.702345513899075	8.889430606434361e-17	1.866236176497761e-14	13.729033396141922	9.144557264839027e-13	ARFGEF1, CEP85L, SLC19A3, DNM1, CNTNAP2, GLUL, SCN2A, NTRK2, CTNNA2, MT-ND4, MT-ND2, ACBD6, MECP2, HIBCH, GNAQ, PAFAH1B1, KCNQ5, EIF4A2, MACF1, GRM7, GABRB3, VPS53, CASK, CDH2, PHACTR1, GNB1, GNAO1, CUL3, CDKL5, MT-ND5, DMXL2, SPTBN1, MT-ATP6, STRADA, ATP6V0C, MAPK1, RALGAPA1, DOCK7, GRIN2B, SPTAN1, MT-ND1, ATP2B1, GABRG2, PLCB1, MT-ND3, NEXMIF, RNF13, ATAD1, CDK19, KCNB1
HP:0002384	Focal impaired awareness seizure	40	0.022434099831744252	3.696421761076837	1.1155566480934408e-13	1.5457207669848486e-11	10.810868958225317	1.1475731238937226e-09	CAMK2B, CACNA1D, CEP85L, DNM1, ADGRV1, CNTNAP2, HTT, SCN2A, ATP6V0A1, SCN3A, FGF13, MYT1L, ATXN10, ITPR1, FRRS1L, KCNQ5, OPHN1, MACF1, CDH2, GNB1, KDM6A, FMN2, GNAO1, NSD1, SCN8A, CACNA1A, VPS35L, GRIK2, STRADA, RERE, ATP6V0C, DOCK7, GRIN2B, SUPT16H, GABRG2, PLCB1, PAFAH1B1, SPTAN1, KCNQ3, KCNB1
HP:0000194	Open mouth	39	0.021873247335950644	3.6926344436986844	2.344639509406197e-13	3.092218799136096e-11	10.509729783868995	2.411930663326155e-09	AP1S2, MBD5, TBCK, MED12L, REV3L, OGT, ASH1L, DPYD, FOXP1, DST, VPS13B, GRIA3, KANSL1, ATRX, SOX5, KCNH1, LAMA2, AHI1, PIGN, ZSWIM6, BCAS3, MED13L, RPS6KA3, PAK3, PRKAR1A, BRAF, PDE4D, ADAM22, UNC80, STRADA, TCF4, RPS23, HNRNPK, CLTC, SETBP1, ZEB2, CCDC88A, NEXMIF, CSNK2B
HP:0002174	Postural tremor	21	0.011777902411665733	3.675419364707082	8.452435555331748e-08	4.576326555668299e-06	5.339482992898459	0.000869502045576977	SETX, ATXN1, SCARB2, MT-ND4, MT-ND2, MT-CYB, ITPR1, BSCL2, MT-CO1, UCHL1, MT-ND4L, MT-CO3, PRKN, TENM4, PPP2R2B, ATXN2, MT-ND5, GRIK2, MT-ATP6, MT-ND1, TPP1
HP:0001271	Polyneuropathy	21	0.011777902411665733	3.675419364707082	8.452435555331748e-08	4.576326555668299e-06	5.339482992898459	0.000869502045576977	CD59, SETX, OPA1, SLC12A6, MT-ND4, MT-ND2, MT-CYB, ATXN10, PSAP, HLA-DQB1, MT-CO3, MT-ND4L, ARL6IP1, SEPTIN9, NF1, MT-ND5, DMXL2, SPTBN1, MT-ATP6, MT-ND1, SYNE1
HP:0007334	Bilateral tonic-clonic seizure with focal onset	17	0.009534492428491307	3.636526038096425	1.685803775926975e-06	6.695700171027332e-05	4.174204001995643	0.017341863442960792	ADAM22, PPP2CA, ATP6V0C, PSAP, KCNMA1, SCN2A, KCNQ3, TBCK, KDM6A, GABRG2, CEP85L, EHMT1, PLCB1, CNTNAP2, SCN8A, WWOX, KCNB1
HP:0002521	Hypsarrhythmia	58	0.03252944475602917	3.6214942929469016	1.0035314691261192e-18	2.7900887088919965e-16	15.554381988421802	1.0323328222900388e-14	MFF, ARFGEF1, DNM1, CACNA1B, MDH1, CACNA1E, TRAPPC12, GABRB2, SCN2A, SYNJ1, GABRB1, NTRK2, CTNNA2, SLC1A2, FGF12, ATP6V0A1, HIBCH, SCN3A, FGF13, GABRA5, KCNT2, PAFAH1B1, CNKSR2, CYFIP2, ARFGEF2, GRM7, GABRB3, CASK, PHACTR1, GNB1, NF1, GNAO1, CUL3, SCN8A, GABRA2, CACNA1A, DMXL2, WWOX, CDKL5, SPTBN1, PPP3CA, DOCK7, GRIN2B, ST3GAL3, CLTC, CACNA2D1, SETBP1, YWHAG, CCDC88A, GABRG2, PLCB1, NEXMIF, SPTAN1, CELF2, TBL1XR1, ATAD1, CDK19, KCNB1
HP:0000713	Agitation	25	0.014021312394840156	3.609786876051598	7.67902891690435e-09	5.231402017761262e-07	6.281381904444625	7.899417046819506e-05	SORL1, ADCY5, WAC, HTT, VPS13C, SYT1, SYNJ1, FGF12, ATP6V0A1, MECP2, APP, GIGYF2, GNAS, UCHL1, MED13L, PRKN, PAK3, PRKAR1A, LRRK2, CACNA1A, CDKL5, SPTBN1, DNAJC6, SNCA, GLS
HP:0000752	Hyperactivity	66	0.03701626472237801	3.579281634845528	8.195831483366201e-21	3.2619074314925084e-18	17.486528367809058	8.431051846938811e-17	HUWE1, MICU1, MBD5, DPP6, ARID1B, SLC4A10, CHD2, ASH1L, DNM1, DPYD, CNTNAP2, UBE3C, HTT, SNRPN, ADNP, SHOC2, KANSL1, ARID1A, SPRED1, ATRX, SCN2A, AUTS2, TRIP12, ARID2, ATP6V0A1, MECP2, BBS2, MAPK10, SLC6A1, BSCL2, SMAD4, GRIA1, GATAD2B, ZSWIM6, ATP9A, MED13L, VPS13A, OPHN1, ANK3, STAG2, CASK, GRM7, GABRB3, CNKSR2, PAK3, ATP1A1, DYM, UBE3A, PDE4D, CUL3, GNAO1, FBXO11, CACNA1A, DYRK1A, HERC2, DMXL2, CDKL5, SPTBN1, CREBBP, AQP4, CAMTA1, THRB, KMT2A, ATR, SETBP1, NEXMIF
HP:0100716	Self-injurious behavior	47	0.026360067302299495	3.571789119461582	3.520890249563027e-15	6.03656633287581e-13	12.219210022755771	3.621939799725486e-11	CRBN, AP1S2, MBD5, KMT2E, DNM1, DPYD, FBXW11, WAC, SNRPN, GRIA3, SYT1, PPP2CA, ATRX, CTNNB1, ZBTB20, SCN2A, SOX5, KIF5C, ATP6V0A1, ACBD6, UBE4B, NIPBL, TAOK1, GRIA1, VPS13A, RPS6KA3, GRM7, CASK, NRCAM, CDH2, GNAO1, VAMP2, CREBBP, KMT2C, CDKL5, HERC2, DMXL2, GRIA2, TRIO, TCF4, RERE, SETBP1, GLS, EHMT1, FOXP1, WASF1, RFX7
HP:0002322	Resting tremor	17	0.009534492428491307	3.570407382858308	2.2442365807852904e-06	8.711872342089917e-05	4.059888497064508	0.023086461706538282	VPS13C, MICU1, PSAP, SNCA, VPS13A, SYNJ1, PRKN, DNAJC6, ATP6AP2, SNCAIP, MECP2, ATXN2, MAPT, TTC19, LRRK2, ADCY5, GIGYF2
HP:0000736	Short attention span	46	0.025799214806505887	3.56617871244829	7.382357112082631e-15	1.1865985564374067e-12	11.925696184341435	7.594230761199403e-11	MBD5, GRIA4, BBS9, SCLT1, AUH, CEP290, FOXP1, SNRPN, VPS13C, MT-CO2, SPRED1, SCN2A, SYNJ1, SMARCA2, MT-ND4, FOCAD, BBS2, TAOK1, MT-CO1, UCHL1, PSAP, ATP9A, VPS13A, MT-CO3, PRKN, PAK3, UBE3A, DISP1, LRRK2, NF1, FBXO11, CREBBP, MT-ND5, SPTBN1, GRIK2, DNAJC6, SNCA, KMT2A, CLTC, MT-ND1, SDCCAG8, PRNP, SYNE1, GABRG2, WDPCP, PTEN
HP:0002572	Episodic vomiting	19	0.01065619742007852	3.5399200332893095	6.670033149105876e-07	2.9322491882415446e-05	4.532799125272483	0.006861463100485215	CDK13, ADNP, MT-CO2, MT-ND4, MT-ND2, FGF13, MT-CYB, MT-CO1, NDUFS1, MT-CO3, CDK8, NSD1, MT-ND5, MT-ATP6, HNRNPK, MT-ND1, ZEB2, MT-ND3, NEXMIF
HP:0002073	Progressive cerebellar ataxia	19	0.01065619742007852	3.5399200332893095	6.670033149105876e-07	2.9322491882415446e-05	4.532799125272483	0.006861463100485215	ATXN1, TTBK2, SACS, AUH, HTT, ATXN10, SLC44A1, ZFHX3, ATXN7, PPP2R2B, ATXN2, ATM, CACNA1A, TARDBP, VPS13D, ANO10, PRNP, GLS, TPP1
HP:0000729	Autistic behavior	135	0.07571508693213685	3.5361177561321786	8.151288838339707e-41	2.0963077070000142e-37	36.67854496899565	8.385230828000057e-37	MED13, PHF21A, MED12L, CEP290, WAC, SNX14, ADNP, SETD2, VPS13B, RORA, NTRK2, ARID2, ZMYM2, MECP2, NLGN1, FGF13, TAOK1, RIMS2, ZSWIM6, FRRS1L, OPHN1, GRM7, THOC2, CASK, GABRB3, CDH2, PHACTR1, ZNF462, NF1, SPECC1L, CREBBP, GABRA2, HERC2, GRIK2, CAMTA1, EHMT1, NEXMIF, FOXP1, PTEN, TIAM1, TNRC6B, AP1S2, CAMK2B, ARID1B, SON, DPYD, BCL11B, SYT1, COG5, SCN2A, CTNNB1, AFF3, ACBD6, NIPBL, KAT6A, GATAD2B, MAP1B, CUL3, GABBR1, NSD1, SCN8A, CDKL5, SBF2, CACNA1A, TRIO, RERE, RPS23, ATP2B1, SLF2, ATG7, MBD5, ANKRD17, PRORP, TCF12, CHD2, ZNF292, UBE3C, SNRPN, GRIA3, PPP2CA, SMARCA2, RSRC1, TRIP12, AUTS2, MYT1L, NBEA, SLC6A1, STAG2, ATP1A1, FBXO11, PDE4D, ALMS1, MEIS2, DYRK1A, DMXL2, SPTBN1, TANC2, SUPT16H, GABRG2, NAA15, SPTAN1, TBL1XR1, KDM5A, NLGN4X, CEP85L, ASH1L, DNM1, ADGRV1, CNTNAP2, USP9X, FBXW11, KANSL1, ARID1A, CTNNA2, ATP6V0A1, SLC35A3, GNAQ, STAG1, MAPK10, GRIA1, ATP9A, MED13L, ANK3, UBE3A, TLK2, CDK8, KDM6A, GNAO1, VAMP2, KMT2C, GRIA2, TCF4, SETBP1, CELF2, RFX7
HP:0002591	Polyphagia	22	0.012338754907459339	3.529569389917119	9.454185693270752e-08	5.039129959931411e-06	5.297644440978769	0.0009725520822667622	MBD5, BBS9, HTT, SNRPN, ADNP, SETD2, CTNNB1, NTRK2, ACBD6, MYT1L, UBE4B, GNAS, BSCL2, PREPL, UBE3A, BRAF, ALMS1, HERC2, RERE, SUPT16H, MAPT, RFX7
HP:0004691	2-3 toe syndactyly	28	0.015703869882220976	3.515618522763296	1.927994159637233e-09	1.4691315496435714e-07	6.832939314675104	1.9833275920188215e-05	MAPRE2, KDM5A, PHIP, KCTD1, TBCK, SLC12A6, SIK3, CSGALNACT1, FBXW11, ADNP, SYT1, SOX5, CERT1, PLAAT3, NIPBL, STAG1, ITPR1, SMAD4, DDX6, LMBR1, RBPJ, NSD1, TRIO, MEIS2, CNOT2, KMT2A, LRRC8C, WDPCP
HP:0025336	Delayed ability to sit	26	0.014582164890633763	3.492258931249918	8.456980034303373e-09	5.686075399534563e-07	6.245187385696458	8.69969536128788e-05	MBD5, CDK13, RAB3GAP2, SIK3, SON, ADCY5, SNX14, CTNNB1, NEXMIF, MECP2, ITPR1, KAT6A, OPHN1, MACF1, CASK, CUL3, ALMS1, TRIO, VPS35L, GRIK2, PGAP1, GRIN2B, SLC9A7, PAFAH1B1, CELF2, WASF1
HP:0000817	Reduced eye contact	35	0.01962983735277622	3.4853114665325777	2.494889021244929e-11	2.3763817927357948e-09	8.62408378374219	2.566492336154658e-07	NDUFS8, NDUFC2, MBD5, CAMK2B, IREB2, ADCY5, CNTNAP2, ADNP, GRIA3, SYT1, NTRK2, NDUFA13, MT-ND2, MECP2, MYT1L, NHLRC2, SLC25A12, NALCN, NDUFS1, OPHN1, GABRA2, WWOX, CDKL5, ADAM22, SPTBN1, DOCK7, GRIN2B, ST3GAL3, MT-ND1, GPHN, AGTPBP1, GLS, MT-ND3, NEXMIF, ARFGEF2
HP:0002133	Status epilepticus	57	0.03196859226023556	3.4653954010095345	1.9585356200566135e-17	4.685454865935438e-15	14.329248241237988	2.0147455923522382e-13	MICU1, TBCK, GRIA4, CHD2, IQSEC1, SLC19A3, KCNMA1, SON, DNM1, ADGRV1, CACNA1B, CNTNAP2, CACNA1E, GRIA3, GABRB2, CACNB4, SCN2A, SYNJ1, SMARCA2, NTRK2, SLC1A2, FGF12, MECP2, SCN3A, FGF13, AKT3, SLC25A12, GABRA5, ATXN10, BSCL2, EHMT1, PSAP, CNKSR2, CYFIP2, GRM7, SLC1A3, ATP1A1, GNB1, SCN8A, GABRA2, CACNA1A, WWOX, PPP3CA, STRADA, AQP4, GRIN2B, CLTC, CACNA2D1, YWHAG, CCDC88A, GABRG2, PUM1, NEXMIF, CELF2, KCNQ3, CDK19, KCNB1
