HP:0000486	Strabismus	197	0.11048794167134043	2.159022435164068	4.7265164982954634e-26	3.2414450145310286e-23	22.48926134104806	4.862167521796543e-22	NDUFS8, PHIP, OPA1, PHF21A, MYO5A, MED12L, GRIA4, ANKRD11, FBN1, CACNA1B, WAC, CEP290, HACE1, ADNP, VPS13B, RORA, ARID2, HIBCH, UBE4B, RPL26, GNAS, SLC44A1, TAOK1, CSPP1, ZSWIM6, DDX6, OPHN1, MACF1, THOC2, CASK, NRCAM, RPS6KA3, GRM7, CDH2, PRKAR1A, SPECC1L, NF1, CREBBP, HERC2, TBC1D32, SOS1, GTF2I, MT-ATP6, GRIK2, CYB5R3, CAMTA1, SLC9A7, PPP1R12A, MT-ND1, PRKACB, SYNE1, EHMT1, AHI1, NEXMIF, FOXP1, AP1S2, ASCC3, ZNF407, CAMK2B, SLC30A9, CDK13, ARID1B, DSE, SON, KCNMA1, DPYD, RPL8, SYT1, RASA2, COG5, RPS19, SCN2A, ZBTB20, MPDZ, CTNNB1, AFF3, SOX5, RPS28, ADD3, FRMD5, ACBD6, AP3B1, NIPBL, BBS2, NHLRC2, ITPR1, PIGN, BCAS3, KAT6A, GATAD2B, ARNT2, LYST, BRAF, RBPJ, NSD1, SCN8A, CDKL5, CACNA1A, TRIO, STRADA, RERE, KMT2A, KIF21A, RPS20, RPL18, ATG7, ROBO1, HUWE1, MAPRE2, RAB3GAP2, TBCK, SLC12A6, ANKRD17, REV3L, TCF12, BBS9, ZNF292, FARS2, SNRPN, SLC25A46, KIDINS220, DCC, FRMD4A, NRXN1, RPS29, TRIP12, SMAD2, AUTS2, MYT1L, RPS17, SMAD4, RPS27, RPL35, NALCN, HNRNPR, NDUFS1, VPS53, DISP1, FBXO11, DYRK1A, DMXL2, SPTBN1, RPL5, SOS2, PTPN11, ATR, AGTPBP1, AFF4, SDCCAG8, SUPT16H, ZEB2, SPTAN1, TBL1XR1, HNRNPU, RPL9, SETX, KDM5A, HSD17B4, MAP2K1, HDAC8, CHN1, SCLT1, CEP85L, ASH1L, USP9X, CNTNAP2, FBXW11, KANSL1, SHOC2, ARID1A, JMJD1C, MT-ND2, NBAS, LRPPRC, GNAQ, STAG1, ATP9A, FBXW7, MED13L, PRKACA, RPL27, UBE3A, TLK2, PRKG1, KDM6A, ATM, GNAO1, CDK8, GNB1, ASPH, TCF4, SETBP1, CRPPA, MT-ND3, WDPCP, WASF1, PBX1
HP:0001250	Seizure	329	0.18452047111609646	2.1580826934168784	3.5676697819833404e-44	1.8350309523631311e-40	39.736356605893015	3.6700619047262622e-40	CRBN, NDUFC2, LMBRD1, OPA1, MED12L, PRKAG2, HTT, GLUL, RORA, MT-ND4, APP, JAZF1, GNAS, BSCL2, MT-CO3, GABRA2, CYB5R3, CACNA2D1, FOXP1, CDK19, TIAM1, TNRC6B, KMT2E, DIP2B, SON, DPYD, BCL11B, BPTF, SNAP25, DYNC1H1, CALM3, TRIO, UNC80, STRADA, KMT2A, HLCS, ATP2B1, ATG7, ROBO1, SORL1, PRORP, SNRPN, KIF2A, RSRC1, AUTS2, TRIP12, KCNH1, ATXN10, ATP6AP2, SLC1A3, PDHX, MEIS2, SPTBN1, TANC2, FTO, UBAC2, NAA15, HNRNPU, MICU1, HECTD4, HSD17B4, MAP2K1, SCLT1, ASH1L, CNTNAP2, EXOC2, KANSL1, MT-ND2, MSH2, NBAS, AKT3, STAG1, GNAQ, LIFR, CYFIP2, UBE3A, CDK8, NIN, KCNN3, AKAP9, CLTC, CRPPA, MT-ND3, MYO5A, CEP290, WAC, SNX14, VPS13B, GABRB2, NTRK2, FRRS1L, OXR1, RPS6KA3, CASK, PAK3, HERC1, ATP2A2, MT-ATP6, NEXMIF, PTEN, ARFGEF2, ATAD1, CDK13, MT-CO2, ATRX, SCN2A, ZBTB20, MPDZ, FRMD5, ACBD6, NIPBL, MT-CYB, NFIA, BCAS3, MED27, ARNT2, RBPJ, CUL3, SCN8A, PAK1, RERE, GRIN2B, RPS20, RNF13, PDE10A, SLC4A10, SLC12A6, BBS9, SIK3, ZNF292, FARS2, MDH1, CALM1, KAT6B, GABRB1, SMARCA2, SMAD2, KIF5C, FGF12, MYT1L, NBEA, KCNT2, NDUFS1, DISP1, PPA2, GABRG2, SPTAN1, TBL1XR1, YWHAE, DHX9, HDAC8, CHN1, ACTB, CALM2, ATP6V0A1, APOE, DYNC1I2, ANK2, HLA-DQB1, NNT, ATM, GNAO1, TCF4, GPHN, WDPCP, WASF1, BCKDHB, NDUFS8, IREB2, GRIA4, IQSEC1, ANKRD11, ADNP, SETD2, ARID2, SLC1A2, ZMYM2, SCN3A, LAMA2, PPM1B, TAOK1, CFH, CSPP1, ZSWIM6, KCNQ5, CNKSR2, OPHN1, NF1, HERC2, CAMKMT, ADAM22, CAMTA1, MT-ND1, YWHAG, LRRC8C, AHI1, AP1S2, RAB3GAP1, SOX5, BBS2, PIGN, LYST, GABBR1, NSD1, CACNA1A, MT-ND5, PPP3CA, AQP4, MBD5, ADAR, RAB3GAP2, ANKRD17, TRAPPC12, SLC25A46, GRIA3, DCC, SPRED1, SMAD4, NFASC, HNRNPR, PSAP, VPS13A, PDE4D, DYRK1A, DMXL2, ATR, AGTPBP1, SUPT16H, ZEB2, PAFAH1B1, SLC20A2, AUH, USP9X, ARID1A, JMJD1C, MT-CO1, CRADD, WWOX, PRKDC, DNAJC6, HNRNPK, GLS, CELF2, LAMA3, PHIP, IDS, PHF21A, TMEM165, CACNA1B, HACE1, CDK6, SYNJ1, HIBCH, MECP2, XPR1, UBE4B, NDUFB8, PREPL, GRM7, THOC2, MACF1, PHACTR1, CREBBP, VPS13D, PGAP1, EHMT1, STT3B, ASCC3, CAMK2B, JAK2, ARID1B, SEMA3A, KCNMA1, PCLO, COG5, CTNNB1, ADD3, NHLRC2, GABRA5, ITPR1, PCCA, KAT6A, EIF4A2, BRAF, CDKL5, PRNP, SMCHD1, TPP1, KCNB1, HUWE1, MAPRE2, RYR2, TBCK, SLC19A3, ADK, SERPINI1, MEGF10, MYO9A, SLC25A12, NALCN, BMPR1A, FUT8, STAG2, ATP1A1, FBXO11, FRYL, SDCCAG8, KDM5A, MFF, CACNA1D, HTRA1, NLGN4X, DNM1, CTNNA2, LRPPRC, GRIA1, FBXW7, ATP9A, ANK3, TLK2, GNB1, KDM6A, SUMF1, KMT2C, RAPGEF2, MAPK1, COG6, SETBP1, FAR1
HP:0001272	Cerebellar atrophy	79	0.0443073471676949	2.15733835051027	6.137959859103705e-11	5.443206299189639e-09	8.264145205476822	6.314119307059981e-07	RNF216, OPA1, TTBK2, HTT, SNX14, NDUFA13, SLC44A1, FRRS1L, GRM7, CASK, HERC1, GRIK2, MT-ATP6, VPS13D, CYB5R3, SYNE1, TTC19, STT3B, CAMK2B, SACS, KCNMA1, PCLO, GRID2, COG5, SCN2A, SCARB2, ACBD6, ITPR1, PIGN, BCAS3, ZFHX3, MED27, VPS50, LYST, PPP2R2B, CACNA1A, SCN8A, CDKL5, ANO10, PRNP, CCDC88A, RNF13, TPP1, TBCK, ATXN1, FARS2, SLC25A46, REPS1, FGF12, ATXN10, SPART, NALCN, NFASC, NDUFS1, ATP6AP2, VPS53, SLC1A3, ATXN2, DMXL2, AGTPBP1, PLD3, SPTAN1, SETX, DHX9, HSD17B4, MFF, ATP6V0A1, UCHL1, CYFIP2, ATXN7, SUMF1, GNAO1, WWOX, GRIA2, NDUFA9, COG6, CRPPA, GLS, FAR1
HP:0001629	Ventricular septal defect	96	0.0538418395961862	2.149082419230719	5.187544382159514e-13	6.507837690155478e-11	10.186563287196282	5.336426905927492e-09	ANKRD11, FBN1, CEP290, WAC, VPS13B, GPC6, ARID2, ZMYM2, FOCAD, RPL26, TAOK1, MACF1, GRM7, CASK, ZNF462, SPECC1L, NF1, CREBBP, SOS1, GTF2I, PRKACB, EHMT1, TAB2, TIAM1, CDK13, ARID1B, SON, RPL8, ATRX, RPS19, SCN2A, DTNA, RPS28, NIPBL, MT-CYB, KAT6A, BRAF, NSD1, CDKL5, TRIO, VPS35L, RERE, RPS20, RPL18, SLF2, RARB, TBCK, KAT6B, RPS29, SMAD2, CWC27, RPS17, SMAD4, RPS27, RPL35, HNRNPR, STAG2, MEIS2, DYRK1A, DMXL2, SPTBN1, RPL5, FRYL, FTO, SOS2, PTPN11, AFF4, ZEB2, RPL9, MICU1, KDM5A, CACNA1D, MAP2K1, HDAC8, CSGALNACT1, DST, EXOC2, KANSL1, SHOC2, ARID1A, NEK1, JMJD1C, AKT3, STAG1, MED13L, PRKACA, RPL27, CHD4, CDK8, KDM6A, GNAO1, ASPH, MAPK1, COG6, HNRNPK, RFX7
HP:0000276	Long face	54	0.03028603477285474	2.1435435470162068	7.753818384859778e-08	4.265429397061633e-06	5.370037242248517	0.0007976352972505254	HUWE1, MAPRE2, AP1S2, MAP2K1, SLC4A10, SLC12A6, ANKRD11, FBN1, CEP290, ADNP, SETD2, KANSL1, JMJD1C, SMAD2, MYO9A, ACBD6, NBAS, APC, SMAD4, CSPP1, KAT6A, BCAS3, SNAP25, OPHN1, EYA1, PRKACA, NRCAM, HERC1, TLK2, BRAF, PRKG1, NF1, FBXO11, TSPAN7, NSD1, MEIS2, PAK1, DYRK1A, ASPH, STRADA, FRYL, CAMTA1, MAPK1, HNRNPK, PPP1R12A, SLC9A7, PRKACB, SETBP1, SYNE1, SLF2, ATG7, AHI1, BRWD3, PBX1
HP:0001270	Motor delay	137	0.07683679192372406	2.1414486690947503	7.852834829993511e-18	1.9702954121010546e-15	14.70546865392622	8.078211189614325e-14	OPA1, MED12L, IQSEC1, FBN1, CEP290, WAC, ADNP, VPS13B, RORA, ARID2, MT-ND4, HIBCH, LAMA2, TAOK1, ZSWIM6, PREPL, MT-CO3, RPS6KA3, NRCAM, ZNF462, CREBBP, HERC2, GRIK2, MT-ATP6, VPS13D, PGAP1, MT-ND1, SYNE1, EHMT1, AHI1, FOXP1, PTEN, DMD, CDK13, GDAP1, DPYD, BCL11B, ZMYND11, SYT1, BPTF, MT-CO2, COG5, CTNNB1, MPDZ, SOX5, FRMD5, AP3B1, NIPBL, HS2ST1, NHLRC2, GABRA5, ITPR1, SNAP25, MED27, FXR1, CPE, DYNC1H1, BRAF, CUL3, GABBR1, NSD1, SCN8A, SBF2, PAK1, MT-ND5, TRIO, CNOT2, RALGAPA1, RPS23, HUWE1, MAPRE2, MBD5, PDE10A, TBCK, SLC12A6, ANKRD17, IL6ST, REV3L, ADCY5, RFX7, UBE3C, MEGF10, SNRPN, SLC25A46, GRIA3, SPRED1, KAT6B, RSRC1, TRIP12, REPS1, SMAD2, MYO9A, MYT1L, SPART, BMPR1A, NALCN, ATP6AP2, SLC1A3, DYM, PTH1R, DYRK1A, DMXL2, SPTBN1, TANC2, AGTPBP1, ZEB2, NAA15, SPTAN1, MICU1, HECTD4, HSD17B4, MFF, CSGALNACT1, HNRNPA2B1, AUH, ACTB, CNTNAP2, FBXW11, NEK1, DYNC1I2, MT-CO1, GRIA1, ATP9A, MED13L, ATXN7, UBE3A, TLK2, CDK8, KDM6A, KMT2C, WWOX, ASPH, TCF4, ATL1, SETBP1, CRPPA, PBX1
HP:0000337	Broad forehead	52	0.029164329781267526	2.1300302701240637	1.658058710283059e-07	8.200216323404727e-06	5.086174690686797	0.0017056449952681828	HECTD4, MBD5, MAP2K1, TBCK, TNS1, TCF12, ANKRD11, FBN1, WAC, CNTNAP2, ADNP, SHOC2, KANSL1, PPP2CA, KAT6B, ZBTB20, SMAD2, KCNH1, PIGN, NFIA, NALCN, GATAD2B, MED13L, FUT8, SUZ12, CTNND1, CASK, THOC2, CHD4, BRAF, CDH2, RBFOX2, NF1, FBXO11, NSD1, CDKL5, DYRK1A, PAK1, SOS1, SPTBN1, GTF2I, UNC80, CAMTA1, KMT2A, PTPN11, PRKACB, SETBP1, NAA15, EHMT1, TAB2, ROBO1, PTEN
HP:0002808	Kyphosis	57	0.03196859226023556	2.1239520199735855	5.9027152134834826e-08	3.2822287243840317e-06	5.483831158116347	0.0006072123140110459	ASCC3, ZNF407, KMT2E, IDS, ARID1B, RAB3GAP2, TCF12, ANKRD11, SON, ACTB, FBN1, HTT, HACE1, RAB3GAP1, VPS13B, GRIA3, KANSL1, DCC, DICER1, ATRX, ZBTB20, AUTS2, TMEM43, ACBD6, MECP2, UBE4B, PLAAT3, LAMA2, HS2ST1, GNAS, CCN2, ITPR1, SMAD4, ALMS1, PSAP, RPS6KA3, HERC1, PRKAR1A, TLK2, DYM, NF1, KCNN3, NSD1, KMT2C, MEIS2, HERC2, DYRK1A, CDKL5, GTF2I, TRIO, SYNE2, SPTBN1, VPS35L, RERE, SYNE1, EHMT1, PTEN
HP:0000358	Posteriorly rotated ears	91	0.05103757711721817	2.106552982577606	7.77026405248659e-12	8.074010738174703e-10	9.092910677327621	7.993270630792956e-08	ANKRD11, TMEM165, FBN1, CEP290, WAC, ADNP, GPC6, ARID2, ZMYM2, UBE4B, PPM1B, CSPP1, PREPL, SUZ12, NRCAM, HERC1, CDH2, NF1, CAMKMT, SOS1, GTF2I, CTNND2, CAMTA1, AHI1, ASCC3, CDK13, ARID1B, MRPS28, DSE, BCL11B, RAB3GAP1, GRIP1, RASA2, COG5, ATRX, CTNNB1, MPDZ, RPS28, SOX5, AP3B1, NIPBL, BBS2, HS2ST1, PIGN, KAT6A, ZNF148, MAP1B, BRAF, NSD1, UNC80, RERE, KIF21A, HUWE1, MAPRE2, RAB3GAP2, SLC4A10, IL6ST, BBS9, FRMD4A, SPRED1, KAT6B, SMARCA2, SMAD2, KCNH1, FBXO11, PDE4D, FRYL, SOS2, PTPN11, TRPS1, AFF4, SDCCAG8, SUPT16H, ZEB2, TBL1XR1, KCTD1, MAP2K1, HDAC8, SCLT1, CSGALNACT1, ACTB, USP9X, SHOC2, TLK2, GNB1, KDM6A, ASPH, MAPK1, CRPPA, WDPCP, RFX7
HP:0011220	Prominent forehead	55	0.030846887268648347	2.103716854917488	1.3175022477676811e-07	6.676426415165584e-06	5.175455933251125	0.0013553145622786137	HECTD4, AP1S2, CAMK2B, KMT2E, IL6ST, CHD2, CSGALNACT1, PIK3R1, SON, FBN1, ZNF292, DPYD, CNTNAP2, USP9X, WAC, FOXP1, SNX14, ADNP, KIDINS220, SHOC2, SETD2, CTNNB1, ZBTB20, SMAD2, LRPPRC, SLC6A1, NALCN, ZSWIM6, MED13L, RPS6KA3, SUZ12, ARNT2, CASK, OPHN1, DYNC1H1, HERC1, PRKAR1A, BRAF, CDH2, SPECC1L, PTH1R, PDE4D, SUMF1, CREBBP, NSD1, CDKL5, ASPH, VPS35L, UNC80, PRKDC, KMT2A, SETBP1, NEXMIF, BRWD3, PTEN
HP:0001274	Agenesis of corpus callosum	61	0.034212002243409985	2.103374323000812	2.2120880584774968e-08	1.3708283046721692e-06	5.863016936897535	0.0002275574985755801	HECTD4, SLC30A9, CDK13, ARID1B, SLC12A6, RAB3GAP2, MED12L, ACTB, DNM1, DPYD, IFT80, TRAPPC12, RAB3GAP1, BCL11B, CDK6, KANSL1, DCC, KIDINS220, MT-CO2, ARID1A, FRMD4A, KAT6B, ATRX, MPDZ, ARID2, MT-ND4, HIBCH, ACBD6, UBE4B, MT-CYB, HS2ST1, DYNC1I2, MT-CO1, PIGN, NFIA, ZSWIM6, HNRNPR, ZNF148, MT-CO3, SUZ12, STAG2, ARNT2, CDH2, DISP1, CDK8, PDHX, ZNF462, DYNC2H1, CREBBP, MT-ND5, PGAP1, RERE, HNRNPK, PPP1R12A, MT-ND1, CRPPA, ZEB2, EHMT1, AHI1, ROBO1, HNRNPU
HP:0000054	Micropenis	50	0.028042624789680313	2.100239636975475	4.238760735485331e-07	1.955342228068951e-05	4.708777220490841	0.00436041316859376	HUWE1, STT3B, MBD5, ADAR, PHF21A, RAB3GAP2, HDAC8, SEMA3A, TCF12, ACTB, GRIA3, DCC, COG5, KAT6B, SCN2A, ATRX, NEK1, MYT1L, BBS2, HNRNPR, DDX6, OPHN1, GRM7, THOC2, CASK, CPE, HERC1, CHD4, CDH2, DYNC2H1, KDM6A, INTU, GNAO1, ALMS1, CDKL5, WWOX, HERC2, DMXL2, DYRK1A, SPTBN1, TCF4, PRKDC, PTPN11, PPP1R12A, SETBP1, ZEB2, EHMT1, SMCHD1, TBL1XR1, PBX1
HP:0001347	Hyperreflexia	110	0.06169377453729669	2.0660893989758744	1.80651974985621e-13	2.4134634632169912e-11	10.617359271464455	1.8583668666770831e-09	NDUFS8, OPA1, DCTN1, IREB2, TTBK2, HTT, CDK6, SYNJ1, NTRK2, MT-ND4, HIBCH, MECP2, XPR1, BSCL2, GRM7, CASK, CREBBP, TARDBP, GTF2I, MT-ATP6, VPS13D, PGAP1, MT-ND1, SYNE1, TTC19, ATAD1, AP1S2, SACS, DPYD, RAB3GAP1, PCLO, GRID2, ATRX, SCN2A, ITPR1, PIGN, BCAS3, PPP2R2B, NSD1, CDKL5, CACNA1A, MT-ND5, TRIO, SNCA, ANO10, PRNP, CCDC88A, PLCB1, TPP1, HUWE1, ADAR, SLC4A10, ATXN1, SLC19A3, ADCY5, SNRPN, SLC25A46, GRIA3, DCC, KIDINS220, AUTS2, ATXN10, SPART, NALCN, NFASC, NDUFS1, PSAP, PRKN, EYA1, ATP6AP2, SLC1A3, ERBB4, LRRK2, DYM, ATXN2, DMXL2, UBAC2, AGTPBP1, ZEB2, MAPT, SLC20A2, SPTAN1, HECTD4, SETX, DHX9, MFF, HTRA1, AUH, DNM1, CACNA1E, VPS13C, NEK1, CTNNA2, MT-ND2, GNAQ, DYNC1I2, UCHL1, TAF15, CYFIP2, ATXN7, UBE3A, GNB1, GNAO1, WWOX, ZFR, DNAJC6, ATL1, GPHN, MT-ND3, RFX7
HP:0000369	Low-set ears	151	0.08468872686483454	2.0593258778136154	4.5468333500264e-18	1.1993147351723483e-15	14.921066830402722	4.6773274671721577e-14	LMBRD1, IREB2, OGT, TMEM165, FBN1, SLC10A7, ADNP, GPC6, GLUL, ARID2, ZMYM2, MECP2, RPL26, TAOK1, CSPP1, ZSWIM6, DDX6, MACF1, HERC1, CDH2, PHACTR1, ZNF462, NF1, SPECC1L, CREBBP, KIF5B, SOS1, CAMTA1, PPP1R12A, CACNA2D1, AHI1, ACER3, PTEN, CDK13, ARID1B, MRPS28, PIK3R1, SON, CSNK2A1, RPL8, SPINT2, RAB3GAP1, GRIP1, PCLO, COG5, ATRX, TENM3, RPS19, CTNNB1, RPS28, RPL17, AFF3, SOX5, AP3B1, NIPBL, HS2ST1, CCN2, PIGN, NFIA, KAT6A, SNAP25, ZNF148, MED27, BRAF, INTU, NSD1, VPS35L, UNC80, RERE, CNOT2, RALGAPA1, RPS23, RB1, KMT2A, RPS20, ATP2B1, RPL18, HUWE1, MAPRE2, MBD5, SPARC, ADAR, RAB3GAP2, TBCK, SLC4A10, IL6ST, ZNF292, FRMD4A, SPRED1, KAT6B, SMARCA2, RPS29, TRIP12, SMAD2, AUTS2, MYO9A, KCNH1, CWC27, RPS17, SMAD4, SPART, RPS27, BMPR1A, RPL35, NALCN, EYA1, ATP6AP2, STAG2, PTH1R, FBXO11, MEIS2, DYRK1A, RPL5, FRYL, PTPN11, ATR, SUPT16H, PAFAH1B1, YWHAE, RPL9, KDM5A, DHX9, HSD17B4, KCTD1, MAP2K1, ACTB, ASH1L, DNM1, USP9X, DST, EXOC2, SHOC2, JMJD1C, MYSM1, PLAAT3, NBAS, LRPPRC, STAG1, LIFR, MED13L, RPL27, CHD4, SEPTIN9, KDM6A, ASPH, PRKDC, MAPK1, SETBP1, CRPPA, PUM1, PBX1
HP:0001631	Atrial septal defect	87	0.04879416713404375	2.05514246685637	9.059928545403564e-11	7.766623745547205e-09	8.109767733752465	9.319948494656646e-07	NPHP3, LMBRD1, FBN1, CEP290, SNX14, ADNP, GPC6, ARID2, ZMYM2, FOCAD, FGF13, RPL26, SPECC1L, NF1, CREBBP, SOS1, GTF2I, PRKACB, EHMT1, AHI1, PTEN, CDK13, ARID1B, SON, RPL8, SYT1, RASA2, RPS19, MPDZ, RPS28, FRMD5, NIPBL, BBS2, ITPR1, PIGN, KAT6A, CPE, BRAF, CUL3, NSD1, TRIO, VPS35L, STRADA, KMT2A, RPS20, RPL18, SLF2, SIK3, PPP2CA, KAT6B, RPS29, SMAD2, AUTS2, KCNH1, RPS17, SMAD4, RPS27, BMPR1A, RPL35, FUT8, FBXO11, MEIS2, RPL5, FRYL, SOS2, PTPN11, ZEB2, RPL9, KDM5A, MAP2K1, HDAC8, CSGALNACT1, USP9X, KANSL1, SHOC2, ARID1A, NEK1, JMJD1C, PRKACA, RPL27, CHD4, KDM6A, ASPH, MAPK1, COG6, HNRNPK, SETBP1
HP:0000737	Irritability	49	0.027481772293886708	2.0433739428335405	1.3957839504317376e-06	5.697789483369558e-05	4.244293600709019	0.014358429498091284	CAMK2B, ADAR, STX16, GRIA4, CHD2, HTRA1, SLC19A3, PTPRO, ASH1L, DNM1, DPYD, HTT, HACE1, ADNP, CTNNB1, SLC1A2, HIBCH, MECP2, FOCAD, MSH2, NHLRC2, GNAS, MAPK10, BMPR1A, NDUFS1, MAGI2, PSAP, HLA-DQB1, VPS13A, NDUFA2, STAG2, VPS50, GABRB3, NRCAM, VPS53, PRKAR1A, DISP1, ATM, CACNA1A, SPTBN1, MT-ATP6, ST3GAL3, PRNP, UBAC2, HLCS, RPS20, MAPT, EHMT1, RNF13
HP:0002007	Frontal bossing	82	0.045989904655075714	2.0413967161119384	4.921313683043522e-10	3.894273373651439e-08	7.409573564757165	5.06255538574687e-06	ANKRD11, FBN1, SNX14, GPC6, ARID2, UBE4B, PPM1B, EPB41L1, APC, CSPP1, PREPL, DDX6, OPHN1, RPS6KA3, HERC1, CDH2, PRKAR1A, SPECC1L, CREBBP, CAMKMT, PTEN, ARID1B, DSE, PIK3R1, SON, CTNNB1, MPDZ, SOX5, ITPR1, PIGN, NFIA, KAT6A, GATAD2B, ZNF148, MED27, BRAF, INTU, NSD1, TRIO, PAK1, VPS35L, UNC80, RERE, MBD5, EPB41, SIK3, ADK, IFT80, KIDINS220, PPP2CA, SMARCA2, SMAD2, CWC27, RNPC3, BMPR1A, STAG2, FBXO11, PDE4D, FRYL, TRPS1, SUPT16H, ZEB2, PAFAH1B1, BRWD3, YWHAE, HNRNPU, HECTD4, KDM5A, HSD17B4, KCTD1, MAP2K1, CSGALNACT1, CNTNAP2, DICER1, LIFR, MED13L, DYNC2H1, WWOX, ASPH, SETBP1, CRPPA, RFX7
HP:0000278	Retrognathia	59	0.03309029725182277	2.040502282031562	1.1919328983706e-07	6.1065452711194294e-06	5.214204418893344	0.0012261413725538361	HECTD4, MBD5, DHX9, HSD17B4, RARB, ARID1B, SLC4A10, HDAC8, SCLT1, BBS9, ACTB, FBN1, CEP290, DPYD, FBXW11, FOXP1, FARS2, SNRPN, PIK3C2A, SETD2, COG5, RPS19, CTNNB1, KAT6B, RSRC1, SMAD2, RPL17, ARID2, AUTS2, BBS2, HS2ST1, SMAD4, PREPL, FUT8, SUZ12, EYA1, CASK, ARNT2, PRKG1, KDM6A, INTU, FBXO11, CREBBP, NSD1, TRIO, DYRK1A, ASPH, RPL5, FRYL, PPP3CA, FTO, COG6, HNRNPK, SDCCAG8, SETBP1, CRPPA, CCDC88A, ATG7, WDPCP
HP:0000006	Autosomal dominant inheritance	395	0.22153673583847447	2.0378609251135416	1.9553122153770429e-47	2.011429675958364e-43	42.69649514672539	2.011429675958364e-43	OPA1, RPL21, MED12L, TNXB, CACNB2, PRKAG2, FBN1, HTT, RB1CC1, DCAF8, GLUL, RORA, NR3C2, APP, BMPR2, RPL26, GNAS, BSCL2, APC, RIMS2, DDX6, GABRB3, ZNF462, SPECC1L, GABRA2, ITM2B, FOXP1, CDK19, TNRC6B, KMT2E, DIP2B, GDAP1, AGBL1, SON, BCL11B, BPTF, CACNB4, CERT1, GATAD2B, SNAP25, ZNF148, MAP1B, DYNC1H1, LMBR1, CALM3, TRIO, PDSS1, RPS23, KMT2A, KIF21A, ATP2B1, ROBO1, RARB, ATP2C1, STX16, IL6ST, SNRPN, KIF2A, KIDINS220, AUTS2, TRIP12, COCH, KCNH1, ATXN10, KIF1B, KLHL24, NRIP1, SLC1A3, PTH1R, MEIS2, SPTBN1, TANC2, TRPS1, NAA15, MAPT, KCNQ3, HNRNPU, SETX, MAP2K1, AHR, CSGALNACT1, HNRNPA2B1, ASH1L, ADGRV1, KANSL1, NCDN, MSH2, NBAS, AKT3, STAG1, GNAQ, UCHL1, CYFIP2, ATXN7, UBE3A, CHD4, PRKG1, CDK8, KCNN3, VAMP2, IRF2BP2, AKAP9, CLTC, PLCG2, CEP290, WAC, VPS13B, GABRB2, OPCML, NR3C1, NTRK2, EPB41L1, MYO6, CTNND1, SUZ12, WNK1, ATP2A2, ATP2B2, SYNE1, CFI, CSNK2B, PTEN, RASA1, CDK13, MIB1, ZMYND11, ZEB1, MLLT10, SCN2A, ZBTB20, RPL17, FRMD5, WDFY3, NIPBL, NFIA, SMARCAD1, PPP2R2B, RBPJ, CUL3, SCN8A, PAK1, SYNE2, RERE, GRIN2B, SGCE, RNF13, PDE10A, SLC4A10, SLC12A6, TNS1, BBS9, ZNF292, PICALM, CALM1, KAT6B, GABRB1, SMARCA2, MXI1, SMAD2, FGF12, KIF5C, MYT1L, CWC27, SLC6A1, NBEA, KCNT2, EYA1, RPL5, ATF6, PTPN11, GABRG2, SPTAN1, TBL1XR1, DHX9, KCTD1, CHN1, ACTB, CALM2, SHOC2, DICER1, NEK1, CDC73, ATP6V0A1, APOE, TTC21B, ANK2, HLA-DQB1, ATM, GNAO1, TCF4, GPHN, WDPCP, WASF1, PBX1, RFX7, MED13, KLHL3, DCTN1, GRIA4, ANKRD11, TPM1, ARHGEF10, ADNP, SETD2, ARID2, SLC1A2, TMEM43, ZMYM2, SCN3A, TAOK1, CFH, CSPP1, ZSWIM6, KCNQ5, MECOM, CDH2, NF1, HERC2, CAMTA1, PPP1R12A, PRKACB, YWHAG, LRRC8C, AHI1, DPP6, CSNK2A1, SMARCC1, SYT1, RPS19, RPS28, SOX5, ARHGAP26, SYN2, BBS2, RPL13, CCN2, GIGYF2, ZFHX3, TENM4, SSBP1, HNRNPDL, NSD1, CACNA1A, PPP3CA, AQP4, CNOT2, RPL18, MBD5, ADAR, ANKRD17, PKD2, SLC25A46, DCC, PPP2CA, SPRED1, RPS29, ANO3, SMAD4, HNRNPR, PSAP, PRKN, ADAM10, CYLD, PDE4D, DYRK1A, DMXL2, SOS2, ATR, AFF4, SUPT16H, ZEB2, PAFAH1B1, CTNNA3, SLC20A2, USP48, CACNA1E, ARID1A, INVS, SEPTIN9, GRIA2, HNRNPK, ATL1, MSH3, GLS, PUM1, CELF2, GNAL, THRA, NPHP3, PHIP, PHF21A, TTBK2, JAK1, TRPM7, HNRNPC, XPR1, NLGN1, MACF1, VWA8, PRKAR1A, PHACTR1, CREBBP, TARDBP, SOS1, GRIK2, EHMT1, TAB2, RIMS1, CAMK2B, PTPRJ, ARFGEF1, JAK2, ARID1B, SEMA3A, SGCD, PIK3R1, KCNMA1, CTNNB1, DTNA, AFF3, GABRA5, ITPR1, KAT6A, EIF4A2, BRAF, RB1, SNCA, PRNP, LRP1, SMCHD1, ELP4, KCNB1, MAPRE2, RYR2, ATXN1, TCF12, CHD2, EPB41, SERPINI1, ADCY5, ROBO2, ANO5, RPS17, RPS27, RPL35, NALCN, BMPR1A, ATP1A1, CTNNA1, LRRK2, ERBB4, RBFOX2, FBXO11, ATXN2, ALMS1, FRYL, ATP6V0C, THRB, SDCCAG8, PLD3, MEF2A, LPP, PDE8B, MTAP, SCD5, KDM5A, CACNA1D, SNCAIP, HTRA1, CEP85L, DNM1, RIPOR2, FBXW11, PDE1C, GRIA1, TNRC6A, FBXO38, FBXW7, MED13L, PRKACA, RPL27, LRP12, TLK2, GNB1, KDM6A, GNAI2, DYNC2H1, NSF, KMT2C, ASPH, RAPGEF2, MAPK1, SETBP1, ZNF644, FAR1
HP:0000047	Hypospadias	65	0.03645541222658441	2.0238158226920016	3.7839535344373455e-08	2.250030636344334e-06	5.647811568508767	0.00038925530008756973	HUWE1, MAPRE2, MAP2K1, ARID1B, HDAC8, MED12L, TCF12, OGT, RPL8, USP9X, GRIP1, KANSL1, ARID1A, RPS19, KAT6B, JMJD1C, SMARCA2, RPS28, RPS29, ATRX, ARID2, ACBD6, ZMYM2, UBE4B, MECP2, FOCAD, NIPBL, LRPPRC, RPL26, RPS17, BBS2, SMAD4, PIGN, RPS27, RPL35, GATAD2B, EHMT1, CSPP1, ATP6AP2, PRKACA, RPL27, BRAF, KDM6A, PDE4D, CREBBP, NSD1, WWOX, DYRK1A, VPS35L, SPTBN1, RPL5, FRYL, RERE, PTPN11, PPP1R12A, ATR, PRKACB, AFF4, SETBP1, RPL18, RPS20, ZEB2, PUM1, SMCHD1, RPL9
HP:0000286	Epicanthus	184	0.10319685922602355	2.0184639246146068	8.419697404316596e-21	3.2619074314925084e-18	17.486528367809058	8.661342719820483e-17	PHIP, LMBRD1, IDS, PHF21A, ANKRD11, TMEM165, FBN1, CEP290, WAC, SLC10A7, SNX14, ADNP, GPC6, SETD2, ARID2, HIBCH, ZMYM2, MECP2, FOCAD, UBE4B, RPL26, GNAS, CSPP1, ZSWIM6, PREPL, DDX6, RPS6KA3, MACF1, CASK, MECOM, PRKAR1A, ZNF462, SPECC1L, NF1, CREBBP, SOS1, GTF2I, CTNND2, PPP1R12A, PRKACB, AHI1, TAB2, PTEN, ZNF407, CDK13, ARID1B, SEMA3A, DSE, PIK3R1, SON, CSNK2A1, RPL8, EXOC6B, BCL11B, SYT1, BPTF, ATRX, RPS19, ZBTB20, CTNNB1, RPS28, RPL17, AFF3, SOX5, CERT1, ACBD6, AP3B1, NIPBL, HS2ST1, RPL13, PIGN, BCAS3, KAT6A, GATAD2B, ZNF148, MAP1B, EIF4A2, BRAF, LMBR1, INTU, RBPJ, NSD1, TRIO, VPS35L, UNC80, RERE, RB1, RPS23, KMT2A, CHST11, RPS20, RPL18, CCDC88A, MAPRE2, SPARC, RAB3GAP2, TBCK, IL6ST, PRORP, TCF12, REV3L, TRIM33, ZNF292, RFX7, IFT80, PIK3C2A, PPP2CA, SPRED1, KAT6B, RIN2, ANO5, SMARCA2, RPS29, TRIP12, SMAD2, AUTS2, KCNH1, RNPC3, RPS17, SMAD4, SPART, RPS27, RPL35, NALCN, STAG2, VPS53, PTH1R, DYM, PDHX, FBXO11, PDE4D, ALMS1, NSMCE2, DMXL2, RPL5, FRYL, SOS2, PTPN11, TRPS1, BTRC, ATR, SUPT16H, ZEB2, PAFAH1B1, MTAP, HNRNPU, RPL9, YWHAE, MICU1, DHX9, HSD17B4, KCTD1, MAP2K1, HDAC8, CSGALNACT1, ACTB, CNTNAP2, KANSL1, SHOC2, NCDN, NEK1, JMJD1C, CDC73, NBAS, TTC21B, LIFR, ATP9A, MED13L, PRKACA, RPL27, UBE3A, CHD4, TLK2, SEPTIN9, KDM6A, NIN, DYNC2H1, SUMF1, WWOX, MAPK1, COG6, PUM1, FAR1, PBX1
HP:0001251	Ataxia	158	0.0886146943353898	2.016694192852694	6.075047359427471e-18	1.5623503046607598e-15	14.806221583567394	6.249401218643039e-14	NDUFS8, NPHP3, RAD50, RNF216, OPA1, MYO5A, CACNA1B, CEP290, HTT, HACE1, SNX14, GABRB2, RORA, SYNJ1, NTRK2, SLC1A2, MT-ND4, HIBCH, MECP2, SCN3A, FGF13, APP, BSCL2, CSPP1, RIMS2, ZSWIM6, OXR1, CNKSR2, MT-CO3, OPHN1, GABRB3, NRCAM, GABRA2, GTF2I, MT-ATP6, GRIK2, VPS13D, CAMTA1, MT-ND1, ITM2B, CACNA2D1, SYNE1, YWHAG, TTC19, AHI1, NEXMIF, PTEN, SPIDR, CDK19, ATAD1, PUM1, CAMK2B, SACS, SEMA3A, KCNMA1, DHFR, CSNK2A1, SYT1, GRID2, CACNB4, MT-CO2, SCN2A, ZBTB20, SCARB2, FRMD5, ACBD6, GPI, BBS2, MT-CYB, GABRA5, ITPR1, SNAP25, MT-ND4L, LYST, PPP2R2B, BRAF, SCN8A, CACNA1A, MT-ND5, PPP3CA, PRNP, HLCS, ATG7, TPP1, KCNB1, SORL1, MBD5, ADAR, SLC4A10, CHD2, BBS9, SLC19A3, UBE3C, SNRPN, SLC25A46, FRMD4A, DCC, GABRB1, REPS1, FGF12, MYO9A, SLC6A1, SMAD4, KIF1B, NALCN, NFASC, NDUFS1, PSAP, SLC1A3, ATXN2, PDHX, ALMS1, DYRK1A, DMXL2, SPTBN1, UBAC2, AGTPBP1, SDCCAG8, GABRG2, PAFAH1B1, SPTAN1, YWHAE, MICU1, SETX, KDM5A, DHX9, HSD17B4, MAP2K1, NEMF, SCLT1, HTRA1, AUH, DNM1, ADGRV1, CNTNAP2, CTNNA2, ATP6V0A1, MT-ND2, LRPPRC, UCHL1, MT-CO1, INVS, FBXW7, HLA-DQB1, MED13L, CYFIP2, ATXN7, UBE3A, LRP12, ATM, SUMF1, WWOX, TCF4, CLTC, GPHN, MT-ND3, WDPCP, CELF2
HP:0003487	Babinski sign	53	0.029725182277061134	2.013881099270892	8.603711876681206e-07	3.687766003142482e-05	4.4332366436834985	0.008850638407541956	SETX, ADAR, DCTN1, OPA1, IREB2, ATXN1, SACS, HTRA1, SLC19A3, HTT, FARS2, SNX14, SLC25A46, GRIA3, GRID2, NEK1, SLC1A2, MECP2, APOE, FGF13, ATXN10, SLC44A1, ITPR1, BSCL2, SPART, UCHL1, NFASC, NDUFS1, TAF15, ZFHX3, PSAP, PRKN, ATP6AP2, ATXN7, LRP12, ERBB4, ATXN2, CACNA1A, WWOX, TARDBP, MT-ATP6, VPS13D, ZFR, PGAP1, SNCA, ANO10, SLC9A7, ATL1, PRNP, SYNE1, TTC19, SPTAN1, TPP1
HP:0000028	Cryptorchidism	138	0.07739764441951767	2.0127296521014975	1.1000029775796201e-15	2.057405569156646e-13	12.686680088915368	1.1315730630361552e-11	PHIP, ANKRD11, OGT, FBN1, CEP290, ADNP, GPC6, VPS13B, RORA, ARID2, HIBCH, ZMYM2, MECP2, UBE4B, CSPP1, ZSWIM6, DDX6, OPHN1, SUZ12, THOC2, PRKAR1A, CDH2, PHACTR1, ZNF462, NF1, SPECC1L, CREBBP, HERC2, SOS1, GTF2I, PPP1R12A, PRKACB, SYNE1, EHMT1, TIAM1, TNRC6B, STT3B, AP1S2, KMT2E, ARID1B, MRPS28, SEMA3A, DSE, RAB3GAP1, GRIP1, RASA2, COG5, ATRX, ZBTB20, SOX5, ACBD6, NIPBL, BBS2, HS2ST1, ITPR1, PIGN, KAT6A, FXR1, CPE, ARNT2, BRAF, LMBR1, NSD1, VPS35L, RERE, GRIN2B, KMT2A, KIF21A, SMCHD1, ROBO1, HUWE1, MAPRE2, MBD5, RARB, RAB3GAP2, TBCK, TCF12, BBS9, IFT80, SNRPN, USP9Y, PIK3C2A, GRIA3, DCC, KAT6B, RIN2, SMARCA2, AUTS2, SMAD2, MYT1L, CWC27, SMAD4, NALCN, HNRNPR, FBXO11, PDE4D, DYRK1A, FRYL, FTO, SOS2, PTPN11, ATR, AFF4, SDCCAG8, ZEB2, BRWD3, TBL1XR1, MAP2K1, HDAC8, TSPYL1, SCLT1, CSGALNACT1, ACTB, ASH1L, KANSL1, SHOC2, ARID1A, JMJD1C, STAG1, FBXW7, MED13L, NNT, PRKACA, CHD4, DYNC2H1, KDM6A, CDK8, WWOX, ASPH, GRIA2, TCF4, MAPK1, HNRNPK, SETBP1, CRPPA, PUM1, WDPCP, PBX1
HP:0004322	Short stature	232	0.13011777902411667	2.0074200575136385	6.626931752422803e-26	4.260702933573336e-23	22.37051874479681	6.8171246937173375e-22	NPHP3, RAD50, RNF216, LMBRD1, IDS, GRIA4, IQSEC1, JAK1, SLC4A4, ANKRD11, TMEM165, FBN1, CACNA1B, SLC10A7, CEP290, HACE1, ADNP, GPC6, CDK6, SETD2, GABRB2, VPS13B, SYNJ1, NTRK2, SLC1A2, MT-ND4, ARID2, ZMYM2, MECP2, SCN3A, UBE4B, RPL26, GNAS, TAOK1, CSPP1, PREPL, MT-CO3, RPS6KA3, MACF1, THOC2, CASK, NRCAM, GRM7, CNKSR2, PAK3, PRKAR1A, SPECC1L, NF1, CREBBP, GABRA2, HERC2, TBC1D32, SOS1, GTF2I, MT-ATP6, PGAP1, CTNND2, CAMTA1, MT-ND1, CACNA2D1, YWHAG, LRRC8C, EHMT1, ACER3, PTEN, SPIDR, CDK19, AP1S2, ASCC3, ZNF407, DPP6, CAMK2B, COX8A, CDK13, ARID1B, PIK3R1, SON, KCNMA1, RPL8, EXOC6B, RAB3GAP1, PCLO, BPTF, MT-CO2, RASA2, COG5, ATRX, RPS19, ZBTB20, SCARB2, RPS28, RPL17, AFF3, NIPBL, BBS2, WDPCP, CCN2, GABRA5, ITPR1, PCCA, BCAS3, KAT6A, ZNF148, FXR1, EIF4A2, ARNT2, BRAF, LMBR1, INTU, NSD1, SCN8A, CACNA1A, MT-ND5, VPS35L, PPP3CA, WRN, RERE, RB1, RPS23, KMT2A, RPS20, RPL18, ROBO1, KCNB1, HUWE1, MAPRE2, MBD5, SPARC, ADAR, STX16, RAB3GAP2, ANKRD17, IL6ST, BBS9, IFT80, SNRPN, PIK3C2A, GRIA3, SPRED1, KAT6B, RIN2, SMARCA2, RPS29, SMAD2, AUTS2, FGF12, MYT1L, KCNH1, CWC27, RNPC3, RPS17, SMAD4, SPART, RPS27, BMPR1A, RPL35, NALCN, FUT8, EYA1, STAG2, VPS53, PTH1R, DYM, DISP1, FBXO11, PDE4D, ALMS1, MEIS2, DYRK1A, DMXL2, RPL5, FRYL, SOS2, PTPN11, TRPS1, ATR, AFF4, SDCCAG8, GABRG2, ZEB2, TBL1XR1, RPL9, HNRNPU, DHX9, HSD17B4, KCTD1, MAP2K1, HDAC8, SCLT1, CSGALNACT1, HNRNPA2B1, ACTB, DNM1, USP9X, KANSL1, SHOC2, NCDN, ARID1A, NEK1, JMJD1C, CTNNA2, MYSM1, PLAAT3, NBAS, DYNC1I2, STAG1, TTC21B, INVS, MT-CO1, LIFR, MED13L, HLA-DQB1, CYFIP2, RPL27, UBE3A, CHD4, TLK2, SEPTIN9, KDM6A, ATM, NIN, DYNC2H1, SUMF1, KMT2C, WWOX, MAPK1, CLTC, PUM1, FAR1, PHKB, CELF2, PBX1
HP:0000023	Inguinal hernia	57	0.03196859226023556	2.001292176874807	4.694129700028071e-07	2.1272472345457607e-05	4.672182032260342	0.004828851222418877	TNRC6B, MAPRE2, NPHP3, AP1S2, IDS, ARID1B, RAB3GAP2, SMCHD1, DSE, PIK3R1, TRIM33, FBN1, CSNK2A1, SLC10A7, FBXW11, ADNP, ZEB1, SHOC2, PPP2CA, ARID1A, DICER1, JMJD1C, SMARCA2, RPL17, SMAD2, AUTS2, FOCAD, CWC27, NIPBL, LRPPRC, SMAD4, NFIA, NALCN, DDX6, RPS6KA3, SUZ12, YWHAE, BRAF, PRKG1, KDM6A, CREBBP, NSD1, KMT2C, MEIS2, DYRK1A, VPS35L, ASPH, GTF2I, CTNND2, MAPK1, GRIN2B, GPHN, SETBP1, EHMT1, PAFAH1B1, RNF13, ATAD1
