	DrugBank_ID	DrugBank_Name	Indication	Targets	Proximity	Normalized_Enrichment_Score	FDR
139	DB01069	Promethazine	Promethazine tablets and suppositories are indicated to treat rhinitis, allergic conjunctivitis, allergic reactions to blood or plasma, dermographism, anaphylactic reactions, sedation, nausea, vomiting, pain, motion sickness, and allergic skin reactions.[A189907,L4000] Promethazine cough syrup with phenylephrine and codeine is indicated to relieve cough and upper respiratory symptoms, and nasal congestion associated with allergy or the common cold.[L11326]	CHRM1, CALM1, CHRM2, DRD2, ADRA1A, CHRM5, CHRM3, HRH2, CHRM4, HRH1, SCN1A	-0.20689303303102527	-1.7753068370881353	<0.0001
140	DB04447	1,4-Dithiothreitol		PPIB, TPI1, MSRA, GSTZ1, AXIN1, LGALS1, CAMK2A, TRPM7, ALDH1A1, HMGCR	-0.20404784562453512	2.3028230787128128	<0.0001
141	DB00210	Adapalene	Adapalene is indicated for the topical treatment of acne vulgaris in patients aged 12 and over.[L12873]	RXRB, TLR2, JUN, RARB, RARG, GOT1, RXRG, RARA, RXRA	-0.18759409324670687	1.8651670923105697	<0.0001
142	DB00280	Disopyramide	For the treatment of documented ventricular arrhythmias, such as sustained ventricular tachycardia, ventricular pre-excitation and cardiac dysrhythmias. It is a Class Ia antiarrhythmic drug.	CHRM1, ORM2, CHRM2, KCND2, KCND3, CHRM3, KCNH2, SCN5A	-0.17892724133130325	1.5154425136342293	<0.0001
143	DB01149	Nefazodone	For the treatment of depression.	ADRA2A, HTR1A, HTR2A, ADRA1A, KCNH2, SLC6A4, SLC6A2, ADRA1B, HTR2C, SLC6A3	-0.14537488421974562	1.430145933732274	<0.0001
144	DB00247	Methysergide	For the treatment of vascular headache	HTR7, HTR2B, HTR1A, HTR2A, HTR1E, HTR1F, HTR2C, HTR1B	-0.14497031313454084	1.4872503764569298	<0.0001
145	DB01248	Docetaxel	For the treatment of patients with locally advanced or metastatic breast cancer after failure of prior chemotherapy. Also used as a single agent in the treatment of patients with locally advanced or metastatic non-small cell lung cancer after failure of prior platinum-based chemotherapy. It is also used in combination with prednisone, in the treatment of patients with androgen independent (hormone refractory) metastatic prostate cancer. Furthermore, docetaxel has uses in the treatment of gastric adenocarinoma and head and neck cancer. 	MAP2, MAP4, NR1I2, BCL2, MAPT, TUBB1	-1.915660806979102	1.3113707469409752	0.00040303767121988596
146	DB00925	Phenoxybenzamine	For the treatment of phaeochromocytoma (malignant), benign prostatic hypertrophy and malignant essential hypertension.	ADRA2C, CALM1, ADRA1A, ADRA1B, ADRA2A, ADRB2, ADRA1D, ADRA2B	-0.44671482965712106	-1.3573053777401638	0.0005550498434759441
147	DB06780	Desoxycorticosterone acetate		NR3C2	-3.243055344593574	-1.2904915166467887	0.0011543294856240956
148	DB08437	Puromycin		RPL19, RPL13A, RSL24D1, RPL3, RPL37, RPL10L, RPL26L1, RPL11, RPL23, RPL15, RPL8, RPL23A	-1.8027609556528417	-1.3218960712633165	0.001511379800853485
149	DB00862	Vardenafil	Used for the treatment of erectile dysfunction	PDE6H, PDE6G, PDE5A	-0.747726285228686	1.2531626601488306	0.0018598779718072796
150	DB00860	Prednisolone	Prednisolone is indicated to treat endocrine, rheumatic, and hematologic disorders; collagen, dermatologic, ophthalmic, respiratory, and gastrointestinal diseases; allergic and edematous states; and other conditions like tuberculous meningitis.[L9542]	NR3C1	-5.3227122553402735	1.2803489272897983	0.002257481940144479
151	DB01131	Proguanil	For the causal prevention and suppression of malaria caused by susceptible strains of <i>P. falciparum</i> and other species of Plasmodium found in some geographical areas of the world.	DHFR	-3.84188252861212	1.2218486098372325	0.004583615263696008
152	DB00717	Norethisterone	"Norethisterone is indicated as an oral contraceptive when given as monotherapy[L9527] or in combination with an estrogen component, such as [ethinylestradiol] or [estradiol].[L10313,L10307] In combination with an estrogen component, oral norethisterone is also indicated as a hormone replacement therapy in the treatment of postmenopausal osteoporosis and moderate-to-severe vasomotor symptoms arising from menopause.[L10304] When applied via transdermal patch, the combination of norethisterone and estradiol is indicated for the treatment of hypoestrogenism, vulvovaginal atrophy, and moderate-severe vasomotor symptoms.[L10301]

Norethisterone, taken in combination with intramuscular [leuprolide], is also indicated for the symptomatic treatment of endometriosis-related pain.[L10310]"	AR, NR3C1, PGR	-1.6403828935408167	1.2464482402124966	0.0051003725625988795
153	DB08162	Fasudil		ROCK1, ROCK2, PKIA, PRKACA	-3.849015987801315	1.208182757568076	0.005814461328307113
154	DB04905	Tesmilifene	Intended for the treatment of various forms of cancer.	ABCB1, HRH1	-1.5766521454639684	-1.2256929902912996	0.0061868992268895515
155	DB00420	Promazine	Used as an adjunct for short term treatment of moderate and severe psychomotor agitation. Also used to treat agitation or restlessness in the elderly.	CHRM1, DRD2, HTR2A, ADRA1A, HTR2C, HRH1	-0.4920709839120099	1.1952707890365784	0.011211943821633836
156	DB02918	Zardaverine		PDE4D	-3.507009317514218	-1.2125247624354216	0.01535488410189063
157	DB07996	5-(2-methylpiperazine-1-sulfonyl)isoquinoline		PKIA, PRKACA	-3.738453725726021	1.1354329993638936	0.020392232128192397
158	DB05022	Amonafide	Investigated for use/treatment in breast cancer, ovarian cancer, and prostate cancer.	TOP2A, TOP2B	-1.9587219857281157	-1.1319928748992527	0.02780545741864702
159	DB01388	Mibefradil	For the treatment of angina and high blood pressure.	CACNA1G, CACNA1S, CACNA1H, CACNA1I, CACNB3, CACNA1C, CACNB4, CACNA1D, CACNB2, CACNA1F, CACNB1	-0.5023367352247571	-1.1514255944093406	0.028170288758206513
160	DB00477	Chlorpromazine	For the treatment of schizophrenia; to control nausea and vomiting; for relief of restlessness and apprehension before surgery; for acute intermittent porphyria; as an adjunct in the treatment of tetanus; to control the manifestations of the manic type of manic-depressive illness; for relief of intractable hiccups; for the treatment of severe behavioral problems in children (1 to 12 years of age) marked by combativeness and/or explosive hyperexcitable behavior (out of proportion to immediate provocations), and in the short-term treatment of hyperactive children who show excessive motor activity with accompanying conduct disorders consisting of some or all of the following symptoms: impulsivity, difficulty sustaining attention, aggressivity, mood lability, and poor frustration tolerance.	DRD1, DRD2, HTR1A, DRD5, ORM1, SMPD1, CALM1, HTR2A, ADRA2A, HTR2C, HTR7, CHRM1, DRD3, ADRA1A, HTR6, HRH4, ADRA1B, KCNH2, DRD4, CHRM3, HRH1	-0.210720100827509	1.1269786360853435	0.03401197221421941
161	DB00588	Fluticasone propionate	Fluticasone propionate is indicated as an inhaler for the treatment and management of asthma by prophylaxis[FDA Label]as well as inflammatory and pruritic dermatoses[F4355]. Fluticasone propionate nasal spray is indicated for managing allergic and nonallergic rhinitis[L8309,F4358].	PLA2G4A, NR3C2, NR3C1, PGR	-2.041051006304006	-1.1209950469856544	0.03859621547516132
162	DB00635	Prednisone	Prednisone is indicated as an anti-inflammatory or immunosuppressive drug for allergic, dermatologic, gastrointestinal, hematologic, ophthalmologic, nervous system, renal, respiratory, rheumatologic, infectious, endocrine, or neoplastic conditions as well as in organ transplant.[L10502]	NR3C1	-5.3227122553402735	-1.1462826606684955	0.055823080734843024
163	DB03849	Cilomilast	Investigated for use/treatment in chronic obstructive pulmonary disease (COPD).	PDE4D, PDE4B	-3.4833420273340154	1.1094248511589373	0.07577774550618001
164	DB00436	Bendroflumethiazide	For the treatment of high blood pressure and management of edema related to heart failure.	CA4, SLC12A3, KCNMA1, CA2, CA1	-0.2723587204334865	-1.115664751638015	0.07805194717829009
165	DB00659	Acamprosate	Acamprosate is indicated for the maintenance of abstinence from alcohol in patients with alcohol dependence who are abstinent at treatment initiation. It is also indicated for the maintenance of alcohol abstinence in patients who have undergone alcohol detoxification. This drug should be used with a psychosocial support program providing adequate support.[L31738]	GABBR1, GRM5, GRIN1	-1.95910552939567	-1.129355316261227	0.08588555346265594
166	DB00875	Flupentixol	"Flupentixol is indicated for maintenance therapy of chronic schizophrenic patients whose main manifestations do not include excitement, agitation or hyperactivity.[L31808]

It is indicated for the management of depression in adult patients who may, or may not, also be showing signs of anxiety.[L31928]

Flupentixol in combination with [melitracen] is indicated to manage symptoms of anxiety, depression, and asthenia in adults.[L31923]"	DRD1, DRD3, CHRM1, DRD2, HTR2A, ADRA1A, HTR2C, DRD4	-0.31885779109427936	-1.0985515437665108	0.09053904972039412
167	DB00700	Eplerenone	For improvement of survival of stable patients with left ventricular systolic dysfunction (ejection fraction <40%) and clinical evidence of congestive heart failure after an acute myocardial infarction.	NR3C2	-3.243055344593574	-1.1164989342881297	0.09558711361593772
168	DB00741	Hydrocortisone	Otic solutions are indicated for infections of the external auditory canal caused by susceptible organisms and with inflammation.[L10529,L10532] Hydrocortisone tablets are indicated for certain endocrine, rheumatic, collagen, allergic, ophthalmic, respiratory, hematologic, neoplastic, edematous, gastrointestinal, and other conditions.[L10535] A hydrocortisone enema is indicated for ulcerative colitis,[L10538] a topical ointment with antibiotics is indicated for corticosteroid responsive dermatoses with infections,[L7772] and a topical cream with [acyclovir] is indicated to treat cold sores.[L7321] Oral granules of hydrocortisone are used as a replacement therapy for Adrenocortical Insufficiency (AI) in children under 17 years of age.[L16533]	NR3C1, ANXA1	-2.560965233990681	-1.0978915352515317	0.09825831366302577
169	DB08916	Afatinib	"Afatinib is a kinase inhibitor indicated as monotherapy [L2937] for the first-line [FDA Label] treatment of (a) Epidermal Growth Factor Receptor (EGFR) TKI (tyrosine kinase inhibitor)-naive adult patients with locally advanced or metastatic non-small cell lung cancer (NSCLC) whose tumours have non-resistant EGFR mutations as detected by an FDA-approved test [FDA Label], and (b) adult patients with locally advanced or metastatic NSCLC of squamous histology progressing on or after platinum-based chemotherapy [FDA Label, L2937].

Recently, as of January 2018, the US FDA approved a supplemental New Drug Application for Boehringer Ingelheim's Gilotrif (afatinib) for the first line treatment of patients with metastatic non-small cell lung cancer (NSCLC) whose tumors have non-resistant epidermal growth factor receptor (EGFR) mutations as detected by an FDA-approved test [L2939]. The new label includes data on three additional EGFR mutations: L861Q, G719X and S768I [L2939]."	EGFR, ERBB2, ERBB4	-1.2674588787599592	1.0769515874969422	0.11775927021223312
170	DB04942	Tamibarotene	Investigated for use/treatment in leukemia (unspecified).	RARB, RARA	-1.5469096753663736	-1.123436450430574	0.12340489711975659
171	DB14544	Hydrocortisone valerate	For the relief of the inflammatory and pruritic manifestations of corticosteroid-responsive dermatoses. Also used to treat endocrine (hormonal) disorders (adrenal insufficiency, Addisons disease). It is also used to treat many immune and allergic disorders, such as arthritis, lupus, severe psoriasis, severe asthma, ulcerative colitis, and Crohn's disease.	NR3C1, ANXA1, HSD3B1, HSD11B2	-1.1800917233158843	-1.1044503516179343	0.14679658879794671
172	DB01244	Bepridil	For the treatment of hypertension, and chronic stable angina (classic effort-associated angina).	CACNA2D2, CACNA1H, PDE1A, CALM1, KCNQ1, ATP1A1, PDE1B, TNNC1, KCNH2, CACNA1A	-1.1880343746327562	-1.0906351679835118	0.15411048935096894
173	DB00820	Tadalafil	Tadalafil is indicated for the treatment of erectile dysfunction (ED) and either alone or in combination with [finasteride] for the treatment of benign prostatic hypertrophy (BPH).[L39095,L39439] It is also indicated for the treatment of pulmonary arterial hypertension (PAH) both alone and in combination with [macitentan] or other endothelin-1 antagonists.[L39100,L39105]	PDE6G, PDE5A, PDE11A	-0.747726285228686	-1.0926943226374917	0.16496267177589852
174	DB09232	Cilnidipine	"Cilnidipine is indicated for the management of hypertension for end-organ protection.[L1436] It is reported to be useful in elderly patients and in those with diabetes and albuminuria. Cilnidipine has been increasingly used in patients with chronic kidney disease 

Hypertension is the term used to describe the presence of high blood pressure. The blood pressure is generated by the force of the blood pumped from the heart against the blood vessels. Thus hypertension is caused when there is too much pressure on the blood vessels and this effect can damage the blood vessel.[L1438]"	CACNA1B, CACNA1C	-1.2374395312911002	1.0406395598137501	0.21012664646746362
175	DB13954	Estradiol cypionate	Depo-Estradiol intramuscular depot injection is indicated for the treatment of moderate to severe vasomotor symptoms and hypoestrogenism due to hypogonadism.	BECN1, MT-ATP6, GPER1, NCOA2, ESR1, NR1I2, ESR2, HSD17B2, ESRRG, CHRNA4	-0.892815686900887	1.0636385834622095	0.24152427264296564
