	DrugBank_ID	DrugBank_Name	Indication	Targets	Proximity	Normalized_Enrichment_Score	FDR
0	DB12442	Alvespimycin	Investigated for use as an antineoplastic agent for solid tumors, advanced solid tumours or acute myeloid leukaemia. 	HSP90AA1	-5.366381717799816	-1.3396026082196841	<0.0001
1	DB00663	Flumethasone	For the treatment of contact dermatitis, atopic dermatitis, exczema, psoriasis, diaper rash and other skin conditions	NR3C1	-5.3227122553402735	1.7218272314278382	<0.0001
2	DB00394	Beclomethasone dipropionate	"Indicated for oral inhalation use in the maintenance treatment of asthma as prophylactic therapy in patients 5 years of age and older. The aerosol form of beclomethasone diproprionate is not indicated for the relief of acute bronchospasm.[L6871]

Indicated for intranasal use to relieve the symptoms of seasonal or perennial allergic and nonallergic (vasomotor) rhinitis and prevent the recurrence of nasal polyps following surgical removal.[L6880]

Indicated for the relief of the inflammatory and pruritic manifestations of corticosteroid-responsive dermatoses in patients 13 years of age and older.[L10782] Corticosteroid-responsive dermatoses include psoriasis, contact dermatitis (dermatitis venenata), atopic dermatitis (infantile eczema, allergic dermatitis), neurodermatitis (lichen simplex chronicus, lichen planus, eczema, eczematous dermatitis), intertrigo, dyshidroses (pompholyx), seborrheic dermatitis, exfoliative dermatitis, solar dermatitis, stasis dermatitis, and anogenital and senile pruritus.[L6886]"	NR3C1	-5.3227122553402735	1.5753888546740373	<0.0001
3	DB00846	Flurandrenolide	For relief of the inflammatory and pruritic manifestations of corticosteroid-responsive dermatoses, particularly dry, scaling localized lesions	NR3C1	-5.3227122553402735	-1.563250934877406	<0.0001
4	DB01130	Prednicarbate	For the relief of the inflammatory and pruritic manifestations of corticosteroid-responsive dermatoses.	NR3C1	-5.3227122553402735	-1.4651757673738448	<0.0001
5	DB15566	Prednisolone acetate	Prednisolone acetate is indicated as an anti-inflammatory or immunosuppressive agent for allergic, dermatologic, gastrointestinal, hematologic, ophthalmologic, nervous system, renal, respiratory, rheumatologic, or infectious conditions.[L9449] Prednisolone acetate is also indicated in organ transplant patients, as well as endocrine or neoplastic conditions.[L9449]	NR3C1	-5.3227122553402735	1.4488656381911542	<0.0001
6	DB00896	Rimexolone	For the treatment of postoperative inflammation following ocular surgery and in the treatment of anterior uveitis.	NR3C1	-5.3227122553402735	-1.4033741477153925	<0.0001
7	DB00253	Medrysone	For the treatment of allergic conjunctivitis, vernal conjunctivitis, episcleritis, and epinephrine sensitivity.	NR3C1	-5.3227122553402735	1.3819021881283338	<0.0001
8	DB00180	Flunisolide	For the maintenance treatment of asthma as a prophylactic therapy.	NR3C1	-5.3227122553402735	-1.2971619849949754	<0.0001
9	DB00620	Triamcinolone	"Triamcinolone hexacetonide injections are indicated for intralesional administration in alopecia areata, discoid lupus erythematosus, keloids, and necrobiosis lipoidica diabeticorum.[L8246] This formulation can also be used for localized hypertrophic infiltrated inflammatory lesions of granuloma annulare, lichen planus, lichen simplex chronicus, and psoriatic plaques.[L8246]

Triamcinolone acetonide spray and cream are indicated for the treatment of inflammatory and pruritic manifestations of corticosteroid responsive dermatoses.[L8249,L8258] A triamcinolone acetonide 10mg/mL or 40mg/mL injection is indicated intra-articularly for acute gouty arthritis, acute and subacute bursitis, acute nonspecific tenosynovitis, epicondylitis, rheumatoid arthritis, and synovitis of osteoarthritis.[L8252,L8255] The same 10mg/mL injection is indicated by the intralesional route for the treatment of alopecia areata, discoid lupus erythematosus, keloids, necrobiosis lipoidica diabeticorum, and tumors of an aponeurosis or tendon.[L8252] This formulation can also be used for localized hypertrophic infiltrated inflammatory lesions of granuloma annulare, lichen planus, lichen simplex chronicus, and psoriatic plaques.[L8252] The 40mg/mL injection is indicated intramuscularly for controlling severe allergic conditions such as asthma, atopic dermatitis, contact dermatitis, drug hypersensitivity, perennial or seasonal allergic rhinitis, serum sickness, and transfusion reactions; treatment of bullous dermatitis herpetiformis, exfoliative erythroderma, mycosis fungoides, pemphigus, Stevens-Johnson syndrome, congenital adrenal hyperplasia, hypercalcemia in
cancer, nonsuppurative thyroiditis, autoimmune hemolytic anemia, Diamond-Blackfan anemia, pure red cell aplasia, secondary thrombocytopenia, trichinosis, tuberculous meningitis, acute exacerbations of multiple sclerosis or cerebral edema, sympathetic ophthalmia, temporal arteritis, uveitis, ocular inflammation, berylliosis, idiopathic eosinophilic pneumonias, symptomatic sarcoidosis, dermatomyositis, polymyositis, and systemic lupus erythematosus; adjunct treatment of adrenocortical insufficiency, regional enteritis, ulcerative colitis, fulminating or disseminated pulmonary tuberculosis, acute gouty arthritis, acute rheumatic carditis, ankylosing spondylitis, psoriatic arthritis, rheumatoid arthritis; palliative management of leukemia and lymphoma; induction of diuresis or remission of proteinuria in idiopathic nephrotic syndrome or lupus erythematosus.[L8255] A triamcinolone intravitreal injection is indicated for the treatment of sympathetic ophthalmia, temporal arteritis, uveitis, and ocular inflammatory conditions.[L8261] The intravitreal injection is also used for visualization during vitrectomy.[L8261] An extended release suspension is indicated intra-articularly for management of pain in osteoarthritis of the knee.[L8264]

A triamcinolone acetonide suspension for injection into the suprachoroidal space is indicated for the treatment of macular edema associated with uveitis.[L38963]"	NR3C1	-5.3227122553402735	1.2809252726507216	<0.0001
10	DB00547	Desoximetasone	For the relief of the inflammatory and pruritic manifestations of corticosteroid-responsive dermatoses.	NR3C1	-5.3227122553402735	-1.2715232907626253	<0.0001
11	DB05134	Tanespimycin	Investigated for use/treatment in leukemia (myeloid) and solid tumors.	HSP90AA1, HSP90AB1	-5.314347756018138	-2.1678146020664357	<0.0001
12	DB08473	Dichlororibofuranosylbenzimidazole		CSNK2A1	-5.187234485738502	-1.9484532561587582	<0.0001
13	DB04462	Tetrabromo-2-Benzotriazole		CSNK2A1	-5.187234485738502	-1.3161451240960311	<0.0001
14	DB02424	Geldanamycin		HSP90AA1, HSP90AB1, HSP90B1	-5.1328474699403674	-2.1464468778401797	<0.0001
15	DB03444	6-bromoindirubin-3'-oxime		GSK3B	-5.125747120458223	-2.0013887535661468	<0.0001
16	DB01950	AR-AO-14418		GSK3B	-5.125747120458223	1.7655717263261468	<0.0001
17	DB07794	5-(2-PHENYLPYRAZOLO[1,5-A]PYRIDIN-3-YL)-1H-PYRAZOLO[3,4-C]PYRIDAZIN-3-AMINE		MAPK1	-4.951072933953312	2.288355867433745	<0.0001
18	DB08521	4-[4-(4-Fluorophenyl)-2-[4-[(R)-methylsulfinyl]phenyl]-1H-imidazol-5-yl]pyridine		MAPK1, MAPK14	-4.834973324360465	-1.7295326753469966	<0.0001
19	DB03044	Doramapimod		MAPK14	-4.71887371476762	-2.809354455101785	<0.0001
20	DB07138	Neflamapimod		MAPK14	-4.71887371476762	2.121222650520182	<0.0001
21	DB05482	7-ethyl-10-hydroxycamptothecin	Investigated for use/treatment in colorectal cancer.	TOP1	-4.5965329772155235	-3.1168739868794266	<0.0001
22	DB04690	Camptothecin	Investigated for the treatment of cancer.	TOP1	-4.5965329772155235	-1.799304264647559	<0.0001
23	DB01396	Digitoxin	For the treatment and management of congestive cardiac insufficiency, arrhythmias and heart failure.	ATP1A1	-4.555201022345888	1.6233851301687547	<0.0001
24	DB00390	Digoxin	"Digoxin is indicated in the following conditions: 1) For the treatment of mild to moderate heart failure in adult patients.[L9143] 2) To increase myocardial contraction in children diagnosed with heart failure.[L9143] 3) To maintain control ventricular rate in adult patients diagnosed with chronic atrial fibrillation.[L9143]

In adults with heart failure, when it is clinically possible, digoxin should be administered in conjunction with a diuretic and an angiotensin-converting enzyme (ACE) inhibitor for optimum effects.[L9143]

"	ATP1A1	-4.555201022345888	1.4377149432940295	<0.0001
25	DB07101	PD-0325901		MAP2K1	-4.391321376454263	2.6772705277427367	<0.0001
26	DB07460	2-({5-CHLORO-2-[(2-METHOXY-4-MORPHOLIN-4-YLPHENYL)AMINO]PYRIMIDIN-4-YL}AMINO)-N-METHYLBENZAMIDE		PTK2	-4.348993494791395	1.8889172269582213	<0.0001
27	DB07379	(2S)-2-({6-[(3-Amino-5-chlorophenyl)amino]-9-isopropyl-9H-purin-2-yl}amino)-3-methyl-1-butanol		CDK6	-4.213948296063984	-1.707659552533665	<0.0001
28	DB08881	Vemurafenib	"Vemurafenib is approved since 2011 for the treatment of metastatic melanoma with a mutation on BRAF in the valine located in the exon 15 at codon 600, this mutation is denominated as V600E.[A31270] The V600E mutation, a substitution of glutamic acid for valine, accounts for 54% of the cases of cutaneous melanoma.[A31271] 
Vemurafenib approval was extended in 2017, for its use as a treatment of adult patients with Erdheim-Chester Disease whose cancer cells present BRAF V600 mutation.[L1013] Erdheim-Chester disease is an extremely rare histiocyte cell disorder that affects large bones, large vessels, central nervous system, as well as, skin and lungs. It is reported an association of Erdheim-Chester disease and V600E mutation.[A31272]"	BRAF	-4.180012301677327	-2.148387584155327	<0.0001
29	DB06999	PLX-4720		BRAF	-4.180012301677327	-1.5300670905109879	<0.0001
30	DB00864	Tacrolimus	For use after allogenic organ transplant to reduce the activity of the patient's immune system and so the risk of organ rejection. It was given FDA approval in 1994 for use in liver transplantation. Since then, this indication has expanded to kidney, heart, small bowel, pancreas, lung, trachea, skin, cornea, and limb transplants. It has also been used in a topical preparation in the treatment of severe atopic dermatitis.	FKBP1A	-4.041979768743603	-1.6106135151514704	<0.0001
31	DB07970	5-[(2-methyl-5-{[3-(trifluoromethyl)phenyl]carbamoyl}phenyl)amino]pyridine-3-carboxamide		EPHA7	-3.9799150615458436	-2.5492146206556607	<0.0001
32	DB07350	(2E)-N-hydroxy-3-[1-methyl-4-(phenylacetyl)-1H-pyrrol-2-yl]prop-2-enamide		HDAC8	-3.896250029476388	-2.162331600038907	<0.0001
33	DB02565	4-(dimethylamino)-N-[7-(hydroxyamino)-7-oxoheptyl]benzamide		HDAC8	-3.896250029476388	-1.8844683459053257	<0.0001
34	DB08756	Y-27632		ROCK1, ROCK2, PKIA, PRKACA	-3.849015987801315	1.907029433317021	<0.0001
35	DB07997	N-[2-(METHYLAMINO)ETHYL]-5-ISOQUINOLINESULFONAMIDE		PKIA, PRKACA	-3.738453725726021	1.234448579002664	<0.0001
36	DB04149	(R)-Rolipram		PDE4D, PDE4B	-3.4833420273340154	1.520951106545354	<0.0001
37	DB14068	Dexniguldipine		ABCB1	-3.3540860782868487	2.1156673542557645	<0.0001
38	DB06191	Zosuquidar	Investigated for use/treatment in leukemia (myeloid) and myelodysplastic syndrome.	ABCB1	-3.3540860782868487	1.7660822365446722	<0.0001
39	DB14063	Dexverapamil		ABCB1	-3.3540860782868487	-1.6088435620431976	<0.0001
40	DB02877	Arotinoid acid		RARB	-3.2946011380916587	-1.601664303795408	<0.0001
41	DB06654	Safinamide	Safinamide is indicated as an add-on treatment to levodopa with or without other medicines for Parkinson’s disease	MAOB	-3.2946011380916587	-1.4578980550057494	<0.0001
42	DB07859	4-(4-CHLOROPHENYL)-4-[4-(1H-PYRAZOL-4-YL)PHENYL]PIPERIDINE		AKT2, GSK3B, PKIA, PRKACA	-3.100468196137838	2.383130168936785	<0.0001
43	DB08073	(2S)-1-(1H-INDOL-3-YL)-3-{[5-(3-METHYL-1H-INDAZOL-5-YL)PYRIDIN-3-YL]OXY}PROPAN-2-AMINE		PRKACA, AKT2, PKIA, GSK3B	-3.100468196137838	-1.849782345431375	<0.0001
44	DB03759	FG-9041		GRIA2	-3.077742848083825	1.5925136113931626	<0.0001
45	DB01013	Clobetasol propionate	Clobetasol propionate is indicated to treat moderate to severe plaque psoriasis[L11818,L118121,L11824] as well as inflammatory and pruritic manifestations of corticosteroid responsive dermatoses.[L11815,L11827]	NR3C2, NR3C1, ANXA1	-2.7883286041916455	1.359628189112735	<0.0001
46	DB12500	Fedratinib	Fedratinib is indicated to treat adults with primary or secondary myelofibrosis that is either intermediate-2 or high risk.[L8090]	JAK2, JAK1, FLT3	-2.7641488210710317	2.1779561452219975	<0.0001
47	DB01222	Budesonide	Budesonide extended release capsules are indicated for the treatment and maintenance of mild to moderate Crohn’s disease.[L10601,L10604] Various inhaled budesonide products are indicated for prophylactic therapy in asthma[L10607,L10613,L10619] and reducing exacerbations of COPD.[L10619] A budesonide nasal spray is available over the counter for symptoms of hay fever and upper respiratory allergies.[L10616] Extended-release capsules are indicated to induce remission of mild to moderate ulcerative colitis[L10622] and a rectal foam is used for mild to moderate distal ulcerative colitis.[L10625] In addition, a delayed-release capsule formulation of budesonide is indicated to reduce proteinuria in adults with IgA nephropathy at risk of rapid disease progression.[L39479]	NR3C1, ANXA1	-2.560965233990681	1.7848181027788332	<0.0001
48	DB01380	Cortisone acetate	Cortisone acetate is indicated to treat a wide variety of endocrine, rheumatic, collagen, dermatologic, allergic, ophthalmic, respiratory, hematologic, neoplastic, edematous, and gastrointestinal diseases and disorders.[A226300,L13203]	NR3C1, ANXA1	-2.560965233990681	1.686312439929177	<0.0001
49	DB13520	Metergoline		SCN2A	-2.465409416159291	-1.4282271303358698	<0.0001
50	DB07995	H-89		HASPIN, PKIA, PRKACA	-2.425375221364377	1.6593370171087982	<0.0001
51	DB03758	Radicicol		DLAT, HSP90AB1, HSP90B1, PDK3	-2.4076492793258657	-1.326341765277754	<0.0001
52	DB00762	Irinotecan	For the treatment of metastatic colorectal cancer (first-line therapy when administered with 5-fluorouracil and leucovorin). Also used in combination with cisplatin for the treatment of extensive small cell lung cancer. Irinotecan is currently under investigation for the treatment of metastatic or recurrent cervical cancer. Also used in combination with fluorouracil and leucovorin for the treatment of patients with metastatic adenocarcinoma of the pancreas after disease progression following gemcitabine-based therapy. 	TOP1MT, TOP1	-2.1978755949283055	-2.200943356976826	<0.0001
53	DB01030	Topotecan	For the treatment of advanced ovarian cancer in patients with disease that has recurred or progressed following therapy with platinum-based regimens. Also used as a second-line therapy for treatment-sensitive small cell lung cancer, as well as in combination with cisplatin for the treatment of stage IV-B, recurrent, or persistent cervical cancer not amenable to curative treatment with surgery and/or radiation therapy.	TOP1MT, TOP1	-2.1978755949283055	-1.7712044562095257	<0.0001
54	DB11689	Selumetinib	Although selumetinib has been investigated for the treatment of several types of cancer, it is currently only indicated for the treatment of neurofibromatosis type 1 (NF1) in patients ≥2 years who have symptomatic, inoperable plexiform neurofibromas (PN).[A193611,L12852,L12969]	MAP2K1, MAP2K2	-2.0952697945476753	2.082469100949224	<0.0001
55	DB08877	Ruxolitinib	"Ruxolitinib is indicated for the treatment of inte1mediate or high-risk myelofibrosis (MF), including prima1y MF, post-polycythemia vera MF and post-essential thrombocythemia MF in adults.[L31938] It is also indicated to treat disease-related splenomegaly or symptoms in adult patients with these conditions.[L32073]

Ruxolitinib is indicated for the treatment of polycythemia vera (PV) in adults who have had an inadequate response to or are intolerant of hydroxyurea.[L31938]

Ruxolitinib is indicated for the treatment of steroid-refracto1y acute graft-versus-host disease (GVHD) in adult and pediatric patients 12 years and older.[L31938]

Ruxolitinib is indicated for topical non-continuous and short-term treatment of mild to moderate atopic dermatitis in immunocompetent patients who are 12 years and older and whose disease is not adequately controlled with topical prescription therapies or when the topical prescription therapies are not advisable.[L39125]"	TYK2, JAK2, JAK1, JAK3	-2.0229161689635458	1.7760384945385737	<0.0001
56	DB08895	Tofacitinib	"For the treatment of moderate to severe rheumatoid arthritis which is resistant or intolerant to methotrexate therapy. It may also be used as an adjunct to methotrexate therapy, or other non-biologic disease-modifying antirheumatic drugs (DMARDS), when methotrexate alone is not sufficient.  

Tofacitinib has also been investigated as a preventative therapy for kidney transplant rejections, and as a treatment for psoriasis, ulcerative colitis, and ankylosing spondylitis. 

It is not to be initiated in patients with a history of chronic or recurrent infections, or in the presence of active infection, even if localized, due to reports of serious and sometimes fatal infections (commonly pneumonia, herpes zoster and urinary tract infections). Use of tofacitinib is also discouraged in those who have been, or are likely to be, exposed to TB. An increased likelihood of exposure may be encountered by traveling to certain areas. In addition, tofacitinib is not to be used in patients with severe hepatic impairment, or low hemoglobin (less than 9g/dL). Cautioned is advised when using tofacitinib in patients at risk of gastrointestinal perforation, and in the elderly who are more susceptible to infection.   "	TYK2, JAK2, JAK1, JAK3	-2.0229161689635458	1.3683159905044877	<0.0001
57	DB09073	Palbociclib	"Palbociclib is indicated in combination with [letrozole] as initial endocrine-based therapy for the treatment of human epidermal growth factor receptor type 2 (HER2)-negative and hormone receptor(HR)-positive tumors in adult patients with advanced/metastatic breast cancer. It is as well approved in combination with [fulvestrant] in patients with disease progression with prior endocrine therapy.[A176783]

In the official labeling, the use of palbociclib should be accompanied with either an aromatase inhibition, no restricted to letrozole, as initial endocrine-based therapy in postmenopausal women or in man.[FDA label]

The breast cancer starts as a group of cancer cells that grow into and destroy the nearby breast tissue. This growth can spread into other parts of the body which is called metastasis. According to the location of the cancer cells, it can be categorized in ductal carcinoma and lobular carcinoma. However, other types of breast cancer include inflammatory breast cancer, Paget disease of the breast, triple negative breast cancer non-Hodgkin lymphoma and soft tissue sarcoma.[L5870] In males, breast cancer is usually treated as the cases of postmenopausal women and almost all the cases are ductal carcinoma.[L5873]"	CDK6, CDK4	-2.006583254352536	2.111322805525613	<0.0001
58	DB05984	RAF-265	Investigated for use/treatment in melanoma.	BRAF, KDR	-1.9896152571592078	-1.8319758940946704	<0.0001
59	DB00694	Daunorubicin	"For remission induction in acute nonlymphocytic leukemia (myelogenous, monocytic, erythroid) of adults and for remission induction in acute lymphocytic leukemia of children and adults.

Daunorubicin is indicated in combination with [cytarabine] for the treatment of newly-diagnosed therapy-related acute myeloid leukemia (t-AML) or AML with myelodysplasia-related changes (AML-MRC) in adults and pediatric patients 1 year and older.[L32843]"	TOP2A, TOP2B	-1.9587219857281157	-2.800907311876342	<0.0001
60	DB00380	Dexrazoxane	For reducing the incidence and severity of cardiomyopathy associated with doxorubicin administration in women with metastatic breast cancer who have received a cumulative doxorubicin hydrochloride dose of 300 mg/m^2 and would benefit from continued doxorubicin therapy. Also approved for the treatment of extravasation from intravenous anthracyclines.	TOP2A, TOP2B	-1.9587219857281157	1.7457596798199615	<0.0001
61	DB00773	Etoposide	For use in combination with other chemotherapeutic agents in the treatment of refractory testicular tumors and as first line treatment in patients with small cell lung cancer. Also used to treat other malignancies such as lymphoma, non-lymphocytic leukemia, and glioblastoma multiforme.	TOP2A, TOP2B	-1.9587219857281157	-1.626369779338519	<0.0001
62	DB08597	Dorsomorphin		FKBP1A, ACVR1	-1.920598990692346	1.8490229932803561	<0.0001
63	DB01229	Paclitaxel	Used in the treatment of Kaposi's sarcoma and cancer of the lung, ovarian, and breast. Abraxane® is specfically indicated for the treatment of metastatic breast cancer and locally advanced or metastatic non-small cell lung cancer.	MAP2, MAP4, NR1I2, BCL2, MAPT, TUBB1	-1.915660806979102	1.2240419882352644	<0.0001
64	DB01782	Pyrazolanthrone		MAPK8, MAPK8IP1, MAPK10, TTK	-1.8550585038600351	2.3359728527471986	<0.0001
65	DB04297	Trichostatin A		HDAC7, HDAC8	-1.8477341210587381	-2.430098758116344	<0.0001
66	DB11781	Tosedostat		NPEPPS, LTA4H	-1.8424647027355976	1.5408146729411698	<0.0001
67	DB03374	3,5-Diiodotyrosine		PRSS1, IYD, PKIA, PRKACA	-1.7688359691835545	-1.8185036021988612	<0.0001
68	DB07374	Anisomycin		RPL19, RPL13A, RSL24D1, RPL3, RPL37, SNU13, RPL10L, RPL26L1, RPL11, RPL23, RPL15, RPL8, RPL23A	-1.648642283113476	1.9776161576341629	<0.0001
69	DB02587	Colforsin		ADCY5, ADCY2, CFTR, GNAS	-1.6011519700649568	-2.1759394206923357	<0.0001
70	DB01132	Pioglitazone	Pioglitazone is indicated as an adjunct to diet and exercise to improve glycemic control in adults with type 2 diabetes mellitus.[L11416] It is also available in combination with [metformin],[L11419] [glimepiride],[L11422] or [alogliptin][L11425] for the same indication.	PPARG, MAOB	-1.5469096753663736	1.9255051129952616	<0.0001
71	DB02509	Farnesol		NR1H4, MAOB	-1.5469096753663736	1.4455944985676739	<0.0001
72	DB01247	Isocarboxazid	Isocarboxazid is indicated for the treatment of the enduring and debilitating symptoms of depression that have not responded to other antidepressant drugs.[L1372] Depression is a common but serious mood disorder. The patient will present changes in its feelings, thoughts, and ability to handle everyday activities. For a mood disorder to be considered as depression, the symptoms should be present for at least two weeks.[L1375]	MAOA, MAOB	-1.5469096753663736	-1.1667368380058896	<0.0001
73	DB04513	N-(6-Aminohexyl)-5-Chloro-1-Naphthalenesulfonamide		TNNI3, TNNC1, CALM1	-1.5258758580171765	1.6213969234940602	<0.0001
74	DB06152	Nylidrin	Nylidrin is mainly indicated in conditions like arteriosclerosis, cerebrovascular disease, peripheral vascular disease, Raynaud's disease, thrombo-angitis obliterans, and thrombophlebitis [L2285]. It may sometimes be used in the treatment of peripheral vascular disorders in addition premature labor (however, the drug is not approved for premature labor)[A32531].	CACNA1I, IFNAR2	-1.46303955168743	-1.7066609443622793	<0.0001
75	DB01092	Ouabain	For the treatment of atrial fibrillation and flutter and heart failure	ATP1A2, ATP1A1, ATP1A3	-1.3845458158760215	1.47750711383646	<0.0001
76	DB04599	Aniracetam		GRIA2, HTR2A, GRIA3, DRD2	-1.384162484202009	-1.4255817599409637	<0.0001
77	DB02052	Indirubin-3'-monoxime		AHR, GSK3B, CDK5R1, CDK1, CDK5, CDK2	-1.378215706758387	-1.2800946864012004	<0.0001
78	DB00818	Propofol	Used for induction and/or maintenance of anaesthesia and for management of refractory status epilepticus. 	GABRB2, SCN2A, GABRB3, GABRA1, SCN4A	-1.3730880020706426	1.5994811177610393	<0.0001
79	DB00201	Caffeine	Caffeine is indicated for the short term treatment of apnea of prematurity in infants and off label for the prevention and treatment of bronchopulmonary dysplasia caused by premature birth.[T716,L9851] In addition, it is indicated in combination with sodium benzoate to treat respiratory depression resulting from an overdose with CNS depressant drugs.[L9899] Caffeine has a broad range of over the counter uses, and is found in energy supplements, athletic enhancement products, pain relief products, as well as cosmetic products.[T716,L9854,L9872]	ITPR1, ADORA2B, PDE1A, ADORA1, PRKDC, PDE4B, ADORA2A, ADORA3, RYR1, PIK3CB, PDE1B, ATM, PIK3CA, PIK3CD	-1.3367344136890786	1.6397925491480885	<0.0001
80	DB00393	Nimodipine	For use as an adjunct to improve neurologic outcome following subarachnoid hemorrhage (SAH) from ruptured intracranial berry aneurysms by reducing the incidence and severity of ischemic deficits.	CACNA1S, CACNB3, CACNA1C, CACNB4, CACNA1D, AHR, CACNB2, NR3C2, CACNA1F, CACNB1	-1.3317779063670387	2.089640587741685	<0.0001
81	DB12695	Phenethyl Isothiocyanate		PSMC3, FBXO41, YWHAQ, TPM4, TUBA1A, ATP5F1B, ATP5MG, DIABLO, HSPB1, TPM1, TXN, ACTB, SMARCE1, S100A10, RANBP1, TUBA4A, TPM3, HSPA4, YWHAZ, PSMA3, HSPH1, NUDC, UCHL1, YWHAH, SF3A3, TUBB2A, ATP5ME, USP14, ACTA2, SUCLG2, PAPPA, HSPE1, TUBB3, TUBB1, YWHAB, TPD52L2, TUBA3C, TUBB4B, VIM, HNRNPK, MT-ND1, HNRNPF, VCP, CYB5B, YWHAE	-1.3062673174885906	1.7711105551362272	<0.0001
82	DB05266	Ibudilast	For the treatment of multiple sclerosis, asthma, and cerebrovascular disease.	PDE4C, PDE4B, PDE4A, PDE3A, PDE4D	-1.2728677385182587	-1.5277662529364457	<0.0001
83	DB03777	Bisindolylmaleimide I		PRKCI, PDPK1, PIM1	-1.2617898929023976	-2.068919635135678	<0.0001
84	DB01205	Flumazenil	For the complete or partial reversal of the sedative effects of benzodiazepines in cases where general anesthesia has been induced and/or maintained with benzodiazepines, and where sedation has been produced with benzodiazepines for diagnostic and therapeutic procedures. Also for the management of benzodiazepine overdose as an adjunct for appropriate supportive and symptomatic measures.	GABRA1, GABRG2, GABRA5	-1.2445956225301789	-1.4427355600408103	<0.0001
