GO_ID	Name	Gene Count	Gene Ratio	Fold Enrichment	p-value	FDR	-log10 FDR	FWER	Associated Genes
GO:0015935	small ribosomal subunit	22	0.006014215418261345	4.587732620537432	9.348915308121692e-13	5.5217031038593736e-11	10.257926948624318	1.7669449932349998e-09	NPM1, RPS4X, RPS21, RPS20, RPS9, RPS27A, RACK1, RPS6, FAU, RPS3, RPS18, RPS25, RPS29, RPS23, DAP3, RPS15, RPSA, RPS24, MRPS6, RPS2, RPS28, RPS16
GO:0016442	RISC complex	13	0.003553854565336249	4.574699289229087	5.620005576388317e-08	1.9312382798861674e-06	5.714164138827833	0.00010621810539373919	AGO1, TNRC6A, AGO4, AGO2, DDX6, AGO3, TNRC6C, PRKRA, DHX9, DCP2, TNRC6B, LIMD1, DICER1
GO:0022627	cytosolic small ribosomal subunit	32	0.008747949699289229	4.504319300164024	1.475628717223022e-17	1.4678622502902694e-15	14.83331469833397	2.7889382755515117e-14	RPS8, RPS3A, RPS17, LARP4, RPS12, DHX29, RPS4X, RPS20, RPS21, RPS27, RPS9, RPS14, RPS27A, RACK1, RPS6, RPS11, RPS4Y1, FAU, RPS3, RPS18, RPS25, RPS7, RPS19, RPS29, RPS23, DDX3X, RPS15, RPSA, RPS24, RPS28, RPS2, RPS16
GO:0022625	cytosolic large ribosomal subunit	42	0.011481683980317113	4.299577513792932	3.0948068030424976e-21	3.899456571833547e-19	18.408995912024338	5.8491848577503205e-18	RPL32, RPLP1, RPL4, UBA52, RPL15, RPL35A, RPL7A, RPL9, RPL14, RPL37, RPL34, RPL41, RPLP0, RPL31, RPL7, RPL37A, RPL8, RPL10, RPL23, RPL30, RPL36, RPL27A, RPL17, RPL38, RPL28, RPL5, RPL35, RPL24, RPL19, RPL36A, RPL11, RPL6, RPL3, RPL18, RPL13A, RPL13, RPL21, RPL26, RPL12, RPLP2, RPL23A, RPL27
GO:0022626	cytosolic ribosome	75	0.02050300710770913	4.265453882731083	1.769091067239229e-36	6.687164234164285e-34	33.17475801056481	3.3435821170821425e-33	RPS8, RPL32, RPLP1, RPS3A, UBA52, RPS17, RPL4, RPL15, RPL35A, RPS12, RPL7A, RPL9, RPS4X, RPL37, RPL14, RPL34, RPS20, RPS21, RPS9, RPS14, RPS27, EIF2AK4, RPS16, RPS27A, RPLP0, USP10, RPL31, RPS6, RPL7, RPS11, RPL37A, RPL8, FAU, RPL23, RPS3, RPS18, RPL10, RPL30, RPS25, RPL36, RPL27A, RPL17, RPL38, RPL28, RPS7, HBS1L, RPL24, LTN1, RPS19, RPL35, RPS29, RPL5, RPL19, RPS23, RPL11, RPL36A, NEMF, RPL6, RPL3, RPL18, RPL13A, RPL13, RPL21, RPL26, GSPT1, RPL12, RPS15, RPL23A, RPSA, RPS24, RPS28, RPS2, EEF1A1, RPL27, ASCC3
GO:0030904	retromer complex	14	0.0038272279934390375	3.58298126149411	2.3066291895891063e-06	5.7362225898992245e-05	4.241374004535281	0.004359529168323411	RAB7A, VPS35, DENND4C, ANKFY1, SNX27, VPS29, SNX1, SNX3, DENND5A, SNX6, SNX5, SNX2, TBC1D5, VPS26A
GO:0032839	dendrite cytoplasm	16	0.004373974849644614	3.336532814936314	1.6895618530096876e-06	4.3152323002544724e-05	4.364995820110274	0.0031932719021883094	STAU1, WASF1, KIF5C, CDKL5, LRRK2, ZC3H14, HPCA, UHMK1, GRIK2, KIFAP3, STAU2, KIF5B, TRAK2, MAP2K1, ABHD12, MAP2
GO:0036464	cytoplasmic ribonucleoprotein granule	35	0.009568069983597594	2.985817717911758	9.016190713711887e-11	4.1562440119306015e-09	8.381298963058052	1.7040600448915466e-07	AGO4, ACTB, DDX6, DHX9, RPS4X, HNRNPU, TUT4, PABPC1, RPLP0, RPS6, DYNC1I1, NCL, FXR1, LSM14A, AGO2, STAU1, RPL28, TUBB, IQGAP1, AGO3, ZC3H12C, BTBD1, TUBA1A, RPL6, ROCK2, CDC42, AGO1, CAPRIN1, YTHDF2, MAPT, TDRD7, DCP1A, DCP2, FMR1, RAC1
GO:0005791	rough endoplasmic reticulum	20	0.005467468562055768	2.9633679606342263	1.1519290460570496e-06	3.155283908764962e-05	4.500961557350869	0.0021771458970478237	RPL4, RPS21, CCDC47, PKM, CDKAL1, PSEN1, STAU1, RPS29, RPS23, PTGDS, RPL6, STX17, RPL18, RAB14, SEC62, SPPL3, SUCO, RPS28, RPL27, TMCC1
GO:0031252	cell leading edge	33	0.009021323127392018	2.9031745489338436	8.130445876017368e-10	3.414787267927295e-08	7.466636346519202	1.5366542705672827e-06	SSH1, CDC42BPB, AAK1, ARF1, ARPC2, DOCK8, RAPH1, PABPC1, IQGAP2, CLASP2, DST, CYFIP1, CCDC88A, GBF1, IQGAP1, BCAS3, PAFAH1B1, CFL1, SSX2IP, CARMIL1, SHTN1, CDC42BPA, CDC42, LMO4, CAPRIN1, SLK, DDX3X, CD2AP, MACF1, ABI1, ABL1, PRKCI, MYH9
GO:0030136	clathrin-coated vesicle	39	0.010661563696008748	2.889283761618371	2.90644906240519e-11	1.4455759810383707e-09	8.839959076405313	5.493188727945809e-08	EPS15, PIK3C2A, AAK1, LMBRD1, SYNRG, AFTPH, ASTN1, SNX3, DNAJC6, RNF216, EPN2, STX6, MYO6, SORT1, ADAM10, SGIP1, BTBD8, DENND1B, AP1G1, PICALM, CLTA, NUMB, SCYL2, ASTN2, SNAP91, OCRL, SNX9, VPS41, GGA2, GAS7, CLTC, VTI1A, SNX18, DENND1A, SCAMP1, GPR107, CLINT1, HEATR5B, FCHO2
GO:0000118	histone deacetylase complex	23	0.0062875888463641335	2.877759552882571	3.647299459162809e-07	1.0444539360329862e-05	4.981110709123437	0.0006893395977817709	TBL1XR1, RERE, ZNF217, NRIP1, NCOR1, RCOR3, RBBP4, RCOR1, CBX5, RBBP7, KDM3B, SIN3A, HDAC9, HDAC4, TRERF1, MIER1, HDAC2, MBD2, JMJD1C, HDAC8, PHF21A, KDM3A, TBL1X
GO:0005840	ribosome	92	0.025150355385456534	2.6161450480750643	9.534515284097676e-21	1.126264617934038e-18	17.94835955921209	1.8020233886944607e-17	NUFIP2, RPL15, RPL7A, RPS21, PNPT1, RPL30, RPS25, RPL27A, NCK1, RPL35, RPS19, RPS23, RPL36A, EEF2, DAP3, RPL13A, RPL13, RPL12, RPS15, RPL23A, RPSA, MRPS6, RPS17, RPL4, SERP1, RPL35A, RPL9, RPL14, RPS14, MRPL3, RPLP0, PTCD3, RPS11, RPL23, RPS18, FXR1, RPL17, RPS7, RPL24, RPL18, RPLP2, RPS24, MRPS27, RPS16, RPS8, RPL32, RPS3A, RPL37, RPL34, RPS20, RPS9, RPS27A, RPL41, RACK1, RPL31, MRPL1, EIF2AK2, RPL36, RPL38, RPL5, RPL11, SF1, RPL6, RPL3, RPL21, SNCA, EEF1A1, RPS2, RPL27, MRPS28, RPLP1, UBA52, RPS12, RPS4X, RPS27, RPS6, RPL7, RPL37A, RPS4Y1, RPL8, FAU, RPL10, RPS3, RPL28, MT3, RPL19, RPS29, MRPS31, RPL26, FUBP3, MRPS5, RPS28
GO:0010494	cytoplasmic stress granule	45	0.012301804264625479	2.612040831280684	7.470758404524313e-11	3.529933346137738e-09	8.452233495087496	1.411973338455095e-07	NUFIP2, QKI, LARP4, PRRC2C, DDX6, MBNL1, RC3H2, RPTOR, CELF1, EIF4A1, RBM4, G3BP2, TRIM25, LARP1B, PUM1, PABPC1, YBX1, HIPK2, C9orf72, KPNB1, HNRNPK, YTHDF3, UBAP2L, FXR1, ATXN2, LSM14A, ROCK1, STAU1, CSDE1, RC3H1, GIGYF2, DHX36, LARP1, PABPC4, PUM2, G3BP1, CAPRIN1, DDX1, DDX3X, STAU2, YTHDF2, RBFOX1, TIAL1, FMR1, LARP4B
GO:0014069	postsynaptic density	115	0.03143794423182067	2.4999841675620793	1.6013149861951655e-23	2.5220711032573858e-21	20.598242673783144	3.0264853239088625e-20	PCLO, SYT1, INPP4A, DTNB, SLC8A1, DNM3, KALRN, ATP1A1, VPS35, CLSTN1, DROSHA, NETO2, RPL30, RPS25, RPS19, SYN2, GRIA1, PDLIM5, RTN3, GRIK2, CAMK2D, SRGAP2, RPL12, ABI1, DISC1, EGLN1, FMR1, MAP1B, GOPC, CAMK2G, RPL14, PDPK1, RPS14, RPLP0, PLEKHA5, DTNBP1, DNAJC6, PRNP, USP8, RPS18, ADD1, ANKS1B, RTN1, PAK2, PTEN, PTK2B, GRIN2B, BMPR2, TANC1, EEF2K, GRIP1, STRN, SOS1, DAPK1, GRM3, ARF1, CAPZB, EIF3E, SYNDIG1, CPEB3, ITPR1, DLGAP1, LRRC7, TSC1, CNKSR2, PKP4, CTNNA2, EIF3A, MPDZ, SH3KBP1, ARHGEF9, DLGAP2, RPL38, ZDHHC2, PRKN, PJA2, NEGR1, FYN, RPL6, DLG1, ABLIM1, PPFIA2, PDE4B, NCK2, NLGN1, MAGI2, RTN4, GRIA2, MAP2K1, RHEB, SYT11, SPTBN1, RPS27, PPP1R9A, DGKI, GPHN, MTMR2, RPL7, ARHGAP32, RPL8, RPS3, HNRNPD, ADAM10, NPTN, ADD3, DLG2, CPEB4, NTRK2, EPS8, SIPA1L1, MIB1, ABL1, KPNA1, CTNND2, PSD3
GO:0005905	clathrin-coated pit	32	0.008747949699289229	2.468120164473438	2.06013751284398e-07	6.3830490152051185e-06	5.194971820625595	0.0003893659899275122	EPS15, FCHO2, AAK1, FCHSD2, INPP5F, FNBP1, LRP1, AP1S2, HSPD1, MYO6, SORT1, APP, SGIP1, AP1G1, PICALM, AP2B1, CLTA, NUMB, SNAP91, ARRB2, ITSN1, OCRL, SNX9, BMPR2, GAS7, CLTC, EPS15L1, DNM1L, LRP12, REPS1, ARRB1, AP2A2
GO:0045335	phagocytic vesicle	35	0.009568069983597594	2.403219138807025	1.2624780294802538e-07	4.113937027099448e-06	5.385742360427521	0.00023860834757176796	RAB7A, CLCN3, APPL2, TRIM14, STX12, SYT11, UVRAG, MTOR, SNX3, RAB31, PDIA3, STXBP3, CYBB, STX6, STX8, APPL1, LRRK2, RAB5A, NOD1, RAB11A, ACTG1, ITGB5, ITGAV, CDC42, RAB14, ABCA1, SRGAP2, CTSS, PIK3C3, AMBRA1, KIF5B, RAB8B, RAB22A, RAP1A, RAB39A
GO:0043197	dendritic spine	63	0.01722252597047567	2.396723951945385	1.848862780129294e-12	1.0277501924836369e-10	9.988112433210153	3.4943506544443656e-09	MAP1B, GABRB3, APBA1, GRIA4, SEPTIN11, GRM3, SRGAP2C, SYT11, DNM3, DGKI, SYNDIG1, GPHN, OPHN1, SRGAP2B, MTMR2, ARHGAP32, DOCK10, ITGB1, DTNBP1, FXR1, GRM5, GRID1, ABI2, ARFGEF2, ANKS1B, GRIA2, APP, ZNF804A, GABRB2, NEGR1, PPP3CA, MT3, ASIC2, GRIA1, CFL1, PTEN, ZMYND8, CPEB4, PTPRO, PPFIA2, ITSN1, PDE4B, NTRK2, GRIA3, FARP1, LPAR1, NLGN1, SRGAP2, EEF2K, SIPA1L1, RHOA, EPHB2, TANC2, GPM6A, DIP2A, CTTNBP2, STRN, ABR, FRMPD4, KCND2, MAPT, FMR1, TENM2
GO:0098794	postsynapse	99	0.02706396938217605	2.392315508134326	8.824300999273335e-19	9.810546405074474e-17	16.008306803619003	1.6677928888626605e-15	DTNB, SLC8A1, KIFAP3, ARPC2, SRGAP3, OPHN1, CAP1, GNA13, THY1, VPS35, DOCK10, SYT17, KCTD8, LRRK2, C1QC, GRIA1, SWAP70, DSTN, EEF2, PDLIM5, LATS1, RHOA, ERBIN, PIK3C3, STAU2, EPHB2, FRMPD4, ATXN1, FMR1, MAP1B, PARN, PURA, RPLP0, EPB41L3, ATAD1, PRNP, ARHGEF7, FXR1, STRN3, ATG5, ARFGEF2, MECP2, C1QA, DOCK4, ARRB2, PUM2, VAPB, SNX27, HPCA, MKLN1, STRN, CBLB, RAC1, NRGN, CPEB3, C1QB, GSK3B, PPP3R1, PTPN1, PRKN, ADGRB3, GABRA4, NCKAP1, JAK2, SNX14, GRK3, CPSF2, CDC42, NLGN1, SNCA, KIF1B, RTN4, GRIA2, AP2A2, WASF1, SLC4A10, ELMO1, NCDN, SPTBN1, DGKI, GPHN, MEF2C, CYFIP1, FRRS1L, C9orf72, PSEN1, RPL8, CUL3, SLC24A2, AGO2, APP, ZNF804A, TRIO, CPEB4, WNT5A, BRAF, RAB3GAP1, ABL1, GABRA2
GO:0005925	focal adhesion	171	0.046746856205576816	2.3655976668551846	8.53302446273381e-31	2.3039166049381283e-28	27.63753324515797	1.61274162345669e-27	ACTR3, CD46, PGM5, ACTB, YWHAE, RPL7A, ARPC2, RDX, GNA13, ATP6V0C, CAP1, RALA, THY1, HCK, PACSIN2, PAK1, LRP1, RAB21, ARPC5, PDIA3, HSPA1A, MAP4K4, CTNNA1, ARHGAP31, JAK1, YWHAG, RPL30, LIMD1, NEDD9, ARHGAP22, RPS19, MAPK1, RSU1, CFL1, PTPRA, ITGAV, RPL13A, CDH2, PPIA, RPL12, CD81, RPS15, RHOA, PI4KA, AMBRA1, EVL, MYH9, ITGB5, HSPA9, PPFIA1, RPS17, RPL4, RPL9, BCAR3, HSPA1B, PDPK1, RPS14, GIT2, RPLP0, DST, PRKAR2A, TLN2, RPS11, ITGB8, PTPRC, MSN, GDI2, ARHGEF7, HNRNPK, RPL23, MPZL1, RPS18, ADD1, DOCK7, PRAG1, RPS7, CTNNB1, YWHAZ, MAPRE2, ACTG1, IGF2R, PTK2B, RPL18, GNA12, PPP1R12A, SDCBP, DCTN4, ARHGAP26, HSP90B1, MARCKS, RPLP2, SORBS2, SCARB2, RPS16, APBB1IP, RAC1, RPS8, RPS3A, SNAP23, PEAK1, CORO1C, ARF1, ALCAM, HACD3, PTPN11, RPS9, YWHAQ, PABPC1, CLASP2, TNS3, RPL31, ITGB1, PTK2, SH3KBP1, NRP1, ACTR2, RPL38, RPL5, DLC1, IQGAP1, NUMB, NCKAP1, RPL6, SSH2, RPL3, BLOC1S6, HSPA8, G3BP1, CDC42, ARHGAP24, KRAS, CBL, LIMS1, RPS2, MAP2K1, RPL27, WASF1, RPLP1, MPRIP, NPM1, PIP5K1A, RPS4X, RPL7, EPB41L2, CYFIP1, RPL37A, RAB10, LPXN, STX16, RPL8, RPS3, YWHAB, CLASP1, ADAM10, SORBS1, CASK, FOCAD, RPL19, RPS29, ARPC3, PTPN12, ADAM9, CLTC, LMO7, PPP1CB, ARPC1B, LPP, PCBP2, PDCD6IP, ADAM17, LAP3
GO:0016605	PML body	45	0.012301804264625479	2.345999635502096	5.940092185718063e-09	2.2911784144912528e-07	6.639941090901349	1.1226774231007138e-05	N4BP1, NSMCE2, HIPK3, ZNF451, CIITA, SIMC1, EIF3E, BASP1, RB1, SP140, CHFR, MTOR, TCF7L2, CBX5, KAT6A, HIPK2, MORC3, ZMYM2, KLHL20, SMC5, SLF2, SP3, SMC6, SENP2, ATRX, PIAS2, NR2C1, PTEN, CASP8AP2, NBN, MRE11, CSNK2A1, ATR, TOPBP1, RFWD3, SKIL, WDFY3, USP7, SP100, RNF111, HIPK1, RPA1, TENM2, HMBOX1, PIAS1
GO:0001726	ruffle	45	0.012301804264625479	2.324476703066297	8.011880025960404e-09	2.9691084802088554e-07	6.527373934604887	1.5142453249065164e-05	ARHGAP18, SAMSN1, APPL2, PIP5K1A, MYO5A, RDX, RASA1, MTMR14, MTM1, AIF1, PAK1, C2CD5, FGD2, TLN2, CYFIP1, ITGB1, ATP6V1B2, ARHGEF7, MTSS1, KLHL2, MYO6, APPL1, ROCK1, MYO9B, RAB5A, ACAP2, IQGAP1, NCKAP1, CLIP1, SNX5, BLOC1S6, TMEM87A, SNX9, WIPF1, CD2AP, MKLN1, ABL1, MYH9, TRPM7, FGD4, CDK6, RAB22A, FRMD4B, WASF2, GNAS
GO:0000151	ubiquitin ligase complex	48	0.013121924548933843	2.290331847541029	6.660247038487441e-09	2.5175733805482527e-07	6.599017862064221	1.2587866902741263e-05	ARIH1, RNF19A, UBE2V1, MYCBP2, BARD1, DCUN1D1, RNF144A, WDR26, RMND5A, RNF144B, FBXL3, FBXW4, DCUN1D4, CAND1, RANBP9, RNF217, WWP2, FBXL4, RNF2, UBR1, RNF168, BRCA1, SUGT1, PRKN, ANKIB1, ARMC8, UBR2, FBXO9, BRCC3, FBXO11, UBE4A, UBR4, KCMF1, UBR3, UBE4B, UBE2N, ARIH2, FBXL5, UBE3D, LMO7, USP7, TRAF3, MKLN1, FBXO21, SMURF2, FBXW11, SKP1, UBE2E1
GO:0030027	lamellipodium	77	0.021049753963914706	2.269846767752813	2.252870386082935e-13	1.4193083432322492e-11	10.84792324427674	4.257925029696747e-10	ACTR3, CDC42BPB, ACTB, APC, ARPC2, SNX2, RDX, RAPH1, PAK1, FGD2, PTPRM, ARPC5, CTNNA1, ARHGAP31, NEDD9, MYO9B, SWAP70, CFL1, SHTN1, SH3RF1, CDH2, SRGAP2, RHOA, ABI1, EVL, FGD4, APBB2, ANKRD28, SSH1, FER, CTTNBP2NL, ARHGEF7, CCDC88A, KLHL2, TIAM2, ABI2, CTNNB1, ARHGEF6, PTK2B, PTPRO, SORBS2, WASF2, APBB1IP, RAC1, RUFY3, CORO1C, PKN2, CAPZB, PABPC1, AIF1, PHACTR4, ITGB1, CTNNA2, TSC1, SPATA13, CASP8, ROCK1, PIK3CA, NCKAP1, PTPN13, CDC42BPA, ABLIM1, WASF1, PKD2, PIP5K1A, IQGAP2, CYFIP1, ACTR3B, PLXND1, SNX1, ARPC3, CARMIL1, ITSN1, CAPRIN1, DDX3X, WASL, CTNNA3
GO:1990904	ribonucleoprotein complex	159	0.04346637506834336	2.2664138250825316	3.3289175475203815e-26	6.9907268497928e-24	23.155477666823256	6.291654164813521e-23	RPL15, AGO4, NUP98, ACTB, DYRK1A, RPL7A, HNRNPH1, RPS21, HNRNPR, HSPA1A, SECISBP2, RBMS1, SRP19, ATXN2, RPL30, RPS25, SYNCRIP, RPL27A, RPL35, LRRK2, RPS19, RPS23, RPL36A, EEF2, DAP3, PABPC4, RBMS3, RPL13A, RPL13, LARP7, RPL12, RPS15, RPL23A, RPSA, MRPS6, FMR1, RPS17, RPL4, LSM8, ILF3, RPL35A, RPL9, HSPA1B, RALY, RPL14, RPS14, MRPL3, XPO1, RPLP0, PTCD3, RPS11, CBX5, HNRNPK, NCL, RPL23, RPS18, PARP4, XRCC5, RPL17, RPS7, CELF2, RPL24, NCBP1, AGO3, EEFSEC, NOP58, RPL18, HNRNPH3, NFATC2, DDX1, RPLP2, RPS24, MRPS27, RPS16, RPS8, RPL32, RPS3A, HNRNPM, SECISBP2L, DHX9, RPL37, RPL34, RPS20, ZFP36L1, RPS9, PABPC1, CELF4, RBM12B, RPS27A, RPL41, RACK1, NAF1, RPL31, JARID2, NSRP1, DDX17, YBX1, MRPL1, HNRNPA3, HNRNPUL1, RPL36, BRCA1, RPL38, SRP14, RPL5, IQGAP1, RPL11, LRPPRC, RPL6, HNRNPC, RPL3, HSPA8, RPL21, RPS2, RPL27, TOP2B, MRPS28, RPLP1, ZFP36L2, UBA52, YY1, NPM1, RPS12, HNRNPA2B1, RPS4X, CELF1, HNRNPU, RPS27, RPS6, CPSF6, RPL7, ZC3H14, RBMX, SUZ12, RPL37A, RPS4Y1, RNF2, FAU, RPL8, RPS3, RPL10, HNRNPD, DDX5, SNRPN, LSM14A, GAPDH, AGO2, RPL28, RPL19, RPS29, MRPS31, HNRNPLL, EFL1, HEATR1, AGO1, RPL26, MRPS5, PCBP2, RPS28
GO:0035861	site of double-strand break	41	0.011208310552214325	2.2412268362466627	1.551590084429885e-07	4.970347897580479e-06	5.303613211928317	0.0002932505259572483	ACTR3, PARP1, SMCHD1, ARPC2, SHLD2, RNF169, NABP1, STK38, MMS22L, SAMHD1, UIMC1, ARPC5, RNF168, SMC5, SLF2, SMARCAD1, ACTR2, SMARCA5, RAD50, SMC6, HELLS, ATF2, TP53BP1, PELI1, ARPC3, NBN, MRE11, UFL1, REV1, XRCC4, RNF138, TOPBP1, RFWD3, ATM, RIF1, RAD18, EPC1, SLF1, WDR70, MBTD1, RPA1
GO:0032588	trans-Golgi network membrane	44	0.01202843083652269	2.1731365044650994	1.81252103465031e-07	5.709441259148477e-06	5.243406390868306	0.0003425664755489086	ASAP1, AP4E1, GOLPH3L, AP1B1, HLA-DRB1, KIF13A, CD74, ARFIP1, HLA-DRA, HLA-DQB1, SLC30A6, AFTPH, COG3, AP1S2, RIC1, RAB31, COG6, STX16, RHOBTB3, KIAA0319L, VPS13B, STX6, COG5, RAB6A, APP, AP1G1, NSG2, CLTA, RAB11A, FUT9, IGF2R, VPS54, ST3GAL1, USP6NL, VPS53, VTI1A, CLTC, SCAMP1, CD2AP, CALN1, ATP9A, TMEM165, GNAS, HLA-DPB1
GO:0005802	trans-Golgi network	77	0.021049753963914706	2.1677036632039366	4.295517854220746e-12	2.2551468734658917e-10	9.646825168083765	8.11852874447721e-09	DOP1A, RAB21, BIRC6, RAB31, ATP8A2, SLC11A2, ATXN2, TGOLN2, SYT17, LRRK2, CNST, FUT9, MS4A6A, GOLPH3, ATP9B, RELCH, NBEA, AP4E1, TRAPPC9, ATP2C1, YIPF4, WDR11, KLHL20, STX6, GBF1, ARFGEF2, OSBPL9, SNAP25, LAMP2, CCDC91, IGF2R, WLS, SNX9, OCRL, RAB14, OSBPL11, TBC1D23, ATP8A1, GSAP, ECPAS, ATP9A, RAC1, NMNAT2, PIK3C2A, CLASP2, PREPL, TPST1, RAB6A, BICD1, DENND5A, RAB11A, VPS54, GGA2, EIPR1, ARFGEF1, SORL1, GOLPH3L, B4GALT5, SLC9A7, SYT11, PCSK5, FAM91A1, PCSK1N, RAB10, STX16, ARL5A, STX8, ATP8B4, AP1G1, GOLGA4, GCC2, DOP1B, CLTC, ATP8B1, SCAMP1, RBFOX1, LAP3
GO:0030426	growth cone	53	0.014488791689447786	2.162399664028019	8.435029704343994e-09	3.065808873309644e-07	6.513454923145781	1.5942206141210148e-05	MAP1B, NEO1, SSH1, AUTS2, CALM3, MYO5A, USP9X, ERC2, BASP1, PREX1, FKBP15, THY1, KLC1, C9orf72, PSEN1, DTNBP1, KIF21A, TIAM2, EXOC6, SETX, ARHGAP4, CTSZ, DOCK7, APP, PTBP2, COPG2, ZNF804A, LRRK2, SNAP25, PAFAH1B1, CFL1, CXADR, PTK2B, MYO9A, CPEB4, SHTN1, PTPRO, SLC2A13, EPS8, SNCA, LRIG2, CD2AP, ABI1, CBL, ABL1, COPA, GPM6A, MAPT, APBB2, TENM2, KIF20B, FMR1, RUFY3
GO:0098978	glutamatergic synapse	215	0.05877528704209951	2.1578178465580775	1.556128198653134e-31	4.9018038257573724e-29	28.309644073560456	2.9410822954544236e-28	EPS15, NEO1, PCLO, GUCY1A1, ACTB, SYT1, GUCY1B1, SRGAP2C, KIFAP3, LYN, ARPC2, ZDHHC17, PLCB1, NRXN1, OPHN1, CAP1, FBXL20, THY1, CACNB4, CLSTN1, VPS35, NRP2, SIPA1L2, PACSIN2, DOCK10, DROSHA, ERBB4, NETO2, SACM1L, SYT17, ARHGAP22, LRRK2, SYN2, UBE3A, ELMOD1, EFR3A, C1QC, PPP3CA, AP2B1, RYK, GRIA1, DSTN, CNNM2, CFL1, PPP2R1A, EEF2, GRIK2, RPS6KB1, LATS1, LPAR1, SRGAP2, RHOA, ERBIN, PIK3C3, ATP2B2, TNIK, STAU2, EPHB2, CTTNBP2, SNX6, PRUNE2, LRRC4C, DISC1, EGLN1, SRGAP2B, PIAS1, MAP1B, APBA1, CNTN1, OGT, SH3GL3, PARN, PURA, ATP2B4, NF1, EPB41L3, PLEKHA5, ATAD1, DTNBP1, PCDH9, RGS7, USP14, USP8, PPP2R2A, FXR1, FUS, ATG5, ARFGEF2, ANKS1B, APPL1, CTNNB1, YWHAZ, EEA1, C1QA, NRCAM, DOCK4, SLC4A8, ADAM23, GNAO1, NSG2, PAK2, SNAP25, PTK2B, ARRB2, PUM2, PTPRO, NUDT3, FARP1, VAPB, PDE10A, CDKL5, SNX27, CADPS, TANC1, HPCA, ATP8A1, EEF2K, LRRTM3, ATP2B1, GPM6A, SLC1A2, SOS1, NTRK3, CBLB, DAPK1, RAC1, CDH11, CLCN3, GRIK1, PTPRD, GRM3, NRGN, BIN1, CNTNAP2, AKAP9, SYNDIG1, CLASP2, PPP3CC, DLGAP1, EPHA7, ITGB1, BTBD9, CNKSR2, SH3KBP1, GRM5, NRP1, GSK3B, DLGAP2, PPP3R1, ZDHHC2, PTPN1, NRG3, PRKN, PJA2, PPP3CB, TENM4, SIPA1L3, PRKAR1A, RAB11A, NUMB, FYN, JAK2, DLG1, PPFIA2, CPSF2, CDC42, NLGN1, SPARCL1, KCND2, ADGRL3, ABR, IL1RAP, RTN4, RAP1A, MAP2K1, ELMO1, DAAM1, NCDN, ERC2, SPTBN1, RPS27, IL1RAPL1, DGKI, PCDH7, APOE, ARHGAP32, RABEP1, C9orf72, PSEN1, CUL3, HNRNPD, GRID1, PLXND1, CDH8, MAPK14, AGO2, DAB1, ADAM10, STAU1, NAPB, TRIO, CALY, RAP1B, PAFAH1B1, ITSN1, WNT5A, EPS8, BRAF, MIB1, ABL1, PRKCI, WASL, KPNA1, LRP8, YWHAH
GO:1904813	ficolin-1-rich granule lumen	46	0.012575177692728267	2.0886964496728337	3.383773161824383e-07	9.838971193612437e-06	5.007050310948354	0.0006395331275848084	CST3, TIMP2, PSMD12, HSPA1B, PKM, CAND1, AMPD3, XRCC6, OSTF1, HSP90AB1, ARPC5, KPNB1, HSPA1A, HUWE1, IDH1, CTSZ, PSMD14, ACTR2, MAPK14, SRP14, DERA, ASAH1, MIF, MAPK1, FGL2, EEF2, CAB39, MNDA, PSMB7, KCMF1, HSP90AA1, HSPA8, HMGB1, ACTR10, ARSB, PPIA, DDX3X, ATG7, APAF1, CTSS, CDK13, ALOX5, COTL1, EEF1A1, GPI, GLB1
GO:0031901	early endosome membrane	77	0.021049753963914706	2.0843304453884004	3.134500221027506e-11	1.5190270301902529e-09	8.818434498054247	5.9242054177419865e-08	EPS15, INPP4A, STX12, ZFYVE16, TPCN1, SNX2, ATP13A3, WASHC5, CMTM6, FGD2, MON2, SNX3, RAB31, RAB21, SLC11A2, LAMP5, GRIA1, TMEM163, WASHC4, SNX6, ATP11B, PPP1R21, FIG4, SH3GL3, INPP5F, GPR65, APPL1, RAB5A, EEA1, NSG2, WLS, OCRL, RAB14, VPS41, SNX27, LRP6, LDLRAD4, KIF16B, TMEM30A, ATP9A, PLD3, TSG101, RAC1, CLCN3, APPL2, SYNDIG1, ATP11C, ITCH, STX7, MAPKAP1, STAM2, VPS13B, OSBPL6, SNX4, GGA2, SNX30, SLC9A9, SORL1, SNX13, RCC2, RABGEF1, HLA-DRA, MTMR2, STAM, RABEP1, PSEN1, APP, SNX1, DOP1B, SNX5, DNAJC13, NTRK2, WASHC1, WASHC3, ARL8B, SNX19, PIKFYVE
GO:0005770	late endosome	64	0.017495899398578457	2.0829222197290282	1.4936796249605388e-09	6.137074980816126e-08	7.2120385706127985	2.8230544911754183e-06	RAB7A, SPG11, CLCN3, NBR1, VPS29, PSAP, NPC2, SLC38A9, ANKRD13A, MVB12B, MYO5A, CHMP3, CD74, MTM1, VOPP1, VPS35, CLEC16A, UVRAG, MAPKAP1, STX7, RAB31, VPS36, MAP2K1, SLC11A2, RUBCN, SPPL2A, LAMP5, RNF149, STX8, ATP9A, IFNAR1, NEGR1, OSBPL1A, LAMP2, NSG2, TMEM59, MAPK1, RAB27A, HTT, KIDINS220, KCNQ1, SNX14, IGF2R, ASTN2, RAPGEF2, KCMF1, GRIN2B, VPS8, TMEM163, VPS13C, VPS41, RAB14, VPS39, CD2AP, WASHC1, CTSS, PIK3C3, MAGI2, ECPAS, DYNC1LI2, RAB22A, RAP1A, TSG101, NMNAT2
GO:0005769	early endosome	121	0.0330781848004374	2.0644796792418445	2.1497580843452063e-16	1.8468376270056545e-14	13.733571285824135	4.0630427794124397e-13	EPS15, AP1B1, CCDC93, ZFYVE16, PACSIN2, WASHC5, VPS35, UVRAG, FGD2, LRP1, RAB21, SNX3, RAB31, SLC11A2, HPS3, RCSD1, SGK3, PICALM, MAPK1, GRIA1, VPS26A, GPR107, WASHC4, APBB2, SNX6, MVB12B, ATP11B, STAMBP, PPP1R21, SH3GL3, INPP5F, FKBP15, ATP11A, HSPD1, RUBCN, USP8, CD4, STX6, SORT1, HAVCR2, APPL1, RAB5A, EEA1, NSG2, IGF2R, HMGB1, WLS, OCRL, RAB14, VPS41, DIAPH2, NIPA2, TBC1D2B, SNX27, LRP6, RIN3, ECPAS, TRAK2, KIF16B, ATP9A, TSG101, WASF2, CLCN3, VPS29, WDFY4, MYO5A, CNTNAP2, TBCK, SAMD9L, ITCH, STX7, MAPKAP1, NRP1, PTPN1, RAPGEF1, NUMB, ASTN2, RAB1A, RABGAP1L, VPS8, SLC2A13, SNX4, WDFY1, SNX30, ANKFY1, HPS5, SLC9A9, SORL1, SNX13, RAP1A, MAP2K1, TRAK1, RPS6KC1, RABGEF1, CHMP3, CLCN5, APOE, USP10, RABEP1, AP1S2, PSEN1, AP3S2, STX8, APP, ASAH1, SNX1, AP1G1, HTT, AP3B1, TM9SF4, ANK2, KCNQ1, SNX5, AP3S1, DNAJC13, NTRK2, WASHC1, WASHC3, COMMD1, RAB22A, WDFY2
GO:0016363	nuclear matrix	47	0.012848551120831055	2.051385727787879	3.7352817568109086e-07	1.0536839582645698e-05	4.977289631783657	0.0007059682520372617	ERCC8, RAD21, HNRNPM, DNMT3A, YY1, RGS12, AHCTF1, ACTB, PSPC1, SRPK1, SCAF8, HNRNPA2B1, SRRM1, PBRM1, ARID2, HNRNPU, SMARCC1, HAT1, HLTF, BASP1, BRD7, ATXN3, DCAF7, MORC3, HLCS, ZNF326, ATXN7, THOC1, SORBS1, STAG2, CASK, PRPF40A, PPIG, SNW1, CFL1, NCOR2, RUNX1T1, SMC1A, SFPQ, SMC3, PRKCD, STAG1, ARFGEF1, ATXN1, ALOX5, POLA1, NUMA1
GO:0030672	synaptic vesicle membrane	48	0.013121924548933843	1.972694584013441	1.4046934087539454e-06	3.6873201979791065e-05	4.433289147672581	0.0026548705425449566	RAB7A, CLCN3, CALM3, SYT1, STX12, ARPC2, DGKI, ATP6V1E1, SYNDIG1, ATP6V0C, ATP6AP2, PTPRN2, DMXL2, ATP6V1B2, BORCS5, DTNBP1, SYT6, LAMP5, ATP6V1C1, SYNPR, STX6, PRKN, SV2C, LRRK2, SYN2, SLC18B1, SNAP25, RAB5A, SLC4A8, CLTA, RAB11A, GRIA1, MYOF, MCTP1, DNAJC5, PPT1, TMEM163, SLC35F1, SNCA, SCAMP1, ATP8A1, KIF1B, DNM1L, ATP2B1, GABRA2, ICA1, RAC1, ATP6V0A1
GO:0016607	nuclear speck	140	0.03827227993439038	1.9608355162405577	1.2322192878942188e-16	1.1089973591047969e-14	13.955069488050642	2.3288944541200736e-13	CCNL1, API5, ZNF217, MTREX, DYRK1A, THOC2, RREB1, MAML2, PLCB1, CDK12, CDC5L, BASP1, CACNB4, HSPA1A, KAZN, RSRC1, SAP130, WAC, RBM39, BMP2K, IL15, PPIG, CSNK1A1, RSBN1L, PIAS2, SMU1, EAF2, SRRM2, LUC7L2, SF3B1, ZC3H13, KMT2E, PIAS1, PSPC1, SFMBT2, BARD1, SRSF11, HSPA1B, EP400, PPP4R3A, PARN, CWC22, MAML3, GATAD2A, ACIN1, HDAC4, SPOP, THOC1, NSL1, SMC6, DENND1B, HBP1, PAK2, ARGLU1, EFTUD2, PNN, DHX15, RAD18, VIRMA, SMURF2, S100PBP, STK17A, MAPK9, ASCC3, SGK1, DDX42, ZNF106, GRK5, LUC7L3, TRIM22, SRSF10, MRTFB, ZNF638, NR3C1, DDX17, DDX46, RBM25, NSRP1, HIF1A, KAT6A, YTHDC1, CDC40, BNIP3L, PNISR, SCAPER, PRKN, PRKAA1, HP1BP3, TRIP12, DHX36, RBBP6, PRPF40A, SNW1, BANP, TCERG1, SARNP, SON, IFI16, TCF12, ILRUN, MORF4L1, RBM27, WRN, CDK13, ASCC1, DDX39B, NRIP1, NPM1, PIP5K1A, SRPK1, SREK1, SRRM1, THRAP3, HNRNPU, PSME4, COP1, RBM4, MEF2C, CPSF6, ZC3H14, FBXL4, SRSF1, FTO, LPXN, SMC5, DDX5, PLAG1, MAPK14, SRSF4, CDYL, SRSF5, PPP4R3B, WTAP, YLPM1, SFPQ, GATAD2B, GPATCH2, BCLAF1, SRPK2, HIPK1
GO:0000781	chromosome, telomeric region	56	0.01530891197375615	1.9463108087128498	2.4972280534247744e-07	7.6089336248520585e-06	5.118676204371813	0.0004719761020972824	CBX3, NSMCE2, PARP1, POLR2B, POT1, SMCHD1, PPP1R10, THOC2, HNRNPA2B1, HAT1, PTGES3, RBBP4, PURA, NABP1, ATF7, XRCC6, ORC4, CBX5, RBBP7, MSH2, SMC5, XRCC5, SETX, SLF2, THOC1, SMC6, RAD50, HDAC2, PRKDC, DHX36, ATRX, TP53BP1, ORC3, NBN, TNKS2, MRE11, ATR, ATM, TERF2IP, SMG6, CHD4, GATAD2B, RIF1, WRN, SLF1, PPP1CB, SP100, CDC73, BRCA2, RPA1, EZH2, ORC2, HMBOX1, TNKS, KDM1A, ORC5
GO:0005938	cell cortex	65	0.017769272826681247	1.9363806515255395	4.4398409894205985e-08	1.5539443462972095e-06	5.808564539285963	8.391299470004932e-05	PPFIA1, FER, TRAK1, CORO1C, GRB2, PARD3B, FNBP1, FRYL, GRM7, IQGAP2, RIC8B, CD302, CLASP2, DST, ITCH, EPB41L2, ARHGAP32, C2CD5, PSEN1, ARHGEF7, TSC1, PARD3, KIF21A, NCL, SPTAN1, PTK2, FMN2, SEPTIN2, SPIRE1, CTSZ, ACTR2, MYO6, CLASP1, NEDD9, NDFIP1, MYO9B, CTNNB1, ADD3, SNAP25, ENO1, IQGAP1, PAFAH1B1, GLRX3, CLIP1, ASTN2, PTK2B, CLIP4, DCTN4, EPS8, EPB41, ITPR2, SNCA, WDPCP, DYNC1H1, MARCKS, FNBP1L, RHOA, MKLN1, MYH9, CTTNBP2, AKAP13, FRY, MAP2K1, RAC1, NUMA1
GO:0045202	synapse	252	0.06889010388190268	1.8743204485490985	8.056367793222766e-26	1.522653512919103e-23	22.817398911205597	1.5226535129191029e-22	EPS15, CYFIP2, PCLO, KCNQ3, RPL15, SNTG1, RPS6KA3, ACTB, CADM1, DTNB, SLC8A1, STXBP5, RPL7A, ARPC2, RIMS1, SRGAP3, DNM3, RPS21, NRXN1, OPHN1, FBXL20, CACNB4, CLU, VPS35, RAB21, YWHAG, NETO2, DMD, SEPTIN2, RPL30, MBP, RPL27A, RPS25, SYNPR, GPRIN3, LRRK2, SGCZ, SYN2, ELMOD1, C1QC, RPS23, AP2B1, GRIA1, MAPK1, CNNM2, PPP2R1A, EEF2, EIF1AX, MYO9A, RTN3, GRIK2, RPL13A, RPS6KB1, CDH2, RPL13, RPS15, ATP2B2, PPP2CA, APBB2, GNB4, SDK1, FMR1, STON2, MAP1B, GABRB3, SSH1, TMOD2, GOPC, RGS12, CPEB2, CNTN1, RPL35A, OGT, FGF12, RPS14, GIT2, CACNA1E, PRKAR2A, TLN2, RPS11, PTPRC, ATXN3, GDI2, DNAJC6, USP14, PPP2R2A, RPL23, TIAM2, RPS18, GAD2, ATG5, EIF5B, EMB, ARFGEF2, RPS7, CTNNB1, RPL24, CACNA1A, SNAP25, MECP2, C1QA, NRCAM, IGSF11, TRIM9, ACTG1, TUBA1A, SLC12A6, KCMF1, RAPGEF2, SDCBP, NUDT3, FARP1, PDE10A, CD53, CADPS, ATP8A1, GNG2, LRRTM3, LRP6, MKLN1, ATP2B1, SLC38A6, TENM2, SLC1A2, SORBS2, EXT1, RPS16, WASF2, RAC1, NMNAT2, CDH11, HNRNPM, SNAP23, CADM2, QKI, CORO1C, SEPTIN11, ARF1, RPL37, ERC1, CNTNAP2, NLGN4Y, RPL34, RPS20, YWHAQ, RPS9, NR3C1, SYNDIG1, CPEB3, RPS27A, ITPR1, DLGAP1, PTPRN2, RPL31, ITGB1, YBX1, C1QB, MPDZ, SH3KBP1, HNRNPUL1, KCNMB1, RGS10, DLGAP2, RPL36, PPP3R1, MAPK8, RPL38, NDFIP1, NRG3, SAMD4A, PRKN, CDH23, PJA2, PRKAR1A, SNX14, VPS54, DLG1, RPL6, NCK2, RPL21, NLGN1, CACNA1B, SNCA, TIAM1, RIMS2, MAGI2, KCND2, MACO1, ABR, IL1RAP, RTN4, RPL27, PHACTR1, FCHO2, WASF1, SPG11, CNTNAP5, LRRTM4, GPC6, SLC4A10, DAAM1, GNG7, RHEB, SYT11, ERC2, UTRN, PPP1R9A, DGKI, ETV5, PPA2, CYFIP1, FRRS1L, PSEN1, RPL37A, RPL8, RPS3, HNRNPD, GRID1, DAB1, APP, PDE7B, RPL28, DTNA, OPRM1, CASK, RPL19, SLC1A3, HTT, ASIC2, RPS6KA2, KIDINS220, HNRNPLL, DLG2, CPEB4, ITSN1, EXOC4, GNB1, NRXN3, EPS8, HTR2C, CAPRIN1, EIF5, KCNIP1, SCAMP1, FAM171B, SIPA1L1, CTBP2, ARL8B, RPS28, SPART, GLS, YWHAH
