GO:0005829	cytosol	1490	0.4073264078731547	1.6596033029783372	9.310907080507043e-128	1.759761438215831e-124	123.75454620325904	1.7597614382158311e-124	RPL7A, RPTOR, ZFYVE16, ALPK1, SNX2, GNA13, PACSIN2, MAP3K5, PPP2R2D, ARPC5, STARD13, MTR, PPP2R3C, KAZN, YWHAG, OXSR1, KYNU, RPS25, SGK3, FAM120A, RPL35, DENND6A, ST13, CSDE1, GRIA1, SWAP70, CFL1, AMD1, EEF2, MYO9A, RPL13, FAM13A, UBXN7, ANKRD28, UCHL5, PRRC2C, DOCK5, PDPK1, FNIP1, UBE2D3, MAGED1, PCM1, TAX1BP1, ERI3, SET, FBXO21, SOS1, STRN, APBB1IP, RAC1, TACC1, PDS5B, ASB3, PKM, STK10, PREPL, RACK1, NAF1, CDK5RAP2, ATP6V1B2, TSC1, SMS, SPAST, CASP8, RAB6A, EIF2S3, RBBP6, JAK2, HPS5, NUP88, ILRUN, ANAPC16, VPS13A, FCHO2, PRKCH, FMN1, TUT4, BACH1, TMEM87B, FTL, RPL8, ADD3, DOP1B, PAFAH1B1, BTBD1, DENND3, CSNK2A1, SBF2, LMO7, ARPC1B, RALGAPA2, KPNA1, CYTH1, SPART, ARHGAP27, FBXW11, SCFD1, UBE2V1, WDR26, TIGAR, RPS21, DOCK8, ATP6V1E1, SEC14L1, PIGN, DUSP22, RPL30, LRRK2, AP2B1, DEPDC5, PDE4D, TRNT1, PRKCB, SNX6, TBC1D5, PRKRA, SMG7, STAT1, RGS7, CNBP, RPL23, TMSB4X, GAD2, EIF5B, PLEKHA1, SLC44A1, SLA, AGO3, PTPN4, AAGAB, KLHL7, CTNND1, OSBPL11, ATP6V1A, TCF25, NMNAT2, METAP2, TRIM22, NRGN, FARSB, ARFIP1, TPK1, RPAP2, NLN, PCP4, LONP2, PXK, TBC1D14, NHLRC2, ENO1, AZIN1, FYN, HNRNPC, ANKFY1, PPP2R5C, DENND1A, PREP, MAP3K7, FGFR1OP2, DCP1A, TOP2B, SYK, RICTOR, RHEB, COP1, LARP1B, NABP1, CYFIP1, PACS1, CLASP1, APP, STAU1, IRAK4, TAB2, MNDA, SNX5, REL, TMEM87A, DENND4A, CLTC, WASHC1, PRKCA, PPP1R12B, CDC42BPB, SEM1, CALM1, EIF4B, DOCK3, MSRA, CTNNA1, CABIN1, ALMS1, CEP162, EVI5, UBE2K, PPIG, UBE2D2, CENPC, SRGAP2, ATG7, ABI1, PI4KA, TANK, COTL1, FMR1, KIF3A, STON2, PPFIA1, RPL4, RPS17, OGT, NEK9, CLNS1A, OLA1, FBXW8, PTEN, TUBA1A, PUM2, KHDRBS1, GNA12, ARHGAP26, DPYSL2, USP24, NCOA3, PIK3C2A, DNAJC7, WIPI2, RNF169, RB1, AFTPH, RPL31, PIP5K1B, MAPKAP1, RIC1, YBX1, GSK3B, PPP3R1, ARHGAP4, FRS2, MAP3K1, RPL38, RAPGEF1, SAMD4A, SENP2, DLG1, TBC1D15, RAB3GAP2, ROCK2, TJP1, WDFY1, USP40, SMG1, USP12, RNF111, LIMS1, TNKS, SNX10, COPB2, FBXW4, RPS6, FBXW7, ZNRF2, GAPDH, CTIF, MAP4K5, CARMIL1, PDGFC, IP6K1, ATM, RPL26, PPP1CB, KIF5B, INPP5D, GLS, ACTR3, PEX14, ACTB, TRIM25, CLU, AK5, STK3, SPRED2, BRD7, EXOC6, ATP6V1C1, SPATS2, LSAMP, OTUD4, NOD1, LATS1, FKBP5, WIPF1, SERINC5, HERC3, FGD4, HELZ, CNDP2, HIPK3, UBAP1, RANBP2, PPP4R3A, PARP14, PRKAR2A, DGKB, ARHGEF7, PAN3, FXR1, TRAPPC10, PIK3CB, ANKIB1, RPL24, YWHAZ, DOCK4, CLIP1, SDCBP, NFATC2, NUDT3, EEF2K, TRAK2, RIMKLB, ASCC3, RPS16, ACACA, NPL, EIF3H, PSMF1, RNF114, DHX9, EIF3E, NR3C1, LYPLAL1, TNS3, ITCH, CMIP, PRKD3, DHFR, PIK3CA, CNOT2, PDE4B, SREBF2, DYNC1H1, MAPT, ABR, NBR1, KPNA3, NBAS, RPS12, CNOT6, EIF2AK4, MTMR2, XRCC6, NKTR, MTMR3, RAB10, KCNIP4, HUWE1, RPS3, MAP3K3, PIK3R5, IQCB1, CNOT6L, SORBS1, FNDC3A, RC3H1, TRIO, ARPC3, PDCD10, PPP2R5A, SFPQ, VTI1A, NRDC, PRKCI, POLA1, NUMA1, TMCC1, RAB7A, IPO11, STXBP5, LYN, RPE, RAB2A, SH3BGRL, RAB21, RBMS1, IDH1, HBS1L, RAPGEF4, RPS19, MAPK1, SEPTIN7, NIBAN1, SMG6, USP7, EPHB2, USP4, DOCK11, MAP1B, APBA1, SERP1, PHKB, WIPF2, USP48, RPLP0, PLEKHA5, GABARAP, USP8, PALD1, SUGT1, RPS7, BTRC, NCBP1, ACTG1, DNAJC9, OCRL, PDE10A, HPCA, MAP7, RPLP2, NGLY1, EXOC1, SGK1, TRIM38, RPS3A, DNAJB6, RPL37, CCND2, PABPC1, USP45, RNF217, ADAR, NRP1, TRPC4AP, GAB2, PRKN, PRKAR1A, TUBB, TNKS2, BLOC1S6, HSPA8, ANAPC1, G3BP1, NCK2, DENND4C, RNF146, DPYD, SRPK1, CABLES1, HNRNPU, TENT4B, CDC16, WWC2, IQGAP2, CLEC16A, FBXL4, PPP1R1B, HNRNPD, LSM14A, GPCPD1, PPP2R5E, SNX1, AP1G1, FBXO11, RPS6KA2, ITSN1, POGZ, SMURF1, INO80, PAPSS1, PDCD6IP, LARP4, NUP98, RNF144B, GDAP1, FGD2, NLRC5, HLCS, UBE3A, RSU1, ARHGAP5, SPATS2L, PABPC4, PLSCR1, XRCC4, WDR44, UBE2G2, YTHDF2, MITF, PRKG1, PARD3, N4BP1, MDH1, ZFAND6, PRKACB, SH3GL3, RAP1GDS1, DUSP16, DST, EIF2B3, MTAP, VAV1, PRNP, ABI2, GBF1, ARMC8, CRBN, RAB5A, ETNK1, DIAPH1, USP15, ATG10, PTK2B, WNK1, RAB14, PANK3, WDFY3, MKLN1, OSBPL8, CERT1, RBX1, RCOR3, ITPRID2, CLOCK, CYLD, URI1, CLASP2, AIF1, METAP1, FOXO1, RAB12, SMAD4, NT5C2, DDX60, NFATC3, ANKRD11, PEG10, UBE2F, RPL6, RPL3, DGLUCY, XPO6, PPT1, PPFIA2, CKAP5, ARHGDIB, CDC42, NSMAF, TIAM1, RAPGEF6, KRAS, EPS15L1, CHD9, TNRC18, SEC24B, INPP4B, RPL37A, RPS4Y1, RNF216, FAU, ANKS1A, FIP1L1, FOCAD, PRKDC, CNOT10, KIDINS220, NBN, DDX3X, USP37, NUP205, WASL, DYNC1LI2, REPS1, COMMD1, GLRX3, ASAP1, PPP2R2C, CYFIP2, RPL15, GUCY1A1, RPS6KA3, ARHGAP20, GNAI2, ARHGAP21, COG3, UPF3A, URGCP, RPL36A, EIF1AX, STX17, MAP2K4, RIPK1, MYH9, SERPINB6, ANAPC4, CARD8, GNB4, RAB39A, GPBP1, FER, AHCTF1, RPL9, CAMK2G, ABCD3, RPS14, GCA, EPB41L3, ARHGEF11, DYNC1I1, DNAJC6, MTMR1, STX6, NCKAP1L, APPL1, UBE2E3, RAPGEF2, TMF1, SMC3, BIRC2, DIAPH2, PSTPIP2, DYNC1I2, RPS8, QKI, ERAP1, MTMR6, RPS20, ZFP36L1, YWHAQ, UBQLN1, AHCYL2, ESR1, DDX17, AKAP10, SPTAN1, MAPK8, EIF2AK2, PTPN1, TRIP12, TNPO1, OGA, TNRC6B, SPAG9, STAMBPL1, CBL, NFAT5, CDK6, UBE2E1, PHACTR1, CEP152, PHLPP1, CDC27, NCDN, PEBP1, GPHN, PPM1B, KPNA5, USP10, RANBP9, LYPLA1, TAOK1, AP1S2, FTO, CUL3, USP34, SPIRE1, AKAP7, NPEPPS, USP6NL, AGO1, UBE2N, RAB3GAP1, HERC2, TNRC6C, MCM3AP, IPO7, BBS9, SND1, GOLGB1, ELP3, EIF4A1, KALRN, FBXL20, RNF115, PAK1, MON2, JAK1, LDHB, KNTC1, MBP, VPS4B, DERA, MYO9B, PICALM, PDE7A, RAB18, IREB2, TNIK, ATXN1, EGLN1, CNOT4, NAA50, UCHL3, EHBP1, FNBP1, MTPN, RASA1, RIC8B, TPT1, NF1, ATAD1, WDR11, DTNBP1, GDI2, NUP214, TIAM2, PWWP3A, RAD23B, EP300, PSMB7, DCTN4, CAPZA2, DPH6, ITPKB, MAPK9, ANP32B, WASF2, RPL32, ANAPC10, HSD17B11, RPL41, HSP90AB1, PSMA1, CHM, VTA1, HSPH1, MTHFD1L, BRCC3, DHX36, AHI1, NCKAP1, CAB39, OSBPL6, MRTFA, PRMT2, BBS2, ARFGEF1, GIGYF2, BABAM2, SPG11, ARIH1, ZFP36L2, RPLP1, NPM1, CDK14, MAPK10, IPO9, SRSF1, MAPK14, CASK, CUL1, PTPN12, MAP3K2, LRRK1, PCBP2, ARL8B, HERC4, COPS2, NEDD4L, GRB2, ADK, MTOR, CRADD, ARHGAP31, SYT6, ERBB4, MOB1B, GUCY1A2, PSMC6, NEDD9, COPG2, STK38L, EFR3A, ANAPC5, HPGDS, PIK3C3, PCCA, TIAL1, RPL14, NT5C3A, MAP2, GAPVD1, XPO1, CEP63, ADD1, SORT1, MTHFS, TTC1, PRAG1, OSBPL1A, DENND5B, DNAJC5, ARHGAP15, DCC, RPL18, SERPINB9, GTF2E2, IL10RA, ARF1, MYO5A, ANP32A, PUM1, RPS27A, ENOX2, CKB, CUL2, STAM2, ACTR2, ACBD6, PIP4K2A, RPL5, SMAD5, RPL11, COPB1, COX4I1, TSC22D1, PDZD2, NAA16, ZCCHC7, EEF1A1, HEATR5B, FMNL3, TUBGCP3, RPS4X, RABGEF1, TUT7, SPTBN1, G3BP2, ZC3H7A, AMPD3, EPB41L2, C9orf72, KPNB1, RAP1B, RPS28, YWHAH, PELI2, EPS15, ZMIZ1, OSBPL3, AGO4, GUCY1B1, IRF2, APC, CFLAR, RIMS1, SRGAP3, PNPT1, NAA25, LRP1, BIRC6, HPS3, SYNCRIP, SAMD4B, PPP3CA, HPRT1, USP11, WWP1, LPIN2, MCF2L2, NBEA, EEF1B2, PSMD12, HSPA1B, ZRANB1, PRKCE, ABL2, RAP2A, AGK, PARP4, STRADA, NSL1, TCHP, PELI1, ACTR10, SOCS6, BCL2, RIN3, RPS24, SH3GLB1, TSG101, PTPN2, LAPTM5, PIK3CG, CEP83, UBE2H, GBE1, RABL6, PDE3B, RPL34, DYNC1LI1, CEP192, LRRC7, DCAF7, AGPS, RPL36, ATP6V1H, ARL13B, SHOC2, PSMD1, RASA2, SERF2, VPS54, RAB1A, ZC3H15, ATF6, SNCA, PCMT1, MALT1, DCP2, CAPZA1, IFI44, DAAM1, FHIT, USP47, MOB1A, WSB1, CEP57, FMN2, MAP3K20, NUP107, NTRK2, TGFBR2, AHCYL1, NDRG4, MTFR1, FNIP2, PIKFYVE, ARRB1, RAP1GAP2, AP1B1, NCOR1, ARPC2, HCK, DOCK10, ERMAP, RCSD1, CHN1, PSMD14, KMT2A, HNMT, PFDN5, PDE8A, RAB27A, SPIN1, TRIM36, STAT5B, CAMK2D, RPS15, AMBRA1, DDI2, CAST, NFE2L2, SKP1, PARP1, RNF19A, NBEAL1, TLN2, MSN, ATXN3, QDPR, PPA1, UBA3, RPS18, LCP2, MYO6, FBXO9, BRCA2, ALOX5, TTC8, BLNK, KIF2A, PKN2, DCUN1D1, BIN1, PTPN5, LNPEP, PTPN11, HSPA4, GALK2, EIF3A, SERBP1, UBA6, PPP3CB, HECTD2, VPS13C, SOS2, RPS2, RPL27, METTL21A, ARHGAP18, ELMO1, GOLPH3L, FOXO3, DDX6, UBXN2B, SRRM1, CHMP3, FMNL2, DDX5, LGALS9, AGO2, EIF4G2, GOLGA4, GCC2, TTLL7, IPO8, CARNMT1, EFL1, CUL5, RFWD3, GMPS, APAF1, DNM1L, FKBP1A, HIPK1, SCLT1, NME7, ARHGAP17, ETV6, CMPK1, RB1CC1, MTM1, RASSF3, RTCB, LIMD1, SEC23A, ARHGAP22, CSNK1A1, PDLIM5, RPS6KB1, VPS26A, EVL, PSIP1, MVB12B, NAA15, IKBKB, FANCL, SUFU, USP14, CCDC88A, CPPED1, ATG5, TSNAX, DENND1B, SNAP25, UBE2G1, CRYL1, FARP2, MTMR9, VPS41, SPRED1, DDX1, S100PBP, ULK2, CBLB, SRSF10, AKAP9, GNAI3, FBXL3, XPO4, ITGB3BP, CSNK1G1, PTK2, RAB11A, GAB1, PIP5K1A, ARHGAP6, DGKI, UTRN, MDM2, AGBL4, ATXN7, DAB1, MAP3K14, RPL28, ALDH3A2, ELP2, ARHGAP35, DLG2, EXOC4, MARK3, EPB41, TNRC6A, HCLS1, REPS2, ABL1, MAPK4, C2CD3, PIK3AP1, PGM5, KIFAP3, ARL6IP1, TTBK2, RAPH1, NAGK, PPP6R2, G2E3, SMAP2, PDE1C, DNAJA1, NCK1, GOSR1, TFG, CIT, DDHD1, CEP295, EIF4H, RBMS3, GOLPH3, PPP2CA, RPL23A, RPSA, YTHDF3, STAMBP, TRAPPC9, CEP135, TXNDC11, ECHDC1, TTLL5, RMND5A, ARMH3, STK4, CAND1, KLC1, VCPIP1, DOCK2, ACIN1, HDAC4, RPL17, HERC1, TPM3, CTNNB1, OSBPL9, CCDC91, ZFAT, PANK2, UFL1, MAT2A, EXOC2, SNX27, GSPT1, TBC1D23, ANGEL1, CLINT1, STAG1, GRIP1, IFI44L, PPIL4, RUFY3, OFD1, PEX5L, PPM1D, NFKB1, NAA35, RPS9, PPIP5K2, ARHGEF9, TDRD3, SERTAD2, SRP14, NSUN6, FBXO22, TBC1D4, IFI16, MRE11, TPP2, ARHGEF12, SMAD2, RAP1A, MAP2K1, XIAP, MGLL, PSME4, C2CD5, PPM1A, LPXN, YWHAB, SGIP1, LTN1, LRBA, WWOX, RPS29, NR3C2, CAPRIN1, FANCM, EIF5, MAD1L1, LPP, ITSN2, PADI2, CUX1, NLK, YWHAE, CD163, RFFL, STRIP2, WASHC5, EML1, HSPA1A, DMD, RPL27A, SYNJ1, USP9Y, RUNX2, MSI2, SEC24D, DNAJC3, CCDC6, SH3RF1, PFKFB3, RPL13A, SMC1A, TM7SF3, PTMA, PPIA, RPL12, ATXN10, DISC1, ILF3, USP9X, TASP1, KLHL2, PPP2R2A, ARFGEF2, STAG2, EEA1, FAM13B, EFTUD2, UBR4, CSE1L, IVNS1ABP, TUBGCP5, NUP133, EIF4G3, HSP90B1, TBC1D2B, RABGAP1, CADPS, MKNK1, HMBOX1, ZNF106, MTMR10, MCCC1, PMM2, PLCG2, EIF4A2, SDCCAG8, DCAF8, RASAL2, UBE2R2, EPN2, RGS10, PJA2, UBR2, BICD1, NCOA1, RPL21, NSF, CNTRL, USP33, COPA, SORL1, GLUL, RAD21, WAPL, ARID4B, PDS5A, CREBBP, SLAIN2, AGTPBP1, DPP8, STXBP3, TASOR2, IDE, PRMT3, HSD17B4, ANK2, TNPO3, GNB1, EEF1G, KPNA4, PPP2R2B, CNOT1, TRAF3, PGK1, NCAM1, PLA2G4A, ICA1, USP25, INPP4A, OAZ1, AGFG1, CENPP, STK24, CHKA, SNX3, PDCD4, MYO1F, RGL1, SRP19, ATG12, RPS23, FAF1, LARP1, HSP90AA1, IRS2, OTUD7A, RAF1, PLCB2, RPL35A, ITPK1, PARN, MBNL3, RPS11, EXOC5, EML4, KLHL20, PAXBP1, ZMYM2, HEATR3, KAT2B, CDK19, MECP2, PAK2, ARHGEF6, ARRB2, DELE1, FNBP1L, PRKCD, HK1, KIF16B, ATP9A, UGP2, VPS29, PDE5A, AKAP11, PREX1, PPP3CC, MTMR14, OSTF1, HIF1A, CTNNA2, ANK3, CEP290, UBR1, SH3KBP1, ROCK1, PRKAA1, FBXO38, CDC42BPA, TRAPPC11, UBE3D, KLHL5, NEK1, UNK, TRAK1, RCC2, UBA52, RPS27, PTPN18, RPL7, VPS36, IRF8, STX16, TRAPPC12, RPL10, PPP6R3, CRLF3, TBK1, IST1, PDE7B, ATG3, MT3, RPL19, CLTA, PARG, UPF2, SKAP2, PRKAG2, BRAF, HNRNPDL, SERGEF, NUP93, AKAP13, FANCC, NUFIP2, XAF1, AFDN, PLCB1, DOP1A, CACNB4, LRCH3, VPS35, TXNIP, RAB31, USO1, XRN1, GMDS, PUDP, MIF, MIOS, CPSF7, UCK2, CCDC50, PPP2R1A, DAPP1, LRRFIP1, DICER1, VAPA, RHOA, STAU2, GNAS, AAK1, HSPD1, CAMKMT, XRCC5, TTF2, FYB1, KCMF1, PPP1R12A, SNX9, FARP1, EFCAB13, HEATR5A, SESN1, SMURF2, OTULIN, UACA, GPI, TRAPPC8, MBNL1, CAPZB, NMT1, PTGES3, PDCD6, RIN2, SENP6, PPP2CB, WWP2, RNF213, SPATA13, DLC1, IQGAP1, NUP42, DENND5A, NEMF, RASSF2, CCND3, VPS53, GRK3, FBXL5, KLHDC1, SCP2, AP2A2, LARP4B, WASF1, SAMSN1, VRK1, PDSS2, MEF2C, STK38, TRIM37, STAM, ARHGAP32, RABEP1, IL18, RHOBTB3, PARP9, COG5, TRIM24, SEC31A, C11orf65, SRGAP1, HTT, UCHL1, FNTA, SLK, MIB1, PIK3R1, SRPK2, TTC7B
GO:0000139	Golgi membrane	208	0.056861673045379986	1.6564682009089762	1.0014122869227185e-14	7.279497008784377e-13	12.137898628084793	1.892669222283938e-11	ASAP1, GALNT2, MAN1C1, C6orf89, ST3GAL5, CUX1, SCFD1, GOLGB1, AP1B1, TRIP11, STX12, CSGALNACT1, RFFL, ZDHHC17, RAB2A, ARHGAP21, KIF13A, ATP6V0C, ST3GAL6, DOP1A, CLSTN1, ATP6AP2, COG3, MTOR, RAB21, CHPT1, USO1, ATP8A2, ATP6V0B, SGMS1, GALNT1, SACM1L, SEC23A, EXT2, COPG2, LPCAT2, LRRK2, SGCZ, ST6GAL1, GOSR1, LARGE1, MGAT4A, CHSY1, FUT9, RTN3, ACER3, ATL1, VAPA, IFNGR2, GOLPH3, GOLIM4, GLCE, TMEM165, RAB39A, ST6GALNAC3, HLA-DPB1, GOPC, CHST11, USP32, HACE1, ATP2C1, TMED10, FIG4, CD74, PAQR3, GALNT10, ARMH3, FUT8, SLC30A7, TVP23C, GABARAP, GALNTL6, GLG1, PROS1, MAN1A1, KIAA0319L, GAD2, STX6, GBF1, ARFGEF2, RTN1, MGAT4C, ST8SIA3, NOTCH2, TRAF3IP3, IGF2R, GALNT13, ITM2B, WLS, LMAN1, GALNT11, STX18, RAB14, TMF1, CASD1, RNF24, ATP6V1A, TMEM50B, LDLRAD4, PLD3, MBTPS1, SH3GLB1, MGAT5, EXT1, SCARB2, NMNAT2, CLCN3, RNF121, ST3GAL3, VPS45, HLA-DRB1, AGPAT3, ARF1, ERC1, ARFIP1, GNAI3, RAB12, MAPKAP1, RIC1, SAMD8, TPST1, VPS13B, ATP6V1H, ZDHHC2, DSE, C1GALT1, RAB6A, NDFIP1, ROCK1, PRKN, PJA2, DENND5A, GNPTAB, RAB11A, ST3GAL1, TNKS2, RAB1A, COPB1, HS3ST5, UGCG, ATF6, CDC42, ZDHHC21, UXS1, SREBF2, KRAS, ARFGEF1, SORL1, COPA, ADAM17, PIKFYVE, MAN2A1, TNKS, MAN1A2, PLD1, GOLPH3L, B4GALT5, GCNT2, SLC9A7, RHEB, MPHOSPH9, COP1, SEC22B, CLCN5, HLA-DRA, COPB2, HLA-DQB1, PCSK5, TMEM87B, ARHGAP32, AP1S2, SERINC3, PSEN1, COG6, RAB10, ST8SIA4, HUWE1, ZDHHC20, TAPBP, CHSY3, STX16, COG5, ADAM10, FNDC3A, AP1G1, GOLGA4, GALNT7, TMEM59, DOP1B, SLC10A7, SLC35A3, NDST3, PITPNB, ST6GALNAC5, PDGFC, SSPN, TMEM87A, PDCD10, VTI1A, FKTN, HS2ST1, TMBIM4, PRKCI, NCAM1, PLA2G4A, CYTH1, ARRB1, ICA1
GO:0005765	lysosomal membrane	121	0.0330781848004374	1.653588092596623	4.987198967108981e-09	1.9637095932991612e-07	6.706922738215623	9.425806047835974e-06	RAB7A, DEPTOR, AP1B1, LYN, RPTOR, TPCN1, RAB2A, ATP6V1E1, ATP6V0C, VPS35, ATP6AP2, MTOR, LRP1, BORCS5, ATP6V0B, SLC11A2, LAMP5, HGSNAT, ATP6V1C1, TMEM106B, HLA-DMB, MIOS, AP2B1, DEPDC5, STX17, TMEM163, VPS39, WDR41, MITF, GNB4, TMEM165, RAB39A, HLA-DPB1, GOPC, PSAP, TM6SF1, CD74, FNIP1, ATXN3, ATP11A, GNAQ, WDR11, GPR155, MYO6, NAPG, SORT1, OSBPL9, LAMP2, TRAF3IP3, DNAJC5, CYBRD1, RAB14, VPS41, OSBPL11, ATP6V1A, PLD3, SCARB2, DRAM2, ATP6V0A1, CLCN3, LAPTM5, HLA-DRB1, LMBRD1, SLC49A4, LNPEP, PIP4P2, GNAI3, ATP11C, RAB12, CD164, STX7, MAPKAP1, ATP6V1B2, TSC1, SPPL2A, VPS13B, ATP6V1H, TRPM2, MMD, SNX14, HSPA8, PPT1, SPAG9, VPS13C, ANKFY1, NSF, VPS13A, SPG11, PLD1, UBA52, RICTOR, RHEB, SLC38A9, SYT11, SEC22B, CHMP3, CLCN5, HLA-DRA, HLA-DQB1, VOPP1, CLEC16A, MFSD1, WDR59, AP1S2, PSEN1, ZNRF2, GPR137C, SLC36A4, LRBA, AP1G1, TMEM59, AP3B1, RNF13, GDAP2, TAB2, GNB1, DNAJC13, FNIP2, KIF5B, ARL8B, ARRB1
GO:0012505	endomembrane system	83	0.022689994532531437	1.6397302715509385	2.2469406837068625e-06	5.6622905229412934e-05	4.247007851453897	0.00424671789220597	AP1B1, STX12, ARL6IP1, MTOR, RAB21, CHPT1, RAB31, ATP8A2, JAK1, AIG1, PICALM, AP2B1, FAF1, STX17, RAB18, VPS39, PARD3, NBEA, CEPT1, ATP11B, USP32, AGPAT5, ATP2C1, PARD3B, YIPF4, GABARAP, ATP11A, DOCK2, RAP2A, STX6, VMP1, CPE, RAB5A, IGF2R, WLS, LMAN1, RAB14, ATP8A1, PRKCD, CLINT1, OSBPL8, GRIP1, PLD3, TOR1AIP2, RUFY3, LCLAT1, VPS45, LPGAT1, ARF1, AGPAT3, TMCC3, ATP11C, PIP5K1B, STX7, FRS2, RAB6A, JAK2, RAB1A, RAB28, KRAS, FNDC3B, PLD1, RHEB, SEC22B, PCSK5, STX16, SFT2D2, RNF145, STX8, SEC31A, FNDC3A, ATP8B4, KCNQ1, ICA1L, ITSN1, VTI1A, SNX18, ATP8B1, DNAJC1, DNM1L, RAB22A, ICA1, TMCC1
GO:0031410	cytoplasmic vesicle	263	0.07189721159103335	1.6308314646794306	2.3076087951417224e-17	2.180690311408928e-15	14.661406005946253	4.361380622817855e-14	RAB7A, CD46, SYT1, AP1B1, STX12, STXBP5, RFFL, ZDHHC17, AGFG1, RAB2A, ARHGAP21, SNX2, ATP6V1E1, HCK, ATP6V0C, PACSIN2, MFF, CLU, ATP6AP2, UVRAG, MTOR, ASTN1, RAB21, SNX3, SPRED2, RAB31, ATP6V0B, SLC11A2, SNX24, LAMP5, SYT6, ATP6V1C1, SYNPR, SEC23A, SGK3, BTBD8, HEXB, LRRK2, CNST, COPG2, PICALM, AP2B1, SEC24D, STX17, TRIM36, TMEM163, GGNBP2, ITPR2, WIPF1, IFNGR2, SRGAP2, UQCC1, PIK3C3, AMBRA1, MYH9, TRPM7, HERC3, SNX6, TBC1D5, RAB39A, GNAS, GABRB3, CD93, VEZT, TMED10, PAM, DUSP16, FNBP1, PDPK1, AOAH, CHIC2, DST, SLC30A7, KLC1, GABARAP, WDR11, DMXL2, DTNBP1, DNAJC6, USP14, CCDC88A, MAN1A1, KIAA0319L, GAD2, CTSZ, SLC15A2, MYO6, SORT1, ARFGEF2, APPL1, STOM, CPE, RAB5A, SLC18B1, DENND1B, EEA1, LAMP2, SLC4A8, NSG2, TAX1BP1, TRIM9, CLIP1, SCN8A, SCYL2, DNAJC5, ARRB2, WLS, SNX9, OCRL, RAB14, VPS41, SPRED1, TBC1D2B, ATP6V1A, SLC35F1, CADPS, TLR1, TBC1D23, FNBP1L, ATP8A1, RIN3, LRP6, CLINT1, ATP2B1, GRIP1, ECPAS, TRAK2, KIF16B, RUBCNL, TMEM30A, SH3GLB1, ULK2, RAC1, NMNAT2, ATP6V0A1, TBC1D12, SNAP23, CLCN3, LAPTM5, VPS45, PIK3C2A, APPL2, HLA-DRB1, RNF144A, LMBRD1, MYO5A, LNPEP, SLC30A9, PIP4P2, ANXA4, UBQLN1, PDCD6, ITPR1, PTPRN2, AFTPH, RAB12, ITCH, ITGB1, ATP6V1B2, CEP290, SH3KBP1, SERPINI1, EPN2, NRP1, VPS13B, SPAST, ATP6V1H, DSE, RAB6A, TRPM2, SV2C, GABRB2, TBC1D14, BICD1, RAB11A, DLD, NUMB, TLR2, ASTN2, MYOF, SSH2, BLOC1S6, RABGAP1L, COPB1, SPAG9, ARHGDIB, SNX30, SREBF2, DENND4C, DENND1A, KIF1B, SLC9A9, SORL1, PENK, COPA, PIKFYVE, ARRB1, VPS13A, AP2A2, HEATR5B, NBR1, SPG11, PKD2, PLD1, TRAK1, RCBTB2, SEC24B, TRIM14, SYT11, ARFGEF3, CHMP3, DGKI, HLA-DRA, COPB2, SYNRG, VOPP1, FTL, FAM91A1, C2CD5, TMEM123, AP1S2, RABEP1, C9orf72, PSEN1, RAB10, RNF216, AP3S2, FMN2, SPIRE1, IST1, ADAM10, SEC31A, APP, FNDC3A, AP1G1, SLC1A3, HTT, CALY, AP3B1, CLTA, KCNQ1, USP6NL, MCTP1, SNX5, DENND3, DENND4A, ITSN1, AP3S1, VTI1A, CLTC, ATM, SNX18, WASHC1, MIB1, CTSS, DNM1L, WASL, RAB8B, SNX19, RAB22A, COMMD1, GABRA2, ICA1
GO:0005730	nucleolus	238	0.06506287588846364	1.6086854643442943	4.36177519972748e-15	3.2975020509939747e-13	12.481814925657234	8.243755127484937e-12	C6orf89, OSBPL3, RPS6KA3, MTREX, NOL10, ELP3, RPL7A, ZFC3H1, WDR75, HNRNPR, CDC14A, MORF4L2, STK24, TAF15, LRP1, CRADD, KDM5A, G2E3, SUB1, KATNBL1, DROSHA, MTDH, MOB1B, SETD7, SRP19, RPS25, SMARCA5, UPF3A, RPL35, RPS19, RPS23, PHF6, SPATS2L, SPIN1, UTP18, PLSCR1, REV1, RPL13A, TSPYL1, SCAF11, RPL13, SMG6, RESF1, BRWD1, SF3B1, HECTD1, TOP1, RPL23A, CTCF, STAU2, AATF, YY1AP1, TANK, PSIP1, ATXN1, CDC14B, WDR43, FMR1, HSPA9, N4BP1, RPS17, KDM7A, PARP1, RGS12, RPL4, ILF3, UCHL5, PSPC1, NAA50, RPL9, FGF12, PARN, RPS14, XPO1, NF1, SP140, RPS11, TSEN15, ORC4, CBX5, AOPEP, NCL, RPL23, SIN3A, FXR1, ZNF655, XRCC5, SETX, PIK3CB, NUCKS1, CAMKMT, MYSM1, STAG2, RPS7, MED27, SP140L, BAZ1B, PELI1, OLA1, NFX1, GCFC2, TSEN2, ESF1, NOP58, RORA, KLHL7, APTX, DHX15, ZFP91, DDX24, UTP20, SP100, CHD7, RPS24, YPEL2, ERGIC2, NTRK3, RPS16, ANP32B, RAC1, ZNF106, RPS8, RPS3A, HNRNPM, KIF2A, KIF20B, PPM1D, FAM133B, REV3L, DHX9, PTPN11, RPS9, RNF169, CCND2, RPS27A, ITPR1, DDX17, RPAP2, KDM2B, KAT6A, ADAR, TAF1, CUL2, RNF213, RPL36, ACTR2, RPL5, RBBP6, TNPO1, MDN1, RPL11, DEK, ZMYND8, RPL3, XPO6, IFI16, HSPA8, TBC1D1, INTS4, TAF1B, EIPR1, EPC1, PRMT2, WRN, TRA2A, ARFGEF1, SMAD2, ZCCHC7, MTUS1, EEF1A1, RPS2, ERCC6, XRN2, RPL27, TOP2B, SPG11, RCC2, NRIP1, NPM1, NVL, ZNF800, RPS12, DDX10, SYNE1, RTF2, RPS4X, SPTBN1, RPS27, TENT4B, RBM4, HLTF, CDK8, ZEB2, RPS6, OXR1, SF3B3, FBXW7, PUM3, TENT4A, NSD2, RPL7, XRCC6, SUZ12, SDAD1, RBL2, RPL8, MDM2, FAU, NEK11, RPS3, RBPJ, FMN2, DDX5, ATXN7, ZMAT3, SENP5, CASK, RPL19, NMD3, GTPBP10, PRKDC, FBXO11, MACROD2, NOVA1, NBN, MNDA, CCNY, HEATR1, RPL26, ATM, GPATCH2, PPP1CB, ABL1, SRPK2, RPS28, ZEB1, POLA1, DDX50
GO:0005856	cytoskeleton	231	0.06314926189174412	1.5997813012575177	2.0658332049356175e-14	1.3944374133315419e-12	11.85560097344148	3.904424757328317e-11	PPP1R12B, KRIT1, ACTR3, KIF5C, PCLO, CDC42BPB, PGM5, SNTG1, ACTB, DYRK1A, TRIP11, APC, ARPC2, DNM3, CDC42SE1, ARHGAP21, RAPH1, BASP1, KALRN, RDX, HCK, PACSIN2, CLU, FGD2, EML1, ARPC5, CTNNA1, KIF21A, RASSF3, KAZN, DMD, SEPTIN2, NEDD9, MYO9B, STK38L, LRRK2, SGCZ, BCAS3, MAPK1, SWAP70, CCDC6, CFL1, CEP295, SEPTIN7, LRRFIP1, SHTN1, TRIM36, PDE4D, MARK2, WIPF1, EML5, MACF1, RHOA, CCSER2, TLK2, EVL, TNIK, ABI1, MYH9, FGD4, AMBRA1, DISC1, COTL1, PARD3, PIAS1, KIF3A, MAP1B, SSH1, FRMD5, TMOD2, FER, MYCBP2, TUBA1B, HOOK3, PRKCE, WIPF2, FNBP1, CLNS1A, MAP2, ABL2, EPB41L3, DST, TLN2, KLC1, GABARAP, TBCA, MSN, DOCK2, EML4, KLHL2, TMSB4X, ADD1, ABI2, TPM3, ARFGEF2, PDE4DIP, STOM, CTNNB1, PCM1, SNAP25, MAPRE2, TCHP, DIAPH1, PTPN4, TRIM9, ACTG1, CLIP1, TUBA1A, ARL6IP5, UBR4, GRIN2B, IVNS1ABP, SDCBP, ACTR10, ARHGAP26, DCTN4, FARP1, ITPKB, MARCKS, FNBP1L, PSTPIP2, MAP7, DPYSL2, DYNC1I2, UACA, KIF16B, FRMD4B, DAPK1, APBB1IP, RAC1, WASF2, AUTS2, CCDC146, PEAK1, CORO1C, DNAJC7, PKN2, SEPTIN11, CAPZB, BIN1, KIF26B, CYLD, SLC30A9, AKAP9, CLASP2, AIF1, PREPL, CDC42SE2, CDK5RAP2, NAV1, CTNNA2, ANK3, PKP4, PTK2, SPTAN1, SH3KBP1, MAST2, SPAST, ACTR2, ARL13B, CASP8, ROCK1, TUBB, BICD1, CAMSAP2, LRPPRC, SSH2, KIF13B, PTPN13, ROCK2, CDC42BPA, ABLIM1, SPECC1L, ARHGDIB, ARHGAP24, INVS, EDA, SNCA, DYNC1H1, KIF1B, KLHL5, MAP4, MAPT, CAPZA1, WASF1, MPRIP, RCC2, TMOD3, APPBP2, ARHGAP6, SYNE1, TTC28, SLAIN2, ERC2, SPTBN1, UTRN, PPP1R9A, TTC17, GPHN, TMSB10, EPB41L2, MTSS1, ACTR3B, FMN2, SPIRE1, ATXN7, CLASP1, GAPDH, SORBS1, ADD3, ANK2, ARPC3, PAFAH1B1, CARMIL1, TOGARAM1, FRMD4A, PPP2R2B, DCLK2, EPB41, SLAIN1, CD2AP, STIM1, SIPA1L1, ARPC1B, ABL1, KIF5B, DYNC1LI2, WASL, INPP5D, CTNNA3, NUMA1
GO:0005764	lysosome	96	0.026243849097867686	1.5991666154428485	1.2346856112344016e-06	3.333651150332884e-05	4.4770798488428065	0.002333555805233019	RAB7A, MANBA, NPC2, RB1CC1, LYN, RPTOR, RFFL, TPCN1, HCK, ATP6AP2, UVRAG, MTOR, BORCS5, SLC11A2, PDE1C, LAMP5, HEXB, LRRK2, TMEM106B, RAB27A, DEPDC5, TMEM163, VPS26A, RNASET2, EPG5, SNX6, CPQ, TIAL1, IDS, USP4, CTBS, PSAP, FNBP1, CD74, GABARAP, RAP2A, RUBCN, LYST, CTSZ, SORT1, LAMP2, KCMF1, GRIN2B, OCRL, RAB14, VPS41, ATP6V1A, SCARB2, DRAM2, RUFY3, LAPTM5, LMBRD1, MYO5A, RAB12, CD164, STX7, MAPKAP1, ANK3, TRPM2, IFNAR1, PIP4K2A, SNX14, PPT1, SLC2A13, VPS13C, ARSB, SNCA, NBR1, SPG11, RPS6KC1, RICTOR, SLC38A9, SYT11, HLA-DRA, TPP1, LIPA, VOPP1, MFSD1, C9orf72, VPS36, RAB10, OCIAD1, CTSC, APP, ASAH1, SNX1, WWOX, TMEM59, CLTA, ANK2, KCNQ1, CLTC, CTSS, ARL8B, HEXA, GLB1
GO:0043025	neuronal cell body	101	0.02761071623838163	1.592914038223272	8.114232985341665e-07	2.2552794621023156e-05	4.646799635014872	0.0015335900342295747	KIF5C, GRIA4, SLC8A1, RPTOR, AGFG1, NRXN1, WASHC5, VPS35, XRN1, PDE1C, SLC38A2, MBP, PTBP2, LRRK2, MT-ND1, PICALM, GRIA1, PPP2R1A, CFL1, BMPR1A, HSP90AA1, NAP1L4, GRIK2, LPAR1, STAU2, EPHB2, ATXN10, MAP1B, INPP5F, PURA, MAP2, CACNA1E, DTNBP1, ARHGEF7, CYBB, STRN3, RTN1, IL6ST, RAB5A, CACNA1A, ADNP, PTK2B, RAPGEF2, PUM2, GNA12, BMPR2, TANC1, LRP6, RIN3, GPM6A, TRAK2, STRN, SOS1, SORBS2, RUFY3, PMM2, NRGN, ALCAM, CNTNAP2, AKAP9, EPHA7, RACK1, HSP90AB1, CNKSR2, SERPINI1, GRM5, PRKN, PRKAA1, NEGR1, PPT1, CDC42, SNCA, CACNA1B, SORL1, PENK, MAPT, KCND2, RTN4, GRIA2, VPS13A, SLC4A10, NCDN, APOE, PSEN1, PPP1R1B, STAU1, ZNF804A, SLC1A3, ASIC2, UCHL1, KCNQ1, PAFAH1B1, ELOVL5, ITSN1, SMURF1, VTI1A, FUBP3, ABL1, FBXW11, GABRA2, NUMA1
