GO_ID	Name	Gene Count	Gene Ratio	Fold Enrichment	p-value	FDR	-log10 FDR	FWER	Associated Genes
HP:0007768	Central retinal vessel vascular tortuosity	10	0.002733734281027884	4.691999271004192	1.436501753933548e-06	5.131004702331392e-05	4.289797587333382	0.014777293542714409	MT-CYB, MT-CO3, MT-ND1, MT-ND4, MT-ND2, MT-ND5, MT-ND4L, NEK1, MT-ATP6, SELENOI
HP:0020118	Radial artery aplasia	20	0.005467468562055768	4.331076250157715	7.126416423346548e-11	5.639188134381996e-09	8.248783416253815	7.330944574696594e-07	RPS17, RPL15, RPL9, RPL35A, RPS20, RPS27, RPL31, RPL8, HEATR3, RPL5, RPS7, RPL35, RPS19, RPS29, RPL11, RPL18, RPL26, RPS24, RPS28, RPL27
HP:0030270	Elevated red cell adenosine deaminase activity	20	0.005467468562055768	4.331076250157715	7.126416423346548e-11	5.639188134381996e-09	8.248783416253815	7.330944574696594e-07	RPS17, RPL15, RPL9, RPL35A, RPS20, RPS27, RPL31, RPL8, HEATR3, RPL5, RPS7, RPL35, RPS19, RPS29, RPL11, RPL18, RPL26, RPS24, RPS28, RPL27
HP:0001227	Abnormality of the thenar eminence	20	0.005467468562055768	4.331076250157715	7.126416423346548e-11	5.639188134381996e-09	8.248783416253815	7.330944574696594e-07	RPS17, RPL15, RPL9, RPL35A, RPS20, RPS27, RPL31, RPL8, HEATR3, RPL5, RPS7, RPL35, RPS19, RPS29, RPL11, RPL18, RPL26, RPS24, RPS28, RPL27
HP:0100033	Tics	12	0.0032804811372334607	4.222799343903772	8.661371400847516e-07	3.263718959725948e-05	4.486287245596833	0.00890995276005184	POGZ, ACBD6, ZSWIM6, CHD8, GATAD2B, KMT5B, MAPK1, ZBTB20, ARID2, SPTBN1, FRYL, VPS13A
HP:0000234	Abnormality of the head	21	0.005740841990158557	4.222799343903772	5.3751693284978245e-11	4.42354935058057e-09	8.35422912323252	5.529436688225712e-07	RPS17, RPL15, RPL9, RPL35A, RPS20, RPS27, RPL31, RPL8, HEATR3, RPL5, RPS7, RPL35, RPS19, RPS29, RPL11, RPL18, RPL26, CDC73, RPS24, RPS28, RPL27
HP:0025268	Stuttering	13	0.003553854565336249	4.066399368203633	6.011452860697112e-07	2.3417175824378104e-05	4.630465483210992	0.006183981557799119	NEXMIF, AP4E1, HEXB, MT-CO3, MT-ND1, MT-ND4, MT-CO1, MT-CO2, MT-ND5, MAPT, UBAP2L, KANSL1, NSD1
HP:0006758	Malignant genitourinary tract tumor	26	0.007107709130672498	4.066399368203633	1.1244257671371392e-12	1.1016159872895002e-10	9.95796976997224	1.1566967866539752e-08	RPS17, RPL15, RPL9, RPL35A, PMS1, RPS20, RPS27, RPL31, MSH2, RPL8, HEATR3, RPL5, RPS7, RPL35, RPS19, RPS29, PIK3CA, RPL11, RPL18, TGFBR2, RPL26, KRAS, MLH1, RPS24, RPS28, RPL27
HP:0005532	Macrocytic dyserythropoietic anemia	20	0.005467468562055768	4.021713660860735	6.661081526666066e-10	4.4785977558701844e-08	7.348857941853303	6.852254566481382e-06	RPS17, RPL15, RPL9, RPL35A, RPS20, RPS27, RPL31, RPL8, HEATR3, RPL5, RPS7, RPL35, RPS19, RPS29, RPL11, RPL18, RPL26, RPS24, RPS28, RPL27
HP:0012133	Erythroid hypoplasia	22	0.006014215418261345	3.995767121113247	1.1151930148060128e-10	8.561186972618995e-09	8.067466018042321	1.1471990543309453e-06	RPS17, RPL15, RPL9, RPL35A, RPS20, RPS27, RPS14, RPL31, TET2, RPL8, HEATR3, RPL5, RPS7, RPL35, RPS19, RPS29, RPL11, RPL18, RPL26, RPS24, RPS28, RPL27
HP:0002236	Frontal upsweep of hair	19	0.00519409513395298	3.962132717736873	2.701046098203247e-09	1.6441219652199292e-07	6.784065968512959	2.77856612122168e-05	YY1, TCF4, OGT, CREBBP, CAMTA1, PPP2R3C, UBR1, UBAP2L, FOXP1, HDAC4, MED27, FBXO11, TRIO, EP300, MED13L, HERC2, BRD4, FRMPD4, POLA1
HP:0040276	Adenocarcinoma of the colon	25	0.00683433570256971	3.9099993925034933	1.2535073021142333e-11	1.1116232428318205e-09	8.954042381174917	1.2894829616849117e-07	RPS17, RPL15, RPL9, RPL35A, APC, RPS20, RPS27, RPL31, RPL8, HEATR3, RPL5, RPS7, RPL35, RPS19, RPS29, RPL11, BMPR1A, RPL18, AAGAB, RPL26, MAD1L1, MLH1, RPS24, RPS28, RPL27
HP:0200125	Mitochondrial respiratory chain defects	13	0.003553854565336249	3.852378348824494	1.5921798095155488e-06	5.580763913080492e-05	4.253306349354884	0.01637875370048645	PREPL, PNPT1, MT-CYB, MT-CO3, MT-ND1, MT-ND4, MT-CO1, MT-ND2, MT-ND5, MT-ND4L, CAMKMT, MT-ATP6, PPM1B
HP:0002669	Osteosarcoma	25	0.00683433570256971	3.804323733246642	3.210665478068207e-11	2.7072226043350527e-09	8.567476032423208	3.3028115772887644e-07	RPS17, RPL15, RPL9, RPL35A, RPS20, RPS27, RB1, RPL31, MTAP, RPL8, MDM2, HEATR3, RPL5, RPS7, RPL35, RPS19, RPS29, RPL11, RPL18, ANAPC1, RPL26, WRN, RPS24, RPS28, RPL27
HP:0040082	Happy demeanor	14	0.0038272279934390375	3.7535994168033535	1.003564893701281e-06	3.726957422926021e-05	4.428645568634383	0.010323672061505078	ZSWIM6, TASP1, ASXL1, ADNP, UBE3A, TCF4, TBC1D23, DYRK1A, WDR26, HNRNPC, SNRPN, GRIK2, ZEB2, HDAC8
HP:0012410	Pure red cell aplasia	20	0.005467468562055768	3.753599416803353	4.459922406991698e-09	2.5774843708271683e-07	6.588803959481535	4.587922180072359e-05	RPS17, RPL15, RPL9, RPL35A, RPS20, RPS27, RPL31, RPL8, HEATR3, RPL5, RPS7, RPL35, RPS19, RPS29, RPL11, RPL18, RPL26, RPS24, RPS28, RPL27
HP:0001895	Normochromic anemia	25	0.00683433570256971	3.609230208464763	1.8044714335913643e-10	1.3354386789463571e-08	7.8743760492424935	1.8562597637354365e-06	RPS17, RPL15, RPL9, RPL35A, RPS20, RPS27, RPL31, TET2, RPL8, HEATR3, RPL5, RPS7, RPL35, ASXL1, RPS19, RPS29, RPL11, RPL18, RPL26, SF3B1, RPS24, HK1, RPS28, SCARB2, RPL27
HP:0000640	Gaze-evoked nystagmus	25	0.00683433570256971	3.43317019829575	8.512835156034067e-10	5.507643726422795e-08	7.259034160763147	8.757153525012245e-06	SPG11, UBAP1, ITPR1, FGF14, CACNB4, SAMD9L, ATXN3, RFC1, ATXN2, SETX, PIK3R5, TMEM106B, CACNA1A, WWOX, SLC1A3, UCHL1, SCN8A, GDAP2, VPS13D, MRE11, AFG3L2, APTX, COQ2, ATXN1, ATXN10
HP:0011229	Broad eyebrow	17	0.004647348277747403	3.4184566117316257	4.88553719646051e-07	1.9555455696493877e-05	4.7087320593249	0.005025752113998926	MAF, RERE, CHD1, FRA10AC1, FBXO11, MAPK1, ACTB, EP300, CREBBP, SIN3A, BPTF, SPTBN1, ZFX, POLA1, HERC1, ZEB2, SON
HP:0009944	Partial duplication of thumb phalanx	23	0.0062875888463641335	3.4078731547293604	4.976425554794192e-09	2.812774158360871e-07	6.550865136556845	5.119248968216785e-05	RPS17, RPL15, RPL9, RPL35A, RPS20, RPS27, RPL31, RPL8, HEATR3, RPL5, RPS7, RPL35, INTU, RPS19, NUP107, RPS29, CHSY1, RPL11, RPL18, RPL26, RPS24, RPS28, RPL27
HP:0011904	Persistence of hemoglobin F	22	0.006014215418261345	3.347804885257045	1.714255034838778e-08	8.519102194872709e-07	6.069606171941957	0.0001763454154338651	RPS17, RPL15, RPL9, RPL35A, RPS20, RPS27, RPL31, SLC30A7, MDM4, RPL8, HEATR3, RPL5, RPS7, RPL35, RPS19, RPS29, RPL11, RPL18, RPL26, RPS24, RPS28, RPL27
HP:0005518	Increased mean corpuscular volume	30	0.008201202843083653	3.187018372757564	2.346358689001359e-10	1.6997881573068296e-08	7.769605200883784	2.413699183375698e-06	RPS17, ETV6, RPL15, POT1, RPL9, RPL35A, DUT, RPS27, RPS20, LARS2, SAMD9L, RPL31, MDM4, RPL8, RPL17, HEATR3, RPL5, RPS7, RPL35, RPS19, ANKRD11, DHFR, RPS29, RPL11, RPL18, EFL1, RPL26, RPS24, RPS28, RPL27
HP:0000391	Thickened helices	27	0.007381082558775287	3.1024648240925674	4.164216289670858e-09	2.420186043607012e-07	6.616151247818612	4.2837292971844115e-05	RAF1, AFF4, TCF4, DYRK1A, EDEM3, PTPN11, RB1, SPRED2, TAF1, DIS3L2, SIN3A, SMS, ZFX, SPOP, RASA2, PBX1, CDH2, MARK2, BRAF, SUPT16H, DDX3X, KRAS, SOS2, CBL, PPP1CB, SOS1, MAP2K1
HP:0001896	Reticulocytopenia	22	0.006014215418261345	3.0967195188627663	1.1954363404254286e-07	5.27787709611862e-06	5.2775407272457455	0.0012297453633956384	RPS17, RPL15, RPL9, RPL35A, RPS20, RPS27, RPL31, RPL8, HEATR3, MYSM1, RPL5, RPS7, RPL35, RPS19, RPS29, RPL11, RPL18, RPL26, RPS24, RPS28, RPL27, FANCC
HP:0010862	Delayed fine motor development	30	0.008201202843083653	3.07112679556638	8.002952509879281e-10	5.210529903109378e-08	7.283118107354255	8.232637246912817e-06	AUTS2, CLCN3, TET3, FIG4, SPTBN1, TRRAP, EIF4A2, ITPR1, FNIP1, NFIA, TSEN15, CTNNA2, CDC40, SIN3A, ZFX, LNPK, CIT, GRIA1, SEC24D, SNX14, HNRNPC, TNRC6B, WLS, POGZ, CDH2, WASHC4, MYT1L, PI4KA, ASCC3, CDH11
HP:0000629	Periorbital fullness	25	0.00683433570256971	3.059999524567951	2.2737487914116924e-08	1.1033044253420793e-06	5.9573046398674085	0.0002339005381725208	YY1, EDEM3, ATP6V1E1, TASP1, NSD2, RBMX, RBL2, CLPB, SPEN, ZFX, DOCK7, SETD2, TUBB, NRCAM, FBXO11, TRIO, ANKRD17, RPS23, HS2ST1, GATAD2B, MAP3K7, CHD1, PPP2CA, MED13, KMT2E
HP:0004808	Acute myeloid leukemia	41	0.011208310552214325	3.037452159650082	1.0565638010867932e-12	1.0655756688019454e-10	9.972415704676866	1.0868871821779841e-08	DNMT3A, ETV6, RPL15, RPS17, NPM1, RPL9, RPL35A, RPS20, RPS27, RPS14, CHIC2, SAMD9L, RPL31, TET2, NUP214, RPL8, CLPB, MDM2, SRP19, HEATR3, RPL5, RPS7, RPL35, ASXL1, RPS19, PICALM, RPS29, RPL11, JAK2, RUNX1, RPL18, EFL1, MLLT10, RPL26, SF3B1, KRAS, BRCA2, LPP, RPS24, RPS28, RPL27
HP:0002263	Exaggerated cupid's bow	22	0.006014215418261345	3.02118977450026	2.1466695431216787e-07	9.08756773254844e-06	5.041552339185185	0.002208278959009271	DNMT3A, CLCN3, ZMIZ1, CHD8, HNRNPU, TBCK, RALA, JARID2, SMARCA2, HNRNPK, KMT2A, CACNA1A, TRIP12, SLC1A3, MED27, NRCAM, B3GLCT, SCN2A, EXOC2, POGZ, SUPT16H, MYT1L
HP:0032792	Tonic seizure	44	0.01202843083652269	2.984789897699052	3.583947598954646e-13	3.880849363204888e-11	10.411073214255229	3.6868068950446445e-09	CLCN3, TBL1XR1, ST3GAL3, PSAP, CHD2, FGF12, CNTNAP2, PLCB1, HNRNPU, ATP6V0C, COG3, SLC25A12, DMXL2, CUL3, ARHGEF9, DOCK7, MTHFS, SYNJ1, NAPB, CEP85L, PPP3CA, CACNA1A, ADNP, LNPK, MECP2, DENND5A, SQOR, ALG13, SCN8A, TSEN2, SCN2A, VPS53, GRIK2, GNB1, NEXMIF, ATP6V1A, CACNA1B, NSF, KCNQ5, ARFGEF1, GLUL, GRIA2, PHACTR1, ATP6V0A1
HP:0001087	Developmental glaucoma	25	0.00683433570256971	2.8726526149005256	1.189177812122443e-07	5.272875928148091e-06	5.2779524475865305	0.0012233072153303571	RPS17, RPL15, RPL9, RPL35A, RNASEH2B, RPS20, RPS27, RPL31, SAMHD1, ADAR, RPL8, HEATR3, RPL5, RPS7, RPL35, RPS19, GLIS3, RPS29, RPL11, RPL18, RPL26, SBF2, RPS24, RPS28, RPL27
HP:0001894	Thrombocytosis	34	0.009294696555494806	2.8572174665219556	7.856488229423719e-10	5.147751236693108e-08	7.288382448391943	8.08196944160818e-06	RPS17, RPL15, PMM2, RPL9, RPL35A, RPS20, RPS27, RPS14, HLA-DQB1, RPL31, TET2, ATP6V1B2, RPL8, HEATR3, TTC7A, TBK1, RPL5, RPS7, RPL35, IFNGR1, RPS19, RPS29, RPL11, JAK2, REL, RUNX1, RPL18, RPL26, SF3B1, ABL1, RPSA, RPS24, RPS28, RPL27
HP:0002817	Abnormality of the upper limb	35	0.009568069983597594	2.815199562602515	7.474669169211509e-10	4.943492628982647e-08	7.305966109064135	7.689192174367879e-06	RPS17, RPL15, RPL9, RPL35A, RPS20, RPS27, CPLANE1, RASA1, CEP57, RPL31, FANCL, GNAQ, RPL8, ARHGAP31, RBPJ, BRCA1, HEATR3, RPL5, RPS7, RPL35, RPS19, RPS29, RPL11, GLMN, RPL18, RFWD3, RPL26, ARL6IP6, FANCM, STAG1, BRCA2, RPS24, RPS28, RPL27, FANCC
HP:0009765	Low hanging columella	30	0.008201202843083653	2.7690487501008345	1.9769104324898734e-08	9.73037206651834e-07	6.011870553015673	0.00020336477619023328	CLCN3, ZMIZ1, CDC42BPB, ZNF148, KMT5B, PPP1R21, CREBBP, EDEM3, CNTNAP2, HNRNPR, PUM1, ZEB2, ITCH, KAT6A, KDM3B, SMARCA2, ZFX, SETD2, CTNNB1, TRIP12, TRIO, EP300, CEP295, TBCD, HIVEP2, LIFR, CAPRIN1, CTCF, RAC1, CDH11
HP:0025269	Panic attack	27	0.007381082558775287	2.764014116009742	1.054258492024782e-07	4.6948732066921785e-06	5.328376132125771	0.0010845157107458932	DNMT3A, CREBBP, USP48, NR3C1, NF1, DNAJC6, USP8, SYNJ1, PRKN, CTNNB1, CDH23, LRRK2, PRKAR1A, MECP2, ATRX, EP300, UCHL1, SDHC, SPECC1L, SMC1A, VPS13C, BRAF, CDKL5, SNCA, KIF1B, SPART, MAX
HP:0000297	Facial hypotonia	25	0.00683433570256971	2.7599995711789362	3.2254866558632824e-07	1.31668973130419e-05	4.880516551429605	0.0033180581228865586	AP4E1, YY1, ZMIZ1, TET3, CAMK2G, SLC30A9, PURA, VPS13B, STRADA, DSE, HERC1, STAG2, ASXL1, CACNA1A, SLC1A3, MECP2, PPP2R1A, SCN2A, SRRM2, GRIA3, POGZ, DYNC1H1, SET, NGLY1, UNC80
HP:0100615	Ovarian neoplasm	24	0.0065609622744669215	2.757746510304504	5.646532133855507e-07	2.217018170266092e-05	4.654230747474614	0.005808587606097161	BARD1, PMS1, RPS20, EWSR1, MSH2, MDM2, IDH1, BRCA1, RAD50, NPAT, PIK3CA, BMPR1A, PTEN, NBN, MRE11, DICER1, SPRED1, TGFBR2, ATM, KRAS, WRN, MLH1, BRCA2, FLI1
HP:0010529	Echolalia	23	0.0062875888463641335	2.755301699568419	9.89104756775576e-07	3.6865654467211416e-05	4.433378051765615	0.01017492063295035	EHMT1, PDZD8, CHD8, TCF4, ACTB, SLC25A13, SPTBN1, CYLD, ITPR1, ATP6AP2, KDM5A, SMARCA2, PSEN1, UBAP2L, CTNNB1, TMEM106B, ADNP, SNAP25, ACTG1, GRIK2, KRAS, HERC2, MAPT
HP:0002002	Deep philtrum	38	0.01038819026790596	2.74301495843322	3.734857042214688e-10	2.5785553284068788e-08	7.58862354544245	3.84204743932625e-06	AUTS2, RAD21, DNMT3A, OFD1, ZNF148, TCF4, PRKACB, CREBBP, ARID2, PURA, ITPR1, JARID2, ATP6V1B2, SUZ12, ARNT2, SHOC2, IL6ST, PBX1, NRCAM, CHSY1, EP300, SETD5, SNX14, NBN, EFTUD2, NSD1, OCRL, MARK2, BRAF, CDKL5, HS2ST1, MAP3K7, CBL, PPP1CB, EZH2, EXT1, DPYD, TRPS1
HP:0000194	Open mouth	59	0.016129032258064516	2.722897937599154	8.590196461887125e-15	1.1329147564542674e-12	11.945802766389265	8.836735100343285e-11	SETBP1, PDZD8, CHD8, RPS6KA3, TCF4, DGCR2, OGT, TET3, REV3L, MBD5, KANSL1, IL1RAPL1, TBCK, PURA, ZEB2, MEF2C, DST, MTOR, AP1S2, ATP6V1B2, HNRNPK, CCDC88A, PIGF, DIS3L2, PIGN, SIN3A, VPS13B, STRADA, FOXP1, PLXND1, DPYD, AGO2, EIF2S3, ADAM22, PRKAR1A, ATRX, BCAS3, RPS23, RAP1B, TCF20, DENND5A, PPP2R1A, AHI1, MED13L, PDE4D, OCRL, GRIA3, BRAF, NEXMIF, ZSWIM6, ANKLE2, CLTC, POGZ, ASH1L, MED12L, CTCF, NGLY1, UNC80, RAC1
HP:0000912	Sprengel anomaly	26	0.007107709130672498	2.710932912135755	2.955718521817134e-07	1.2211034712422834e-05	4.913247534183194	0.0030405476433932855	RAF1, RPS17, RPL15, RPL9, SYNE1, RPL35A, RPS20, RPS27, PTPN11, RPL31, RPL8, HEATR3, RPL5, RPS7, RPL35, RPS19, RPS29, RPL11, RPL18, CDH2, BRAF, RPL26, MAP3K7, RPS24, RPS28, RPL27
HP:0000722	Compulsive behaviors	51	0.013942044833242209	2.7089656168439293	7.146555528707524e-13	7.425920881193364e-11	10.129249682236736	7.35166167238143e-09	EHMT1, MAP1B, CLCN3, PDZD8, RAD21, AUTS2, PPM1D, GTF2I, CREBBP, USP9X, SPTBN1, TRRAP, ADCY5, NFIA, JARID2, NIPBL, UBAP2L, SIN3A, FOXP1, SNRPN, HDAC4, ADNP, UBE3A, AP1G1, HTT, TRIO, MAPK1, BAZ1B, GRIA1, EP300, SCN8A, SETD5, TCF20, PANK2, EIF4H, OCRL, SMC1A, HDAC8, POGZ, SMC3, TTC19, ARID1B, NLGN1, TLK2, BRD4, CHD7, CTCF, GRIA2, FMR1, VPS13A, CEP152
HP:0000319	Smooth philtrum	93	0.025423728813559324	2.6991088589900407	3.751674246724911e-22	1.4843643452330446e-19	18.82845948604955	3.859347297605916e-18	ZMIZ1, CDC42BPB, SYT1, DYRK1A, MEIS2, ATP6V1E1, WDR37, MTOR, NIPBL, KDM5A, PPP2R3C, DIS3L2, PIGN, SEC23A, ANKRD17, MAPK1, KDM6A, CEP295, RECQL, ACER3, SRRM2, TTI1, SMC1A, CDH2, ATG7, FRA10AC1, MED13, NALCN, TBL1XR1, TRAPPC9, RTTN, TPR, RAP1GDS1, USP9X, TASP1, ORC4, SIN3A, ZFX, SPOP, STAG2, CTNNB1, ADNP, IGF1R, EP300, PIGU, EXOC2, SMC3, ATP6V1A, CERT1, ATP9A, RERE, DYM, DHX9, CNTNAP2, JARID2, SMARCA2, SMS, ZNF292, MAF, TRIP12, ANKRD11, PIK3CA, SETD5, HNRNPC, SON, CDC42, ASH1L, BBS2, CDK13, RAD21, CHD8, ZNF148, DDX6, CREBBP, HNRNPU, SPTBN1, TRRAP, FBXL4, RPL10, PACS1, QRICH1, FAR1, CASK, NUP107, FBXO11, AP3B1, RAP1B, SUMF1, PPP1CB, ABL1, FLI1, UNC80, TRPS1
HP:0000331	Short chin	34	0.009294696555494806	2.6962474684080426	5.478168452388806e-09	3.0135785491830827e-07	6.520917484125659	5.635391886972365e-05	ERCC8, PPP1R21, MBD5, FIG4, MEF2C, NFIA, DST, ITCH, MTOR, NSD2, AP1S2, FBXL4, SLF2, RPL17, ZNF292, NDUFS4, ADNP, PRKDC, NRCAM, TRIO, ALG13, RNF13, BMPR1A, PTEN, XRCC4, SMC3, EDA, ARID1B, MAP3K7, SET, PIK3R1, ABL1, CTCF, ERCC6
HP:0410030	Cleft lip	41	0.011208310552214325	2.653406484292026	2.8144625543502246e-10	1.983039472369915e-08	7.70266864108374	2.895237629660076e-06	RPS17, C2CD3, RPL15, RERE, SMCHD1, RPL9, RPL35A, RPS20, RPS27, TRRAP, RPL31, JARID2, SMAD4, RIC1, NIPBL, RPL8, HEATR3, DSE, STAG2, EIF2S3, RPL5, RPS7, RPL35, ASXL1, INTU, RPS19, NUP107, RPS29, FBXO11, ANKRD17, CEP120, KDM6A, RPL11, RPL18, CTNND1, RPL26, BRD4, CHD7, RPS24, RPS28, RPL27
HP:0000219	Thin upper lip vermilion	154	0.04209950792782941	2.651625276090442	1.0256597535141603e-34	9.591783531272879e-32	31.018100631017894	1.0550961884400167e-30	CUX1, CDC42BPB, SYT1, ACTB, DYRK1A, WDR26, SEL1L, MEIS2, OPHN1, RALA, NFIA, MCPH1, NCAPD3, MTOR, NIPBL, KDM3B, PIGN, UBAP2L, KMT2A, SEC23A, WAC, GLIS3, ANKRD17, CIT, KDM6A, MAPK1, CEP295, HIVEP2, PDE4D, SRRM2, SMC1A, CDH2, WASHC4, ADGRG6, TLK2, MED13, CTCF, KCNMA1, BPTF, NALCN, SETBP1, RFX7, TBL1XR1, TRAPPC9, PSMD12, OGT, CEP135, MBD5, FIG4, TPR, ARID2, USP9X, PURA, TASP1, CEP63, SIN3A, TRAPPC10, ZFX, PIGK, STAG2, CTNNB1, ADNP, MAPRE2, IGF1R, EP300, ACTG1, PIGU, EEFSEC, OCRL, EXOC2, NEXMIF, SMC3, HK1, ATP9A, EXT1, ASCC3, CDH11, CLCN3, AFF4, PMM2, PPM1D, DHX9, LMBRD1, CHD2, CNTNAP2, EDEM3, ASXL2, SMAD4, CDK5RAP2, KAT6A, ATP6V1B2, SMARCA2, TAF1, KAT6B, ARID1A, DSE, ZNF292, MAF, ACBD6, TRIP12, ANKRD11, SETD5, VPS35L, HNRNPC, TNRC6B, CNOT2, CDC42, SPECC1L, CDK13, CDK6, CEP152, RAD21, SLC9A7, CREBBP, SPTBN1, TRRAP, COPB2, MEF2C, ZNF407, HUWE1, RPL10, SPEN, SNRPN, PACS1, QRICH1, AGO2, FAR1, PBX1, PRKDC, ATRX, FBXO11, AP3B1, RAP1B, TRIO, TCF20, B3GLCT, CSNK2A1, WNT5A, HDAC8, ANKLE2, AGO1, POGZ, MED12L, CLTC, ARID1B, CAPRIN1, HS2ST1, GATAD2B, HERC2, PPP1CB, PDCD6IP, UNC80, KDM1A, TRPS1
HP:0001182	Tapered finger	70	0.01913613996719519	2.6451539514386044	1.931683059061619e-16	3.3118706047611455e-14	13.47992663950068	1.9871223628566876e-12	WASF1, ACSL4, EHMT1, MAP1B, ZMIZ1, SLC4A10, CDC42BPB, TRAPPC9, RPS6KA3, TCF4, DDX6, DYRK1A, FIG4, USP9X, PUM1, TBCK, DOCK3, SLC25A12, SMARCA2, CCDC88A, HUWE1, RPL10, PIGN, SPEN, ZMYM2, VPS13B, ZFX, SMARCAD1, KMT2A, SPOP, DSE, HEATR3, SLC25A46, MTHFS, MAF, EIF2S3, ACBD6, ASXL1, ADNP, RUNX2, MAPRE2, ATRX, FBXO11, TRIO, MAPK1, TCF20, PHF6, SETD5, RNF13, HIVEP2, SLC12A6, COPB1, KMT2C, WNK1, GNB1, SMC1A, CNOT1, CDC42, HECTD4, HDAC8, SUPT16H, CDKL5, CHD4, CTCF, PHF21A, EXOC6B, UNC80, KMT2E, PHIP, KDM1A
HP:0002572	Episodic vomiting	29	0.007927829414980863	2.6335737843700944	1.3717071226712276e-07	5.99272171599167e-06	5.222375889167406	0.0014110751170918919	KRIT1, MT-CYB, CDC42BPB, MT-ATP6, SEL1L, MT-ND3, CDK8, ZEB2, CCM2, MT-ND2, HNRNPK, MT-ND5, ADNP, MT-ND1, MT-ND4, UQCRC2, PIK3CA, MT-CO2, PDCD10, NSD1, APTX, MARK2, COQ2, NEXMIF, POGZ, MT-CO3, MT-CO1, CDK13, NDUFS1
HP:0009777	Absent thumb	28	0.007654455986878075	2.627519591762347	2.38711162608252e-07	1.0022945835718728e-05	4.999004616575463	0.0024556217297510884	RPS17, RPL15, PSMD12, RPL9, RPL35A, FIG4, RPS20, RPS27, RPL31, FANCL, RPL8, CUL3, RPL17, HEATR3, RPL5, RPS7, RPL35, RPS19, RPS29, RPL11, SON, RPL18, RFWD3, RPL26, RPS24, RPS28, RPL27, FANCC
HP:0000294	Low anterior hairline	68	0.018589393110989613	2.622377674753028	8.994784045382374e-16	1.3810349772365445e-13	12.859795321980052	9.252934347484849e-12	RAD21, CLCN3, RPL15, RPS17, PGAP1, CDC42BPB, PIK3C2A, RPL9, RPL35A, CREBBP, CNTNAP2, ARID2, RPS20, RPS27, RPL31, NIPBL, ATP6V1B2, SMARCA2, RPL8, RBL2, UBAP2L, SPEN, VPS13B, ARID1A, ZFX, PACS1, SPOP, BRCA1, HEATR3, DOCK7, STAG2, RPL5, RPS7, RPL35, ASXL1, RPS19, MAPRE2, ANKRD11, RPS29, TRIO, CIT, EP300, LRPPRC, NOTCH2, SETD5, MED13L, RPL11, NBN, RALGAPA1, SLC12A6, RAB3GAP2, FRMD4A, RAB18, RPL18, TCF12, XRCC4, SMC1A, HDAC8, SMC3, ARID1B, RPL26, CAPRIN1, ASH1L, MAP3K7, BRD4, RPS24, RPS28, RPL27
HP:0045025	Narrow palpebral fissure	34	0.009294696555494806	2.622377674753028	1.3379103623172183e-08	6.881541948578613e-07	6.1623142384028515	0.00013763083897157225	DNMT3A, RFX7, TBL1XR1, GPC6, CDC42BPB, DGCR2, DDX6, DHX9, EDEM3, ARID2, SMAD4, RBMX, SMARCA2, RPL10, ZMYM2, UBAP2L, SPEN, SPOP, KMT2A, HDAC4, ADNP, TRIP12, PIK3CA, FBXO11, PHF6, B3GLCT, PDE4D, KCTD1, TENM3, LARP7, GATAD2B, FRA10AC1, MED13, CTCF
HP:0012760	Reduced social responsiveness	32	0.008747949699289229	2.6111995942979846	4.033241276328925e-08	1.8859069549816204e-06	5.724479737863199	0.0004148995300959565	CHD8, TET3, CREBBP, MBD5, CHD2, CNTNAP2, SPTBN1, OPHN1, NF1, DNAJC6, SNRPN, HERC1, SYNJ1, PRKN, LRRK2, ADNP, MECP2, EP300, UCHL1, GRIK2, SMC1A, VPS13C, POGZ, NEXMIF, TTC19, ZMYND11, NLGN1, SNCA, CLTC, CDKL5, GTF2E2, POLA1
HP:0100716	Self-injurious behavior	70	0.01913613996719519	2.592946965554948	7.097966699928725e-16	1.1063149006388908e-13	12.956121238181053	7.301678344216679e-12	WASF1, EHMT1, SETBP1, KIF5C, RFX7, CLCN3, CDC42BPB, CHD8, RERE, TCF4, SYT1, RPS6KA3, CREBBP, FMR1, MBD5, HECW2, RTTN, GRM7, TAOK1, AP1S2, NIPBL, DMXL2, TSC1, CHKA, RBL2, RPL10, UBAP2L, SPEN, FOXP1, LUZP1, SPOP, SNRPN, HDAC4, CTNNB1, ACBD6, WAC, CRBN, ELP2, HPRT1, CASK, AP1G1, ATRX, TRIO, NRCAM, ZBTB20, GRIA1, SCAF4, EP300, GNAO1, SCN2A, KMT2C, OCRL, UBE4B, GRIA3, NIPA2, POGZ, CDH2, CDKL5, WASHC4, TBC1D23, VPS13A, HERC2, PPP2CA, GLS, FBXW11, GRIA2, KMT2E, DPYD, CEP152, ATP6V0A1
HP:0000465	Webbed neck	57	0.01558228540185894	2.5881673398119895	3.7424733986103557e-13	4.010294151198409e-11	10.396823771131166	3.849882385150473e-09	RAF1, RPS17, C2CD3, RPL15, ACTB, RPL9, RPL35A, RPS20, RPS27, PTPN11, TMEM260, NF1, TASP1, RB1, RPL31, FANCL, NSD2, KAT6A, SPRED2, RPL8, SMS, CHN1, KMT2A, SHOC2, HEATR3, RPL5, RPS7, RPL35, RASA2, TAPT1, RPS19, ANKRD11, PIK3CA, IGF1R, MAPK1, RPS29, RPL11, ACTG1, B3GLCT, RPL18, CDC42, BRAF, RPL26, MAP3K7, KRAS, SOS2, CBL, PPP1CB, CHD7, RPS24, FLI1, RPS28, SOS1, FBXW11, MAP2K1, RPL27, NALCN
HP:0000455	Broad nasal tip	75	0.02050300710770913	2.5748776487218126	1.0706829980145298e-16	2.0025665455591762e-14	13.698413043339126	1.1014116000575468e-12	SETBP1, RFX7, TBL1XR1, YY1, OFD1, CDC42BPB, RPS6KA3, ACTB, DYRK1A, WDR26, APC, CDH11, TPR, ARID2, ASXL2, CPLANE1, ATP6V1E1, PURA, KAT6A, NIPBL, KDM5A, KDM3B, ATP6V1B2, TAF1, COG6, HUWE1, HNRNPK, ZMYM2, ARID1A, ZFX, FOXP1, QRICH1, KMT2A, SNRPN, HDAC4, DOCK7, SETD2, EIF2S3, CTNNB1, WAC, EXT2, CASK, ADNP, PRKAR1A, IGF1R, FBXO11, ZBTB20, KDM6A, TBC1D32, SMC3, RAB3GAP2, NSD1, XRCC4, HDAC8, POGZ, SUPT16H, ARID1B, ZSWIM6, RAB3GAP1, ATP6V1A, CAPRIN1, HS2ST1, GATAD2B, PHIP, SET, WASHC4, MAP3K7, PPP2CA, TLK2, CTCF, PHF21A, BPTF, NEK1, DPYD, GLB1
HP:0100660	Dyskinesia	83	0.022689994532531437	2.5536782917596583	4.716693701681984e-18	1.1027415479364219e-15	14.957526262226626	4.852062810920257e-14	CYFIP2, PGAP1, SYT1, GRM7, XPR1, NDUFA13, ADCY5, VPS35, PNPT1, CHKA, YWHAG, SYNJ1, LRRK2, PPP3CA, MT-ND1, BCAS3, BMPR1A, IREB2, ATG7, ATXN10, GNAS, GABRB3, SIL1, PRKRA, HECW2, FGF12, MT-ATP6, PURA, DMXL2, DNAJC6, CELF2, NDUFS4, CACNA1A, SLC20A2, CDK19, GNAO1, SCN8A, GRIN2B, PDE10A, CDKL5, ATP6V1A, MLH1, BRCA2, SLC1A2, WIPI2, RPS20, SLC30A9, MT-ND3, ITPR1, MSH2, MT-ND2, CNKSR2, PRKN, GABRB2, PIK3CA, LRPPRC, VPS13C, SNCA, CACNA1B, KRAS, GIGYF2, SCN3A, TRAK1, CACNA2D1, PMS1, FTL, STX16, MT-ND5, NPAT, CASK, WWOX, MT-ND4, UCHL1, SCN2A, DNAJC13, NTRK2, TGFBR2, CLTC, ATM, DDX3X, NUS1, GABRA2, UNC80
HP:0002171	Gliosis	39	0.010661563696008748	2.553320533523211	3.0529834328406413e-09	1.8153780678399814e-07	6.741032915708732	3.140604057363168e-05	EHMT1, YY1, GLS, DYRK1A, THOC2, RANBP2, ETFA, EIF4A2, VPS35, MTOR, CSF1R, ATXN3, KDM3B, C9orf72, PRNP, PSEN1, SERPINI1, FUS, FARS2, TBK1, AKT3, HSD17B4, LRRK2, ADNP, HTT, PIK3CA, TFG, LRPPRC, GDAP2, TBCD, KMT2C, DNAJC13, NARS2, ATP6V1A, SNCA, MAPT, ERCC6, NGLY1, GIGYF2
HP:0000527	Long eyelashes	59	0.016129032258064516	2.5358286136419603	4.363793848598113e-13	4.580647685768244e-11	10.339073110103595	4.489034732052879e-09	RAD21, SLC4A10, CDC42BPB, AFF4, ACTB, CREBBP, MBD5, CNTNAP2, ASXL2, SLC30A9, CCDC47, TBCK, PPM1B, CAMTA1, PREPL, SMAD4, CSF1R, NIPBL, FBXL4, ATP6V1B2, RNF2, TAF1, SMARCA2, SPEN, ARID1A, VPS13B, CAMKMT, PACS1, KMT2A, SPOP, SHOC2, DOCK7, BRCA1, SEC31A, MAF, MED27, FBXO11, NRCAM, RPS23, KDM6A, NOTCH2, EP300, DENND5A, DEPDC5, FRMD4A, WNT5A, CNOT2, SMC1A, HDAC8, MARK2, HECTD4, ARID1B, SMC3, CHD1, STAG1, BRD4, CTCF, ASCC3, DPYD
HP:0000713	Agitation	36	0.009841443411700382	2.5336796063422633	1.572338731458781e-08	8.007251747780437e-07	6.096516517071305	0.0001617464853051648	SYT1, FGF12, SPTBN1, ADCY5, TRANK1, VPS35, COX10, PSEN1, DNAJC6, ZFX, SPAST, APP, PRKN, SYNJ1, WAC, EIF2S3, LRRK2, CACNA1A, PRKAR1A, MECP2, HTT, IGF1R, UCHL1, MED13L, DNAJC13, SMC1A, VPS13C, MARK2, CDKL5, SNCA, SORL1, GIGYF2, GLS, FMR1, GNAS, ATP6V0A1
HP:0002967	Cubitus valgus	25	0.00683433570256971	2.5135710380379597	2.8863091714333803e-06	9.640085209914022e-05	4.015919127297178	0.029691462446535182	RAF1, SIL1, PSMD12, PRKACB, PTPN11, LMBRD2, LARS2, NF1, WDR11, SPRED2, IDH1, VPS13B, HEATR3, SHOC2, IL6ST, NUP107, FBXO11, MAPK1, BRAF, KRAS, CBL, ASPH, BPTF, SOS1, MAP2K1
HP:0005484	Secondary microcephaly	58	0.015855658829961726	2.5120242250914746	1.1237669476072052e-12	1.1016159872895002e-10	9.95796976997224	1.156019059003532e-08	KIF5C, TRAPPC9, GLS, TCF4, DYRK1A, CRLS1, CREBBP, MBD5, FGF12, HNRNPR, ZEB2, ITPR1, TAF2, WDR37, MFF, SLC25A12, HSPD1, CTNNA2, COG6, FTO, CLPB, TRAPPC12, ARNT2, SNRPN, VPS50, GABRB2, WWOX, ADAM22, DHFR, MECP2, TRIO, UBE3A, RAP1B, EP300, ACTG1, PAFAH1B1, TBCD, EFTUD2, RAB3GAP2, EEFSEC, RAB18, VPS53, PPP1R12A, PPT1, SMC1A, EXOC2, NTRK2, NEXMIF, SMC3, CLTC, PRORP, CACNA1B, CDKL5, FRA10AC1, CERT1, ATP9A, NGLY1, TMEM165
HP:0000965	Cutis marmorata	33	0.009021323127392018	2.510853663942784	8.079677819331609e-08	3.67768343926833e-06	5.434425655874363	0.0008311564572746426	RAD21, GUCY1A1, RPS6KA3, RNASEH2B, NFIA, LRRC8C, SAMHD1, SMAD4, NIPBL, ADAR, TGFBR1, FTO, ARHGAP31, UBAP2L, RBPJ, HEATR3, AKT3, PIK3CA, PTEN, MAT2A, SMC1A, TGFBR2, HDAC8, ARID1B, SMC3, LARP7, ARL6IP6, STAG1, SMAD2, ABL1, BRD4, PRKG1, POLA1
HP:0011097	Epileptic spasm	33	0.009021323127392018	2.510853663942784	8.079677819331609e-08	3.67768343926833e-06	5.434425655874363	0.0008311564572746426	EHMT1, SETBP1, TBL1XR1, ST3GAL3, NCDN, CHD2, PLCB1, PURA, EIF4A2, MFF, MTOR, TSC1, SMARCA2, TRAPPC12, AKT3, SYNJ1, CELF2, CASK, PPP3CA, WWOX, PIK3CA, SCN8A, TBCD, GRIN2B, COX4I1, SCN2A, GRIK2, NEXMIF, CACNA1B, NSF, SLC1A2, PHACTR1, ATP6V0A1
