HP:0000347	Micrognathia	249	0.06806998359759431	1.6891197375615088	1.2276852745092043e-18	3.323473268125312e-16	15.478407810060402	1.2629198418876185e-14	C2CD3, ZMIZ1, PEX14, CDC42BPB, RPL15, ACTB, DYRK1A, TRIP11, APC, WDR26, RREB1, HNRNPR, CPLANE1, WASHC5, ATP6AP2, SPRED2, KDM5A, NIPBL, PIGF, DIS3L2, KIF21A, PIGN, CHN1, KMT2A, TRPS1, EXT2, ASXL1, RPL35, RPS19, PPP3CA, RUNX2, LARGE1, MAPK1, CHSY1, KDM6A, CEP295, SEC24D, RAB18, CHD6, EIF4H, XRCC4, PDE4D, SMC1A, DICER1, PI4KA, ADGRG6, CTCF, YY1AP1, EPG5, MITF, PRKG1, BPTF, NALCN, MTX2, RAF1, SETBP1, RPS17, PSMD12, RPL35A, GTF2I, RPL9, MBD5, FIG4, ARID2, NEK9, PURA, CAMTA1, NF1, FANCL, ORC4, CLPB, ZFX, RPL17, HEATR3, TPM3, SPOP, SETD2, HELLS, STAG2, RPS7, CTNNB1, CPE, P3H2, MAPRE2, MECP2, NRCAM, IGF1R, KIAA0586, BAZ1B, EP300, ACTG1, NOTCH2, PTEN, SCYL2, TUBA1A, EFTUD2, JMJD1C, LIFR, EEFSEC, RPL18, PPP1R12A, WLS, NUP133, MAT2A, SPRED1, SMC3, SUPT16H, OCRL, ARL6IP6, STAG1, BRD4, CHD7, BRCA2, RPS24, GRIP1, SOS1, PHIP, NSMCE2, AUTS2, CLCN3, RERE, OFD1, AFF4, REV3L, ROBO1, RPS20, PTPN11, RFWD3, TBCK, GNAI3, RIN2, EIF4A2, CSPP1, RB1, RPL31, SMAD4, ATP6V1B2, TAF1, CEP290, KAT6B, DYNC2H1, VPS13B, BRCA1, ZNF292, RPL5, RASA2, INTU, ANKRD11, PIK3CA, TUBB, GNPTAB, ARID1B, RPL11, LRPPRC, SETD5, VPS35L, TNRC6B, RAB3GAP2, VPS53, CNOT2, SPECC1L, NUP88, ATR, MAP3K7, KRAS, SOS2, CBL, SMAD2, ASPH, PHF21A, NEK1, ERCC6, MAP2K1, RPL27, DPYD, CEP152, RAD21, ARIH1, YY1, CHD8, GPC6, CREBBP, HNRNPU, RPS27, LOXL3, TRRAP, LMBRD2, RYR3, CEP57, NSD2, FBXL4, TGFBR1, RPL8, RBMX, POGZ, HUWE1, SUZ12, SPEN, SMC5, HDAC9, SNRPN, MAP3K20, PLAG1, PLXND1, SEC31A, PLAGL1, HSD17B4, TAPT1, CASK, FOCAD, WWOX, NUP107, RPS29, ATRX, FBXO11, TRIO, RAP1B, SLC10A7, KIDINS220, IPO8, TBCD, NBN, PAK2, NSD1, CSNK2A1, B3GLCT, WNT5A, HDAC8, TGFBR2, HECTD4, BRAF, ANKLE2, RAB3GAP1, RPL26, CAPRIN1, GATAD2B, DDX3X, FANCM, LEMD3, MAD1L1, FKTN, ABL1, PIK3R1, RPS28, CWC27, EZH2, FBXW11, NEDD4L, FANCC
HP:0003487	Babinski sign	91	0.024876981957353744	1.6854155276107163	1.975679948449185e-07	8.468258179040319e-06	5.07220590974293	0.002032381962969677	PGAP1, SEL1L, WASHC5, ATP6AP2, PNPT1, TAF15, ERBB4, ATXN2, LARGE1, TFG, DNAJC3, HADHA, DDHD1, EEF2, SACS, ATL1, IREB2, PI4KA, HADHB, ATXN1, ATXN10, NDUFS1, AP4E1, ANO10, PSAP, UBAP1, FIG4, MT-ATP6, ABHD12, ZFR, TSEN15, HSPD1, ATXN3, PRNP, FUS, SETX, ATG5, SELENOI, SLC25A46, NDUFS4, CACNA1A, SLC44A1, MECP2, OPA1, PANK2, TSEN2, COQ2, VAPB, SLC1A2, NUBPL, DNMT1, ITPR1, TAF2, SAMD9L, ADAR, SPTAN1, EIF2AK2, SPAST, NT5C2, PRKN, EIF2S3, SNX14, TTC19, SNCA, ABCB7, LRP12, ERCC6, NEK1, SPG11, ZFHX3, KPNA3, SLC9A7, SYNE1, VRK1, TPP1, APOE, FTL, RFC1, FBXL4, PSEN1, FARS2, ATXN7, PIK3R5, TBK1, WWOX, HTT, UCHL1, VPS13D, AFG3L2, GRIA3, SPART
HP:0002650	Scoliosis	319	0.0872061235647895	1.6817390645509407	2.737820428883432e-23	1.2801799432692666e-20	19.892728981229993	2.8163958751923865e-19	MEIS2, SAMHD1, ARPC5, PPP2R3C, KIF21A, YWHAG, IDH1, MAPK1, ANKRD17, DDHD1, ATL1, EIF4H, RPL13, USP7, CTCF, ACVR1, MAP1B, DNMT3A, CHST11, SIL1, PPP1R21, ARID2, GNAQ, HNRNPK, SIN3A, FUS, SETX, HDAC4, TPM3, HERC1, SLC25A46, CTNNB1, NRCAM, ACTG1, SCYL2, PIBF1, PIGU, DCC, WLS, OCRL, MAT2A, MIA3, CDKL5, STAG1, CHD7, SOS1, NGLY1, RAC1, AUTS2, RERE, OFD1, ARF1, PUM1, JARID2, SMARCA2, ADAR, SMS, MAF, ACBD6, PRKAR1A, CEP120, RPL11, SON, TCF12, NUP88, TTC19, SMAD2, MAP2K1, TCF4, HNRNPU, SPTBN1, LOXL3, TRRAP, RYR3, OXR1, NSD2, FBXL4, ASAH1, ATRX, SLC35A3, ALG13, SCAF4, PAFAH1B1, RNF13, CSNK2A1, POGZ, PRORP, CAPRIN1, HS2ST1, LEMD3, FANCM, SBF2, NUS1, KIAA0586, ERCC8, GLB1, PDZD8, ZMIZ1, DYRK1A, APC, HNRNPH1, WASHC5, PNPT1, CCM2, GDAP1, DMD, SYNJ1, UBE3A, RUNX2, SEC24D, PHF6, SACS, PDE4D, SMC1A, LARP7, PRKG1, SETBP1, PSMD12, GTF2I, USP9X, EED, ARFGEF2, DISP1, STAG2, IL6ST, LIFR, KLHL7, APTX, SPTLC1, FARSB, SMAD4, TAF1, ARL13B, DPP6, RASA2, ANKRD11, GNPTAB, VPS35L, CDC42, MAP3K7, KRAS, SYNE1, CREBBP, ZEB2, ZNF407, PACS1, SNRPN, MAP3K20, HSD17B4, SLC10A7, TBCD, NSD1, SCN2A, TGFBR2, HECTD4, ARID1B, FKTN, DDX3X, KRIT1, CDC42BPB, RPS6KA3, SYT1, TRIP11, SEL1L, HNRNPR, NRXN1, ATP6AP2, CHKA, ALMS1, KMT2A, EXT2, LARGE1, NDUFAF6, TLK2, OTUD7A, NALCN, FMR1, RAF1, TBL1XR1, RNASEH2B, NEK9, ZFPM2, PARN, DNAJC6, ZMYM2, ZFX, ADNP, CDK19, MECP2, ZBTB20, NOTCH2, PTEN, TUBA1A, FOXP2, SUPT16H, BRD4, ATP2B1, BRCA2, HK1, PIK3C2A, KANSL1, BIN1, PTPN11, TBCK, CEP290, DYNC2H1, SPTAN1, ARID1A, SNX14, RAB3GAP2, KMT2C, TRAPPC11, SOS2, CBL, ASPH, NEK1, ERCC6, EXOC6B, PHACTR1, CEP152, EHMT1, DDX6, COPB2, AP1S2, TGFBR1, SUZ12, TRAPPC12, RPL10, TAPT1, IPO8, TOGARAM1, WNT5A, GRIA3, BRAF, RFWD3, RAB3GAP1, PPP1CB, HERC2, DNM1L, KIF5B, FLI1, EZH2, CTNND2, FANCC, MCM3AP, ACTB, CSGALNACT1, RREB1, PLCB1, TTC21B, CPLANE1, SPRED2, SEC23A, KDM6A, PPP2R1A, RAB18, TTI1, UNC80, FGD4, YY1AP1, BPTF, GNAS, HACE1, MBD5, CAMTA1, NF1, FANCL, HSPD1, SUFU, LUZP1, BAZ1B, EP300, JMJD1C, SLC12A6, SPRED1, ARL6IP6, NDUFAF5, DYM, ASXL2, RIN2, ITPR1, CSPP1, KAT6B, VPS13B, BRCA1, DSE, PIK3CA, AHI1, SETD5, SDHC, VPS53, CNOT2, UBE4B, ATR, CDK13, SPG11, ARIH1, SMCHD1, NPM1, NBAS, DHRSX, VRK1, CCDC47, MTMR2, HUWE1, SPEN, QRICH1, CASK, ALDH3A2, HTT, TRIO, TCF20, PDCD10, B3GLCT, ABL1, TANC2, NEDD4L, POLA1, TRPS1
HP:0000639	Nystagmus	297	0.08119190814652816	1.6789443174557168	1.3773897718938548e-21	5.060431636954316e-19	18.295812437794098	1.4169208583472084e-17	ERCC8, GALNT2, CYFIP2, BBS9, PEX14, PGAP1, SYT1, GRIA4, CRLS1, THOC2, APC, TNFRSF11A, RIMS1, HNRNPH1, NSUN3, HNRNPR, CPLANE1, ATP6V1E1, TTBK2, OPHN1, CACNB4, PNPT1, COG3, SAMHD1, CHKA, SPRED2, TSPAN7, NIPBL, MTR, YWHAG, PIGN, UBAP2L, HPS3, ATXN2, HGSNAT, POC1B, ANOS1, CHN1, ALMS1, SYNJ1, EXT2, TMEM106B, PPP3CA, UBE3A, MT-ND1, KIZ, BCAS3, KDM6A, PHF6, EEF2, SACS, MYO9A, RAB18, CHD6, XRCC4, TMEM163, SMC1A, RNASET2, USP7, PI4KA, NDUFAF2, RHOA, KCNMA1, FRMPD4, EPG5, ATXN1, ATXN10, FMR1, NDUFS1, GNAS, NALCN, RAF1, FRMD5, AP4E1, RFX7, ANO10, SIL1, PSMD12, OGT, HECW2, FGF12, TTLL5, RNASEH2B, MT-ATP6, ABHD12, PURA, CACNA1E, CAMTA1, PTCD3, FANCL, COX10, WDR11, HSPD1, PRNP, DTNBP1, SUFU, RUBCN, USP8, CLPB, ARNT2, AGK, SIN3A, FUS, NDUFV2, ZFX, FOXP1, LUZP1, LYST, SETX, SLC25A46, ANKH, CTNNB1, CELF2, NDUFS4, CACNA1A, SNAP25, CDK19, PAK2, KIAA0586, OPA1, EP300, SCN8A, PIBF1, TUBA1A, RORA, SLC12A6, EEFSEC, DCC, PIGU, OCRL, KLHL7, APTX, SMC3, COQ2, VPS41, ATP6V1A, GTF2E2, ATP5F1A, MYT1L, BRD4, CHD7, BRCA2, HK1, SPTLC1, SLC1A2, PLD3, SOS1, NTRK2, NUBPL, PHIP, DRAM2, NDUFAF5, TTC8, CLCN3, UGP2, RERE, OFD1, KIF2A, PMM2, HLA-DRB1, ROBO1, MYO5A, CNTNAP2, DNMT1, PTPN11, MT-ND3, TBCK, SDCCAG8, TAF2, TPK1, ITPR1, CSPP1, USP45, SAMD9L, MT-ND2, ADAR, CEP290, CNKSR2, TAF1, SPTAN1, SERPINI1, VPS13B, SPAST, BRCA1, ARL13B, SCAPER, ZNF292, NT5C2, MAF, EIF2S3, ACBD6, GABRB2, LRMDA, RASA2, ANKRD11, CEP120, AHI1, LRPPRC, SNX14, SON, BLOC1S6, ATF6, UBE4B, HIBCH, HPS5, TTC19, RAB28, CACNA1B, KRAS, SOS2, RIMS2, BBS2, ABCB7, CBL, PHF21A, ERCC6, MAP2K1, DPYD, SPG11, SCN3A, RAD21, TRAK1, TET3, SYNE1, SNX10, CREBBP, CACNA2D1, AGTPBP1, VRK1, SYT14, LMBRD2, TPP1, OXR1, TAOK1, NSD2, CSF1R, RFC1, FBXL4, FRRS1L, ATP5F1E, STX16, MT-ND5, RNF216, HUWE1, SPEN, SNRPN, ATXN7, PACS1, PIK3R5, IQCB1, DAB1, ASAH1, ADD3, HSD17B4, CASK, PBX1, FOCAD, WWOX, MT-ND4, SLC1A3, MERTK, ALG13, AP3B1, RAP1B, KIDINS220, IPO8, TBCD, TRIM44, TOGARAM1, NSD1, B3GLCT, ELOVL5, ADAM9, SCN2A, AFG3L2, HDAC8, POGZ, BRAF, RFWD3, GNB1, CLTC, ATM, NARS2, WDPCP, FANCM, ARID1B, FANCC, MAD1L1, PPP1CB, DNM1L, NUS1, REPS1, SPART, GABRA2, UNC80, IFRD1, SCLT1
HP:0003596	Middle age onset	77	0.021049753963914706	1.6739024426285223	2.3924279504486125e-06	8.122411328800289e-05	4.090315021087681	0.024610906326264878	APC, WASHC5, ATP6AP2, CTNNA1, ERBB4, HGSNAT, SPTLC2, CDH2, ATP2B2, TRPM7, ATXN10, GNB4, IKZF1, MAP1B, RAF1, ANO10, POT1, PSAP, TTLL5, NT5C3A, USP48, NF1, PRNP, CNBP, GBF1, HAVCR2, APPL1, ITM2B, AAGAB, KLHL7, BMPR2, VAPB, MLH1, PDK3, GBE1, DNMT1, CYLD, ITPR1, NAF1, SAMD9L, MSH2, BRCA1, PRKN, TENM4, JAK2, VPS13C, TTC19, SNCA, KIF1B, BBS2, SMAD2, MAPT, MSH3, RPA1, LRP12, NEK1, VPS13A, SPG11, PKD2, VRK1, HLA-DQB1, EIF2AK4, APOE, FTL, CSF1R, PSEN1, TAPBP, FARS2, TBK1, DAB1, APP, CASK, KCNQ1, ELOVL5, AFG3L2, FKTN, DNM1L
HP:0000648	Optic atrophy	184	0.05030071077091307	1.670957159738267	1.5262589099565527e-13	1.7641152142385458e-11	10.753473054536371	1.5700625406723057e-09	ERCC8, CYFIP2, PCLO, PEX14, MT-CYB, ST3GAL5, RPS6KA3, DYRK1A, TNFRSF11A, RREB1, SEL1L, NDUFA13, WASHC5, MFF, MTOR, NIPBL, YWHAG, HGSNAT, INTS8, SYNJ1, SEC23A, ASXL1, PPP3CA, MT-ND1, KIZ, LARGE1, TFG, CHSY1, RAB18, ATG7, RHOA, PI4KA, NDUFAF2, FRMPD4, EPG5, ATXN1, NDUFS1, NALCN, STAMBP, SIL1, PSAP, PPP1R21, ATP5F1E, FGF12, MT-ATP6, ABHD12, ELP4, PTCD3, COX10, GNAQ, CCDC88A, NDUFV2, ZFX, LUZP1, SELENOI, SLC25A46, SSBP1, ANKH, CTNNB1, CELF2, CACNA1A, SLC44A1, ADAM22, CDK19, NRCAM, DIAPH1, MT-CO2, OPA1, SCN8A, SCYL2, PANK2, JMJD1C, PIGU, KLHL7, TBC1D2B, ATP6V1A, MT-CO3, ATP5F1A, CHD7, HK1, SLC1A2, NGLY1, MICU1, TTC8, NDUFAF5, CLCN3, YME1L1, RERE, OFD1, AFF4, HLA-DRB1, KANSL1, MYO5A, DNMT1, SLC30A9, MT-ND3, CSPP1, KAT6A, CTNNA2, ATP6V1B2, MT-ND2, ADAR, CEP290, CNKSR2, TSC1, MPDZ, VPS13B, SCAPER, AKT3, NT5C2, GABRB2, AUH, PRKAR1A, PIK3CA, DENND5A, AHI1, VPS35L, SON, RAB3GAP2, PPT1, VPS53, UBE4B, CDC42, TRAPPC11, CACNA1B, KRAS, MT-CO1, BBS2, MT-ND4L, ERCC6, MAP2K1, DPYD, SCN3A, TRAK1, STT3B, SMCHD1, NBAS, SYNE1, SNX10, CACNA2D1, AGTPBP1, VRK1, ZEB2, LRRC8C, AP1S2, CSF1R, RFC1, FBXL4, NSD2, COG6, RBMX, MT-ND5, RNF216, HUWE1, RBL2, PDHX, SPEN, TRAPPC12, ATXN7, SEC31A, CASK, WWOX, MT-ND4, ATRX, ALG13, ZNF592, MERTK, UCHL1, TBCD, SUMF1, B3GLCT, AFG3L2, NTRK2, POGZ, BRAF, CLTC, RAB3GAP1, NARS2, SBF2, FKTN, DNM1L, NUS1, GABRA2, GLB1
HP:0005280	Depressed nasal bridge	297	0.08119190814652816	1.6688907586685566	4.189084464654938e-21	1.4859693754450119e-18	17.82799014092019	4.309311188790534e-17	GALNT2, BBS9, PCLO, PEX14, MANBA, CDC42BPB, RPL15, RPS6KA3, PGAP1, ACTB, TRIP11, CSGALNACT1, TNFRSF11A, LMBR1, RREB1, WDR26, SEL1L, GRM7, CPLANE1, TTC21B, HNRNPR, ETFA, WASHC5, RALA, MTOR, SPRED2, NIPBL, KIF21A, DIS3L2, PIGN, HGSNAT, ARHGAP31, IDH1, KYNU, KMT2A, ALMS1, TRPS1, WAC, EXT2, ASXL1, RPL35, RPS19, RUNX2, GLIS3, RPS23, CHSY1, KDM6A, MAPK1, SEC24D, BMPR1A, PDE4D, NIN, XRCC4, SMC1A, STAT5B, CDH2, DICER1, RPL13, LARP7, MACF1, ADGRG6, CTCF, EPG5, ACVR1, LPIN2, TMEM165, IDS, GNAS, HSPA9, MTX2, ACSL4, DNMT3A, RAF1, SETBP1, RPS17, CHST11, MDH1, PPP1R21, GLB1, RPL35A, PRKACB, RPL9, FIG4, HECW2, ARID2, IKBKB, USP9X, NEK9, FRYL, PURA, NF1, MTAP, ORC4, WDR11, DMXL2, EED, SUFU, CEP63, SIN3A, CAMKMT, ZFX, LUZP1, HEATR3, SPOP, HDAC4, SETD2, HELLS, STAG2, RPS7, IL6ST, ANKH, ADNP, P3H2, MAPRE2, BTRC, NRCAM, IGF1R, MECP2, ZBTB20, KIAA0586, NOTCH2, MED27, PTEN, EP300, GNAO1, TUBA1A, EFTUD2, RALGAPA1, LIFR, PIGU, SCYL2, RPL18, KLHL7, SPRED1, SMC3, NEXMIF, SUPT16H, CDKL5, BRD4, CHD7, RPS24, GRIP1, SOS1, EXT1, ASCC3, TTC8, CDH11, NSMCE2, AUTS2, UGP2, RERE, OFD1, PMM2, PIK3C2A, DYM, PPM1D, RPS20, PTPN11, CCND2, GNAI3, SDCCAG8, RNPC3, PREPL, CSPP1, JARID2, RPL31, NSRP1, SMAD4, TAF1, CEP290, KAT6B, AGPS, DYNC2H1, ARID1A, SHOC2, DSE, SCAPER, AKT3, ZNF292, MAF, ACBD6, RPL5, INTU, TRIP12, PRKAR1A, ANKRD11, PIK3CA, TUBB, CEP120, GNPTAB, RPL11, ARID1B, SETD5, VPS35L, SNX14, SON, RAB3GAP2, TCF12, UBE4B, CDC42, SPECC1L, NUP88, ATR, ARSB, KCTD1, EDA, ASH1L, MAP3K7, KRAS, SOS2, BBS2, SMAD2, CBL, NEK1, EXOC6B, GLUL, MAP2K1, RPL27, DPYD, CEP152, RAD21, FAM111A, CHD8, GPC6, FMN1, NBAS, SYNE1, CREBBP, TBXAS1, SNX10, RPS27, CLCN5, TRRAP, LOXL3, RYR3, MEF2C, PPM1B, FBXW4, CEP57, TRIM37, TAOK1, NSD2, CSF1R, TGFBR1, RPL8, STX16, RNF2, RPL10, HUWE1, RBPJ, SPEN, MAP3K20, PLAG1, HSD17B4, FAR1, TAPT1, FOCAD, CASK, RPS29, ATRX, TRIO, RAP1B, TCF20, SLC10A7, TAB2, IPO8, MED13L, NBN, PAK2, SUMF1, NSD1, B3GLCT, SCN2A, WNT5A, EFL1, CNOT1, HDAC8, TGFBR2, BRAF, POGZ, ZSWIM6, MED12L, RAB3GAP1, RPL26, HS2ST1, GATAD2B, WDPCP, STIM1, LEMD3, PPP1CB, LRRK1, PIK3R1, CDC73, RPS28, EZH2, POLA1, SCLT1
HP:0000737	Irritability	82	0.02241662110442865	1.666760751865749	1.1009421784618689e-06	4.073882082675268e-05	4.389991545680623	0.011325392189837245	ST3GAL5, GRIA4, MED23, SAMHD1, HLCS, TMEM106B, BMPR1A, SMC1A, NDUFS1, GNAS, FMR1, GABRB3, SUCLA2, PSAP, HACE1, FIG4, RNASEH2B, MT-ATP6, GAPVD1, TSEN15, QDPR, PRNP, MTHFS, DISP1, STAG2, CTNNB1, CACNA1A, ADNP, MECP2, NRCAM, PANK2, PTPRO, NUP133, ATP5F1A, MLH1, BRCA2, SLC1A2, ERAP1, ST3GAL3, CHD2, RPS20, DNMT1, UBAC2, MSH2, ADAR, IFNGR1, NHLRC2, PRKAR1A, PIK3CA, PPT1, VPS53, HIBCH, ARHGAP24, ANKFY1, ASH1L, KRAS, MAGI2, MAPT, DPYD, VPS13A, EHMT1, PMS1, SLC25A13, SPTBN1, HLA-DQB1, MAPK10, TRANK1, PSEN1, STX16, VPS50, ASAH1, NPAT, FOCAD, NUP107, HTT, RNF13, TGFBR2, POGZ, ATM, CD2AP, NUP205, NUP93
HP:0001945	Fever	101	0.02761071623838163	1.6627786890225382	9.435836010749066e-08	4.257300221165598e-06	5.370865722668022	0.0009706644504257565	MT-CYB, LYN, DIS3L2, SRP19, ASXL1, MIF, MT-ND1, RAB27A, TNFRSF1B, STAT5B, WIPF1, JAZF1, LPIN2, HLA-DPB1, IKZF1, TBL1XR1, HACE1, RANBP2, MT-ATP6, GAPVD1, STAT1, DST, PTPRC, TET2, PRNP, CLPB, KIAA0319L, CYBB, FOXP1, LYST, RPL17, HAVCR2, MTHFS, ANKH, CACNA1A, MECP2, MT-CO2, LIFR, EEFSEC, PTPRO, NUP133, KLHL7, MT-CO3, BCL2, CHD7, BRCA2, OTULIN, ITGAM, NGLY1, BLNK, ERAP1, PIK3CG, PMM2, CIITA, HLA-DRB1, MT-ND3, UBAC2, RB1, MT-ND2, TSC1, PXK, BRCA1, IFNGR1, PRKAR1A, JAK2, ARHGAP24, EDA, ANKFY1, KIF1B, MT-CO1, MAGI2, MALT1, MAP2K1, XIAP, TCF4, NPM1, SPTBN1, NABP1, LIPA, TRANK1, IRF8, MT-ND5, TBK1, FIP1L1, CASK, MT-ND4, DCLRE1C, NUP107, IRAK4, RUNX1, BRAF, EPB41, ATM, CD2AP, NUP205, NUP93, TRAF3, ABL1, PIK3R1, SPP1, NUMA1
HP:0001627	Abnormal heart morphology	82	0.02241662110442865	1.6607652095928507	1.6450998923006562e-06	5.7366585057955424e-05	4.2413410022114775	0.01692314259209685	BBS9, RPL15, DYRK1A, CPLANE1, WAC, RPL35, RPS19, KDM6A, BMPR1A, SMC1A, SETBP1, RPS17, RPL35A, RPL9, ARID2, PURA, NF1, SCLT1, HNRNPK, SIN3A, FOXP1, HEATR3, TPM3, DISP1, STAG2, RPS7, ADNP, EP300, PTEN, SCYL2, RPL18, NIPA2, RPS24, RAC1, TTC8, AUTS2, RERE, OFD1, AFF4, LMBRD1, KANSL1, RPS20, SDCCAG8, ITPR1, RPL31, CEP290, ARID1A, DSE, SCAPER, RPL5, RPL11, LRPPRC, SON, KMT2C, CDC42, MAP3K7, HYDIN, BBS2, RPL27, EHMT1, CREBBP, RPS27, ZEB2, NEK10, RPL8, SNRPN, MAP3K20, PLXND1, PLAGL1, PBX1, RPS29, MED13L, NSD1, CSNK2A1, EFL1, POGZ, ARID1B, RPL26, LEMD3, WDPCP, RPS28, FANCC
HP:0001249	Intellectual disability	570	0.1558228540185894	1.655145694361458	4.049827151876068e-40	1.0415142977837279e-36	35.9823347637326	4.1660571911349115e-36	GALNT2, C2CD3, KCNQ3, GRIA4, ARL6IP1, MEIS2, ADCY5, NFIA, MCPH1, MTOR, NIPBL, CRADD, MTR, SECISBP2, KIF21A, YWHAG, HGSNAT, ARHGAP31, IDH1, KYNU, TMEM106B, RPS19, MAPK1, CIT, GRIA1, CEP295, MYO9A, EIF4H, CHD6, MARK2, RPL13, USP7, CTCF, FRMPD4, ACVR1, PCCA, MAP1B, GABRB3, DNMT3A, CHST11, FRMD5, SIL1, TRAPPC9, PPP1R21, ARID2, GNAQ, HNRNPK, CEP63, USP8, SIN3A, HDAC4, HERC1, AGGF1, CTNNB1, CEP85L, BTRC, NRCAM, LAMP2, GNAO1, ACTG1, PIBF1, PANK2, DCC, WLS, OCRL, NEXMIF, PDE10A, CDKL5, SET, STAG1, CHD7, GRIP1, SOS1, NGLY1, RAC1, AUTS2, RERE, OFD1, AFF4, PPM1D, CHD2, EDEM3, MYO5A, PUM1, USP45, JARID2, TSC1, SMARCA2, ATP6V1B2, SMS, SPAST, ENTPD1, MAF, EIF2S3, PRKAR1A, TUBB, NSUN6, CEP120, SON, ANAPC1, TCF12, TUSC3, SMAD2, PHF21A, MAP2K1, DPYD, SCN3A, YY1, FMN1, STT3B, TCF4, CACNA1D, HNRNPA2B1, TET3, HNRNPU, SPTBN1, CLCN5, SYT14, TRRAP, OXR1, ZC3H14, NSD2, CSF1R, COG6, RBPJ, ASAH1, FAR1, WWOX, SLC1A3, AP1G1, ATRX, SLC35A3, FBXO11, SCAF4, PAFAH1B1, TMLHE, FRMD4A, CSNK2A1, POGZ, PRORP, HS2ST1, LEMD3, FANCM, CDC73, NUS1, PDCD6IP, FBXW11, GLB1, KIAA0586, ERCC8, PDZD8, CUX1, MANBA, ZMIZ1, NPC2, DYRK1A, THOC2, WDR26, HNRNPH1, OPHN1, WASHC5, LRP1, KDM5A, DIS3L2, PIGN, RSRC1, SYNJ1, WAC, PPP3CA, HPRT1, UBE3A, RUNX2, CHSY1, SEC24D, PHF6, DEPDC5, SACS, PDE4D, GRIK2, XRCC4, SMC1A, CDH2, SLC4A4, FRA10AC1, LPIN2, SETBP1, ANO10, PSMD12, PRKRA, PRKACB, GTF2I, FIG4, RAP1GDS1, USP9X, PURA, MTAP, TSEN15, COX10, EED, CNBP, ARNT2, STRADA, ARFGEF2, DOCK7, DISP1, SETD2, HELLS, STAG2, IL6ST, CELF2, CACNA1A, MED27, DIAPH1, OPA1, SCN8A, EFTUD2, LIFR, KLHL7, APTX, NIPA2, ATP6V1A, WDFY3, MYT1L, CERT1, EXT1, CDH11, CLCN3, MCCC1, ST3GAL3, CEP83, PMM2, GBE1, EIF4A2, SDCCAG8, SMAD4, TAF1, AGPS, ARL13B, SHOC2, NT5C2, DPP6, RASA2, INTU, ANKRD11, GNPTAB, VPS35L, PPT1, SPECC1L, CDC42, ARSB, MAP3K7, TIAM1, KRAS, SORL1, GRIA2, RAD21, ZNF148, SYNE1, CREBBP, TBXAS1, ZEB2, CEP57, FMN2, PACS1, SNRPN, MAP3K20, APP, NUP107, BRWD3, SLC10A7, SAMD12, TAB2, TBCD, KIDINS220, NBN, NSD1, SCN2A, GLUD1, GNB1, CNOT1, NTRK2, TGFBR2, HECTD4, ARID1B, CLTC, WDPCP, DDX3X, FKTN, PGK1, GABRA2, CYFIP2, CDC42BPB, RPS6KA3, SYT1, AP1B1, TRIP11, LMBR1, ATP6V0C, ATP6AP2, MED23, COG3, YEATS2, ALMS1, KMT2A, HNMT, NNT, RAD50, EXT2, LARGE1, CNNM2, BMPR1A, DAP3, STAT5B, PI4KA, TLK2, IDS, NALCN, RAF1, RFX7, TBL1XR1, SUCLA2, OGT, HECW2, NEK9, PARN, FUT8, ORC4, QDPR, DNAJC6, CLPB, ZMYM2, MGME1, ZFX, ANKH, ADNP, MAPRE2, MECP2, PAK2, CDK19, ZBTB20, NOTCH2, PTEN, TUBA1A, RORA, FOXP2, GRIN2B, TENM3, SUPT16H, COQ2, SMC3, BRD4, ATP2B1, BRCA2, HK1, SLC1A2, SCARB2, TTC8, ATP6V0A1, YME1L1, KMT5B, ROBO1, KANSL1, PTPN11, RB1, KAT6A, RIC1, ANK3, CEP290, UBR1, DYNC2H1, SPTAN1, MPDZ, ARID1A, EIF2AK2, SCAPER, ZNF292, GABRB2, TRIP12, SNX14, TNRC6B, RAB3GAP2, KMT2C, TRAPPC11, CACNA1B, ASH1L, CHD4, SOS2, CBL, ASPH, NEK1, ERCC6, EXOC6B, PHACTR1, CEP152, EHMT1, DIP2B, FAM111A, TRAK1, DGCR2, DDX6, NCDN, SNX10, CACNA2D1, COPB2, CDK8, GPHN, FBXW4, FBXW7, TAOK1, TGFBR1, SUZ12, RPL10, PDHX, PLAG1, AGO2, TAPT1, IPO8, SUMF1, TOGARAM1, WNT5A, EFL1, GRIA3, BRAF, AGO1, MED12L, ZSWIM6, RAB3GAP1, RFWD3, STIM1, PPP1CB, KCNQ5, HERC2, FLI1, CWC27, CTNND2, EZH2, FANCC, MCM3AP, BBS9, SCLT1, PGAP1, ACTB, CSGALNACT1, TNFRSF11A, RREB1, TTC21B, CPLANE1, GRM7, RALA, CACNB4, WDR37, SPRED2, TSPAN7, KDM3B, ATP8A2, UBAP2L, HADHA, KDM6A, PPP2R1A, HIVEP2, NIN, TTI1, WASHC4, RHOA, TNIK, YY1AP1, EPG5, BPTF, TMEM165, AQP4, GNAS, HSPA9, ACSL4, HACE1, NAA15, MBD5, RANBP2, FGF12, IKBKB, FRYL, CAMTA1, NF1, FANCL, ATAD1, WDR11, DMXL2, SUFU, RUBCN, LUZP1, FOXP1, SPOP, LYST, MYSM1, CPE, SNAP25, IGF1R, BAZ1B, EP300, JMJD1C, SLC12A6, VPS41, SPRED1, CHD1, ATP5F1A, ATP2A2, PHIP, GPI, NSMCE2, DYM, LMBRD1, CNTNAP2, ASXL2, GNAI3, FBXL3, ITPR1, RNPC3, TAF2, CSPP1, NPC1, CNKSR2, KAT6B, VPS13B, RNF213, BRCA1, DSE, AKT3, CDH23, PIK3CA, AHI1, NEMF, SETD5, SDHC, VPS53, UBE4B, ATR, DYNC1H1, BBS2, CDK13, SPG11, GPC6, CHD8, SMCHD1, NBAS, VRK1, MAPK10, TRIM37, FRRS1L, ATP5F1E, PSEN1, RBMX, HUWE1, SPEN, QRICH1, IQCB1, COG5, CASK, ALDH3A2, ELP2, ZNF592, TRIO, UCHL1, B3GLCT, HDAC8, ABL1, LRRK1, PIK3R1, TANC2, NEDD4L, POLA1, TRPS1
HP:0001288	Gait disturbance	196	0.05358119190814653	1.6520332762577634	1.025712382063157e-13	1.1990344629867837e-11	10.921168334107245	1.0551503274283698e-09	ERCC8, CYFIP2, PGAP1, RPS6KA3, DYRK1A, THOC2, ARL6IP1, TTBK2, CPLANE1, XPR1, ADCY5, WASHC5, ATP6AP2, MED23, GDAP1, SAMHD1, MTOR, KDM5A, ATP8A2, MTR, YWHAG, DMD, SYNJ1, HEXB, TMEM106B, PPP3CA, MT-ND1, LARGE1, TFG, DDHD1, NDUFAF6, BMPR1A, SACS, MYO9A, ATL1, EIF4H, XRCC4, SMC1A, USP7, PI4KA, ATXN1, FMR1, AP4E1, PSAP, HACE1, GLB1, UBAP1, PRKRA, GTF2I, FIG4, FGF12, RNASEH2B, USP9X, MT-ATP6, ABCD3, RANBP2, ATAD1, AOPEP, WDR11, ANOS1, PRNP, EED, SUFU, FUS, STRADA, SETX, LUZP1, LYST, GBF1, HERC1, TPM3, CELF2, CACNA1A, SLC20A2, SNAP25, MECP2, CDK19, LAMP2, BAZ1B, OPA1, ZBTB20, SCN8A, MT-CO2, PIBF1, PANK2, DCC, APTX, CDKL5, ATP6V1A, MT-CO3, HPCA, TBC1D23, MLH1, CHD7, BRCA2, HK1, SPTLC1, SLC1A2, MICU1, NUBPL, PHIP, PDK3, ERAP1, RERE, OFD1, DYM, GBE1, BIN1, RPS20, SLC30A9, UBAC2, ITPR1, MTMR14, TPK1, FGF14, CSPP1, SAMD9L, JARID2, MSH2, RIC1, ADAR, CNKSR2, TAF1, SPTAN1, EIF2AK2, ENTPD1, ARL13B, PRKN, EIF2S3, GABRB2, FBXO38, IFNGR1, PIK3CA, CEP120, GNPTAB, AHI1, UBE4B, TRAPPC11, SNCA, CACNA1B, DYNC1H1, KRAS, MT-CO1, ABCB7, MAPT, LRP12, ERCC6, SPG11, SCN3A, VPS37A, TRAK1, KPNA3, SMCHD1, DDX6, SLC9A7, SYNE1, CACNA2D1, PMS1, SYT14, TPP1, CDK8, GPHN, APOE, FTL, AP1S2, CSF1R, FRRS1L, PSEN1, MT-ND5, SPEN, RNF168, CTSC, DAB1, APP, ASAH1, NPAT, CASK, WWOX, LNPK, MT-ND4, HTT, GDAP2, TOGARAM1, ELOVL5, PPP2R2B, TGFBR2, NTRK2, CLTC, ATM, SBF2, FKTN, DNM1L, NUS1, SPART, GABRA2, KIAA0586
HP:0001251	Ataxia	264	0.07217058501913615	1.6424589713305282	6.4159987740080486e-18	1.4666973197382398e-15	14.833659501651162	6.60013793882208e-14	ERCC8, MCM3AP, CYFIP2, BBS9, PEX14, MT-CYB, SYT1, NPC2, DYRK1A, YWHAE, HNRNPH1, SEL1L, CPLANE1, OPHN1, CACNB4, PNPT1, KDM5A, ATP8A2, HLCS, YWHAG, ATXN2, ALMS1, SYNJ1, RAD50, HEXB, PPP3CA, UBE3A, MT-ND1, NDUFAF6, DAP3, HIVEP2, SACS, MYO9A, EIF4H, TRNT1, GRIK2, XRCC4, NEDD4L, ATG7, RNASET2, PI4KA, NDUFAF2, CTCF, KCNMA1, FRMPD4, FMR1, NDUFS1, NALCN, GABRB3, FRMD5, SUCLA2, SIL1, PSAP, HACE1, GLB1, GTF2I, MBD5, FGF12, MT-ATP6, PARN, ABHD12, PURA, CAMTA1, OGDH, ATAD1, COX10, WDR11, ATXN3, PRNP, SUFU, DMXL2, RUBCN, CLPB, ANOS1, NUP214, NDUFV2, FUS, SETX, LYST, ATG5, PIGK, SLC25A46, CELF2, NDUFS4, CACNA1A, SNAP25, MECP2, NRCAM, CDK19, KIAA0586, BAZ1B, OPA1, ZBTB20, SCN8A, PTEN, MT-CO2, PIBF1, PANK2, DNAJC5, RORA, ITM2B, SPIDR, DCC, TUBA1A, VPS41, APTX, NEXMIF, COQ2, NIPA2, ATP6V1A, MT-CO3, TBC1D23, ATP5F1A, UBE3C, CHD7, SGPL1, HK1, SPTLC1, SLC1A2, SCARB2, MICU1, NUBPL, TTC8, ATP6V0A1, NDUFAF5, GPI, YME1L1, ERAP1, OFD1, PMM2, GBE1, HLA-DRB1, DHX9, CHD2, MYO5A, CNTNAP2, DNMT1, MT-ND3, PUM1, UBAC2, SDCCAG8, ITPR1, TPK1, CSPP1, SAMD9L, NPC1, SMAD4, CTNNA2, MT-ND2, ADAR, CEP290, CNKSR2, TAF1, SPTAN1, SPAST, BRCA1, ARL13B, SCAPER, ACBD6, CDH23, GABRB2, IFNGR1, AUH, DHFR, PIK3CA, TUBB, CEP120, DLD, AHI1, NEMF, SETD5, LRPPRC, SNX14, MRE11, SDHC, PPT1, CDC42, INVS, HIBCH, TTC19, TRAPPC11, CACNA1B, KIF1B, MT-CO1, RIMS2, BBS2, SORL1, ABCB7, MT-ND4L, LRP12, ERCC6, MAP2K1, SPG11, SCN3A, TRAK1, SLC4A10, TCF4, SYNE1, CACNA2D1, AGTPBP1, VRK1, SPTBN1, SYT14, TPP1, HLA-DQB1, GPHN, OXR1, FTL, FBXW7, NSD2, CSF1R, RFC1, FBXL4, PSEN1, ATP5F1E, MT-ND5, RPL10, RNF216, SPEN, PDHX, RNF168, SNRPN, ATXN7, PIK3R5, IQCB1, DAB1, APP, HSD17B4, WWOX, MT-ND4, SLC1A3, HTT, NUP107, ZNF592, TCF20, UCHL1, PAFAH1B1, VPS13D, MED13L, TBCD, SUMF1, TOGARAM1, FRMD4A, CSNK2A1, ELOVL5, SCN2A, AFG3L2, PPP2R2B, NTRK2, BRAF, ZSWIM6, CLTC, ATM, CAPRIN1, WDPCP, PGK1, DNM1L, NUS1, PDCD6IP, ACADM, REPS1, GABRA2, GABRB1, SCLT1
HP:0031936	Delayed ability to walk	246	0.06724986331328595	1.6410878966829827	1.3371558899495688e-16	2.4132144982300374e-14	13.617404074171816	1.3755322639911215e-12	MCM3AP, GALNT2, PGAP1, MANBA, SYT1, ACTB, GRIA4, TRIP11, CSGALNACT1, TNFRSF11A, LMBR1, RREB1, WDR26, TTC21B, CPLANE1, ADCY5, OPHN1, DOCK3, RALA, PAK1, SLC25A12, SPRED2, NIPBL, KDM3B, ARHGAP31, HGSNAT, IDH1, KYNU, KMT2A, ALMS1, TRPS1, EXT2, TMEM106B, UBE3A, RUNX2, LARGE1, TFG, CHSY1, MAPK1, SEC24D, HIVEP2, MYO9A, PDE4D, NIN, GRIK2, TTI1, XRCC4, TMEM163, SMC1A, STAT5B, SRRM2, RPL13, WASHC4, ATG7, MACF1, PPP2CA, CTCF, FRMPD4, ACVR1, LPIN2, OTUD7A, TMEM165, IDS, KMT2E, GNAS, NBEA, HSPA9, RAF1, AP4E1, DNMT3A, CHST11, TRAPPC9, PPP1R21, GLB1, PRKACB, FIG4, HECW2, IKBKB, NEK9, NF1, MTAP, ORC4, HNRNPK, RUBCN, CEP63, TRAPPC10, FUS, ZFX, FOXP1, SPOP, ATG5, HDAC4, SETD2, STAG2, ANKH, CTNNB1, IL6ST, CELF2, CRBN, SNAP25, BTRC, MECP2, IGF1R, EP300, NOTCH2, SCN8A, RORA, EFTUD2, LIFR, SPRED1, SMC3, ATP6V1A, SET, MYT1L, HK1, DYNC1I2, SPTLC1, SOS1, EXT1, ASCC3, ATP6V0A1, NSMCE2, CLCN3, OFD1, DYM, PPM1D, CNTNAP2, PTPN11, PUM1, GNAI3, FBXL3, ITPR1, RNPC3, TRIM2, SMAD4, KAT6A, SMARCA2, CNKSR2, CEP290, KAT6B, AGPS, DYNC2H1, VPS13B, SHOC2, DSE, ARL13B, ACBD6, INTU, PRKAR1A, ANKRD11, CEP120, GNPTAB, AHI1, SETD5, VPS35L, HNRNPC, SON, RAB3GAP2, COPB1, TCF12, CDC42, SPECC1L, ATR, ARSB, DYNC1H1, MAP3K7, KRAS, SOS2, CBL, SMAD2, CDK13, ABCB7, NEK1, EXOC6B, MAP2K1, CEP152, WASF1, SPG11, RAD21, YY1, FAM111A, ZNF148, KPNA3, GPC6, FMN1, NBAS, SLC9A7, SYNE1, NCDN, TBXAS1, SNX10, CREBBP, CLCN5, TRRAP, RYR3, MEF2C, ZEB2, FBXW4, TRIM37, ZNF407, AP1S2, CSF1R, NSD2, TGFBR1, RBL2, CUL3, HUWE1, RPL10, RBPJ, SNRPN, MAP3K20, PLAG1, FAR1, TAPT1, CASK, FBXO11, TRIO, TCF20, SLC10A7, SCAF4, TAB2, TNPO3, SUMF1, NSD1, CSNK2A1, WNT5A, EFL1, HDAC8, TGFBR2, AGO1, BRAF, ZSWIM6, RAB3GAP1, ARID1B, HS2ST1, LEMD3, STIM1, HERC2, PPP1CB, LRRK1, PIK3R1, CDC73, CWC27, EZH2, KDM1A, KIAA0586
